51001021	Sin	وانتم الذين كنتم قبلا اجنبيين واعداء في الفكر في الاعمال الشريرة قد صالحكم الآن
55002022	Recommendation	اما الشهوات الشبابية فاهرب منها واتبع البر والايمان والمحبة والسلام مع الذين يدعون الرب من قلب نقي . 
51003001	Faith	فان كنتم قد قمتم مع المسيح فاطلبوا ما فوق حيث المسيح جالس عن يمين الله . 
66008007	Violence	فبوّق الملاك الاول فحدث برد ونار مخلوطان بدم وألقيا الى الارض فاحترق ثلث الاشجار واحترق كل عشب اخضر
66011017	Faith	قائلين نشكرك ايها الرب الاله القادر على كل شيء الكائن والذي كان والذي يأتي لانك اخذت قدرتك العظيمة وملكت . 
43004010	Grace	اجاب يسوع وقال لها لو كنت تعلمين عطية الله ومن هو الذي يقول لك اعطيني لاشرب لطلبت انت منه فاعطاك ماء حيّا . 
51003004	Grace	متى اظهر المسيح حياتنا فحينئذ تظهرون انتم ايضا معه في المجد
43020031	Faith	واما هذه فقد كتبت لتؤمنوا ان يسوع هو المسيح ابن الله ولكي تكون لكم اذا آمنتم حياة باسمه
62004006	Faith	نحن من الله فمن يعرف الله يسمع لنا ومن ليس من الله لا يسمع لنا . من هذا نعرف روح الحق وروح الضلال . 
65001012	Description	هؤلاء صخور في ولائمكم المحبية صانعين ولائم معا بلا خوف راعين انفسهم . غيوم بلا ماء تحملها الرياح اشجار خريفية بلا ثمر ميتة مضاعفا مقتلعة . 
44005015	Description	‎حتى انهم كانوا يحملون المرضى خارجا في الشوارع ويضعونهم على فرش واسرّة حتى اذا جاء بطرس يخيّم ولو ظله على احد منهم‎ . 
49006016	Faith	حاملين فوق الكل ترس الايمان الذي به تقدرون ان تطفئوا جميع سهام الشرير الملتهبة . 
51003023	Recommendation	وكل ما فعلتم فاعملوا من القلب كما للرب ليس للناس
58012016	Recommendation	لئلا يكون احد زانيا او مستبيحا كعيسو الذي لاجل اكلة واحدة باع بكوريته . 
43018040	Sin	فصرخوا ايضا جميعهم قائلين ليس هذا بل باراباس . وكان باراباس لصا
55003004	Sin	خائنين مقتحمين متصلفين محبين للذات دون محبة لله
50002009	Grace	لذلك رفعه الله ايضا واعطاه اسما فوق كل اسم
61001016	Description	لاننا لم نتبع خرافات مصنعة اذ عرّفناكم بقوة ربنا يسوع المسيح ومجيئه بل قد كنا معاينين عظمته . 
61003016	Sin	كما في الرسائل كلها ايضا متكلما فيها عن هذه الامور . التي فيها اشياء عسرة الفهم يحرّفها غير العلماء وغير الثابتين كباقي الكتب ايضا لهلاك انفسهم
44014014	Description	‎فلما سمع الرسولان برنابا وبولس مزقا ثيابهما واندفعا الى الجمع صارخين
45015008	Faith	واقول ان يسوع المسيح قد صار خادم الختان من اجل صدق الله حتى يثبت مواعيد الآباء . 
59001026	Sin	ان كان احد فيكم يظن انه ديّن وهو ليس يلجم لسانه بل يخدع قلبه فديانة هذا باطلة . 
43015020	Recommendation	اذكروا الكلام الذي قلته لكم ليس عبد اعظم من سيده . ان كانوا قد اضطهدوني فسيضطهدونكم . وان كانوا قد حفظوا كلامي فسيحفظون كلامكم . 
43008031	Faith	فقال يسوع لليهود الذين آمنوا به انكم ان ثبتم في كلامي فبالحقيقة تكونون تلاميذي
44007011	Description	ثم أتى جوع على كل ارض مصر وكنعان وضيق عظيم فكان آباؤنا لا يجدون قوتا‎ . 
63001004	Faith	فرحت جدا لاني وجدت من اولادك بعضا سالكين في الحق كما اخذنا وصية من الآب . 
54005008	Faith	وان كان احد لا يعتني بخاصته ولا سيما اهل بيته فقد انكر الايمان وهو شر من غير المؤمن . 
58010022	Faith	لنتقدم بقلب صادق في يقين الايمان مرشوشة قلوبنا من ضمير شرير ومغتسلة اجسادنا بماء نقي
48001023	Description	غير انهم كانوا يسمعون ان الذي كان يضطهدنا قبلا يبشر الآن بالايمان الذي كان قبلا يتلفه . 
44027034	Recommendation	‎لذلك التمس منكم ان تتناولوا طعاما لان هذا يكون مفيدا لنجاتكم لانه لا تسقط شعرة من راس واحد منكم‎ . 
66002003	Faith	وقد احتملت ولك صبر وتعبت من اجل اسمي ولم تكلّ . 
56002002	Recommendation	ان يكون الاشياخ صاحين ذوي وقار متعقلين اصحاء في الايمان والمحبة والصبر . 
44017030	Recommendation	‎فالله الآن يامر جميع الناس في كل مكان ان يتوبوا متغاضيا عن ازمنة الجهل‎ . 
43019025	Description	وكانت واقفات عند صليب يسوع امه واخت امه مريم زوجة كلوبا ومريم المجدلية . 
66019013	Description	وهو متسربل بثوب مغموس بدم ويدعى اسمه كلمة الله . 
46008009	Recommendation	ولكن انظروا لئلا يصير سلطانكم هذا معثرة للضعفاء . 
44013034	Grace	‎انه اقامه من الاموات غير عتيد ان يعود ايضا الى فساد فهكذا قال اني ساعطيكم مراحم داود الصادقة‎ . 
43014020	Faith	في ذلك اليوم تعلمون اني انا في ابي وانتم فيّ وانا فيكم . 
62002003	Faith	وبهذا نعرف اننا قد عرفناه ان حفظنا وصاياه . 
43008024	Sin	فقلت لكم انكم تموتون في خطاياكم . لانكم ان لم تؤمنوا اني انا هو تموتون في خطاياكم . 
66017006	Sin	ورأيت المرأة سكرى من دم القديسين ومن دم شهداء يسوع . فتعجبت لما رأيتها تعجبا عظيما
58012017	Description	فانكم تعلمون انه ايضا بعد ذلك لما اراد ان يرث البركة رفض اذ لم يجد للتوبة مكانا مع انه طلبها بدموع
43007012	Description	وكان في الجمع مناجاة كثيرة من نحوه . بعضهم يقولون انه صالح . وآخرون يقولون لا بل يضل الشعب . 
44011021	Faith	‎وكانت يد الرب معهم فآمن عدد كثير ورجعوا الى الرب
52002004	Faith	بل كما استحسنّا من الله ان نؤتمن على الانجيل هكذا نتكلم لا كاننا نرضي الناس بل الله الذي يختبر قلوبنا . 
46015057	Grace	ولكن شكرا للّه الذي يعطينا الغلبة بربنا يسوع المسيح . 
54005005	Faith	ولكن التي هي بالحقيقة ارملة ووحيدة فقد ألقت رجاءها على الله وهي تواظب الطلبات والصلوات ليلا ونهارا . 
43016024	Grace	الى الآن لم تطلبوا شيئا باسمي . اطلبوا تأخذوا ليكون فرحكم كاملا
46007021	Recommendation	دعيت وانت عبد فلا يهمك . بل وان استطعت ان تصير حرا فاستعملها بالحري . 
65001019	Sin	هؤلاء هم المعتزلون بانفسهم نفسانيون لا روح لهم
48001006	Sin	اني اتعجب انكم تنتقلون هكذا سريعا عن الذي دعاكم بنعمة المسيح الى انجيل آخر
58012014	Recommendation	اتبعوا السلام مع الجميع والقداسة التي بدونها لن يرى احد الرب
43021006	Description	فقال لهم القوا الشبكة الى جانب السفينة الايمن فتجدوا . فالقوا ولم يعودوا يقدرون ان يجذبوها من كثرة السمك . 
46007019	Recommendation	ليس الختان شيئا وليست الغرلة شيئا بل حفظ وصايا الله . 
45012008	Recommendation	ام الواعظ ففي الوعظ . المعطي فبسخاء . المدبر فباجتهاد . الراحم فبسرور . 
44019002	Faith	قال لهم هل قبلتم الروح القدس لما آمنتم . قالوا له ولا سمعنا انه يوجد الروح القدس‎ . 
53003014	Recommendation	وان كان احد لا يطيع كلامنا بالرسالة فسموا هذا ولا تخالطوه لكي يخجل . 
46015050	Sin	فاقول هذا ايها الاخوة ان لحما ودما لا يقدران ان يرثا ملكوت الله . ولا يرث الفساد عدم الفساد
43006027	Recommendation	اعملوا لا للطعام البائد بل للطعام الباقي للحياة الابدية الذي يعطيكم ابن الانسان لان هذا الله الآب قد ختمه . 
59004003	Sin	تطلبون ولستم تأخذون لانكم تطلبون رديّا لكي تنفقوا في لذّاتكم
49005020	Faith	شاكرين كل حين على كل شيء في اسم ربنا يسوع المسيح للّه والآب . 
48003006	Faith	كما آمن ابراهيم بالله فحسب له برا . 
66021023	Grace	والمدينة لا تحتاج الى الشمس ولا الى القمر ليضيئا فيها لان مجد الله قد انارها والخروف سراجها . 
45008009	Faith	واما انتم فلستم في الجسد بل في الروح ان كان روح الله ساكنا فيكم . ولكن ان كان احد ليس له روح المسيح فذلك ليس له . 
45011023	Faith	وهم ان لم يثبتوا في عدم الايمان سيطعمون . لان الله قادر ان يطعمهم ايضا . 
66014005	Description	وفي افواههم لم يوجد غش لانهم بلا عيب قدام عرش الله
44024014	Faith	‎ولكنني اقرّ لك بهذا انني حسب الطريق الذي يقولون له شيعة هكذا اعبد اله آبائي مؤمنا بكل ما هو مكتوب في الناموس والانبياء‎ . 
45013008	Recommendation	لا تكونوا مديونين لاحد بشيء الا بان يحب بعضكم بعضا . لان من احب غيره فقد اكمل الناموس . 
66016009	Sin	فاحترق الناس احتراقا عظيما وجدفوا على اسم الله الذي له سلطان على هذه الضربات ولم يتوبوا ليعطوه مجدا
66021012	Description	وكان لها سور عظيم وعال وكان لها اثنا عشر بابا وعلى الابواب اثنا عشر ملاكا واسماء مكتوبة هي اسماء اسباط بني اسرائيل الاثني عشر . 
48003013	Grace	المسيح افتدانا من لعنة الناموس اذ صار لعنة لاجلنا لانه مكتوب ملعون كل من علّق على خشبة . 
48001013	Sin	فانكم سمعتم بسيرتي قبلا في الديانة اليهودية اني كنت اضطهد كنيسة الله بافراط واتلفها . 
66020002	Description	فقبض على التنين الحية القديمة الذي هو ابليس والشيطان وقيّده الف سنة
44008009	Description	وكان قبلا في المدينة رجل اسمه سيمون يستعمل السحر ويدهش شعب السامرة قائلا انه شيء عظيم‎ . 
50003010	Faith	لاعرفه وقوة قيامته وشركة آلامه متشبها بموته . 
54005022	Recommendation	لا تضع يدا على احد بالعجلة ولا تشترك في خطايا الآخرين . احفظ نفسك طاهرا
56002003	Recommendation	كذلك العجائز في سيرة تليق بالقداسة غير ثالبات غير مستعبدات للخمر الكثير معلمات الصلاح
46007038	Recommendation	اذا من زوج فحسنا يفعل ومن لا يزوج يفعل احسن . 
59001022	Recommendation	ولكن كونوا عاملين بالكلمة لا سامعين فقط خادعين نفوسكم . 
43007001	Violence	وكان يسوع يتردد بعد هذا في الجليل . لانه لم يرد ان يتردد في اليهودية لان اليهود كانوا يطلبون ان يقتلوه
46001030	Grace	ومنه انتم بالمسيح يسوع الذي صار لنا حكمة من الله وبرا وقداسة وفداء . 
43013005	Description	ثم صبّ ماء في مغسل وابتدأ يغسل ارجل التلاميذ ويمسحها بالمنشفة التي كان متزرا بها . 
44022004	Violence	‎واضطهدت هذا الطريق حتى الموت مقيدا ومسلما الى السجون رجالا ونساء‎ . 
43007043	Description	فحدث انشقاق في الجمع لسببه . 
60005002	Recommendation	ارعوا رعية الله التي بينكم نظّارا لا عن اضطرار بل بالاختيار ولا لربح قبيح بل بنشاط . 
46015056	Sin	اما شوكة الموت فهي الخطية . وقوة الخطية هي الناموس . 
59005004	Sin	هوذا اجرة الفعلة الذين حصدوا حقولكم المبخوسة منكم تصرخ وصياح الحصادين قد دخل الى أذني رب الجنود . 
60002001	Recommendation	فاطرحوا كل خبث وكل مكر والرياء والحسد وكل مذمة
46007039	Recommendation	المرأة مرتبطة بالناموس ما دام رجلها حيّا . ولكن ان مات رجلها فهي حرّة لكي تتزوج بمن تريد في الرب فقط . 
55002018	Sin	اللذان زاغا عن الحق قائلين ان القيامة قد صارت فيقلبان ايمان قوم . 
48005006	Faith	لانه في المسيح يسوع لا الختان ينفع شيئا ولا الغرلة بل الايمان العامل بالمحبة . 
58005009	Grace	واذ كمّل صار لجميع الذين يطيعونه سبب خلاص ابدي
46016001	Recommendation	واما من جهة الجمع لاجل القديسين فكما اوصيت كنائس غلاطية هكذا افعلوا انتم ايضا . 
49005022	Recommendation	ايها النساء اخضعن لرجالكنّ كما للرب . 
43008012	Faith	ثم كلمهم يسوع ايضا قائلا انا هو نور العالم . من يتبعني فلا يمشي في الظلمة بل يكون له نور الحياة . 
65001017	Recommendation	واما انتم ايها الاحباء فاذكروا الاقوال التي قالها سابقا رسل ربنا يسوع المسيح . 
44017025	Grace	‎ولا يخدم بايادي الناس كانه محتاج الى شيء . اذ هو يعطي الجميع حياة ونفسا وكل شيء‎ . 
62005009	Faith	ان كنا نقبل شهادة الناس فشهادة الله اعظم لان هذه هي شهادة الله التي قد شهد بها عن ابنه . 
45013014	Faith	بل البسوا الرب يسوع المسيح ولا تصنعوا تدبيرا للجسد لاجل الشهوات
58011030	Description	بالايمان سقطت اسوار اريحا بعد ما طيف حولها سبعة ايام . 
44019011	Grace	‎وكان الله يصنع على يدي بولس قوات غير المعتادة‎ . 
43008034	Sin	اجابهم يسوع الحق الحق اقول لكم ان كل من يعمل الخطية هو عبد للخطية . 
62004011	Faith	ايها الاحباء ان كان الله قد احبنا هكذا ينبغي لنا ايضا ان يحب بعضنا بعضا . 
44002028	Grace	‎عرفتني سبل الحياة وستملأني سرورا مع وجهك‎ . 
54004013	Recommendation	الى ان اجيء اعكف على القراءة والوعظ والتعليم
47004008	Description	مكتئبين في كل شيء لكن غير متضايقين . متحيّرين لكن غير يائسين . 
44002013	Description	‎وكان آخرون يستهزئون قائلين انهم قد امتلأوا سلافة
66021018	Description	وكان بناء سورها من يشب والمدينة ذهب نقي شبه زجاج نقي . 
66015006	Description	وخرجت السبعة الملائكة ومعهم السبع الضربات من الهيكل وهم متسربلون بكتان نقي وبهي ومتمنطقون عند صدورهم بمناطق من ذهب
45012014	Recommendation	باركوا على الذين يضطهدونكم . باركوا ولا تلعنوا . 
66001015	Description	ورجلاه شبه النحاس النقي كانهما محميّتان في أتون وصوته كصوت مياه كثيرة
43017026	Grace	وعرفتهم اسمك وسأعرفهم ليكون فيهم الحب الذي احببتني به واكون انا فيهم
45008032	Grace	الذي لم يشفق على ابنه بل بذله لاجلنا اجمعين كيف لا يهبنا ايضا معه كل شيء . 
65001018	Sin	فانهم قالوا لكم انه في الزمان الاخير سيكون قوم مستهزئون سالكين بحسب شهوات فجورهم . 
45011018	Recommendation	فلا تفتخر على الاغصان . وان افتخرت فانت لست تحمل الاصل بل الاصل اياك يحمل . 
47001024	Faith	ليس اننا نسود على ايمانكم بل نحن موازرون لسروركم . لانكم بالايمان تثبتون
43011001	Description	وكان انسان مريضا وهو لعارز من بيت عنيا من قرية مريم ومرثا اختها . 
52004008	Sin	اذا من يرذل لا يرذل انسانا بل الله الذي اعطانا ايضا روحه القدوس
62004002	Faith	بهذا تعرفون روح الله . كل روح يعترف بيسوع المسيح انه قد جاء في الجسد فهو من الله . 
65001008	Sin	ولكن كذلك هؤلاء ايضا المحتلمون ينجسون الجسد ويتهاونون بالسيادة ويفترون على ذوي الامجاد . 
60003011	Recommendation	ليعرض عن الشر ويصنع الخير ليطلب السلام ويجدّ في اثره
51001023	Faith	ان ثبتم على الايمان متأسسين وراسخين وغير منتقلين عن رجاء الانجيل الذي سمعتموه المكروز به في كل الخليقة التي تحت السماء الذي صرت انا بولس خادما له
43008059	Violence	فرفعوا حجارة ليرجموه . اما يسوع فاختفى وخرج من الهيكل مجتازا في وسطهم ومضى هكذا
49004024	Recommendation	وتلبسوا الانسان الجديد المخلوق بحسب الله في البر وقداسة الحق
66014012	Faith	هنا صبر القديسين هنا الذين يحفظون وصايا الله وايمان يسوع
44013030	Description	‎ولكن الله اقامه من الاموات‎ . 
43010011	Description	انا هو الراعي الصالح . والراعي الصالح يبذل نفسه عن الخراف . 
49003002	Grace	ان كنتم قد سمعتم بتدبير نعمة الله المعطاة لي لاجلكم . 
56003010	Recommendation	الرجل المبتدع بعد الانذار مرة ومرتين اعرض عنه
43010019	Description	فحدث ايضا انشقاق بين اليهود بسبب هذا الكلام . 
43003033	Faith	ومن قبل شهادته فقد ختم ان الله صادق . 
61003014	Recommendation	لذلك ايها الاحباء اذ انتم منتظرون هذه اجتهدوا لتوجدوا عنده بلا دنس ولا عيب في سلام . 
53003001	Faith	اخيرا ايها الاخوة صّلوا لاجلنا لكي تجري كلمة الرب وتتمجد كما عندكم ايضا . 
47004014	Faith	عالمين ان الذي اقام الرب يسوع سيقيمنا نحن ايضا بيسوع ويحضرنا معكم . 
59005014	Recommendation	أمريض احد بينكم فليدع شيوخ الكنيسة فيصلّوا عليه ويدهنوه بزيت باسم الرب
44007023	Description	ولما كملت له مدة اربعين سنة خطر على باله ان يفتقد اخوته بني اسرائيل‎ . 
44023027	Violence	‎هذا الرجل لما امسكه اليهود وكانوا مزمعين ان يقتلوه اقبلت مع العسكر وانقذته اذ أخبرت انه روماني‎ . 
44019029	Description	‎فامتلأت المدينة كلها اضطرابا واندفعوا بنفس واحدة الى المشهد خاطفين معهم غايوس وارسترخس المكدونيين رفيقي بولس في السفر
44003014	Sin	‎ولكن انتم انكرتم القدوس البار وطلبتم ان يوهب لكم رجل قاتل‎ . 
44015009	Faith	ولم يميّز بيننا وبينهم بشيء اذ طهر بالايمان قلوبهم‎ . 
46011028	Recommendation	ولكن ليمتحن الانسان نفسه وهكذا يأكل من الخبز ويشرب من الكاس . 
46015058	Faith	اذا يا اخوتي الاحباء كونوا راسخين غير متزعزعين مكثرين في عمل الرب كل حين عالمين ان تعبكم ليس باطلا في الرب
46004016	Recommendation	فاطلب اليكم ان تكونوا متمثلين بي . 
46001021	Faith	لانه اذ كان العالم في حكمة الله لم يعرف الله بالحكمة استحسن الله ان يخلّص المؤمنين بجهالة الكرازة . 
60003001	Recommendation	كذلكنّ ايتها النساء كنّ خاضعات لرجالكنّ حتى وان كان البعض لا يطيعون الكلمة يربحون بسيرة النساء بدون كلمة
47005020	Recommendation	اذا نسعى كسفراء عن المسيح كأن الله يعظ بنا . نطلب عن المسيح تصالحوا مع الله . 
44002024	Description	‎الذي اقامه الله ناقضا اوجاع الموت اذ لم يكن ممكنا ان يمسك منه . 
59002007	Sin	أما هم يجدّفون على الاسم الحسن الذي دعي به عليكم . 
54003003	Description	غير مدمن الخمر ولا ضرّاب ولا طامع بالربح القبيح بل حليما غير مخاصم ولا محب للمال
43004014	Grace	ولكن من يشرب من الماء الذي اعطيه انا فلن يعطش الى الابد . بل الماء الذي اعطيه يصير فيه ينبوع ماء ينبع الى حياة ابدية . 
62002005	Faith	واما من حفظ كلمته فحقا في هذا قد تكملت محبة الله . بهذا نعرف اننا فيه . 
66016013	Description	ورأيت من فم التنين ومن فم الوحش ومن فم النبي الكذاب ثلاثة ارواح نجسة شبه ضفادع . 
59002008	Recommendation	فان كنتم تكملون الناموس الملوكي حسب الكتاب . تحب قريبك كنفسك . فحسنا تفعلون . 
47004005	Faith	فاننا لسنا نكرز بانفسنا بل بالمسيح يسوع ربا ولكن بانفسنا عبيدا لكم من اجل يسوع . 
46015033	Recommendation	لا تضلوا . فان المعاشرات الرديّة تفسد الاخلاق الجيدة . 
58013020	Grace	واله السلام الذي اقام من الاموات راعي الخراف العظيم ربنا يسوع بدم العهد الابدي
50001027	Recommendation	فقط عيشوا كما يحق لانجيل المسيح حتى اذا جئت ورأيتكم او كنت غائبا اسمع اموركم انكم تثبتون في روح واحد مجاهدين معا بنفس واحدة لايمان الانجيل
46006014	Grace	والله قد اقام الرب وسيقيمنا نحن ايضا بقوته . 
55001006	Recommendation	فلهذا السبب اذكّرك ان تضرم ايضا موهبة الله التي فيك بوضع يديّ . 
60004006	Grace	فانه لاجل هذا بشر الموتى ايضا لكي يدانوا حسب الناس بالجسد ولكن ليحيوا حسب الله بالروح
46007023	Recommendation	قد اشتريتم بثمن فلا تصيروا عبيدا للناس . 
46010010	Recommendation	ولا تتذمروا كما تذمر ايضا اناس منهم فاهلكهم المهلك . 
47002017	Faith	لاننا لسنا كالكثيرين غاشين كلمة الله لكن كما من اخلاص بل كما من الله نتكلم امام الله في المسيح
45015001	Recommendation	فيجب علينا نحن الاقوياء ان نحتمل اضعاف الضعفاء ولا نرضي انفسنا . 
50002024	Faith	وأثق بالرب اني انا ايضا سآتي اليكم سريعا . 
66007001	Description	وبعد هذا رأيت اربعة ملائكة واقفين على اربع زوايا الارض ممسكين اربع رياح الارض لكي لا تهب ريح على الارض ولا على البحر ولا على شجرة ما
