43011027	Faith	قالت له نعم يا سيد . انا قد آمنت انك انت المسيح ابن الله الآتي الى العالم
44002042	Faith	وكانوا يواظبون على تعليم الرسل والشركة وكسر الخبز والصلوات‎ . 
58001009	Grace	احببت البر وابغضت الاثم من اجل ذلك مسحك الله الهك بزيت الابتهاج اكثر من شركائك . 
44012002	Violence	‎فقتل يعقوب اخا يوحنا بالسيف‎ . 
55002016	Recommendation	واما الاقوال الباطلة الدنسة فاجتنبها لانهم يتقدمون الى اكثر فجور . 
62003015	Sin	كل من يبغض اخاه فهو قاتل نفس . وانتم تعلمون ان كل قاتل نفس ليس له حياة ابدية ثابتة فيه . 
43021015	Faith	فبعدما تغدوا قال يسوع لسمعان بطرس يا سمعان بن يونا أتحبني اكثر من هؤلاء . قال له نعم يا رب انت تعلم اني احبك . قال له ارع خرافي . 
46012008	Grace	فانه لواحد يعطى بالروح كلام حكمة . ولآخر كلام علم بحسب الروح الواحد . 
44007013	Description	‎وفي المرة الثانية استعرف يوسف الى اخوته واستعلنت عشيرة يوسف لفرعون‎ . 
60003010	Recommendation	لان من اراد ان يحب الحياة ويرى اياما صالحة فليكفف لسانه عن الشر وشفتيه ان تتكلما بالمكر
44004032	Description	وكان لجمهور الذين آمنوا قلب واحد ونفس واحدة . ولم يكن احد يقول ان شيئا من امواله له بل كان عندهم كل شيء مشتركا‎ . 
46015003	Grace	فانني سلمت اليكم في الاول ما قبلته انا ايضا ان المسيح مات من اجل خطايانا حسب الكتب . 
66018024	Violence	وفيها وجد دم انبياء وقديسين وجميع من قتل على الارض
44013048	Faith	‎فلما سمع الامم ذلك كانوا يفرحون ويمجدون كلمة الرب . وآمن جميع الذين كانوا معيّنين للحياة الابدية‎ . 
66022020	Description	يقول الشاهد بهذا نعم . انا آتي سريعا . آمين . تعال ايها الرب يسوع
50004009	Recommendation	وما تعلمتموه وتسلمتموه وسمعتموه ورأيتموه فيّ فهذا افعلوا واله السلام يكون معكم
53003015	Recommendation	ولكن لا تحسبوه كعدو بل انذروه كأخ . 
51002008	Recommendation	انظروا ان لا يكون احد يسبيكم بالفلسفة وبغرور باطل حسب تقليد الناس حسب اركان العالم وليس حسب المسيح . 
50003014	Faith	اسعى نحو الغرض لاجل جعالة دعوة الله العليا في المسيح يسوع . 
56002014	Faith	الذي بذل نفسه لاجلنا لكي يفدينا من كل اثم ويطهر لنفسه شعبا خاصّا غيورا في اعمال حسنة . 
43005024	Faith	الحق الحق اقول لكم ان من يسمع كلامي ويؤمن بالذي ارسلني فله حياة ابدية ولا يأتي الى دينونة بل قد انتقل من الموت الى الحياة . 
66021015	Description	والذي كان يتكلم معي كان معه قصبة من ذهب لكي يقيس المدينة وابوابها وسورها . 
50003019	Sin	الذين نهايتهم الهلاك الذين الههم بطنهم ومجدهم في خزيهم الذين يفتكرون في الارضيات . 
54003006	Sin	غير حديث الايمان لئلا يتصلف فيسقط في دينونة ابليس . 
65001003	Recommendation	ايها الاحباء اذ كنت اصنع كل الجهد لاكتب اليكم عن الخلاص المشترك اضطررت ان اكتب اليكم واعظا ان تجتهدوا لاجل الايمان المسلّم مرة للقديسين . 
44004002	Description	متضجرين من تعليمهما الشعب وندائهما في يسوع بالقيامة من الاموات . 
66018005	Sin	لان خطاياها لحقت السماء وتذكر الله آثامها . 
43004046	Description	فجاء يسوع ايضا الى قانا الجليل حيث صنع الماء خمرا . وكان خادم للملك ابنه مريض في كفرناحوم . 
45012011	Recommendation	غير متكاسلين في الاجتهاد . حارّين في الروح . عابدين الرب . 
60001008	Faith	ذلك وان لم تروه تحبونه . ذلك وان كنتم لا ترونه الآن لكن تؤمنون به فتبتهجون بفرح لا ينطق به ومجيد
62004013	Grace	بهذا نعرف اننا نثبت فيه وهو فينا انه قد اعطانا من روحه . 
43019029	Description	وكان إناء موضوعا مملوّا خلا . فملأوا اسفنجة من الخل ووضعوها على زوفا وقدموها الى فمه . 
51001013	Grace	الذي انقذنا من سلطان الظلمة ونقلنا الى ملكوت ابن محبته
45016017	Recommendation	واطلب اليكم ايها الاخوة ان تلاحظوا الذين يصنعون الشقاقات والعثرات خلافا للتعليم الذي تعلمتموه واعرضوا عنهم . 
45012007	Recommendation	ام خدمة ففي الخدمة . ام المعلّم ففي التعليم . 
43016023	Faith	وفي ذلك اليوم لا تسألونني شيئا . الحق الحق اقول لكم ان كل ما طلبتم من الآب باسمي يعطيكم . 
66021019	Description	واساسات سور المدينة مزينة بكل حجر كريم . الاساس الاول يشب . الثاني ياقوت ازرق . الثالث عقيق ابيض . الرابع زمرد ذبابي . 
59004017	Sin	فمن يعرف ان يعمل حسنا ولا يعمل فذلك خطية له
66019005	Faith	وخرج من العرش صوت قائلا سبحوا لالهنا يا جميع عبيده الخائفيه الصغار والكبار . 
47005002	Faith	فاننا في هذه ايضا نئن مشتاقين الى ان نلبس فوقها مسكننا الذي من السماء . 
48006004	Recommendation	ولكن ليمتحن كل واحد عمله وحينئذ يكون له الفخر من جهة نفسه فقط لا من جهة غيره . 
46007036	Recommendation	ولكن ان كان احد يظن انه يعمل بدون لياقة نحو عذرائه اذا تجاوزت الوقت وهكذا لزم ان يصير فليفعل ما يريد . انه لا يخطئ . فليتزوجا . 
43016002	Violence	سيخرجونكم من المجامع بل تأتي ساعة فيها يظن كل من يقتلكم انه يقدم خدمة لله . 
66015001	Description	ثم رأيت آية اخرى في السماء عظيمة وعجيبة . سبعة ملائكة معهم السبع الضربات الاخيرة لان بها اكمل غضب الله . 
43018023	Description	اجابه يسوع ان كنت قد تكلمت رديّا فاشهد على الردي وان حسنا فلماذا تضربني . 
50004003	Recommendation	نعم اسألك انت ايضا يا شريكي المخلص ساعد هاتين اللتين جاهدتا معي في الانجيل مع اكليمندس ايضا وباقي العاملين معي الذين اسماؤهم في سفر الحياة
66016006	Sin	لانهم سفكوا دم قديسين وانبياء فأعطيتهم دما ليشربوا . لانهم مستحقون . 
45006002	Sin	حاشا . نحن الذين متنا عن الخطية كيف نعيش بعد فيها . 
66017011	Violence	والوحش الذي كان وليس الآن فهو ثامن وهو من السبعة ويمضي الى الهلاك . 
48004030	Recommendation	لكن ماذا يقول الكتاب . اطرد الجارية وابنها لانه لا يرث ابن الجارية مع ابن الحرة . 
54006009	Sin	واما الذين يريدون ان يكونوا اغنياء فيسقطون في تجربة وفخ وشهوات كثيرة غبية ومضرة تغرق الناس في العطب والهلاك . 
66017016	Violence	واما العشرة القرون التي رأيت على الوحش فهؤلاء سيبغضون الزانية وسيجعلونها خربة وعريانة ويأكلون لحمها ويحرقونها بالنار . 
46008003	Faith	ولكن ان كان احد يحب الله فهذا معروف عنده . 
45003009	Sin	فماذا اذا . أنحن افضل . كلا البتة . لاننا قد شكونا ان اليهود واليونانيين اجمعين تحت الخطية
44007041	Sin	‎فعملوا عجلا في تلك الايام واصعدوا ذبيحة للصنم وفرحوا باعمال ايديهم‎ . 
66009020	Sin	واما بقية الناس الذين لم يقتلوا بهذه الضربات فلم يتوبوا عن اعمال ايديهم حتى لا يسجدوا للشياطين واصنام الذهب والفضة والنحاس والحجر والخشب التي لا تستطيع ان تبصر ولا تسمع ولا تمشي
47005011	Faith	فاذ نحن عالمون مخافة الرب نقنع الناس . واما الله فقد صرنا ظاهرين له وارجو اننا قد صرنا ظاهرين في ضمائركم ايضا . 
49002003	Sin	الذين نحن ايضا جميعا تصرفنا قبلا بينهم في شهوات جسدنا عاملين مشيئات الجسد والافكار وكنا بالطبيعة ابناء الغضب كالباقين ايضا
44002040	Recommendation	‎وباقوال أخر كثيرة كان يشهد لهم ويعظهم قائلا اخلصوا من هذا الجيل الملتوي‎ . 
45008013	Faith	لانه ان عشتم حسب الجسد فستموتون . ولكن ان كنتم بالروح تميتون اعمال الجسد فستحيون . 
45010011	Faith	لان الكتاب يقول كل من يؤمن به لا يخزى . 
45001008	Faith	اولا اشكر الهي بيسوع المسيح من جهة جميعكم ان ايمانكم ينادى به في كل العالم . 
52001004	Faith	عالمين ايها الاخوة المحبوبون من الله اختياركم . 
60004008	Recommendation	ولكن قبل كل شيء لتكن محبتكم بعضكم لبعض شديدة لان المحبة تستر كثرة من الخطايا . 
44027001	Description	فلما استقر الرأي ان نسافر في البحر الى ايطاليا سلموا بولس واسرى آخرين الى قائد مئة من كتيبة اوغسطس اسمه يوليوس‎ . 
66015003	Faith	وهم يرتلون ترنيمة موسى عبد الله وترنيمة الخروف قائلين عظيمة وعجيبة هي اعمالك ايها الرب الاله القادر على كل شيء عادلة وحق هي طرقك يا ملك القديسين . 
60002002	Faith	وكاطفال مولودين الآن اشتهوا اللبن العقلي العديم الغش لكي تنموا به
66014013	Faith	وسمعت صوتا من السماء قائلا لي اكتب طوبى للاموات الذين يموتون في الرب منذ الآن . نعم يقول الروح لكي يستريحوا من اتعابهم . واعمالهم تتبعهم
59001027	Faith	الديانة الطاهرة النقية عند الله الآب هي هذه افتقاد اليتامى والارامل في ضيقتهم وحفظ الانسان نفسه بلا دنس من العالم
51002004	Recommendation	وانما اقول هذا لئلا يخدعكم احد بكلام ملق . 
66005013	Description	وكل خليقة مما في السماء وعلى الارض وتحت الارض وما على البحر كل ما فيها سمعتها قائلة . للجالس على العرش وللخروف البركة والكرامة والمجد والسلطان الى ابد الآبدين . 
66008008	Description	ثم بوق الملاك الثاني فكأن جبلا عظيما متقدا بالنار ألقي الى البحر فصار ثلث البحر دما . 
44007058	Violence	‎واخرجوه خارج المدينة ورجموه . والشهود خلعوا ثيابهم عند رجلي شاب يقال له شاول‎ . 
45015011	Faith	وايضا سبحوا الرب يا جميع الامم وامدحوه يا جميع الشعوب . 
45011036	Faith	لان منه وبه وله كل الاشياء . له المجد الى الابد . آمين
43001029	Faith	وفي الغد نظر يوحنا يسوع مقبلا اليه فقال هوذا حمل الله الذي يرفع خطية العالم . 
58011031	Description	بالايمان راحاب الزانية لم تهلك مع العصاة اذ قبلت الجاسوسين بسلام
43010010	Grace	السارق لا يأتي الا ليسرق ويذبح ويهلك . واما انا فقد أتيت لتكون لهم حياة وليكون لهم افضل . 
50003020	Faith	فان سيرتنا نحن هي في السموات التي منها ايضا ننتظر مخلّصا هو الرب يسوع المسيح
45015007	Recommendation	لذلك اقبلوا بعضكم بعضا كما ان المسيح ايضا قبلنا لمجد الله . 
44021024	Recommendation	‎خذ هؤلاء وتطهر معهم وانفق عليهم ليحلقوا رؤوسهم فيعلم الجميع ان ليس شيء مما أخبروا عنك بل تسلك انت ايضا حافظا للناموس‎ . 
45004012	Faith	وابا للختان للذين ليسوا من الختان فقط بل ايضا يسلكون في خطوات ايمان ابينا ابراهيم الذي كان وهو في الغرلة . 
44001026	Description	‎ثم ألقوا قرعتهم فوقعت القرعة على متياس فحسب مع الاحد عشر رسولا
45004007	Grace	طوبى للذين غفرت آثامهم وسترت خطاياهم . 
66011004	Description	هذان هما الزيتونتان والمنارتان القائمتان امام رب الارض . 
59004009	Recommendation	اكتئبوا ونوحوا وابكوا . ليتحول ضحككم الى نوح وفرحكم الى غم . 
64001011	Recommendation	ايها الحبيب لا تتمثل بالشر بل بالخير لان من يصنع الخير هو من الله ومن يصنع الشر فلم يبصر الله
45004011	Faith	واخذ علامة الختان ختما لبر الايمان الذي كان في الغرلة ليكون ابا لجميع الذين يؤمنون وهم في الغرلة كي يحسب لهم ايضا البر . 
45006007	Grace	لان الذي مات قد تبرأ من الخطية . 
47004010	Faith	حاملين في الجسد كل حين اماتة الرب يسوع لكي تظهر حياة يسوع ايضا في جسدنا . 
50002021	Sin	اذ الجميع يطلبون ما هو لانفسهم لا ما هو ليسوع المسيح . 
58011011	Faith	بالايمان سارة نفسها ايضا اخذت قدرة على انشاء نسل وبعد وقت السن ولدت اذ حسبت الذي وعد صادقا . 
43006039	Grace	وهذه مشيئة الآب الذي ارسلني ان كل ما اعطاني لا أتلف منه شيئا بل اقيمه في اليوم الاخير . 
46008006	Faith	لكن لنا اله واحد الآب الذي منه جميع الاشياء ونحن له . ورب واحد يسوع المسيح الذي به جميع الاشياء ونحن به . 
52003006	Description	واما الآن فاذ جاء الينا تيموثاوس من عندكم وبشرنا بايمانكم ومحبتكم وبان عندكم ذكرا لنا حسنا كل حين وانتم مشتاقون ان ترونا كما نحن ايضا ان نراكم
60005004	Grace	ومتى ظهر رئيس الرعاة تنالون اكليل المجد الذي لا يبلى
47003012	Faith	فاذ لنا رجاء مثل هذا نستعمل مجاهرة كثيرة . 
61002012	Sin	اما هؤلاء فكحيوانات غير ناطقة طبيعية مولودة للصيد والهلاك يفترون على ما يجهلون فسيهلكون في فسادهم
43012006	Sin	قال هذا ليس لانه كان يبالي بالفقراء بل لانه كان سارقا وكان الصندوق عنده وكان يحمل ما يلقى فيه . 
62004016	Faith	ونحن قد عرفنا وصدقنا المحبة التي للّه فينا . الله محبة ومن يثبت في المحبة يثبت في الله والله فيه . 
44011019	Description	اما الذين تشتتوا من جراء الضيق الذي حصل بسبب استفانوس فاجتازوا الى فينيقية وقبرس وانطاكية وهم لا يكلمون احدا بالكلمة الا اليهود فقط‎ . 
54006006	Faith	واما التقوى مع القناعة فهي تجارة عظيمة . 
66013007	Violence	وأعطي ان يصنع حربا مع القديسين ويغلبهم وأعطي سلطانا على كل قبيلة ولسان وامّة . 
60002020	Faith	لانه اي مجد هو ان كنتم تلطمون مخطئين فتصبرون . بل ان كنتم تتألمون عاملين الخير فتصبرون فهذا فضل عند الله
58009015	Grace	ولاجل هذا هو وسيط عهد جديد لكي يكون المدعوون اذ صار موت لفداء التعديات التي في العهد الاول ينالون وعد الميراث الابدي . 
45006001	Sin	فماذا نقول . أنبقى في الخطية لكي تكثر النعمة . 
49005004	Recommendation	ولا القباحة ولا كلام السفاهة والهزل التي لا تليق بل بالحري الشكر . 
66006008	Violence	فنظرت واذا فرس اخضر والجالس عليه اسمه الموت والهاوية تتبعه واعطيا سلطانا على ربع الارض ان يقتلا بالسيف والجوع والموت وبوحوش الارض
45004016	Faith	لهذا هو من الايمان كي يكون على سبيل النعمة ليكون الوعد وطيدا لجميع النسل ليس لمن هو من الناموس فقط بل ايضا لمن هو من ايمان ابراهيم الذي هو اب لجميعنا . 
44028018	Description	الذين لما فحصوا كانوا يريدون ان يطلقوني لانه لم تكن فيّ علّة واحدة للموت‎ . 
45009016	Grace	فاذا ليس لمن يشاء ولا لمن يسعى بل للّه الذي يرحم . 
46010008	Sin	ولا نزن كما زنى اناس منهم فسقط في يوم واحد ثلاثة وعشرون الفا . 
45007023	Sin	ولكني ارى ناموسا آخر في اعضائي يحارب ناموس ذهني ويسبيني الى ناموس الخطية الكائن في اعضائي . 
58006001	Faith	لذلك ونحن تاركون كلام بداءة المسيح لنتقدم الى الكمال غير واضعين ايضا اساس التوبة من الاعمال الميتة والايمان بالله
46016011	Recommendation	فلا يحتقره احد بل شيعوه بسلام ليأتي اليّ لاني انتظره مع الاخوة . 
59002014	Faith	ما المنفعة يا اخوتي ان قال احد ان له ايمانا ولكن ليس له اعمال . هل يقدر الايمان ان يخلّصه . 
43007025	Description	فقال قوم من اهل اورشليم أليس هذا هو الذي يطلبون ان يقتلوه . 
43020022	Faith	ولما قال هذا نفخ وقال لهم اقبلوا الروح القدس . 
45010003	Sin	لانهم اذ كانوا يجهلون بر الله ويطلبون ان يثبتوا بر انفسهم لم يخضعوا لبر الله . 
62005010	Faith	من يؤمن بابن الله فعنده الشهادة في نفسه . من لا يصدق الله فقد جعله كاذبا لانه لم يؤمن بالشهادة التي قد شهد بها الله عن ابنه . 
43014012	Faith	الحق الحق اقول لكم من يؤمن بي فالاعمال التي انا اعملها يعملها هو ايضا ويعمل اعظم منها لاني ماض الى ابي . 
56002009	Recommendation	والعبيد ان يخضعوا لسادتهم ويرضوهم في كل شيء غير مناقضين
58012015	Recommendation	ملاحظين لئلا يخيب احد من نعمة الله . لئلا يطلع اصل مرارة ويصنع انزعاجا فيتنجس به كثيرون . 
54003007	Recommendation	ويجب ايضا ان تكون له شهادة حسنة من الذين هم من خارج لئلا يسقط في تعيير وفخ ابليس
49004007	Grace	ولكن لكل واحد منا اعطيت النعمة حسب قياس هبة المسيح . 
66016003	Description	ثم سكب الملاك الثاني جامه على البحر فصار دما كدم ميت . وكل نفس حية ماتت في البحر . 
49006006	Recommendation	لا بخدمة العين كمن يرضي الناس بل كعبيد المسيح عاملين مشيئة الله من القلب
60003016	Recommendation	ولكم ضمير صالح لكي يكون الذين يشتمون سيرتكم الصالحة في المسيح يخزون في ما يفترون عليكم كفاعلي شر . 
43006040	Faith	لان هذه هي مشيئة الذي ارسلني ان كل من يرى الابن ويؤمن به تكون له حياة ابدية وانا اقيمه في اليوم الاخير
44012023	Violence	‎ففي الحال ضربه ملاك الرب لانه لم يعط المجد لله . فصار يأكله الدود ومات
47001003	Grace	مبارك الله ابو ربنا يسوع المسيح ابو الرأفة واله كل تعزية
54001006	Sin	الامور التي اذ زاغ قوم عنها انحرفوا الى كلام باطل
45001016	Faith	لاني لست استحي بانجيل المسيح لانه قوة الله للخلاص لكل من يؤمن لليهودي اولا ثم لليوناني . 
46003011	Description	فانه لا يستطيع احد ان يضع اساسا آخر غير الذي وضع الذي هو يسوع المسيح . 
49005033	Recommendation	واما انتم الافراد فليحب كل واحد امرأته هكذا كنفسه واما المرأة فلتهب رجلها
51002013	Grace	واذ كنتم امواتا في الخطايا وغلف جسدكم احياكم معه مسامحا لكم بجميع الخطايا . 
54004014	Recommendation	لا تهمل الموهبة التي فيك المعطاة لك بالنبوة مع وضع ايدي المشيخة . 
66021001	Description	ثم رأيت سماء جديدة وارضا جديدة لان السماء الاولى والارض الاولى مضتا والبحر لا يوجد فيما بعد . 
52005016	Recommendation	افرحوا كل حين . 
66009006	Description	وفي تلك الايام سيطلب الناس الموت ولا يجدونه ويرغبون ان يموتوا فيهرب الموت منهم . 
52004014	Faith	لانه ان كنا نؤمن ان يسوع مات وقام فكذلك الراقدون بيسوع سيحضرهم الله ايضا معه . 
62004015	Faith	من اعترف ان يسوع هو ابن الله فالله يثبت فيه وهو في الله . 
49004022	Recommendation	ان تخلعوا من جهة التصرف السابق الانسان العتيق الفاسد بحسب شهوات الغرور
43010009	Grace	انا هو الباب . ان دخل بي احد فيخلص ويدخل ويخرج ويجد مرعى . 
58011037	Violence	رجموا نشروا جربوا ماتوا قتلا بالسيف طافوا في جلود غنم وجلود معزى معتازين مكروبين مذلين . 
62002029	Faith	ان علمتم انه بار هو فاعلموا ان كل من يصنع البر مولود منه
44013047	Grace	‎لان هكذا اوصانا الرب . قد اقمتك نورا للامم لتكون انت خلاصا الى اقصى الارض‎ . 
47004002	Faith	بل قد رفضنا خفايا الخزي غير سالكين في مكر ولا غاشين كلمة الله بل باظهار الحق مادحين انفسنا لدى ضمير كل انسان قدام الله . 
44002033	Description	‎واذ ارتفع بيمين الله واخذ موعد الروح القدس من الآب سكب هذا الذي انتم الآن تبصرونه وتسمعونه‎ . 
51003010	Recommendation	ولبستم الجديد الذي يتجدد للمعرفة حسب صورة خالقه
43011004	Faith	فلما سمع يسوع قال هذا المرض ليس للموت بل لاجل مجد الله ليتمجد ابن الله به . 
45001017	Faith	لان فيه معلن بر الله بايمان لايمان كما هو مكتوب اما البار فبالايمان يحيا
43019017	Description	فخرج وهو حامل صليبه الى الموضع الذي يقال له موضع الجمجمة ويقال له بالعبرانية جلجثة
45012006	Faith	ولكن لنا مواهب مختلفة بحسب النعمة المعطاة لنا . أنبوّة فبالنسبة الى الايمان . 
66004007	Description	والحيوان الاول شبه اسد والحيوان الثاني شبه عجل والحيوان الثالث له وجه مثل وجه انسان والحيوان الرابع شبه نسر طائر . 
49005015	Recommendation	فانظروا كيف تسلكون بالتدقيق لا كجهلاء بل كحكماء
45010012	Grace	لانه لا فرق بين اليهودي واليوناني لان ربا واحدا للجميع غنيا لجميع الذين يدعون به . 
