45010004	Faith	لان غاية الناموس هي المسيح للبر لكل من يؤمن . 
50004006	Recommendation	لا تهتموا بشيء بل في كل شيء بالصلاة والدعاء مع الشكر لتعلم طلباتكم لدى الله . 
46010006	Faith	وهذه الامور حدثت مثالا لنا حتى لا نكون نحن مشتهين شرورا كما اشتهى اولئك . 
66009002	Description	ففتح بئر الهاوية فصعد دخان من البئر كدخان أتون عظيم فاظلمت الشمس والجو من دخان البئر . 
52004006	Recommendation	ان لا يتطاول احد ويطمع على اخيه في هذا الامر لان الرب منتقم لهذه كلها كما قلنا لكم قبلا وشهدنا . 
47005017	Faith	اذا ان كان احد في المسيح فهو خليقة جديدة . الاشياء العتيقة قد مضت . هوذا الكل قد صار جديدا . 
43005020	Faith	لان الآب يحب الابن ويريه جميع ما هو يعمله . وسيريه اعمالا اعظم من هذه لتتعجبوا انتم . 
49004028	Recommendation	لا يسرق السارق في ما بعد بل بالحري يتعب عاملا الصالح بيديه ليكون له ان يعطي من له احتياج . 
57001022	Recommendation	ومع هذا اعدد لي ايضا منزلا لاني ارجو انني بصلواتكم سأوهب لكم
58013009	Recommendation	لا تساقوا بتعاليم متنوعة وغريبة لانه حسن ان يثبّت القلب بالنعمة لا باطعمة لم ينتفع بها الذين تعاطوها . 
52005012	Recommendation	ثم نسألكم ايها الاخوة ان تعرفوا الذين يتعبون بينكم ويدبرونكم في الرب وينذرونكم
43009022	Description	قال ابواه هذا لانهما كانا يخافان من اليهود . لان اليهود كانوا قد تعاهدوا انه ان اعترف احد بانه المسيح يخرج من المجمع . 
50003003	Faith	لاننا نحن الختان الذين نعبد الله بالروح ونفتخر في المسيح يسوع ولا نتكل على الجسد . 
62003023	Faith	وهذه هي وصيته ان نؤمن باسم ابنه يسوع المسيح ونحب بعضنا بعضا كما اعطانا وصية . 
66013011	Description	ثم رأيت وحشا آخر طالعا من الارض وكان له قرنان شبه خروف وكان يتكلم كتنين . 
46014020	Recommendation	ايها الاخوة لا تكونوا اولادا في اذهانكم بل كونوا اولادا في الشر . واما في الاذهان فكونوا كاملين . 
59005013	Recommendation	أعلى احد بينكم مشقات فليصلّ . أمسرور احد فليرتل . 
58012012	Recommendation	لذلك قوّموا الايادي المسترخية والركب المخلّعة
60001017	Recommendation	وان كنتم تدعون ابا الذي يحكم بغير محاباة حسب عمل كل واحد فسيروا زمان غربتكم بخوف
58010036	Recommendation	لانكم تحتاجون الى الصبر حتى اذا صنعتم مشيئة الله تنالون الموعد . 
58011001	Faith	واما الايمان فهو الثقة بما يرجى والايقان بامور لا ترى . 
49004017	Recommendation	فاقول هذا واشهد في الرب ان لا تسلكوا في ما بعد كما يسلك سائر الامم ايضا ببطل ذهنهم
51002016	Recommendation	فلا يحكم عليكم احد في اكل او شرب او من جهة عيد او هلال او سبت
66007015	Faith	من اجل ذلك هم امام عرش الله ويخدمونه نهارا وليلا في هيكله والجالس على العرش يحل فوقهم . 
44020010	Description	‎فنزل بولس ووقع عليه واعتنقه قائلا لا تضطربوا لان نفسه فيه‎ . 
55002010	Faith	لاجل ذلك انا اصبر على كل شيء لاجل المختارين لكي يحصلوا هم ايضا على الخلاص الذي في المسيح يسوع مع مجد ابدي . 
60005014	Recommendation	سلموا بعضكم على بعض بقبلة المحبة . سلام لكم جميعكم الذين في المسيح يسوع . آمين
49005021	Recommendation	خاضعين بعضكم لبعض في خوف الله
61003017	Recommendation	فانتم ايها الاحباء اذ قد سبقتم فعرفتم احترسوا من ان تنقادوا بضلال الاردياء فتسقطوا من ثباتكم . 
51003018	Recommendation	ايتها النساء اخضعن لرجالكنّ كما يليق في الرب . 
54005020	Recommendation	الذين يخطئون وبّخهم امام الجميع لكي يكون عند الباقين خوف . 
45014013	Recommendation	فلا نحاكم ايضا بعضنا بعضا بل بالحري احكموا بهذا ان لا يوضع للاخ مصدمة او معثرة . 
45002010	Grace	ومجد وكرامة وسلام لكل من يفعل الصلاح اليهودي اولا ثم اليوناني . 
58011034	Violence	اطفأوا قوة النار نجوا من حد السيف تقووا من ضعف صاروا اشداء في الحرب هزموا جيوش غرباء . 
48006017	Faith	في ما بعد لا يجلب احد عليّ اتعابا لاني حامل في جسدي سمات الرب يسوع
66018021	Violence	ورفع ملاك واحد قوي حجرا كرحى عظيمة ورماه في البحر قائلا هكذا بدفع سترمى بابل المدينة العظيمة ولن توجد فيما بعد . 
65001020	Faith	واما انتم ايها الاحباء فابنوا انفسكم على ايمانكم الاقدس مصلّين في الروح القدس
45012002	Recommendation	ولا تشاكلوا هذا الدهر . بل تغيّروا عن شكلكم بتجديد اذهانكم لتختبروا ما هي ارادة الله الصالحة المرضية الكاملة . 
46015009	Sin	لاني اصغر الرسل انا الذي لست اهلا لان أدعى رسولا لاني اضطهدت كنيسة الله . 
62002015	Recommendation	لا تحبوا العالم ولا الاشياء التي في العالم . ان احب احد العالم فليست فيه محبة الآب . 
45002001	Sin	لذلك انت بلا عذر ايها الانسان كل من يدين . لانك في ما تدين غيرك تحكم على نفسك . لانك انت الذي تدين تفعل تلك الامور بعينها . 
48002009	Description	فاذ علم بالنعمة المعطاة لي يعقوب وصفا ويوحنا المعتبرون انهم اعمدة اعطوني وبرنابا يمين الشركة لنكون نحن للامم واما هم فللختان . 
43019023	Description	ثم ان العسكر لما كانوا قد صلبوا يسوع اخذوا ثيابه وجعلوها اربعة اقسام لكل عسكري قسما . واخذوا القميص ايضا . وكان القميص بغير خياطة منسوجا كله من فوق . 
45002021	Sin	فانت اذا الذي تعلّم غيرك ألست تعلّم نفسك . الذي تكرز ان لا يسرق أتسرق . 
46006019	Faith	ام لستم تعلمون ان جسدكم هو هيكل للروح القدس الذي فيكم الذي لكم من الله وانكم لستم لانفسكم . 
47005014	Grace	لان محبة المسيح تحصرنا . اذ نحن نحسب هذا انه ان كان واحد قد مات لاجل الجميع فالجميع اذا ماتوا . 
58003001	Faith	من ثم ايها الاخوة القديسون شركاء الدعوة السماوية لاحظوا رسول اعترافنا ورئيس كهنته المسيح يسوع
44020035	Recommendation	‎في كل شيء اريتكم انه هكذا ينبغي انكم تتعبون وتعضدون الضعفاء متذكرين كلمات الرب يسوع انه قال مغبوط هو العطاء اكثر من الاخذ‎ . 
58013004	Recommendation	ليكن الزواج مكرما عند كل واحد والمضجع غير نجس . واما العاهرون والزناة فسيدينهم الله . 
43020005	Description	وانحنى فنظر الاكفان موضوعة ولكنه لم يدخل . 
66016018	Description	فحدثت اصوات ورعود وبروق . وحدثت زلزلة عظيمة لم يحدث مثلها منذ صار الناس على الارض زلزلة بمقدارها عظيمة هكذا . 
66019010	Faith	فخررت امام رجليه لاسجد له . فقال لي انظر لا تفعل . انا عبد معك ومع اخوتك الذين عندهم شهادة يسوع . اسجد للّه . فان شهادة يسوع هي روح النبوة
46002010	Grace	فاعلنه الله لنا نحن بروحه . لان الروح يفحص كل شيء حتى اعماق الله . 
50002029	Recommendation	فاقبلوه في الرب بكل فرح وليكن مثله مكرّما عندكم . 
51003020	Recommendation	ايها الاولاد اطيعوا والديكم في كل شيء لان هذا مرضي في الرب
47001012	Faith	لان فخرنا هو هذا شهادة ضميرنا اننا في بساطة وإخلاص الله لا في حكمة جسدية بل في نعمة الله تصرفنا في العالم ولا سيما من نحوكم . 
43014021	Faith	الذي عنده وصاياي ويحفظها فهو الذي يحبني . والذي يحبني يحبه ابي وانا احبه واظهر له ذاتي
51002023	Sin	التي لها حكاية حكمة بعبادة نافلة وتواضع وقهر الجسد ليس بقيمة ما من جهة اشباع البشرية
64001006	Recommendation	الذين شهدوا بمحبتك امام الكنيسة . الذين تفعل حسنا اذا شيعتهم كما يحق للّه
55002023	Recommendation	والمباحثات الغبية والسخيفة اجتنبها عالما انها تولّد خصومات . 
47003018	Faith	ونحن جميعا ناظرين مجد الرب بوجه مكشوف كما في مرآة نتغيّر الى تلك الصورة عينها من مجد الى مجد كما من الرب الروح
58009014	Grace	فكم بالحري يكون دم المسيح الذي بروح ازلي قدم نفسه للّه بلا عيب يطهر ضمائركم من اعمال ميتة لتخدموا الله الحي
44011017	Grace	‎فان كان الله قد اعطاهم الموهبة كما لنا ايضا بالسوية مؤمنين بالرب يسوع المسيح فمن انا . أقادر ان امنع الله‎ . 
49004030	Faith	ولا تحزنوا روح الله القدوس الذي به ختمتم ليوم الفداء . 
66003003	Recommendation	فاذكر كيف اخذت وسمعت واحفظ وتب فاني ان لم تسهر اقدم عليك كلص ولا تعلم اية ساعة اقدم عليك . 
62003007	Recommendation	ايها الاولاد لا يضلّكم احد . من يفعل البر فهو بار كما ان ذاك بار
62004001	Recommendation	ايها الاحباء لا تصدقوا كل روح بل امتحنوا الارواح هل هي من الله لان انبياء كذبة كثيرين قد خرجوا الى العالم . 
44013038	Grace	‎فليكن معلوما عندكم ايها الرجال الاخوة انه بهذا ينادى لكم بغفران الخطايا‎ . 
50003001	Recommendation	اخيرا يا اخوتي افرحوا في الرب . كتابة هذه الامور اليكم ليست عليّ ثقيلة واما لكم فهي مؤمّنة . 
46011034	Recommendation	ان كان احد يجوع فليأكل في البيت كي لا تجتمعوا للدينونة . واما الامور الباقية فعند ما اجيء ارتبها
43018031	Description	فقال لهم بيلاطس خذوه انتم واحكموا عليه حسب ناموسكم . فقال له اليهود لا يجوز لنا ان نقتل احدا . 
46012031	Faith	ولكن جدوا للمواهب الحسنى . وايضا اريكم طريقا افضل
58007026	Description	لانه كان يليق بنا رئيس كهنة مثل هذا قدوس بلا شر ولا دنس قد انفصل عن الخطاة وصار اعلى من السموات
50004013	Faith	استطيع كل شيء في المسيح الذي يقويني . 
52004003	Recommendation	لان هذه هي ارادة الله قداستكم . ان تمتنعوا عن الزنى
51004002	Recommendation	واظبوا على الصلاة ساهرين فيها بالشكر
44007029	Description	‎فهرب موسى بسبب هذه الكلمة وصار غريبا في ارض مديان حيث ولد ابنين
46011007	Description	فان الرجل لا ينبغي ان يغطي راسه لكونه صورة الله ومجده . واما المرأة فهي مجد الرجل . 
51003015	Faith	وليملك في قلوبكم سلام الله الذي اليه دعيتم في جسد واحد . وكونوا شاكرين
58002010	Grace	لانه لاق بذاك الذي من اجله الكل وبه الكل وهو آت بابناء كثيرين الى المجد ان يكمل رئيس خلاصهم بالآلام . 
59004001	Sin	من اين الحروب والخصومات بينكم أليست من هنا من لذّاتكم المحاربة في اعضائكم . 
46005001	Sin	يسمع مطلقا ان بينكم زنى وزنى هكذا لا يسمى بين الامم حتى ان تكون للانسان امرأة ابيه . 
46010013	Faith	لم تصبكم تجربة الا بشرية . ولكن الله امين الذي لا يدعكم تجربون فوق ما تستطيعون بل سيجعل مع التجربة ايضا المنفذ لتستطيعوا ان تحتملوا . 
44020029	Violence	‎لاني اعلم هذا انه بعد ذهابي سيدخل بينكم ذئاب خاطفة لا تشفق على الرعية‎ . 
53001004	Faith	حتى اننا نحن انفسنا نفتخر بكم في كل كنائس الله من اجل صبركم وايمانكم في جميع اضطهاداتكم والضيقات التي تحتملونها
62004012	Faith	الله لم ينظره احد قط . ان احب بعضنا بعضا فالله يثبت فينا ومحبته قد تكملت فينا . 
48001001	Description	بولس رسول لا من الناس ولا بانسان بل بيسوع المسيح والله الآب الذي اقامه من الاموات
58012003	Recommendation	فتفكروا في الذي احتمل من الخطاة مقاومة لنفسه مثل هذه لئلا تكلوا وتخوروا في نفوسكم
45006005	Faith	لانه ان كنا قد صرنا متحدين معه بشبه موته نصير ايضا بقيامته
45015010	Recommendation	ويقول ايضا تهللوا ايها الامم مع شعبه . 
54004001	Sin	ولكن الروح يقول صريحا انه في الازمنة الاخيرة يرتد قوم عن الايمان تابعين ارواحا مضلة وتعاليم شياطين
56003001	Recommendation	ذكّرهم ان يخضعوا للرياسات والسلاطين ويطيعوا ويكونوا مستعدين لكل عمل صالح . 
61003005	Sin	لان هذا يخفى عليهم بارادتهم ان السموات كانت منذ القديم والارض بكلمة الله قائمة من الماء وبالماء
60003018	Grace	فان المسيح ايضا تألم مرة واحدة من اجل الخطايا البار من اجل الاثمة لكي يقربنا الى الله مماتا في الجسد ولكن محيى في الروح
61002021	Sin	لانه كان خيرا لهم لو لم يعرفوا طريق البر من انهم بعدما عرفوا يرتدّون عن الوصية المقدسة المسلمة لهم . 
53003006	Recommendation	ثم نوصيكم ايها الاخوة باسم ربنا يسوع المسيح ان تتجنبوا كل اخ يسلك بلا ترتيب وليس حسب التعليم الذي اخذه منا . 
45005012	Sin	من اجل ذلك كأنما بانسان واحد دخلت الخطية الى العالم وبالخطية الموت وهكذا اجتاز الموت الى جميع الناس اذ اخطأ الجميع . 
58011033	Faith	الذين بالايمان قهروا ممالك صنعوا برا نالوا مواعيد سدوا افواه اسود
47004009	Faith	مضطهدين لكن غير متروكين . مطروحين لكن غير هالكين . 
59004004	Sin	ايها الزناة والزواني أما تعلمون ان محبة العالم عداوة للّه . فمن اراد ان يكون محبا للعالم فقد صار عدوا للّه . 
44016006	Description	‎وبعدما اجتازوا في فريجية وكورة غلاطية منعهم الروح القدس ان يتكلموا بالكلمة في اسيا‎ . 
45010006	Faith	واما البر الذي بالايمان فيقول هكذا لا تقل في قلبك من يصعد الى السماء اي ليحدر المسيح . 
66016002	Violence	فمضى الاول وسكب جامه على الارض فحدثت دمامل خبيثة ورديّة على الناس الذين بهم سمة الوحش والذين يسجدون لصورته
66005008	Description	ولما اخذ السفر خرّت الاربعة الحيوانات والاربعة والعشرون شيخا امام الخروف ولهم كل واحد قيثارات وجامات من ذهب مملوءة بخورا هي صلوات القديسين . 
62005001	Faith	كل من يؤمن ان يسوع هو المسيح فقد ولد من الله . وكل من يحب الوالد يحب المولود منه ايضا . 
48005026	Recommendation	لا نكن معجبين نغاضب بعضنا بعضا ونحسد بعضنا بعضا
54005001	Recommendation	لا تزجر شيخا بل عظه كأب والاحداث كاخوة
60002012	Recommendation	وان تكون سيرتكم بين الامم حسنة لكي يكونوا في ما يفترون عليكم كفاعلي شر يمجدون الله في يوم الافتقاد من اجل اعمالكم الحسنة التي يلاحظونها . 
50003006	Sin	من جهة الغيرة مضطهد الكنيسة . من جهة البر الذي في الناموس بلا لوم . 
43004052	Description	فاستخبرهم عن الساعة التي فيها اخذ يتعافى فقالوا له امس في الساعة السابعة تركته الحمى . 
43019031	Violence	ثم اذ كان استعداد فلكي لا تبقى الاجساد على الصليب في السبت لان يوم ذلك السبت كان عظيما سأل اليهود بيلاطس ان تكسر سيقانهم ويرفعوا . 
43019012	Description	من هذا الوقت كان بيلاطس يطلب ان يطلقه ولكن اليهود كانوا يصرخون قائلين ان اطلقت هذا فلست محبا لقيصر . كل من يجعل نفسه ملكا يقاوم قيصر
43014001	Faith	لا تضطرب قلوبكم . انتم تؤمنون بالله فآمنوا بي . 
50001028	Faith	غير مخوّفين بشيء من المقاومين الامر الذي هو لهم بيّنة للهلاك واما لكم فللخلاص وذلك من الله . 
43015016	Grace	ليس انتم اخترتموني بل انا اخترتكم واقمتكم لتذهبوا وتأتوا بثمر ويدوم ثمركم . لكي يعطيكم الآب كل ما طلبتم باسمي . 
58011004	Faith	بالايمان قدم هابيل للّه ذبيحة افضل من قايين . فبه شهد له انه بار اذ شهد الله لقرابينه . وبه وان مات يتكلم بعد . 
46004001	Recommendation	هكذا فليحسبنا الانسان كخدام المسيح ووكلاء سرائر الله . 
66006013	Description	ونجوم السماء سقطت الى الارض كما تطرح شجرة التين سقاطها اذا هزتها ريح عظيمة
46010014	Recommendation	لذلك يا احبائي اهربوا من عبادة الاوثان
45012021	Recommendation	لا يغلبنك الشر بل اغلب الشر بالخير
55002014	Recommendation	فكّر بهذه الامور مناشدا قدام الرب ان لا يتماحكوا بالكلام . الامر غير النافع لشيء . لهدم السامعين . 
59004008	Recommendation	اقتربوا الى الله فيقترب اليكم . نقوا ايديكم ايها الخطاة وطهروا قلوبكم يا ذوي الرأيين . 
59002009	Sin	ولكن ان كنتم تحابون تفعلون خطية موبّخين من الناموس كمتعدّين . 
52004007	Grace	لان الله لم يدعنا للنجاسة بل في القداسة . 
45001018	Sin	لان غضب الله معلن من السماء على جميع فجور الناس واثمهم الذين يحجزون الحق بالاثم . 
62004007	Faith	ايها الاحباء لنحب بعضنا بعضا لان المحبة هي من الله وكل من يحب فقد ولد من الله ويعرف الله . 
62002009	Sin	من قال انه في النور وهو يبغض اخاه فهو الى الآن في الظلمة . 
60004014	Grace	ان عيّرتم باسم المسيح فطوبى لكم لان روح المجد والله يحل عليكم . اما من جهتهم فيجدّف عليه واما من جهتكم فيمجد . 
44021019	Grace	‎فبعدما سلم عليهم طفق يحدثهم شيئا فشيئا بكل ما فعله الله بين الامم بواسطة خدمته‎ . 
43008046	Sin	من منكم يبكّتني على خطية . فان كنت اقول الحق فلماذا لستم تؤمنون بي . 
58010017	Grace	ولن اذكر خطاياهم وتعدياتهم في ما بعد . 
46001005	Grace	انكم في كل شيء استغنيتم فيه في كل كلمة وكل علم
45015030	Recommendation	فاطلب اليكم ايها الاخوة بربنا يسوع المسيح وبمحبة الروح ان تجاهدوا معي في الصلوات من اجلي الى الله
43007020	Violence	اجاب الجمع وقالوا بك شيطان . من يطلب ان يقتلك . 
45003025	Grace	الذي قدمه الله كفارة بالايمان بدمه لاظهار بره من اجل الصفح عن الخطايا السالفة بامهال الله
43018018	Description	وكان العبيد والخدام واقفين وهم قد اضرموا جمرا . لانه كان برد وكانوا يصطلون وكان بطرس واقفا معهم يصطلي
49006011	Recommendation	البسوا سلاح الله الكامل لكي تقدروا ان تثبتوا ضد مكايد ابليس . 
43013037	Faith	قال له بطرس يا سيد لماذا لا اقدر ان اتبعك الآن . اني اضع نفسي عنك . 
50004007	Faith	وسلام الله الذي يفوق كل عقل يحفظ قلوبكم وافكاركم في المسيح يسوع
59003009	Faith	به نبارك الله الآب وبه نلعن الناس الذين قد تكوّنوا على شبه الله . 
46005010	Sin	وليس مطلقا زناة هذا العالم او الطماعين او الخاطفين او عبدة الاوثان والا فيلزمكم ان تخرجوا من العالم . 
44026009	Sin	‎فانا ارتأيت في نفسي انه ينبغي ان اصنع امورا كثيرة مضادة لاسم يسوع الناصري‎ . 
61002014	Sin	لهم عيون مملوءة فسقا لا تكف عن الخطية خادعون النفوس غير الثابتة . لهم قلب متدرب في الطمع . اولاد اللعنة . 
43010012	Description	واما الذي هو اجير وليس راعيا الذي ليست الخراف له فيرى الذئب مقبلا ويترك الخراف ويهرب . فيخطف الذئب الخراف ويبددها . 
59001019	Recommendation	اذا يا اخوتي الاحباء ليكن كل انسان مسرعا في الاستماع مبطئا في التكلم مبطئا في الغضب . 
46009014	Recommendation	هكذا ايضا امر الرب ان الذين ينادون بالانجيل من الانجيل يعيشون . 
43012046	Grace	انا قد جئت نورا الى العالم حتى كل من يؤمن بي لا يمكث في الظلمة . 
43005014	Description	بعد ذلك وجده يسوع في الهيكل وقال له ها انت قد برئت . فلا تخطئ ايضا لئلا يكون لك اشرّ . 
46016014	Recommendation	لتصر كل اموركم في محبة
43014015	Recommendation	ان كنتم تحبونني فاحفظوا وصاياي . 
58012025	Recommendation	انظروا ان لا تستعفوا من المتكلم . لانه ان كان اولئك لم ينجوا اذ استعفوا من المتكلم على الارض فبالأولى جدا لا ننجو نحن المرتدين عن الذي من السماء
48004008	Sin	لكن حينئذ اذ كنتم لا تعرفون الله استعبدتم للذين ليسوا بالطبيعة آلهة . 
44003026	Grace	‎اليكم اولا اذ اقام الله فتاه يسوع ارسله يبارككم برد كل واحد منكم عن شروره
44010039	Violence	‎ونحن شهود بكل ما فعل في كورة اليهودية وفي اورشليم . الذي ايضا قتلوه معلقين اياه على خشبة‎ . 
46001010	Recommendation	ولكنني اطلب اليكم ايها الاخوة باسم ربنا يسوع المسيح ان تقولوا جميعكم قولا واحدا ولا يكون بينكم انشقاقات بل كونوا كاملين في فكر واحد ورأي واحد . 
