44019013	Description	Amala hamosebegi, Yu dolö nawesalea mugabe fedai nesiladigisa aligilo nefolalo amoligi odoaea oodo beala Dafidilo Geloi Yesuïe ëi säla mugabe fedai nefolalo amolima sähalea, Foloea ïe mala säla ïlo Yesu amoïe ëigi dili nesiladigisagola sälo.
44015040	Grace	Amase, Foloea Sailasa memelesebegi edoolalia sähalea, Godeïe ugila negelo alibalä namialola säsebegi, ele asi.
63001008	Recommendation	Amai gabugi, dilia hamoi amoïe bidi nimolö amo made neala dabadigiloea, idihë namialo. Bidi amo sulubadela nimolöïe amala namialo.
44008021	Sin	Dïe iso asigi Godeïe siigi mogoi made nebego. Ameada alïa hamoi hamosebewegida dofä dia hamomolöi mademelë.
44014026	Grace	Adaliala ödä du edefadegi fila Ädiago obëgëi. Dafidi Ädiago ami elea hamoi hamola wagai amo hamomäia Godea udia dolö wela ifosi Ädiago nefolalo amolia Godea ele ugila negemäia ele Godema adolasila gausia ami obëgëi.
62005013	Faith	Godeïe malöïe ëigi asigi afädë negei nefolalebela dilie, dilia namolöi namolö gaula nebego dawadigimäia, na dilima ado gowe dëdëla ïasisago.
44013023	Grace	Dolö amoïe yaua mäumadila afädëa Isilale udia dolöïe damula aulo namiäia Godea dafidi säla negei amo gadola Yesu e misimelë.
55001016	Grace	Onesifolusia ne neala obeägïla ugila negesamu nelo amo eege, ea mosöa aligilo amolige, Dafidilo Geloia bobasëla ugila negemäia hamesa neawe. Ne igi ëfëa begela negei amobalä, ea hewala bedäla made aligisio.
62002028	Faith	Amai gabugi, nïe malöla dilie, hï e ulufadigisolo amo gala ïe siigi nilï hewaloea bedäla made gelola namolöïe ebalä dila namialo.
54001015	Grace	Ado dofäfalï amo nilïa nabaha maadei dibe amoda gowe. Geleso Yesu e nafade hamolo nefolalebe amoli damula moholöïe nagadaia digai nelo. Ado amoda dofä gabula helësëmolö dialea. Nafade hamolo amolile dafidiloda nemelë.
44008032	Description	Bebagi ado säla dëdëla negei nidei amoda gowe. Sugua sibi baagomäia nufulö sigi awäsebe amo gadolage, sibi emalö hilï damusegi nafi dagala adolo made amo gadolage, ea nafi made dagai.
44013021	Description	Samuale nebegi, ilia beaha aligilo gini ïmäia ëdëgësebegi, Godea Bëyamini sosogomadila Gisiïe malö Solo ï. Amala ïasebegi Solo eda gäheo i nabülasi biyidiagi beaha aligilo nelo.
56001010	Sin	Amala säsebe amoïe mida, ado neadigilo yafie amoli ami nefolaleamelë. Amoliada ado yafie memalä säla dabolahilä, udia dolöïe asigi balalëlasila gadiabola säla olelelo nefolalea. Amala sälo amoligi yafieda, gafodo damumolö dialeala sälo amoli nefolaleamelë.
44010012	Description	Amodaia ami hogoi elö elöige, nagadaia hagomoea aulo elö elöige, hagila aulo haea elö elöige sefolalebe melï.
55001013	Faith	Na dima säla ï amo gadola, dia säla olelesamu namolöïe gelola gaula namialo. Amala gaula nea, Geleso Yesuma dila nea, asigi afädë negemolöge, boba hamomolöge, amoleda nilïle dialeamelë.
44016022	Violence	Amala säi amo nabalahilä, udia dolö gegedoi amoliage ele nufulö hamosebegi, gudi mogelo amolia elele fagulo giladigilahilä, ele buudi damuia nufualai.
44009013	Description	Amala sälebe Ananaiasaea säla obëgësalea, Dafidilo Geloie, dolö goeada udia dolö dihïle nafolai Yalusaleme nefolalo amolima nafade edefade hamoimelëla udia dolö yafiea säi amo na nabimelë.
55003002	Sin	Udia dolöea hili ilimu helësëmolöge, muni boba hamomolöge, gugusäla bimäia hamomolöge, hili ilile ëi gauia adamolöge, gagademolöge, eedole emelele ado made nabulöge, made nesegemolöge, Godeïe mala made nabulöge, dïe bimolömelë.
54004006	Faith	Dia ado amoli didoolalima säla ïalahilä, Godeïe ado mala dofä säla negei dibe amoge, mala hedabola säla olelei amo gaula mogosa neebe goge, gesami gelomäiaïe molö amo dia nahamu aligiseda, Geleso Yesuïe hamoi hamolo hedabi di namolömelë.
