54004014	Recommendation	Dolö dafidi nelo nefolalo amolia dima naabo negesisolo amo gala, afädëa bea säi ameada, Gesamiïe galu dima ï amo gaula nebegoda fisimabio.
62004015	Faith	Afädëa Yesu eda Godeïe Efege neala säla ulufadigiseda, Godeda ebalä dila nea, amase, eege Godebalä dila neamelë.
62002029	Faith	Amai dilia eda mogoifalï neebe amo helësësebe amea gomalä helësëmalo. Sulubadelaea mala mogoi hamosa neebe amolida Godeïe malölali nefolaleala helësëmalo.
44013047	Grace	Mida, Dafidilo Geloia alïa hamomalai amoda gowe. Dida fii odoa udia dolöïe yo digalo nebego. Damula aulo amo sege föi dibe sulubadelamadi gaula mosäiala säi.
44002033	Description	Godea Yesu neala gauia adala fedalasila ïe naabo dafädimadi ifosilahilä, ïe Gesami ï. Eedoea Gesami ïmolömelëla dafidi säla negei amo ï. Ea amo walio söga sali amo dilia siia beala gëhea nabi amomelë.
62003023	Faith	Godea hamomalola säi amoda gowe. Nilïa ïe malö Yesu Gelesoïe ëigi asigi afädë negela nea, nihïlïmu boba hahamosa namolöla. Ea amala hamomalola säi.
44020010	Description	Folo e digalahilä malïsä amodaia dia fedalahilä naaboea gauia welahilä sähalea, Hame gudusebemelë. Didigaomabula säi.
55002010	Faith	Amaimo, udia dolö Godea memelei amoli helësëlahilä, damula auloge, namolöi namolö hedabi hïdo elöi amoge, Geleso Yesuma dibe amole, iliage gaula namiäia, yöi sulubadela diëgi, aso made dofeala nea, ne së naha neawe.
54005020	Recommendation	Asiala hamolo amo udia dolöïe siigi ifosilahilä, ilia nabala bedämäia, dolö amoma nemomalo.
62002015	Recommendation	Nagadaia galu amole nelebo nagadaia dibe amole boba hamola namiabio. Afädëa nagadaia galu dibe amo boba hamoseda, Nadoma boba hamolo amo ema mademelë.
44020035	Recommendation	Na sulubadela hamosa nelo amo gadola hamoi edefade hamosebewea udia dolö geloi made nefolalebe amoli ugila negemolöi dibe amo oleimelë. Amase, Dafidilo Geloi Yesuea sähalea, Afädëa digali afädë ïaseda, dia holöfalï obeägïmolö. Gasoda, dia afädë elögali ïaseda, dia edefademalä obeägïmolömelëla säi amo helësëmolöi dibe amoge oleimelëla Foloea säla wagai.
64001006	Recommendation	Amolia udia dolö Godea wela ifosi yawe nefolalebe welima dia boba hamolo amo säla ïmelë. Amala säla ïlo amoli nelebo gaula nawesa namolö awäsebe amo gadola afiasebea ami Godea helësëse amo gadola dia ili ugila negemalo.
55002023	Recommendation	Udia dolö odoaea asigi made gäwila, ado memalä amogi didiäha neebea ami made awäla, udia dolöea ado amo gadoia gëgëlola helësëlahilä, di ilibalä aligila made, nafolala namialo.
44011017	Grace	Dafidilo Geloi Yesu Gelesoma asigi afädë negesebegi, Godea nilïgali ï amo gadola, iligalige ïasebegi, na Godema iligali amala ïmabula sämolöi nelolela Fidaea säla wagai.
62003007	Recommendation	Nïe malöla dilie, afädëa dili dahila neloea idihë namialo. E asigi mogoi neebe amo gadola afädëa mala mogoi hamolo neebe amoge asigi mogoi nea.
62004001	Recommendation	Nïe damelë obeägïlola dilie, wäfalï bea sälo yafie amoli sege sulubadelagi nawesa nea. Amai odoaea Gesami nema neala säseda, sulubadelaea dofä säsebela helësëmabio. Ili Godemadila walebelela bimolöïe fedogola bimalo.
44013038	Grace	Amai gabugi, nedoola dilie, Yesuïe aulodaia nea nafade hamoi amo hëmolöïe mala dilima säla ïaha neebewe helësëmalo.
44007029	Description	Amala säi amo nabalahilä Mosese e Midiana segea fisäla awäla nelo. Ami nea ïe dolö malö äudä sogobai.
44020029	Violence	Ne asibua ilua ügülo geloi gadoi dili nefolalebea gui maalahilä, sugua sibi gadoi nefolalebe amoli bobasëla made, nufudala hësömolöla helësësamelë.
62004012	Faith	Afädëa Gode made melï nea gaso, nilï nihïlïmu boba hahamosa aligiseda, Gode eege nilïbalä dila nea, nilïle isogi ïe boba hamolo amea hamese amo gadola hamosage neamelë.
54004001	Sin	Godeïe Gesamia ulufadigila fädäla sähalea, hobea udia dolö odoaea Godeïe mala dïgïla moholömelë. Dïgïla awälahilä, ilia dahila nelo mugabege, mugabeïe mala säla oleleloge nabala bëgëla moholömelë.
56003001	Recommendation	Geleso sosogo Gilidi neebe amolima bu helësëlasila, dia gomalä säla ïmalo. Ilia gamane sigi aligilo geloi neebe amolige, amase, gamane hamoi hamolo odoa neebe amoli hawala namiäiage, ilia hamomola säsebe amo gadola hamomäiage, säla ïmalo. Hamoi hedabi sulubadela hamomolö amo daiala namiäiage säla ïmalo.
44016006	Description	Gesami Hedabia ilia Esiamadi ado mala säla ïmolö mosabiola idi gasebegi, ili Filigiamadile Galesiamadilemu nawesa namolö asi.
62005001	Faith	Afädë Memelei amo dofä Yesu e nealahilä asigi afädë negei neebe amoli sulubadelada Godeïe malö nea. Eedo afädë amoma boba hamosa neebe amoli sulubadelaea ïe malö amomage boba hamosa nea.
54005001	Recommendation	Dia ëdëdëi sefolalebe amolima nemola sämabio. Dïe diadoma sälo amo gadola wäla, ado geleä säla hamogimalo. Dolö geloi nefolalebe amolimage, dihïle didooma sälo amo gadola wäla sämalo.
55002014	Recommendation	Ado amoli dia udia dolöma helësëlasisamu namialo. Ilia ado eloalola nuduloea, dida Godeïe siigi nea, ilima idihë namialola sämalo. Ado eloalola säse amo, nabase amoli neala hedabolo made, nafadelasilomelë.
62004007	Faith	Nïe damelë obeägïlola dilie, boba hamolo amoda Godemadila mulo amea nilïa nihïlïmu boba hahamosa namolöla. Afädëa odoa neebe amo boba hamosa neebe amoda Godeïe malö nea, ea Gode dawadigi nea.
62002009	Sin	Afädëa ïe edooma bimolö habobala nea ea sähalea, Yo digalo neebea ami neala säseda, gasimi sagaia ami neamelë.
44021019	Grace	Foloea ilima dili go gabiola sälahilä, udia dolö fii odoa nefolalebea ami Godea emadi aligila hamoi amo ilima awala säla ïaha maadei.
44026009	Sin	Nasalese fii Yesuïe ëi neala nafademolöïe, na hamoi edefade hamomolöila helësësa nelomelë.
44003026	Grace	Amaimo, Godea Yesu e ïe hamoi hamolasilo namiäia diligalidale fisiga wei. Fisiga wei amoïe mida gowe. Dilia nafade hamosa neebea amila ea sigi gaula obëgëlahilä obeägïlasimäia fisiga weimelëla Fidaea säla wagai.
44010039	Violence	Ea Yalusaleme neage, Yu udia dolöïe sege sulubadelagi neage hamoi amo nilïa beaha maadei. Ilia e baagomäia iigi baala negeimelë.
55002022	Recommendation	Malïsä nefolalebe amolia asigia gesami aulo amo gadola made, dida fisäla awäla, asigi gagadelai amolia Dafidilo Geloia ili ugila negemäia welo nefolalebe amolibalä nea, di asigi mogoi namolöge, Godema asigi afädë negemolöge, boba hamomolöge, daluloge, amoli bua gaula bëgëla hamosa namialo.
62004006	Faith	Amaimo, nilï Godeïe sosogo nefolalea. Ado nilïa säsolo amo gala udia dolöea Gode dawadigi nefolalebe amolia nilïle ado nabelo nea. Amai gaso, udia dolö Godeïe sosogo made nefolalebe amolia nilïle ado nabelo made neamelë. Amo gadola dofä sälo Gesamige wäfalï sälo gesamige mogemolöi galea.
44005015	Description	Amalebe oloi difolalo amoli gaula mafula idiafa Fida awäsido fëo fösisila nidila negeladigi, dafudaia gaula maala nidila negeladigi. Amoïe mida, ilia helësësaleada Fida e maasegi, ïe ausuluboea oloi difolalebe amoli dabemäia amai.
55003004	Sin	Amase, ilia hilile damelë ado nii neebe amogali hololöla ïmolöge, asigi made gäwila helësëse amo gadola aabela hamomolöge, ilia hilimu neda dofä edefade neala helësëmolöge, amase, Gode made boba hamola, domaloea hamelo amomu boba hamomolöge, dië bimolömelë.
44014014	Description	Amala hamomolöïe hamosa neala säi amo nabalahilä abosolo äudä Banabasale Fololea helele fagulo amo nulilahilä, udia dolö gegedoi mogogi ami baluluia awälahilä, ado gelola silälasila
44007011	Description	Amalahilä Isibi sege sulubadelagige Gainana sege sulubadelagige sïdë i maasebegi, udia dolö edefade yösa nefolalo, nilïle mäu ilia molö abidi galea walebelela hogoi gaso, afädë made beagolei.
63001004	Faith	Nadoea nilïa hamomalola säi amo gadola dïe malö odoaea ado dofä amo bëgëla awähala säi amo nabalahilä, na edefademalä obeägïmelë.
54005008	Faith	Afädëa e sosogofalïge, e sosogo odoage beala made ugila negeseda, ea Godeïe mala säla negei dibe amoma baagi ïala, Gode made helësëlo nefolalebe amoli gadoi made, eda nafadefalï nafade nea.
44027034	Recommendation	Walio dili molö muäiala sähamelë. Dili namolöïe molö molö dialea. Dilile busa hilï afädë made besela digimolömelëla säi.
56002002	Recommendation	Dia hä, dolö fädäi neebe amolima gomalä säla olelesa namialo. Ilia nelebo dibe amo sulubadela asigi gäwila hamomalolage, asigi mogoi namialolage, hili ilile asigi sigi namialolage, asigi afädë negei amo made digala gelola namialolage, odoabalä hedabola boba hahamosa namialolage, amase, yöi diëgi, dofea, aso madela namialolage, säla ïaha namialo.
44017030	Recommendation	Godeada dafidi udia dolöea e dawa made nea hamoi amoda ea helësëlo made nelo. Amalo gasoda, walio ea udia dolö sege föi sulubadelagi neebe amo sulubadelaea asigi besumalola gelola säha nea.
44013034	Grace	Godea Yesu neala nowelasi amo bu made baagomolömelëla gomalä säla dëdëla negei dialea. Dofä hedabi obeägïlasimolö dafidi Debidima ïmolömelëla säla ï amo gadola dilima ïmolömelëla säla dëdëla negei dialea.
62002003	Faith	Amaimo, nilïa ea säi dibe amo gadola hamosamu aligiseda, nilïa e dawadigila helësësamelë.
44011021	Faith	Dafidilo Geloia ïe geloi ilima olesebegi udia dolö yafie asigi afädë negesa maadelahilä Godemadi namolö obëgëi.
54005005	Faith	Udia didalo e ugila negelo afädë maade, hïdofalï sebe amea Godema asigia sisiläfüsa salea, yoba gasigige ema adosalea, ugila negemalola adosamu aligilo salea.
44019002	Faith	Gausialahilä ea ilima nabahalea, Dilia Yesuma asigi afädë negeselo amo gala Gesami Hedabi niilela nabi. Amala nabasebegi, ilia säla obëgësalea, Gesami Hedabi neala säi goda nilïa nabi mademelëla säi.
44024014	Faith	Ado dofä dima säla ïahawe, amoda gomalä. Neda Idi ilia sosogo elöla säse gowe bëgësaleada, nilïle mäuïe Gode ëi gauia adalomelë. Amase, nada Ado säla negei dibe amo sulubadelage, Godeïe bea sälo amolia ado säla dëdëla negei amoge dofä gabula helësësamelë.
44008009	Description	Gaamugi ami dolö afädë ïe ëi Saimono sulo. Dafidida ea golë hamosa nelo. Samelia fii udia dolö fudugimäia elö elöla hamosa nelo. Ea hïmu sähaleada, Neda ëi sälo edefademelëla sälo.
54005022	Recommendation	Dia hä fodolofalï aabela afädëma naabo negesimabio. Odoaea nafade hamoi amo dima asiala baaloea. Dida asigi gagadelai namialo.
56002003	Recommendation	Amo gadola wäla, udia fädäi sefolalebe amolimage, gomalä säla olelemalo. Baagido sämabiolage, gagaolo ödäea asigi made neala gagaomäiage, Godea hamei dibe amo gadola bëgëla hamosa samiäiage, ilia mala hedabi olelemolö galeamelëla säla ïmalo.
44022004	Violence	Idi gowegi bëgëla aulo nefolalo amoli na neala sëlasisa nelo, ili baagomäia. Udiage dolöge nafodolahilä, ili galabaia mosöa negesa aligilomelë.
55002018	Sin	Elea ado dofä dibea amila asiala baagi feala asimelë. Elea sähaleada, Udia dolö nowelasimolö amoda, hä, nowelasisa maadeila sälahilä, udia dolö odoa asigi afädë negei amoli asigi neala balalëlasilo.
44017025	Grace	Eda nelebo afädë ufola adida made neebe amo dolöfäea e ugila negela nelebo afädë ïmolöi mademelë. Mida gowe. Ea namolöge hamege nelebo sulubadelage udia dolö sulubadelagali ïmolöda hï e nea.
62005009	Faith	Udia dolöea siia melï amo dofä säsebela asigi afädë negelomelë. Amai gaso, Godeïe ado dofä sälo dibe amea udia dolöïe ado sälo amo baagila asi dialea. Mida, e Gode nea. Elöda, hïle efegeïe säsisa nea.
44019011	Grace	Godea Foloïe naaboea geloi melëlo made hïdo elöi hamosa nelo.
62004011	Faith	Nïe damelë obeägïlola dilie, Godea nilï amala boba hamoi amea nilïa nihïlïmu boba hahamosa namolöla.
44002028	Grace	Dia ne namolöïe idi oleimelë. Dia nebalä namolöi nebegoeada ne obeägïlo nobalahilä obeägïsa namolöla Debidia säimelëla säi.
54004013	Recommendation	Ne misiäia beaha neada, Godeïe bebagi ado säla dëdëla negei dibe amo udia dolöea nabuäia nidelahilä, mala amo säla ïadigi, säla oleleladigisa namialo.
44002013	Description	Odoa nefolalo amolia gadiabola sähalea, Wani ödä gähe hamola negei amo edefadela naala gagaosebegola säi.
62004002	Faith	Ilima Godeïe Gesami neebelela fädäla bimolö amoda gowe. Afädëa sähalea, Yesu Geleso eda dofä dolö domalola digaila säha neebe amomada Godeïe Gesami nea.
44013030	Description	Amai gaso, Godea e bauia amila neala nowelasi.
56003010	Recommendation	Afädëa Geleso sosogo nefolalebe amo mogemolöïe ado säseda, äudäla hamogila säla ïmalo. Säla ïasebe amo made nabala auaula fofolëseda, baagi ïmalo.
44007023	Description	Mosese e gäheo i nabülasi biyidia baagilahilä ïe edoo Isilaleïe malö amoli neebea söfë moholö dialeala helësëi.
44023027	Violence	Yu iliada dolö go gaula nufudadigimolöïe hamosebegi, na eda Olomo dolömelëla säsebe amo nabalahilä, ami dolö amola e neebea maala na e damula awäla sigi obëgëimelë.
44019029	Description	Amaimo, gaamugi nefolalo amoli sulubadelaea üalala dodogösa difolalo. Amala üalala dodogösa difolalea Masedonia fii dolö äudä Gaiusale Alisadagusale Folobalä nawesa aligilo amole ilia gaalu gedolo gaamu edefade dibea ami fodolofalï sigi gaula asi.
44003014	Sin	Dilia dolö hedabi mogoifalï hïdo elöi amoma baagi ïala golala bealahilä, dolö nufidelo amo fisigämola säla didigai.
44015009	Faith	Eada ilige nilïge mogogi nofeida maade. Ilia Yesuma asigi afädë negesebegi, ilile nafade hamoi amo ea hëla fisimelë.
44002024	Description	Baagoia e nafodomolö ulï amea Godea baago amoïe sëa e fisigisimäia e nowela ifosi.
54003003	Description	Gagaomolöïe gagaolo ödä edefade made nulöeage, nudumolöïe fodolofalï abadigila made, udia dolö hedabola helësëla hame negeloeage, made gëgëloeage, amase, muni gesami made auloeage, namolö dialea.
62002005	Faith	Afädëa ea säi dibe amo gadola hamoseda, Godema boba hamolo amo dofä fädäi neamelë. Nilï ebalä dila neada gomalä helësëdelä.
55001006	Recommendation	Mi amoïeda, nïe naabo dima negesebegi, Godea Gesamiïe galu ï amo bäumäia, nulo fulabesegi söa fedalo amo gadola, söa fedamäiala helësësa namialo.
44023005	Recommendation	Amala nabasebegi, Foloea säla obëgësalea, Nïe nedoola dilie, e gobela ïlo Busa Edefade neala na made helësëi. Udia dolö dili nefolalebe amoïe beaha aligilo neebe amo dilia e gagademabiola bebagi dëdëla negei dialeala säi.
44014017	Grace	Amai gaso, ea hamoi amo sulubadelaea e dofä neala helësëmäia, musügä negela made, hï e olei. Ea hedabi hamosebe amoda gowe. Sege mudaiala fisiga idaloge, amase, molö bäulasiloge amole diligali ïlomelë. Diligali molö ïase amea bolelasiloge obeägïlo dilile isogi nobalasiloge neamelëla säi.
54003011	Recommendation	Amo gadola wäla, ilile udiage asigi mogoimu nea, baagido made säloge, nelebo dibe amo sulubadela asigi gäwila hamologe, mala hamosebe amo sulubadela mogoimu hamosa namolö dialea.
44012020	Description	Udia dolö Daiamadi nefolalebe amolimage, Saidonomadi nefolalebe amolimage, Heledoea edefademalä mihaläha nelo. Amala nebegi, hili asigi afädë negelahilä Heledo neebea asi. Ilia bea moholö nea, Gini dilo mosö beaha aligilo dolö ëi Balasadusabalä ado afädë negelahilä, hobeala neala dalumolöïe ado sämolö ili Heledo neebea asi. Amala sämolö asi amoïe mida, ilia Heledoïe segeamadi molö bidia nelo amo helësëla amai.
62002012	Grace	Malöla dilie, dilile nafade hamoi amo Gelesoïe ëigi hëla fisi amoïe na dilima dëdëla ïahago.
55001009	Grace	Godea nilï damula awäla ïe udia dolö mogola namiäia, ea nilï wei. Amala hamoi amoda, nilïa hamoi afädë hamosebegi made, amoda Godea ïe hameloeage, ugila negeloeage amala hamoi. Siiba Godea sege föi hamola made nea, Geleso Yesumadila aligila ïe ugila negelo amo nilïma ï.
63001007	Sin	Mida, dahila nelo yafiea Yesu Gelesoda dolö domalola digai madela säsäla sege elö elögi afiaha maadei. Amolida dahila nelo, Gelesoïe ado nii nea.
44024005	Sin	Nafade hamoloda dolö gowemadila misi gabula beagolesamelë. Eada Yu dolö sege dibe sulubadelagi nefolalebe amoli neala habobalasilahilä nudulasiloge, amase, Nasalese sosogo nefolalebe amolile dafidiloge emu neamelë.
54003016	Grace	Godeïe ado mi dafidi ulufadigila made, negesi dilo. Amoda geloi edefade gelola dibe amo afädëa iso gäwi made gabula sämolöi mademelë. Eda dolö domalola ulufala digai. Godeïe Gesamia e mogoifalï neamelëla olei. Selesaia fiia e melï. Ïe ado mala fii odoama säla ï. Udia dolö sege elö elölagi nefolalo amolia ema asigi afädë negei. E selesaia mosöa yo digalo dibea ami fedalasimelë.
54006001	Recommendation	Beaha aligilo nefolalebe amolia Godeïe ëimage, ïe ado malamage, ado nafadela made sämäiaïe, hamoi hamolasiloma i damui muugia negela begei gadoi nefolalebe amolida, ilile beaha aligilo neebe amo hawa nea, dofä hedabola helësëlahilä, ea hamomalola säsebe amo gadola nabala hamomolö dialea.
44013019	Description	Amalahilä Gainana ami fii gifalädalïa sulo amoli nufudaha maadelahilä, ilile sege Isilale udia dolö samiäia hilima ïmelë.
54006003	Faith	Afädëa nilïle Dafidilo Geloi Yesu Gelesoïe ado mala dofä säla negei dibe amo fisila, mala hedabi amo mogola gaula säla olelela made, mala elöi oleleseda,
63001010	Recommendation	Afädëa dili neebea maala, Gelesoea säla olelei amo gadola made, elö gaula maaseda, e säla olela gausiala mosöa maala fimola sämabio.
44007051	Sin	Aso, Sidibenia ilima sähamu nea sähalea, Dilile iso asigi geloifalï nebego, bobaeage gëheage asigi afädë made negei amo wälasi nebego. Gesami Hedabima habobahamu nebego. Dilida dilile diado amoli nelo amo gadoimu nebego.
54001009	Sin	Nilïa elö helësësaleada, mala hamomolö amole, made hamomolö amole säla negelo amoda, udia dolö asigi mogoi nefolalebe amolile säla negelo mademelëla helësësa. Amoda udia dolö goweli gadoiïe säla negeila helësësamelë. Udia dolöea mala damuloge, ado made nabala hamologe, Gode made helësëloge, nafade hamologe, Godeïe mala made nabeloge, nagadaia malamu helësëloge, eedole emele baagomäia nufideloge, udia dolö odoa baagomäia nufideloge,
54006011	Recommendation	Amai gaso, Godeïe dolöo, dihïdi mala amoli gadoi dibeamadila fisäla mosalo. Amala hamosa nea, bua gaula bëgëla hamomolöda goweli. Asigi mogoi namolöge, mala mogoi hamosa namolöge, Godema asigi afädë negemolöge, boba hamomolöge, yöi diëgi, dofea, aso madela namolöge, odoabalä hame negela namolöge, mala amoli bua gaula bëgëla hamosa namialo.
54002012	Recommendation	Na ado säsebe amoda gowe. Udiaea dolöma ado mala säla olelemäiage, sigi aligimäiage, namialamolöi mademelë. Iliada adola made, nabaha samolö galea.
44010015	Recommendation	Amala sälebe, ado amea bu elö ema sähalea, Godea dofea muöla säi amoda ïe siigi dofea madela sämabiola säse nabi.
62004010	Grace	Boba hamolo amoïe mida gowe. Nilïa edale boba hamoi made, eadale nilï boba hamolahilä, nilïa nafade hamoi amo hëmäia ïe malöea hïle namolö amo odala ïala baagomäia e digamalai.
62001007	Faith	E nafade baai made, yo digalo neebe amo gadola nilï nafade baai made, yo digalomadi nawesa aligiseda, odoa neebe amolibalä dila neage, ïe malö Yesuïe healea nafade hamoi amo sulubadela hësage neamelë.
62003017	Sin	Afädë nelegei negelo neebe amea ïe edoo nelebo maade neebe amo bealahilä made bobasëseda, Godeïe boba hamolo amo ebalä abeahäla neadu.
44007025	Description	Mosesea helësësaleada ïe edoo amolia Godea Moseseïe naaboea ili fisigämolö gabula helësësa dialeala helësëi. Gasoda, iliada amala made helësëi nefolalo.
56001016	Sin	Ilia adoeamu, Nilïa Gode dawa neala sälo. Gasoda, mala ilia hamosebe amea, Gode made dawa neala ulufadigilo. Odoaea ilima bimolö habobala, ilia mala mogoi dibe amoli sulubadela fisila, ado nabelo made nea, hedabi hamomolö amo ulï neamelë.
55002015	Recommendation	Godeïe siigi ïe hamoi hamolo nea, dia hamoi hamosebegoïe, ïe siigi hewala made, Godeïe ado mala dofä dibe amo gelolahilä, dofä hamosala helësëla, mogolafalï olelelo namialo. Godea dima obeägïlahilä, hedabola hamosa nelo gabula sämäia, amala hamosa namialo.
44026014	Violence	Amala hamosebegi, nilï sulubadela digafui difolalebegi, afädëa nema Hibulu adoea sähalea, Soloo, Soloo, edogi dia ne neala sëlasisa. I ägëgi emoea nufidelo wäla nufidelo goeada di dihïmu yölasisebegola säsio.
62005021	Recommendation	Nïe malöla dilie, wäfalï sälo gode neebe amo helësëlahilä, gasi gala sigola namialo. Hä amo.
55003006	Sin	Amoligi dolö odoaeada, udia asigi made gäwi gadoi sebe amolile mosöa, asigi fea negela awälahilä, säfe negela ilile asigi gide begelo. Udia amolia nafade yafie dafidi hamoi amogi yöla nea gaso, gesami yafie awähamu fisa.
44009005	Description	Amo nabalahilä ea säla obëgësalea, Dafidilo, dida nowëla nabi. Amala nabasebegi, ea säla obëgësalea, Neda Yesu, dia neala sëlasilo amomelë.
44007033	Recommendation	Bedäla nebegi Dafidilo Geloia ema sähalea, Sege di nebegoda na nihïle nafolai sege amea dia emo usililo salugai go gimo.
62002024	Faith	Mi gäwia amila nabi dilile isogi dibe amo amalasi namialo. Amalasi aligiseda, dili Efegele Eedolebalä namolömelë.
62001005	Grace	Ea ado säi amo nilïa nabalahilä, dilima säla ïahago. Gode eda yo digalo nea, gasimi sagalo gadoi nafade ema madefalïmelë.
54005017	Recommendation	Dolö dafidi nelo nefolalebe amoliada udia dolö hedabola sigi neëda, ili hedabola helësëla bidi hedabi ïmolö dialea. Mala säla ïadigi, säla oleleladigilo amolida dofä amamolö dialea.
44007020	Description	Amo gaalu, Moseseïe emea e ägüla misi, malö amoda Godeïe siigi hedabifalï. Aube ohodoa eedo hï mosöa ami sigi nelo.
44014019	Violence	Amaha nebegi, Yu odoa Ädiagolage Aigoniamalage mofiai. Mofiai amolia helësëse amo gadola gegedoi amolia amala helësëmäialahilä, ilia ado afädë negei. Ado afädë negelahilä, ilia Folo igia nufi. Nufi amo baagoi gabula helësëlahilä, dusugala gaula awäla gaamu baagido negesi.
44007052	Sin	Bea sälo nefolalo amoligi afädë dilile diado amolia neala made sësa neloda nowë. Siiba dolö mogoifalï moholömelëla säladigi amolige ilia baagomäia nufudadigisa nelo. Amase, walio dilia dolö amo hololölahilä baagomäia nufimelë.
56003006	Grace	Nilïle damula aulo Yesu Gelesoïe aulodaia nea, Godea gëla made, ïe Gesami nilïma nobalasila adugamäia nilïma söga sali.
44004036	Description	Amo gadola dolö afädë nelo amoïe ëida Yosebe. Ïe ëi elö abosolo dolö amolia negeida Banabasa. (Banabasa amoda ado gowe gadoi. Iso asigi neala gelolasilo dolöla säla ëi negei.) Banabasada Ilibai sosogo nelo. Eda ödä södölogi Saibulusi fii.
54004010	Faith	Ado amo helësëlahilä, nilïa hamoi baagi sëi edefade hamosamu neebewemelë. Mida, nilïa Gode namolöi neebe amoma asigia sisiläfüsa nea. Eada udia dolö sulubadelaïe damula aulo nea. Ea amala hamolo neada, ema dofä asigi afädë negei neebe amoli hä, damula aulo nea.
44022016	Recommendation	Di memalä beaha samolöda edoïe. Hä nowelahilä ödägi gela, Dafidilo Geloima adola, dia nafade hamoi amo hëla fisimalola säsiola Foloea säi.
55002024	Recommendation	Amaimo, Dafidilo Geloiïe hamoi hamolo nefolalebe amolia gëgëmolöda dofea mademelë. Eada udia dolö nefolalebe sulubadelabalä hame negeloge, säla olelemolö dawa gauige, odoama habobala obëgëla made, ado geleä säloge, amo gadoi namolö dialeamelë.
44002038	Faith	Amala nabelebe Fidaea säla obëgësalea, Dili asigi besula hïdo hïdola Yesu Gelesoïe ëigi ödägi gemalo. Amala hamosegida, dilia nafade hamoi amo hëladigila diligali Gesami Hedabi ïmolömelë.
44003019	Recommendation	Amala hamoi gabugi asigi besula dilile nafade hamoi amo hëmäia Godemadi namialo.
62002022	Sin	Wäfalï sälo amoda nowë. Eada sähalea, Afädë Memeleida Yesu madela sälomelë. Efegele Eedolema baagi ïlo amoda Gelesoïe ado niimelë.
44007021	Description	Amalahilä e segea negei dibegi, Felauïe idiwia neala gaula awälahilä, hïle malö folo wäla fosa nelo.
44026021	Violence	Amala säla ïaha aligilo amoïe, Yu dolö nefolalo amolia ne gobela ïlo mosöa nebegi gaulahilä baagomäia nufidedelä hamoimelë.
55004004	Sin	Ado mala dofä amo nabulö habobala baagi ïalahilä, mäuïe sibalo dibe amoli nabulö helësëla hamesa namolömelë.
54006020	Recommendation	Dimodie, hamoi dia hamomäia dima gausi amo fädäla beala hedabola hamosa namialo. Odoaea nagadaiaïe ado iso gäwi made nalï didiäha sefolalebea amige, mala dawadigisa maadeimelëla säha sefolalebea amige, di aligila made, sisigaha namialo. Ilia dawadigisa maadeila sälo gaso, ilile dawadigiloda wäfalï, Godeïe ado malabalä ado nii neamelë.
44017005	Violence	Amai gaso, Yu dolö nefolalo amolia naabo gëlahilä, dolö nafade hamolo memalä magaia gaamugi nawesa aligilo nefolalo odoa amoli hobe nii. Hobe nealahilä udia dolö yafie gegedolasila, ado gelolafalï säi amea ili sulubadelaea gaamugi ami nududulä hamoi. Amala hamola ilia Folole Sailasale udia dolö neebea sigi moholöïe ele hogosalea dolö afädë ëi Yeisonoïe mosöa ami fudulasia awäla hogola digai.
62005016	Sin	Afädëa ïe edooea nafade hamosa neë beaseda, nafade amo gadoi hamose ameada baagomolöi made galëda, Godema nabaseda, Godea ema namolö ïmolömelë. Amo säsebe amoda, nafade ameada ili baagomolöïe made säha nea. Amaimo, na gomalä säha, nafade hamose ameada baagolo dialea. Nafade amoïe dilia adolasimalola säha maade.
