46010010	Recommendation	Iyavei ndayande ñehe mara-mara tẽi chira yande Aposar rese, inungar ahe ẽgüe ehi yuvɨreco. Ipɨpe sui Tũpa ombou güembiguai ava yucasar ɨva sui ahe ava yucapa ãgua aracahe.
47002017	Faith	Ore rumo ndahei setá ambuae ava nungar tẽi oroico. Esepia, oromombehuse Tũpa Ñehengagüer, ndahei mbahe pɨsɨ ãgua tẽi rese ẽgüe orohe, ore rumo ore pɨhañemoñeta tuprɨsa pɨpe oromombehu co ñehesa Tũpa rovaque Cristo rese ore recosa pɨpe. Esepia niha, ore semimondo oroico.
45015001	Recommendation	Yande yayemovɨracua catu vahe Cristo rese yande yeroyasa pɨpe, iyacatu yande teieté yañemosañora ava Tũpa rese ndipɨhañemoñeta tuprɨ vɨtei vahe rese. Ndahei chira rumo yande ae tẽi yayembovɨha.
50002024	Faith	Che rumo ayeroya yande Yar rese aso pɨhaivi vaherã che teieté pe repia.
66007001	Description	Ipare asepia irungatu tuprɨ Tũpa rembiguai ɨva pendar yuvɨnohai vahe irohɨ cotɨ, norte cotɨ, arɨ sẽsa cotɨ, caharu cotɨ avei no omombɨtuhu tuprɨ vahe irungatu ɨvɨtu yuvɨrecoi vahe ɨvɨ harɨ rupi ipeyuẽhɨ ãgua, que para guasu pɨpe angara viña, que ñepei yepe ɨvɨra ro angara viña no.
60004003	Sin	Ẽgüe peye pucu rane niha pe rembiapo ai pɨpe peico ava Tũpa reroyasarẽhɨ recocuer nungar rupi tuprɨ. Ahese mbahe-mbahe tẽi peyapo pe pɨhañemoñeta raisa pɨpe, savaɨposa, pietasave pe rãse tẽi pɨpe pe aracuasa pemocañɨ pe ɨhu tẽisa pɨpe, pemboetei avei mbahe rahanga tẽi peico.
66011005	Violence	Acoi que oimese ovɨreco mara pota vahe, ahese che reco mombehusar yuru sui osẽra tata sapɨpa ãgua; ẽgüe ehira ava omano que che reco mombehusar reco momara potasar.
44023005	Recommendation	Ahese omboyevɨ chupe: —Che mu, ndaicuai co oñehe vahe pahi rerecuar ɨvate catu vahe secose. Esepia, icuachiaprɨ pɨpe aipo ehi yandeu: ‘Peñehe rai eme pe rerecuar upe’ ehi —ehi.
66022015	Sin	Ava rehɨi ndiporeroyai vahe rumo opɨtapara ocarve tẽi yuvɨreco, iyavei ava ipaye serai vahe, oyemboaguasa-guasa tẽi vahe, oporoyuca vahe, mbahe rahanga upe tẽi oyeroquɨ vahe, iyavei opacatu ava oipota rai vahe oporombopa-mbopa tẽi ãgua yepi” ehi.
66002014	Sin	Che rumo aicua mbahe pe resendar: eipeve amove ava ndoyepepɨ potai eté Balaam porombohesa sui yuvɨreco. Ahe omboaracua Balac israelita mboangaipa uca ãgua, toyuvɨrohuño mbahe roho seropovẽheprɨ mbahe rahanga upendar tẽi, oya, iyavei, toyemboaguasaño yuvɨreco, oyapave avei.
53001003	Faith	Ore rɨvɨreta, “Avɨye ndeu” orohe itera Tũpa upe pe recocuer rese yepi. Esepia, Tũpa rese pe yeroyasa tuvicha-vicha iri, tuvicha-vicha iri avei pe yeaɨsusa opacatu peyeupe pereco vahe.
46012002	Sin	Pe niha cũritei peicua tuprɨ ité yɨpɨndar Tũpa rese peicoẽhɨ vɨtese, peyembopa uca mbahe rahanga ẽgüe ehi tẽi, noñehei vahe upe peico.
49005025	Recommendation	Iyavei cuimbahe osaɨsura güembireco, inungar Cristo osaɨsu opacatu vɨroyasar, omondo güecocuer chupe nara.
45012017	Recommendation	Aní pẽu mbahe tẽi aposar upe pemboyevɨra mbahe tẽi avei. Peyapo catu mbahe tuprɨ opacatu ava rembiepiave.
60005006	Recommendation	Peyeecomombegüe catu peico Tũpa pĩratasa povrɨve. Evocoiyase pe reco mboɨvatera curi.
44014017	Grace	Tũpa rumo ndasesarai ava upe mbahe tuprɨ apo ãgua sui. Ahe ombou amar pẽu mbahe mitɨ ha avɨye ãgua yepi. Ẽgüe ehi mbahe tembihu imbou iyavei vɨharetesa pẽu —ehi ava upe yuvɨreco.
54003011	Recommendation	Iyavei sembireco yuvɨrecoi aveira oporomboeteisa pɨpe, nimahechiroi chira, osãro tuprɨra güecocuer yuvɨreco, iyavei imboyeroyaprɨ aveira opacatu mbahe rese yuvɨreco.
66002021	Sin	Che amondo vɨte tẽi arɨ chupe, tomboasɨ oangaipa Tũpa upe oyevɨ ãgua, che yapave viña. Ahe rumo ndopoi potai eté oyemboaguasa tẽisa sui.
44012020	Description	Yɨpɨndar rumo Herodes ndasorɨi eté ava Tiro pendar upe, Sidón pendar upe avei. Evocoiyase ahe pendar oyoya ipɨhañemoñeta yuvɨraso vaherã mborerecuar rovai. Ahe evocoiyase oyemborɨ Blasto rese yuvɨreco, ahe mborerecuar Herodes mboyoyasar. Ahe oporandu Blasto upe Herodes moñero uca ãgua rese yuvɨreco. Esepia, Herodes porocuaita sui oipɨsɨ mbahe güemihura yuvɨreco.
43008049	Sin	—Che ndarecoi eté caruguar cheyese. Che rumo che Ru amboetei; pe rumo ndache mboetei eté peye.
43006018	Description	Ahese oipeyu pĩrata ɨvɨtu, ɨ avei ohɨtu pĩrata.
45008018	Faith	Cũritei rumo yande paraɨsusa ndoyoyai eté teco porañetesa yande rese ou vaherã rese.
62002012	Grace	Che rahɨreta, co aicuachía pẽu nara. Esepia, Tũpa iñero pe angaipa rese pẽu Jesucristo recocuer pɨpe.
55001009	Grace	Tũpa niha yande pɨ̃sɨro iyavei yande renoi yande reco tuprɨ ãgua sese, ndahei yande rembiapo pɨpe. Ahe rumo güemimbotar rupi yande raɨsu Cristo Jesús rese yande recose. Ahe Tũpa ité yande raɨsu yɨpɨsuive ɨvɨ apo vɨteẽhɨseve.
43019006	Violence	Osepiase pahi eta rerecuar, sundao rerecuar avei, omboɨpɨ osapucai: —¡Tayatɨcasa! ¡Tayatɨcasa! —ehi pãve voi yuvɨreco chupe. Pilato evocoiyase aipo ehi ava upe: —Peraso, peyatɨca pe ae. Esepia, che ndayosui eté mbahe sembiavɨ —ehi.
60001010	Grace	Aracahe suive ava Tũpa ñehe mombehusar oicua tuprɨ pota ité co poropɨ̃sɨrosa resendar yuvɨreco ‘¿mara ehi eté pĩha co tecocuer?’ oyapave yuvɨreco. Iyavei oñemoñeta yuvɨreco Tũpa oporoaɨsusa pɨpe pẽu mbahe ombou vaherã rese.
63001007	Sin	Setá vai oguata ɨvɨ yacatu rupi oporombopa tẽi vahe yuvɨreco. Ahe, “Jesucristo ou güete reseve” ndehi eté yuvɨreco. Ahe oporombopa tẽi vahe Jesucristo amotarẽhɨmbar yuvɨrecoi.
44024005	Sin	Oroyandu co mbɨa ava mañeco tẽisar oguata opacatu ɨvɨ rupi. Ore judío, ore mboyaho ore yeamotarẽhɨ uca ãgua, ahe Jesús, Nazaret pendar, reroyasar rerecuar —ehi—.
54003016	Grace	Supi eté tuvichá eteprɨ Tũpa reco oyecua ramo vahe reroya tuprɨsa: Cristo oyemoporẽhɨ yande reco nungar pɨpe yandeu. Ipare Espíritu pɨpe imboyecuasa secocuer supi tuprɨ vahe. Iyavei Tũpa rembiguai rembiepiave secoi. Ichui imombehusa opacatu ɨvɨ rupi; opacatu rupi avei seroyasa. Iyavei ipɨsɨprɨ secoi ɨvave nara.
66016021	Violence	Iyavei yuvɨrovɨapipa ɨva sui ava harɨve amanda guasu, ahe iposɨigüer cuarenta kilos rutei. Ava rumo iñehe mara-mara tẽiño vɨte ité Tũpa upe yuvɨreco amanda sui tẽi. Esepia niha, evocoi Tũpa poronupasa ɨvaté catu vahe.
61003013	Faith	Yande rumo yasãro ité ɨva, ɨvɨ ipɨasu vahe Tũpa remimombehu. Aheve opacatu ava yuvɨrecoira güeco avɨyesa pɨpe.
66006014	Description	Ahese ɨva ndoyecua iri cute inungar acoi cuachiar yeapoapɨprɨ vahe, opacatu tuprɨ avei ɨvɨtrɨ, caha pãhu avei no osɨrɨ güenda sui yuvɨreco.
58010010	Grace	Tũpa evocoiyase yande peha angaipa sui oyeupe nara. Esepia, Jesucristo oyapo ité semimbotar mbahe ñepei reseve apɨrẽhɨ vaherã güete mondo pɨpe.
52001002	Faith	Ore, “Avɨye ndeu” orohe arɨ rupi Tũpa upe opacatu pe rese yepi. Iyavei oremahenduha pe rese ore yeruresa pɨpe.
66006004	Violence	Ipare osẽ cavayu pĩra vahe, ahe ava iharɨ pendar oipɨsɨ pĩratasa mbahe tuprɨsa rerocua ãgua ɨvɨ pɨ̃pendar ava sui ‘toyeyuca-yuca tẽi yuvɨreco’ oyapave. Ipare imondosa quɨse pucu chupe.
54006001	Recommendation	Iyavei co ava mbiguai Jesús reroyasar, ahe oyeroya tuprɨra güerecuar yuvɨreco ava oñehe-ñehe tẽiẽhɨ ãgua Tũpa rer rese, yande porombohesa rese avei no.
51003009	Recommendation	Ndaperemirai chira peyese. Esepia, pepoi yɨpɨndar pe reco ai sui iyavei pe rembiapo ai sui.
66002020	Sin	Oime rumo mbahe pe rembiavɨ: peñemosaño evocoi cuña Jezabel pe pãhu pendar upe, ahe acoi oñehe tẽi angahu vahe Tũpa rese viña. Ahe rumo ombopa tẽi oporombohesa pɨpe che rembiguai iyemboaguasa-guasa tẽi uca ãgua sereco iyavei ohu uca mbahe roho mbahe rahanga tẽi upe seropovẽheprɨ yuvɨreco chupe.
48003008	Grace	Iyavei Tũpa Ñehengagüer icuachiaprɨ pɨpe omombehu ité senondeve Tũpa oipɨsɨ aveira opacatu oyese oyeroya vahe ndahei vahe judío co ɨvɨ pɨpendar oyeupe nara. Iyavei omombehu co ñehesa icatuprɨ vahe Abraham upe: “Opacatu ava ɨvɨ pɨpendar sovasaprɨra yuvɨreco nde sui” ehi.
58012005	Recommendation	Peresarai eté Tũpa pe mboaracuasa sui tahɨr ité pe recosa pɨpe; icuachiaprɨ aracahendar pɨpe aipo ehi: “Che rahɨr, eyemoingatu voiño Yar nde mombaraɨsusa upe nde reco mohɨvi tuprɨ ãgua, iyavei, ‘Ndachequerẽhɨ iri’ nderei chiaveira chupe ndeu oñehe pĩratase.
58013017	Recommendation	Pemboyeroya pe cuaisar, peyapo semimbotar. Esepia, ahe ndopɨtuhui eté pe recocuer rãro yuvɨreco. Esepia, oicua Tũpa oicuara mbahe sembiapo rese chupe curi. Sese pemboyeroya catu ‘tayavai eme iporavɨquɨsa chupe; tasorɨvete oporavɨquɨsa rese yuvɨreco’ pe yapave. Pemboavaise rumo, nosei chietera mbahe avɨye vahe ichui pe recocuer upe nara.
44013019	Description	Ipare omocañɨ ava eta Canaán pɨpendar siete tuprɨ yuvɨrecoi vahe serecuar reseve-seve. Ipare omondo Canaán ɨvɨ yande ramoi upe nara.
54006003	Faith	oimese oporombohe vahe oyesuindar pɨhañemoñetasa co cotɨ tẽi vahe rese, ndoyoyai vahe yande Yar Jesucristo porombohesa avɨye vahe rese, ndoyoyai vahe avei yande yembohesa Tũpa rese yande yeroya tuprɨsa rese,
63001010	Recommendation	Acoi oyepotase ava oporombopa tẽi vahe pẽu, ndovɨrecoi vahe co porombohesa, ndapeipɨsɨi chira pe rẽtave. Iyavei ndapemboavɨravei chiaveira.
47001005	Grace	Esepia, inungar Cristo imombaraɨsuprɨ secoi, ẽgüe yahe aveira imombaraɨsuprɨ yaico yaicose sese. Cristo sui avei rumo oime itera vɨhasa yandeu.
65001011	Sin	¡Iparaɨsu yuvɨreco! Caín recocuer rupi tuprɨ avei oyapo mbahe yuvɨreco. Inungar Balaam guarepochi pota raisave tẽi oyavɨ güeco yuvɨreco. Inungar Coré omano oporeroyaẽhɨsa pɨpe.
65001010	Sin	Evocoi ava pe pãhu pendar rumo oñehe tẽiño vahe que mbahe ndosenducuai vahe rese yuvɨreco. Iyavei co mbahe oicua vahe oyesui tẽi inungar mbahe mɨmba ndipɨhañemoñetai vahe oyesui tẽi imbahecua, ahe oiporu yuvɨreco oyemocañɨ ãgua tẽi.
58011007	Faith	Noé avei oyeroya Tũpa rese. “Oimera mbahe tẽi co ɨvɨ pɨpe ndapesepia vɨtei vahe” ehise chupe, vɨroya voi eté. Evocoiyase seroyasave oyapo arca oyesuindar pɨ̃sɨro ãgua. Iyavei sese oyeroya pɨpe omombehu ava co ɨvɨ pɨpendar cañɨ ãgua. Ahe rumo Tũpa rese oyeroya pɨpe oñepɨsɨro.
58009006	Description	Evocoi nungar mbahe moingatuprɨ pare, pahi eta yuvɨroiqueño yɨpɨndar oɨ asɨaprɨ pɨpe arɨ rupi ocuaita apo ãgua.
44007051	Sin	Ichui aipo ehi chupe: “Pe rumo ndapeyapɨsaca potai vahe ité peico. Oime tẽi pe nambi, pe pɨha avei, ipɨpe rumo ndapeicuai eté Tũpa. Peico Espíritu Santo amotarẽhɨmbar tẽi inungar pe ramoi aracahe yuvɨrecoi.
54001009	Sin	Yaicua avei acoi porocuaita ndahei ava avɨye vahe upe nara. Ahe rumo ndiporeroyai vahe mboaracua ãgua, ndayaracua potai vahe upe nara, angaipa viyar upe nara avei, iyavei opacatú mbahe-mbahe tẽi aposar upe nara, nomboetei vahe Tũpa iyavei chupendar pɨhañemoñetasa; acoi vu, osɨ oyuca vahe; opacatu ava oporapichi vahe upendar.
46005009	Recommendation	Ambuae aicuachía vahe pɨpe aipo ahe pẽu: “Ndapemborɨi chira ava oyemboaguasa-guasa tẽi vahe, acoi ava oipota rai vahe ambuae ava mbahe, imonda rai vahe, iyavei ava mbahe rahanga upe tẽi oyerure vahe” ahe. Co che ñehesa rumo ndahei Tũpa ndoicua vɨtei vahe upendar. Esepia niha, pe yepepɨ ãgua ñepei reseve evocoi nungar ava sui, pesẽ itera co ɨvɨ pɨpe sui viña.
48001015	Grace	Tũpa rumo yɨpɨve che ha vɨteẽhɨseve che poravo oyeupe nara. Iyavei oporoaɨsusa pɨpe che renoi güemimbotar rupi.
45007015	Description	Che rumo ahese ndaicuai mbahe oime vahe cheu. Esepia, che remimbotar ayapo pota vahe ndayapoi; mbahe che remimbotarẽhɨ rumo ayapo.
61003018	Faith	Peicua tuprɨ catura rumo yande Yar Poropɨ̃sɨrosar Jesucristo iyavei peicoveño itera iporovasasa pɨpe. ¡Ẽgüe tehi imboeteiprɨ tasecoi cũritei apɨrẽhɨ vaherã! Aipo rupive che ñehe pẽu.
46004010	Description	Iyavei, “Co ndayaracuai vahe” ehi rutei ava yuvɨreco oreu Cristo rese ité ore recose; ahese avei rumo pe peyeapo imbahecua eteprɨ vahe peico Cristo rese pe recosa pɨpe. Iyavei ore ndoyavɨi ndaseco pĩratai vahe oroico ava rembiepiave; aheseve avei rumo peyeecomomirata tẽi peico. Ore seroɨ̃rombrɨ tẽi oroico, pe evocoiyase ava pe mboetei guasu pe rereco yuvɨreco.
60005009	Faith	Sese peyemovɨracuara Tũpa rese pe yeroyasa pɨpe Caruguar upe. Esepia, peicua niha opacatu rupi avei yande rɨvɨreta Tũpa rese yuvɨrecoi vahe iparaɨsu co nungar mbahe pɨpe.
51003022	Recommendation	Pe avei no mbiguai: peroya tuprɨ avei pe rerecuar co ɨvɨ pɨpe yepi. Aní chira ahe pe repiaseño pembovɨhara. Iyacatu rumo pemboyeroyara pe pɨhañemoñeta tuprɨsa pɨpe, Tũpa sui pe sɨquɨyesa pɨpe avei.
66017012	Description	“Evocoi diez tuprɨ vahe sãchi, ahe mborerecuar diez tuprɨ ndoyuvɨroique vɨtei vahe oporocuai vaherã yuvɨreco. Oyoya rumo oporocuai raimi tẽira mbahe ɨpɨ vai reseve yuvɨreco curi.
46002012	Grace	Yande evocoiyase ndahei co ɨvɨ pɨpendar tẽi espíritu yaipɨsɨ, ẽgüe ehi rumo Espíritu Tũpa suindar yaipɨsɨ yaicua vaherã iporerecosa oporoaɨsusa pɨpe ombou vahe yandeu.
59005001	Recommendation	¡Pe mbahe yar, pesendu co: peyaseho iyavei perãse! Esepia, peiporarara mbahe tẽi peico.
66002010	Recommendation	Ndapesɨquɨyei chira pe paraɨsu ãgua sui. Esepia, Caruguar osoquenda ucara amove pe pãhu pendar secoãha ãgua; pe paraɨsu rane itera niha diez arɨ rupi peico. Acoi peyemovɨracua tuprɨse ité chupe, Cristo rese ité amanora, pe hesave, ahese amondora porerecosa tecovesa pẽu.
54006011	Recommendation	Nde rumo, Tũpa rese ereico vahe, eyepepɨ opacatu co nungar mbahe naporai vahe sui. Eico nde reco ɨ̃visa pɨpe, ndemahenduhaño ité Tũpa rese. Eroya, esaɨsu, eñemosa avei eico nde reco mbegüesave.
59005005	Sin	Co ɨvɨ pɨpe tẽi pe peyeecomoendɨyai peico iyavei peyembovɨha co ɨvɨ pɨpendar mbahe rese inungar guaca imonguɨraprɨ yuca ãgua. Ipɨpe peyemoingatu pe cañɨ ãgua.
66004004	Description	Iyavei asepia evocoi rese oyere tuprɨ ambuae veinticuatro tenda, ahe iharɨve oguapɨ yuvɨnoi veinticuatro avei icuaiprɨ yuvɨrecoi vahe; iturucuar morochí vahe yuvɨreco iyavei oãca rese omboyere tuprɨ oro apoprɨ yuvɨreco.
66018007	Description	pemondo setecuer mombaraɨsusa chupe, tiparaɨsu tahoyoya iyemondo-mondo tẽi agüer iyemboetei ai agüer rese avei no. Esepia niha, ahe aipo ehi opɨha pɨpe oico: ‘Cohave che aguapɨ vĩte mborerecuar che reco nungar pɨpe. Ndahei imer mano vahecuer che aico, iyavei ndacheparaɨsui chietera’ ehi viña.
60003007	Recommendation	Iyavei pe imer, pereco mbegüera pe rembireco upe. Pemboeteira sereco. Esepia, ahe nipirata tuprɨi, iyavei Tũpa omboura güeco tuprɨsa pɨpe tecovesa apɨrẽhɨ vahe oyoya voi pẽu. Ẽgüe peyese, Tũpa osendu itera pe yeruresa.
54002012	Recommendation	Ndaipotai cuña oporombohe ava rehɨi pãhuve iyavei toyocuai eme cuimbahe. Iyacatu rumo iquiririñora yuvɨreco.
46001009	Faith	Ahe acoi omboavɨye vahe ité oñehengagüer yande poravo Guahɨr yande Yar Jesucristo rese yande reco ãgua.
48005013	Recommendation	Esepia, pe ore rɨvɨreta, Tũpa niha pe renoi mbiguai tẽi nungar pe recosa sui pe renose ãgua. Ndahei chira rumo pe remimbotarai tẽi apo ãgua, iyacatu rumo peñepɨtɨvɨira pe yeaɨsusa pɨpe.
59002012	Recommendation	Evocoiyase peñehe tuprɨra iyavei peico tuprɨ aveira. Esepia, oporandura yande recocuer rese yande Yar oporocuaita pɨpe güeru vahe yande reco tuprɨ ãgua.
46012005	Faith	Setá mbahe avei oime mbahe yayapo vaherã yande Yar upe. Ahe yande Yar rumo ñepeiño ité secoi.
45009005	Description	Ahe avei niha yande ramoi yɨpɨndar vahe suindar yuvɨrecoi, Tũpa Rembiporavo Poropɨ̃sɨrosar avei ahe ichuindar oyesu vahe. Ahe Poropɨ̃sɨrosar niha Tũpa ité, ɨvate catu vahe secoi opacatu sui. Sese, ¡timboeteisa catu yepi! ¡Ẽgüe tehi apɨrẽhɨ!
47001006	Description	Ore paraɨsu pe mbovɨha ãgua ‘toñepɨsɨro yuvɨreco’ ore yapave. Iyavei Tũpa ore mbovɨha pe mbovɨha ãgua avei. Supi evocoiyase pe peñemosañora mbegüe rupi ore paraɨsu agüer nungar tuprɨ pe recose.
47001021	Faith	Tũpa niha opacatu yande momirata seseño ité yande reco ãgua, yande poravo avei.
44010015	Recommendation	Osendu iri ñehesa aipo ehi vahe chupe: “Tũpa remimbocatuprɨ upe, ‘Ava remimbotarẽhɨ, ndihusai vahe’ nderei chira” ehi.
66018009	Sin	Evocoiyase mborerecuar ɨvɨ pɨpendar yuvɨrecoi vahe co cuña resendarer, chupe oyemondo-mondo tẽi vahecuer imbahe eta rese, oyaseho tẽira yuvɨreco iyavei ndoyembovɨhai chira sese osepiase evocoi cuña rãtachi yuvɨreco curi.
43014023	Faith	Evocoiyase aipo ehi Judas upe: —Acoi che raɨsu vahe, omboyeroya vahe che ñehe yuvɨreco, che Ru evocoiyase osaɨsura iyavei che Ru reseve oroyura oroico vaherã sese.
62004010	Grace	Ndahei yande rane yasaɨsu Tũpa. Ahe rane rumo yande raɨsu iyavei ombou Guahɨr imano ãgua yande angaipa repɨrã. Ahe niha poroaɨsusa supi eté vahe.
62001007	Faith	Yaicose rumo tesapesa pɨpe inungar yande Ru Tũpa secoi tesapesa, evocoiyase yaico tuprɨra yandeyeupe. Iyavei suvɨ yande moatɨro opacatu angaipa sui.
48004007	Grace	Sese yande Tũpa rahɨr ité yaico, ndahe iri cũritei mbiguai tẽi nungar. Tũpa rahɨr yande reco pɨpe ahe ombou aveira oporerecosa yande mahera.
58001008	Faith	Tahɨr rese ñehesa rumo aipo ehi icuachiaprɨ aracahendar pɨpe: “Che Yar Tũpa, nde mborerecuasa rumo apɨrẽhɨ vaherã ité. Ereporocuai nde reco ɨ̃vi tuprɨsa pɨpe yepi.
43010033	Sin	Judío rerecuareta omboyevɨ yuvɨreco chupe: —Nande api-apisai chira ita pɨpe que mbahe nde rembiapo avɨye vahe rese. Co rese rumo ẽgüe orohera ndeu. Esepia, nde ereñehe rai tẽi Tũpa rese. Nde moco ava tẽi ereico. Nde rumo ereyeapo Tũpa ndeyeupe ae —ehi yuvɨreco chupe.
66014011	Description	Tãtachi icaigüer pendar evocoiyase oyeupira ndopai vaherã, ahese ndipoi chietera pɨtuhusa pɨ̃tu, arɨ pɨpe evocoi mbahe ɨpɨ vai mboeteisar upe, sahanga mboeteisar upe avei no, iyavei acoi vɨreco vahe serer cuachiaprɨ oyese yuvɨreco no” ehi.
47004001	Faith	Sese, “Ndorequerẽhɨ iri” ndorohei eté. Esepia, Tũpa ore poravo ore paraɨsuerecosa pɨpe ore poravɨquɨ ãgua co ñehesa rese.
58013006	Faith	Evocoiyase aipo yahera Yar rese yande yeroyasa pɨpe: “Che Yar che pɨ̃tɨvɨi, ndasɨquɨyei chietera ava tẽi sui oyapo potase mbahe cheu” yahera.
45014003	Recommendation	Acoi ava opacatu mbahe ohu vahe, tovɨroɨ̃ro eme amove ndohui vahe mbahe iyavei acoi amove ndohui vahe mbahe, tovɨroɨ̃ro eme acoi ohu vahe opacatu mbahe. Esepia, evocoi nungar ava Tũpa oipɨsɨ ité.
45015005	Grace	Tũpa, acoi ombou vahe yande ñemosasa, yande pɨhamonguerẽhɨsa avei yandeu, tape pɨ̃tɨvɨi oyoya guasu pe reco tuprɨ ãgua ñepei-pei peyese Jesucristo recocuer rupi.
58007027	Description	Ndahei eté ambuae pahi eta nungar secoi, ndoyuca ranei arɨ yacatu rupi mbahe mɨmba Tũpa upe seropovẽhe ãgua yɨpɨndar oangaipa rese, ipare opacatu ambuae angaipa rese. Ñepei reseve ité rumo güete vɨropovẽhe opacatu ava angaipa repɨrã.
62003017	Sin	Acoi ava vɨreco tẽi vahe mbahe eta oyeupe nara, osepiaño tẽi rumo vɨvrɨ upe mbahe ipane vahe, iyavei ndoipɨ̃tɨvɨi, ahe ndovɨrecoi Tũpa poroaɨsusa oyese yuvɨreco.
47005008	Faith	Yande rumo yayeroyaño ité sese, iyavei yaipota ité yande retecuer reya ãgua yande Yar pɨri yande so ãgua ɨvave.
60002011	Recommendation	Che rɨvɨreta, che rembiaɨsu, peico raimi tẽi vahe co ɨvɨ pɨpe, pepoi opacatu co ɨvɨ pɨpendar pe pɨhañemoñeta raisa sui. Esepia, pemomara uca tẽi pe recocuer ipɨpe.
60002017	Recommendation	Pemboeteira opacatu ava. Pesaɨsu catu pe rɨvɨreta Jesús reroyasar; pemboetei Tũpa; pemboyeroya avei mborerecuar guasu.
44007025	Description	Ahe rumo, ‘Oicua revo che mu Tũpa vɨnose uca ãgua Egipto sui yuvɨreco cheu’ ehi viña. Imu rumo nomohai eté Moisés vɨnose ãgua yuvɨreco evocoi ava po sui.
50003002	Violence	Peñearo acoi ava cave nungar tẽi sui, oyapo vahe mbahe tẽi iyavei güetecuer omomara tẽi vahe.
56001016	Sin	Iyavei, “Che aicua Tũpa” ehi tuprɨ tẽi angahu yuvɨreco. Mbahe sembiapo rese rumo icuasa seroyaẽhɨsa yuvɨreco. Ahe niha ava ndosepia potai vahe, ndiporeroyai vahe yuvɨreco, ndoicatui mbahe avɨye vahe apo yuvɨreco yepi.
45010002	Faith	Supi eté iquerẽhɨ ité Tũpa upe mboravɨquɨ apo ãgua yuvɨreco viña. Oquerẽhɨsa sui rumo oyavɨ senducuaẽhɨsa pɨpe yuvɨreco.
47001004	Grace	Ahe niha yande mbovɨhaño opacatu yande paraɨsusa pɨpe, yande avei evocoiyase yaicatura ava iparaɨsu vahe mbovɨha ãgua yuvɨreco. Ẽgüe ehi eté Tũpa imbou vɨhasa yandeu, ahe avei yande yamondora yuvɨreco chupe.
55002015	Recommendation	Eyapo tuprɨ mbahe opacatu nde catugüer rupi nde recocuer mboyecua ãgua Tũpa rovai inungar oporavɨquɨ tuprɨ vahe, nochi vahe. Ẽgüe ere, eporombohe tuprɨ ñehesa supi eté vahe rese.
53002004	Description	Oyemboɨvate aira opacatu Tũpa rer rerecosar amotarẽhɨsave iyavei ndoipotai chira ambuae mboetei. Oique aveira, oguapɨ Tũpa rẽta pɨpe inungar-ra Tũpa ité viña. “Supi eté che Tũpa aico” ehi tuprɨ tẽira oĩ.
49006004	Recommendation	Iyavei pe iyesupa, pemoñemoɨro ucai rene pe rahɨr. Iyacatu rumo pemboacua imboaracuasa tuprɨ pɨpe, imbohesave avei yande Yar upe saɨsusa pɨpe.
45008037	Grace	Opacatu rumo co mbahe oimese yandeu, yasecopɨpa ité ahe yande raɨsusar recocuer pɨpe sui.
44026014	Violence	Orovɨapipase ɨvɨve, asendu ñehesa aipo ehi vahe hebreo ñehe pɨpe cheu: ‘Saulo, Saulo, ¿mahera vo ereyapo mbahe-mbahe tẽi cheu? Ereyapose evocoi mbahe tẽi, nde ae ereyemombaraɨsu’ ehi cheu.
66002009	Sin	Che aicua pe yemombaraɨsusa, pe paraɨsusa avei; pe rumo mbahe yar nungar ité peico ɨva pendar mbahe rese. Aicua avei pe rese ava semira tẽi vahe, ore Tũpa rembiporavo judío oroico, ehi tẽi vahe. Ndahei rumo ahe yuvɨrecoi. Esepia, Caruguar reroyasar tẽi evocoi yuvɨrecoi.
46013006	Faith	Ndahei mbahe tẽi rese oyembovɨha; ahe rumo oyembovɨha mbahe supi tuprɨ vahe rese.
59001021	Recommendation	Evocoiyase peseya teco raisa, opacatu ambuae oime vahe mbahe naporai vahe pe pãhuve. Co catu pe yemominisave peroya catu vɨte Tũpa ñehe omoingue vahe pe pɨha pɨpe. Ahe niha vɨreco pĩratasa pe pɨ̃sɨro ãgua.
46003006	Grace	che rane inungar añotɨ vahe mbahe rãhɨi pe pɨha pɨpe; Apolos evocoiyase inungar imboɨhusar; Tũpa rumo inungar omboorɨ vahe pẽu.
66014008	Sin	Ambuae Tũpa rembiguai ɨva pendar raquɨcuerindar aipo ehi oico: “¡Ovɨapi Babilonia guasu cute! ¡Esepia niha, evocoi opa ombosavaɨpo opacatu ambuae tecua pendar ohɨgua yemboaguasa tẽisa resendar pɨpe!” ehi.
43015014	Recommendation	Pe che mboyeroyase peye, ahese che mborɨpar peico.
62005021	Recommendation	Che rahɨreta, peñearo tuprɨ tũpa angahu tẽi sui. Aipo rupive co che ñehesa amombehu pẽu.
55003006	Sin	Esepia, evocoi nungar ava pãhuve oime yuvɨroiqueño tẽi vahe oɨ rupi cuña ndoicatui vahe angaipa rerecosar mbopa ãgua. Esepia, ahe cuña opɨhañemoñeta raisa pɨpe yuvɨrecoi vahe.
49004015	Faith	Yande rumo evocoiyase yañehera mbahe supi eté vahe rese poroaɨsusa pɨpe iyavei yaroya catu-catu irira Cristo opacatu yande recocuer pɨpe. Ahe niha yande rerecuar secoi.
49004003	Faith	Peyapo opacatu pe recocuer pɨpe peico tuprɨ vɨte ãgua peyepãhuve Espíritu Santo pe pɨ̃tɨvɨisa pɨpe, pe reco tuprɨsa pɨpe avei.
44009005	Description	Evocoiyase oporandu chupe: “¿Ava vo nde ereico, nde mbɨa?” ehi. “Che Jesús, che niha co che moña che rereco eve” ehi chupe.
60003015	Recommendation	Pemboeteiñora rumo Cristo pe Yar secosa rese pe pɨha pɨpe. Peyemoingatu voira ava pe remiaro rese oporanduse pẽu pe querẽhɨsa pɨpe imombehu tuprɨ ãgua.
44007033	Recommendation	Evocoiyase Yar aipo ehi chupe: ‘Esequɨi nde pɨtaqui. Esepia, ɨvɨ nimarai vahesave ereico’ ehi chupe.
62002024	Faith	Sese yɨpɨsuive pesendu vahe ñehesa peyapocatu pe pɨha pɨpe. Ẽgüe peyese, ahese peico tuprɨra Jesucristo rese, Tu rese avei.
43008051	Faith	Supi eté aipo ahe pẽu: acoi omboyeroya vahe che ñehe, nomanoi chietera yuvɨreco —ehi judío eta upe.
66020011	Description	Evocoiyase asepia tenda imboeteiprɨ, morochi vahe. Iharɨve oime ava oguapɨ vahe oĩ. Sovai ɨvɨ iyavei ɨva opa ocañɨ tuprɨ tẽi. Ndoyecua iri eté co cotɨ rupi yuvɨreco.
46006013	Recommendation	Supi eté niha aipo ehi vahe: “Yande rembihu yande avɨter upe nara, yande avɨter evocoiyase yande rembihu upe nara” ehi. Coiye rumo Tũpa opara omocañɨ evocoi nungar mbahe. Yande retecuer rumo ndicuaitai yaguasa tẽi vaherã, ahe rumo yande Yar upe nara. Yande Yar evocoiyase yande retecuer upe nara secoi.
45006011	Faith	Ẽgüe peye avei pe, “Che omano vahe nungar aico angaipa upe” peyera; “Che rumo Tũpa upeño ité aicovera yande Yar Jesucristo rese che recosa pɨpe” peye aveira.
47002014	Faith	Avɨye yande Ru Tũpa upe. Esepia, yande Cristo rese yaico vahe yande renose oamotarẽhɨmbar povrɨ sui opacatu ava rembiepiave iyavei yande recocuer sui opacatu ava upe oicua uca güecocuer inungar mbahe sɨ̃acua vahe yasẽtu vahe opacatu rupi.
62001005	Grace	Iyavei Jesucristo ore mbohe co ñehesa rese, ahe oromombehu pẽu: yande Ru Tũpa niha tesapesa secoi; ndipoi eté pɨ̃tumimbisa sese.
43006037	Grace	Opacatu ombou vahe ava che Ru cheu, cheu ité yugüerura; acoi yugüeru vahe cheu, aipɨsɨra; ndamomboi chietera cheyesui.
58013001	Recommendation	Ndapepoi chietera pe yeaɨsusa sui ñepei-pei oyeɨvrɨ nungar pe recosa pɨpe.
