44002033	Description	Wamba Dapitito pii mindi leane oko loto, Akali Andane Goteto nambana Akali Andane oko pii mindi lamawuato, nambato nimbana yanda-pene tupa nimbana pangosa ateakale lokalenga, nimbato nambana kii tikasa epo atape leaipia. Balato wuane leane tekeko, Jisasa bala ati kenga peane wuane pua, Dapiti bala ati kenga napeaipia. Jia. Goteto Jisasana gene oko laiyu loto, bala ati kenga epeakale lo moto, balana kii tikasa ateakale leaipia. Wuane lalu, wamba Ayiane Gote okomane potomisa pii mindi loto, Oli Sipitisa oko mauwakale leane okone balato Jisasanga mayaepia. Maya-kola, andipa Jisasato Oli Sipitisa okone wandakali utupanenga gae lala-kola, utupane-mane pii waka-waka leyai-kola, yakamato ale wato, andeyai okoni.
51003010	Recommendation	
43011004	Faith	Wuane leapele okone ale wato, Jisasato pii mindi loto, Goteto Lasatosa bala mee omeakale nembo toto, siki okone balanga epeakale lo ando konda nayane. Jia. Wandakali-mane Gote Iwanane okona gene oko laiyu leakale nembo toto, Goteto balana tai-lene oko andawa loyale, siki okone Lasatosa balanga epeakale lo ando konda yane lea.
45001017	Faith	
45012006	Faith	Wamba Goteto nanima ondowa moyoto, balana piape waka-waka pulane mana mindipene-mindipene tupa tale puato, mana minditupa nanima mindiki-mindiki lo mee geane nembo toto, nanimato balana piape utupane pua atape-pene. Mindimane Gotena pii oko wandakali tupa lamauwa ateakale nembo toto, Goteto balana piape pulane mana tupa wandakali okone maiyae yando, wandakali okonemane bilipi lola pua Gotena pii oko wandakali tupa lamauwa atape-pene.
66004007	Description	Minditaka saka atene ateaini utupanena bulupane oko pusi andane gene layone okonepene gulene mindi atea. Lapone oko yia bulumako andopane yale mindi atea. Tepone okona lee-inga oko wandakalina lee-inga atene yale mindi atea. Tukuni oko eka aiyawe yale mindi yuu lo epoko pua atalane mindi atea.
49005015	Recommendation	Andipa nanima gii koo okona ateyama nembo toto, yakama mini napalene kee ene gulo ata na-piyapape. Akali Andane okomane nanimato wua pipiai lakae lo nembo talane tupa nembo tatawa atalapape. Mangene utupane nembo tatawa atoto, yakamato Gotena piape pulane oto eya tupa mee apia napene, balana piape pulane eya utupane pua atalapape. Balana piape pua atoto, yakama mana anda napene wandakali ata na-piyapape. Jia. Yakama mana andene wandakali atoto, mana anu-pene tupa minu ateyamape lo wayumane ando atalapape.
45010012	Grace	
45010004	Faith	
50004006	Recommendation	Tene okonena, kenda-pene mindi yakamanga epolopeya nembo toto, yakamato nembo kambua mia na-piyapape. Jia. Ole dindi lo Goteto yakama moyalane nembo toto, yakamato bala wayu pele lalapape. Wuane lalu, balato yakama dee lapone moyakale lo pote loto, yakamanga kenda-pene yolane tupa pitaka bala lamai-yapape.
46010006	Faith	Okone angi, wandakali utupanena minditupa-mane Gote andayo mulu-mulu leai-kola, peyo ome lalane enjole mindimane utupane peyo ome leaipia-ko. Utupane-mane Gote andayo mulu-mulu leaini pua, yakamato bala andayo mulu-mulu lalaini mana oko kondalapape. Alu mindi wandakali kambua-mane Gote minu mandeke peai-kola, balato utupanena mana koo okone embo wete wato, etulu koo gepo tupamane utupane no omaya yaepia-ko. Nanimato utupanena mana koo okone wato minuto, Kataisa minu mandeke piyamane mana oko kondamakale. Gotena pii pepa pelene eya mindimane temane waka mindi loto, wandakali tupamane owato gote mindi lo opa maiyu, tomo ipapi no pitiyu, pamuku pulu makale lo ika leaini layene eya. Utupane-mane wuane peai-kola, wandakali (3,000) tausene tepo omeainipia-ko. Wandakali utupane-mane owato gote okone lotu leaini pua, yakamato owato gote minditupa lo lotu lalaini mana oko kondalapape. Alu mindi wandakali kambua-mane pamuku peai-kola, ole mindikina Goteto akali (23,000) tausene paiyasa laponga tepo peyo ome leaipia-ko. Akali utupane-mane pamuku peaini pua teke, nanimato pamuku napene, kondamakale. Isatale tane wandakali nanimana yumbane tupamane mana koo utupane wato minaima lakae lo nembo teaini pua, nanimato mana koo tupa wato minaima lakae lo nembo natape-pene lo nanima andawa loyale, Goteto koo peaini wandakali utupane peyo ome leaipia.
66009002	Description	Maya-kola, kaiyanda okonemane yuu kundu koo okonena asia lomba oko lumbea. Asia okone lumbea-angi, wandakali-mane tata andane kambua yangeyai-kola, ita tua andane kambua piyane wuane pua teke, tua andane wetete mindi yuu kundu koo okona atoto, kamaka epea. Kamaka epoto, ati kenga okona kulayoko loto, yame peya mangua ya-kola, nai oko alu puato, undupi lamangua ya.
52004006	Recommendation	Akali Andane okomane mana koo wato minalaini wandakali tupa yole koo mindi maiyane lo wamba nanimato yakama langema. Tene okonena, wandapi, akalipi, yakamato wandakali yangone mindi andakasa wato, wandakali waka mindi balana wetenepi, akalinipi, utupane gitisa loto, mia mai na-piyapape. Jia.
47005017	Faith	
43005020	Faith	
49004028	Recommendation	Pake nene wandakali tupamane dee lapone pake naa nape-pene. Jia. Utupane-mane wandakali tipia tupa moyo minditaka tupa tale pua mai-makale nembo toto, yakamana kini-mane piape epene tupa tailo pua atape-pene.
57001022	Recommendation	Wuane lalu, nambato pii mindi konda pua leyo. Namba katapusa ateyo-kola, yakamato Gote lo pote leyai okone Goteto ale wato, namba yakama ateyainga puu lolopeya nembo teyo-ko. Namba pangulane panda mindi nimbato mandeke pingepe.
58013009	Recommendation	
52005012	Recommendation	Amene imalini yame, akali minditupa-mane yakama moyo ando ateakale loto, Akali Andane okomane akali utupane ate leane. Akali utupane-mane Gotena piape puato, yakamato wua piyapape lo mana langua atalaini.
43009022	Description	Wamba Juta yame akali utupane-mane pii mindi lo yake puato, wandakali mindimane Jisasa bala Mesaya oko ateya leaindo, bala nanima towa atu lotu lo ata napeakale. Nanimato bala peyo watamakale leainipia. Tene okonena, akali okonena angini, ayiane-la, okonelapo-mane Juta yame akali utupane yuku wato, nalipana iwanane oko bala akali mini-yene mindi ateya-ko. Yakamato bala tipa piyapa leapelepia.
50003003	Faith	
62003023	Faith	Wamba balato loo mindi yata wato, nanimato balana iwanane Jisasa Kataisa oko lo bilipi loto, mindi akali towa epele aka pua yamapane yo atape-pene leaipia. balato nanima langeane pua, nanimato mana okonelapo wato minu atape-pene
66013011	Description	Okone angi nambato andewa-kola, yia kapua mindi-pene mindi yuu pangosa paliyu kamaka epea. Balana kawanenga nene lapo ateane okonelapo sipisipi andopane tupana kawanenga nene atalane okonepene guleane tekeko, pii leane oko puya andane wete tupamane pii taimane lalaini pua lea.
46014020	Recommendation	Andopane kambolo tupamane mana koo tupa wato mina-makale nembo natalaini pua teke, amene imalini yame yakamato mana koo tupa wato mina-makale nembo na-talapape. Nambato wuane leyo tekeko, andopane kambolo tupamane Gotena pii oko nembo natalaini pua teke, yakamato Gotena pii oko nembo natene gulo ata na-piyapape. Jia. Yakama wandakali wai-ene atoto, Gotena pii oko kuai lo nembo tatawa atalapape.
59005013	Recommendation	Yakamana mindi balanga kenda-pene mindi yando, balato Gote ando pote lape-pene. Yakamana mindi bala epelewa ateando, balato Gotena gene oko laiyu lo soŋo lape-pene.
58012012	Recommendation	Jisasa towa yanda-pene wandakali tupamane Kitisene wandakali tupa kenda-pene kambua mai-yaikola, Kitisene wandakali utupane yakamana kini kenepi tai nalene manda tene atalaini. Yakamato wandakali utupane mo tai laya alapape.
60001017	Recommendation	Yakamato pote loto, Gote ando Ayiane lalaini. Ayiane okonemane wandakalina gene oko andoto, yapa lo tale napiyane. Jia. Balato wandakali nanima mindiki-mindiki lo nanimana mana minalamane tupa andoto, nanima yapa lo tale piyane. Tene okonena, yakama yuu okona ateyai-angi, yakama atapowa atolane yuu oko ati kenga eya nembo toto, yakamato Gote yukuwa epelewa atoto, balana pangosa atalapape.
58010036	Recommendation	
58011001	Faith	Gote lo bilipi lene mana oko wua pene eya: Gote lo bilipi lene wandakali-mane mangene epene Goteto pukale leane tupa lee-mane anda na-piyaini tekeko, utupane-mane mini lapo pali napene, mangene epene Goteto pukale leane utupane katulo pulupeya nembo toto, maliyo atoto, bilipi leyama nayu lalaini.
49004017	Recommendation	Tene okonena, nambato Akali Andane okona gene oko loto, pii mindi yakama langeyo. Aitene wandakali tupa nembo napalene gulo atoto, mana koo tupa minu atalaini okonena, Kitisene wandakali yakamato aitene wandakali utupanena mana koo utupa wato mina na-piyapape leyo.
51002016	Recommendation	Wamba Juta yame wandakali tupamane tomo ipapi utupanena minditupa nanene konda yainipia. Dee Sambasa angipi, ana wenene peke leya-angipi, gii andane waka minditupa epeya-angipi, gii utupane epeya-kola, Juta yame wandakali tupamane lotu lalainipia. Utupane-mane wuane piyaini okonemane minditaka angini oko matili epolopeya lo makande pua piyaini tekeko, minditaka angini okone Kataisa bala epeaipia. Tene okonena, wandakali mindimane yakama languato, tomo ipapi utupanena minditupa naa na-piyapape leandopi, lotu oko angi lalapape leandopi, yakamato balana pii okone ale wato, wato mina na-piyapape.
66007015	Faith	Tene okonena, utulu otongapi, wandakali utupane-mane Gotena lotu anda epene wete okona atoto, balana piape pimai-yaini. Bala pitiyane toko okona wenonga atoto, utupane-mane bala lo lotu lolai-kola, kiŋi pitiyane toko okona pitiyane Gote okomane utupane towa atu atoto, moyo ando atolopeya.
44020010	Description	Manda tene ya-kola, Polo bala anda lumu kenga wete ateane okonena atoto, yuunga kili loto, iwana manda tene yane okonena tokonga paluto, bala minea. Minalu, balato wandakali tupa lamawuato, iwana oko saka ateya-ko. Yakamato anu pimape lo yuku-mane omolaini lea.
55002010	Faith	Wamba Goteto wandakali minditupa balana yame ateakale lata ya-kola, Jisasa Kataisato piape peane mambele, wandakali utupane bala towa atu ati kenga yuu tii-pene okona atapowa ateakale nembo toto, nambato kenda-pene nambanga epalane tupa pitaka awua atalawane.
60005014	Recommendation	Yakamato Kitisene wandakali waka tupa towa epelewa yamapane yoto, sikane lalapape. Yakama pitaka Kataisa towa atu atoto, mini epene palu atalapape.
49005021	Recommendation	Wuane puato, Kataisa bala yakama pitakana Akali Andane oko ateya nembo toto, yakama mindiki-mindiki lo wandakali yangone tupana pangosa atalapape.
61003017	Recommendation	Nambana yamapane yene yame, Gotena loo tanga lalaini wandakali utupane-mane epoto, owato pii mana minditupa yakama langulu-peyai oko yakamato nemboto ateyai okoni. Utupane-mane wuane puato, yakama kilau lo molai-kola, yakamato yakamana bilipi oko awua tepa olomane. Tika ando atalapape.
51003018	Recommendation	Wanda yame yakamato yakamana akalini tupana pangosa pituto, utupane-mane pii lolai tupa ale amawua pitiyapape. Yakamato wuane pua peateaindo, Akali Andane okona wenonga yakamana mana okone tika-pene yolopeya.
54005020	Recommendation	Enene, balato mana koo okone minu atalae yando, Gotena piape akali waka tupamane mana koo mindi minuyale yuku yakale nembo toto, Gotena piape akali pitakana wenonga Timoti nimbato piape akali okone lo tika puato, nimbato mana koo minu atelene oko kondaa lape.
45014013	Recommendation	Goteto nanima pitaka yapa lo tale pulupeya nembo toto, matili nanimato mindi akali yapa lo tale piki pua ata napene, kondamakale. Kondalu, Kitisene yangone mindimane koo mindi peakale lo nanimato bala mo piya aa napimakale lo pii lo yake pimakale.
45002010	Grace	
58011034	Violence	
48006017	Faith	Wamba nambato Jisasana piape pua atewa-angi, wandakali minditupa-mane namba peleai-kola, andipa nambana umbaininga panju minditupa eya-ko. Galesia tane wandakali yakamato kenda-pene waka mindi konda pua namba gulaini. Tika ando atalapape.
66018021	Violence	Wuane lea-kola, matili enjole tai-lene mindimane ana andane wetete mindi minaiyu loto, ipa solewata okona taimane peya amo loto, Bapilone tane wandakali tupa lamawuato, wua lea: Wamba yakamato posini pua atoto, yuu yoo peya tupa pitakana wandakali tupa minakasa yai. Wuane puato, yakamana bisanisa piape piyaini wandakali tupamane yuu waka tane wandakali tupa pitaka sia minuto, gene andane yene ateai. Dee, yakamato potopesa akali tupapi, Gotena wandakali tupapi, utupanena minditupa peyo ome laka piki pua ateai okonena, koo tene mindi yakamanga eya. Yuu waka tupa pitakana wandakali minditupa-mane wandakali minditupa peyo ome leaini okonena, koo tene okone Bapilone tane wandakali yakamanga eya teke. Tene okonena, nambato wua leyo. Nambato ana andane oko ipa solewata okona taimane peya amo lalo-kola, latako piya. Wuane pua teke, matili Goteto Bapilone tano andane oko taimane peya amo lola-kola, tano okona wandakali atalaini tupa latako pulupeyai. Wuaneko, matili-matilipi gitapi, pupepi, biakulupi, musikipi, utupanena mindi peyolane wandakali mindi tano okonena ata napulai-kola, mindimane musiki ale na-olopeya. Minditaka waa piyaini wandakali mindi ata napulu-peya teke. Dee, witi dini minu kokope lolane wandakali mindi ata napula-kola, witi dini minu kokope lalane ana oko gili galo laa napulu-peya teke. Wanda kee lolane akalipi, akali polane wandapi, okonelapo tano okonena pii lo ata napulu-peyapi teke. Wandakali mindikipi mindi tano okonena ata napulai-kola, tano okonena lamu mindikipi mindi taa napulu-peya. Enjole okonemane wuane lea.
65001020	Faith	Akali utupane-mane wuane piyaini tekeko, Kitisene enene yame yakamato Gote bilipi leyama nayu lalapale loto, balato bilipi okone yakama geane-ko. Yamapane yene yame, yakamana bilipi okone tai guleakale loto, ole dindi lo yakamato Oli Sipitisa okona tai-lene oko moto, pote lo atalapape.
45012002	Recommendation	Yakamato wandakali waka tupana mana koo tupa wato mina na-piyapape. Jia. Goteto mana anu-pene tupa epele wete wato, utupane epene tika-pene wete lalaepe lo yakamato andamakale nembo toto, Goteto yakamana nembo-tene tupa mo wenene gulaya yakale atalapape.
46015009	Sin	Wamba namba aposolo akali ata napewa-angi, nambato kenda-pene andane minditupa Gotena sosa oko maiwane okonena, andipa aposolo akali waka tupa pitakana namba napinga ateyo-kola, wandakali-mane namba aposolo akali ateya nalape-pene. Jia.
62002015	Recommendation	Wandakali-mane minditaka lee-mane andoto, miama lakae lo nembo talaini. Dee, wandakali tupana umbaini-mane mana koo tupa minaima lakae lo nembo talaini teke. Wandakali-mane lipinga yale ateyama nembo talaini teke. Ayiane Gote balato yuu okona mana koo utupane mina ika naleaipia. Jia. wandakali-mane mana koo okonepene tupa mina ika leainipia. Wuaneko, yuu okona mana koo utupane epelewa yamapane yo atalane wandakali okomane Ayiane Gote oko towa epelewa yamapane yo ata napiyane. Goteto nembo teya pua piyane wandakali oko bala saka atapowa atolopeya tekeko, yuu okona minditaka eya tupa pitakapi, minditaka eya utupane miaima lakae lo nembo talamane mana okopi, utupane pitaka koyo pulupeya. Tene okonena, yakamato yuu okona mana koo utupanepi, yuu okona minditaka eya tupapi, utupane epelewa yamapane yo ata na-piyapape.
45002001	Sin	Yakamana minditupa-mane yangone tupa yapa lo tale puato, utupanenga koo tene eya lalaini tekeko, nambato wuane lalaini wandakali yakama pitaka mindiki-mindiki lo pii mindi langeyo. Wandakali waka utupane-mane mana koo minditupa wato minalaini wuane pua teke, nimbatopi mana koo utupane wato minalene leyo. Tene okonena, nimbato wandakali yangone mindi yapa lo tale puato, balanga koo tene eya lole okonemane nimbato nimba tanenga koo tene okone eya lole-kola pulu-peyako. Nimbato nimba tanenga koo tene mindi naeya katulo nalolo-pele.
48002009	Description	
43019023	Description	Gotena pii pepa pelene eya mindimane loto, akali utupane-mane nambana tona tupa tale pua moto, nambana tona luu oko apito meyape andoyale tasu peleai layene eya. Pii okone enene guleakale nembo toto, Goteto ami yanda yene tukumindi tupana nembo-tene oko mina ika lea-kola, utupane-mane Jisasa bala ita malamanda okona peyo yuka yai-angi, balana tona tupa yomo tukumindinga tale puato, yakama mindiki-mindiki lo yomo mindi meai. Utupane-mane wuane peaini tekeko, balana tona luu piyane okone tambu latane ata napene, mee lapa-lapa mindiki angu-mane luu puyoko latane ateanga andeai. Andoto, ami yanda yene utupane-mane yakama teke-teke pii lalawa puato, nanimato tona luu oko minu lete nalene, apito meyape andoyale, nanimato tasu peyamakale lalu, utupane-mane tasu peleai.
45002021	Sin	Yakamato wandakali waka tupa mana lamawua ateyai-ko. Anu peakale yakama tane mana mia na-piyainipe. Yakamato wandakali waka tupa lamawuato, yakamato pake mia na-piyapape loto teke, anu peakale yakama tane pake mialainipe.
46006019	Faith	Goteto yole andane wete mindimane nimba kambo molo-peke lea-kola, nimbana umbaini oko nimba tanena jia. Goteto balana Oli Sipitisa oko nimba gea-kola, nimbana umbaini oko Oli Sipitisa okona anda ateya. Yakamato wuane nembo nateyaipe. Wuane nembo toto, nimbato mangene mindi pule-angi, nimbana umbaini-mane Gotena gene oko laiyu lo atape.
47005014	Grace	Saka ateyama wandakali nanimato nanima tane angu epele amakale nembo natape-pene. Jia. Akali nanima moyo omalu, ika leane okomane epele yakale nayuto, nanimato balana piape pua atalapale nembo toto, Kataisa bala wandakali pitakana panda moto omeaipia. Bala akali mindiki okomane wandakali pitakana panda moto omeane okona, Gotena wenonga wandakali nanima pitaka omene teke gulo atema. Tene okonena, wandakali mindi bala Kataisa towa mina mindiki lo atoto, omene gulo ateando, mana koo balato wamba minu atalane tupa alu piyane. Goteto wandakali okone mo wenene gulaya eya-kola, mana wenene minditupa balanga yalane. Wamba nanimato mana wambane oko wato minuto, wandakali waka tupa yapa lo tale pua atemane tekeko, Kataisato wandakali pitakana panda moto omeane oko nembo toto, andipa nanimato wandakali tupa yapa lo tale napeyama. Jia. Wamba nanimato mana wambane oko wato minuto, Kataisa yapa lo tale pua atema tekeko, andipa nanimato mana okone wato minuto, bala yapa lo tale napeyama. Kataisato nanima yamapa yo atoto, nanima moyo piape utupane pitaka peane oko nembo toto, nanimato balana piape oko pimakale nembo teyama.
58003001	Faith	Jisasa bala akali enene mindi atoto, Gotena pitisa akali kawane atalu, aposolo piape piyu, piyane lo nanimato lapana alamane. Kitisene amene imalini yame, Gote ati kenga ateya okomane yakamapi ee lo mea-kola, Jisasato yakama moyo Gotena piape utupane piyane lo yakamato wayumane nemboto atalapape.
44020035	Recommendation	Wamba Akali Andane Jisasato pii mindi leane oko loto, wandakali mindimane minditaka mindi mialu atoto, epele ape-pene tekeko, wandakali mindimane minditaka mindi wandakali waka mindi maiyu atoto, epele wete ape-pene leaipia. Yakamato Jisasana pii okone nembo toto, wandakali tai nalene tupa moyo piape piyapale lo yakama andawa lokale nembo tewa. Nambato wuane nembo toto, namba tanena kini-mane piape puato, nambato minditaka jia yene wandakali tupa moyo, minditaka maiki pewa leaipia.
58013004	Recommendation	Goteto pamuku pima epoko piyaini wandakali tupa yapa lo tale puato, yole koo mindi malupeya. Tene okonena, akali-mane wanda kee lalu, wanda-mane akali pulu, piyaini mana okone epene tika-pene yakale loto, wetene, akalini-la, mina mindiki lo pitiyaini mana okone minu koya na-piyapape.
43020005	Description	Peakaiyu lalu, bala tombawua loto, mali anda-pangosa andandaka lo andea-kola, Jisasa mali puyale lapa-lapa mindimane bala puta pua ombo yaini tupa mee yanga andea tekeko, disaipolo okone bala ana anda mali kua-pene okona anda-pangosa kolandaka nalea. Jia.
66016018	Description	Wuane lea-kola, yuu tapale puato, ati kulu lea-angi, yuu yundukumi andane wetete mindi minuto, yuu oko dii-dee lea. Wamba bulupane tewa wandakali yuu okona palu ateai-angi atoto, ipapo wato, andipa ateyama okona giau loto, yuu yundukumi andane wetete mineane okonepene mindi wamba mina napeaipia.
66019010	Faith	Wuane lea-kola, nambato bala lo lotu loyale, balana kene yane ongane aiki leka wato, tombawua lewa tekeko, balato namba languato, wamba Oli Sipitisa okomane potopesa akali tupa lamawuato, Jisasato wua pulupeya lo yakamato wandakali tupa lamai-yapape leane lea. Oli Sipitisa okomane wuane lea-kola, potopesa akali utupane-mane wuane leai. Andipa Oli Sipitisa okomane nimbapi, nimba towa piape mindiki piyaini amene tupapi, yakama languato, wamba Jisasato wua peane lo wandakali tupa lamauwa atalapape leya-kola, yakamato wuane lalaini leya. Namba yakama towa atu Gotena piape akali atoto, nanimato piape mindiki okone teke piyamane. Tene okonena, nimbato namba lo lotu nalene kondalu, Gote lo angu lotu lape. Enjole okonemane wuane lea.
46002010	Grace	
50002029	Recommendation	Wamba yakamato katulo namba moyolo naepeai-kola, Ipapo-taitasa balato namba moyolo epea okoni. Epoto, bala tane kuai lo atokale nembo natene, namba moyo Kataisana piape oko pua atoto, bala omape-pene gulea-ko. Yakamato akali okonepene tupana gene tupa laiyu lape-pene. Tene okonena, Ipapo-taitasa bala yakama ateyainga epola-angi, yakamato bala Akali Andane okona piape piyane nembo toto, bala towa epele andane wete wato, nimba wayu epeleya lo bala lamialapape.
51003020	Recommendation	Andopane yame yakamato Akali Andane oko nembo toto, yakamana angini, ayiane-la, okonelapo-mane pii lolapi tupa pitaka ale amawua atalapape. Akali Andane okomane mana okone epele alane.
47001012	Faith	Nanimato yakama minakasa oyale, pii tene lapo palene tupa pepa peyo epe laa na-piyamane. Jia. Yakamato nanimana pepa tupa dii lo andoto, tene tupa pitaka nembo teyai. Nanima yuu okona atoto, wandakali minakasa naene, Gotena mana epene tika-pene tupa wato minu atalamane. Yuu okona wandakali-mane mana utupane nanima langi napeai. Jia. Goteto nanima ondowa moyoto, mana langea-kola, nanima yakama towa atu atoto, mana epene utupane wayumane wete wato minalamane. Nanimana mini okomane pii okone enene leyai lo nanima langeya-kola, nanimato epele alamane.
43014021	Faith	Nambato leyo pua piyaini wandakali tupamane namba towa epelewa yamapane yo atolai-kola pulupeyai. Utupane-mane namba towa epelewa yamapane yo atolai-kola, nambana Ayiane okomane utupane towa epelewa yamapane yo teke atolopeya. Nambatopi utupane towa epelewa yamapane yo atoto, namba tane utupanenga andawa lolo-peyawa. Jisasato wuane lea.
51002023	Sin	
64001006	Recommendation	Nimbato wandakali utupane moyee-kola, wandakali utupanena minditupa epoto, nimbato utupane towa epelewa yamapane yoto, moyalene lo nanimana sosa oko lamai-yaini. Akali utupane yuu waka mindina poyale atolai-angi, nimbato mana Goteto epele alane oko wato minuto, akali utupane wayumane moyalu, pulupa leendo, nimbato mana epene wete mindi wato minule-kola pulupeya.
55002023	Recommendation	Akali Andane okona piape akali tupamane mana epene Goteto epele alane tupa lamaulane mana tupa andape-pene. Utupane-mane wandakali tupa towa pii yanda napepe-pene. Jia. Utupane-mane wandakali pitaka towa tambo-tambo lo atape-pene. Wandakali mindimane Akali Andane okona piape akali mindinga kenda-pene mindi maiyando, balato wuane peakale lo ando kondape-pene. Wandakali minditupa-mane mini napalene gulo atoto, pii tene na-atene minditupa tipa peyai-kola, pii okonepene tupamane pii yanda piyaini mana oko mina ika lalane-ko. Wandakali mindimane Gotena piape akali mindi towa pii yanda puyale, pii okonepene mindi bala tipa peando, balato akali okonena pii yano peya napene, masia maipe-pene.
47003018	Faith	Nanimana lee-inga ima lapa-lapa mindimane ombo naene ateyama-kola, Akali Andane okomane Sipitisa ateya okona tii-pene oko nanimana lee-inganga epeakale lalane. Epeakale leya-kola, nanima balana tii-pene oko miama-miama poto, bala yale gulama-lama peyama. Wuaneko, wandakali-mane galasa andalaini pua teke, nanima andoto, Akali Andane okona tii-pene oko andalaini. Tene okonena, nanima yuku naene atoto, Gotena piape oko katulo piyamane.
58009014	Grace	Memepi, bulumakaopi, utupanena tundupa tupamane wuane piyaini tekeko, Kataisana tundupa okomane utupane sia mineaipia. Balanga koo mindikipi mindi nayene atea-kola, Oli Sipitisa atapowa atalane okomane bala mo tai laya ya-kola, Kataisa bala tane Gote lo opa mayaepia. Nanimato Gote saka atapowa atalane okona piape pimai-yapale loto, Kataisana tundupa okonemane nanimana ini anda-pangosa koo yalane tupa apialane.
44011017	Grace	Pii okone nembo tolo-peke loto, nambato wua lo nembo tewa: Wamba nanimato Akali Andane Jisasa Kataisa lo bilipi lema-kola, Goteto balana Oli Sipitisa oko nanima Juta yame Kitisene tupanga gea. Andipa wuane pua teke, wandakali yame waka tupamane Akali Andane Jisasa Kataisa lo bilipi lapiai-kola, Goteto balana Oli Sipitisa oko wandakali utupanenga maipia teke. Goteto wuane pipia-kola, namba apito balana piape okone katulo jia lolo-peyawape. Pitato wuane leaipia.
49004030	Faith	Goteto yakama molo-peke lokale nembo toto, yakama balana wandakali atalapale lata alu, balana Oli Sipitisa oko yakama geane. Tene okonena, yakamato Gotena Oli Sipitisa okona yamapane oko mo kenda piya aa na-piyapape.
66003003	Recommendation	Wuane puato, nimbana yamapane peke loto, nimbato Gotena pii layene epene wamba ale wato mana meene okone nembo tolo-peke loto, wato minu atape. Nimba lee too ata napene, mee limu palu atapowa ateendo, pake nene akali mindi epalane pua, namba epolopeyo. Andoko angi namba nimba atelenga epolopeya lo nimbato anda napulupele.
62003007	Recommendation	Nambana andopane yame, Gotena iwanane oko epene tika-pene atalane pua teke, mana epene tika-pene minalaini wandakali tupa epene tika-pene gulalaini. Wuane tekeko, wamba bulupane wete tewa Sataneto mana koo tupa mineane okonena, andipa mana koo tupa wato minalaini wandakali tupa pitaka balana yame atalaini. Balana yame ateyai-kola, Gotena iwanane okomane Satanena piape koo piyaini tupa minu koyo piya wakale loto, bala ati kenga atala yuunga panakame epeane. Tene okonena, yakamato mana koo mindi wato minu atalapale loto, wandakali yangone mindimane yakama minakasa olane. Waiwa ando atalapape.
