59005014	Recommendation	Yakamana mindi bala siki peleando, balato sosa okona akali kawane tupa ipulupa lo ee lo miape-pene. Ee lo mola-kola, akali utupane-mane Akali Andane okona gene oko loto, wandakali siki pelene okona umbaininga wele aiya mawuato, pote lape-pene.
44007023	Description	Matili bala mali paiyasa tukumindi penenga, balato balana amene Isatale tane wandakali tupa andolo pokale nembo toto, utupane andolo peaipia.
44023027	Violence	Juta yame wandakali tupamane akali Polo oko minata wato, bala peyo ome loyale pipiai tekeko, nambato bala Lomo tane mindi ateya lene oko ale auwa. Ale wato, nambapi, ami yanda yene tupapi, nanima poto, bala Juta yame wandakali tupana kininga molo-peke laima.
44019029	Description	Wuane laka puato, utupane-mane Epesasa tano okona wandakali ateaini tupana nembo-tene minu kee amai-yaikola, utupane pitaka-mane pii laiyu nena pua ateainipia. Wuane pua atoto, wandakali utupane pitaka nembo mindiki paluto, Polo towa atu epoko pua atalapili Masetonia tane lapo akali Gayasa, Atitakusa-la, okonelapo minu kilau lo awua poto, wandakali amunguli pua pitiyaini panda okona taimane peainipia.
44003014	Sin	Wuane leaini okomane yakamato akali epene tika-pene wete Jisasa masia maiyu, akali yangone peyo ome lalane akali Batapasa oko Pailateto tita lo tepa yakale leai.
44015009	Faith	
46011028	Recommendation	
46015058	Faith	Tene okonena, nambana yamapane yene amene imalini yame yakamato pii nambato yakama langeyo tupa bilipi leyama nayu loto, mindimane yakamana bilipi okone mo lawa pulane. Waiwa ando atalapape. Yakamato Akali Andane okona piape pua ateyai oko mee katapusa piape pua apia napeyama nembo toto, ole dindi lo balana piape tailo pua atalapape.
46004016	Recommendation	Namba yakamana ayiane gulo atoto, yakamato nambana mana tupa wato minalapape lo yakama langeyo nayu leyo.
46001021	Faith	
60003001	Recommendation	Wanda minditupa-mane tona epene wete tupa piyu, minditaka golo-mane waa-pene tupamane yati piyu, yakamana kawa itini tupa wayumane wete yati piyu, piyaini. Utupane-mane wuane piyaini tekeko, Kitisene wanda yakamato yakamana umbaini kenga wayumane yati na-piyapape. Jia. Yakama yamapane epene palu, tenga-mane tambo lo pitiyapape. Mana epene okonelapo-mane yakamana yamapane anda-pangosa yati pitane atola-kola, yakamana yati okone koyo napulu-peya. Goteto yakamana mana okonelapo andoto, yakamana yati okonelapo epene wete eya nembo tolopeya. Wamba wanda Satato wuane pua, balana akalini Apatakamena pangosa pituto, bala ando akali andane loto, pii balato leane tupa wato minu peteaipia. Wuane pua teke, matili wanda epene wete minditupa-mane Gote lo bilipi loto, wua pukale lo potomisa pii leane okone enene pulupeya lo maliyo peteaini-pia. Bilipi lo peteaini wanda utupane-mane mana epene okonepene tupa wato minu pituto, yakamana akalini tupana pangosa peteaini-pia. Wanda utupane-mane mana epene okonepene tupa mineaini okonemane yakamana yamapane anda-pangosa yati peainipia. Andipa Kitisene wanda yakamatopi minditaka mindi yuku naene pituto, mana epene utupane wato minu peteaindo, yakama Sata wanane yame pitulu-peyai. Yakamana akalini mindimane Gotena pii oko ale naene, tanga lo ateando, balato Gotena pii oko wato mineakale loto, yakamato pii kambua bala lamai na-piyapape. Jia. Yakamato pii manapi mindi lamai napene, Gote yuku amawua mana epene wete tupa minu pituto, yakamana akalini tupana pangosa pitiyapape. Wuane pulai-kola, balato yakamana mana epene minulai utupane andoto, bala Kitisene gulolo-peya nembo toto, yakamato wuane pua pitiyapape
47005020	Recommendation	Tene okonena, nanima Gotena piape akali tupa atoto, balana pii oko wandakali waka tupa lamalu peyama-kola, Gote bala tane pii okone yakama langene gulalane. Kataisato mana koo mindikipi mindi mina napeane tekeko, nanima Gotena wandakali tika-pene tupa atalapale nembo toto, Goteto nanima bala towa mina mindiki loto, nanimana mana koo tupa pitaka Kataisanga yata yaepia. Goteto wuane pea-kola, Kataisa bala koo piyane akali mindi gulo atoto, nanimana panda moto, omeaipia. Tene okonena, andipa nanimato balana ambulini pai puato, yakamato Gote towa yanda pua ateyai oko kondalu, bala towa yamapane mindiki palu atalapape leyama.
44002024	Description	Yakamato wuane peai-kola, Jisasa bala tandaka andane nalu omeane tekeko, matili Goteto bala malinga ika laya olopeya nembo toto, wamba Dapitito pii mindi leane oko loto, minditaka mindimane namba mo yuku olane loto, Gote bala nambana kii tikasa mandaka atalane leaipia. Ole dindi lo bala namba mandaka ateya-kola, nambato bala andalawane. Gote namba nimbana akali epene wetete ateyo-kola, nimbato nambana umbaini oko malinga paluto, tameakale lo ando konda napulupele. Dee, nambana tandini oko wandakali omene tupa atalaini yuu okona atapowa ateakale lo nimbato ando konda napulu-peleko. Namba yamapane epene wete palu, epele wete wato, pii lalawane. Nimbato namba moyolo-pele nembo toto, namba maliyo ateyo. Nimbato namba saka wete atapowa atolane asini oko namba andawa lee. Nimba namba towa atapowa atole okomane, nimbato namba mo epele wete piya olopele. Wamba Dapitito wuane lea-kola, wandakali omalaini mana okomane Jisasa katulo mina duli lo mina napeaipia. Tene okonena, Goteto bala malinga ika laya yaepia.
59002007	Sin	Dee, amango utupane-mane Kataisana gene epene Goteto yakamanga geane okone lamba lalaini. Lamba leyai-kola teke, yakamato utupane towa epelewa atoto, wandakali koo tipia tupa masia mawua ateaindo, yakama jasa nembo-tene koo palene atoto, wandakali kopeta yapa lo tale pulai-kola pulupeyai.
54003003	Description	
43004014	Grace	Wuane tekeko, nambato ipa mindi wandakali maluwa tupanga ipa lai yungalane pua epoto, wandakali utupane saka atapowa ateakale lo ataya olopeya leaipia. Utupane-mane ipa okone nalu, matili-matilipi dee lapone ipa nono na-olopeyai. Jia.
62002005	Faith	
66016013	Description	Okone angi, nambato andewa-kola, puya andane okopi, pusi kapua andane okopi, owato potopesa akali okopi, utupanena nee asianga sipitisa koo monge gulene tepo kamaka epeainga andewa.
59002008	Recommendation	Gote bala nanimana kiŋi oko atoto, balana pii pepa pelene eya okona loo mindi yata wato, nimbato nimba tane epele alene pua teke, nimbana wandakali yangone tupa towa epelewa yamapane yo atape leaipia. Yakamato loo okone wayumane wato minu ateaindo, yakamato mana epene mindi wato minulai-kola pulupeya.
47004005	Faith	
46015033	Recommendation	Wandakali mindi bala koo piyaini wandakali tupa towa atu ateando, utupane-mane balana mana epene tupa minu koyolo-peyai. Koo piyaini wandakali minditupa-mane yakama minakasa oyale, wandakali omene tupa malinga ika nalolo-peyai leyai. Utupane-mane yakama minakasa yakale lo yakamato ando konda aa na-piyapape.
58013020	Grace	Nanimana Akali Andane Jisasa bala Gotena sipisipi tupa yatawa ando atalane akali kawane oko atoto, bala tanena tundupa okomane pii wenene yapowa yolane Goteto lo yata yane oko minu tai laya yaepia. Balato pii okone minu tai laya ya-kola, Goteto bala malinga ika laya yaepia. Jisasa bala malinga ika loto, nanimana mini epene pale laya alane okona tene oko ateya.
50001027	Recommendation	Nambato yakama andolo epewandopi, na-epewandopi, yakama nembo mindiki palu ateyai lolai oko ale wakale. Dee, wandakali-mane Gotena pii layene epene oko ale wato, bilipi leakale nembo toto, yakama pitaka potomane lo atoto, Gotena piape pua ateyai lolai okone nambato ale wakale teke. Wandakali-mane wuane lolai oko nambato ale yakale nembo toto, yakamato Kataisana pii layene epene okomane leya pua, Kitisene mana epene tupa wato minu atalapape.
46006014	Grace	
55001006	Recommendation	Nimbato Kataisa lo bilipi leyo nayu lalene nembo toto, nambato nimbana nembo-tene oko mina ika loto, wua leyo: Goteto balana Oli Sipitisa nanimanga geane okone nanimato yukuwa atalapale lo gii napeane. Jia. Nanimato nanima tanena mana tupa kuai lo ando atoto, wandakali yangone tupa towa epelewa yamapane yo atalapale loto, Goteto nanima minu tai laya oyale, balana Oli Sipitisa oko nanima geane. Wamba nambato nimbana kawanenga kii yata ewa-angi, nimbato Gotena piape oko tailo pula loto, Goteto balana Oli Sipitisa oko nimbanga geane. Ita lungu andane teakale nembo toto, wandakali-mane ita tola oko po lalaini. Wuane pua teke, nimbato Gotena piape andane oko kuai lo pukale nembo toto, nimbato Oli Sipitisa okonena tai-lene okomane Gotena piape tupa tailo pua atape.
60004006	Grace	Enene, wandakali pitaka-mane mana koo minalaini okonena, Goteto utupane yapa lo tale peya-kola, utupane omalaini. Utupane omalaini tekeko, Gote bala saka atapowa atalane pua teke, balato wandakali omene tupana tandini tupa saka atapowa ateakale nembo teaipia. Wuane nembo toto, wandakali wamba ateaini tupa oma napene, saka ateai-kola teke, Goteto akali minditupa-mane balana pii layene oko wandakali utupane lamai-yakale leaipia.
46007023	Recommendation	
46010010	Recommendation	
47002017	Faith	
45015001	Recommendation	Gotena pii okomane nanimana bilipi oko mo tai laya ola-kola, balato nanima moyolo-peya. Moyola-kola, balana potomisa pii tupa angini guleakale loto, nanima kepa naene, maliyo atalapale nembo toto, wamba akali minditupa-mane nanima mana languyale Gotena pii pepa peleaini-pia. Gotena pii utupanena mindimane pii mindi nanima mana languato, wandakali-mane nimba andayo pii koo leaini utupane namba andayo leai-kola, pea layene eya. Kataisa bala tane epele oyale mangene mindi napeane tekeko, Gotena pii okonemane leya pua, kenda-pene minditupa balanga epeai-piako. Bilipi leyama nayu lalamane wandakali nanima tane epele amakale nembo natape-pene. Jia. Bilipi leyo nayu lalamane wandakali nanima mindiki-mindiki lo wandakali yangone tupa mo epele piyamakale nembo toto, utupane moyo minu tai laya oyale, wua pimakale nembo tape-pene. Wuane nembo toto, bilipi leyama nayu na-lalaini wandakali tupa moyo, nanimato utupanena kenda-pene tupa awua atamakale.
50002024	Faith	Dee, matili Akali Andane okomane namba epolane asia mindi lumbu tepa ola-kola, nambatopi yakama wamba ini andolo epokale nembo teyo.
66007001	Description	Mangene peaini utupane pitaka pikoyo pea-kola, popo andane mindi lo auwa epea. Epoto, yuupi, ipa solewatapi, itapi, utupane minu koyolane nembo toto, enjole tukumindi yuu kona tukumindi tupana atoto, popo lo auwa epolane asini tukumindi tupa tuma pitawa ateainga andewa.
60004003	Sin	Anu peakale nambato wuane leyope. Wamba yakamato aitene wandakali tupana mana koo tupa wato minuto, pati andane tupa loto, bia ipa tai kambua tupa noto, sapake lo keewa ateai. Okone angi, yakamato pamuku puato, mana koo kambua minuto, Gotena loo yata yane tupa tanga loto, owato gote tupa lo lotu leai. Wamba yakamato aitene mana koo utupane wato minu atoto, gii andane luu mindi apeaini tekeko, andipa yakamato mana koo utupane wato mina napene kondeyai.
66011005	Violence	Akali okone-lapona yanda-pene wandakali tupamane akali okonelapo minu koyamakale nembo teaindo, akali okonelapo-mane liyambana nee asianga ita lungu kamaka epeakale loto, wandakali utupane too koyo peakale lolo-peyapi.
44023005	Recommendation	Wuane leai-kola, Poloto utupane lamawuato, amene yame, Gotena pii pepa pelene eya mindimane loto, nimbato nimbana yame okona akali kawane mindi andayo pii koo lolene layene eya tekeko, nambato akali okone bala pitisa akali kawane ateya nembo natene, pii koo okone bala andayo lalo leaipia.
66022015	Sin	Wuane tekeko, yia peango atalaini wandakali tupapi, pamuku pima epoko piyaini wandakali tupapi, wandakali yangone peyo ome lalaini wandakali tupapi, posini piyaini wandakali tupapi, owato pii lauwa lakae lo atalaini wandakali tupapi, owato gote tupa lo lotu lalaini wandakali tupapi, wandakali okonepene tupa pitaka tano okonena katulo kolandaka nalolo-peyai. Jia. Utupane takita atoto, yamapane kendawa atolopeyai.
66002014	Sin	Nimbato namba lo bilipi leyo nayu lalene tekeko, nimbanga koo tene minditupa eya. Wamba akali Belameto mana koo mindi Beleke mana lamawuato, Isatale tane wandakali tupamane owato gote tupa lo opa maiyene tupa nalu, pamuku pua ateakale lo mo piya oyale wua pipe leaipia. Andipa Pekemama tane Kitisene minditupa-mane akali Belamena mana koo okonelapo wato minu atalaini. Wuane pua teke, Pekemama tane Kitisene minditupa-mane akali Nikolasana mana koo tupa wato minu atalaini teke. Wandakali utupane-mane wuane pua ateakale lo nimbato ando konda alene mambele, nimbanga koo tene mindi eya-ko.
53001003	Faith	Amene imalini yame, ole kambuanga wandakali minditupa-mane kenda-pene andane tupa yakama giki peyai-kola, yakamato kenda-pene kambua awua atalaini. Kenda-pene auwa atoto teke, Gote lo bilipi lene mana okola, wandakali yangone towa epelewa yamapa yoo atene mana okola, mana okonelapo yakamanga andane gulama lama peya. Tene okonena, ole dindi lo nanimato Gote ando wayu pele lape-pene. Nanimato wuane pemando, mana okone epene gulolo-peya. Nanimato yakamana gene tupa laiyu loto, Tesalonaika tane Kitisene tupamane mana epene utupane wato minu ateyai lo Gotena sosa tupana wandakali ateyai tupa lamai-yamane.
46012002	Sin	
49005025	Recommendation	Wamba sosa oko Kataisana umbaini gulo atea-kola, Kataisato wua lo nembo teaipia. Sosa okonenga koo tenepi mindi nayene, epene tika-pene wete ateakale nembo toto, nambato Gotena pii layene epene okola, ipa okola, okonelapo-mane sosa okonga kalato ateane tupapi, koo tene yane tupapi, utupane wasa-wasa peyo apokale. Wuane puluwa-kola, sosa oko epene tii-pene wete gulolo-peya nembo teaipia. Wuane nembo toto, Kataisato sosa oko towa epelewa yamapane yoto, sosa oko moyoyale omeaipia. Wuane pua teke, akali tupa yakamato yakamana wetene tupa towa epelewa yamapane yo atalapape.
45012017	Recommendation	Yakamato wandakali waka tupa towa pii yanda napene, utupane pitaka towa tambo lo atolane asini mindi yando, yakamato asini okone wato minuto, utupane pitakana wenonga mana epene tupa angu wato minu atalapape. Mindimane yakamanga mana koo mindi mineando, yakamato paini balanga mana koo mindi mina na-piyapape.
60005006	Recommendation	
44014017	Grace	Wamba Goteto wuane peane tekeko, bala ata too pua ata napeaipia. Jia. Ole dindi lo Gote bala ateyo lo mo pana wato, balato yakama towa mana epene tupa minu atalane. Balato kingi ati kenga ato epeakale lalane okomane tomo epene kambua tupa ee tupana ika laya alane. Tomo kambua giyu, balato yakamana mini yamapa-la mo epele piya alane leapilipia.
54003011	Recommendation	Wuane pua teke, Gotena piape akali tupana wetene tupanga koo tene mindi nayakale lo pitipe-pene. Wanda utupane-mane mee kindi-kindi pua piti napene, wandakali yangone mindi layanga napene, bia ipa tai kambua noto, keewa napitipe-pene. Wanda utupane-mane piape pimakale lolai tupa pitaka enene pua pitipe-pene.
66002021	Sin	Wamba wanda okone bala yamapane peke leakale nembo toto, nambato bala peteakale lo ando kondewa tekeko, balato mee pamuku pua pitukale nembo toto, yamapane peke na-lokale nembo teya.
44012020	Description	Wamba Taya tanepi, Saitone tanepi, utupane-mane yuu Etoteto ando ateane okona tawe tomo mo ateaini tekeko, matili Etoteto utupane towa yataka andane wete wato, tomo nameakale, jia leaipia. Wuane lea-kola, utupane pitaka-mane lapone tomo mia-makale nembo toto, amunguli piyu, yuu Etote ateane okona peainipia. Poto, utupane-mane Etotena anda ando ateane akali Balasatusa lene oko towa pii ini loto, yakama nanima towa yanda napene, tomo mialapa lalapape leainipia. Wuane leai-kola, bala tane katu lalu, kiŋi oko lamauwakale leaipa.
43008049	Sin	Wuane leai-kola, balato utupanena pii okone yano peyoto, nambato nambana Ayiane okona gene oko laiyu lalawane okonena, sipitisa koo mindi nambanga ata napeya lo yakamato andeyai. Wandakali-mane nambana gene oko laiyu lapiai lakae lo nembo nateyo tekeko, yakamato nambana gene oko laiyu lalapale lo namba Ayiane okomane nembo teya. Wuaneko, yakamato nambana gene oko mo ainapi leyai okonena, balato yakama yapa lo tale peya.
43006018	Description	Undupi lea-angi, popo andane mindi lo awua epeane mindimane ipa oko taimane mina ika laya ya.
45008018	Faith	Goteto minditaka eya tupa pitaka yakale lea-kola, utupane yakama tane koyamakale nembo nateainipia. Jia. Goteto utupane atalu koyakale leane pua, utupane atalu, koyalaini. Minditaka eya tupa pitaka koyalaini mana okona anda-pangosa andi latane gulo atalaini. Wanda-mane andopane manduyale masia peleya-kola, tandaka noto, ai lalaini. Wuane pua teke, minditaka Goteto yakale leane tupa pitaka-mane tandaka noto, ai lo atama ipulu, andipa nanima ateyama okona giau leya oko nembo teyama. Nanimato wuane nembo teyama tekeko, matili Goteto balana andopane tupa tinga lo moto, gene andanepi, minditaka epene mauwakale leane tupapi, utupane pitaka balana andopane utupanenga maulupeya. Goteto balana andopane tupa tinga lo mola pua teke, balato minditaka yakale leane tupa pitaka wuane pua teke tinga leakale nembo toto, utupane-mane maliyo ateakale loto, andipa Goteto utupane pitaka koyakale lo ando kondalane. Tene okonena, matili Goteto balana andopane tupa ama tombenenga mo pana olopeya nembo toto, minditaka Goteto yakale leane tupa pitaka-mane utupane andaima lakae lo maliyo ateyai. Matili Goteto nanima balana andopane yame ateyai lo mo pana wato, minditaka epene nanima gulupeya tupa nanimanga andawa lola-angi, minditaka epene utupane-mane tandaka andipa neyama tupa mee gulaya wato, epene wete yolopeya nembo teyo.
62002012	Grace	Kitisene mini-yene yame, wamba Goteto yuu ati-la yakale lea-angi, Jisasa bala ateane okone yakamato nembo tatawa ateyai okonena, nambato yakamana pepa oko peyo epe leyo. Kitisene wandakali tai yame, Gotena pii layene oko yakamanga eya-kola, yakama tai atoto, akali koo Satane oko sia minapiai mambele, nambato yakamana pepa oko peyo epe leyo. Kitisene wandakali minditupa yakama andopane yame gulo atoto, Ayiane Gote oko nembo tatawa ateyai mambele, nambato yakamana pepa oko peyo epe leyo. Jisasa Kataisato yakama molo-peke loyale ita malamanda okona omeane oko nembo toto, Ayiane Goteto yakamana koo tupa api yiake mambele, nambato yakamana pepa oko peyo epe leyo.
55001009	Grace	Wamba Goteto yuu ati-la yakale nalene atea-angi, balato nanima mee ondowa moyoto, Kataisato piape pula mambele, Goteto nanima bala tanena yame tupa gulaya wakale nembo teaipia. Goteto wuane nembo teane okonena, matili Jisasa Kataisato nanima molo-peke loyale, wandakali omalaini mana okona tai-lene oko mo mee gulaya yaepia. Jisasato wuane peane okonena, nanimato mana epene mindi mina napema-kola teke, Goteto nanima balana wandakali epene tika-pene tupa atalapale loto, nanima ee lo molo-peke leaipia. Wandakali omalu, malinga ika lalu, dee lapone oma napene, saka atapowa atalaini lo wandakali-mane nembo teakale loto, Goteto balana pii layene epene okomane mana utupane nanimanga lo pana yaepia.
43019006	Violence	Pitisa akali kawane tupapi, yanda yene tupapi, utupane-mane Jisasa andoto, pii taimane loto, bala ita malamanda okona peyo yuka aa, laka peainipia. Wuane laka peai-kola, Pailateto utupane lamawuato, nambato balanga koo tene mindikipi mindi anda napeyo-ko. Yakama tane bala atu aiyu poto, ita malamanda okona peyo yuka alapa leaipia.
60001010	Grace	Wamba Kataisana Sipitisa okomane potopesa akali tupa lamawuato, matili Kataisato wandakali tupa ondo wato, utupane molo-peke loyale, tandaka nalu, gene andane mindi molopeya leaipia. Kataisana Sipitisa okomane wuane lea-kola, potopesa akali utupane-mane Gote tipa piki puato, mangene aki mindi pula-kola, Kataisato wuane pulu-peyape. Andoko angi Kataisato wandakali tupa molo-peke lolo-peyape leainipia.
63001007	Sin	Anu peakale nanimato Gotena loo utupane wato minu atamakalepe. Wandakali kambua yuu okona epoko pua atoto, wandakali yangone tupa minakasawa atalaini. Utupane-mane Jisasa Kataisa bala nanimana umbaini ateyama okopene ata napeane lalaini. Wuane lalaini wandakali utupane-mane Kataisa towa yanda pimawuato, wandakali yangone tupa minakasawa, owato pii lalaini.
44024005	Sin	Nanimato akali oko andaima-kola, balato kenda-pene kambua mina ika lalane akali mindi pia. Nasatesa tane Jisasa oko lo bilipi lene yame ateyai okona akali kawane atoto, balato yuu yoo peya tupa pitakana Juta yame wandakali atalaini tupa pitaka mo yataka aya wato, yanda kambua mina ika lo atalane.
54003016	Grace	Wamba Jisasa bala akali enene mindi guloto, yuu okona panakame epea-kola, enjole tupamane bala andeaini-pia. Oli Sipitisa okomane bala akali tika-pene wete ateya lo lapana ya-kola, wandakali tupamane balana pii oko lo tawe yainipia. Balana pii lo tawe yai-kola, yuunga wandakali tupamane bala lo bilipi leainipia. Goteto bala atu ati kenga peakale lo mea-kola, Jisasa bala gene andane wetete meaipia. Gotena pii layene wamba too pitane yane utupanena tene tupa andane wetete eya lo bilipi leyama nayu leyama.
66016021	Violence	Latako pea-kola, kingi apane andane wetete mindiki-mindiki lo epeane utupanena kenda-pene oko laisa beke andane lapona kenda-pene sia minuto, andane wetete epea. Kingi apane utupane ati kenga ato epoto, wandakali tupa peyoto, minu koya-kola, Goteto kingi apane andane epeakale leya loto, wandakali utupane-mane bala ando lamba leai.
61003013	Faith	Matili yuu ati-la andipa eya okolapo wuane pua koyolo-peyapi tekeko, wamba Goteto potomisa pii mindi leane oko loto, matili nambato yuu ati-la wenene mindi yakale lolowa-kola, yuu wenene okonena wandakali atolai utupane-mane mana epene tika-pene tupa angu wato minu atolopeyai leaipia. Goteto yuu wenene mindi yakale lokale leane okone yata yakale lo nanimato maliyo ateyama.
66006014	Description	Wandakali-mane tuli mindi leka wato, yata alamane wuane pua teke, Goteto ati kenga yalane oko leka wato, mindisa yata ya-kola, ati kenga yalane oko latako pea. Dee, ati peleya tupapi, ipa angini andane wetete tupana tombenenga yuu yalane tupapi, utupane pitaka lopa alu, yakama yalaini yuu oko tepa alu, mindisa peai.
58010010	Grace	Mo apialu, Jisasato Gotena nembo-tene oko wato minuto, alu mindiki angu balana umbaini oko Gote opa mayaepia. Opa mayane okonemane nanima mo kuai wete laya yaepia.
52001002	Faith	Yakamato Gote lo bilipi loto, balana piape tupa pua atalaini. Yakamato wandakali yangone tupa towa epelewa yamapa yo atoto, utupane moyo atalaini. Dee, nanimana Akali Andane Jisasa Kataisa bala dee lapone epolopeya lo yakamato bilipi leyama nayu loto, maliyo atalaini. Ole dindi lo nanimato yakama pitakana mana epene utupane nembo tolo-peke loto, nanimana Ayiane Gote lo pote loto, bala ando wayu pele lalamane.
66006004	Violence	Nimba ipu lea wete, yia osa tundupa-pene mindi epea-kola, nambato bala andewa. Wandakali-mane yakamana yangone tupa towa kuai lo ata napene, mindi akali peyo ome leakale nembo toto, akali mindimane kandepa luu andane mindi yia osa okonena masianesa peteane akali oko maya.
54006001	Recommendation	Kitisene wandakali tupamane yakamana piape ando atalane akali okona pii tanga leaindo, wandakali waka minditupa-mane utupanena mana koo okone andoto, Gotena gene okopi, balana mana nanimato lamawua ateyama okopi, okonelapo koo ya lolopeyai. Wandakali waka tupamane wuane naleakale nembo toto, piape wandakali tupamane yakamana piape ando atalane akali okona pii lola tupa wato minape-pene.
51003009	Recommendation	Goteto yakama bala ateya okonepene gulalapale nembo toto, ole dindi lo mana epene tupa yakama mana languato, yakama balana yame wandakali wenene gulaya yane. Goteto wuane pea-kola, yakamato yakamana nembo-tene wambane koo tupapi, mana koo tupapi, utupane apoto, yakama balana yame wandakali wenene guleai okoni. Tene okonena, yakamato owato pii tupa mindi akali lamai-lamai na-piyapape. Jia.
66002020	Sin	Wuane tekeko, nimbanga koo tene mindi eya. Wanda Jesepeleto potopesa wanda mindi peteyo loto, nambana piape wandakali tupa minakasa wato, owato gote tupa lo opa maiyene minjuni tupa nalu, pamuku pua ateakale lo mana lamaiyane. Wanda okonemane mana koo okonelapo nambana piape wandakali tupanga mana lamauwa peteya-kola, nimbato bala wuane pua peteakale lo ando konda alene okonena, nimbanga koo tene mindi eya.
48003008	Grace	
58012005	Recommendation	Goteto yakama balana andopane yame ateyai nembo toto, wamba balato yakama mo tai layawa pii mindi yakama langeane okone yakamato embesa yai. Gotena pii pepa pelene eya okonemane loto, nambana andopane, Akali Andane okomane wandakali mindi yamapane yo atoto, balana andopane ateya leando, balato wandakali okonena mana koo minalane tupa mo tika puyale, kunju-mane peyalane layene eya-ko. Goteto nimbana mana minalene tupa mo tika puyale kenda-pene mindi nimba geando, nimbato mini kenda wete olene. Dee, balato nimba mo tika puyale kenda-pene mindi nimba gula-kola, nimbato okone angini mindi jia ya, mee ya lo nembo natape layene eya.
58013017	Recommendation	Yakama Gotena yia sipisipi tupa ateyai-kola, sosa okona akali kawane ateyai tupamane yakama moyo ando atalaini. Matili utupane-mane Gote lamawuato, nanimato nimbana piape pua atema-kola, wandakali tupamane wua peaini lolopeyai. Sosa okona akali kawane utupane-mane mini kenda wato piape okone pua ateaindo, okonemane yakama katulo moya napulu-peya. Akali kawane utupane-mane piape okone epelewa peakale nembo toto, yakama akali utupanena pangosa atoto, utupanena pii ale amawua, wato minu atalapape.
44013019	Description	Balato utupane moyo atoto, Kenane yuu okona wandakali yame yanasa paleaini tupa peyo watoto, yuu okone Isatale tanena yuu tene gulo yakale lo, yakama mayaepia.
54006003	Faith	Nanimana Akali Andane Jisasa Kataisato pii leane tupa enene wetete eya. Nanimato balana pii utupane nembo toto, Gotena mana epene tupa wandakali tupanga mana lamai-yamane. Akali minditupa-mane pii layene enene utupane awua tepa alu, pii waka mindi wandakali tupa mana lamawua atolopeyai.
63001010	Recommendation	Wandakali mindi yakama atolainga epoto, Kataisana pii layene enene oko yakama langi napene, yakama minakasa wato, pii waka mindi-pene mindi langeando, yakamato wandakali okone ando, nimba wayu epeleya leaindo, yakamato balana piape koo piyane okone moyolai-kola pulu-peyako. Yakamato bala ando wayu epeleya nalene, kondalapape. Yakamato wandakali okonepene tupa moyo, yakama andaka yatawa pali na-piyapape.
47001005	Grace	
