44015008	Grace	Goteto nanima Juta yame wandakali tupanga mana mindi wato minalu, wandakali yame waka tupanga mana waka mindi wato minalu, napiyane. Jia. Balato Oli Sipitisa oko nanima Juta yame wandakali tupanga geane, wuane pua teke wandakali yame waka tupapi mayane. Wandakali pitakana nembo-tene oko andalane Gote okomane wuane peane okonemane balato wandakali yame waka tupa molo-peke lokale lo andawa leane. Wandakali yame waka utupane-mane Jisasa lo bilipi leyai oko andoto, balato utupanena koo tupa apoto, balana wenonga utupane kalato nayene ateakale laya yane.
59002011	Sin	
43010028	Grace	Nambato utupane saka atapowa ateakale lo ataya olowa-kola, matili-matilipi utupane alu napulu-peyai. Jia wete. Nambana Ayiane okomane wandakali utupane nambana yame ateakale lo namba geane. Balato minditaka eya tupa pitaka sia minuto, tai wetete ateya okonena, wandakali mindikipi mindimane namba Ayiane okona yame atolaini wandakali utupanena mindikipi mindi pii-mane lo tambo-tambo loto, katulo namolo-peyai. Jia. Namba Ayiane nalipa mindiki ateyapa. Tene okonena, wandakali mindikipi mindimane sipisipi nambana kini tokonga atolai utupane katulo tikayu namolo-peya. Jia. Jisasato wuane lea.
45016020	Grace	Yakamato mana utupane masia mawua ateaindo, yakamana yamapane tambo laya alane Goteto yakama moyo atola-kola, yakamana kene tupamane Satane wamba kapoyale ango mangua olopeyai. Nanimana Akali Andane Jisasato yakama ondo wato, moyo ateakale lo pote leyo.
55003005	Sin	Wandakali utupane-mane Gotena mana epene tupa angini mindi jia ya loto, mana utupane mee umbaini kenga-mane angu wato minu atolopeyai. Tene okonena, nimbato wandakali okonepene tupa atolainga mandaka gulo puu napene, waka atape.
45012005	Description	
56003008	Faith	Pii nambato leyo utupane enene wete eya. Mana epene utupane-mane wandakali moyalane. Tene okonena, Gote lo bilipi lene wandakali tupamane mana epene utupane wayumane minu ateakale nembo toto, nimbato mana epene utupane wandakali tupanga lamaiyo nayu lamawua atape.
59002023	Faith	
59002001	Faith	Nambana amene imalini yame, yakamato nanimana Akali Andane epene wete Jisasa Kataisa lo bilipi lalaini-ko. Yakamato wandakali gene yene tupa towa angu epele wato, wandakali gene nayene tupa embowa, masia maulaini. Tika ando atalapape.
45003013	Sin	Wandakali mali keao lo apene eya-kola, mali okonena guu koo wete mindi kamaka epalane. Wuane pua teke, wandakali-mane mini koo palu atoto, wandakali yangone tupa minu koyamakale loto, utupane andayo pii koo tupa lalaini. Wandakali peyo ome lalane etulu gepo okona posini gulene pii koo tupa wandakali utupanena ambulini okona anda-pangosa paliyane. Utupane-mane yakamana yangone tupa minakasa oyale, owato pii lalaini.
49005028	Recommendation	Sosa oko Kataisana umbaini gulo eya-kola, nanima balana kinipi, kenepi, lenepi, okonetaka tupa gulo ateyama. Nanima okonetaka gulo ateyama-kola, Kataisato tomo epene tupa nanima guato, kuai lo moyo ando atalane. Kataisato wuane piyane pua teke, akali mindimane bala tanena umbaini oko towa mini koo mindi pali napene, balana umbaini oko moyo, tomo epene tupa neakale mawuato, kuai lo moyo ando atalane. Akali mindimane balana wetene oko towa epelewa yamapane yo atalane okonemane bala tane epelewa yamapane yo ateya-kola, piyane-ko. Akali yame yakamato yakama tanena umbaini oko epelewa yamapane yo atalaini pua teke, yakamato yakamana wetene tupa epelewa yamapane yo atape-pene.
45009030	Faith	Wuane pulupeya nembo toto, nanimato aki lamakalepe. Wandakali yame waka tupamane wandakali tika-pene atamakale nembo nateaini tekeko, utupane-mane Jisasa lo bilipi leai-kola, Goteto utupane wandakali tika-pene ateyai leaipia. Isatale tane tupamane wandakali tika-pene atamakale nembo toto, Mosesana loo tupa wato minuyale, piape ayiawa pua ateaini tekeko, Goteto utupane wandakali tika-pene ateyai naleaipia.
54003009	Faith	Akali utupane-mane Gotena pii layene wamba too pitane yane okone bilipi loto, pii okone kuai lo wato mineyamape, wato mina napeyamape nembo tape-pene.
54006002	Recommendation	Piape ando atalane akali mindi bala Kitisene mindi ateando, balana piape wandakali tupamane bala anda napi loto, bala mee Kitisene amene nanima ateyama okopene teke ateya nalape-pene. Jia. Piape ando atalane akali okonemane minditaka epene tupa meakale nembo toto, Kitisene piape wandakali utupane-mane piape ando atalane akali okone towa epelewa yamapane yoto, balana piape kuai lo pimaipe-pene. Wandakali-mane mana utupane pitaka wato mineakale loto, Timoti nimbato mana lamawua atape.
45003003	Faith	Okone enene tekeko, Juta yame wandakali minditupa-mane Gotena pii tupa wato mina napene kondalaini. Wuane pua teke, Goteto bala tanena pii tupa wato mina napene, minditaka pukale leane tupa napene, kondolo-peyape.
43019034	Violence	Utupane-mane balana kene peyo kundu naleaini tekeko, ami yanda yene mindimane Jisasana patilininga yandate-mane peyo lutuku apeya-kola, okone angi teke, tundupa ipa towa balau lea.
43015012	Recommendation	Piape anduane mindi bala waka mindinga atoto, balana piape tupa pua ateya-kola, piape anduane okonemane aki peyape lo balana piape akali okomane nembo natalane tekeko, nambana Ayiane okomane pii minditupa namba langea-kola, nambato ale ewane tupa pitaka yakama langewa. Tene okonena, nambato yakama nambana piape akali tupa ateyai nalene, yakama nambana yamapane yene yame ateyai leyo. Yakamato mangene mindi pua atalapa lolowa-kola, yakamato mangene okone pua ateaindo, yakama nambana yamapane yene tupa atolopeyai. Wandakali mindimane balana yamapane yene yame moyoyale omeando, balana mana okonemane wandakali yangone epelewa yamapane yo atalaini mana waka tupa pitaka sia minulu-peya. Namba yakama towa epelewa yamapane yo atalawane wuane pua teke yakamato mindi akali towa epelewa yamapane yaka pua atalapale leyo.
45006013	Recommendation	Dee, yakamato mana koo mindi mina-makale nembo toto, koo piyaini mana okonemane yakamana kinipi, ambulinipi, okonetaka tupa bosa lo ando ateakale lo yakamato ando konda na-piyapape. Jia. Wamba koo piyaini mana okomane yakama bosa lo ando atea-kola, yakama Gotena pangosa ata napeai. Okone angi, Goteto andea-kola, yakama omene gulo ateaini tekeko, andipa yakama malinga ika lene gulo ateyai. Tene okonena, andipa yakama saka atoto, mana epene tika-pene tupa wato mina-makale nembo toto, yakama tane Gote maiyapape. Maiyu, Goteto yakamana kinipi, ambulinipi, okonetaka tupa pitaka bosa lo ando ateakale lalapape.
58010039	Faith	Pii okone enene tekeko, nanima Jisasa towa kembena peyalu poto, alu pipe-pene wandakali jia. Nanimato Jisasa lo bilipi loloma-kola, Goteto nanima molo-peke lolopeya.
45011026	Grace	Oto okone epola-angi, Isatale tane wandakali tupamane andolai-kola, wandakali yame waka kambua Gotena yame ateyai lo andolopeyai. Andoto, yakama tane Gotena yame ataima lakae lo nembo tolai-kola, Goteto Isatale tane enene tupa pitaka molo-peke lolopeya. Matili Goteto utupane molo-peke lolopeya loto, Gotena pii pepa pelene eya mindimane loto, nambato pii mindi lo yata wato, utupanena mana koo tupa apia-mauwakale leyo layene eya. Dee, Gotena pii pepa pelene eya waka mindimane loto, Jekopona mandiyene yame Isatale tane wandakali tupamane Gote masia mawuato, mana koo tupa minu atolai-kola, utupane molo-peke lolane akali oko Sayone tano okona ato epoto, utupanena mana koo tupa apia-malupeya layene eya.
52002015	Violence	Wamba Juta yame-mane potopesa akali tupa peyo ome lalu, Akali Andane Jisasapi peyo ome leai. Wuane piyu, matili utupane-mane nanima pulupa lo peyo wateainipia. Andipa Goteto wandakali yame waka tupa molo-peke leakale nembo toto, nanimato Gotena pii layene epene oko wandakali utupane lamawua ateyama-kola, Juta yame-mane nanimato pii okone lamaulaini, jia loto, nanima peyo wata alaini. Juta yame wandakali utupane-mane Gotena wandakali pitaka yanda pimawua ateyai-kola, Goteto utupane towa epele aa napiyane. Ole dindi lo Juta yame wandakali utupanena mana koo okone andane wete yama-yama epeya-kola, andipa Gotena yataka ene oko wandakali utupanenga epo eya.
58010026	Sin	Anu peakale nanimato wuane pimakale leyamape. Nanimato Gotena pii layene enene oko mana moto teke, dee lapone koo tupa pima lakae lo nembo toto, koo pua atemando, Goteto koo utupane apeakale nembo toto, nanimato bala opa waka mindi mauluma-kola, katu nalolo-peya. Jia.
49002006	Grace	
49004025	Recommendation	Nanimato mana epene utupane yakama langema okonena, yakamato owato pii lalaini mana oko kondalapape. Nanima pitaka Kataisana umbaini okona kinipi, kenepi, okonetaka gulo ateyama nembo toto, yakama mindiki-mindiki lo yakamana yangone tupa towa pii enene tupa lalapape.
48002005	Faith	
46014013	Recommendation	Nambato wandakali yame waka mindina pii lalaini oko mo loto, loma yewando, nambana sipitisa okomane loma yolopeya tekeko, nambana nembo-tene oko bala mee pangulu-peyako. Nambato anu pipe-penepe. Namba tanena pii loto, nambana sipitisa okola, nembo-tene okola, lapotaka-mane loma yolopeyo. Dee, namba tanena pii loto, nambana sipitisa okola, nembo-tene okola, lapotaka-mane teke wee lolopeyo. Nimbato wuane napene, wandakali yame waka mindina pii lalaini oko mo loto, nimbana sipitisa okomane angu Gote wayu pele leendo, nimbato Gote wayu pele kuai lo lolopele tekeko, wandakali mindimane yame waka okonena pii oko ale aa napiyane yando, nimbato Gote wayu pele lo pote lokoyo pule-angi, nimbato aki lelepe lo bala tatake wato, enene nalolo-peya. Jia. Nimbana loma yolene okonemane balana bilipi oko mo tai laya na-olopeya. Tene okonena, wandakali mindimane yame waka mindina pii lalaini oko mo loto, pii mindi leando, balato pii lolane okonena tene tupa mopeke lokale loto, Goteto tai-lene okone bala maiyakale lo balato pote lape-pene.
44009001	Violence	Soloto Akali Andane lo bilipi lene wandakali tupa minu koyoto, peyo ome lokale loto, pitisa akali kawane oko ateanga peaipia.
43017013	Description	Nambato nimba atelenga epoyale peyo tekeko, andipa namba yuu okona atoto, nambana epele ene oko wandakali utupanenga tumbi leakale nembo toto, pii utupane leyo.
60004013	Recommendation	Matili Kataisa balana tai-lene oko towa panakame epola-angi, yakama epele andane wete olo-peyama nembo talapape. Wuane nembo toto, wamba Kataisa bala tandaka neane pua teke, andipa yakamapi tandaka no atoto, epelewa atalapape.
44011006	Description	Tepa ya-kola, lapalapa andane gulene okonena anda-pangosa aki mindi paleyape lo wayumane andewa. Andewa-kola, yia kapuapi, koa yamepi, yuu okona minditaka ema-pene kene tukumindi atene yame okonepene tupa pitakapi, eka yamepi, puya yamepi, yame utupane pitaka paleanga andewane.
51003008	Recommendation	Okone angi, yakamato yamapane koo palu atoto, wandakali yangone tupa towa embowa, yatakawa ateai. Wuane pua atoto, yakamato pii koo kalato atene tupa loto, wandakali waka tupa andayo pii koo tupa lo ateaini. Wamba yakamato wuane pua ateaini tekeko, andipa yakamato mana koo utupane pitaka awua apialapape.
44018003	Description	Poto andea-kola, wandakali okonelapo-mane yole miapakale nembo toto, anda yame peyalaini sele tupa tambu lo piape pua ateapili-pia. Polotopi piape mindiki okone teke piyane okonena, bala okonelapo towa atu atoto, piape okone pua ateainipia.
45006012	Sin	Yakamana umbaini oko katulo omolo-peya. Tene okonena, yakamana umbaini okonemane mana koo tupa minauwa lakae lo nembo tola-angi, koo piyaini mana okonemane yakamana umbaini okone bosa lo ando ateakale lo yakamato ando konda na-piyapape.
53003012	Recommendation	Wandakali waka tupamane aki peyaipe lo mane wako pua andama epoko pua ata napene, wandakali utupane-mane yakama tanena tomo tupa namakale nembo toto, piape pua atape-pene. Nanimato Akali Andane Jisasa Kataisana gene oko loto, pii okone akali utupane lamaiyama nayu leyama.
44007009	Sin	Nanimana yumbane utupane-mane yakamana amene Josepe oko towa apiangu puato, balato yole mia napene, akali waka tupana piape mee pua atapowa ateakale nembo teainipia. Utupane-mane wuane nembo toto, Isipi tane minditupa-mane bala kambo awua peakale leaini tekeko, Gote bala Josepe towa atu ateaipia.
44011028	Description	Potopesa akali epeaini utupanena mindi Akapasa lene okomane ika loto, Oli Sipitisa okona tai-lene okomane pii mindi lo pana wato, ulia nono andane mindi yuu yo peya tupa pitakana yolopeya leaipia. Matili Kolotiyasa bala Lomo tane gapomane akali kawane atea-angi, pii wamba Akapasato leane okone enene guleaipia.
44020036	Description	Poloto pii utupane lokoyo piyu, akali esamane tupa towa aiki leka wato, pote lea.
48005024	Faith	Yuunga wandakali nanima pitaka-mane nembo-tene wambane oko wato minuto, wandakali mindina minditaka yola tupa miauwa lakae lo nembo talamane. Molane asia mindi naeya-kola, nanima yataka wato, mana koo mindi mina-makale nembo talamane. Wuane tekeko, wamba nanima Jisasa Kataisana yame gulema-angi, nanimato mana koo utupane masia maema okomane nanimana nembo-tene wambane oko Jisasana ita malamanda okona peyo ome lema.
59001002	Recommendation	Nambana amene imalini yame, yakamato Gote lo bilipi leyama nayu leyaipe, naleyaipe lo andoyale, Goteto kenda-pene mindipene-mindipene tupa yakamanga epeakale lo ando kondalane. Dee, yakama Kitisene tai atalapale nembo toto, Goteto kenda-pene utupane yakamanga epeakale loto, yakamana bilipi oko minu mandeke peakale lo ando kondalane teke. Tene okonena, kenda-pene utupane yakamanga epola-angi, yakamato epelewa teke atape-pene nembo talapape.
62001006	Sin	Tene okonena, nanimato bala towa nembo mindiki palu ateyama loto teke, mana koo tupa wato minuto, undupi-lene okona epoko pua atemando, nanimato pii enene oko nalene, owato pii loloma-kola pulupeya.
44010011	Description	Andea-kola, ati kenga iyu oko yapu lo lapo puato, asini lumba-yene yaepia. Lumba-yene ya-kola, mindimane lapalapa andane wete gulene mindina duni tukumindi tupana minatawa atoto, yuunga tepa ama-ama pua tepa yaepia.
44002009	Description	Nanima Patiya tanepi, Mitiya tanepi, Ilama tanepi, Mesopotemia tanepi, Jutiya tanepi, Kapatosia tanepi, Pondasa tanepi, Esia tanepi, yuu utupanena tane tupa pitaka epo ateyama.
51001010	Faith	
54001018	Recommendation	Sipi mindina ingane minalane akali mindimane ana andane mindi sipi polane asia okona yola oko andoto teke, tuu puato, sipi okone mopeke nalene, asia mindiki okonena teke peando, sipi okone ana okonena pambe loto, koyolo-peya. Wuane pua teke, owato tisa tupamane yakama tanena mana tupa yapa lo tale puato, mana koo minditupa mineyama lo andoto teke, tuu puato, yamapane peke na-lalaini. Jia. Utupane-mane mana koo utupane minu atoto, Kataisa lo bilipi leaini mana oko awua tepa alaini. Wuane piyane pua teke, akali Aimeniasa, Alekesanda-la, okonelapo-mane liyambana bilipi oko awua tepa alu, Jisasa lamba leapi. Liyambato Jisasa lamba nalape-pene ya lo andeakale loto, nambato akali okonelapo Satanena kininga maewa. Nambana iwanane Timoti, wamba akali minditupa-mane potopesa pii mindi loto, nimbato Gotena piape oko kuai lo pua atolopele leainipia. Andipa nimbato pii okone nembo tolo-peke loto, Kataisa lo bilipi leyo nayu loto, nimbana mana minalene tupa yapa lo tale puato, mana epene miniyope, mana koo miniyope lo andape. Gotena wenonga koo tene mindi nimbanga naeya lo andoto, nimbato owato tisa tupa towa yanda pimawuato, Gotena piape oko pua atape leyo.
66019001	Faith	Matili nambato ale ewa-kola, ati kenga kili kalae leane oko wandakali kambua-mane pii taimane lene gulea. Utupane-mane pii mindi leane oko loto, Bapilone tano oko pamuku wanda mindi gulo atoto, mana koo tupa minuto, yuu okona wandakali tupa minu koyoto, Gotena piape akali minditupa peyo ome leako leai. Goteto pamuku wanda andane okone yapa lo tale puato, mana koo okonena tene oko balanga yata wato, yole koo mindi bala maya. Wuaneko, Goteto mana epene tika-pene oko wato minuto, pii enene oko loto, wandakali yapa lo tale piyane lo nanimato andeyama. Andoto, nanimana Gote okomane nanima molo-peke leane nembo toto, nanimato balana gene oko laiyu loto, balanga tai-lene wete eya-kola, balana gene andane wete eya lamakale. Wandakali utupane-mane wuane leai.
49002001	Grace	Wamba yame waka wandakali yakamato mana koo kambua minu ateai okonemane yakama wandakali omene gulo ateai.
46010021	Sin	
49005003	Recommendation	Pamuku piyaini wandakali tupapi, mana koo kalato atene minalaini wandakali tupapi, minditaka kambua miawa lakae lo nembo talaini wandakali tupapi, wandakali utupane owato gote tupa lo lotu lalaini wandakali gulo ateyai. Wuane piyaini wandakali utupane Kataisa-la, Gote-la, okone-lapona yuu epene okona katulo kolandaka nalolo-peyai. Yakamato mana koo utupane wato minuto, wandakali-mane giwa yakale loto, pii koo yala-pene tupa leaindo, yakamana mana okone katu nalolo-peya. Yakama Gotena wandakali ateyama nembo toto, pamuku piyaini mana okopi, minditaka kambua miauwa lakae lo nembo talaini mana okopi, mana koo kalato atene tupapi, mana koo okonepene tupa yakamato wato mina napene konda yaindo, yakamana mana okone kuai-lene yolopeya. Tene okonena, yakamato mana koo okonepene tupa wato mina napene, Gote wayu pele lalapape.
56001015	Sin	Mana epene minalaini wandakali tupamane andeyai-kola, Gotena wenonga minditaka eya tupa pitaka epene teke-teke eya lo andalaini. Wuane tekeko, Kataisa lo bilipi nalene wandakali utupane yakamana mini yamapa-la, lapotaka koyatane eya okonena, utupane-mane andeyai-kola, minditaka eya tupa pitaka koo teke-teke eya nembo talaini.
44009021	Description	Lamaiya-kola, balana pii leane okone ale yaini wandakali pitaka-mane moko andane loto, wua leainipia: Wamba akali okonemane Jutusaleme atoto, Jisasana gene oko loto, pote lo lotu lalaini wandakali tupa minu koyo atalane. Balato wali Damasakasa ateyai Kitisene wandakali tupa andi lo awua pitisa akali kawane tupa ateyainga pokale loto, Damasakasa ipupia okonde leainipia.
58008006	Description	Poto, balato pitisa piape piyane okomane Lipai yame tupamane pitisa piape piyaini okone sia minuto, piape kuai lo wete piyane. Wamba Goteto Isatale tane wandakali tupa towa pii mindi lo yata wato, potomisa pii minditupa leane tekeko, matili balato pii waka wenene mindi lo yata wato, potomisa pii epene wete minditupa lo yata yane okomane pii wamba ini bulupane lo yata yane okone sia mineaipia. Jisasa bala wandakali, Gote-la, utupanena tombenenga akali atoto, pii wenene Goteto lo yata yane okone lo tai laya yaepia.
50001021	Faith	Namba oma napene, saka atewando, nambato Kataisana piape puluwa-kola, piape okonemane dini epene minditupa lulupeya tekeko, namba omewando, namba Kataisa ateyanga poto, kuai lo wete atolopeyo. Tene okonena, namba saka atokalepe, omokalepe namba tane nembo nateyo.
50001006	Faith	Nambato Gotena pii layene epene oko wandakali tupa lamawua ateyo-kola, akali minditupa-mane namba andi loto, kosimi lalaini. Utupane-mane namba kosimi leyai-kola, nambato Gotena pii lalawane okone pii enene mindi lalawane loto, Gotena pii layene epene oko mo tai laya alawane. Namba andi nalene, mee ateyo-angi, nambato wuane teke piyawane. Yakama pitaka-mane namba towa potomane lo ateyai-kola, Goteto nanima pitaka ondowa moyalane okonena, yakama pitaka nambana yamapane yene yame ateyai nembo talawane okone katu leya.
62005020	Faith	Nanimato Gote enene oko nembo talapale loto, balana Iwanane oko epoto, nembo-tene epene minditupa nanima geane nembo teyama. Balato wuane peane okonena, nanima Gote enene oko towa atu atoto, balana Iwanane Jisasa Kataisa towa atu ateyama. Bala Gote enene oko atoto, wandakali saka atapowa ateakale lo ataya alane-ko.
45012018	Recommendation	
58010023	Faith	Wamba nanimato pii mindi loto, matili Goteto nanima moyoyale wua pulupeya lema okonena, nanima mini lapo pali napimakale. Jia. Goteto minditaka pukale leane utupane pitaka enene wete piyane-ko. Goteto nanima moyoyale mangene minditupa pukale leane tupa pulupeya nembo toto, nanimato wayumane nembo tatawa atamakale.
43014027	Grace	Nambato yakamana yamapane mo tambo laya wato, yakama tepa alu pokale. Gote lo bilipi nalene wandakali tupamane yangone mindina yamapane mo tambo laya alaini pua teke, nambato yakamana yamapane mo tambo laya naeyo. Jia. Nambato utupane sia minuto, yakamana yamapane mo tambo wete laya eyo-ko. Namba yakama tepa alu, polowa-angi, yakamato anu pulu-peyamape lo nembo kambua toto, yuku aa na-piyapape.
47005006	Faith	Andipa nanimato bala lee-mane anda napene atoto teke, bala lo bilipi loto, balana mana tupa wato minuto, epoko pua atalamane. Tene okonena, nanima omolomane lo yuku naene, Akali Andane okona piape pua atalamane. Wuane tekeko, nanimana umbaini oko nanimana anda guleya-kola, nanima Akali Andane oko towa atu balana anda ati kenga ateya okona ata napeyama nembo teyama.
43012047	Grace	Namba yuu okona epewane oko yuu okona wandakali tupa yapa lo tale pulu na-epewane. Jia. Nambato utupane molo-peke lolo epewane. Wuaneko, wandakali-mane nambana pii oko ale wato, wato mina napeando, nambato bala yapa lo tale puato, koo tene mindi balanga yata na-olopeyo. Jia.
62003012	Sin	Nanima akali Kene yale ata napimakale. Jia. Balana amene Epoloto mana epene tika-pene tupa wato minu ateane tekeko, Keneto mana koo tupa wato minu ateaipia. Balato mana koo mindi minuto, akali koo Satane okona andopane atoto, balana amene Epolo oko peyo ome leaipia.
66016020	Description	Yuu yundukumi andane wetete okone minea-kola, yuu wangianepi, ipa angini andane tupana tombenenga yuu ailene yane tupapi, utupane pitaka latako pea.
58011012	Description	Mandea-kola, Apatakame bala akali mini-yene omape-pene gulene ateane tekeko, bala wandakali kambua wete tupana yumbane guleaipia. Apatakame balana mandiyene tupana yame kambua wete ati kenga kaiyanda ateya oko-tuma, ipa mau eya oko-tuma, guleai-kola, wandakali mindimane katulo dii nalape-pene guleaipia.
54001017	Faith	Balato wuane peane okonena, nambato balana gene oko laiyu loto, nanimato Gote lee-mane anda na-piyamane tekeko, bala angu Gote enene wetete ateya leyo. Bala katulo oma napiyane. Ole dindi lo bala yuu pitakana kiŋi atalane. Matili-matilipi, wandakali pitaka-mane balana gene oko laiyu loto, bala tama pua atape-pene. Enene.
66014007	Faith	Yuu lo epoko pua atoto, balato pii taimane loto, wamba Goteto yuupi, ati kengapi, ipa solewatapi, ipa lai yungalanepi, utupane pitaka yakale leane lea. Andipa balato wandakali yapa lo tale pulane oto oko wamba mandaka guleya-ko. Yakamato balana gene oko laiyu loto, lotu lalapape lea.
44006001	Description	Jisasa lo bilipi lene yame oko andane gulama lama peai-kola, ole dindi lo Iputu pii lalaini Kitisene wandakali tupamane Iputu pii lalaini wanda yalo tupa moyoto, tomopi, waka minditakapi, utupanena minditupa maiyaini tekeko, utupane-mane Gitiki pii lalaini wanda yalo tupa kuai lo moya napeainipia. Wuane peainga andoto, Gitiki pii lalaini Kitisene wandakali tupamane Atamaiki pii lalaini Kitisene tupa towa yataka wato, mulu-mulu lo ateainipia.
60002021	Grace	Kataisato owato pii mindi nalene, mana koo waka mindi mina napeane teke. Jia. Wandakali-mane bala ando pii koo leai-kola, utupane-mane pii koo leaini okonena yano peyoto, balato pii koo mindi lapeke naleane. Wandakali-mane bala tandaka mayai-kola, balato utupane paini tandaka mauwakale naleane. Jia. Wandakali pitakana mana kuai lo tale piyane jasa okomane bala moyolo-peya nembo toto, Kataisa bala tane Gotena kininga yata yaepia. Kataisato mana epene utupane mineane pua, yakamatopi mana epene utupane wato minu atalapale loto, yakama moyoyale bala tandaka no atoto, mana epene tupa angu wato minu ateane. Tene okonena, yakamatopi mana epene tupa minu atolai-kola, wandakali mindimane yakama mee peleando, peleakale lo yakamato ando kondalapale loto, Goteto yakama ee lo meane oko nambato andeyo.
53003010	Recommendation	
43003016	Grace	Wamba Gotena iwanane okone ati kenga atea-kola, Goteto bala yuunga epeakale loto, wandakali tupa yapa lo tale peakale naleaipia. Jia. Balana iwanane okonemane wandakali tupa molo-peke leakale loto, Goteto bala yuunga epeakale leaipia-ko. Goteto wandakali tupa pitaka epelewa yamapane yo atoto, balana iwanane okone lo bilipi lolai wandakali tupa alu napene, pitaka saka atapowa ateakale nembo toto, balana iwanane mindiki oko angu epeakale leane.
44019015	Description	Lamai-yaikola, sipitisa koo okonemane iwanane utupane lamawuato, nambato Jisasa okone wayumane andeyawane. Dee, Polopi andeyawane tekeko, yakama api tupape leaipia.
66019019	Violence	Enjole okonemane wuane lea-angi, nambato pusi kapua andane wetete okopi, yuu okona kiŋi tupapi, utupanena ami tupapi, utupane andewa. Utupane-mane yia osanga peteane akali tupapi, balana ami okopi, utupane yanda pimauyale epo amunguli pua ateai.
44027002	Description	Atamituma tano okona tane tupana sipi mindi Esia potopinjia okona ipa solewata matenenga tano yane tupana poyale pea-kola, nanima sipi okonena peakaiyu lo petema. Masetonia potopinjia okona tano Tesalonaika tane Atitakusa bala nanima towa atu sipi okonena pitiyu pema.
58013003	Recommendation	Kitisene wandakali waka mindi katapusa paleando, yakamapi utupane towa atu katapusa palene atoto, katapusa pangulane wandakali okone ondo wato moyalapape. Wandakali-mane Kitisene wandakali mindinga kenda-pene mindi maula-kola, Kitisene okonemane kenda-pene okone awua ateando, yakamapi wandakali okone towa atu kenda-pene okone awua atene atoto, wandakali okone ondo wato moyalapape.
51003017	Recommendation	Dee, yakamato Akali Andane Jisasana mana wato minuto, pii lolai tupapi, piape pulai tupapi, utupane pitaka pua atalapape. Wuane pua atoto, yakamato balana gene oko loto, Ayiane Gote oko ando wayu pele lalapape.
48006006	Recommendation	Yakamato wuane pua atape-pene tekeko, Gotena pii layene epene okona mana mo atolane wandakali okomane balana minditaka epene yolane tupa pitaka tale puato, minditupa mana langulane akali oko maipe-pene.
44007005	Description	Apatakame bala yuu okonena wamba bulupane epeane-angi, Goteto bala yuu aŋako kee mindiki atolanepi mindi mai napeaipia. Okone angi, Apatakame bala andopane mindi mandi napene, mee ateane tekeko, Goteto potomisa pii mindi bala lamawuato, matili Apatakamepi, balana mandiyene tupapi, utupane yuu okonena ateakale loto, yuu okone utupanena yakale mauwakale leaipia.
