44013030	Description	ಆದರೆ ದೇವರು ಯೇಸುವನ್ನು ಸತ್ತವರೊಳಗಿಂದ ಜೀವಂತವಾಗಿ ಎಬ್ಬಿಸಿದರು.
43010011	Description	“ನಾನೇ ಒಳ್ಳೆಯ ಕುರುಬನು. ಒಳ್ಳೆಯ ಕುರುಬನು ಕುರಿಗಳಿಗೋಸ್ಕರ ತನ್ನ ಪ್ರಾಣವನ್ನು ಕೊಡುತ್ತಾನೆ.
49003002	Grace	ನಿಮಗೋಸ್ಕರವಾಗಿ ನನಗೆ ಕೊಡಲಾದ ದೇವರ ಕೃಪೆಯ ಕಾರ್ಯಭಾರವನ್ನು ನೀವು ಕೇಳಿದ್ದೀರಿ,
56003010	Recommendation	ಭೇದ ಹುಟ್ಟಿಸುವವರನ್ನು ಒಂದೆರಡು ಸಾರಿ ಬುದ್ಧಿ ಹೇಳಿದ ಮೇಲೆ ಬಿಟ್ಟುಬಿಡು. ಅಂಥವರ ಸಹವಾಸ ಮಾಡದಿರು.
43010019	Description	ಈ ಮಾತುಗಳ ದೆಸೆಯಿಂದ ಯೆಹೂದ್ಯರ ಮಧ್ಯದಲ್ಲಿ ಮತ್ತೆ ಭೇದ ಉಂಟಾಯಿತು.
43003033	Faith	ಅವರ ಸಾಕ್ಷಿಯನ್ನು ಸ್ವೀಕರಿಸಿದವರು ದೇವರು ಸತ್ಯವಂತರೆಂದು ಮುದ್ರೆ ಹಾಕಿದ್ದಾರೆ.
61003014	Recommendation	ಆದಕಾರಣ ಪ್ರಿಯ ಸ್ನೇಹಿತರೇ, ನೀವು ಇಂಥವುಗಳನ್ನು ಎದುರು ನೋಡುವವರಾಗಿರುವುದರಿಂದ ಸಮಾಧಾನದಲ್ಲಿದ್ದು ನಿರ್ಮಲರಾಗಿಯೂ ನಿರ್ದೋಷಿಗಳಾಗಿಯೂ ಅವರಿಗೆ ಕಾಣಿಸಿಕೊಳ್ಳುವಂತೆ ಜಾಗ್ರತೆಯುಳ್ಳವರಾಗಿರಿ.
53003001	Faith	ಕೊನೆಯದಾಗಿ ಪ್ರಿಯರೇ, ಕರ್ತ ಯೇಸುವಿನ ವಾಕ್ಯವು ನಿಮ್ಮಲ್ಲಿ ಹಬ್ಬಿದಂತೆ ಎಲ್ಲ ಕಡೆಗಳಲ್ಲಿಯೂ ಅತಿವೇಗದಿಂದ ಹಬ್ಬಿ ಹರಡುವಂತೆ ನಮಗಾಗಿ ಬೇಡಿಕೊಳ್ಳಿರಿ.
47004014	Faith	ಏಕೆಂದರೆ, ಕರ್ತ ಯೇಸುವನ್ನು ಸತ್ತವರೊಳಗಿಂದ ಎಬ್ಬಿಸಿದ ದೇವರೇ, ನಮ್ಮನ್ನೂ ಸಹ ಯೇಸುವಿನೊಂದಿಗೆ ಎಬ್ಬಿಸಿ, ನಿಮ್ಮ ಜೊತೆಯಲ್ಲಿಯೂ ನಿಲ್ಲಿಸುವನೆಂದು ತಿಳಿದವರಾಗಿದ್ದೇವೆ.
59005014	Recommendation	ನಿಮ್ಮಲ್ಲಿ ಯಾವನಾದರೂ ಅಸ್ವಸ್ಥನಾಗಿರುವವನು ಇದ್ದಾನೋ? ಅವನು ಸಭೆಯ ಹಿರಿಯನನ್ನು ಕರೆಕಳುಹಿಸಲಿ. ಅವರು ಕರ್ತ ಯೇಸುವಿನ ಹೆಸರಿನಿಂದ ಎಣ್ಣೆ ಹಚ್ಚಿ ಅವನಿಗೋಸ್ಕರ ಪ್ರಾರ್ಥಿಸಲಿ.
44007023	Description	“ಮೋಶೆ ನಲವತ್ತು ವರ್ಷ ವಯಸ್ಸಾಗಿದ್ದಾಗ, ತನ್ನ ಬಂಧುಗಳಾದ ಇಸ್ರಾಯೇಲ್ ಪುತ್ರರನ್ನು ಸಂದರ್ಶಿಸಬೇಕೆಂದು ತೀರ್ಮಾನಿಸಿದನು.
44023027	Violence	ಈ ಪೌಲನನ್ನು ಯೆಹೂದ್ಯರು ಬಂಧಿಸಿ, ಇವನನ್ನು ಕೊಲ್ಲಬೇಕೆಂದಿದ್ದರು. ಆದರೆ ನಾನು ಸೈನಿಕರೊಂದಿಗೆ ಹೋಗಿ ಇವನನ್ನು ಬಿಡಿಸಿದೆನು. ಇವನು ರೋಮ್ ಪೌರ ಎಂದು ನನಗೆ ಗೊತ್ತಾಯಿತು.
44019029	Description	ಕೂಡಲೇ ಇಡೀ ಪಟ್ಟಣದಲ್ಲೆಲ್ಲಾ ಕೋಲಾಹಲ ಉಂಟಾಯಿತು. ಜನರು ಗುಂಪಾಗಿ ಕೂಡಿಕೊಂಡು ಬಂದು ಮಕೆದೋನ್ಯದಿಂದ ಪೌಲನೊಂದಿಗೆ ಪ್ರಯಾಣಮಾಡಿ ಬಂದ, ಗಾಯ ಮತ್ತು ಅರಿಸ್ತಾರ್ಕರನ್ನು ಬಂಧಿಸಿ ಕ್ರೀಡಾಂಗಣದೊಳಗೆ ಎಳೆದುಕೊಂಡು ಬಂದರು.
44003014	Sin	ಆದರೆ ನೀವು ಪವಿತ್ರರೂ ನೀತಿವಂತರೂ ಆಗಿರುವ ಯೇಸುವನ್ನು ನಿರಾಕರಿಸಿ ಆ ಕೊಲೆಗಾರನನ್ನು ನಿಮಗೆ ಬಿಡುಗಡೆ ಮಾಡಿಕೊಡಬೇಕೆಂದು ಕೇಳಿಕೊಂಡಿರಿ.
44015009	Faith	ದೇವರು ಅವರಿಗೂ ನಮಗೂ ಮಧ್ಯದಲ್ಲಿ ಯಾವುದೇ ವ್ಯತ್ಯಾಸವನ್ನು ಮಾಡದೆ, ವಿಶ್ವಾಸದ ಮೂಲಕ ಅವರ ಹೃದಯಗಳನ್ನು ಶುದ್ಧೀಕರಿಸಿದರು.
46011028	Recommendation	ಆದರೆ ಪ್ರತಿಯೊಬ್ಬರೂ ತಮ್ಮನ್ನು ಪರೀಕ್ಷಿಸಿಕೊಂಡವರಾಗಿ, ಆ ರೊಟ್ಟಿಯನ್ನು ತೆಗೆದುಕೊಂಡು ತಿನ್ನಲಿ, ಆ ಪಾತ್ರೆಯಲ್ಲಿ ಕುಡಿಯಲಿ.
46015058	Faith	ಆದ್ದರಿಂದ, ನನ್ನ ಪ್ರಿಯ ಸಹೋದರರೇ, ಸ್ಥಿರವಾಗಿ ನಿಲ್ಲಿರಿ. ಯಾವುದೂ ನಿಮ್ಮನ್ನು ಕದಲಿಸದಿರಲಿ. ಕರ್ತನಲ್ಲಿ ನಿಮ್ಮ ಪ್ರಯಾಸವು ನಿಷ್ಫಲವಾಗುವುದಿಲ್ಲವೆಂದು ತಿಳಿದು, ಕರ್ತನ ಕೆಲಸಕ್ಕೆ ಯಾವಾಗಲೂ ನಿಮ್ಮನ್ನು ಸಂಪೂರ್ಣವಾಗಿ ಒಪ್ಪಿಸಿಕೊಡಿರಿ.
46004016	Recommendation	ಆದ್ದರಿಂದ ನೀವು ನನ್ನನ್ನು ಅನುಕರಣೆ ಮಾಡುವವರಾಗಿ ಇರಬೇಕು ಎಂದು ನಿಮ್ಮನ್ನು ಬೇಡಿಕೊಳ್ಳುತ್ತೇನೆ.
46001021	Faith	ಈ ಪ್ರಪಂಚವು ತನ್ನ ಜ್ಞಾನದ ಮೂಲಕ ದೇವರನ್ನು ಅರಿತುಕೊಳ್ಳಲಿಲ್ಲ; ಆದ್ದರಿಂದ ದೇವರ ಜ್ಞಾನದಿಂದ, ನಂಬಿದವರನ್ನು ಪ್ರಸಂಗದ ಬುದ್ದಿಹೀನತೆಯಿಂದ ರಕ್ಷಿಸುವುದು ದೇವರಿಗೆ ಮೆಚ್ಚುಗೆಯಾಯಿತು.
60003001	Recommendation	ಅದೇ ರೀತಿಯಾಗಿ ಪತ್ನಿಯರೇ, ನಿಮ್ಮ ಗಂಡಂದಿರಿಗೆ ಅಧೀನರಾಗಿರಿ. ಪತಿಯರಲ್ಲಿ ಯಾರಾದರೂ ವಾಕ್ಯವನ್ನು ಸ್ವೀಕರಿಸದವರಾಗಿದ್ದರೂ ಪತ್ನಿಯರ ನಡತೆಯಿಂದ ವಾಕ್ಯವಿಲ್ಲದೆ ಅವರನ್ನು ಗೆಲ್ಲುವಂತೆ,
47005020	Recommendation	ಆದ್ದರಿಂದ ನಾವು ಕ್ರಿಸ್ತ ಯೇಸುವಿನ ರಾಯಭಾರಿಗಳಾಗಿದ್ದೇವೆ. ದೇವರೇ ನಮ್ಮ ಮೂಲಕ ನಿಮಗೆ ಕರೆ ನೀಡುತ್ತಾರೆ. ಆದ್ದರಿಂದ ಕ್ರಿಸ್ತ ಯೇಸುವಿನ ಪರವಾಗಿ ನಿಮ್ಮನ್ನು ಬೇಡಿಕೊಳ್ಳುವುದೇನೆಂದರೆ: ದೇವರೊಡನೆ ಸಮಾಧಾನ ಮಾಡಿಕೊಳ್ಳಿರಿ.
44002024	Description	ಆದರೆ ದೇವರು ಯೇಸುವನ್ನು ಮರಣ ವೇದನೆಯಿಂದ ಬಿಡಿಸಿ ಜೀವಂತವಾಗಿ ಎಬ್ಬಿಸಿದರು. ಏಕೆಂದರೆ ಯೇಸುವನ್ನು ಹಿಡಿದಿಟ್ಟುಕೊಂಡಿರಲು ಮರಣಕ್ಕೆ ಸಾಧ್ಯವಾಗಲಿಲ್ಲ.
59002007	Sin	ನೀವು ಕರೆಸಿಕೊಳ್ಳುವ ಆ ಯೋಗ್ಯವಾದ ನಾಮವನ್ನು ದೂಷಿಸುವವರು ಅವರಲ್ಲವೇ?
54003003	Description	ಅವನು ಮದ್ಯಪಾನ ಮಾಡುವವನಾಗಿರಬಾರದು, ಹೊಡೆದಾಡುವವನಾಗಿರಬಾರದು. ಆದರೆ ಸಾತ್ವಿಕನೂ ಕುತರ್ಕ ಮಾಡದವನೂ ಹಣದಾಶೆಯಿಲ್ಲದವನೂ ಆಗಿರಬೇಕು.
43004014	Grace	ಆದರೆ ನಾನು ಕೊಡುವ ನೀರನ್ನು ಕುಡಿಯುವವರಿಗೆ ಎಂದೆಂದಿಗೂ ದಾಹವಾಗದು. ನಾನು ಅವರಿಗೆ ಕೊಡುವ ನೀರು ಅವರಲ್ಲಿ ನಿತ್ಯಜೀವಕ್ಕೆ ಉಕ್ಕುವ ನೀರಿನ ಬುಗ್ಗೆಯಾಗಿರುವುದು,” ಎಂದರು.
62002005	Faith	ಯಾವನಾದರೂ ದೇವರ ವಾಕ್ಯವನ್ನು ಕೈಕೊಂಡು ನಡೆದರೆ ಅವನಲ್ಲಿ ನಿಜವಾಗಿ ದೇವರ ಪ್ರೀತಿಯು ಪರಿಪೂರ್ಣವಾಗಿದೆ. ಇದರಿಂದಲೇ ನಾವು ದೇವರಲ್ಲಿದ್ದೇವೆಂಬುದನ್ನು ತಿಳಿದುಕೊಳ್ಳುತ್ತೇವೆ.
66016013	Description	ಆಗ ಕಪ್ಪೆಗಳಂತೆ ಕಾಣುವ ಮೂರು ಅಶುದ್ಧಾತ್ಮಗಳು ಘಟಸರ್ಪನ ಬಾಯೊಳಗಿಂದಲೂ ಮತ್ತು ಸುಳ್ಳು ಪ್ರವಾದಿಯ ಬಾಯೊಳಗಿಂದಲೂ ಮೃಗದ ಬಾಯೊಳಗಿಂದಲೂ ಬರುವುದನ್ನು ಕಂಡೆನು.
59002008	Recommendation	“ನಿನ್ನ ನೆರೆಯವನನ್ನು ನಿನ್ನಂತೆಯೇ ಪ್ರೀತಿಸಬೇಕು!” ಎಂದು ಪವಿತ್ರ ವೇದದಲ್ಲಿ ಬರೆದಿದೆ. ಈ ರಾಜಾಜ್ಞೆಯನ್ನು ನೆರವೇರಿಸುವವರಾದರೆ ನೀವು ಉತ್ತಮವಾದದ್ದನ್ನು ಮಾಡುವವರಾಗಿರುವಿರಿ.
47004005	Faith	ನಾವು ನಮ್ಮ ಬಗ್ಗೆಯೇ ಪ್ರಚಾರ ಮಾಡುವುದಿಲ್ಲ. ಆದರೆ ಕ್ರಿಸ್ತ ಯೇಸು ಕರ್ತ ದೇವರೆಂದೂ ನಾವು ಯೇಸುವಿಗಾಗಿ ನಿಮ್ಮ ಸೇವಕರಾಗಿದ್ದೇವೆ ಎಂದೂ ಪ್ರಚುರಪಡಿಸುತ್ತೇವೆ.
46015033	Recommendation	ಮೋಸಹೋಗಬೇಡಿರಿ. ಏಕೆಂದರೆ, “ದುಸ್ಸಹವಾಸವು ಸದಾಚಾರವನ್ನು ಕೆಡಿಸುತ್ತದೆ.”
58013020	Grace	ಕುರಿ ಹಿಂಡಿಗೆ ಮಹಾಕುರುಬ ಆಗಿರುವ ನಮ್ಮ ಕರ್ತ ಯೇಸುವನ್ನು ನಿತ್ಯಒಡಂಬಡಿಕೆಯ ರಕ್ತದ ಮೂಲಕ ಸಮಾಧಾನದ ದೇವರು ಸತ್ತವರೊಳಗಿಂದ ಜೀವಂತವಾಗಿ ಬರಮಾಡಿದರು.
50001027	Recommendation	ಏನೇ ಸಂಭವಿಸಿದರೂ ಕ್ರಿಸ್ತನ ಸುವಾರ್ತೆಗೆ ಯೋಗ್ಯರಾಗಿ ನಡೆದುಕೊಳ್ಳಿರಿ. ಆಗ ನಾನು ಬಂದು ನಿಮ್ಮನ್ನು ನೋಡಿದರೂ ಸರಿ, ದೂರದಲ್ಲಿದ್ದು ನಿಮ್ಮ ವಿಷಯವಾಗಿ ಕೇಳಿದರೂ ಸರಿ, ನೀವು ಒಂದೇ ಆತ್ಮದಲ್ಲಿ ದೃಢವಾಗಿ ನಿಂತು ಸುವಾರ್ತೆಯಲ್ಲಿಟ್ಟ ನಂಬಿಕೆಗಾಗಿ ಒಂದೇ ಮನಸ್ಸಿನಿಂದ ಒಟ್ಟಿಗೆ ಹೋರಾಡುವವರಾಗಿದ್ದೀರೆಂದು ನಾನು ತಿಳಿದುಕೊಳ್ಳುವೆನು.
46006014	Grace	ದೇವರು ತಮ್ಮ ಶಕ್ತಿಯಿಂದ ನಮಗೆ ಕರ್ತ ಆಗಿರುವ ಯೇಸುವನ್ನು ಸತ್ತವರೊಳಗಿಂದ ಎಬ್ಬಿಸಿದರು ಮತ್ತು ನಮ್ಮನ್ನೂ ಎಬ್ಬಿಸುವರು.
55001006	Recommendation	ಆದಕಾರಣ ನಾನು ನಿನ್ನ ತಲೆಯ ಮೇಲೆ ಹಸ್ತಗಳನ್ನು ಇಟ್ಟಿದ್ದರ ಮೂಲಕ ನಿನಗೆ ದೊರಕಿದ ದೇವರ ವರವು ಪ್ರಜ್ವಲಿಸುವಂತೆ ಮಾಡಬೇಕೆಂದು ನಿನಗೆ ಜ್ಞಾಪಕ ಮಾಡುತ್ತೇನೆ.
60004006	Grace	ಈ ಕಾರಣದಿಂದಲೇ ಈಗ ಸತ್ತಿರುವವರಿಗೂ ಸಹ ಬದುಕಿದ್ದಾಗ ಸುವಾರ್ತೆ ಸಾರಲಾಯಿತು. ಆದ್ದರಿಂದ ಎಲ್ಲಾ ಮನುಷ್ಯರಿಗೆ ನೇಮಿಸಿದ ನ್ಯಾಯತೀರ್ಪಿನಂತೆ ಅವರು ದೇಹದಲ್ಲಿ ಮರಣ ಹೊಂದಿದ್ದರೂ, ತಮ್ಮ ಆತ್ಮದಲ್ಲಿ ದೇವರಿಗಾಗಿ ಜೀವಿಸುವರು.
46007023	Recommendation	ನಿಮ್ಮನ್ನು ಕ್ರಯಕ್ಕೆ ಕೊಳ್ಳಲಾಗಿದೆ. ಆದ್ದರಿಂದ ಮನುಷ್ಯರಿಗೆ ಗುಲಾಮರಾಗಬೇಡಿರಿ.
46010010	Recommendation	ಅವರಲ್ಲಿ ಕೆಲವರು ಗೊಣಗುಟ್ಟಿ ಸಂಹಾರಕನ ಕೈಯಿಂದ ಸಂಹಾರವಾದಂತೆ ನೀವೂ ಗೊಣಗುಟ್ಟಬೇಡಿರಿ.
47002017	Faith	ಎಷ್ಟೋ ಮಂದಿ ದೇವರ ವಾಕ್ಯವನ್ನು ಕಲಬೆರಕೆ ಮಾಡಿ, ಅದರಿಂದ ಹಣಗಳಿಸುತ್ತಾರೆ. ನಾವಾದರೋ ಹಾಗೆ ಮಾಡುವವರಲ್ಲ. ನಾವು ದೇವರಿಂದ ಕಳುಹಿಸಲಾದವರಾಗಿ ಕ್ರಿಸ್ತ ಯೇಸುವಿನಲ್ಲಿದ್ದುಕೊಂಡು ದೇವರ ಮುಂದೆ ಯಥಾರ್ಥವಾಗಿ ಮಾತನಾಡುತ್ತೇವೆ.
45015001	Recommendation	ವಿಶ್ವಾಸದಲ್ಲಿ ಬಲವುಳ್ಳವರಾದ ನಾವು ನಮ್ಮ ಸುಖವನ್ನು ನೋಡಿಕೊಳ್ಳದೆ, ಬಲಹೀನರ ಬಲಹೀನತೆಗಳನ್ನು ಸಹಿಸಿಕೊಳ್ಳಬೇಕು.
50002024	Faith	ಇದಲ್ಲದೆ ನಾನು ಸಹ ಬೇಗನೆ ಬರುವೆನೆಂದು ಕರ್ತ ದೇವರಲ್ಲಿ ಭರವಸೆಯುಳ್ಳವನಾಗಿದ್ದೇನೆ.
66007001	Description	ಇದಾದನಂತರ ನಾಲ್ಕು ದೇವದೂತರು ಭೂಮಿಯ ನಾಲ್ಕು ದಿಕ್ಕುಗಳಲ್ಲಿ ನಿಂತಿರುವುದನ್ನು ಕಂಡೆನು. ಅವರು ಭೂಮಿಯ ಮೇಲಾಗಲಿ, ಸಮುದ್ರದ ಮೇಲಾಗಲಿ ಅಥವಾ ಯಾವ ಮರದ ಮೇಲಾಗಲಿ ಗಾಳಿ ಬೀಸದಂತೆ ಭೂಮಿಯ ನಾಲ್ಕು ದಿಕ್ಕಿನ ಗಾಳಿಯನ್ನು ತಡೆಹಿಡಿದಿದ್ದರು.
60004003	Sin	ದೇವರನ್ನು ಅರಿಯದ ಜನರು ಮಾಡಲು ಇಚ್ಛಿಸುವುದನ್ನೆಲ್ಲಾ ನೀವು ಗತಕಾಲದಲ್ಲಿ ಸಾಕಷ್ಟು ಮಾಡಿದ್ದೀರಿ. ಆಗ ನೀವು ಅಶ್ಲೀಲತೆ, ದುರಾಶೆಗಳು, ಕುಡುಕತನ, ಅಮಲೇರುವಿಕೆ, ದುಂದು ಔತಣಗಳು, ಅಸಹ್ಯವಾದ ವಿಗ್ರಹಾರಾಧನೆಗಳು ಇವುಗಳನ್ನು ಮಾಡುತ್ತಿದ್ದೀರಿ.
66011005	Violence	ಇವರಿಗೆ ಯಾವನಾದರೂ ಕೇಡನ್ನುಂಟುಮಾಡಬಯಸಿದರೆ, ಇವರ ಬಾಯೊಳಗಿಂದ ಬೆಂಕಿ ಹೊರಟು, ಇವರ ಶತ್ರುಗಳನ್ನು ದಹಿಸಿಬಿಡುವುದು. ಇವರಿಗೆ ಯಾವನಾದರೂ ಕೇಡನ್ನುಂಟುಮಾಡಬಯಸಿದರೆ, ಅವನಿಗೂ ಅದೇ ರೀತಿಯಾಗಿ ಕೊಲೆಯಾಗಬೇಕು.
44023005	Recommendation	“ಸಹೋದರರೇ, ಮಹಾಯಾಜಕನೆಂದು ನನಗೆ ತಿಳಿಯಲಿಲ್ಲ. ಏಕೆಂದರೆ, ‘ನಿನ್ನ ಜನರ ಅಧಿಪತಿಯ ಕುರಿತಾಗಿ ಕೆಟ್ಟದ್ದನ್ನು ಮಾತನಾಡಬಾರದು’ ಎಂದು ಪವಿತ್ರ ವೇದದಲ್ಲಿ ಬರೆದಿದೆ,” ಎಂದು ಪೌಲನು ಹೇಳಿದನು.
66022015	Sin	ಆದರೆ ನಾಯಿಗಳೂ ಮಾಟಗಾರರೂ ಜಾರರೂ ಕೊಲೆಗಾರರೂ ವಿಗ್ರಹಾರಾಧಕರೂ ಸುಳ್ಳನ್ನು ಪ್ರೀತಿಸಿ ಅನುಸರಿಸುವರೆಲ್ಲರೂ ಹೊರಗಿರುವರು.
66002014	Sin	ಆದರೂ ನಿನಗೆ ವಿರೋಧವಾಗಿ ಕೆಲವು ವಿಷಯಗಳು ನನಗಿವೆ. ವಿಗ್ರಹಗಳಿಗೆ ನೈವೇದ್ಯ ಮಾಡಿದ ಪದಾರ್ಥಗಳನ್ನು ತಿನ್ನುವುದರಲ್ಲಿಯೂ ವ್ಯಭಿಚಾರ ಮಾಡುವುದರಲ್ಲಿಯೂ ಇಸ್ರಾಯೇಲರು ಮುಗ್ಗರಿಸಿ ಬೀಳುವಂತೆ ಬಿಳಾಮನು ಬಾಲಾಕನಿಗೆ ಕಲಿಸಿದ ಬೋಧನೆಯನ್ನು ಹಿಡಿದುಕೊಂಡಿರುವವರು ನಿನ್ನಲ್ಲಿದ್ದಾರೆ.
53001003	Faith	ಪ್ರಿಯರೇ, ನಾವು ಯಾವಾಗಲೂ ನಿಮಗಾಗಿ ದೇವರಿಗೆ ಕೃತಜ್ಞತೆಯನ್ನು ಸಲ್ಲಿಸಲು ಬದ್ಧರಾಗಿದ್ದೇವೆ. ಹಾಗೆ ಮಾಡುವುದು ಯೋಗ್ಯ. ಏಕೆಂದರೆ ನಿಮ್ಮ ವಿಶ್ವಾಸವು ಹೆಚ್ಚೆಚ್ಚಾಗಿ ಅಭಿವೃದ್ಧಿಯಾಗುತ್ತಾ ಇದೆ ಮತ್ತು ಪರಸ್ಪರ ನಿಮ್ಮೆಲ್ಲರಲ್ಲಿ ಪ್ರೀತಿಯೂ ಹೆಚ್ಚುತ್ತಿದೆ.
46012002	Sin	ನೀವು ಕ್ರಿಸ್ತನನ್ನು ನಂಬದಿದ್ದಾಗ, ಹೇಗೆ ಮೂಕ ವಿಗ್ರಹಗಳ ಕಡೆಗೆ ಪ್ರಭಾವಗೊಂಡು ದಾರಿತಪ್ಪಿ ಹೋಗಿದ್ದಿರಿ ಎಂಬುದನ್ನು ಬಲ್ಲಿರಿ.
49005025	Recommendation	ಗಂಡಂದಿರೇ, ಕ್ರಿಸ್ತ ಯೇಸು ಸಭೆಯನ್ನು ಪ್ರೀತಿಸಿ, ಅದಕ್ಕಾಗಿ ತಮ್ಮನ್ನು ತಾವೇ ಒಪ್ಪಿಸಿಕೊಟ್ಟಂತೆಯೇ ನೀವು ನಿಮ್ಮ ನಿಮ್ಮ ಹೆಂಡತಿಯರನ್ನು ಪ್ರೀತಿಸಿರಿ.
45012017	Recommendation	ಯಾರಿಗೂ ಕೆಟ್ಟದ್ದಕ್ಕೆ ಪ್ರತಿಯಾಗಿ ಕೆಟ್ಟದ್ದನ್ನು ಮಾಡಬೇಡಿರಿ. ಎಲ್ಲರ ದೃಷ್ಟಿಯಲ್ಲಿಯೂ ಒಳ್ಳೆಯದನ್ನು ಮಾಡಿರಿ.
60005006	Recommendation	ಹೀಗಿರುವುದರಿಂದ ದೇವರ ಪರಾಕ್ರಮವುಳ್ಳ ಹಸ್ತದ ಕೆಳಗೆ ನಿಮ್ಮನ್ನು ತಗ್ಗಿಸಿಕೊಳ್ಳಿರಿ, ಆಗ ದೇವರು ಸಕಾಲದಲ್ಲಿ ನಿಮ್ಮನ್ನು ಮೇಲಕ್ಕೆತ್ತುವರು.
44014017	Grace	ಆದರೂ ದೇವರು ತಮ್ಮ ಬಗ್ಗೆ ಸಾಕ್ಷಿಕೊಡದೆ ಇರಲಿಲ್ಲ. ಆಕಾಶದಿಂದ ಮಳೆಯನ್ನೂ ಸಕಾಲದಲ್ಲಿ ಬೆಳೆಯನ್ನೂ ನಿಮಗೆ ದಯಪಾಲಿಸಿ ಆಹಾರಕೊಟ್ಟು ನಿಮ್ಮ ಹೃದಯಗಳನ್ನು ಆನಂದದಿಂದ ತುಂಬಿಸಿ ಒಳ್ಳೆಯದನ್ನು ಮಾಡುತ್ತಾ ಬಂದವರು ದೇವರೇ.”
54003011	Recommendation	ಹಾಗೆಯೇ ಅವರ ಹೆಂಡತಿಯರು ಗೌರವವುಳ್ಳವರಾಗಿರಬೇಕು. ಚಾಡಿ ಹೇಳದವರೂ ಸ್ವಸ್ಥ ಬುದ್ಧಿಯುಳ್ಳವರೂ ಎಲ್ಲಾ ವಿಷಯಗಳಲ್ಲಿ ನಂಬಿಗಸ್ತರೂ ಆಗಿರತಕ್ಕದ್ದು.
66002021	Sin	ದೇವರ ಕಡೆಗೆ ತಿರುಗಿಕೊಳ್ಳುವುದಕ್ಕೆ ನಾನು ಅವಳಿಗೆ ಸಮಯವನ್ನು ಕೊಟ್ಟೆನು. ಆದರೆ ದೇವರ ಕಡೆಗೆ ತಿರುಗಿಕೊಂಡು ತನ್ನ ವ್ಯಭಿಚಾರವನ್ನು ಬಿಟ್ಟುಬಿಡಲು ಅವಳಿಗೆ ಮನಸ್ಸಿಲ್ಲ.
44012020	Description	ಅವನು ಟೈರ್ ಮತ್ತು ಸೀದೋನಿನ ಜನರೊಂದಿಗೆ ಬಹು ಕೋಪವುಳ್ಳವನಾಗಿದ್ದನು. ಈಗ ಅವರೆಲ್ಲರೂ ಒಂದಾಗಿ ಅವನ ಬಳಿ ಬಂದು ಅರಸನ ನಂಬಿಗಸ್ತ ಸೇವಕನಾದ ಬ್ಲಾಸ್ತ ಎಂಬುವನ ಬೆಂಬಲವನ್ನು ಪಡೆದುಕೊಂಡು, ಸಂಧಾನ ಮಾಡಿಕೊಳ್ಳಲು ಅರಸನನ್ನು ಕೇಳಿಕೊಂಡರು. ಏಕೆಂದರೆ ಅವರ ಆಹಾರ ಧಾನ್ಯಗಳು ಅರಸನ ಸೀಮೆಯಿಂದ ಬರುತ್ತಿದ್ದವು.
43008049	Sin	ಅದಕ್ಕೆ ಯೇಸು, “ನನಗೆ ದೆವ್ವ ಹಿಡಿದಿಲ್ಲ. ಆದರೆ ನನ್ನ ತಂದೆಯನ್ನು ಸನ್ಮಾನಿಸುತ್ತೇನೆ. ನೀವು ನನ್ನನ್ನು ಅವಮಾನಪಡಿಸುತ್ತೀರಿ.
43006018	Description	ಆಗ ರಭಸವಾದ ಗಾಳಿಯು ಬೀಸಿದ್ದರಿಂದ ಸರೋವರವು ಅಲ್ಲೋಲಕಲ್ಲೋಲವಾಯಿತು.
45008018	Faith	ನಮಗೆ ಮುಂದೆ ಪ್ರಕಟವಾಗಲಿರುವ ಮಹಿಮೆಯೊಂದಿಗೆ ಹೋಲಿಸುವಾಗ ಈಗಿನ ಸಂಕಟಗಳು ಅಲ್ಪವೆಂದು ನಾನು ಎಣಿಸುತ್ತೇನೆ.
62002012	Grace	ಪ್ರಿಯ ಮಕ್ಕಳೇ, ಕ್ರಿಸ್ತ ಯೇಸುವಿನ ಹೆಸರಿನ ನಿಮಿತ್ತ ನಿಮ್ಮ ಪಾಪಗಳು ಕ್ಷಮಿಸಲಾಗಿರುವುದರಿಂದ ನಾನು ನಿಮಗೆ ಬರೆಯುತ್ತೇನೆ.
55001009	Grace	ದೇವರು ನಮ್ಮ ಕ್ರಿಯೆಗಳಿಗನುಸಾರವಾಗಿ ಅಲ್ಲ, ತಮ್ಮ ಸ್ವಂತ ಸಂಕಲ್ಪ ಮತ್ತು ಕೃಪೆಯ ಪ್ರಕಾರ ನಮ್ಮನ್ನು ರಕ್ಷಿಸಿ ಪರಿಶುದ್ಧವಾದ ಜೀವಿತಕ್ಕೆ ನಮ್ಮನ್ನು ಕರೆದರು. ಈ ಕೃಪೆಯು ಕಾಲದ ಆರಂಭಕ್ಕೆ ಮುಂಚೆಯೇ ಕ್ರಿಸ್ತ ಯೇಸುವಿನಲ್ಲಿ ನಮಗೆ ಕೊಡಲಾಯಿತು.
43019006	Violence	ಮುಖ್ಯಯಾಜಕರೂ ಕಾವಲಾಳುಗಳೂ ಯೇಸುವನ್ನು ನೋಡಿದಾಗ, “ಶಿಲುಬೆಗೆ ಹಾಕಿಸು, ಶಿಲುಬೆಗೆ ಹಾಕಿಸು!” ಎಂದು ಕೂಗಿದರು. ಅದಕ್ಕೆ ಪಿಲಾತನು ಅವರಿಗೆ, “ನೀವೇ ಆತನನ್ನು ತೆಗೆದುಕೊಂಡುಹೋಗಿ ಶಿಲುಬೆಗೆ ಹಾಕಿರಿ. ಏಕೆಂದರೆ ನನಗೆ ಆತನಲ್ಲಿ ಯಾವ ಅಪರಾಧವೂ ಕಾಣಲಿಲ್ಲ,” ಎಂದನು.
60001010	Grace	ನಿಮಗೆ ಬರಬೇಕಾಗಿದ್ದ ಕೃಪೆಯನ್ನು ಕುರಿತು ಮುಂತಿಳಿಸಿದ ಪ್ರವಾದಿಗಳು, ಈ ರಕ್ಷಣೆಯ ವಿಷಯದಲ್ಲಿ ಸೂಕ್ಷ್ಮವಾಗಿ ವಿಚಾರಿಸಿ ಪರಿಶೋಧನೆ ಮಾಡಿದರು.
63001007	Sin	ಏಕೆಂದರೆ ನರಮಾಂಸದಲ್ಲಿ ಬಂದಿರುವ ಕ್ರಿಸ್ತ ಯೇಸುವನ್ನು ಒಪ್ಪದೆ ಇರುವ ಮೋಸಗಾರರು ಅನೇಕ ಮಂದಿ ಹೊರಟು ಲೋಕದೊಳಗೆ ಹೋಗಿದ್ದಾರೆ. ಇಂಥವರೇ ಮೋಸಗಾರರೂ ಕ್ರಿಸ್ತವಿರೋಧಿಗಳೂ ಆಗಿದ್ದಾರೆ.
44024005	Sin	“ಜಗತ್ತಿನಲ್ಲಿ ಇರುವ ಯೆಹೂದ್ಯರ ಮಧ್ಯದಲ್ಲಿ ದಂಗೆಯೆಬ್ಬಿಸಿ ಪೌಲನೆಂಬ ಈ ಮನುಷ್ಯನು ತೊಂದರೆ ಕೊಡುವವನಾಗಿದ್ದಾನೆಂತಲೂ ನಜರೇತಿನವರ ಪಂಗಡಕ್ಕೆ ಇವನು ನಾಯಕನೆಂದೂ ನಾವು ಕಂಡೆವು.
54003016	Grace	ಎಲ್ಲಾ ಪ್ರಶ್ನೆಗಳಿಂದ ಹೆಚ್ಚಾಗಿ ದೈವ ಭಕ್ತಿಯ ರಹಸ್ಯವು ದೊಡ್ಡದಾದದ್ದು ಅದು ಯಾವುದೆಂದರೆ: “ದೇವರು ಮನುಷ್ಯ ರೂಪದಲ್ಲಿ ಪ್ರತ್ಯಕ್ಷರಾದರು. ಆತ್ಮದಲ್ಲಿ ರುಜುಪಡಿಸಲಾದರು. ದೂತರಿಗೆ ಕಾಣಿಸಿಕೊಂಡರು, ಯೆಹೂದ್ಯರಲ್ಲದವರಿಗೆ ಸಾರಲಾದರು, ಲೋಕದಲ್ಲಿ ನಂಬಲಾದರು, ಮಹಿಮೆಗೆ ಒಯ್ಯಲಾದರು!”
66016021	Violence	ಆಕಾಶದಿಂದ ಒಂದೊಂದು ಸುಮಾರು ನಲವತ್ತೈದು ಕಿಲೋಗ್ರಾಂ ತೂಕದ ಬಹುದೊಡ್ಡ ಆಲಿಕಲ್ಲುಗಳು ಮನುಷ್ಯರ ಮೇಲೆ ಬಿದ್ದವು. ಆಲಿಕಲ್ಲಿನ ಉಪದ್ರವವು ಬಹು ಹೆಚ್ಚಾಗಿದ್ದರಿಂದಲೂ ಮನುಷ್ಯರು ದೇವರನ್ನು ದೂಷಿಸಿದರು.
61003013	Faith	ಆದರೂ ನಾವು ದೇವರ ವಾಗ್ದಾನದ ಪ್ರಕಾರ ನೂತನ ಆಕಾಶಗಳನ್ನೂ ನೂತನ ಭೂಮಿಯನ್ನೂ ಎದುರುನೋಡುತ್ತಾ ಇದ್ದೇವೆ. ಅವುಗಳಲ್ಲಿ ನೀತಿಯು ವಾಸವಾಗಿರುವುದು.
66006014	Description	ಆಕಾಶವು ಸುರುಳಿಯಂತೆ ಸುತ್ತಿಕೊಂಡು ಹೊರಟುಹೋಯಿತು. ಪ್ರತಿ ಬೆಟ್ಟಗಳು ಮತ್ತು ದ್ವೀಪಗಳು ತಮ್ಮ ಸ್ಥಳಗಳಿಂದ ಕದಲಿದವು.
