46011034	Recommendation	ನೀವು ಒಟ್ಟಾಗಿ ಕೂಟಕ್ಕೆ ಸೇರಿಬರುವಾಗ, ನ್ಯಾಯತೀರ್ಪಿಗೆ ಒಳಗಾದಂತೆ, ಹಸಿದವರು ಮನೆಯಲ್ಲೇ ಊಟಮಾಡಲಿ. ಇನ್ನುಳಿದ ವಿಷಯಗಳನ್ನು ನಾನು ಬಂದಾಗ ಕ್ರಮಪಡಿಸುತ್ತೇನೆ.
43018031	Description	ಆಗ ಪಿಲಾತನು ಅವರಿಗೆ, “ನೀವೇ ಆತನನ್ನು ತೆಗೆದುಕೊಂಡುಹೋಗಿ ನಿಮ್ಮ ನಿಯಮದ ಪ್ರಕಾರ ಆತನಿಗೆ ತೀರ್ಪು ಮಾಡಿರಿ,” ಎಂದನು. ಅದಕ್ಕೆ ಯೆಹೂದ್ಯರು ಅವನಿಗೆ, “ಮರಣದಂಡನೆ ವಿಧಿಸುವ ಅಧಿಕಾರ ನಮಗೆ ಇಲ್ಲ,” ಎಂದು ಹೇಳಿದರು.
46012031	Faith	ಆದರೆ ನೀವು ಆಸಕ್ತಿಯಿಂದ ಶ್ರೇಷ್ಠ ವರಗಳನ್ನು ಅಪೇಕ್ಷಿಸಿರಿ. ನಾನು ನಿಮಗೆ ಇನ್ನೂ ಸರ್ವೋತ್ತಮವಾದ ಮಾರ್ಗವನ್ನು ತೋರಿಸುತ್ತೇನೆ.
58007026	Description	ಪರಿಶುದ್ಧರು, ನಿರ್ದೋಷಿ, ನಿಷ್ಕಳಂಕರು, ಪಾಪಿಗಳಿಂದ ಪ್ರತ್ಯೇಕಿಸಲಾದವರೂ ಗಗನ ಮಂಡಲಗಳಿಗಿಂತ ಉನ್ನತಕ್ಕೇರಿದಾತರೂ ಆಗಿರುವ ಇಂಥಾ ಮಹಾಯಾಜಕ ನಮಗಿದ್ದಾರೆ.
50004013	Faith	ನನಗೆ ಶಕ್ತಿನೀಡುವ ಕ್ರಿಸ್ತ ಯೇಸುವಿನ ಮೂಲಕ ನಾನು ಎಲ್ಲವನ್ನೂ ಮಾಡಲು ಶಕ್ತನಾಗಿದ್ದೇನೆ.
52004003	Recommendation	ನೀವು ಪವಿತ್ರರಾಗಿ ಇರಬೇಕೆಂಬುದೇ ದೇವರ ಚಿತ್ತವಾಗಿದೆ. ಆದ್ದರಿಂದ ನೀವು ಕಾಮಾತಿರೇಕಕ್ಕೆ ದೂರವಾಗಿರಬೇಕು.
51004002	Recommendation	ಎಚ್ಚರವಾಗಿದ್ದು ಕೃತಜ್ಞತೆ ಉಳ್ಳವರಾಗಿ ಪ್ರಾರ್ಥನೆಯಲ್ಲಿ ನಿರತರಾಗಿರಿ.
44007029	Description	ಮೋಶೆ ಇದನ್ನು ಕೇಳಿ, ಮಿದ್ಯಾನಿಗೆ ಓಡಿಹೋದನು. ಅಲ್ಲಿ ಪರದೇಶದವನಂತೆ ಬದುಕಿ, ಇಬ್ಬರು ಗಂಡು ಮಕ್ಕಳನ್ನು ಪಡೆದನು.
46011007	Description	ಪುರುಷನು ದೇವರ ಸ್ವರೂಪವೂ ಮಹಿಮೆಯೂ ಆಗಿರುವುದರಿಂದ, ತನ್ನ ತಲೆಗೆ ಮುಸುಕು ಹಾಕಬೇಕಾಗಿಲ್ಲ. ಆದರೆ ಸ್ತ್ರೀಯು ಪುರುಷನ ಮಹಿಮೆಯಾಗಿದ್ದಾಳೆ.
51003015	Faith	ಕ್ರಿಸ್ತ ಯೇಸುವಿನ ಸಮಾಧಾನವು ನಿಮ್ಮ ಹೃದಯಗಳಲ್ಲಿ ಆಳಲಿ, ಆ ಸಮಾಧಾನಕ್ಕಾಗಿಯೇ ನೀವು ಸಹ ಒಂದೇ ದೇಹವಾಗಿರುವಂತೆ ಕರೆಯಲಾಗಿದ್ದೀರಿ. ನೀವು ಕೃತಜ್ಞತೆಯುಳ್ಳವರಾಗಿರಿ.
58002010	Grace	ದೇವರು ಸಮಸ್ತವನ್ನೂ ತಮಗೋಸ್ಕರವೂ ತಮ್ಮ ಮೂಲಕವೂ ಉಂಟುಮಾಡಿ ಬಹುಮಂದಿ ಮಕ್ಕಳನ್ನು ಮಹಿಮೆಗೆ ತರುವಂತೆ ಅವರ ರಕ್ಷಣಾ ನಾಯಕರಾದ ಕ್ರಿಸ್ತ ಯೇಸುವನ್ನು ಬಾಧೆಗಳ ಮೂಲಕ ಸಿದ್ಧಿಗೆ ತರುವುದು ದೇವರಿಗೆ ಯುಕ್ತವಾಗಿತ್ತು.
59004001	Sin	ನಿಮ್ಮಲ್ಲಿ ಯುದ್ಧಗಳೂ ಕಾದಾಟಗಳೂ ಬರಲು ಕಾರಣಗಳೇನು? ನಿಮ್ಮಲ್ಲಿ ಹೋರಾಡುವ ದುರಾಶೆಗಳಿಂದ ಅಲ್ಲವೇ?
46005001	Sin	ಯೆಹೂದ್ಯರಲ್ಲದವರಲ್ಲಿ ನಡೆಯದೇ ಇರುವಂಥ ಅನೈತಿಕತೆ ನಿಮ್ಮಲ್ಲಿದೆಯೆಂದು ವಾಸ್ತವವಾಗಿ ವರದಿ ಬಂದಿದೆ: ಒಬ್ಬನು ತನ್ನ ತಂದೆಯ ಹೆಂಡತಿಯನ್ನು ಇಟ್ಟುಕೊಂಡಿದ್ದಾನಂತೆ.
46010013	Faith	ಮನುಷ್ಯರಿಗಾಗುವ ಶೋಧನೆಯೇ ಹೊರತು, ಬೇರೆ ಯಾವುದೂ ನಿಮಗೆ ಸಂಭವಿಸಲಿಲ್ಲ. ಆದರೆ ದೇವರು ನಂಬಿಗಸ್ತರು. ನಿಮ್ಮ ಶಕ್ತಿಗೆ ಮೀರಿದ ಶೋಧನೆಗಳನ್ನು ಅವರು ನಿಮ್ಮ ಮೇಲೆ ಬರುವಂತೆ ಮಾಡುವುದಿಲ್ಲ. ಆದರೆ ನಿಮಗೆ ಶೋಧನೆಗಳು ಬಂದಾಗ, ಅವುಗಳನ್ನು ಜಯಿಸುವುದಕ್ಕೆ ಶಕ್ತರಾಗುವಂತೆ, ಅವುಗಳಿಂದ ತಪ್ಪಿಸಿಕೊಳ್ಳುವ ಮಾರ್ಗವನ್ನು ಮಾಡುವರು.
44020029	Violence	ನಾನು ಹೋದ ನಂತರ ಕ್ರೂರ ತೋಳಗಳು ನಿಮ್ಮ ಮಧ್ಯದಲ್ಲಿ ಪ್ರವೇಶಿಸಿ ಮಂದೆಯನ್ನು ಹಾಳುಮಾಡದೆ ಬಿಡುವುದಿಲ್ಲ ಎಂದು ಬಲ್ಲೆನು.
53001004	Faith	ಹೀಗಿರುವುದರಿಂದ, ನೀವು ಸಹಿಸುತ್ತಿರುವ ನಿಮ್ಮ ಎಲ್ಲಾ ಹಿಂಸೆಗಳಲ್ಲಿಯೂ ಸಂಕಟಗಳಲ್ಲಿಯೂ ನಿಮಗೆ ತೋರಿ ಬಂದ ನಿಮ್ಮ ತಾಳ್ಮೆ, ನಂಬಿಕೆಗಳನ್ನು ನೆನೆಸಿ ನಿಮ್ಮ ವಿಷಯವಾಗಿ ದೇವರ ಸಭೆಗಳಲ್ಲಿ ನಾವೇ ಹೆಮ್ಮೆಪಡುತ್ತೇವೆ.
62004012	Faith	ದೇವರನ್ನು ಯಾರೂ ಎಂದೂ ನೋಡಿಲ್ಲ, ನಾವು ಒಬ್ಬರನ್ನೊಬ್ಬರು ಪ್ರೀತಿಸಿದರೆ, ದೇವರು ನಮ್ಮಲ್ಲಿ ನೆಲೆಗೊಂಡಿದ್ದಾರೆ ಮತ್ತು ಅವರ ಪ್ರೀತಿಯು ನಮ್ಮಲ್ಲಿ ಸಿದ್ಧಿಗೆ ಬರುತ್ತದೆ.
48001001	Description	ಮನುಷ್ಯರಿಂದಾಗಲಿ, ಮನುಷ್ಯನ ಮುಖಾಂತರದಿಂದಾಗಲಿ ಅಪೊಸ್ತಲನಾಗಿರದೆ ಕ್ರಿಸ್ತ ಯೇಸುವಿನ ಮುಖಾಂತರವೂ ಅವರನ್ನು ಮರಣದಿಂದ ಎಬ್ಬಿಸಿದ ತಂದೆಯಾದ ದೇವರಿಂದಲೂ ಅಪೊಸ್ತಲನಾದ ಪೌಲನೆಂಬ ನಾನೂ
58012003	Recommendation	ನೀವು ಮನಗುಂದಿದವರಾಗಿ ಬೇಸರಗೊಳ್ಳದಂತೆ ಪಾಪಿಗಳಿಂದ ಎಷ್ಟೋ ವಿರೋಧವನ್ನು ಸಹಿಸಿಕೊಂಡ ಯೇಸುವನ್ನು ಕುರಿತು ನೀವು ಯೋಚಿಸಿರಿ.
45006005	Faith	ನಾವು ಕ್ರಿಸ್ತ ಯೇಸುವಿನೊಂದಿಗೆ ಸೇರಿ ಅವರ ಮರಣದಲ್ಲಿ ಪಾಲುಗಾರರಾದರೆ, ಅವರ ಪುನರುತ್ಥಾನದಲ್ಲಿಯೂ ಪಾಲುಗಾರರಾಗುವೆವು.
45015010	Recommendation	ಮತ್ತೊಂದು ಕಡೆಯಲ್ಲಿ ಹೀಗೆ ಬರೆಯಲಾಗಿದೆ: “ಯೆಹೂದ್ಯರಲ್ಲದವರೇ ದೇವಜನರೊಂದಿಗೆ ಸೇರಿ ಸಂತೋಷಪಡಿರಿ.”
54004001	Sin	ಮುಂಬರುವ ದಿನಗಳಲ್ಲಿ ಕೆಲವರು ವಂಚಿಸುವ ಆತ್ಮಗಳಿಗೂ ದೆವ್ವಗಳ ಬೋಧನೆಗಳಿಗೂ ಲಕ್ಷ್ಯಗೊಟ್ಟು ವಿಶ್ವಾಸದಲ್ಲಿ ಬಿದ್ದುಹೋಗುವರೆಂದು ಪವಿತ್ರಾತ್ಮ ದೇವರು ಸ್ಪಷ್ಟವಾಗಿ ಹೇಳುತ್ತಾರೆ.
56003001	Recommendation	ಆಳುವವರಿಗೂ ಅಧಿಕಾರಿಗಳಿಗೂ ಅಧೀನರಾಗಿ ವಿಧೇಯರಾಗಿರಬೇಕೆಂತಲೂ ಪ್ರತಿಯೊಂದು ಒಳ್ಳೆಯ ಕಾರ್ಯಕ್ಕೆ ಸಿದ್ಧರಾಗಿರಬೇಕೆಂತಲೂ ಅವರಿಗೆ ಜ್ಞಾಪಕಮಾಡು.
61003005	Sin	ಆದರೆ ಪೂರ್ವಕಾಲದಲ್ಲಿ ದೇವರ ವಾಕ್ಯದಿಂದ ಆಕಾಶವು ಅಸ್ತಿತ್ವಕ್ಕೆ ಬಂದಿತು ಎಂತಲೂ ಜಲದಿಂದ ಜಲದ ಮೂಲಕ ಭೂಮಿಯು ಉಂಟಾಯಿತೆಂಬುದನ್ನು ಅವರು ಬೇಕೆಂತಲೇ ಮರೆತುಬಿಡುತ್ತಾರೆ.
60003018	Grace	ಕ್ರಿಸ್ತ ಯೇಸುವು ನೀತಿವಂತರಾಗಿದ್ದರೂ ಅನೀತಿವಂತರಾದ ನಮ್ಮನ್ನು ದೇವರ ಬಳಿಗೆ ತರುವುದಕ್ಕಾಗಿ, ಒಂದೇ ಸಾರಿ ಪಾಪಗಳಿಗೋಸ್ಕರ ಬಾಧೆಪಟ್ಟು ಶರೀರದಲ್ಲಿ ಮರಣಹೊಂದಿದರು. ಆದರೆ ಆತ್ಮದಲ್ಲಿ ಬದುಕುವವರಾದರು.
61002021	Sin	ಅವರು ನೀತಿಮಾರ್ಗವನ್ನು ತಿಳಿದುಕೊಂಡ ಮೇಲೆ ತಮಗೆ ಕೊಡಲಾದ ಪವಿತ್ರ ಆಜ್ಞೆಯಿಂದ ತೊಲಗಿ ಹೋಗುವುದಕ್ಕಿಂತ ಆ ಮಾರ್ಗವನ್ನು ತಿಳಿಯದೆ ಇದ್ದಿದ್ದರೆ ಮೇಲಾಗಿತ್ತು.
53003006	Recommendation	ಪ್ರಿಯರೇ, ನಮಗೆ ಕರ್ತ ಆಗಿರುವ ಯೇಸುಕ್ರಿಸ್ತರ ಹೆಸರಿನಲ್ಲಿ ನಾವು ನಿಮಗೆ ಆಜ್ಞಾಪಿಸುವುದೇನೆಂದರೆ, ನಮ್ಮಿಂದ ಸ್ವೀಕರಿಸಿದ ಬೋಧನೆಯನ್ನು ಅನುಸರಿಸದೆ, ಸೋಮಾರಿಯಾಗಿ ಅಶಿಸ್ತಿನಿಂದ ನಡೆಯುವ ಪ್ರತಿ ವಿಶ್ವಾಸಿಗೆ ನೀವು ದೂರವಾಗಿರಬೇಕು.
45005012	Sin	ಆದ್ದರಿಂದ, ಒಬ್ಬ ಮನುಷ್ಯನ ಮೂಲಕ ಪಾಪವೂ ಪಾಪದ ಮೂಲಕ ಮರಣವೂ ಲೋಕದೊಳಗೆ ಪ್ರವೇಶಿಸಿದ ಹಾಗೆಯೇ ಎಲ್ಲರೂ ಪಾಪಮಾಡಿದ್ದರಿಂದ ಮರಣವು ಎಲ್ಲರಲ್ಲಿಯೂ ವ್ಯಾಪಿಸಿತು.
58011033	Faith	ಇವರೆಲ್ಲರೂ ನಂಬಿಕೆಯ ಮೂಲಕವೇ ರಾಜ್ಯಗಳನ್ನು ಸ್ವಾಧೀನಮಾಡಿಕೊಂಡರು. ನೀತಿಯನ್ನು ಸ್ಥಾಪಿಸಿದರು, ವಾಗ್ದಾನಗಳನ್ನು ಪಡೆದುಕೊಂಡರು, ಸಿಂಹಗಳ ಬಾಯಿ ಕಟ್ಟಿದರು,
47004009	Faith	ಹಿಂಸೆಗೆ ಒಳಪಟ್ಟರೂ ಕೈಬಿಟ್ಟವವರಲ್ಲ, ದಬ್ಬಿದವರಾದಾಗ್ಯೂ ನಾಶವಾಗಲಿಲ್ಲ.
59004004	Sin	ವ್ಯಭಿಚಾರಿಗಳೇ, ಇಹಲೋಕ ಸ್ನೇಹವು ದೇವರೊಂದಿಗಿರುವ ಶತ್ರುತ್ವ ಎಂದು ನಿಮಗೆ ತಿಳಿಯದೋ? ಲೋಕಕ್ಕೆ ಸ್ನೇಹಿತನಾಗಿರಬೇಕೆಂಬುವವನು ದೇವರಿಗೆ ಶತ್ರುವಾಗಿದ್ದಾನೆ.
44016006	Description	ಏಷ್ಯಾ ಪ್ರಾಂತದಲ್ಲಿ ಸುವಾರ್ತೆ ಸಾರಬಾರದೆಂದು ಪವಿತ್ರಾತ್ಮ ತಡೆದದ್ದರಿಂದ ಪೌಲ ಮತ್ತು ಅವನ ಜೊತೆಯವರು ಫ್ರುಗ್ಯ ಹಾಗೂ ಗಲಾತ್ಯ ಪ್ರದೇಶಗಳ ಮಾರ್ಗವಾಗಿ ಪ್ರಯಾಣಮಾಡಿದರು.
45010006	Faith	ಆದರೆ ವಿಶ್ವಾಸದಿಂದ ಬರುವ ನೀತಿಯ ಬಗ್ಗೆ ಮೋಶೆಯು ಹೇಳುವುದೇನೆಂದರೆ: “ ‘ಕ್ರಿಸ್ತನನ್ನು ಕೆಳಗೆ ತರಲು ಪರಲೋಕಕ್ಕೆ ಯಾರು ಏರಿ ಹೋಗುವರು?’
66016002	Violence	ಮೊದಲನೆಯ ದೂತನು ಹೋಗಿ ತನ್ನ ಬೋಗುಣಿಯೊಳಗಿರುವುದನ್ನು ಭೂಮಿಯ ಮೇಲೆ ಸುರಿಯಲು, ಮೃಗದ ಗುರುತನ್ನು ಹಾಕಿಸಿಕೊಂಡು ಅದರ ವಿಗ್ರಹವನ್ನು ಆರಾಧಿಸುವ ಎಲ್ಲಾ ಜನರ ಮೇಲೆ ಭೀಕರವಾದ ಕೆಟ್ಟ ಹುಣ್ಣುಗಳು ಎದ್ದವು.
66005008	Description	ಸುರುಳಿಯನ್ನು ತೆಗೆದುಕೊಂಡಾಗ, ಆ ನಾಲ್ಕು ಜೀವಿಗಳೂ ಇಪ್ಪತ್ನಾಲ್ಕು ಮಂದಿ ಹಿರಿಯರೂ ಕುರಿಮರಿ ಆಗಿರುವವರ ಮುಂದೆ ಅಡ್ಡಬಿದ್ದರು. ಹಿರಿಯರ ಕೈಗಳಲ್ಲಿ ವೀಣೆಗಳೂ ದೇವಜನರ ಪ್ರಾರ್ಥನೆಗಳೆಂಬ ಧೂಪದಿಂದ ತುಂಬಿದ್ದ ಚಿನ್ನದ ಧೂಪಾರತಿಗಳೂ ಇದ್ದವು.
62005001	Faith	ಯೇಸುವೇ ಕ್ರಿಸ್ತ ಎಂದು ನಂಬುವ ಪ್ರತಿಯೊಬ್ಬರೂ ದೇವರಿಂದ ಹುಟ್ಟಿದವರಾಗಿದ್ದಾರೆ. ತಂದೆಯನ್ನು ಪ್ರೀತಿಸುವ ಪ್ರತಿಯೊಬ್ಬರು ದೇವರಿಂದ ಹುಟ್ಟಿದವರನ್ನು ಸಹ ಪ್ರೀತಿಸುತ್ತಾರೆ.
48005026	Recommendation	ನಾವು ಅಹಂಕಾರಿಗಳಾಗಿರಬಾರದು. ಒಬ್ಬರನ್ನೊಬ್ಬರು ಕೆಣಕದೆಯೂ ಒಬ್ಬರ ಮೇಲೊಬ್ಬರು ಮತ್ಸರಗೊಳ್ಳದೆಯೂ ಇರೋಣ.
54005001	Recommendation	ವೃದ್ಧನನ್ನು ಗದರಿಸದೆ ತಂದೆಯಂತೆಯೂ ಯೌವನಸ್ಥರನ್ನು ಸಹೋದರರಂತೆಯೂ
60002012	Recommendation	ನಿಮ್ಮ ನಡವಳಿಕೆಯು ಯೆಹೂದ್ಯರಲ್ಲದವರ ನಡುವೆ ಯೋಗ್ಯವಾಗಿರಲಿ, ಆಗ ಅವರು ಯಾವ ವಿಷಯದಲ್ಲಿ ನಿಮ್ಮನ್ನು ಕೆಟ್ಟವರೆಂದು ನಿಂದಿಸುತ್ತಾರೋ, ಆ ನಿಮ್ಮ ವಿಷಯದಲ್ಲಿಯೇ ನಿಮ್ಮ ಸತ್ಕ್ರಿಯೆಗಳನ್ನು ಕಣ್ಣಾರೆ ಕಂಡು ಕರ್ತ ಯೇಸು ನಮ್ಮನ್ನು ದರ್ಶಿಸುವ ದಿನದಲ್ಲಿ ಅವರು ದೇವರನ್ನು ಕೊಂಡಾಡುವರು.
50003006	Sin	ಆಸಕ್ತಿಯನ್ನು ನೋಡಿದರೆ, ನಾನು ಸಭೆಯ ಹಿಂಸಕನು; ಮೋಶೆಯ ನಿಯಮದಲ್ಲಿರುವ ನೀತಿಯ ಅನುಸಾರವಾಗಿ ನಾನು ನಿರ್ದೋಷಿ.
43004052	Description	ಅವನು, “ಯಾವ ಸಮಯದಲ್ಲಿ ಮಗನು ಚೇತರಿಸಿಕೊಂಡನು?” ಎಂದು ಅವರನ್ನು ವಿಚಾರಿಸಿದಾಗ ಅವರು, “ನಿನ್ನೆ ಮಧ್ಯಾಹ್ನ ಒಂದು ಗಂಟೆಗೆ ಜ್ವರವು ಬಿಟ್ಟಿತು,” ಎಂದು ಸೇವಕರು ಅವನಿಗೆ ಹೇಳಿದರು.
43019031	Violence	ಅದು ಪಸ್ಕಹಬ್ಬದ ಸಿದ್ಧತೆಯ ದಿನವಾಗಿತ್ತು. ಮರುದಿನ ವಿಶೇಷ ಸಬ್ಬತ್ ದಿನದಲ್ಲಿ ದೇಹಗಳು ಶಿಲುಬೆಯ ಮೇಲೆ ಇರಬಾರದೆಂದು ಅವರ ಕಾಲುಗಳನ್ನು ಮುರಿದು ಅವರನ್ನು ತೆಗೆದುಬಿಡಬೇಕೆಂದು ಯೆಹೂದ್ಯ ನಾಯಕರು ಪಿಲಾತನನ್ನು ಕೇಳಿಕೊಂಡರು.
43019012	Description	ಇದನ್ನು ಕೇಳಿದಾಗಿಂದ ಪಿಲಾತನು ಯೇಸುವನ್ನು ಬಿಡಿಸಲು ಪ್ರಯತ್ನಿಸಿದನು. ಆದರೆ ಯೆಹೂದ್ಯ ನಾಯಕರು, “ನೀನು ಈ ಮನುಷ್ಯನನ್ನು ಬಿಡುಗಡೆ ಮಾಡಿದರೆ, ನೀನು ಕೈಸರನ ಮಿತ್ರನಲ್ಲ. ತನ್ನನ್ನು ತಾನೇ ಅರಸನನ್ನಾಗಿ ಮಾಡಿಕೊಳ್ಳುವವನು, ಕೈಸರನಿಗೆ ವಿರೋಧವಾಗಿ ಮಾತನಾಡುವವನಾಗಿದ್ದಾನೆ,” ಎಂದು ಕೂಗಿ ಹೇಳಿದರು.
43014001	Faith	“ನಿಮ್ಮ ಹೃದಯವು ಕಳವಳಗೊಳ್ಳದಿರಲಿ, ನೀವು ದೇವರನ್ನು ನಂಬಿರಿ; ನನ್ನನ್ನೂ ನಂಬಿರಿ.
50001028	Faith	ನಿಮ್ಮ ವಿರೋಧಿಗಳಿಗೆ ಯಾವ ವಿಷಯದಲ್ಲಿಯೂ ಅಂಜದೆ ಧೈರ್ಯದಿಂದಿರಿ. ನೀವು ಧೈರ್ಯದಿಂದಿರುವುದು, ಅವರ ವಿನಾಶಕ್ಕೂ, ನಿಮ್ಮ ರಕ್ಷಣೆಗೂ ದೇವರಿಂದಾದ ಸೂಚನೆಯಾಗಿದೆ.
43015016	Grace	ನೀವು ನನ್ನನ್ನು ಆರಿಸಿಕೊಳ್ಳಲಿಲ್ಲ. ನಾನೇ ನಿಮ್ಮನ್ನು ಆರಿಸಿಕೊಂಡಿದ್ದೇನೆ. ನೀವು ಹೋಗಿ ಫಲಕೊಡುವಂತೆಯೂ ನಿಮ್ಮ ಫಲವು ಸ್ಥಿರವಾಗಿರುವಂತೆಯೂ ನಾನು ನಿಮ್ಮನ್ನು ನೇಮಿಸಿದ್ದೇನೆ. ಹೀಗೆ ನೀವು ನನ್ನ ಹೆಸರಿನಲ್ಲಿ ತಂದೆಯನ್ನು ಏನು ಕೇಳಿಕೊಂಡರೂ ಅವರು ನಿಮಗೆ ಕೊಡುವರು.
58011004	Faith	ನಂಬಿಕೆಯಿಂದಲೇ ಹೇಬೆಲನು ಕಾಯಿನನ ಯಜ್ಞಕ್ಕಿಂತ ಉತ್ತಮ ಯಜ್ಞವನ್ನು ದೇವರಿಗೆ ಸಮರ್ಪಿಸಿದನು. ಅದರ ಮೂಲಕ ಅವನು ನೀತಿವಂತನೆಂದು ಸಾಕ್ಷಿಹೊಂದಿದನು. ದೇವರು ಸಹ ಅವನ ಕಾಣಿಕೆಗಳನ್ನು ಸ್ವೀಕಾರಮಾಡಿದರು. ಅವನು ಸತ್ತು ಹೋಗಿದ್ದರೂ ನಂಬಿಕೆಯ ಮೂಲಕ ಇನ್ನೂ ಮಾತನಾಡುತ್ತಿದ್ದಾನೆ.
46004001	Recommendation	ಆದ್ದರಿಂದ ನೀವು ಈ ರೀತಿಯಾಗಿ ನಮ್ಮನ್ನು ಪರಿಗಣಿಸಬೇಕು: ನಾವು ಕ್ರಿಸ್ತ ಯೇಸುವಿನ ದಾಸರೆಂತಲೂ ದೇವರ ರಹಸ್ಯಗಳ ನಂಬಿಗಸ್ತ ನಿರ್ವಾಹಕರೆಂದೂ ಪರಿಗಣಿಸಿರಿ.
66006013	Description	ಬಿರುಗಾಳಿಯಿಂದ ಆಕಾಶದ ನಕ್ಷತ್ರಗಳು ಅಂಜೂರದ ಕಾಯಿಗಳಂತೆ ಭೂಮಿಗೆ ಬಿದ್ದವು.
46010014	Recommendation	ಆದ್ದರಿಂದ ನನ್ನ ಪ್ರಿಯ ಸ್ನೇಹಿತರೇ, ವಿಗ್ರಹಾರಾಧನೆಯನ್ನು ಬಿಟ್ಟು ಓಡಿಹೋಗಿರಿ.
45012021	Recommendation	ಕೆಟ್ಟದ್ದಕ್ಕೆ ಸೋಲಬೇಡಿರಿ, ಕೆಟ್ಟದ್ದನ್ನು ಒಳ್ಳೆಯದರಿಂದ ಜಯಿಸಿರಿ.
55002014	Recommendation	ಈ ವಿಷಯಗಳನ್ನು ದೇವಜನರ ನೆನಪಿಗೆ ತರಬೇಕು. ಕೇಳುವವರಿಗೆ ಯಾವ ಪ್ರಯೋಜನವನ್ನೂ ಉಂಟು ಮಾಡದೆ ಕೆಡವಿ ಹಾಕುವ ವಾಗ್ವಾದಗಳನ್ನು ಮಾಡಬಾರದೆಂದು ಅವರಿಗೆ ದೇವರ ಮುಂದೆ ಎಚ್ಚರಿಸು.
59004008	Recommendation	ದೇವರ ಸಮೀಪಕ್ಕೆ ಬನ್ನಿರಿ. ಆಗ ನಿಮ್ಮ ಸಮೀಪಕ್ಕೆ ದೇವರು ಬರುವರು. ಪಾಪಿಗಳೇ, ನಿಮ್ಮ ಕೈಗಳನ್ನು ಶುಚಿಮಾಡಿಕೊಳ್ಳಿರಿ. ಎರಡು ಮನಸ್ಸುಳ್ಳವರೇ, ನಿಮ್ಮ ಹೃದಯಗಳನ್ನು ನಿರ್ಮಲ ಮಾಡಿಕೊಳ್ಳಿರಿ.
59002009	Sin	ನೀವು ಪಕ್ಷಪಾತಿಗಳಾಗಿದ್ದರೆ ಪಾಪಮಾಡುವವರಾಗಿದ್ದೀರಿ. ಮಾತ್ರವಲ್ಲದೆ ಮೋಶೆಯ ನಿಯಮದ ಪ್ರಕಾರ ಅಪರಾಧಿಗಳೆಂದು ನಿರ್ಣಯ ಹೊಂದುತ್ತೀರಿ.
52004007	Grace	ದೇವರು ನಮ್ಮನ್ನು ಅಶುದ್ಧತೆಗೆ ಕರೆಯದೆ ಪವಿತ್ರ ಜೀವನವನ್ನು ಜೀವಿಸಲು ಕರೆದಿದ್ದಾರೆ.
45001018	Sin	ದುಷ್ಟತನದಿಂದ ಸತ್ಯವನ್ನು ಅಡಗಿಸುವವರಾದ ಮನುಷ್ಯರ ಎಲ್ಲಾ ವಿಧವಾದ ಭಕ್ತಿಹೀನತೆ ಹಾಗೂ ದುಷ್ಟತನದ ಮೇಲೆ ದೇವರ ರೌದ್ರವು ಪರಲೋಕದಿಂದ ಪ್ರಕಟವಾಗುತ್ತಿದೆ.
62004007	Faith	ಪ್ರಿಯರೇ, ನಾವು ಒಬ್ಬರನ್ನೊಬ್ಬರು ಪ್ರೀತಿಸೋಣ. ಏಕೆಂದರೆ ಪ್ರೀತಿಯು ದೇವರಿಂದಾಗಿದೆ. ಪ್ರೀತಿ ಮಾಡುವ ಪ್ರತಿಯೊಬ್ಬರು ದೇವರಿಂದ ಹುಟ್ಟಿದವರೂ ದೇವರನ್ನು ಬಲ್ಲವರೂ ಆಗಿದ್ದಾರೆ.
62002009	Sin	ಬೆಳಕಿನಲ್ಲಿದ್ದೇನೆಂದು ಹೇಳಿಕೊಂಡು ತನ್ನ ಸಹೋದರನನ್ನು ದ್ವೇಷಿಸುವವನು ಈವರೆಗೂ ಕತ್ತಲೆಯಲ್ಲಿದ್ದಾನೆ.
60004014	Grace	ನೀವು ಕ್ರಿಸ್ತ ಯೇಸುವಿನ ಹೆಸರಿನ ನಿಮಿತ್ತ ನಿಂದೆಗೆ ಗುರಿಯಾದರೆ, ಧನ್ಯರು. ಏಕೆಂದರೆ, ಮಹಿಮೆಯ ಆತ್ಮರೂ, ದೇವರೂ ನಿಮ್ಮಲ್ಲಿ ವಾಸಿಸುತ್ತಾರೆ.
44021019	Grace	ಪೌಲನು ಅವರನ್ನು ವಂದಿಸಿ, ತನ್ನ ಸೇವೆಯ ಮೂಲಕ ದೇವರು ಯೆಹೂದ್ಯರಲ್ಲದವರ ಮಧ್ಯದಲ್ಲಿ ಮಾಡಿದ ಕಾರ್ಯಗಳನ್ನು ವಿವರಿಸಿದನು.
43008046	Sin	ನನ್ನಲ್ಲಿ ಪಾಪವಿದೆಯೆಂದು ರುಜುವಾತು ಪಡಿಸುವವರು ನಿಮ್ಮಲ್ಲಿ ಯಾರಿದ್ದಾರೆ? ನಾನು ಸತ್ಯವನ್ನೇ ಹೇಳುವುದಾದರೆ ನೀವು ನನ್ನನ್ನು ಏಕೆ ನಂಬುವುದಿಲ್ಲ?
58010017	Grace	ತರುವಾಯ ಅವರು, “ನಾನು ಅವರ ಪಾಪಗಳನ್ನೂ ಅಧರ್ಮಗಳನ್ನೂ ಇನ್ನೆಂದಿಗೂ ನನ್ನ ನೆನಪಿಗೆ ತಂದುಕೊಳ್ಳುವುದಿಲ್ಲ!” ಎಂದು ಹೇಳುತ್ತಾರೆ.
46001005	Grace	ನೀವು ಕ್ರಿಸ್ತ ಯೇಸುವಿನಲ್ಲಿ ಜ್ಞಾನದಲ್ಲಿಯೂ ಮಾತುಗಳಲ್ಲಿಯೂ ಎಲ್ಲಾ ಸಮೃದ್ಧಿಯನ್ನು ಹೊಂದಿದ್ದೀರಿ.
45015030	Recommendation	ಪ್ರಿಯರೇ, ನಮ್ಮ ಕರ್ತ ಆಗಿರುವ ಯೇಸುಕ್ರಿಸ್ತರ ಮೂಲಕವಾಗಿಯೂ ಪವಿತ್ರಾತ್ಮರ ಪ್ರೀತಿಯ ಮೂಲಕವಾಗಿಯೂ ನಾನು ನಿಮ್ಮನ್ನು ಬೇಡಿಕೊಳ್ಳುವುದೇನೆಂದರೆ, ನನಗೋಸ್ಕರ ದೇವರಲ್ಲಿ ಪ್ರಾರ್ಥಿಸಿ, ನನ್ನೊಂದಿಗೆ ಹೋರಾಡಿರಿ.
43007020	Violence	ಅದಕ್ಕೆ ಜನರು, “ನಿನಗೆ ದೆವ್ವ ಹಿಡಿದಿದೆ. ನಿನ್ನನ್ನು ಕೊಲ್ಲುವುದಕ್ಕೆ ಹುಡುಕುವವರು ಯಾರು?” ಎಂದರು.
45003025	Grace	ಇದನ್ನು ನಂಬಿಕೆಯಿಂದ ಕ್ರಿಸ್ತ ಯೇಸುವಿನ ರಕ್ತದ ಮೂಲಕ ದೊರಕುವಂತೆ ದೇವರು ಕ್ರಿಸ್ತ ಯೇಸುವನ್ನು ನಮಗಾಗಿ ಪ್ರಾಯಶ್ಚಿತ್ತ ಬಲಿಯಾಗಿ ಒಪ್ಪಿಸಿದರು. ದೇವರು ಹಿಂದಿನ ಕಾಲದಲ್ಲಿ ಜನರು ಮಾಡಿರುವ ಪಾಪಗಳನ್ನು ದಂಡಿಸದೆ ತಮ್ಮ ನೀತಿಯನ್ನು ತೋರಿಸಿಕೊಡುವುದಕ್ಕಾಗಿಯೂ
43018018	Description	ಆಗ ಚಳಿಯಿದ್ದುದರಿಂದ ಸೇವಕರೂ ಕಾವಲುಗಾರರೂ ಬೆಂಕಿಮಾಡಿ ಚಳಿ ಕಾಯಿಸಿಕೊಳ್ಳುತ್ತಿದ್ದರು. ಪೇತ್ರನೂ ಅವರೊಂದಿಗೆ ನಿಂತು ಚಳಿ ಕಾಯಿಸಿಕೊಳ್ಳುತ್ತಿದ್ದನು.
49006011	Recommendation	ನೀವು ಪಿಶಾಚನ ತಂತ್ರಗಳನ್ನು ಎದುರಿಸಿ ನಿಲ್ಲುವುದಕ್ಕೆ ಶಕ್ತರಾಗುವಂತೆ ದೇವರ ಸರ್ವಾಯುಧಗಳನ್ನು ಧರಿಸಿಕೊಳ್ಳಿರಿ.
43013037	Faith	ಪೇತ್ರನು ಯೇಸುವಿಗೆ, “ಕರ್ತದೇವರೇ, ನಾನು ಈಗ ನಿಮ್ಮನ್ನು ಏಕೆ ಹಿಂಬಾಲಿಸಲಾರೆನು? ನಿಮಗಾಗಿ ನನ್ನ ಪ್ರಾಣವನ್ನೇ ಕೊಡುವೆನು,” ಎಂದನು.
50004007	Faith	ಆಗ ಎಲ್ಲಾ ಗ್ರಹಿಕೆಯನ್ನೂ ಮೀರುವ ದೇವರ ಸಮಾಧಾನವು ನಿಮ್ಮ ಹೃದಯಗಳನ್ನೂ ಯೋಚನೆಗಳನ್ನೂ ಕ್ರಿಸ್ತ ಯೇಸುವಿನಲ್ಲಿ ಕಾಯುವುದು.
59003009	Faith	ಅದೇ ನಾಲಿಗೆಯಿಂದ ನಮ್ಮ ತಂದೆಯಾದ ಕರ್ತದೇವರನ್ನು ಕೊಂಡಾಡುತ್ತೇವೆ, ಅದರಿಂದಲೇ ದೇವರ ಹೋಲಿಕೆಗೆ ಸರಿಯಾಗಿ ಸೃಷ್ಟಿಸಲಾದ ಮನುಷ್ಯರನ್ನು ನಾವು ಶಪಿಸುತ್ತೇವೆ.
