62003016	Faith	ናሹሞ ዓይጎ ማዔቴያ ኑ ዔራሢ ዬሱስ ኪሪስቶሴ ፔ ሼምፓሢ ኑም ዓኣሢ ዒንጌሢሮኬ፤ ኑኡኒ ሃሣ ኑ ሼምፓሢ ኑ ዒሾንሢንታ ሚሾንሢንታ ዛሎ ዓኣሢ ዒንጋንዳያ ኮይሳኔ።
43013001	Grace	ዬሱሴ ዓይሁዶ ዓሶኮ ዑሣ ዓኣዺፆ ቦንቾ ኬሎኮ ቤርታ ሃያ ዓጮ ሃሺ ሌካ ዓዶ ባንሢ ዓኣዻንዳሢ ዔሬኔ፤ ዬያሮ ሃያ ዓጮይዳ ዓኣ፥ ዒዛም ማዔዞንሢ ቢያ ዒ ናሽኬኔ፤ ሃሣ ሜቶ ጉቤ ዔያቶ ዛሎ ዔካኒ ጋፒንሢ ዒ ዔያቶ ናሽኬኔ።
58003017	Sin	ዖይዲታሚ ሌዔ ጉቤ ፆኦሲ ዻጋሲ ናንጌ ዓሳ ዋኣቶዳይ? ዬያታ ጎሞ ማዼም ሌዛ ዓሲ ናንጉዋ ዳውሎይዳ ኬኤሪንቲ ዓቴዞንሢቱዋዓዳ?
60001014	Recommendation	ፆኦሲም ዓይሢንታ ናይ ዒንሢ ማዔሢሮ ዔራቶ ዓቲሢና ቤርታ ዒንሢኮ ዓኣ ፑርቶ ማዾ ሱኡኮ ኩንሢፖቴ፤
45011032	Grace	ዓይጎሮ ጌዔቴ ፆኦሲ ዓሲ ቢያ ማኣራኒ ጋዓዖ፥ ዓሲ ቢያ «ዓይሢንቱዋያኬ» ጌይ ሃሼኔ፤
66006006	Description	ዬካፓ ዖይዶ ባኮንሢ ባኣካፓ ዑኡሲጉዴ ባኣዚ ታኣም ዋይዚንቴያ ማሌኔ፤ ዬና ዑኡዛ «ዛላ ኪሎ ማዓ ዛርጌ ፔቴ ኬሊ ማዾና ማዾ ዛላ ዒንጊንታያ፥ ፔቴ ኪሎና ዛላና ማዓ ዔልዓ ዬኖ ጎይፆ ፔቴ ኬሊ ማዾ ማዼም ዒንጊንታያ ማዖም፤ ዛይቶና ዎይናፓ ኮሾና ዑዦና ጋዓንቴ ፑርቲሲ፥ ባይዚፖ» ጋዓንቴ ታ ዋይዜኔ።
59004010	Recommendation	ጎዳሢ ቤርቶይዳ ዒንሢ ቶኦኮ ሂርኪዱዋቴ፤ ዒዚያ ዒንሢ ዼጊዳንዳኔ።
44017031	Grace	ዒዚ ዶኦሬ ዓሢ ዛሎና ዓጮ ቢያይዳ ጎኑሞና ዎጋንዳ ኬሊ ጌሤኔ፤ ዬያ ዒ ጎናሲ ዔርዜሢ ዬያ ዒዚ ዶኦሬሢ ሃይባፓ ዔቂሲፆናኬ» ጌዔኔ።
43019002	Description	ዒማና ፖኦሊሶንሢ ካኣታ ቶኦካ ዓጋ ባኮ ማሊሲ ዓንጊሢ ማራዖ ዬሱሴኮ ቶኦካ ዓጌኔ፤ ዞቄ ዲንኪ ዓፒላኣ ዔያታ ዒዛ ማይሴኔ።
54005014	Recommendation	ዬያሮ ጋርቺባኣ ዜኤሪንዶ ማዔ ዶዶ ላኣላ፦ ሎዓንዳጉዲ፥ ናይ ሾዓንዳጉዲ፥ ማኣሮዋ ፔኤኮ ኮይሳ ጎይሢና ዎይሣያ ማዓንዳጉዲ ታ ዞራኔ፤ ያዺዴቴ፦ ሞርካሢ ኑና ጫሽኮንዶ ባኣዚ ባይዛንዳኔ።
43014011	Faith	ታኣኒ ዓዶና ዓኣሢጉዲ ዓዴያ ታኣና ዓኣሢ ታ ዒንሢም ኬኤዛሢ ጉሙርቁዋቴ፤ ዬይ ዓቴቴ ታኣኒ ማዻ ዓኮ ባኮ ዛሎሮታዖ ታና ጉሙርቁዋቴ።
66020014	Violence	ዬካፓ ሃይቢንታ ሃይቄ ዓሳ ናንጋ ቤዞንታ ታሞ ባዞይዳ ዓጊንቴኔ፤ ዬይ ታሞ ባዛ ላምዓሳ ሃይቦኬ፤
58009026	Description	ያዺ ማዔያታቴ ዓጫ ማዢንቴማፓ ዓርቃዖ ሜቶ ዔኪ ዔኪ ናንጋንዳያ ዒዛም ኮይሳንዳያታንቴኬ፤ ሃሢ ጋዓንቴ ዎዶኮ ጋፒንፆይዳ ጎሜ ጌኤሻኒ፥ ፔና ፆኦሲም ዒንጎ ባኣዚ ማሂ ዒንጋኒ ላሚንቱዋ ጎይሢ ፔቴና ሙኪ ጴዼኔ።
44013018	Description	ዖይዲታሚ ሌዔ ማዓንዳያ ዓሲ ናንጉዋ ዳውሎይዳ ጊቢ ዳንዳዒሢና ዔያቶ ዒ ማኣዴኔ፤
46011033	Recommendation	ዬያሮ ታ ዒሾንሦ! ታ ሚሾንሦ! ጎዳ ማዾ ሙዖ ሙዓኒ ዒንሢ ቡካኣና ዎሊ ካፑዋቴ።
66006012	Violence	ዬካፓ ማራዓሢ ላሃሳ ዔርዛ ማላቶ ቡላንቴ ታ ዛጌኔ፤ ዬማና ሳዓ ሚርጌና ዓጊፄኔ፤ ዓባ ካርሢ ዓፒላጉዲ ካርታዛ ዓጊና ጉቤና ሱጉሢጉዲ ዞቄኔ፤
58011035	Violence	ላኣላ ፔኤኮ ሃይቄ ዒጊኖ ሃይባፓ ዔቄም ዴንቄኔ። ሜሌ ዓሳ ሃይቢፓ ዔቂ ባሼ ናንጊ ዴንቃንዳኔ ጌዒ ዱማ ዱማ ሜቶ ዔኬኔ፤ ዬያይዳፓ ቶሊ ሜታ ባኣያ ናንጋኒያ ኮይባኣሴ።
44016037	Violence	ጳውሎሴ ጋዓንቴ፦ «ኑኡኒ ሮሜ ዓሲታንቴ ኑ ጊዳ ዎጉዋዖ ዓሳ ቡካ ቤዞይዳ ኑና ጳርቂ፥ ቱኡዞ ማኣራ ኑና ዔያታ ቱኬኔ። ሃሢ ጊንሣ ቱኡዞ ማኣራፓ ዴሚና ኑ ኬስካንዳጉዲ ዎዲ ዔያታ ጌዔይ? ዬይ ማዑዋሴ! ዔያታ ፔ ቶኦኪና ሙኪ ኑና ኬሶንጎ!» ጌዔኔ።
45013009	Recommendation	«ማቾ ሃሣ ዓኒ ማዒ ባኣያና ላሂፖ፤ ዓሲ ዎዺፖ፤ ዉኡቂፖ፤ ዓሲሮ ማዔ ባኣዚ ዓይጎዋ ዛጊ ሱኡካዺፖ» ጋዓ ዓይሢፆንታ ሃንጎ ዓይሢፃኣ ቢያ «ዓሲ ቢያ ኔና ማሂ ናሽኬ» ጋዓ ዬኖ ፔቴ ዓይሢፆ ዎጌሎ ጋራ ማዓኔ።
62003003	Faith	ዬይ ያዺ ማዓንዳያታሢ ኪሪስቶሴ ዛሎና ሃጊ ማዓንዳ ዎዛ ጌሣሢ ቢያ ኪሪስቶሴ ጌኤሺ ማዔሢጉዲ ፔና ጌኤሻኔ።
45007022	Faith	ታኣኮ ጋሮ ዒና ጋዓንቴ ፆኦሲ ዎጎና ዎዛዻኔ።
50004004	Recommendation	ጎዳና ዒንሢ ዓኣሢሮ ቢያ ዎዴ ዎዛዹዋቴ፤ ላሚ ላሚ ታ ዒንሢ «ዎዛዹዋቴ» ጋዓኔ።
66001012	Description	ዬያ ታኣም ዖ ኬኤዛቴያ ዔራኒ ጊንሢም ታ ሺሬኔ፤ ዬማና ላንካይ ዎርቄፓ ኮሾና ፖዒ ጌሦ ሻርና ታ ዴንቄኔ፤
58003018	Sin	ሃሣ «ታኣኮ ሃውሾ ቤዞ ጌላዓ» ጌዒ ጫኣቆናዞንሢ ዎንሢዳይ? ዬንሢ ዓይሢንቶ ዒፄዞንሢቱዋዓዳ?
43010008	Sin	ታኣኮ ቤርታ ሙኬዞንሢ ዉዞና ሱሎናኬ፤ ማራታ ጋዓንቴ ዔያቶም ዋይዚባኣሴ።
60002018	Recommendation	ዒንሢ፥ ዓይሎ ማዔ ዓሳ ዒንሢ ዎይሣ ዓሶም ዓይሢንቱዋቴ፤ ዒንሢ ዓይሢንታንዳሢ ኮሺ፥ ሃሣ ሼሌዔ ማዔዞንሢም ሌሊቱዋንቴ ሚጪንቱዋ ዓሶንታም ቢያኬ።
44006013	Description	ዒማና ዒዛ ዑፃ ሉኡዙሞና ማርካዻንዳ ፔቴ ፔቴ ዓሲያ ዔያታ ዔኪ ሙኬኔ፤ ሉኡዙሞና ማርካዻ ዓሳ ኬኤዛዖ፦ «ሃይ ዓሢ ሃያ ጌኤዦ ማኣሮና ሙሴ ዔርዜ ዎጎና ጫሽካኔ።
47005018	Faith	ዬይ ቢያ ያዺ ማዔሢ ኑና ፔኤና ዎላ ኪሪስቶሴ ዛሎና ጊኢጊሼሢና፥ ጊኢጊሺፆ ማዾዋ ኑም ዒንጌ ፆኦዛሢ ዛሎናኬ።
59005010	Recommendation	ታ ዒሾንሦ! ታ ሚሾንሦ! ጎዳሢ ሱንፆና ፆኦሲ ማሊፆ ኬኤዛ ዓሳ ሜቶ ጊቢ ዔኪፆና ኮኦኪንሢ ዒንሢም ማዔያታሢ ዔሩዋቴ።
44002021	Faith	ጎዳ ማኣዶም ጌዒ ዔኤላ ዓሲ ቢያ ዻቃንዳኔ›» ሂዚ ጌዔሢ ኩማንዳጉዲኬ።
66007012	Faith	ሂዚ ጌዔኔ፦ «ዓኣሜን፤ ሄርሺሢና ቦንቾና ዔራቶና፥ ጋላታና ዼኤፒሲሢና ዎልቄና ዶዱሞና፥ ኑ ፆኦዛሢም ናንጊና ማዖንጎ፤ ዓኣሜን።»
60003003	Recommendation	ዒንሢኮ ሚዛጱማ ቶኦኪ ማዢንቲና፥ ዎርቄ ዋይዚዳ ዓኣሥሢና፥ ቃራ ጊኢጋ ማኣዖ ማይንቲ ዙሌና ጴዻ ሚዛጱሞና ማዖፖ።
55001008	Faith	ዓካሪ ኑ ጎዳሢ ዛሎ ዓሶም ማርካዻኒ ሴልቂፖ፤ ሃሣ ዒዛ ዛሎሮ ቱኡቴ፥ ታ ዛሎሮዋ ሴልቂፖ፤ ፆኦሲ ኔኤም ዒንጋ ዎልቆና ኮዦ ሃይሶ ዛሎሮ ታኣና ዎላ ሜታዼ።
43017019	Description	ዔያታ ጎኔና ኔኤም ዱማዼያ ማዓንዳጉዲ ታኣኒ ታ ቶኦኮ ዔያቶ ጋቴ ዱማሴኔ።
66003002	Recommendation	ዬያሮ ጴጬ! ኔኤኮ ማዻ ታ ፆኦዛሢ ቤርታ ፒዜ ማዔም ታ ዴንቂባኣሢሮ ሃይቃኒ ዑኪ ዓኣ፥ ዓቴ ባኮ ኔኤኮ ዶዲሼ።
66016004	Description	ሃይሣሳ ኪኢታንቻሢ ዑዦ ዓንጎይዳ ዓኣ ዑዦ ዎሮ ዋኣፆንታ ዓልቃ ዋኣፆንታይዳ ላኣላዛ፥ ዬይያ ሱጉሢ ማዔኔ፤
45005002	Faith	ዒዛ ዛሎና ሃሢ ኑ ዓኣ፥ ፆኦሲኮ ኮሹሞ ዒንጊፆይዳ ጉሙርቂሢና ኑ ጌላኒ ዳንዳዔኔ፤ ፆኦሲና ዎላ ቦንቺንታያ ኑ ማዓንዳሢሮ ሃጊ ማዓንዳ ዎዞና ኑ ዎዛዻኔ።
49005005	Sin	ማቾ ሃሣ ዓኒ ማዒባኣያና ላሃያኮ፥ ቦርሲሳ ማዾ ማዻያኮ፥ ሜሌ ካኣሺ ካኣሽኪሢጉዲ ዓሲሮ ዛጊ ሱኡካዻ ዓሲኮ ኪሪስቶሴና ፆኦሲ ካኣቱሞናይዳ ቤሲባኣያ ማዓንዳሢ ዔሩዋቴ።
58011008	Faith	ዓብራሃሜ ፔ ዓጪ ማሂ ዔካንዳ ቤዞ ዓኣዻንዳጉዲ ፆኦሲ ዒዛ ዔኤሌ ዎዶና ዓንኮ ዓኣዻቴያ ዔሪባኣያታዖ «ዔኤዔ» ጌዒ ዓይሢንቲ ዓኣዼሢ ጉሙርቂሢናኬ።
49005018	Recommendation	ዒንሢ ባይሲንታ ባንሢ ዔኪ ዓኣዻያታሢሮ ዳጋሢ ዑሺና ማሢንቲፖቴ፤ ዬያይዳፓ ዓያና ጌኤሺ ቢታንቶ ዴሞ ጌላያ ማዑዋቴ።
61002002	Sin	ዬያ ዛሎና ሚርጌ ዓሳ ዔያቶኮ ቦርሲሳ ማዾ ማዻንዳኔ፤ ዔያቶኮ ዬያ ማዾይዳፓ ዔቄያና ጎኑሞ ጎይፃ ጫሽኪንታንዳኔ።
49002018	Faith	ዬያሮ ኑኡኒ ቢያሢ ዒዛ ዛሎና ፔቴ ዓያናና ማዒ ዓዳሢ ባንሢ ሙካኒ ዳንዳዓኔ።
44021025	Recommendation	ኪሪስቶሴ ጉሙርቃ፥ ዓይሁዴ ማዒባኣ ዓሶ ዛሎ ጋዓንቴ ‹ሜሌ ካኣሺም ሹኪንቴ፥ ዒኢቴ ባኣዚ ሙዒፖቴ፤ ሱጉሢያ ዑሽኪፖቴ፤ ሱጉሢ ሾኦቲ ባኣንቴ ጩኡሊንቲ ሃይቄ ቆልሞ ሙዒፖቴ፤ ማቾ ሃሣ ዓኒ ማዒባኣያና ላሂሢና ዬያጉዴ ባኣዚ ማዺፖቴ› ጋዓያ፥ ኑኡኒ ዎላ ጌስቲ ዔቂሴ ኪኢታ ዔያቶም ኑ ዳኬኔ» ጌዔኔ።
44005003	Sin	ጴፂሮሴ ጋዓንቴ ዒዛም፦ «ሃናኒያ! ዓያኖ ጌኤዦም ኔ ሉኡቃንዳጉዲ ሃሣ ሳዖ ኔ ሻንቼ ሚኢሾኮ ዛሎ ፓቂ ዓይሳንዳጉዲ ማዼ ፃላሄ ዒና ኔኤኮ ዓይጋ ጌሌይ?
49004014	Recommendation	ዓካሪ ሃካፓ ሴካ ዓሶኮ ዻቢሻ ጌሺፆ ዔርዚፆ ዢባሮና ሴካ ሃንጋ ጌዒ ጌዒ ናይ ኑ ማዓዓኬ።
46006009	Sin	ፑርቶ ዓሳ ፆኦሲ ካኣቱሞይዳ ጌሊንዱዋኣሢ ዒንሢ ዔሩዋዓዳ? ዬያ ባኮና ጌሺንቲፖቴ፤ ዓኒ ሃሣ ማቾ ማዒባኣ ዓሶና ላሃኒ ሱኡካዻ ዓሳ፥ ፆኦሲፓ ሜሌ ካኣሽካ ዓሳ፥ ዓኒ ሃሣ ማቾ ማዒባኣ ዓሶና ላሃ ዓሳ፥ ዓቲንቄና ላሃ ዓቲንቄ፥
58010025	Recommendation	ቢያ ዎዴ ዎላ ኑ ካኣሚ ካኣሚ ዎሊ ኑ ዶዲሾም፤ ጋዓንቴ ፔቴ ፔቴ ዓሳ ማዻ ጎይፆ ኑኡኮ ዎላ ቡኪንታ ቡኪንቶ ኑ ሃሺባኣያታቴ ቃራኬ፤ ጎዳኮ ሙኮ ኬላ ዑኬሢ ዒንሢ ዛጋያታሢሮ ዬያ ባኮ ዑሣ ዓኣዼ ማዹዋቴ።
51003005	Sin	ዬያሮ ዒንሢዳ ዓኣ ዒንሢኮ ሳዖ ፑርቶ ማዾ ሱኡኮ ቢያ ዓያኖና ዎዹዋቴ፤ ዬንሢያ፦ ማቾ ሃሣ ዓኒ ማዒባኣያና ላሂሢ፥ ዒኢሳ ማዾ ማዺሢ፥ ማቾ ሃሣ ዓኒ ማዒባኣያና ላሃኒ ኮዒ ሱኡካዺሢ፥ ፆኦሲፓ ሜሌ ካኣሺ ካኣሽኪሢጉዴያ ማዔ ፔኤም ማዓ ባኣዚሮ ጎጋይቂሢንታኬ።
52005008	Faith	ኑኡኒ ጋዓንቴ ፖዒም ማዔ ዓሲታሢሮ ኑና ኑ ዔሪ ዎይሢ፥ ኮይሳ ናንጊ ኑ ናንጎም፤ ፆኦሲ ጉሙርቂሢና ናሹሞና ዖልዚሮ ዳዳ ማኣዖ ዓንጎጉዲ ኑ ማይንቲ፥ ዻቂንቶኮ ሃጊ ማዓንዳ ዎዞዋ ቶኦካ ዓጎ ዖሎ ቆኦቦጉዲ ኑ ዓጎም፤
55001007	Grace	ዓይጎሮ ጌዔቴ ፆኦሲ ኑም ዒንጌሢ ዎልቄንታ ናሹሞንታ ዒንጋያ፤ ሃሣ ኑና ኑ ዔሪ ዎይሣንዳ ዓያና ማዓንዳኣፓዓቴም ዒጊቹሞ ዓያናቱዋሴ።
62002004	Sin	«ፆኦሲ ታ ዔራኔ» ጌይ ጌይ ዒዛኮ ዓይሢፆ ኩንሡዋይ ዓኣቶ ዬይ ሉኡዚ ዓሲኬ፤ ጎኑሞዋ ዒዛይዳ ባኣያኬ።
50002002	Faith	ዬያሮ ፔቴ ማሊሢና ናሹሞ ዓያናና ዎላ ጊኢጊ ናንጊሢና ታኣኮ ዎዞ ኩሙሢ ዎዛ ማሁዋቴ።
43007030	Description	ዒማና ዔያታ ዒዛ ዓርቃኒ ኮዔያታንቴ ዎዳ ዒዛኮ ሃጊ ሄሊባኣሢሮ ዖኦኒያ ዒዛ ዓርቂባኣሴ።
54006018	Recommendation	ሃሣ ኮሺ ማዾ ዔያታ ማዻንዳጉዲ፥ ዬያ ማዾ ማዺፆና ዔርቴ ዓሲ ማዓንዳጉዲ ሃሣ ዔያቶኮ ዓኣ ባኮ ዒንጋኒና ፓቂ ጊሽታኒ ናሽካያ ማዓንዳጉዲ ዞሬ።
43018030	Description	ዔያታ ማሃዖ፦ «ሃይ ዓሢ ፑርታ ማዺባኣ ዓሲ ማዔቶ ኔኤም ኑ ዒዛ ዓኣሢ ዒንጋዓታንቴኬ» ጌዔኔ።
45014006	Faith	ፔቴ ኬሎ ሜሌ ኬላፓ ባሼ ማሂ ቦንቻያ ዓኣቶ ዬያ ዒ ማዻሢ ጎዳ ቦንቾም ጌዒኬ፤ ቢያ ባኮ ሙዓሢ ጎዳ ቦንቾም ጌዒ ሙዓኔ፤ ሙዓ ሙዖሮዋ ፆኦሲ ዒ ጋላታኔ። ቢያ ሙዖ ሙዑዋኣሢያ ፆኦሲ ቦንቾም ጌዒ ሙዑዋሴ፤ ዒ ሙዑዋዖ ሃሺፆና ፆኦሲ ጋላታኔ።
45012012	Recommendation	ሃጊ ማዓንዳ ባኮና ዎዛዹዋቴ፤ ሜቶ ዎዴና ጊቢ ዳንዳዑዋቴ፤ ቢያ ዎዴና ሃሣ ሺኢቁዋቴ።
44024023	Description	ጳውሎሴ ካፓ፥ ፄኤቶ ፖኦሊሶ ዓይሣሢም፦ «ፔቶዋ ዒዛ ቃዚ ሜታሱዋዖ ዛጊ ካፔ፤ ዒዛኮ ዒጊና ዒዛም ኮይሳ ባኮ ዔኪ ሙካኣና ላኣጊፖ» ጌዔኔ።
46013007	Description	ቢያ ባኣዚ ጊቢ ዳንዳዒሳኔ፤ ቢያ ባኣዚና ፆኦሲ ጉሙርቂሳኔ፤ ቢያ ባኣዚዳ ሃጊ ማዓንዳ ዎዛ ጌሢሳኔ፤ ቢያ ባኣዚያ ዶዲ ዓኣሢሳኔ።
47004013	Faith	ጌኤዦ ማፃኣፖይዳ፦ «ታ ጉሙርቃሢሮ ኬኤዜኔ» ጌይንቲ ፃኣፒንቴሢጉዲ፥ ኑኡኒያ ዬኖ ዓያኖና ጉሙርቃኔ፤ ዬያሮ ኑ ኬኤዛኔ።
52005014	Recommendation	ታ ዒሾንሦ! ታ ሚሾንሦ! ማዾ ማዹዋ፥ ቤልፃዻ ዓሶ ጎሩዋቴ፤ ዒጊጫ ዓሶ ዶዲሹዋቴ፤ ላቢንታ ዓሶዋ ማኣዱዋቴ፤ ዓሲ ቢያና ጊቢ ዳንዳዒ ናንጉዋቴ።
66016010	Description	ዶንጋሳ ኪኢታንቻሢ ዑዦ ዓንጎይዳ ዓኣ ዑዦ ቦዓሢኮ ካኣቱሞ ዖይቶይዳ ላኣላዛ፥ ቦዓሢኮ ካኣቱማ ዹሚ ማዔኔ፤ ዓሳ ኮሺ ሜታዺ ሜታሢዳፓ ዔቄያና ዒንዲርዞ ፔኤኮ ዻዓኔ፤
48006016	Grace	ሃኖ ዓይሢፆ ጎይፆ ዓኣዻ ፆኦሲ ዴሮም ቢያ ኮሹሞና ማኣሪሢና ማዖንጎ።
44018025	Faith	ዬይ ዓሢ ጎዳ ዛሎ ኮሺ ዔራያና ዓያናና ዒናፓ ማዻኒ ማላያ ማዒ ዬሱሴ ዛሎ ፒዜ ኬኤዚ ኬኤዚ ዔርዛኔ። ያዺ ማዔቶዋ ዒዚ ባሼ ዔራሢ ዮሃኒሴኮ ዋኣፆ ማስኪፆ ዛሎ ሌሊኬ።
46010031	Recommendation	ዓካሪ ሙዓቶዋ፥ ዑሽካቶዋ ዓይጎ ባኣዚያ ማዻቴ ቢያ ባኣዚ ፆኦሲ ቦንቾም ማዹዋቴ።
62002027	Recommendation	ጋዓንቴ ኪሪስቶሴይዳፓ ዒንሢ ዔኬ ዓያና ዒንሢዳ ናንጋሢሮ ሜሌ ዖኦኒያ ዒንሢ ዔርዛንዳያ ኮይሱዋሴ፤ ዒዚ ቢያ ባኣዚ ዒንሢ ዔርዛንዳኔ፤ ዒዚ ዒንሢ ዔርዛንዳሢ ጎኔ ባኣዚ ማዓንዳኣፓዓቴም ሉኡዙሞቱዋኣሢሮ ዒዚ ዒንሢ ዔርዛ ጎይፆማ ኪሪስቶሴና ናንጉዋቴ።
59002026	Faith	ሼምፖይዳፓ ዱማዼ ዓሽኪ ሃይቄያታሢጉዲ ማዾይዳፓ ዱማዼ ጉሙርቂሢ ያዼ ሃይቄያኬ።
44027035	Description	ዬያ ጌዔስካፓ ካሣ ዔኪ ቢያሢኮ ቤርታ ፆኦሲ ጋላታዖ፥ ቡንፂ ሙዒሢ ዓርቄኔ።
44015020	Sin	ዬያይዳፓ ‹ሜሌ ካኣሺም ሹኪንቴ፥ ዒኢቴ ባኣዚ ሙዒፖቴ፤ ማቾ ሃሣ ዓኒ ማዒባኣ ዓሲና ላሂፖቴ፤ ሱጉሢ ሾኦቲ ባኣያ፥ ጩኡሊንቲ ሃይቄ ቆልሞ ሙዒፖቴ፤ ሱጉሢያ ዑሽኪፖቴ› ጌዒ ኑ ዔያቶም ፃኣፓንዳኔ።
44023003	Sin	ዬማና ጳውሎሴ ሃናኒያም፦ «ኔኤኒ ቦኦሪንታሢና ዑፃ ሜኤቺንቴ ኮጫሦ! ኔና ፆኦሲ ጳርቃንዳኔ፤ ዎጌ ጎይሢና ዎጋኒ ሃካ ኔ ዴዒ ዓኣዖ ዎጌባኣ ጎይሢና ታና ጳርቃንዳጉዲ ኔ ዓይሣ?» ጌዔኔ።
45008001	Description	ዓካሪ ሃሢ ዬሱስ ኪሪስቶሴና ፔቱሞ ዓኣዞንሢ ናንጊና ፑርታ ዎጌና ዎጊሳ ባኣዚ ባኣሴ።
52005009	Grace	ፆኦሲ ኑና ማሊ ዔኤሌሢ ሜቶ ኑም ዒንጋኒቱዋንቴ ኑ ጎዳሢ ዬሱስ ኪሪስቶሴ ዛሎና ዻቂንታ ኑ ዴንቃንዳጉዲኬ።
66020008	Violence	ዬካፓ ዒ ዓጮ ቢያይዳ ዓኣ፥ ጎኦጌና ማኣጎኦጌ ጌይንታ ዴሮ ዻቢሺ ዖልዚሮዋ ዔያቶ ዔኪ ኬስካንዳኔ፤ ዬያ ዴሮኮ ፓይዳ ባዞ ዓጫ ዓኣ ማኣሻሎጉዲኬ።
46006011	Grace	ዒንሢዳፓ ፔቴ ፔቴዞንሢ ቤርታ ያዺኬ፤ ሃሢ ጋዓንቴ ጎዳ ዬሱስ ኪሪስቶሴ ሱንፆና ኑ ጎዳሢ ዓያኖና ጎማፓ ዒንሢ ማስቲ ጌኤሽኬኔ፤ ፆኦሲም ዱማዼ ዴሬያ ዒንሢ ማዔኔ፤ ፂሊያ ፂሌኔ።
55001012	Faith	ሃያ ታ ሜታሢ ዔካሢ ዬያሮኬ፤ ጋዓንቴ ታኣኒ ሃያ ሜቶ ዔኪፆና ሴልቁዋሴ፤ ዓይጎሮ ጌዔቴ ዖና ጉሙርቃቴያ ታ ዔራኔ፤ ታ ዒዛም ሃዳርሲ ዒንጌ ባኮ ዬኖ ኬሎ ሄላንዳኣና ዒ ካፓኒ ዳንዳዓሢ ታ ጉሙርቃኔ።
49006018	Faith	ዒንሢም ኮይሳ ባኮ ቢያ ዒንሢ ሺኢቃኣና ዓያና ጌኤሺና ቢያ ዎዴ ሺኢቁዋቴ፤ ዬያይዲ ዶዲ ጴጩዋቴ፤ ኪሪስቶሴ ጉሙርቃ ዓሶማኣ ቢያ ዋሉዋዖ ሺኢቁዋቴ፤
52001001	Grace	ፆኦሲ፥ ዓዳሢና ጎዳ ዬሱስ ኪሪስቶሴናሮ ማዔ ቴስሎንቄ ሺኢጲፆ ማኣሮ ዓሶም፤ ጳውሎሴና ሲላሴና ፂሞቴዎሴናይዳፓ ዳኪንቴ ኪኢታ፦ ፆኦሲኮ ኮሹሞ ዒንጊፃ ዒንሢም ማዖንጎ።
50004005	Faith	ዒንሢኮ ኮሹማ ዓሲ ቢያም ዔርቴያ ማዖንጎ፤ ጎዳ ሙካኒ ዑኬኔ።
46011026	Faith	ዬያሮ ሃያ ካፆ ዒንሢ ሙዓኣና ዑዦዋ ዒንሢ ዑሽካኣና ቢያ ጎዳ ሙካንዳያ ሄላንዳኣና ዒዛኮ ሃይቦ ዛሎ ዒንሢ ኬኤዛንዳኔ።
59005015	Faith	ዬያጉዴ ጉሙርቂሢዳ ዶዲ ዔቂ ሺኢቆ ሺኢጲሢ ሃርጌ ዓሢ ዻቂሻኔ፤ ጎዳሢያ ዒዛ ሃርጎይዳፓ ፖዒሳንዳኔ፤ ሃሣ ዬይ ዓሢ ማዼ ጎሜ ዓኣቶዋ ዓቶም ጌይንታኔ።
55001003	Faith	ቢያ ዎዴ ዋንቴና ሮኦሪና ኔ ዛሎ ማሊ ማሊ ታ ሺኢቃኣና ቤርታኣ፥ ታ ዓዶንሢጉዲ ጌኤሺ ዒናፓ ታ ካኣሽካ ፆኦዛሢ ታ ጋላታኔ።
66006016	Description	ዬካፓ ዹኮና ላሎናም፦ «ኑ ዑፆይዳ ዶዑዋቴ! ካኣቱሞ ዖይቶይዳ ዴዔሢና ማራዓሢናኮ ጎሪንታፓ ኑና ዓኣቹዋቴ!
66002017	Description	«ሺኢጲፆ ማኣሮም ዓያና ጋዓ ባኮ ዋይዛ ዋይዚ ዓኣሢ ዋይዞንጎ! ዖሎና ባሼሢም ዓኣቺ ጌሦና፥ ማና ጌይንታ ሙዖ ታ ዒንጋንዳኔ፤ ሃሣ ጊንሣ ዓኪ ሱንሢ ጊዳ ፃኣፒንቴ፥ ቦኦሬ ሹቺ ታ ዒዛም ዒንጋንዳኔ፤ ዬኖ ዔኬ ዓሢዳፓ ዓታዛ ሜሌ ዖኦኒያ ዬኖ ሱንፄሎ ዔራንዳያ ባኣሴ» ጌዔኔ።
61002003	Sin	ዬያታ ሉኡዙሞና ዔርዛ ዓሳ ሚኢሼ ዛጊ ጎጋይቂሢዳፓ ዔቄያና ፔኤኮ ኬሴ ሃይሴ ኬኤዚ ኬኤዚ ዎልቆ ዒንሢሲ ጌሺ ሙዓንዳኔ። ዖዶሲ ዎዴኮ ቤርታፓ ዓርቂ ፑርታ ዎጌ ዔያቶም ጊኢጊንቲ ዓኣኔ፤ ባይሲንታ ሃሣ ዔያቶ ጴጪ ካፒ ዓኣኔ።
53002011	Sin	ዬያ ዛሎና ሉኡዙሞ ባኣዚ ዔያታ ጉሙርቃያ ማዓንዳጉዲ ፆኦሲ ዔያቶ ዻቢንቲ ማዾ ማዺሻንዳኔ።
45002024	Sin	ዬይ ያዺ ማዔሢ፦ «ዒንሢ፥ ዓይሁዶ ዓሶ ዛሎና ፆኦሲኮ ሱንፃ ዓይሁዴ ማዒባኣ ዓሶና ጫሽኪንታኔ» ጌይንቲ ፃኣፒንቴ ጎይፆናኬ።
55003008	Sin	ዒያኔሴና ዒያምቤሬሴ ጎዖዞንሢ ሙሴ ዒፂ ማኬሢ ጎይፆ ዬንሢ ዓሳ ማሊፃ ዔያቶኮ ፑርቴያ ሃሣ ፆኦሲ ጉሙርቂፆ ዛሎና ዻቢንቴያ ማዔሢሮ ጎኑሞ ዔያታ ዒፂ ማካኔ።
66003019	Recommendation	ታኣኒ ናሽካዞንሢ ቢያ ሜቶ ዒንጊ ጎራኔ፤ ዬያሮ ዶዴ፤ ጎሞዋ ኔኤኮ ቡኡፄ።
45005001	Faith	ዓካሪ ኑኡኒ ፂሉሞ ዴንቄሢ ጉሙርቂሢና ማዔሢሮ ኑ ጎዳ ዬሱስ ኪሪስቶሴ ዛሎና ፆኦሲና ዎላ ኑኡኮ ኮሹሞ ዓኣኔ።
54004016	Recommendation	ኔ ዛሎ፤ ሃሣ ኔ ዔርዛ ዔርዚፆ ዛሎ ኔና ዔሬ፤ ዬንሢ ባኮንሢ ዶዲ ማዼ፤ ዬያ ኔ ማዼቴ ኔናንታ ኔኤፓ ዋይዛ ዓሶንታ ኔ ዻቂሻንዳኔ።
44026011	Violence	ሚርጌ ዎዴ ዓይሁዶ ዓሶኮ ቡኪንቶ ቤዞይዳ ዔያታ ሜታዻንዳጉዲና ጉሙርቂፆዋ ዔያታ ሃሻንዳጉዲ ማሃኒ ታ ማሌኔ፤ ዔያቶ ዑፆይዳ ሚርጌና ዻጋዺ ሃሣ ሜሌ ሜሌ ካታሞይዳኣ ዓኣዺ ታ ዔያቶ ዳውሳኔ።
48005019	Sin	ዓሲ ማዻኒ ሱኡካዻ ማዾ ዔርቴያኬ፤ ዬያታ፦ ማቾ ሃሣ ዓኒ ማዒባኣያና ላሂሢ፥ ዒኢሳ ማዾ ማዺሢ፥ ማቾ ሃሣ ዓኒ ማዒባኣያና ላሃኒ ኮዒ ዑሢ ዓርቂ ዓማሊሢ፥
46003007	Grace	ዬያሮ ዼኤፖ ማዾ ማዼሢ ባቃሎ ዑጊሴ፥ ፆኦዛሢ ማዓንዳኣፓዓቴም ዱኡቄሢንታ ዋኣፆ ዑሼሢንታቱዋሴ።
46001007	Faith	ዬያሮ ኑ ጎዳሢ፥ ዬሱስ ኪሪስቶሴኮ ሙኪፆ ካፒ ካፒ ዒንሢ ናንጌቴ ዓይጎጉዴ ዓያና ዒንጊሢ ማዔቴያ ዒንሢም ፓጫዓኬ፤
66014002	Description	ዬኖና ጫሪንጮይዳፓ ዼኤፒ ሶኦሪንታ ዋኣሢ ዑኡሲ ሃሣ ዼኤፒ ጉጉንሢ ማላ ዑኡሲ ታ ዋይዜኔ፤ ዬይ ታ ዋይዜ ዑኡዛ ጎኦሎ ዓይናዺ ዋርቃ ዓሳ ጎኦሎ ዋርቃዛ ዋይዚንታ ዑኡዞጉዴያኬ።
44010043	Faith	ዒዛና ጉሙርቃዞንሢም ቢያ ዒዛኮ ሱንፆና ጎማ ዓቶም ጌይንታንዳሢ ፆኦሲ ማሊፆ ኬኤዛ ዓሳ ዒዛ ዛሎ ማርካዼኔ» ጌዔኔ።
45002007	Faith	ኮሺ ማዾ ዶዲ ማዺ ጋላታና ቦንቾና ሃሣ ባይቁዋ ናንጊያ ኮዓዞንሢም ናንጊና ጋፑዋ ናንጊ ፆኦሲ ዒንጋንዳኔ።
66001004	Grace	-
44019004	Faith	ጳውሎሴ ጊንሣ፦ «ዮሃኒሴኮ ማስኪፃ ጎሞ ቡኡፂፆ ዔርዛያ ማዔኔ፤ ዬማና ዴሮም ዒዚ ኬኤዛዖ ‹ታኣኮ ጊንፃፓ ሙካሢ ጉሙርቁዋቴ› ጌዒ ጌዒኬ፤ ያዺ ጌይንቴሢያ ዬሱሴኬ» ጌዔኔ።
61002009	Violence	ዓካሪ ዬይ ቢያ ያዺ ማዔቶ ፆኦሲ ጎኑሞና ካኣሽኪ ናንጋ ዓሶ ዻቢሳ ባኣዚዳፓ ዓይሲ፤ ሃሣ ጎሞ ዓሶ ሜታሲ ዎጎ ኬሎ ሄላንዳኣና ጌሢ ዎይቲ ካፓንዳቴያ ፆኦሲ ዔራኔ።
58011016	Grace	ሃሢ ጋዓንቴ ባሼ ማዔያ፤ ሃሣ ጫሪንጮይዳ ዓኣ ዓጮ ዔያታ ጶቂሢ ማላኔ፤ ዬያፓ ዔቄያና ፆኦሲ ዔያቶም ካታማ ጊኢጊሼሢሮ «ኑ ፆኦዛሢ» ጌዒ ዔያታ ዔኤሌቴ ዒዛ ቦርሳያቱዋሴ።
54004007	Recommendation	ጋርቼ ላኣሎኮ ፓሡዋ ሃይሶና ሃያ ዓጮኮ ጉሪ ማዔ ሃይሶይዳፓ ሃኪ፥ ዓያና ዛላ ባኣዚ ማዺ ማዺ ዔሬ።
66020009	Violence	ዔያታ ዓጮ ቢያ ኬስኪ ዴንዳዖ ፆኦሲም ዱማዼ ዓሳ ናንጋ ጉርዶና ዒዚ ናሽካ ካታሜሎዋ ማንጌኔ፤ ጋዓንቴ ጫሪንጫፓ ታሚ ኬዲ ዔያቶ ሙዔኔ።
44010048	Description	ዬያሮ ዔያታ ዬሱስ ኪሪስቶሴ ሱንፆና ዋኣፆ ማስታንዳጉዲ ዓይሤኔ፤ ዬካፓ ጴፂሮሴ ዔያቶና ዎላ ዻካ ኬሊ ዴዓንዳጉዲ ዔያታ ዒዛ ሺኢቄኔ።
45002019	Grace	ኔኤኒ ሃሣ፦ «ዓኣፖ ባይቄ ዓሶ ታ ዔኪ ዓኣዻያ፥ ዹሞይዳ ዓኣ ዓሶኮዋ ታ ፖዒኬ» ኔ ኔና ጋዓኔ።
62002025	Grace	ዬይ፤ ኪሪስቶሴ ኑም ዒንጌ ሃጊ ማዓንዳ ዎዛ ናንጊና ናንጎኬ።
59003017	Description	ጋዓንቴ ፆኦሲዳፓ ጴዻ ዔራታ ቤርታሳዖ ጌኤሺኬ፤ ሄሊሳዖ ኮሹሞ ናሽካያ፥ ጊቢ ዳንዳዓያ፥ ዓይሢንታያ፥ ዓቶም ጋዓያ፥ ቃራ ዓኣፒ ዓኣፓያ፥ ዓሲ ዱማሲሢና ዔራያ ፔና ማሊሲሢና ባኣያኬ።
43003035	Faith	ዓዴ ፔኤኮ ናዓሢ ናሽካኔ፤ ቢያ ባኮ ዒዛ ኩጫ ዒንጌኔ።
61003009	Grace	ፔቴ ፔቴ ዓሶም ናጋያ ማላሢጉዲ ጎዳ ዬሱሴ ዒዚ ኬኤዜ ሃጊ ማዓንዳ ዎዞ ቃኣሎ ኩንሣኒ ናጊንዱዋሴ፤ ጋዓንቴ ዓሲ ቢያ ጎሜፓ ማዓንዳጉዲና ሃሣ ፔቴታዖ ዓሲ ባይቁዋጉዲ ዒንሢ ዛሎሮ ጌዒ ዒዚ ጊቢ ካፓኔ።
46007007	Grace	ዓሲ ቢያ ታጉዲ ላኣሊ ዔኩዋዖ ናንጌቴ ቃራኬ ታ ጋዓኔ፤ ጋዓንቴ ፔቴ ፔቴሢም ፆኦሲ ዱማ ዱማ ዒንጊሢ ዒንጌኔ፤ ፔቴሢም ፔቴ ባኣዚ፥ ባጋሢም ሜሌ ባኣዚ ዒንጊንቴኔ።
