60003001	Recommendation	ዓካሪ ዒንሢ ላኣላ ዓኒንሢም ዒንሢኮ ዓይሢንቱዋቴ፤ ዬያይዲፆና ሃጊ ፆኦሲ ቃኣሎ ጉሙርቂ ዔኪባኣ ዓኒንሢ ዓኣቶ ዻንጋና ኬኤዚሢና ሌሊቱዋንቴ ማቾንሢኮ ናንጋ ናንጎ ዛጊ ፆኦሲ ባንሢ ማዓኒ ዳንዳዓኔ።
47005020	Recommendation	ፆኦሲ ዓሶ ፔ ባንሢ ኑ ዛሎና ዔኤላሢሮ ኑኡኒ ኪሪስቶሴ ዛሎ ማዒ ጌስታያኬ፤ ዬያሮ፦ «ፆኦሲና ዎላ ጊኢጉዋቴ» ጌዒ ኪሪስቶሴ ሱንፆና ኑ ዒንሢ ሺኢቃኔ።
44002024	Description	ፆኦሲ ጋዓንቴ ሃይቢኮ ዓኣ ዎልቆ ሜንሢ ሃይቢፓ ዒዛ ዔቂሴኔ፤ ሃይቢያ ዒዛ ዓርቂ ቃዛኒ ዳንዳዒባኣሴ።
59002007	Sin	ዒንሢ ዛሎና ዔኤሊንታ ቦንቺንቴ ሱንፆ ዒንሢኮ ጫሽካሢ ዔያቶቱዋዓዳ?
54003003	Description	ዑሽኪ ማሢንቱዋያ፥ ዓሲና ዣሉዋያ፥ ሼሌዔ ዓሲ፥ ኮሺ ዓሲ፥ ሚኢሼ ባሼ ናሽኩዋያ፥
43004014	Grace	ታኣኒ ዒንጋ ዋኣፆይዳፓ ዑሽካሢ ናንጊና ፔቴታዖ ዼኤቢንታዓኬ፤ ዓይጎሮ ጌዔቴ ታ ዒንጋ ዋኣፆ ዑሽካ ዓሢዳፓ ናንጊና ናንጊ ዋኣሢ ዓልቃያ ማዓንዳኔ» ጌዔኔ።
62002005	Faith	ጋዓንቴ ፆኦሲ ቃኣሎም ዓይሢንታሢ ቢያ ፆኦሲ ጉቤ ዒናፓ ናሽካኔ፤ ጎኔና ኑኡኮ ፆኦሲ ዓሲ ማዒፃ ዔርታሢ ዬያናኬ።
66016013	Description	ዼኤፖ ሾኦዣሢ ዻንጎና ቦዓሢ ዻንጎና ሃሣ ሉኡዙሞና ፆኦሲ ማሊፆ ኬኤዛያ ማሊሳሢ ዻንጋፓ ፓንቆ ማላ፥ ሃይሦ ፑርታ ዓያና ኬስካንቴ ታ ዛጌኔ።
59002008	Recommendation	ጌኤዦ ማፃኣፖይዳ፦ «ዓሲ ዓዳ ኔና ማሂ ናሽኬ» ጌይንቲ ፃኣፒንቴ ፆኦሲኮ ቦንቺንቴ ዎጎ ዒንሢ ኩንሣያ ማዔቶ ኮሺ ዒንሢ ማዻኔ።
47004005	Faith	ኑኡኒ ኬኤዛሢ ዬሱስ ኪሪስቶሴ ጎዳ ማዔሢና ኑኡኒያ ኑ ቶኦኪና ዬሱሴ ዛሎና ዒንሢም ማዻያ ማዒፆ ማዓንዳኣፓዓቴም ኑ ዛላ ኑ ኬኤዙዋሴ።
46015033	Recommendation	ዻቢንቲፖቴ፤ «ፑርታ ላጌ ዓሲ ፑፑርቲሳኔ።»
58013020	Grace	ናንጊና ናንጎ ጫኣቁሞ ሱጉፆና ማራቶኮ ዼኤፒ ሄንቃያ ማዔ ኑ ጎዳሢ ዬሱሴ ሃይባፓ ዔቂሴ ኮሹሞኮ ፆኦዛሢ፥
50001027	Recommendation	ዓካሪ ቢያፓ ባሼ ማዔ ባካ ዓይጎዳይ ጌዔቴ፦ ናንጋ ዒንሢኮ ኪሪስቶሴ ኮዦ ሃይሶ ጋላቲሳያ ማዓኒ ኮይሳሢኬ፤ ዬይ ያዺ ማዔቴ ታ ዒንሢ ሙኪ ዛጌቴያ ሃኬ ማዔቴያ ፔቴ ማሊሢና ዶዲ ዒንሢ ዔቃንዳሢንታ ኮዦ ሃይሶ ማዾ ዶዲ ዒንሢ ማዻንዳሢ ታ ጉሙርቃኔ።
46006014	Grace	ፆኦሲ ጎዳ ዬሱሴ ሃይባፓ ዔቂሴኔ፤ ሃሣ ኑናኣ ፔ ዎልቆና ሃይባፓ ዔቂሳንዳኔ።
55001006	Recommendation	ዬያሮ ታ ኔ ዑፃ ኩጮ ጌሤም ኔ ዔኬ፥ ኔ ጊዳ ዓኣ ፆኦሲኮ ዒንጊፆ ማዾይዳ ፔኤሺ ኔ ዲቻንዳጉዲ ታ ኔኤም ኬኤዛኔ።
60004006	Grace	ቤርታ ዋይዜዖ ሃይቄ ዓሶማኣ ጉቤ ኮዦ ሃይሳ ኬኤዚንቴሢ ዬያይዳፓ ዔቄያናኬ፤ ዬያሮ ዓሽኮና ዔያታ ዓሳ ዎጊንታሢ ጎይፆ ዎጊንታንዳኔ፤ ዓያኖና ጋዓንቴ ዔያታ ፆኦሲ ናንጋ ጎይፆ ሼምፔና ናንጋንዳኔ።
46007023	Recommendation	ፆኦሲ ዒንሢ ሻንቂ ዔኬሢሮ ዓሲኮ ዓይሌ ማዒፖቴ።
46010010	Recommendation	ዔያቶይዳፓ ፔቴ ፔቴ ዓሳ ዾንኪ፥ ጉንዱሜም ፆኦሲ ዳኬ ዎዻ ኪኢታንቻሢ ዔያቶ ዎዺ ባይዜሢጉዲ ዒንሢያ ያዺ ማዒባኣቴ ቃራኬ።
47002017	Faith	ኑኡኒ ፆኦሲ ቃኣሎ ኮርሞ ባኣዚሮ ዔኪ ሃንታ ሚርጌ ዓሶጉዲቱዋሴ፤ ጋዓንቴ ኑኡኒ ፆኦሲፓ ዳኪንቴ ዓሶጉዲ ኪሪስቶሴና ማዒ ፆኦሲ ቤርታ ፒዙሞና ኬኤዛኔ።
45015001	Recommendation	ኑኡኒ ኪሪስቶሴ ጉሙርቂፆና ዶዲ ማዔ ዓሳ ጉሙርቂፆና ላቤ ዓሶኮ ላቢፆ ዔሪ ማኣዳያ ማዓንዳኣፓዓቴም ኑና ኑ ዎዛሳያ ማዓኒ ኮይሱዋሴ፤
50002024	Faith	ሃሣ ታኣኒያ ታኣሮ ዒንሢ ኮይላ ሙካንዳጉዲ ጎዳ ታና ማኣዳንዳኔ ጌዒ ታ ጉሙርቃኔ።
66007001	Description	ዬካፓ ዖይዶ ኪኢታንቻ ዓጮኮ ዖይዶ ዛሎና ዔቂ ዓኣንቴ ታ ዴንቄኔ፤ ዔያታ ሳዖይዳ ማዖም ባዞይዳ ሃሣ ሚፆይዳ ዓይጎ ዢባሬያ ዢባርሹዋጉዲ ዓጮኮ ዖይዶ ዛላፓ ሙካ ዢባሮ ቢያ ላኣጊ ዓርቄኔ።
60004003	Sin	ፆኦሲ ዔሩዋ ዓሳ ማዻሢ ጎይፆ፦ ማቾ ሃሣ ዓኒ ማዒባኣ ዓሲ ዓርቂ ዓማሊሢና፥ ማቾ ሃሣ ዓኒ ማዒባኣ ዓሲና ላሃኒ ሱኡካዺሢና፥ ዑሽኪ ማሢንቲሢና፥ ኮይሱዋ ኮሢ ኮርጊሢና፥ ኮይሱዋ ጎይሢ ዑሽኪ ኮኦሚሢና፤ ሃሣ ዒሣያ ማዔ ሜሌ ካኣዦ ካኣሽኪ ካኣሽኪ ዒንሢ ናንጌ ዎዳ ማይ ጊዳንዳኔ።
66011005	Violence	ዖኦኒያ ዔያቶ ማኣሳንሣኒ ማሌቶ ታሚ ዔያቶ ዻንጋፓ ኬስኪ ዬያቶ ሚቻንዳኔ፤ ዔያቶ ማኣሳንሣኒ ኮዓሢ ቢያ ሃይቃንዳ ጎይፃ ዬያይዲኬ።
44023005	Recommendation	ጳውሎሴያ፦ «ዒሾንሢዮቴ! ቄኤሶኮ ቢያ ዒ ሱኡጌ ማዔሢ ታ ዔሪባኣሢሮኬ፤ ጌኤዦ ማፃኣፖይዳ ‹ኔ ዴሮኮ ሱኡጋሢ ዑፆይዳ ፑርታ ጌኤሲ ጌስቲፖ› ጌይንቲ ፃኣፒንቴኔ» ጌዔኔ።
66022015	Sin	ጌኔ ማዾ ማዻይ፥ ማርሻ ማርሻይ፥ ዓኒ ሃሣ ማቾ ማዒባኣያና ላሃይ፥ ዓሲ ዎዻይ፥ ሜሌ ፆኦዞ ካኣሽካይ፥ ሉኡዙሞ ናሽካያና ሉኡቃ ዓሲ ቢያ ካታሜሎኮ ዙላ ማዓንዳኔ።»
66002014	Sin	ያዺ ማዔቴያ ታ ኔኤኮ ቦሃ ፔቴ ፔቴ ባኣዚ ዓኣኔ፤ ዬና ዓይጎዳይ ጌዔቴ ባኣላኣሜ ጎዖሢኮ ዔርዚፆ ዓርቄ ፔቴ ፔቴ ዓሲ ዒንሢ ባኣካ ዓኣኔ፤ ዬይ ባኣላኣሜ ዒስራዔኤሌ ዴራ ሜሌ ካኣሺም ሹኪንቴ ዓሽኮ ሙዓንዳጉዲና ማቾ ሃሣ ዓኒ ማዒባኣያና ላሂ፥ ዻቢንታንዳጉዲ ማሆም ጌዒ ባኣላኣቄ ጎዖሢ ዒ ዞሬ ዞሮኬ።
53001003	Faith	ታ ዒሾንሦ! ታ ሚሾንሦ! ዒንሢ ዛሎ ፆኦሲ ኑ ቢያ ዎዴ ጋላታኔ፤ ሃሣ ጋላታኒያ ኑም ኮይሳያኬ፤ ኑኡኒ ጋላታሢ ዒንሢኮ ፆኦሲ ጉሙርቂፃ ባሼና ዲጪ ዲጪ ሃሣ ዒንሢኮ ናሹማኣ ቃሲንቲ ቃሲንቲ ዓኣሢሮኬ።
46012002	Sin	ቤርታ ዒንሢ ፆኦሲ ዓሲ ማዒባኣ ዎዶና ጌስታኒ ዳንዳዑዋ ካኣሽኮ ባኮ ካኣሽካንዳጉዲ ሴካ ሃንጋ ዒሺንቲ ዒንሢ ዔኪ ዓኣዺንቴሢ ዒንሢ ዔራኔ።
49005025	Recommendation	ዒንሢ፥ ዓቲንቃ! ኪሪስቶሴ ሺኢጲፆ ማኣሮ ዓሶ ናሽኬሢና ፔ ቶኦኮዋ ዔያቶ ጋቴ ሃይቢም ዓኣሢ ዒንጌሢጉዲ ዒንሢያ ዒንሢ ላኣሎ ናሽኩዋቴ፤
45012017	Recommendation	ዓሲ ቢያም ኮሺ ባኣዚ ማዹዋቴ፤ ዓሲ ፑርታ ባኣዚ ዒንሢም ማዼቴ ዒንሢያ ፑርታ ባኣዚ ማሂ ማዺፖቴ።
60005006	Recommendation	ዓካሪ ፆኦሲ ፔ ማሊ ጌሤ ዎዶና ዒንሢ ዼጊዳንዳጉዲ ፆኦሲኮ ዼኤፖ ዎልቆ ዴማ ዒንሢ ቶኦኮ ሂርኪሱዋቴ።
44014017	Grace	ያዺ ማዔቶዋ ፆኦሲ ኮሺ ማዾ ሃሹዋዖ ማዺፆና ዒዚ ዓኣያ ማዒፆ ማርካሴኔ። ዬያ ዒ ማርካሴሢ፦ ጫሪንጫፓ ዒርዚ ዒንሢም ዋርቂሲፆና ሃኣካ ዒንሢም ካፃንዳጉዲ ቃራ ዎዴ ዒንጊፆና፤ ሃሣ ዒንሢ ሙኡዚ ዴንቂ ሚርጌና ዎዛዻንዳጉዲያ ማሂፆናኬ።»
54003011	Recommendation	ዬያጉዲ ሃሣ ላኣላ ዔያቶኮ ኮሺ ዓሲ ሃሣ ዓሲ ዾንኩዋያ፥ ኮይሳ ጎይሢ ናንጋያ፥ ቢያ ባኣዚናኣ ጉሙርቂንታያ ማዓኒ ኮይሳኔ።
66002021	Sin	ዒዛ ጎሞ ፔኤኮ ቡኡፃንዳጉዲ ቤሲ ታ ዒዞም ጌሤኔ፤ ዒዛ ጋዓንቴ ጎሞ ፔኤሲ ቡኡፃኒ ኮይባኣሴ።
44012020	Description	ሄሮዲሴ ፂሮሴና ሲዶና ዓጮ ዓሶናይዳ ኮሺ ዻጋዼኔ፤ ዬያሮ ዔያታ ፔቱሞና ሙካዖ ካኣቲኮ ላጌ ማዔ፥ ቢላስፆሴ ጌይንታሢ ዔያቶም ካኣቲ ቃይሻንዳጉዲ ሺኢቂ ዔኤዒሴሢኮ ጊንፃ ካኣቲና ቡካኒ ዔያታ ዖኦጬኔ፤ ዬያ ዔያታ ማዼሢ ዔያቶኮ ዓጮ ዓሳ ሙዖንዶ ባኣዚ ዴንቃሢ ዬያ ካኣቲ ዓጫፓ ማዔሢሮኬ።
43008049	Sin	ዬሱሴ ዔያቶም፦ «ታ ጊዳ ፃላሄ ዓያና ባኣሴ፤ ታኣኒ ታኣኮ ዓዶ ቦንቻኔ፤ ጋዓንቴ ዒንሢ ታኣኮ ቶኦኪ ባይዛኔ።
43006018	Description	ዒማና ዼኤፒ ጉዶ ዢባሬ ዢባርሻሢሮ ባዞ ዋኣፃ ዓጊፃኔ።
45008018	Faith	ኑኡኮ ሃሣኣ ዎዶ ሜታሢ ሃጊ ኑም ጴዻንዳ ቦንቾና ዎላ ቤቂሦዛ ኮሺ ዻካኬ ታ ጋዓኔ።
62002012	Grace	ታ ናይዮቴ! ጎማ ዒንሢኮ ኪሪስቶሴ ሱንፆና ዓቶም ጌይንቴሢሮ ታ ዒንሢም ፃኣፓኔ።
55001009	Grace	ዒዚ ኑኡኒ ማዼ ኮዦ ማዾሮቱዋንቴ ፔ ማሊፆና ፔኤኮ ኮሹሞ ዒንጊፆና ዻቂሺ፥ ፆኦሲም ዱማዼያ ማዒ ናንጋንዳጉዲ ኑና ዔኤሌኔ፤ ዬያ ኮሹሞ ዒንጊፆ ሚርጌ ዎዴኮ ቤርታ ዬሱስ ኪሪስቶሴ ዛሎና ኑም ዒንጌኔ።
43019006	Violence	ቄኤሶኮ ሱኡጎና ዔያቶም ዓይሢንቲ ማዻዞንሢና ዬሱሴ ዴንቃዖ፦ «ሱፄ! ሱሱፄ!» ጌይ ጌይ ዒላታዛ፥ ጲላፆሴ ጋዓንቴ፦ «ታኣኒ ታ ዛሎና ዓይጎ ዻቢንቲያ ዒዛይዳ ዴንቂባኣሴ፤ ዒንሢ ኮዔቶ ዒዛ ዔኪ ዓኣዺጋፓ ሱፁዋቴ» ዔያቶም ጌዔኔ።
60001010	Grace	ዬኖ ዻቂንቶ ባኮ ፆኦሲ ማሊፆ ኬኤዛ ዓሳ ኮሺ ኮዒ ዛጌኔ፤ ዬያሮ ዔያታ ፆኦሲ ዒንሢም ዒንጋንዳ ኮሹሞ ዒንጊፆ ቤርታዺ ኬኤዜኔ።
63001007	Sin	ዬሱስ ኪሪስቶሴ ዓሲ ማዒ ጴዼሢ ጉሙርቁዋ፥ ሚርጌ ዻቢሻ ዓሲ ዓጮይዳ ኬስኬኔ። ዬያጉዴ ዓሲ ቢያ ሉኡቃያና ኪሪስቶሴ ዒፃ ሞርኬኬ።
44024005	Sin	ሃይ ዓሢ ኑኡኮ ፑርታ ዶርዖ ማዔኔ፤ ዓጮ ቢያይዳ ዓኣ ዓይሁዶ ዓሶ ቢያሢዳ ዣሎ ዔቂሳኔ፤ ናዝራ ዓሶ ጌይንታ፥ ዱሙሞ ማዤ ዓሶኮዋ ዒዚ ዔኪ ዓኣዻሢኬ።
54003016	Grace	ኑኡኮ ካኣሽኪፆኮ ፆኦሲ ፔጋሴ ዓኣሺንቴ ማሊፃ ጎኔና ዼኤፒኬ፤ ዬይያ ኪሪስቶሴ ዛሎ፦ «ዓሲ ማዒ ጴዼሢ ጎኑማ ዓያኖና ዔርቴሢ ፆኦሲ ኪኢታንቾም ጴዼሢ ዴሮ ቢያም ኬኤዚንቴሢ ዓጮይዳ ዓኣ ዓሳ ጉሙርቄሢ ቦንቾና ሌካ ጫሪንጮ ዔውቴሢ» ጋዓሢኬ።
66016021	Violence	ዴኤሡማ ፔቴ ዼኤፒ ዎንሢ ሹቺጉዴ ሻቺ ጫሪንጫፓ ዓሶይዳ ኬዴኔ፤ ዬይ ባይዞም ዳኪንቴ ባካ ሚርጌ ካራ ባይዚ ሜታሴያ ማዔሢሮ ዓሳ ፆኦሲ ጫሽኬኔ።
61003013	Faith	ጋዓንቴ ፂሉሞኮ ማኣሪ ማዔ ዓኮ ጫሪንጮና ዓኮ ሳዖና ዒዚ ኬኤዜ ሃጊ ማዓንዳ ዎዞ ቃኣሎ ጎይፆ ኑ ካፓኔ።
66006014	Description	ጫሪንጫ ማሪንቴ ማፃኣፖጉዲ ማዒ፥ ማርቲ ዴንዴኔ፤ ሃሣ ዹኮንታ ዋኣፆ ሳዛ ዓኣ ዓጫ ዓኣ ቤዛፓ ሺኢኪ ባይቄኔ።
58010010	Grace	ዬሱስ ኪሪስቶሴ ፔ ዑፆ ላሚ ዒንጊንቱዋ ጎይሢ ፔቴና ፆኦሲም ዒንጎ ባኣዚ ማሂ ሺኢሼሢሮ ኑኡኒ ፆኦሲም ዱማዼያ ማዔኔ፤ ዬኖ ፆኦሲ ዒ ማዻንዳጉዲ ኮዔ ማሊፆኬ።
52001002	Faith	ቢያ ዎዴ ኑ ዒንሢ ዛሎ ሺኢቃኣና ዒንሢ ዛሎሮ ፆኦሲ ኑ ጋላታኔ።
66006004	Violence	ሃሣ ሜሌ ሱጉሢጉዲ ዞቄ ፓራ ኬስኬኔ፤ ዬያ ቶጌሢም ሳዖይዳ ኮሺ ናንጊ ባይዛንዳጉዲና ዓሲ ዎሊ ዎዻንዳጉዲ ማሃንዳ ቢታንቶ ዒንጊንቴኔ፤ ዼኤፒ ጬንቻ ዓፓሮዋ ዒዛም ዒንጊንቴኔ።
54006001	Recommendation	ፆኦሲ ሱንፆና ኑ ዔርዛ ዔርዚፆና ጫሽኪንቱዋጉዲ ዓሶም ዓይሌ ማዒ ማዻ ዓሳ ቢያ ዔያቶ ዎይሣ ዓሳ ቦንቺንታኒ ኮይሳሢ ዔሮንጎ።
51003009	Recommendation	ሚናኣ ዓሢ ዒዛኮ ማዾና ዎላ ዒንሢ ጉሲ ሃሼሢሮ ዎሊና ሉኡዙሞ ባኣዚ ጌስቲፖቴ።
66002020	Sin	ጋዓንቴ ፔቴ ታ ኔኤኮ ቦሃ ባኣዚ ዓኣኔ፤ ዬና፦ ‹ፆኦሲ ማሊሢ ታ ኬኤዛያኬ› ጋዓ ላኣሌሎ፥ ዔልዛቤሎኮ ማዾ ኔ ዛጊ ዚቲ ጌዔኔ፤ ዒዛ ጋዓንቴ ታኣም ማዻ ዓሳ ማቾ ሃሣ ዓኒ ማዒባኣያና ላሃንዳጉዲና ሜሌ ካኣሺም ሹኪንቴ ዓሽኮ ሙዓንዳጉዲ ዔርዚሢና ዓሶ ዻቢሼኔ።
48003008	Grace	ፆኦሲ ዓይሁዴ ማዒባኣ ዓሶ ጉሙርቂሢ ዛላና ፂሊሳንዳያ ማዔሢ ጌኤዦ ማፃኣፓ ቤርታዺ ዴንቂ፦ «ዴራ ቢያ ኔ ዛሎና ዓንጂንታንዳኔ» ጌይሢና ቤርታ ዓብራሃሜም ኮዦ ሃይሶ ቃኣሎ ኬኤዜኔ።
58012005	Recommendation	ፆኦሲ ዒንሢ ፔኤኮ ናኣቶ ማሂ፦ «ታ ናዓሢዮ! ጎዳ ጎራ ጎሮ ቦሂፖ፤ ዒ ኔና ሜቶና ጎራ ዎዶና ሃጋኣ ዎዛ ባኣያ ማዒፖ፤
58013017	Recommendation	ዒንሢኮ ዓርኖ ማዔ ዓሶም ዓይሢንቲ፥ ዔያቶም ዎርቃያ ማዑዋቴ፤ ዓይጎሮ ጌዔቴ ዔያታ ማዻ ማዾ ዛሎ ሚርጌና ዔያታ ዖኦጪንታንዳያ ማዔሢሮ ዒንሢ ሼምፖ ዛሎ ቢያ ዎዴ ዔያታ ዶዲ ማዻኔ፤ ዒንሢ ዔያቶም ዓይሢንታያ ማዔቴ ዔያታ ፔኤኮ ማዾ ዎዛና ማዻንዳኔ። ያዺ ማዒባኣያታቴ ማዻ ዔያቶኮ ዖዪሢና ማዓንዳኔ፤ ዬይ ዒንሢም ጊኢጋዓኬ።
44013019	Description	ዬካፓ ካኣናኔ ዓጮይዳ ላንካይ ካኣቶ ባይዚ፥ ዬያቶኮ ዓጮ ዔያቶ ዻካልሴኔ፤
54006003	Faith	ጎኔ ፆኦሲ ካኣዦና ዎላ ፔቴ ማዔ ባኮ ዔርዚፆ፤ ሃሣ ጎዳ ዬሱስ ኪሪስቶሴኮ ጎኔ ቃኣሎ ሃሺ፥ ዱማዼ ባኣዚ ዔርዛ ዓሲ ዓኣቶ፦
63001010	Recommendation	ሃያ ዔርዚፆ ዓርቁዋዖ ዖኦኒያ ዒንሢ ኮይላ ሙኬቶ ሾኦቺንሢ ዒዛ ዔኪፖቴ፤ ሃሣ ሳራሢታዖ ሳራሢፖቴ።
47001005	Grace	ኪሪስቶሴ ሜታዼ ሜቶ ኑዋ ሚርጌና ሜታዼሢጉዲ ኪሪስቶሴ ዛሎና ዶዱሞ ሚርጌና ኑ ዴንቃንዳኔ።
65001011	Sin	ቃኣዔኤሌ ዓኣዼ ጎይፆ ዔያታ ዓኣዼሢሮ፥ ሚኢሾሮ ጌዒ ባኣላኣሜ ዻቢንቴ ጎይፆ ዔያታኣ ዻቢንቴሢሮ ሃሣ ቆራሄ ጎዖሢ ዒፂ ማኬሢጉዲ ዔያታኣ ዒፂ ማኪ ባይቄሢሮ ዔያቶ ባዴዔ!
65001010	Sin	ዬያታ ዓሳ ጋዓንቴ ፔ ቶኦኪና ዔራኒ ዳንዳዒባኣ ጫሺ ጫሽካኔ፤ ማሊሢባኣ ቦዖጉዲ ፔኤኮ ማዢንታፓ ዔያታ ዔራ ባኣዚ ዓኣያ ማዔቶዋ ዬያና ዎላ ባይቃንዳኔ።
58011007	Faith	ሃጊ ጴዺባኣ ባኮሮ ፆኦሲ ላቲ ዒዛም ኬኤዜ ዎዶና ኖሄ ፆኦሲ ዒጊጪሢና ማኣሮ ዓሶ ዻቂሻኒ ዋኣፆ ካኣሚሎ ኮሼሢ ጉሙርቂሢናኬ፤ ዬያ ጉሙርቂፆና ዓጮ ዓሶ ቢያ ዻቢንቴያ ማሂ ዒዚ ሃሼኔ፤ ጉሙርቂፆና ጴዻ ፂሉሞዋ ዒ ዴንቄኔ።
58009006	Description	ቢያ ባካ ያዺዲ ጊኢጌሢኮ ጊንፃ ቄኤሳ ማዻ ማዾ ማዻኒ ዓፒሎና ማዢንቴ ማኣሮኮ ቤርታሳ ጋሬሎ ቢያ ኬሊ ጌላኔ።
44007051	Sin	«ዒንሢ ባቃኖ ዴይሤ፥ ፑርቶ ዓሳ! ዒና ዒንሢኮ ዔኩዋያ፤ ዋያኣ ዒንሢኮ ዋይዙዋያ፥ ዒንሢኮ ዓዶንሢጉዲ ዒንሢያ ቢያ ዎዴና ዓያኖ ጌኤዦ ማካኔ።
54001009	Sin	ሃሣ ዬይ ዎጋ ኬስኬሢ ኮዦ ዓሶም ማዒባኣሢያ ኑ ዔራኔ፤ ዎጋ ኬስኬሢ ዓይሢንቶ ዒፃ ዓሶና ፑርቶ ማዻ ዓሶናም፥ «ፆኦሲ ዔሩዋሴ» ጋዓ ዓሶና ጎሞ ዓሶናም፥ ፆኦሲም ማዒባኣ ዓሶና ዓያኖ ዛሎ ባኮ ቦሃ ዓሶም፥ ዓዶና ዒንዶና ዎዻ ዓሶና ዓሲ ዎዻዞንሢናም፥
46005009	Recommendation	ሃያኮ ቤርታ ታ ዒንሢም ፃኣፔ ኪኢቶይዳ፦ «ማቾ ሃሣ ዓኒ ማዒባኣያና ላሃ ዓሶና ዎላ ፔቴ ማዒፖቴ» ታ ዒንሢም ጌዔኔ።
48001015	Grace	ጋዓንቴ ታ ሾይንታንዳሢኮ ቤርታ ፆኦሲ ታና ዶኦሪ ፔኤኮ ኮሹሞና ታ ዒዛም ማዻንዳጉዲ ዔኤሌኔ።
45007015	Description	ታኣኒ ማዻ ባኮ ታ ዔሩዋሴ፤ ዓይጎሮ ጌዔቴ ናሽካ ባኮ ታ ሃሺ፥ ታ ዒፃ ባኮ ማዻኔ፤
61003018	Faith	ቢያፓ ባሼ ኑ ጎዳሢና ኑና ዻቂሻ ዬሱስ ኪሪስቶሴኮ ኮሹሞና ዒንጊንታ ዒንጊፆና ጊንሣ ዒዛ ዔሪሢና ዲጩዋቴ፤ ዒዛም ሃሢያ ሃጊያ ናንጊና ቦንቾ ማዖንጎ! ዓኣሜን።
46004010	Description	ኑኡኒ ኪሪስቶሴሮ ጌዒ ዔኤያ ማዔኔ፤ ዒንሢ ጋዓንቴ ኪሪስቶሴና ማዒፆና ዔራ ዓሲ ማዔኔ፤ ዬያጉዲ ዒንሢ ዶዲ ዓሲ ማዔኔ፤ ኑኡኒ ላቤ ዓሲ ማዔኔ፤ ሃሣ ዒንሢ ቦንቺንቴ ዓሲ ማዔኔ፤ ኑኡኒ ጋዓንቴ ቦሂንቴ ዓሲ ማዔኔ።
60005009	Faith	ዓጮ ቢያይዳ ዓኣ ዬሱሴ ጉሙርቂ ጎናሲ ዔኬ፥ ዒንሢኮ ጌርሲንሢንታ ጌሮንሢንታ ማዔ ዓሳ ዬያጉዴ ሜቶ ዔካያ ማዔሢ ዔሪጋፓ ፆኦሲ ጉሙርቂፆና ዶዲ ሞርካሢ ማኩዋቴ።
51003022	Recommendation	ዒንሢ ዓሶም ዓይሌ ማዒ ማዻ ዓሳ! ሳዖይዳ ዒንሢ ዎይሣ ዓሶም ቢያ ባኣዚና ዓይሢንቱዋቴ፤ ዬያ ዒንሢ ዓይሢንታሢ ዓሲ ዎዛሳኒና ዓሲ ቤርቲም ጴዺሢሮ ማዒባኣንቴ ጎዳ ዬሱሴ ዒጊጪሢና ጌኤሺ ዒናፓ ማዖንጎ።
66017012	Description	«ኔኤኒ ዛጌ ታጶ ጉራና ሃጊ ካኣታዺባኣ፥ ታጶ ካኣቶኬ፤ ጋዓንቴ ኮሺ ዻካ ዎዴ ቦዓሢና ዎላ ካኣታዻንዳ ቢታንቶ ዔያታ ዴንቃንዳኔ።
46002012	Grace	ኑኡኒ ሃያ ዓጮ ዓያኖ ዔኪባኣሴ፤ ኑኡኒ ዔኬሢ ፆኦሲ ኑም ዒንጌ ባኮ ቢያ ኑና ዔርዛ ፆኦሲ ዓያኖኬ።
59005001	Recommendation	ሃሣ ዒንሢ ዖርጎጮ ዓሳ ሃኒ ዬዒ ዋይዙዋቴ፤ ፑርታ ሜታ ዒንሢዳ ሄላንዳሢሮ ዒላቲ ዒላቲ ዬኤኩዋቴ።
66002010	Recommendation	ኔና ሄላንዳ ሜታሢ ዒጊጪፖ፤ ሃኣዛጉዋቴ ፃላሄ ዒንሢ ዎይታቴያ ዛጋኒ ዒንሢዳፓ ፔቴ ፔቴ ዓሶ ቱኡሲ ማኣሪ ጌልዚ ቱኪሴም፥ ታጶ ኬሊ ዒንሢ ሜታዻንዳኔ፤ ጋዓንቴ ሃይቢ ሄላንዳኣና ጉሙርቂንታያ ማዔ፤ ቦንቺ ዒንጎ ባኣዚ ማሂ ዒንጊንታ ናንጎ ታ ኔኤም ዒንጋንዳኔ።
54006011	Recommendation	ኔኤኒ ፆኦሲ ዓሢዮ! ዬያ ቢያይዳፓ ሺኢኬ፤ ፂሉሞ፥ ጎኔ ዓያናና ዓኣ ዓሲ ማዒሢ፥ ፆኦሲ ጉሙርቂሢ፥ ናሹሞ፥ ጊቢ ዳንዳዒሢና ሼሌዑሞና ዓኣያ ማዔ።
59005005	Sin	ሳዖይዳ ኮሺ፤ ሃሣ ሚርጌና ዎዛሳ ናንጊ ዒንሢ ናንጊፆና ዑፆ ዒንሢሲ ዒንሢ ዓዳ ሹኪንታኒ ጊኢጌ ቡዋጉዲ ማሊሴኔ።
66004004	Description	ዬያጉዲ ሃሣ ካኣቱሞ ዖይቶ ኮይላ ሜሌ ላማታሚ ዖይዶ ካኣቱሞ ዖይታ ዓኣኔ፤ ዬንሢ ዖይቶንሢዳ ቦኦሬ ማኣዖ ማይንቴያ ሃሣ ቶኦኮይዳኣ ዎርቄፓ ኮሾና ቦንቾም ዓጎ ባኮ ዓጌ ላማታሚ ዖይዶ ጋርቺ ዴዒ ዓኣኔ።
66018007	Description	ዒዛ ፔና ቦንቺሲ ሳኣ ናንጊም ጊኢጋያ ማሄማጉዲ ዒዞ ሜታሲ ዖዪሱዋቴ፤ ዒዛ ፔኤኮ ዒኖና፦ ‹ታኣኒ ካኣቲ ማዒ ዴዔኔ፤ ዓኒ ታኣኮ ሃይቄያቱዋሴ፤ ፔቴታዖ ዖዪያ ታ ዖዩዋሴ› ጌዒ ጌዒ ሄርሺንታኔ።
60003007	Recommendation	ዒንሢያ ዓኒንሢ! ዒንሢኮ ማቾንሢና ዎላ ዔሪ ናንጉዋቴ፤ ዒንሢዳፓ ባሼ ዔያታ ላቢንቴ ማዢንቲ ማዔሢሮ፥ ሃሣ ዒንሢና ዎላ ዔያታ ፆኦሲ ኮሹሞና ዒንጌ ናንጎ ዻካላንዳሢሮ ዔያቶ ቦንቹዋቴ፤ ያዺ ዒንሢ ማዒ ናንጌቶ ዒንሢ ሺኢጲፆኮ ዹቆ ማዓ ባኣዚ ባኣያ ማዓንዳኔ።
54002012	Recommendation	ላኣሊ ዓቲንቄ ዔርዛያና ዓቲንቄ ዎይሣያ ማዓንዳጉዲ ታ ኮዑዋሴ፤ ዒዛ ዚቲ ጋዓንዳያ ኮይሳኔ።
46001009	Faith	ፔኤኮ ናዓሢ፥ ኑ ጎዳ፥ ዬሱስ ኪሪስቶሴና ዎላ ፔቱሞ ዒንሢኮ ዓኣያ ማዓንዳጉዲ ዒንሢ ዔኤሌ ፆኦዛሢ ጉሙርቂንቴያኬ።
48005013	Recommendation	ታ ዒሾንሦ! ታ ሚሾንሦ! ዒንሢ ዎጌ ዓይላቶይዳፓ ኬስካንዳጉዲ ዔኤሊንቴኔ፤ ጋዓንቴ ፔቴሢ ባጋሢም ናሹሞና ዓይሢንቲ ማዻንዳኣፓዓቴም ዬይ ዒንሢኮ ዓይሉማፓ ኬስኪፃ ዒንሢ ሱኡኬ ኩንሥሢም ማዖፓ።
59002012	Recommendation	ዒንሢ ጌስታኣና ሃሣ ማዻኣና ዎጋ ጎሜ ዓይላቶይዳፓ ጉቤ ኬሴ ዓሲጉዲ ማዑዋቴ።
46012005	Faith	ዱማ ዱማ ማዾ ዓኣኔ፤ ጎዳ ጋዓንቴ ፔቴኬ።
45009005	Description	ዔያታ ሾይንቶና ዓዶንሢ ፃጳፓ ሙኬያኬ፤ ኪሪስቶሴያ ዓሲ ማዒ ሾይንቴሢ ዔያቶይዳፓኬ፤ ዒዚ ጋዓንቴ ቢያሢዳፓ ዑሣ ማዔያኬ፤ ሃሣ ዓንጂንቴ ፆኦሲኬ፤ ዓኣሜን።
47001006	Description	ኑኡኒ ሜታዻ ዎዶና ዒንሢ ዶዱሞና ዻቂንታና ዴንቃኔ። ኑኡኒ ዶዱሞ ዴንቃ ዎዶና ሃሣ ዒንሢያ ኑኡኒ ሜታዼ ሜቶጉዴ ሜቶ ጊቢ ዳንዳዒ ዶዱሞ ዴንቃኔ፤
47001021	Faith	ኑና ማዔቴያ ዒንሢ ኪሪስቶሴና ኑ ዶዳንዳጉዲ ማሄሢ ፆኦሲኬ፤ ዒዛም ኑና ዱማሴሢያ ዒዛኬ።
44010015	Recommendation	ላሚ ሃሣ፦ «ፆኦሲ ጌኤሺ ማሄ ባኮ ኔኤኒ ዒኢቴያኬ ጋዓንዳያ ኮይሱዋሴ» ጋዓ ዑኡሲ ዋይዚንቴኔ።
66018009	Sin	ዒዞና ዎላ ዞኦዛ ኮኦሚ፥ ጊኢጋ ናንጊ ናንጌ፥ ሳዖ ካኣታ ዒዛ ሚቺንታ ዎዶና ኬስካ ጩቦ ዛጊ ዒዞሮ ዒላቲ ዒላቲ ዬኤካንዳኔ።
43014023	Faith	ዬሱሴ ዒዛም፦ «ታና ናሽካሢ ታ ቃኣሎ ካፓንዳኔ፤ ታ ዓዴያ ዒዛ ናሽካንዳኔ፤ ኑኡኒያ ዒዛ ኮይላ ሙኪ ዒዛና ዎላ ናንጋንዳኔ።
62004010	Grace	ኑኡኒ ፆኦሲ ናሽኬሢሮቱዋንቴ ዒዚ ኑና ናሽኪ፥ ጎማ ኑኡኮ ዓቶም ጌይንታንዳጉዲ ፔኤኮ ናዖ ዳኬኔ፤ ናሹሞ ጌይፃ ያዺኬ።
62001007	Faith	ጋዓንቴ ዒዚ ፖዖይዳ ዓኣሢጉዲ ኑኡኒ ፖዖይዳ ናንጋቶ ኑኡኮ ዎሊና ፔቱሞ ዓኣያ ማዓንዳኔ፤ ሃሣ ዒዛኮ ናዓሢ፥ ዬሱስ ኪሪስቶሴኮ ሱጉፃ ጎሜ ቢያይዳፓ ኑና ጌኤሻኔ።
48004007	Grace	ዬያሮ ሃይፓ ሴካ ፆኦሲኮ ኔ ናይ ማዓንዳፓዓቴም ዓይሌቱዋሴ፤ ፆኦሲኮ ኔ ናይ ማዔያታቴ ፆኦሲ ፔ ናኣቶም ጊኢጊሼ ባኮ ቢያ ኔኤም ዒንጋንዳኔ።
58001008	Faith	ፔ ናዓሢ ዛሎ ጋዓንቴ፦ «ፆኦሲዮ! ኔኤኮ ካኣቱሞ ዖይታ ናንጊና ባይቁዋዖ ናንጋንዳኔ፤ ኔኤኮ ካኣቱሞ ፂሉሞና ኔ ዔኪ ዓኣዻንዳኔ፤
43010033	Sin	ዔያታኣ፦ «ኔና ኑ ዹዓሢ ፆኦሲ ኔ ጫሽኬሢሮ ማዓንዳኣፓዓቴም ኔ ማዼ ማዾሮቱዋሴ፤ ሃሣ ኔኤኒ ዓሲታዖ ኔና ኔ ፆኦሲ ማሄሢሮኬ» ጌይ ዒዛም ማሄኔ።
66014011	Description	ዔያቶ ሜታሳ ታሞይዳፓ ኬስካ ጩባ ናንጊና ባይቁዋዖ ጩቢ ዴዓያ ማዓንዳኔ፤ ቦዓሢና ዒዛኮ ማላቶናም ዚጊ፥ ዒዛኮ ሱንፆ ማላቶዋ ዔኪ ዓኣዞንሢኮ ቢያ ሮኦሪና ዋንቴና ሃውሾ ባኣያ ማዓንዳኔ» ጌዒ ጌዒ ሃንጎዋቶ ጊንፆ ሃሣ ዓኣዼኔ።
47004001	Faith	ፆኦሲ ፔ ኮሹሞና ሃያ ማዾ ኑም ዒንጌሢሮ ሃጋኣ ዎዛባኣ ዓሲ ኑ ማዓዓኬ።
58013006	Faith	ዬያሮ ጉሙርቂ፦ «ጎዳ ታና ማኣዳሢኬ፥ ታ ዒጊጫዓ፤ ዓሲ ታና ዓይጎ ዎኦታንዳይ?» ኑ ጋዓኔ።
45014003	Recommendation	ዬያሮ ጉቤ ባኮ ሙዓሢ ሙዑዋኣሢ ቦሆፓ፤ ቱኮ ባኮ ሙዓሢ ጉቤ ባኮ ሙዓሢ ዑፃ ኮይሱዋ ጎይሢና «ዻቤኔ» ጌይ ዎጎፓ፤ ዎይቲ ጌዔቴ ዒዛሲያ ፆኦሲ «ኮሺኬ» ጌዔሢሮኬ።
45015005	Grace	ዒንሢ ዬሱስ ኪሪስቶሴ ጊንፆ ሃንታዞንሢ ማዔሢሮ ጊቢ ዳንዳዓሢና ዶዲሢና ዒንጋ፥ ጎዳ ፔቱሞ ዓያና ዒንሢም ዒንጎንጎ።
