43012026	Faith	ታኣም ማዻኒ ኮዓሢ ታ ጊንፆ ሙኮንጎ፤ ታኣኒ ዓኣ ቤዞይዳ ታኣም ማዻሢያ ዒኢካ ማዓንዳኔ፤ ታኣም ማዻሢ ታ ዓዴ ዒዛ ቦንቻንዳኔ» ጌይ ማሄኔ።
54003004	Description	ፔ ናኣቶ ዒዛም ዓይሢንታያና ቦንቻያ ማሂ ዲቺ፥ ፔ ማኣሮ ዓሶ ኮሺ ጎይሢና ዎይሣ ዓሲ ማዓንዳያ ኮይሳኔ።
52005011	Recommendation	ዬያሮ ሃሢ ዒንሢ ማዻ ጎይፆ ፔቴይ ባጋሢ ዶዲሺ ዔቂሲሢና ዎሊ ማኣዱዋቴ።
62003011	Recommendation	ቤርታኣፓ ዒንሢ ዋይዜ ኪኢታ፦ «ዎሊ ኑ ናሽኮም» ጋዓያኬ።
46007026	Recommendation	ሃሢ ኑ ዓኣ ዎዳ ሜቶ ዎዴታሢሮ ዓሲ ዓኣማ ጎይፆ ናንጌቴ ቃራኬ።
43003001	Description	ኒቆዲሞሴ ጌይንታ ፔቴ ዓሲ ዓኣኔ፤ ዒዚ ፔርሴ ዓሶ ዛላፓ ማዔያታዖ ዓይሁዶ ዓሶኮ ሱኡጌኬ።
59002025	Description	ዓኒ ባኣያ ዞኦዛ ኮኦማ፥ ሬዓባ ጌይንታ ላኣሌላ ዒስራዔኤሌኮ ኪኢቶ ዓሶ ፔ ማኣራ ዔኪ ሾኦቺንሢፆና ሃሣ ጊንሣ ሜሌ ጎይሢና ፑኒንቲ ዔያታ ቶሊ ዴንዳንዳጉዲ ማሂፆና ፔ ማዾና ፂሊባኣዓዳ?
54002015	Faith	ያዺ ማዔቴያ ላኣሊ ፆኦሲ ጉሙርቂሢና ናሹሞና ዓኣያ ማዒ ሃሣ ፆኦሲም ፔና ዱማሲ ዶዴቴ፥ ጊንሣ ሼሌዔ ማዒ ናንጌቴ ናይ ሾይሢና ዻቃንዳኔ።
44013017	Grace	ሃያ ዒስራዔኤሌ ዴሮኮ ፆኦዛሢ ኑኡኮ ቤርታዻ ዓዶንሢ ዶኦሪ፥ ጊብፄ ዓጮይዳ ዔያታ ዓኣ ዎዶና ዳልጊ ዴሬ ዔያቶ ማሂ ዒዛኮ ዼኤፖ ዎልቆና ዬኖ ዓጫፓ ዔያቶ ኬሴኔ።
44015008	Grace	ዓሲኮ ዒና ዔራ ፆኦሲ፥ ኑም ዓያኖ ጌኤዦ ዒንጌሢጉዲ ዔያቶማኣ ዒንጊፆና ዔያቶ ፔ ዓሲ ማሄሢ ዔርዜኔ።
59002011	Sin	«ማቾ ሃሣ ዓኒ ማዒባኣ ዓሲና ላሂፖ» ጌዔ ጎዳሢ ዬያጉዲ ሃሣ «ዓሲ ዎዺፖ» ጌዔኔ፤ ኔኤኒ ማቾ ሃሣ ዓኒ ማዒባኣ ዓሲና ላሂባኣያ ማዔቶዋ ዓሲ ኔ ዎዼቴ ዎጎ ኔ ዻቤኔ።
43010028	Grace	ታኣኒ ናንጊና ናንጊ ሼምፖ ዔያቶም ዒንጋንዳኔ፤ ዬያሮ ፔቴታዖ ዔያታ ባይቃዓኬ፤ ታ ኩጫፓ ዖኦኒያ ዔያቶ ቡሪ ዔካዓኬ።
45016020	Grace	ዒንሢ ዬያይዴቴ ኮሹሞ ዒንጋ ፆኦዛሢ ፃላሄ ዒንሢኮ ቶኮ ዴማ ዓጊ ሄርቂ ዳኣፃንዳኔ። ጎዳ ዬሱስ ኪሪስቶሴኮ ኮሹሞ ዒንጊፃ ዒንሢና ማዖንጎ።
55003005	Sin	ፆኦሲ ጎኔ ካኣሽካያ ማላዖ ጎኔ ካኣዦኮ ዎልቆ ጉሙርቁዋያ ማዓንዳኔ፤ ዬያጉዴ ዓሶፓ ሃኬ።
45012005	Description	ዬያጉዲ ኑኡኒ ሚርጌታዖ ኪሪስቶሴና ኑ ፔቴ ዑሢኬ፤ ፔቴ ዑፆኮ ዱማ ዱማ ቤዞ ኑ ማዔ ጎይፆና ዎላ ኑ ካኣማያኬ።
56003008	Faith	ሃይ ታ ኔኤም ኬኤዜ ባካ ቢያ ጎኔ ባኣዚኬ። ፆኦሲ ጉሙርቃ ዓሳ ቢያ ኮሺ ማዾ ዶዲ ማዻንዳጉዲ፥ ሃያ ታ ኔኤም ኬኤዜ ባኮ ቢያ ዶዲሺ ዔያቶም ኔ ኬኤዛንዳጉዲ ታ ኮዓኔ፤ ዬይ ባካ ኮሺ ማዔያ፥ ሃሣ ዓሲም ኮይሳ ባኣዚኬ።
59002023	Faith	ጌኤዦ ማፃኣፖይዳ፦ «ዓብራሃሜ ፆኦሲ ጉሙርቄኔ፤ ፆኦሲያ ዒዛ ፔ ዓሲ ማሄኔ» ጌይንቴ ቃኣላ ኩሜኔ፤ ዬያይዲፆና ዓብራሃሜ ፆኦሲኮ ላጌ ጌይንቴኔ።
59002001	Faith	ታ ዒሾንሦ! ታ ሚሾንሦ! ቦንቺንቴ ኑ ጎዳሢ ዬሱስ ኪሪስቶሴ ዒንሢ ጉሙርቃያ ማዔሢሮ ፔቴሢ ባጋሢዳፓ ባሻያ ማሂ ዛጊ ዱሙሞ ሳዛ ጌሢፖቴ።
45003013	Sin	ዓሲ ባይዛ፥ ፑርታ ጌኤሲ ጌስታኒ ዻንጋ ዔያቶኮ ጉሪ ዱኡፒ ዔቴጉዲኬ፤ ዻንጋ ዔያቶኮ ጌሻያኬ፤ ጌኤዛ ዔያቶኮ ሾኦሺ ዻዓሢጉዲኬ፤
49005028	Recommendation	ዓኒንሢ ፔና ናሽካሢጉዴያ ፔ ማቾንሢ ናሽካኒ ኮይሳኔ፤ ፔ ማቾ ናሽካሢ ፔና ናሽካኔ።
45009030	Faith	ዓካሪ ኑ ዎዚ ጎዖንዶይ? ኪሪስቶሴ ጉሙርቂሢና ጴዻ ፂሉሞ ላቢ ኮዒባኣ፥ ዓይሁዴቱዋ ዓሳ ዴንቄኔ፤
54003009	Faith	ኪሪስቶሴ ጉሙርቂፆ ዛሎኮ ዓኣሺንቴ ማሊፆዋ ጌኤሺ ዒናና ዔሪ ካፓያ ማዓኒ ኮይሳኔ።
54006002	Recommendation	ዔያቶ ዎይሣ ዓሳ ኪሪስቶሴ ጉሙርቃ ዓሲ ማዔ፥ ጎዳ ዬሱሴ ሱንፆና ዔያቶኮ ዒሾንሢ ማዔሢሮ ዓይሎ ማዔ ዓሳ ፔኤኮ ዎይሣ ዓሶ ቦሆፓ፤ ዔያታ ማዻ ማዾና ማኣዲንታ ዓሳ ኪሪስቶሴ ጉሙርቃያና ናሽኪንታ ዒሾንሢያ ማዔሢሮ ቤርታኣስካፓ ባሼ ዔያቶም ማዾንጎ። ዬያሮ ኔኤኒ ዔርዛንዳያና ዞራንዳያና ኮይሳሢ ዬያኬ።
45003003	Faith	ዓይሁዶኮ ፔቴ ፔቴ ዓሳ ጉሙርቂንቱዋያ ማዒ ጴዼቶ፦ ዔያቶኮ ጉሙርቂንቱዋያ ማዒፃ ፆኦሲ ጉሙርቂንቱዋያ ማሃ?
43019034	Violence	ጋዓንቴ ፖኦሊሶንሢዳፓ ፔቴስኬይ ዒዛኮ ጎኦቦ ዎርሢና ጫርጋዛ ቤዞማና ጎኦባፓ ሱጉሢና ዋኣሢና ኬስኬኔ።
43015012	Recommendation	ታ ዓይሢፃ ታ ዒንሢ ናሽኬሢጉዲ ዒንሢያ ዎሊ ናሽካንዳጉዲኬ።
45006013	Recommendation	ዒንሢኮ ዱማ ዱማ ዑፆ ፑርታ ባኣዚ ማዻያ ማሂ ጎሜም ዒንጊፖቴ፤ ጋዓንቴ ሃይቢፓ ዒንሢ ዔቄ ጎይፆና ዒንሢ ፆኦሲም ዒንጉዋቴ፤ ሃሣ ዒንሢኮ ዱማ ዱማ ዑፆዋ ቢያ ፂሎ ማዾ ማዻንዳጉዲ ፆኦሲም ዒንጉዋቴ።
58010039	Faith	ጋዓንቴ ኑኡኒ ጉሙርቂ ዻቃ ዓሶ ዛላ ማዔያኬ፤ ጊንሢም ሎኦሺ ባይቃ ዓሶ ዛላ ማዔያቱዋሴ።
45011026	Grace	ዓካሪ፤ ዒስራዔኤሌ ዓሳ ቢያ ዻቃንዳሢ፦ «ዻቂሻሢ ፂዮኔፓ ኬስካንዳኔ፤ ያይቆኦቤ ዜርፆኮ ጎሞ ባይዛንዳኔ፤
52002015	Violence	ዓይሁዶ ዓሳ ጎዳ ዬሱሴና ፆኦሲ ማሊፆ ኬኤዛ ዓሶና ዎዼያ፤ ሃሣ ኑናኣ ዒፂ ዳኪ ፔ ዓጫፓ ኬሴዞንሢኬ፤ ዔያታ ፆኦሲ ዖዪሳያ ሃሣ ዓሲያ ዒፃያኬ፤
58010026	Sin	ጎኔ ማዔ ባኮ ኑ ዔሬሢኮ ጊንፃ ዔሬዖ ኑ ጎሜ ማዼቴ ሃካፓ ሴካ ጎሜ ዛላ ፆኦሲም ዒንጊንታንዳ ባኣዚ ዓይጌያ ኑም ባኣሴ።
49002006	Grace	ፆኦሲ ዬሱስ ኪሪስቶሴና ዎላ ኑና ሃይባፓ ዔቂሲ፥ ዬሱሴና ዎላ ጫሪንጫ ዒ ዓኣ ቤዛ ኑና ጌሤኔ።
49004025	Recommendation	ዬያሮ ሉኡዙሞ ጌስቲፖቴ! ቢያሢ ኑኡኒ ፔቴ ዑሢኮ ዱማ ዱማ ቤሲ ማዔሢሮ ሴካና ሃንጋና ጎኑሞ ኑ ጌስቶም።
48002005	Faith	ኑኡኒ ጋዓንቴ ኮዦ ሃይሶኮ ጎኑማ ዒንሢና ዶዲ ናንጋንዳጉዲ ጌይሢና ዻካ ዎዴታዖ ዔያቶ ማሊፆም ባሺንቲባኣሴ።
46014013	Recommendation	ዬያሮ ዓኪ ሙኡቺና ጌስታ ዓሲ ጌስቲንቴ ባኮ ቡሊ ኬኤዛኒ ዳንዳዒሢ ዒዛኮ ዓኣያ ማዓንዳጉዲ ሺኢቆንጎ።
44009001	Violence	ዒማና ቢያ ዎዴ ሳውሌ ጎዳኮ ጊንፆ ሃንታ ናኣቶ ዻጋና ዎዻኒ ዚርቂ ዚርቂ ናንጊቤቃ ቄኤሶኮ ሱኡጋሢ ኮራ ዓኣዺ፥
43017013	Description	ሃሢ ታኣኒ ኔ ኮራ ሙካኒኬ፤ ታኣኒ ዓጮይዳ ዓኣዖ ዬያ ኬኤዛሢ ታ ዎዛዼሢጉዲ ዔያታኣ ሚርጌና ዎዛዻንዳጉዲኬ።
60004013	Recommendation	ባሼ ኪሪስቶሴ ሙካ ዎዶና ዒንሢም ዼኤፒ ዎዛ ማዓንዳጉዲ ዒዛኮ ሜቶ ዒዛና ዎላ ዒንሢ ዔካ ጎይፆማና ሃሢ ዎዛዹዋቴ።
44011006	Description	ዬኖ ባኬሎ ኮሺ ታ ዛጋዛ ዱማ ዱማ ቆልሞ፥ ካይዚ ቦዖ ዻካንታ ዼኤፒንታ፥ ካፒያ ጊዳ ዓኣንቴ ታ ዛጌኔ፤
51003008	Recommendation	ሃሢ ጋዓንቴ ጎሪንቲ፥ ዻጋ፥ ዓሲ ዒፂሢ፥ ዾንኮ፤ ዬንሢ ቢያ ሃሹዋቴ፤ ሃሣ ቦርሲሳ ጌኤሲያ ጌስቲፖቴ።
44018003	Description	ዒዛኮ ማዻ ዓዳ ዔያቶ ጎይፆ ዓፒላና ማዦ ማኣሮ ሲኪሢታሢሮ ዔያቶና ዎላ ዴዒ ዬኖ ማዾ ማዻኔ።
45006012	Sin	ዬያሮ ጎሜ ፔኤኮ ፑርቶ ማሊፆ ዒንሢ ኩንሢሱዋጉዲ ዒንሢኮ ሃይቃ ዑፆይዳ ጎሜ ቢታንታንዳጉዲ ማሂፖቴ፤
53003012	Recommendation	ዬኖጉዴ ዓሳ ማዾ ማዺ ሙኡዚ ሙዓንዳጉዲ ጎዳ ዬሱስ ኪሪስቶሴ ሱንፆና ኑ ዓይሣኔ፤ ሃሣ ላቲያ ኑ ዒንሢም ኬኤዛኔ።
44007009	Sin	«ያይቆኦቤኮ ናኣታ ዔያቶኮ ጌርሲ ዮሴፔ ቂኢሪ ጊብፄ ዓጫ ዓይሌ ማዓንዳጉዲ ሻንቼኔ። ፆኦሲ ጋዓንቴ ዒዛና ዎላ ማዔኔ፤
44011028	Description	ዔያቶይዳፓ ፔቴሢ ዓጋቦሴ ጎዖሢ ዔቂ ዓጮ ቢያይዳ ዼኤፒ ናይዚ ኬስካንዳሢ ዓያና ጌኤሺ ማሊሴም ኬኤዛዛ፥ ዬይ ናያ ሮሜ ዓጮ ካኣቲ ቄላውዴዎሴ ዎዶና ማዔኔ።
44020036	Description	ዬካፓ ጳውሎሴ ቢያሢና ዎላ ጉምዓቲ ፆኦሲ ሺኢቄኔ፤
48005024	Faith	ዬሱስ ኪሪስቶሴሮ ማዔ ዓሳ ፔኤኮ ፑርቶ ማሊፆ ሱኡኮ ዬሱሴና ዎላ ፑርቲሴ ዓሶ ሱፆ ሚፆይዳ ሱፂ ዎዼኔ።
59001002	Recommendation	ታ ዒሾንሦ! ታ ሚሾንሦ! ዱማ ዱማ ሜታ ዒንሢ ሄሌ ዎዶና ኮሺ ባኣዚ ማሂ ዛጉዋቴ።
62001006	Sin	ዬያሮ፦ «ፆኦሲና ዎላ ኑኡኮ ፔቱሞ ዓኣኔ» ጌዒ ጌዒ ዹሞይዳ ኑ ናንጋያ ማዔቴ ኑ ሉኡቃኔ፤ ኑ ኬኤዛ ባኮና ማዻ ባኮናኮ ጎኑሞ ባኣሴ ጌይሢኬ።
44010011	Description	ዬና ዒ ዛጌ ባኬላ ያዺኬ፦ ጫሪንጫ ቡሊንቴም ዖይዶ ዛላ ዓርቂንቴ ዓፒላ ማላ ባኣዚ ሳዖ ኬዴኔ።
44002009	Description	ኑኡኒ ሃሢ ናንጋሢ ጳርቴይዳ፥ ሜዴይዳ፥ ዔላኣሜይዳ፥ ሜሶፖታሚያይዳ፥ ዪሁዳይዳ፥ ቄጶዶቂያዳ፥ ጳንፆሴይዳ፥ ዒሲያይዳ፥
51001010	Faith	ኑኡኒ ሺኢቃሢ ጎዳም ዒንሢ ኮይሳሢጉዲ ናንጋንዳጉዲና ቢያ ባኣዚና ዒዛ ዒንሢ ዎዛሳያ ማዓንዳጉዲኬ፤ ዬይያ፦ ኮሺ ማዺ ማዺ፥ ፆኦሲ ዔሪሢና ዲጪ ዲጪ፥
54001018	Recommendation	ታ ናዓሢዮ ፂሞቴዎሴ! ሃያኮ ቤርታ ኔ ዛሎ ኬኤዚንቴ ፆኦዛሢ ማሊፆጉዴያ ሃያ ዓይሢፆ ታ ኔኤም ሃዳርሲ ዒንጋኔ፤ ፆኦሲ ማሊፃ ኬኤዚንቴ ጎይፆ ዛጊ ዖልቴ፤
66019001	Faith	ዬካፓ ሚርጌ ዓሲ ዑኡሲ ማላ፥ ዼኤፒ ዑኡሲ ጫሪንጮይዳ፦ «ፆኦሲም ጋላታ! ዻቂሺሢና ቦንቾና ሃሣ ዎልቄያ ኑ ፆኦዛሢሮ ማዔኔ፤
49002001	Grace	ዒንሢ ዒንሢኮ ዻቢንቶና ጎሞ ዛሎና ቤርታ ዓያኖ ናንጎ ዛሎና ሃይቄያኬ፤
46010021	Sin	ጎዳ ባኮ ዑሽኪ ዑሽኪ ሃሣ ፑርቶ ዓያኖ ባኮዋ ዒንሢ ዑሽካኒ ዳንዳዑዋሴ፤ ዬያጉዲ ሃሣ ጎዳ ባኮ ሙዒ ሙዒ ፑርቶ ዓያኖ ባኮዋ ዒንሢ ሙዓኒ ዳንዳዑዋሴ።
49005003	Recommendation	ማቾ ሃሣ ዓኒ ማዒባኣያና ላሂሢ፥ ቦርሲሳ ማዾ፥ ዓሲሮ ዛጊ ሱኡካዺሢ ማዔቴያ ዒንሢ ባኣካ ጴዾፓ፤ ዬይ ጌኤሺ ማዔ፥ ፆኦዛሢ ዴሬም ኮይሳ ማዾቱዋሴ፤
56001015	Sin	ዒኖ ጌኤዦ ዓሶም ቢያ ባኣዚ ጌኤሺኬ፤ ዒኖ ፑርቶ ዓሶና ፆኦሲ ጉሙርቁዋያ ዓሶም ጋዓንቴ ጌኤሺ ማዔ ባኣዚ ባኣሴ፤ ጉቤ ዔያቶኮ ዒኖና ማሊፆና ፑርቴያኬ።
44009021	Description	ዬያ ዋይዜ ዓሳ ቢያ፦ «ሃይ ዓሢ ዬሩሳላሜይዳ ዬሱሴ ካኣሽካዞንሢ ቢያ ዎዻሢቱዓዳ? ሃይካኣ ዒዚ ሙኬሢ ዔያቶ ቱኪ ቱኪ ቄኤሶኮ ሱኡጎ ባንሢ ዔኪ ዓኣዻኒቱዓዳ?» ጌዒ ጌዒ ዲቃቲ ሄርሼኔ።
58008006	Description	ሃሢ ጋዓንቴ ዬሱሴ ፆኦሲና ዓሲናኮ ባኣካ ማዔ፥ ጫኣቁማ ቤርታኣስካፓ ባሼ ማዔሢጉዲ ዒ ሃሢ ማዻ ማዻኣ ዔያቶ ማዾይዳፓ ባሼኬ፤ ዬይ ዓርቂንቲ ማዺንታሢ ሚርጌና ኮሺ ማዔ፥ ዒንጊንቴ ሃጊ ማዓንዳ ዎዞ ቃኣሎናኬ።
50001021	Faith	ዬያሮ ታኣኮ ናንጎ ጌይፃ፦ ኪሪስቶሴና ናንጊሢኬ፤ ታ ሃይቄቴያ ዑሣ ዓኣዼ ኮሺ ታኣም ማዓኔ።
50001006	Faith	ዬሱስ ኪሪስቶሴ ማዒ ሙካ ኬሎና ኩንሣኒ ዬያ ኮዦ ማዾ ዒንሢና ማዻኒ ዓርቄ ፆኦዛሢ ሃሢያ ማዺሺ ዴዴዓንዳሢ ታ ጉሙርቃኔ።
62005020	Faith	ፆኦሲ ናዓሢ ሙኬሢና ጎኔ ማዔሢ፥ ዒዛ ኑ ዔራንዳጉዲ ማሊ ጶቂሣ ዒና ኑም ዒንጌሢያ ኑ ዔራኔ፤ ኑኡኒ ዬያ ጎኔ ማዔ፥ ዬሱስ ኪሪስቶሴና ናንጋኔ፤ ዒዚ ጎኔ ፆኦሲ ሃሣ ናንጊና ናንጊ ዒንጋያኬ።
45012018	Recommendation	ዒንሢም ዳንዳዒንታያ ማዔቴ ዓሲ ቢያና ኮሹሞና ናንጋኒ ዒንሢ ማዻንዳያ ኮይሳ ባኣዚ ቢያ ማዹዋቴ።
58010023	Faith	ኑም ሃጊ ማዓንዳ ዎዞ ቃኣሎ ዒንጌ ፆኦዛሢ ጉሙርቂንታያ ማዔሢሮ ሃሢ ኑ ጉሙርቂ ማርካዻ፥ ሃጊ ማዓንዳ ዎዞ ዶዲሺ ኑ ዓርቆም።
43014027	Grace	«ኮሹሞ ታ ዒንሢም ዒንጋንዳኔ፤ ሃሣ ታ ኮሹሞዋ ታ ዒንሢም ዒንጋንዳኔ፤ ታኣኒ ዒንሢም ዒንጋ ኮሹማ ዓጫ ዒንሢም ዒንጋሢጉዲቱዋሴ፤ ዒና ዒንሢኮ ማሊ ሜታዺ ዒጊጮፓ» ጌዔኔ።
47005006	Faith	ኑኡኮ ሳዖይዳ ናንጎ ማኣሮ ማዔ ዑፆና ኑ ዓኣ ዎዶማና ጎዳይዳፓ ኑ ሃኪ ናንጋሢ ዔራያ ማዔቴያ ቢያ ዎዴ ዒጊጩዋዖ ጎዳ ጉሙርቂ ኑ ናንጋኔ።
43012047	Grace	ታኣኮ ቃኣሎ ዋይዚ ማዾይዳ ፔኤሹዋኣሢዳ ዎጋንዳሢ ታናቱዋሴ፤ ዓይጎሮ ጌዔቴ ታኣኒ ሙኬሢ ዓጮ ዻቂሻኒ ማዓንዳኣፓዓቴም ዓጮይዳ ዎጋኒቱዋሴ።
62003012	Sin	ፃላሄ ዓሲ ማዒ ፔ ጌርሲ ዎዼ፥ ቃኣዔኤሌጉዲ ማዓንዳያ ኑም ኮይሱዋሴ፤ ዒዚ ፔኤኮ ጌርሲ ዓይጎሮ ዎዼይ ጌዔቴ ዒዛኮ ማዻ ፑርታ ማዔሢሮና ጌርሲ ማዻ ፒዜ ማዔሢሮኬ።
66016020	Description	ዋኣፆ ሳዛ ዓኣ ዓጫ ዓኣዺ ባይቄኔ፤ ሃሣ ዹካኣ ቢያ ዓኣ ቤዛፓ ባይቄኔ።
58011012	Description	ዬያሮ ዬያ ሃይቄያጉዲ ማዔ፥ ዓብራሃሜይዳፓ ጫሪንጮ ዦኦጋሢጉዲ ሚርጌያ ሃሣ ባዞ ዓጫ ዓኣ ፓይዲንቱዋ ማኣሻሎጉዴ ዺቢ ዜርሢ ዒዛይዳፓ ኬስኬኔ።
54001017	Faith	ዬያሮ ናንጊና ካኣቲ ማዔ፥ ሃይቁዋኣሢም፤ ሃሣ ጴዹዋ፥ ፔቴ ፆኦዛሢም ቦንቾና ጋላታና ናንጊና ዒዛም ማዖንጎ፤ ዓኣሜን።
66014007	Faith	ዬይ ዼኤፒ ዑኡሲና፦ «ፆኦሲ ዒጊጩዋቴ፤ ሃሣ ቦንቹዋቴ፤ ዓይጎሮ ጌዔቴ ዒዛኮ ዎጎ ዎጎ ዎዳ ሄሌኔ፤ ጫሪንጮና ሳዖና ባዞና ዓልቃ ዋኣፆና ማዤ ፆኦዛሢም ዚጉዋቴ!» ጌዔኔ።
44006001	Description	ዬካፓ ኪሪስቶሴ ጉሙርቃ ዓሶኮ ፓይዳ ሚርጊ ሚርጊ ዓኣዻዛ ጊሪኬ ሙኡጮ ጌስታ ዓይሁዶ ዓሳ ዬሩሳላሜይዳ ናንጋ ዓይሁዶ ዓሶ ዑፆይዳ ጉንዱሞ ዓርቄኔ፤ ዓይጎሮ ጌዔቶ ኬሊ ኬሊ ሙዖ ባካ ዒንጊንታ ዎዶና ዔያቶኮ ባኣካ ዓኒንሢ ሃይቄ ላኣሎ ዬሩሳላሜ ዓይሁዶ ዓሳ ዋላሢሮኬ።
60002021	Grace	ዒንሢ ዔኤሊንቴሢያ ዬያሮኬ፤ ዓይጎሮ ጌዔቶ ዒዚ ሃንቴ ጎይፆ ሃንታንዳጉዲ ኪሪስቶሴ ሜቶ ዔኪ ዒንሢም ኮኦኪንሢ ማዔኔ።
53003010	Recommendation	ኑ ዒንሢና ዎላ ዓኣ ዎዶና፦ «ማዻኒ ናሽኩዋኣሢ ሙዖፓ» ጋዓ ዎጌ ኑ ዒንሢም ኬሴኔ።
43003016	Grace	ሃሣ ዬሱሴ፦ «ፆኦሲ ዓጮ ሚርጌ ናሽኬሢሮ ፔኤኮ ፔቴ ናዓሢ ዒንጌኔ፤ ዬያሮ ዒዛኮ ናዓሢ ጉሙርቃሢ ቢያ ናንጊና ናንጋያ ማዓንዳኣፓዓቴም ባይቃዓኬ።
44019015	Description	ጋዓንቴ ፑርቶ ዓያናሢ፦ «ዬሱሴ ታ ዔራኔ! ጳውሎሴ ዛሎዋ ታ ዔራኔ! ሃይ ዒንሢ ዖናንሢዳዖ?» ዔያቶ ኮራ ጌዔኔ።
66019019	Violence	ሃሣ ቦዓሢንታ ሳዖ ካኣቶንታ ፔኤኮ ዖላ ዓሶና ዎላ ቦኦሬ ፓራሢ ቶጌሢና ዒዛኮ ዖላ ዓሶና ዖልታኒ ቡኪንቲ ዓኣንቴ ታ ዛጌኔ፤
44027002	Description	ዬማና ዒሲያ ዓጮኮ ባዞ ዓጮይዳ ዓኣ ሳዖ ባንሢ ዓዲራሚፂዮኔ ጎዖ ቤዛፓ ዓኣዻ ዋኣፆ ካኣሚሎና ኑ ዴንዴኔ፤ ቴስሎንቄይዳ ናንጋ፥ ሜቄዶኒያ ዓጮ ዓሢ ዓሪስፂሮኮሴያ ኑኡና ዎላ ዓኣኔ።
58013003	Recommendation	ቱኡዞ ማኣራ ቱኡቴ ዓሶና ዎላ ዒንሢያ ቱኡቴ ዓሲ ማዒ ዔያቶም ማሉዋቴ፤ ሃሣ ዔያቶና ዎላ ሜታዻያ ማዒ ሜታሢዳ ዓኣ ዓሶም ማሉዋቴ።
51003017	Recommendation	ፆኦሲ፥ ዓዳሢ ዬሱስ ኪሪስቶሴ ሱንፆና ጋላቲ ጋላቲ ዻንጋና ጌስቶ ባኣዚያ ማዖም ዒንሢ ማዻ ባኮዋ ቢያ ጎዳ ዬሱሴ ሱንፆና ማዹዋቴ።
48006006	Recommendation	ፆኦሲ ቃኣሎ ዔሪፆይዳ ዓኣሢ ዔርዛሢና ዎላ ኮሺ ማዔ ባኮ ዞርቲ ዔካያ ማዖንጎ።
44007005	Description	ያዺ ማዔቶዋ ቶኪ ሄርቃንዳ ቤሲጉዴያታዖ ፆኦሲ ዒዛም ዒንጊባኣሴ፤ ጋዓንቴ ሃኖ ዓጬሎ ዒዛና ዒዛኮ ፃጶናም ሃጊ ዓጪ ማሂ ዒዛም ዒንጋንዳሢ ጫኣቄኔ፤ ዬኖ ፆኦሲ ዒዛም ጫኣቄሢ ዓብራሃሜኮ ሃጊ ናይ ባኣንቴኬ።
44007019	Description	ዬይ ዓኮ ካኣታሢ ኑ ዴሮ ዑፆይዳ ጌኔ ማሊሢና ዔቂ ዬያ ዓሶኮ ናኣታ ሃይቃንዳጉዲ ሃሣ ኬኤሪንታንዳጉዲ ኑኡኮ ዓዶንሢ ዎልቄና ዒዚ ኮሺ ሜታሴኔ።
43020003	Description	ዬማና ጴፂሮሴና ሃንጎ ዬሱሴኮ ጊንፆ ሃንታሢና ዎላ ኬስካዖ ዱኡፖ ቤዞ ዴንዴኔ።
44024016	Faith	ዬያሮ ፆኦሲና ዓሲና ቤርቲዳ ጌኤሺ ዒና ታኣኮ ዓኣያ ማዓንዳጉዲ ቢያ ኬሊ ታ ኮዓኔ።
65001013	Description	ዔያቶኮ ቦርሲሳ ማዾ ዓዳ ዱባጉዲ ዔያታ ዱባሳያ ዼኤፖ ዢባሮና ሂዒንቲ ዓጊፃ ባዞ ዋኣፆጉዴያኬ፤ ሃሣ ዔያቶ ሻኔ ዹሚ ናንጊና ካፓያ፥ ሴካ ሃንጋ ጌዒ ላቢንቲ ሃንታ ዦኦጋሢጉዴያኬ።
48001012	Description	ዎይቲ ጌዔቴ ታኣም ዬያ ዬሱስ ኪሪስቶሴ ፔጋሲ ዻዌኔ፤ ዓይጎ ዓሲዳፓኣ ታ ዔኪባኣሴ፤ ሃሣ ዖኦኒያ ታና ዔርዚባኣሴ።
45007005	Sin	ዎይቲ ጌዔቴ ጎሞ ማሊፆና ኑ ናንጋ ዎዶና ዎጎ ዛሎና ማዺንታ ፑርቶ ማሊፃ ሃይቢ ዓኣፒ ኑ ዓኣፓንዳጉዲ ኑኡኮ ዱማ ዱማ ዑፆይዳ ማዻኔ።
54002007	Faith	ታኣኒያ ፆኦሲ ጉሙርቂሢና ጎኑሞና ዛላ ኬኤዛንዳጉዲ ፆኦሲ ማዾም ዳኪንቴያ፥ ሃሣ ዔርዛ ዓሲ ማዒ ዓይሁዴ ማዒባኣ ዓሶም ዳኪንቴሢ ዬያሮኬ፤ ዬያ ታ ጎኔ ኬኤዛፓዓቴም ሉኡቁዋሴ።
62003024	Faith	ፆኦሲ ዓይሢፆ ኩንሣሢ ቢያ ፆኦሲና ናንጋኔ፤ ፆኦሲያ ዒዛይዳ ናንጋኔ። ፆኦሲ ኑጊዳ ናንጋሢ ኑ ዔራሢ ዒዚ ኑም ዒንጌ ዓያኖናኬ።
46010024	Recommendation	ፔቴ ፔቴሢ ሜሌሢም ማዓ ባኮዋ ማላንዳኣፓዓቴም ፔኤም ማዓ ባኣዚ ሌሊ ዛጎፓ።
45012016	Recommendation	ዎላ ፔቴ ማሊሢና ጊኢጊ ናንጉዋቴ፤ ዒንሢ ቶኦኮ ዼጊሲ ዖቶርቂሢ ሃሺ፥ ማንቆ ዓሶና ዎላ ፔቴ ማዑዋቴ፤ «ታጊዳፓ ሜሌ ዔሮ ባኣሴ» ጌይፖቴ።
49004031	Recommendation	ዒንሢዳፓ ፑርቱሞ ማሊሢ፥ ዻጋ፥ ጎሪንቲ፥ ዒላቲ፥ ጫሺንታ ዓይጌያ ፑርታ ባኣዚ ቢያ ሃኮንጎ።
51001025	Faith	ፆኦሲኮ ኮዦ ሃይሶ ፔቴታዖ ታ ዓይሱዋዖ፥ ጉቤ ዒንሢም ኬኤዛንዳጉዲ ፆኦሲዳፓ ታኣም ዒንጊንቴ ጎይፆና ሺኢጲፆ ማኣሮ ዓሶም ታ ማዻያ ማዔኔ።
66001014	Description	ዒዛኮ ቶኦኮንታ ቶኦኮ ጋፓኖንታ ቦኦሬ ማራይ ጋፓኔጉዴያ ሃሣ ሻቺጉዲ ቦኦሬኬ፤ ዓኣፓኣ ዔኤታ ታሚጉዲኬ፤
47004015	Grace	ዬይ ቢያ ዒንሢ ማኣዳንዳጉዲ ማዔኔ፤ ፆኦሲኮ ኮሹሞ ዒንጊፃ ሚርጌ ዓሶም ዒንጊንቲ ዒንጊንቲ ዓኣሢ ዬይ ዓሳ ፆኦሲ ሚርጌና ጋላታንዳጉዲና ቦንቻንዳጉዲኬ።
43006056	Faith	ታና ሙዓሢና ሱጉፆዋ ታኣኮ ዑሽካሢ ቢያ ታኣና ናንጋንዳኔ፤ ታኣኒያ ዒዛና ናንጋንዳኔ።
43011027	Faith	ዒዛኣ፦ «ሂዮ፥ ጎዳ! ኔኤኒ ሃያ ዓጮ ‹ሙካንዳኔ› ጌይ ኑ ካፓ፥ ፆኦሲ ናኣዚ፥ ሜሲሄ ማዔሢ ታ ኔና ጉሙርቃኔ» ዒዛም ጌዔኔ።
44002042	Faith	ዬያታ ዳኪንቴዞንሢኮ ዔርዚፆ ዋይዚ ዋይዚ፥ ፔቱሞና ናሽኪንቲ ዎላ ናንጊ ናንጊ፥ ካሣኣ ዎላ ሙዒ ሙዒ ሺኢጲሢያ ዶዲ ሺኢቃኔ።
58001009	Grace	ፂሉሞ ኔ ናሽኪ ፑርቱሞ ኔ ዒፄኔ፤ ዬያሮ ፆኦሲ፥ ኔ ፆኦዛሢ ኔና ዶኦሬኔ፤ ኔኤኮ ላጎይዳፓ ባሼ ዎዛ ዺቢሺ ኔኤም ዒዚ ዒንጌኔ» ጌዔኔ።
44012002	Violence	ዮሃኒሴኮ ቶይዲ ያይቆኦቤ ጬንቻ ዓፓሮና ዒዚ ቲቂሲ ዎዺሼኔ።
55002016	Recommendation	ሃያ ዓጮ ባኣዚ ማዔያ፥ ሃሣ ጉሪ ጌስቲ ሺሮ ጌኤዛፓ ሃኬ፤ ዓይጎሮ ጌዔቴ ዬያጉዴ ሃይሳ ዓሲ ፆኦሲዳፓ ሃኪሳሢሮኬ።
62003015	Sin	ፔ ዒሻሢና ፔ ሚሾና ዒፃሢ ቢያ ዓሲ ሼምፖ ዎዻያኬ፤ ዓሲ ሼምፖ ዎዻ ዓሲኮ ናንጊና ናንጊ ባኣሢ ዒንሢ ዔራኔ።
43021015	Faith	ዬኖ ሙዖ ሙዔስካፓ ዬሱሴ ሲሞኦኔ ጌይንታ ጴፂሮሴ ኮራ፦ «ዮና ናዓሦ፥ ሲሞኦኔ! ሃኣቶይዳፓ ኔ ታና ባሼ ናሽካ?» ዒዛ ኮራ ጋዓዛ፥ ዒዚ ማሃዖ፦ «ሂዮ፥ ጎዳሢዮ! ታ ኔና ናሽካሢ ኔ ታና ዔራኔ» ጌዔኔ። ዬሱሴያ ዒዛም፦ «ዓካሪ ታኣኮ ዔቃሎ ማራናኣቶ ዛጌ» ጌዔኔ።
46012008	Grace	ፔቴሢም ጪንጪ ጌስታንዳጉዲ ዓያኖ ጌኤዦ ዛሎና ዒንጊንታኔ፤ ባጋሢም ሃሣ ዬኖ ዓያኖ ዛሎና ዔራቶና ጌስታንዳጉዲ ዒንጊንታኔ።
44007013	Description	ላሚፆ ማዒ ዔያታ ጊብፄ ዓኣዼ ዎዶና ዮሴፔ ፔኤኮ ጌርሲንሢም ፔና ፔጋሲ ኬኤዚ ዔርቴኔ፤ ዒማና ማኣሮ ዓሳኣ ዒዛኮ ካኣቲና ዔርቴኔ።
60003010	Recommendation	ጌኤዦ ማፃኣፓ፦ «ናንጊ ፔኤኮ ናሽካ ዓሲና ኮሺ ዎዴ ዛጋኒ ኮዓ ዓሲ ዻንጋ ዒዛኮ ፑርታ ባኣዚ ጌስቱዋጉዲ ሙኡጫኣ ዒዛኮ ማልቲሢ ሃይሴ ጌስቱዋጉዲ ካፖንጎ።
44004032	Description	ኪሪስቶሴ ጉሙርቃ ዓሶኮ ቢያ ፔቴ ዒኔና ፔቴ ማሊሢና ዓኣኔ፤ ዖና ማዔቶዋ «ሃይ ታኣሮኬ» ጋዓ ባኣዚ ባኣሴ፤ ዔያቶኮ ዓኣ ባካ ቢያ ፔቴይዳኬ፤
46015003	Grace	ታኣኒ ዋይዚ ዔኬሢና ቢያፓ ቤርታ ኮይሳያ ማዔ ባኮ ዒንሢም ታ ዔኪ ሄሊሴኔ፤ ዒንሢም ታ ሄሊሴ ባካ፦ ጌኤዦ ማፃኣፖይዳ ፃኣፒንቴሢ ጎይፆ ኪሪስቶሴ ኑኡኮ ጎሞ ዛሎሮ ሃይቄኔ፤
66018024	Violence	ዒዞይዳ ፆኦሲ ማሊፆ ኬኤዛዞንሢንታ ፆኦሲም ዱማዼዞንሢንታ ሳዖይዳ ዎዺንቴ ዓሶኮዋ ቢያ ሱጉፃ ጴዼኔ» ጌዔኔ።
44013048	Faith	ዓይሁዴ ማዒባኣ ዓሳ ዬያ ዋይዛዖ ዎዛዼኔ፤ ፆኦሲ ቃኣሎዋ ዔያታ ቦንቼኔ፤ ናንጊና ናንጎም ዶኦሪንቴዞንሢ ቢያ ዒማና ኪሪስቶሴ ጉሙርቄኔ።
66022020	Description	ሃንሢ ባኮ ማርካዻሢ፦ «ሂዮ፤ ታ ዑኬ ዬዓንዳኔ» ጋዓኔ። ዓኣሜን፤ ጎዳ ዬሱሴ ሙኬ!
50004009	Recommendation	ታኣኒ ዔርዛኣና ዋይዚ ዒንሢ ዔኬ ባኮና ታ ማዻኣና ዛጌ ባኮ ቢያ ማዹዋቴ፤ ዬያ ዒንሢ ማዼቴ ኮሹሞ ዒንጋ ፆኦዛሢ ዒንሢና ዎላ ማዓንዳኔ።
53003015	Recommendation	ማዔቴያ ዒንሢኮ ላጌ ማሂ ዞዞራንዳኣፓዓቴም ዒንሢኮ ሞርኬ ማሂ ዒዛ ዛጊፖቴ።
51002008	Recommendation	ኪሪስቶሴ ዔርዜ ጎይፆጉዲቱዋንቴ ዓሲ ኬሴ ዎጌና ሃይ ዓጫ ዎርቃ ዎጌይዳፓ ማዔ ጉሪ ጌሺሢ ባኣዚና ሃሣ ሃምዓቶና ማዢንቴ ሃይሴና ጎኔ ጎይፃፓ ዖኦኒያ ዒንሢ ዲዒ ዔኩዋጉዲ ዒንሢና ዔሩዋቴ።
