58012015	Recommendation	ዒንሢዳፓ ዖጊዳኣ ፆኦሲ ኮሹሞና ዒንጋ ዒንጊፃ ፓጪ ጴዹዋጉዲ ዒንሢና ዔሩዋቴ፤ ዬያጉዲ ሃሣ ዓይጎ ዓሲያ ዒንሢ ባኣካ ጫንቃ ሚሢጉዲ ማዒ ኬስኪ ዒንሢ ሜታሱዋጉዲና ሚርጌሢ ፑርቲሱዋጉዲ ዒንሢና ዔሩዋቴ።
54003007	Recommendation	ዾንኪንታ ዓሲ ማዒ ፃላሄ ፒሮይዳ ጌሉዋጉዲ ኪሪስቶሴ ጉሙርቁዋ ዓሳ «ኮሺ ዓሲኬ» ዒዛ ጋዓያ ማዖንጎ።
49004007	Grace	ጋዓንቴ ኪሪስቶሴ ዒንጋኒ ማሌ ጎይፆ ኑና ፔቴ ፔቴሢም ፆኦሲኮ ኮሹሞና ዒንጎ ዒንጊፃ ዒንጊንቴኔ።
66016003	Description	ላምዓሳ ኪኢታንቻሢ ዑዦ ዓንጎይዳ ዓኣ ዑዦ ባዞ ዋኣፆይዳ ላኣላዛ፥ ዋኣፃ ሃይቄ ዓሲ ሱጉሢጉዲ ካርቴ ሱጉሢ ማዔኔ፤ ባዞይዳ ዓኣ፥ ሼምፔና ናንጋ ባካ ቢያ ሃይቄኔ።
49006006	Recommendation	ዒንሢ ዓይሢንታንዳሢያ ፆኦሲ ማሊፆ ዒናፓ ኩንሣ፥ ኪሪስቶሴም ማዻ ዓሶጉዲ ማዓንዳኣፓዓቴም ዓሲ ዎዛሳኒ ጌዒ ዓሲ ቤርቲም ጴዺሢሮ ማዖፓ።
60003016	Recommendation	ጋዓንቴ ዒንሢኮ ማሂፃ ሼሌዑሞና ቦንቾና ማዖንጎ፤ ዒንሢ ኪሪስቶሴሮ ማዒፆና ዒንሢኮ ዓኣ ኮዦ ማሊፆይዳ ፑርታ ጌስታ ዓሳ ፔኤኮ ፑርቶ ጌኤዞና ቦርሲንታንዳጉዲ ዒንሢኮ ኮሺ ዒና ዓኣያ ማዖንጎ።
43006040	Faith	ሂዮ፤ ታ ዓዳሢኮ ማሊፃ ናዓሢ ዛጊ ዒዛ ጉሙርቂ ዔኬሢ ቢያ ናንጊና ናንጊ ሼምፖ ዴንቃንዳጉዲኬ፤ ታኣኒያ ጋፒንፆ ኬሎና ዒዛ ናንጊና ናንጊ ሼምፖ ዴንቃንዳጉዲ ሃይቢፓ ዔቂሳንዳኔ» ጌዔኔ።
44012023	Violence	ዒማና ሄሮዲሴ ፆኦሲም ቦንቾ ዒንጊባኣሢሮ ቤዞማና ፆኦሲ ኪኢታንቻ ፑርታ ዶርዖ ዒዛይዳ ዓጋዛ ዒዚ ዛልቂ ሃይቄኔ።
47001003	Grace	ሚጪንታ ዓዶ ማዔያ፤ ሃሣ ቢያ ባኣዚና ዶዲሻያ ማዔ ፆኦዛሢ፥ ኑ ጎዳሢ ዬሱስ ኪሪስቶሴኮ ዓዶ፥ ፆኦዛሢም ጋላታ ሄሎንጎ።
54001006	Sin	ፔቴ ፔቴ ዓሳ ዬንሢ ባካፓ ዱማዺ ፓሡዋ ማርሞ ባንሢ ማዔኔ።
45001016	Faith	ታኣኒ ኮዦ ሃይሶ ቃኣሎ ኬኤዛኒ ቦርሲንቱዋሴ፤ ዓይጎሮ ጌዔቶ ኮዦ ሃይሶ ቃኣላ ቤርታዺ ዓይሁዴ ዓሶ፥ ሄሊሳዖ ዓይሁዴ ማዒባኣ ዓሶ፤ ጌይፃ፦ ጉሙርቃ ዓሶ ቢያ ዻቂሻኒ ዳንዳዓ ፆኦሲ ዎልቄኬ።
46003011	Description	ዓይጎሮ ጌዔቴ ፔቴና ቦኦኮልቂንቴማፓ ዓታዛ ዖኦኒያ ሜሌ ጊዳ ቦኦኮልቃኒ ዳንዳዑዋሴ፤ ዬይ ቦኦኮላሢ ዬሱስ ኪሪስቶሴታሢሮኬ።
49005033	Recommendation	ጋዓንቴ ሃይ ባካ ዒንሢማ ማዓያኬ፤ ዬያሮ ዓኒ ፔ ማቾ ፔናጉዲ ማሂ ናሽኮንጎ፤ ማቻኣ ዓኒ ቦንቾንጎ።
51002013	Grace	ዒንሢኮ ጎሞ ዓቲንቶ ቤርታ ቲቂንቲባኣሢሮ ቤርታ ዒንሢ ሃይቄያኬ፤ ሃሢ ጋዓንቴ ፆኦሲ ኪሪስቶሴና ዎላ ናንጊና ባይቁዋያ ዒንሢ ማሄኔ፤ ጎሞዋ ኑኡኮ ቢያ ዓቶም ጌዔኔ።
54004014	Recommendation	ፆኦሲ ማሊፃ ኔኤም ኬኤዚንቴ ዎዶና ሃሣ ሺኢጲፆ ማኣሮ ዎይሣ ጪማ ኔ ዑፃ ኩጮ ጌሤ ዎዶና ኔኤም ዒንጊንቴ ዓያኖ ዒንጊፆ ማዾይዳ ፔኤሺፆ ዋሊፖ።
66021001	Description	ዬካፓ ዓኪ ጫሪንቺና ዓኪ ሳዓና ታ ዛጌኔ፤ ዎይቲ ጌዔቴ ቤርታኣ ጫሪንጮና ቤርታኣ ሳዖና ባይቄሢሮኬ፤ ባዚያ ባኣያ ማዔኔ።
52005016	Recommendation	ቢያ ዎዴ ዎዛዹዋቴ፤
66009006	Description	ዬንሢ ኬሎንሢዳ ዬና ዓሳ ሃይቃኒ ኮዓንዳኔ፤ ጋዓንቴ ዔያቶም ማዓዓኬ፤ ሃይቢ ዔያታ ሱኡካዻንዳኔ፤ ጋዓንቴ ሃይቢ ዔያቶ ኮይላፓ ዴንዲ ባይቃንዳኔ።
52004014	Faith	ዬሱሴ ሃይቂ ሃይባፓ ዔቄሢ ኑ ዔራኔ፤ ዬያሮ ኪሪስቶሴ ጉሙርቂ ዓኣዖ ሃይቄዞንሢ ኪሪስቶሴና ዎላ ፆኦሲ ዔኪ ሙካንዳኔ።
62004015	Faith	ዬሱሴ ፆኦሲ ናይ ማዔሢ ማርካዻ ዓሲዳ ቢያ ፆኦሲ ናንጋኔ፤ ዒዚያ ፆኦሲና ናንጋኔ።
49004022	Recommendation	ዬያሮ ጌሺ ዒንሢ ጎሜ ባንሢ ዔኪ ዓኣዻ ማሊፆና ፑርቴያ፥ ሚና ቤርታ ዒንሢ ናንጋ ናንጎ ሃሹዋቴ።
43010009	Grace	ካራሢ ታናኬ፤ ታ ዛሎና ጌላሢ ዻቃንዳኔ፤ ጌላንዳኔ፥ ኬስካንዳኔ፥ ሄንቆ ቤሲያ ዴንቃንዳኔ።
58011037	Violence	ሹቺናኣ ዹይንቴኔ፥ ማጋኣዜ ጌይንታ ዓንጎና ሄኮ ጳሊንቴኔ፥ ጬንቾ ዓፓሮናኣ ጫርጊንቲ ሃይቄኔ፥ ማራይና ዋኣሪናኮ ዒልዒ ማይንቲ ሜታዺ ሃንቴኔ፥ ማንቆ ሃሣ ቤሲባኣ ዓሲያ ማዒ ሃንቴኔ፤
62002029	Faith	ዒዚ ፂሎ ማዔሢ ዒንሢ ዔሬቴ ፂሎ ማዻሢ ቢያ ፆኦሲ ናይ ማዓሢ ዔሩዋቴ።
44013047	Grace	ዓይጎሮ ጌዔቶ፦ ‹ዓጫ ጉቤ ኔ ዛሎና ዻቃንዳጉዲ ሜሌ ዴሮም ፖዒ ታ ኔና ማሄኔ› ጌዒ ጎዳ ዓይሤሢሮኬ» ጌዒ ጫርቂ ዔያቶም ኬኤዜኔ።
47004002	Faith	ዔርቲባኣ ባኮና ቦርሳያ ማዔ ባኮ ኑ ሃሼኔ፤ ጌሺሢ ማዾዋ ኑ ማዹዋሴ፤ ፆኦሲኮ ቃኣሎ ሉኡዙሞ ባኣዚና ዎላ ኑ ሲኢሩዋሴ፤ ጋዓንቴ ጎኑሞ ፔጋሲ፥ ፔጋ ኬኤዛኔ፤ ማሊፆ ኑኡሲያ ዓሲም ቢያ ፔጋሲ ፔጋሲ ፆኦሲ ቤርታ ኑ ናንጋኔ።
44002033	Description	ፆኦሲ ፔኤኮ ሚዛቆ ዛላ ቦንቺንቴ ቤዞ ዒዛም ዒንጌኔ፤ ሃሣ ዓዳሢዳፓ ዒንጊንታንዳኔ ጌይንቴ ዓያኖ ጌኤዦዋ ዔኬኔ፤ ሃያ ዒንሢ ዛጋ ባኮና ዋይዛ ባኮ ዒዚ ላኣሌኔ።
51003010	Recommendation	ሃሢ ዓኪ ዓሲ ዒንሢ ማዔኔ፤ ዬይ ዓኪ ማዔ ዑፃ ዒዛ ኮሺ ዒንሢ ዔራንዳጉዲ ማዤ ፆኦዛሢ ቢያ ኬሊ ፔና ማላንዳጉዲ ዒ ዓካሳሢኬ።
43011004	Faith	ዬሱሴ ዬያ ዋይዛዖ፦ «ዬይ ሃርጋ ዎዻያቱዋሴ፤ ጋዓንቴ ፆኦሲ ቦንቾም ማዓንዳጉዲና ፆኦሲ ናዓሢያ ዬያ ዛሎና ቦንቺንታንዳጉዲኬ» ጌዔኔ።
45001017	Faith	ዬይ ኮዦ ሃይሶ ቃኣላ ፆኦሲ ዓሲ ፂሎ ማሂ ዛጋሢ ኪሪስቶሴ ጉሙርቄቶ ሌሊ ማዔሢ ኬኤዛኔ፤ ዓይጎሮ ጌዔቴ፦ «ፆኦሲ ጉሙርቃ ዓሲ ፆኦሲ ፂሎ ማሂ ዛጋኔ፤ ናንጊያ ዴንቃንዳኔ» ጌይንቲ ፃኣፒንቴኔ።
43019017	Description	ዬካፓ ዬሱሴ ዒ ሱፂንታንዳ፥ ፑርቲሴ ዓሶ ሱፆ ሚፆ ኬዲ «ቶኦኪ ሜጌሢ ማላ ቤሲ» ጌይንታ ቤዞ ኬስኬኔ፤ ዬና ቤዜላ ዔብሬ ዓሶ ሙኡጮና «ጎልጎታ» ጌይንታኔ።
45012006	Faith	ዬያሮ ፆኦሲ ፔ ኮሹሞ ዒንጊፆና ኑም ዒንጌ ዱማ ዱማ ዒንጊፆጉዴያ ኑ ማዾም፤ ኑም ዒንጊንቴሢ ፆኦሲ ማሊሢ ኬኤዚሢ ማዔቴ ፆኦሲ ጉሙርቃ ጎይፆማ ኑ ኬኤዞም።
66004007	Description	ቤርታኣ ባካሢ ዞቢ ማላያ፥ ላምዓሳሢ ጌማይ ማላያ፥ ሃይሣሳሢ ጊንሣ ዓሲ ዓኣፒ ካራ ማላ ዓውካሬ ዓኣያኬ፤ ዖይዳሳ፥ ጋፒንፃሢ ባራና ኮኦኬ ማላያኬ።
49005015	Recommendation	ዓካሪ ዒንሢ ዎማይዲ ናንጋንዳቴያ ኮሺ ማሉዋቴ፤ ዔራ ዓሲ ማዑዋቴ፤ ዔኤያ ዓሲ ጎይሢ ናንጊፖቴ።
45010012	Grace	ዓካሪ፤ ፔቴ ፆኦዛሢ ቢያሢኮ ጎዳ ማዔሢሮ ዓይሁዴ ዓሶና ዓይሁዴ ማዒባኣ ዓሶና ባኣካ ዱሙሞ ባኣሴ፤ ዒዚ ኮሺ ፆኦሲ ማዔሢሮ ሺኢቃዞንሢም ቢያ ዻቂንቶ ዓንጆ ሚርጌና ዒንጋኔ፤
45010004	Faith	ዓሲ ቢያ ኪሪስቶሴ ጉሙርቂሢና ፂላንዳጉዲ፥ ሙሴኮ ዓሶ ዎይሦ ዎጋ ኪሪስቶሴና ኩሜኔ።
50004006	Recommendation	ዬያሮ ዒንሢም ኮይሳ ባኣዚ ዓኣቶ ጋላቲ ጋላቲ ፆኦሲ ሺኢቃንዳኣፓዓቴም ዓይጎ ባኣዚሮዋ ማሊ ሜታዺፖቴ።
46010006	Faith	ዔያታ ፑርታ ባኣዚ ሱኡካዼሢጉዲ ኑኡኒያ ፑርታ ባኣዚ ሱኡካዹዋጉዲ ዬይ ኑም «ዒንሢና ዔሩዋቴ» ጋዓ ላቲሢ ኮኦኪንሢ ማዔኔ።
66009002	Description	ዒዚ ዔቶ ቡሌ ዎዶና ዓንሢ ታሚፓ ኬስካ፥ ጩቢጉዴ ጩቢ ዔታፓ ኬስኬኔ፤ ዬይ ዔታፓ ኬስካ ጩባ ዓቦንታ ጫሪንጮንታ ቢያ ዹሚሼኔ፤
52004006	Recommendation	ዬያ ባኮና ዖኦኒያ ዻቢንቲ፥ ሜሌሢያ ጌሾፓ፤ ሃያኮ ቤርታ ኑ ዒንሢም ላቲ ኬኤዜሢጉዲ ዬንሢ ባኮ ማዻዞንሢዳ ቢያ ጎዳ ሜቶ ሄሊሳንዳኔ።
47005017	Faith	ዬያሮ ዖኦኒያ ኪሪስቶሴና ዎላ ፔቴ ማዔቴ ዓኪ ማዢንቲኬ፤ ቤርታኣ ባካ ዓኣዼኔ፤ ዬያ ቤዞ ዓኪ ባኣዚ ዓርቄኔ ጌይሢኬ።
43005020	Faith	ዓዴ ፔኤኮ ናዓሢ ናሽካሢሮ ዒ ማዻ ባኮ ቢያ ዒዛ ዻዋኔ፤ ዒንሢ ሄርሺ ዲቃታንዳጉዲ ሃያይዳፓ ባሼ ማዾዋ ዒዛ ዻዋንዳኔ።
49004028	Recommendation	ዉኡቃያ ዓኣቴ ሃይፓ ሴካ ዉኡቆፓ፤ ዬያይዳፓ ሜታዼ ዓሲያ ማኣዳንዳ ሚኢሼ ዴንቃኒ ፔ ኩቻ ዶዲ ማማዾንጎ።
57001022	Recommendation	ፆኦሲ ዒንሢኮ ሺኢጲፆ ዋይዚ፥ ታኣኒ ዒንሢ ኮይላ ሙካንዳጉዲ ታና ማሃንዳኔ ጌይ ሃጊ ማዓንዳ ዎዛ ታ ጌሣሢሮ ታኣኒ ሃውሻንዳ ማኣሪ ታኣም ኮዔ።
58013009	Recommendation	ዱማ ዱማ ዔርቲባኣ ዔርዞ ዔርዚሢና ዲዒንቲ ዔውቲፖቴ፤ ዒና ኑኡኮ ሙኡዚ ዳምቤ ካፒሢናቱዋንቴ ፆኦሲ ኮሹሞና ዒንጌ ዒንጊፆና ዶዴቴ ቃራኬ፤ ዓይጎሮ ጌዔቴ ዬያ ሙዖ ዳምቦ ካፔ ዓሶ ዬይ ዓይጎዋ ማኣዲባኣሢሮኬ።
52005012	Recommendation	ታ ዒሾንሦ! ታ ሚሾንሦ! ዒንሢ ባኣኮይዳ ማዾና ላቢንታዞንሢ፥ ጎዳ ዬሱሴ ዛሎና ዒንሢኮ ሱኡጎ ማዔዞንሢና ዞራ ዓሶ ዒንሢ ቦንቻንዳጉዲ ኑ ዒንሢ ሺኢቃኔ፤
43009022	Description	ዒዛ ሾዔ ዓሳ ዬያ ጌዔሢ ዓይሁዶ ዓሶኮ ዎይሣ ዓሶ ዒጊጬሢሮኬ፤ ዓይጎሮ ጌዔቴ፦ «ዬሱሴ፥ ሜሲሄኬ» ጋዓ ዓሲ ዓኣቶ ዓይሁዶ ዓሶኮ ቡኪንቶ ቤዛፓ ዳውሳኒ ዬና ዎይሣ ዓሳ ዎላ ጌስቲ ዔቂሴሢሮኬ።
50003003	Faith	ኑኡኒ ዓያናና ፆኦሲ ካኣሽካያ፥ ዙልካ ዓሲም ጴዻ ዎጌና ማዒባኣንቴ ዬሱስ ኪሪስቶሴና ሌሊ ሄርሺንታያ ማዔሢሮ ጎኑሞና ዓቲንቴ ቤርቲ ኑ ቲቂንቴያኬ።
62003023	Faith	ዒዛኮ ዓይሢፃ ዒዛኮ ናዓሢ፥ ዬሱስ ኪሪስቶሴ ኑ ጉሙርቃንዳጉዲና ሃሣ ኪሪስቶሴያ ኑና ዓይሤ ጎይፆ ዎሊ ኑ ናሽካንዳጉዲኬ።
66013011	Description	ዬካፓ ሃሣ ሜሌ ቦዖ ሳዓፓ ኬስካንቴ ታ ዛጌኔ፤ ዬያኮ ማራይ ጉራኒ ማላ፥ ላምዖ ጉራኒ ዓኣኔ፤ ዒ ጌስታ ጎይፃ ዼኤፖ ሾኦዣሢ ጎይፆኬ።
46014020	Recommendation	ታ ዒሾንሦ! ታ ሚሾንሦ! ፑርታ ባኣዚ ማዺሢም ናይ ማዑዋቴ፥ ዒንሢ ማላ ማሊፆና ናይ ማዒፖቴ፤ ማላ ማሊፆና ጋዓንቴ ዒናዼ፥ ዶዲ ዓሲ ማዑዋቴ።
59005013	Recommendation	ዒንሢ ባኣኮይዳ ሜታ ሄሌ ዓሲ ዓኣቶ ሺኢቆንጎ፤ ሃሣ ዎዛዻ ዓሲ ዓኣቶ ፆኦሲ ጋላቲ ጋላቲ ዓይናዾንጎ።
58012012	Recommendation	ዬያሮ ዒንሢ ዓያኖ ዛሎና ላቤ ላቢፃፓ ዶዱዋቴ።
60001017	Recommendation	ዖኦማኣ ዱማሱዋዖ ፔቴ ፔቴሢዳ ማዾ ማዾ ጎይፆ ዎጋ ፆኦዛሢ «ኑ ዓዳሢ» ጌዒ ዔኤላያ ዒንሢ ማዔቶ፥ ሃያ ሳዖይዳ ሾኦቹሞና ዓኣዖ ዒዛ ዒጊጪሢና ናንጉዋቴ።
58010036	Recommendation	ፆኦሲኮ ማሊፆ ኩንሢ ፆኦሲ ዒንሢም «ዒንጋንዳኔ» ጌዒ ጫኣቄ ባኮ ዴንቃኒ ዶዳንዳያ ዒንሢም ኮይሳኔ።
58011001	Faith	ጉሙርቂሢ ጌይሢ ሃጊ ማዓንዳ ዎዛ ጌሢ ኑ ካፓ ባኮ ኑ ዴንቃንዳያታሢ ዔሪሢ፤ ሃሣ ኑ ዛጊባኣ ባኮ ዓኣያ ማሂ ዛጊሢኬ።
49004017	Recommendation	«ሃይፓ ሴካ ፓሡዋ ማሊሢና ናንጋ፥ ዓይሁዴ ማዒባኣ ዓሶጉዲ ናንጊፖቴ» ጌዒ ጎዳ ሱንፆና ታ ዒንሢም ላቲ ዞራኔ፤
51002016	Recommendation	ዓካሪ ሙኡዚ ዛላ ማዔቴ ዑሺ ዛላ ቦንቾ ኬሊ ቦንቺሢ ዛላ፥ ዓጊኒ ፄኤሪ ቦንቺሢ ዛላና ዓይሁዶ ዓሶኮ ሃውሾ ኬሎ ቦንቺሢ ዛላና ዖኦኒያ ዒንሢ ዻቤኔ ጎዖፓ።
66007015	Faith	ዬያሮ ፆኦሲ ካኣቱሞ ዖይቶ ቤርታ ዋንቴና ሮኦሪና ጌኤዦ ማኣሮይዳ ዒዛም ማዻኔ፤ ካኣቱሞ ዖይቶይዳ ዴዔሢ ዔያቶ ባኣካ ማዒ ዔያቶኮ ሺባሢ ማዓንዳኔ።
44020010	Description	ጋዓንቴ ጳውሎሴ ሎፓ ኬዲ ሂርኪ ጌይ፥ ናማ ኮንቂ ዓርቃዖ፦ «ናማ ሼምፔና ዓኣኔ፤ ዲቃቲፖቴ» ጌዔኔ።
55002010	Faith	ዬያሮ ዔያታ ዬሱስ ኪሪስቶሴ ዛሎና ጴዻ ዻቂንቶና ናንጊና ናንጋ ቦንቾ ዴንቃንዳጉዲ ሃሣ ፆኦሲ ዶኦሬ ዓሶሮ ጌዒ ቢያ ባኣዚ ታ ዳንዳዓኔ።
60005014	Recommendation	ዬሱሴ ጉሙርቂ ጎናሲ ዔኬ ዓሲ ጎይሢ ናሹሞና ሴካና ሃንጋና ዎሊ ኮሺ ዔኤሊሢ ዔኤሉዋቴ። ኪሪስቶሴሮ ማዔ ዓሶ ዒንሢ ቢያሢም ኮሺ ማዖንጎ።
49005021	Recommendation	ኪሪስቶሴ ቦንቾሮ ጌዒ ዒንሢ ፔቴ ፔቴሢ ዎሊም ዓይሢንታያ ማዑዋቴ።
61003017	Recommendation	ዒንሢ ጋዓንቴ ዒጊኖንሢዮቴ! ዬያ ቤርታዺ ዔሬሢሮ ዓይሢንቶ ዒፃ ዓሶ ማሊፆይዳ ጌሊ ዒንሢ ዶዲ ዔቄ ቤዛፓ ሎኦሙዋጉዲ ኮሺ ዔሩዋቴ፤
51003018	Recommendation	ዒንሢ ላኣሎ ናኣታ! ዒንሢ ጎዳ ዬሱሴሮ ማዔ ጎይፆና ሃሣ ዓይሢንቲሢ ኮይሳያታሢሮ ዒንሢ ዓኒንሢም ዓይሢንቱዋቴ።
54005020	Recommendation	ሜሌ ዓሳ ዒጊጪ ካፒንታንዳጉዲ ጎሞ ማዻ ዓሶ ዓሶ ቢያኮ ቤርታ ጎሬ።
45014013	Recommendation	ዓካሪ ኑጊዳፓ ፔቴይ ባጋሢዳ ኮይሱዋ ጎይሢና ዎጊፆ ሃሾንጎ፤ ሃሣ ዓሲ ዹቂሲ ጎማሲሳ ባኣዚ ማዺሢዳፓ ካፒንቶንጎ።
45002010	Grace	ጋዓንቴ ዓይሁዴ ዓሲ ማዔቴያ ዓይሁዴ ማዒባኣያታዖ ኮሺ ባኣዚ ማዻ ዓሲም ቢያ ጋላታና ቦንቾና ሃሣ ኮሹሞዋ ዒንጊንታንዳኔ።
58011034	Violence	ታሚ ዎልቄያ ባሼኔ፥ ጬንቾ ዓፓሮና ሃይቂፆይዳፓ ቶሌኔ፥ ላቢፃፓ ዶዴኔ፥ ዖልዚና ዔርቴያ ማዔኔ፥ ዔያቶ ዖላኒ ሙኬ ሞርኮኮ ፖኦሊሶ ዳውሴኔ፤
48006017	Faith	ታኣኮ ዑፆይዳ ዓኣ ጳዺንቶ ዲኢዳ ዬሱስ ኪሪስቶሴኮ ታ ዓይሌ ማዔሢ ዔርዛያታሢሮ ሃይፓ ሴካ ዖኦኒያ ታና ሜታሶፓ።
66018021	Violence	ዬካፓ ሃሣ ፔቴ ዼኤፒ ኪኢታንቻስኬይ ፑኡፒ ዎንሢ ሹቺጉዴ ሹቺ ዔኪ ባዞይዳ ኬኤራዖ፦ «ዼኤፖ ካታሜላ፥ ባብሎኔ ሃኣዺዲ ዎልቄና ኬኤሪንታንዳኔ፤ ሃካፓ ሴካ ዒዛ ጴዻዓኬ፤
65001020	Faith	ዒንሢ ጋዓንቴ ዒጊኖንሢዮቴ! ቢያፓ ዑሣ ዓኣዼ ጌኤሺ ማዔ ጉሙርቂፆና ዒንሢ ቶኦኮ ጌኤሻኒ ማሉዋቴ፤ ዓያና ጌኤሺ ዎልቄናኣ ሺኢቁዋቴ።
45012002	Recommendation	ኮሺ ሃሣ ዎዛሳያ፥ ፓጫ ባኣዚያ ባኣያ ማዔ ፆኦሲ ማሊፆ ዒንሢ ዔራንዳጉዲ ዒንሢኮ ዒና ዓካዺ ላኣሚንቶንጎ፤ ጋዓንቴ ሃያ ዓጮ ዓሶኮ ፑርቶ ማሊፆጉዲ ማዺፖቴ።
46015009	Sin	ታኣኒ ፆኦሲ ማዾም ዳኪንቴዞንሢዳፓ ቢያ ላኣፓ፥ ፆኦሲ ማዾም ዳኪንቴሢ ጌይንቲ ዔኤሊንታኒያ ታኣም ኮይሱዋያኬ፤ ዓይጎሮ ጌዔቴ ታኣኒ ኪሪስቶሴ ጉሙርቃ ዓሶ ዒፂ ዳውሴያታሢሮኬ።
62002015	Recommendation	ሃያ ዓጮንታ ሃያ ዓጮይዳ ዓኣ ዓይጎ ባኣዚያ ናሽኪፖቴ፤ ዓጮ ናሽካ ዓሲ ፆኦሲ፥ ዓዳሢ ናሽኩዋያኬ።
45002001	Sin	ሜሌ ዓሲ ዑስካ ኮይሱዋ ጎይሢ ዎጋሦ! ኔ ቶኦኪና ኔ ኬኤዚ ቶላንዳ ጎይሢ ኔኤኮ ባኣሢ ዔሬ፤ ዎይቲ ጌዔቴ ኔኤኒ ዓሶይዳ ዎጋያታዖ ዬይ ኔ ዎጋ ዓሢ ማዻማ ኔ ማዻኔ፤ ዬያሮ ሜሌሢ ዑፃ ኔ ዎጋ ዎዶና ኔ ቶኦካ ኔ ዎጋኔ።
48002009	Description	ዓሶ ዔኪ ዓኣዻያ ማላ፥ ያይቆኦቤና ጴፂሮሴና ዮሃኒሴና ፆኦሲ ታኣም ሃያ ዱማ ማዾ ዒንጌሢ ዔራዖ ታኣና ባርናባሴና ዎላ ዔያታ ፔቴ ማዒፆ ዔርዛ ማላታ ማዓ ሚዛቆ ኩጮና ኑ ዎሊ ዓርቄኔ፤ ዬካፓ ኑኡኒ ዓይሁዴ ማዒባኣ ዓሶ ባንሢ ዓኣዼም፤ ዔያታ ዓይሁዴ ዓሶ ባንሢ ዓኣዻኒ ኑ ዎላ ጫኣቄኔ።
43019023	Description	ፖኦሊሶንሢ ዬሱሴ ሱፄስካፓ ዖዶዞ ቦንቾ ማኣዓሢ ሌሊ ዓታዛ ዒዛኮ ሃንጎ ዓፒሎ ዔኪ ፔቴ ፔቴ ፖኦሊሶም ሄላንዳጉዲ ዖይዶ ቤሲ ፓቄኔ፤ ጋዓንቴ ዬና ቦንቾ ዓፒሌላ ጊኢጊሺ ሲኪንቲባኣያ ሎፓ ሉ ሄላንዳኣና ፔቴ ማዒ ኮሺንቴ ዓፒላኬ፤
45002021	Sin	ዓካሪ ሜሌ ዓሶ ኔ ዔርዛያ ማዓዖ፥ ኔና ኔ ዔርዙዋዓዳ? «ውኡቂፖቴ» ኔ ጋዓኔ፤ ጋዓንቴ ኔ ኔኤሮ ዉዉኡቃኔ፤
46006019	Faith	ፆኦሲዳፓ ዒንሢ ዔኬ፥ ዒንሢኮ ጋሮይዳ ናንጋ ዓያኖ ጌኤዦኮ ዒንሢ ዑፃ ማኣሮ ማዔያታሢ ዒንሢ ዔሩዋዓዳ? ዒንሢ ፆኦሲሮ ማዓንዳኣፓዓቴም ዒንሢሮቱዋሴ።
47005014	Grace	ኪሪስቶሴኮ ናሹማ ኑና ዬያ ማዺሻኔ፤ ፔቴሢ ቢያሢ ዛሎ ሃይቄሢሮ ቢያሢ ዒዛና ዎላ ሃይቄያ ማዔሢ ኑ ዔራኔ።
58003001	Faith	ፆኦሲኮ ዔኤሊፆ ዋይዚ ዔኪ ዒዛም ዱማዼያ ማዔ፥ ታ ዒሾንሦ! ታ ሚሾንሦ! ኑ ጉሙርቃንዳጉዲ ኬኤዞም ፆኦሲፓ ዳኪንቴያ ማዔሢና ኑ ካኣሽካ ካኣዦኮዋ ቄኤሶ ቢያፓ ዑሣ ማዔ፥ ዬሱሴ ዛሎ ማሉዋቴ።
44020035	Recommendation	‹ዔዔካያይዳፓ ባሼ ዒንጋያ ዓንጂንቴያኬ› ጋዓ፥ ጎዳ ዬሱሴኮ ቃኣሎ ጶቂሢ ጶቂሢ ኑ ኩቻ ኑ ማዺ ማዺ ላቢንቴ ዓሶ ማኣዳንዳያ ኮይሳሢ ሚርጌ ጎይሢና ታ ዒንሢ ዻዌኔ» ጌዔኔ።
58013004	Recommendation	ላኣሊ ዔኪ ዎላ ናንጎ ናንጎ ቢያሢ ቦንቻያ ማዖንጎ፤ ዓኒና ማቾና ዎሊ ጉሙርቁዋያ ማዒ፥ ዎሊ ዔኪ ናንጎ ናንጎ ዒኢሶፓ፤ ዓይጎሮ ጌዔቴ ፆኦሲ ዞኦስካ ኮኦማ ፑርቶ ሱኡኮና ዓኣ ዓሶንታ ዓኒ ሃሣ ማቾ ማዒባኣ ዓሶና ላሃ ዓሶዋ ፑርታና ዎጋንዳሢሮኬ።
43020005	Description	ሂርኪ ጌይ ዒዚ ዱኡፖ ዔቶ ዛጋዖ፥ ዬሱሴ ሱኡዶና ዓፒላ ሌሊ ዓኣንቴ ዴንቄኔ፤ ጋዓንቴ ዒ ዔቶ ጋሮ ጌሊባኣሴ።
66016018	Description	ዒማና ዜኤሊንሢ ዜኤሊንሤኔ፥ ዼኤፒ ዑኡሲያ ዋይዚንቴኔ፥ ጉጉንሢ ጉጉንሤኔ ሃሣ ሳዓኣ ሚርጌና ዓጊፄኔ፤ ዬያጉዴ ሳዓ ዓጊፂሢ ዓሲ ማዢንቴማፓ ዓርቃዖ ዓጊፂ ቤቂባኣሴ።
66019010	Faith	ታኣኒ ዬያ ኪኢታንቻሢም ዚጋኒ ዒዛ ቶኮ ዴማ ባሊቶና ሂርኪ ጋዓዛ፥ ዒዚ ጋዓንቴ፦ «ሃሼ! ሃያይዲፖ! ታኣኒያ ኔናንታ ዬሱሴ ዛሎ ማርካዻ ዒሾንሢንታ ዎላ ማማዻያኬ፤ ፆኦሲም ዚጌ። «ዬሱሴ ፔጋሲ ዻዌ ጎኑማ ፆኦሲ ማሊፆ ኬኤዛ ዓሶ ዻንጎና ኬኤዛ ዓያኖኬ» ጌዔኔ።
46002010	Grace	ኑም ጋዓንቴ ፆኦሲ ፔኤኮ ዓያኖ ዛሎና ዓኣሺንቴ ማሊፆ ፔጋሲ ዔርዜኔ። ዓይጎሮ ጌዔቴ ፆኦሲኮ ዓያና ዔርቱዋያ ማዔ፥ ፆኦሲ ማሊፆታዖ ዓይሱዋዖ ቢያ ባኣዚ ዴንቂ ዔራሢሮኬ።
50002029	Recommendation	ዓካሪ ጎዳ ሱንፆና ዒዚ ዒንሢኮ ዒሾ ማዔሢ ዔሪ፥ ዎዛና ዒዛ ሾኦቺንሢ ዔኩዋቴ፤ ሃሣ ዒዛጉዴ ዓሶዋ ቢያ ቦንቹዋቴ።
51003020	Recommendation	ናይዮቴ! ቢያ ባኣዚና ዒንሢ ሾዔ ዓሶም ዓይሢንቱዋቴ፤ ዓይጎሮ ጌዔቴ ዬያ ጎዳ ናሽካ ባኣዚታሢሮኬ።
47001012	Faith	ሃያ ዓጮይዳ ባሼ ዒንሢና ዎላ ኑ ፔቱሞና ሃሣ ፆኦሲዳፓ ማዔ፥ ፂሉሞና ፒዙሞና ኑ ናንጌሢ ኑ ዒና ማርካዻኔ፤ ዬይ ዓሲ ዔራቶናቱዋንቴ ፆኦሲ ፔ ኮሹሞና ዒንጋ ዒንጊፆ ዎልቆናኬ፤ ዬያሮ ሄርሺንታ ኑኡኮ ዬያናኬ።
43014021	Faith	«ታኣኮ ዓይሢፆ ዔካሢና ሃሣ ማዾይዳ ፔኤሻሢ፥ ዒዚ ታና ናሽካኔ፤ ታና ናሽካሢ ታ ዓዴያ ዒዛ ናሽካንዳኔ፤ ታኣ ዒዛ ናሽካንዳኔ፤ ታና ታ ዒዛም ፔጋሲ ዻዋንዳኔ» ጌዔኔ።
51002023	Sin	ዬንሢ ዓይሢፆንሢ ዓሲ ፔኤሮ ኬሲ ካኣሽካ ካኣሺንታ ኮይሱዋ ሼሌዑሞና ዑሢ ፑርቲሲሢ ማዾ ማዺሺሳሢሮ ዛጎዛ ፒዜ ዔራቶና ማዺንታያ ማላኔ፤ ጋዓንቴ ዓሲ ኮዓ ሱኡኮ ማዾ ቃዛኒ ማኣዳ ባኣዚ ባኣያኬ።
64001006	Recommendation	ዔያታ ኔ ዔያቶም ማዼ፥ ናሹሞ ማዾ ዛሎ ኪሪስቶሴ ጉሙርቃ፥ ዓሶ ዺቦ ቤርታ ማርካዼኔ፤ ሃሢያ ፆኦሲ ዎዛሳ ጎይሢና ዔያታ ፔኤኮ ጎይፆ ዓኣዻኣና ኔ ዔያቶ ማኣዴቴ ኮሺኬ።
55002023	Recommendation	ዑራ ማዣሢ ዔሪ ዔኤያቶ ጌኤዞና ፓሡዋ ማርማሢና ሃሼ።
47003018	Faith	ዬያሮ ኑ ቢያሢ ጎዳኮ ቦንቾ ካንቂንቲባኣ ዓኣፒ ካራና ፖዒ፥ ፔጋሲ ዻዋኔ፤ ዓያና ማዔ ጎዳይዳፓ ጴዻ ሃይ ቦንቻ ቦንቾይዳ ቦንቾ ኑም ቃሲ ቃሲ ዓዳ ጎዳ ኑ ማላንዳጉዲ ማሃኔ።
58009014	Grace	ናንጊና ናንጋ ዓያኖ ዛሎና ፔና ዾንኪሳ ባኣዚ ባኣ፥ ፆኦሲም ዒንጎ ባኣዚ ማሂ ፔና ዒንጌ፥ ኪሪስቶሴኮ ሱጉፃ ባይቁዋ ፆኦዛሢም ኑ ማዻንዳጉዲ ኑኡኮ ዒኖ ዬያ ሃይቄያ ማዔ ማዾይዳፓ ዑሣ ዓኣዼ ዎዚ ጌኤሻንዳይ!
44011017	Grace	ኑኡኒ ጎዳ ዬሱስ ኪሪስቶሴ ጉሙርቄ ዎዶና ፆኦሲ ኑም ዒንጌ ዒንጊፃ ዔያቶማኣ ዒንጊንቴያታቴ ሂዳዖ ፆኦሲ ታ ላኣጋኒ ዎልቄ ታኣኮ ዓኣ?» ጌዔኔ።
49004030	Faith	ዒንሢ ጋፒ ዓይላቶፓ ሻንቂንቲ ኬስካንዳ ኬሎ ጎናሲ ዔርዛኒ ፆኦሲ ዒንሢም ዒንጌ፥ ጌኤዦ ዓያኖ ዖዪሲፖቴ።
66003003	Recommendation	ዓካሪ ቤርታ ኔ ዎዚጉዴ ዔራቶ ዔኬያታቶዋ ሃሣ ዋይዜያታቶዋ ማሊ ጶቂሢ ካፔ፤ ጎሞዋ ኔኤኮ ቡኡፄ፤ ጋዓንቴ ኔ ጴጪባኣያ ማዔቴ ዉሲጉዲ፥ ኔ ዔሩዋንቴ ታ ሙካንዳኣኬ፤ ዎማ ዎዴ ታ ሙካንዳቴያ ኔ ዔራዓኬ።
62003007	Recommendation	ታ ናይዮቴ! ዖኦኒያ ዒንሢ ጌሺ ዻቢሱዋጉዲ፤ ኪሪስቶሴ ፂሎ ማዔሢጉዲ ፂሎ ማዾ ማዻሢ ቢያ ፂሎኬ።
62004001	Recommendation	ዒጊኖንሢዮቴ! ዓጮይዳ ሚርጌ፥ ሉኡዙሞና ፆኦሲ ማሊሢ ኬኤዛያ ማላ ዓሲ ኬስኬሢሮ ዓያኖ ቢያ ጎኔ ዓያናኬ ጌይፖቴ፤ ዬያይዳፓ ዺቦ ዓያና ፆኦሲፓታቴያ ቱዋቴያ ዱማሲ ዔራኒ ዛጉዋቴ።
44013038	Grace	ዓካሪ ዒሾንሢዮቴ! ዒንሢም ኬኤዚንቴሢ፥ ጎሞ ቢያ ዒንሢኮ ዓቶም ጋዓኒ ዳንዳዓሢ ዬሱሴኬ፤ ሙሴ ዔርዜ ዎጋ ጎሜ ዓይሉሞፓ ቢያ ዒንሢ ኬሳኒ ዳንዳዑዋሴ ጋዓያኬ።
50003001	Recommendation	ዓካሪ ታ ዒሾንሦ! ታ ሚሾንሦ! ጎዳና ዎዛዹዋቴ፤ ዬያ፥ ታኣኒ ቤርታ ፃኣፔ ባኮ ላሚ ፃኣፓኒ ታና ዒሡዋሴ፤ ዒንሢ ዬይ ዻቢንቲፓ ካፓኒ ዳንዳዓኔ።
46011034	Recommendation	ዒንሢ ቡኪንታኣና ዒንሢ ፑርታና ዎጊሳ ባኣዚ ማዑዋጉዲ ዒንሢ ባኣካ ናይዼ ዓሲ ዓኣቶ ፔኤኮ ማኣራ ሙዖንጎ። ዓቴ ባኮ ዒንሢ ኮራ ታ ሙካዖ ማዾንዶ ጎይፆ ኬኤዛንዳኔ።
43018031	Description	ጲላፆሴያ፦ «ዒንሢ ዒንሢሮ ዒዛ ዔኪ ዓኣዺጋፓ ዒንሢ ዎጎ ጎይፆ ዒዛ ዑፃ ዎጉዋቴ» ዔያቶም ጋዓዛ፥ ዓይሁዶኮ ዎይሣ ዓሳ፦ «ኑኡኒ ዓሲ ዎዻኒ ቢታንቶ ኑኡኮ ባኣሴ» ጌዔኔ።
46012031	Faith	ጋዓንቴ ቢያሢፓ ባሼ ማዔ ዒንጊፆ ዴንቃኒ ኮዑዋቴ። ዓካሪ ታ ዒንሢ ቢያፓ ባሼ ማዔ ጎይሢ ዻዋንዳኔ።
