43012036	Faith	Wɨndɨñda tɨmbi kolsalendok kuseilɨ sɨn gɨta gama palɨñɨlɨmbi, sɨndɨ kolsalen molom indanelɨñdok en nandɨ-kɨlɨktɨ tɨñmɨnekalɨñ.” Yesulɨ wɨndɨñ eu taleumbi, amatam yambɨk bim ñambi, yambɨ-sembɨm pa kuñguk.
43020021	Grace	Tɨmbi Yesulɨ bɨndambo enguk, “Busuk pat-samun. Beptɨ nak nanɨ-mukuk, wɨndɨñgangot nak bo sɨndɨ sanɨ-mutet.”
43006054	Faith	Gan nokok pɨñgɨpna gɨt wekatna na-ta-kulaktɨ kuñgu taletalen nɨmnat wɨn ip palmɨlak, tɨmbi nain taletalennan natna en kɨmnan nanin tɨmba mɨlalekak.
43019011	Sin	Tɨmbi Yesulɨ tambane nɨñguk, “Kunum Yambattɨ gembɨ nɨm gamumda, nepek no tɨ-nameñdok gembɨ no nɨm pakamek. Kusei wala tɨmbi ama nin nak dɨkok kɨkanan napɨkuk endok yomɨnlɨ dɨkok yomga maklelak.” *
43018003	Description	Wɨndɨñda tapma ama biesɨ gɨt Falisi amalɨ tapma ittok kamaikamai ama dɨwɨn enɨ-mukɨlɨñ en wakɨt Romalok mik ama dɨwɨn Judaslɨ ep kiulɨmbi, endɨ tou gɨt sipalak ep pɨndopi, miktok nepenepek epmumbi, Judaslɨ yanañgɨlɨmbi, kwet wolok bɨñgɨlɨñ.
43006064	Faith	Ganmek sɨndoñnan nanin dɨwɨndɨ nokok mandana nɨm nandɨ-dasiañ.” (Yesulɨ manda wɨn eñguk wɨn kusei ñɨndɨñda: endɨ kenan kusei kɨmɨkuknan ikan yambɨ-nandɨ-dakleñguk, wɨn ama nindɨ en nɨm nandɨ-kɨlɨktɨ tɨñmɨñgɨlɨñ, ba nin sɨnɨktɨ en kanjɨkñiilok kɨsɨnan kɨmɨlekak.)
43013026	Description	Eumbi, Yesulɨ tambane nɨñguk, “Nak plaua nanañ dɨp ñɨn wɨtna gɨnañ wɨsɨmbi, mɨwam nambetak en wakan.” Wɨndɨñ eñɨpi, plaua nanañ dɨp wɨn wɨsɨmbi, Judas Simon Iskaliottok nɨñañda mɨumbi
43013020	Faith	Nak kusatnala elet walɨ biañgan sɨnɨk. Tɨmbi ñɨndɨñ sanlet: nin endɨ nak ama nɨ-mukut enda not tɨñmɨlak, endɨ Kunum Yambattok dainan nak wakan not tɨ-namlak, tɨmbi nin endɨ not tɨ-namlak, endɨ nak nanɨ-mukuk enda bo not tɨñmɨlak.”
43017010	Faith	Wɨn nokok gɨñgɨt kuañ endɨ gɨtɨk dɨkok gɨñgɨtkai, tɨmbi dɨkok gɨñgɨtkai gɨtɨk endɨ nokok gɨñgɨtnai. Tɨmbi endok kuñgunjɨlɨ nokok kusatna engano wɨn tɨmbɨ inda-daklelak.
43007018	Faith	Enlok nanandɨnla manda elaktɨ enlok koi gɨñgɨt tɨke-louptok wɨndɨñ pa tɨlak. Gan nin endɨ nɨ-mukuk endok koi gɨñgɨt tɨke-louptok kena tɨlak, endɨ biañgan molom, juluñɨt endok kandañ no nɨm palmɨlak.
43008054	Faith	Eumbi, Yesulɨ tambane enguk, “Natna kotna gɨñgɨt tɨke-lowamda, walɨ tlal tɨmbek. Wɨn nokok Bepnalɨ wakan kotna gɨñgɨt pa tɨke-lolak. Sɨndɨ en sɨndok Yambatsɨ kɨtɨañ,
43019040	Description	Ama tɨpet endɨ Yesulok dalandan tɨkembi, Juda amalɨ dalandanjɨlok plon pa tañ telak wɨn klembi, gwasap endok plon kɨmɨpi, sandum satnindɨ tɨmɨp imgɨmɨk.
43010031	Violence	Manda wala tɨmbi amatamdɨ bɨndambo kawattɨ wɨlɨ kɨmnelɨñdok kawat mekɨlɨñ,
43019010	Description	wala tɨmbi Pilatolɨ nɨñguk, “Nɨtek? Ba dɨk manda tambon no nɨm nanlañ ba? Nak dɨk slak gambiwam kuuñdok ba ewa kloñbat plon kɨmbeñdok gembɨ pat-namlak, wɨn dɨk nɨm nandɨ-daklelañ ba?”
43017022	Grace	Nɨtɨ noñgan tamɨk, wɨndɨñgangot endɨ bo noñgan tɨnelɨñdok nak nandɨ-sembi, dɨk pipapat engano naka namguñ pat-namlak wɨn emambi pat-semlak.
43002006	Description	Tɨmbi it wolok gɨnañ kawat kambot tuknat kɨt tombon, tombon noñgan pakuk, noñgan noñgan wolok wopum wɨn 80 ba 120 lita, wolok tuop. Wɨn Kunum Yambattok dainan tɨ-jamilan tɨndɨlok Juda amatamdɨ tuk walɨ kɨsɨ kesɨsɨ, nepek dɨwɨn wakɨt wɨlɨkañgɨlɨñ.
43014010	Faith	Beptɨ nokok gɨnañ palɨmbi, nak endok gɨnañ patet. Dɨk wɨn nɨm nandɨ-kwambɨñ dalañ ba? Nɨtɨ noñgan tamɨkta tɨmbi nak manda sanlet wɨn natnalok nanandɨnala nɨm pa elet. Tambo Bep nokok gɨnañ pataktɨ enlok kenan pa tɨlak.
43013034	Recommendation	Wɨndɨñda tɨmbi nak endɨkñe manda komblin sanbi, sɨndɨ gɨnañjɨlɨ tambo tɨke-galk tɨnelɨñdok sanɨ-dɨkñelet, wɨn nak sep galk tɨ-samguttɨ tɨ-samlet, telak wolok tuopgan sɨndɨ bo tambo tɨke-galk tɨnekalɨñ.
43012044	Faith	Tɨmbi Yesulɨ wopumgan kɨtɨmbi, ñɨndɨñ eu pɨñguk, “Nak nandɨ-kɨlɨktɨ tɨ-namlaktɨ nakgot nɨm nandɨ-kɨlɨktɨ tɨ-namlak, tambo endɨ Bep nak nanɨ-mukuk en bo nandɨ-kɨlɨktɨ tɨñmɨlak.
