62003016	Faith	Gine teki bang paroko pe inggeig, kari ate tar nimalauelhir tun, Iesu Kristo ke heir katongo tar tukununa tagigeig. Doh inggeig paki guata sira pono toso bung uanotougig.
43013001	Grace	Tar binaka ko uahuhutin ro niein uleik ro nasir Ju, ra kilain, “Leke Liu ro Mat,” Iesu ke ate manasa pare, ke uahuhut manasain na binaka tar hiliuane i kot, kare la tapokis tang Taman. Inggon e uoto malauelhirintiehe tun tasir tamatasine i koto gesir nanon, kare malauelhirintiehe tun tasisin e la tuka tar uadouhinar nituaane i kot.
58003017	Sin	Doh mais ke nimalianais God toro toueit ro hangaul ro krismas? Ahikiono pah teisis geka guata tar niguata uasa geke mata rikin tor tukunus tar butur paden?
60001014	Recommendation	Longor, karung ueltada tun tang God, doh ahik pah mu uakeluk teremi nimalara uasan tar tukunumiu misiana kung uakeluk peme sioun tar binaka halana tung ate tang Iesu.
45011032	Grace	Ge God pe ke uataongo tasir tamata uakapa tun, teeit torosio mahang longorosin mare ueldolomono tasisina uakapa tun.
66006006	Description	Doh inggo ku longoro tar kaling ualeik misiana paha uau, i uantinanina tar toueitir inetesisir tua, e kula pare, “A sikir raes-uit e lain tar bulauanar siokor marein, kara sikir bali-raes e lain tar bulauanar siokor marein. Ahik paho mamantou tar uaiuai mer bino!”
59004010	Recommendation	karung kale uahiuasioum tar matanar Tamata Noman. Gerung guatoum pare, a Tamata Noman e turung kale kai tamiuoum.
44017031	Grace	Ge inggono pe ke uamatoto manasa tar binaka re turung kedanga keip tar nikodkodoho tasir mamang tamatalikane tar koto uakap. Inggono ke uamatoto sioun tun tar tamata gere turung uoum keip tar mareining kedangon. God ke uabang manate tar puhono tasir mamang tamatalik ke kale tapokis tur pe tatanono toro mat.”
43019002	Description	Doho tamatang uiliatung ka kale toro uoho misiana toro uelhung, kara tuha sira tang roono tono takur toia, kara uamokoin toro luna Iesu, kara ualoho toro mahar gomono tabeliaha tatanon.
54005014	Recommendation	Temaeit ru malaro tasir kuaha kamobo gesir kalana ra le mara poho poluk mo keketik mara kaueke katongo polukis tenas um, maeit ahikisina pahe kusais me puh gera menein nosio uelmatan.
43014011	Faith	Mu tagorong mana kompe totoguo. Getu hireo pare, inggo u uangoul teil tang Tamoug, doh Tamouguo e uangoul teil totoguo ue mung tagorong mana kompe gekung banga manasa peoum tar haua ku touogio.”
66020014	Violence	Song ka bakalaisir mat menia toro butur gera pepeisisin i uantinanina toro ngangauana ro hue uleik. Roono ro hue uleik ter uatorikin ra mata uagiamehe per tamat.
58009026	Description	Ge pake te pagiaron, inggono pake matmate uapoul tur ke uakekene pemer kot. Bo ahik puk, inggono ke la uasiokon siounumpeha e la manasainir siokor binakono tar mamang binakalik tar binakene re me uelmatout tunur mamang inetelik, tar kale liu keip tena nitampopokohor niguata uasa tagigeig tar uahung ke guata keipin tono mat.
44013018	Description	Ke la uahuhutin toro toueitir hangaul ro krismas ka lih pelasina toro butur padenen, doh God ke uatut re banga pe tenas niguatasin, ahik teilimpesina pah ka uakeluk tun tena nimalaron.
46011033	Recommendation	Temaeit, tamiuoum ro uanotoug tar binaka rung uelpokosoum tar ein tokah, uanguangoul tasir gisiameh.
66006012	Violence	Inggo ku uakeis uanono tar binaka ke peisono tar uatonomonor butur nihaila tane. Binakon ke nunur nun a uleikintiehe tun. Doha pisar ke kurkurum misiana tar kitup. Doha bialok, ke kubkubara uakapa sira tar deuating.
58011035	Violence	O kuaha ka tagorong man, maeit ka kale tapokis toso tahisilik geka mat, o niuatua tapokis pe. Bosir gisiameher tamat ka uelpusis, kara de mata luaka liuis, teeit ra tagorong mana pe tang God mara tua tapokis keip tar niuangoulur uia uain.
44016037	Violence	Bo Poul puk ke kula tasir tamatang uiliatung pare, “Gisina ka halhaluh to tamiraeim tar matasir manai, doh ahik pah ka kedanga to bakais raeim me tabila tokah, kara uamoko tamiraeim tar karabus, ge raeim pe a toking peng gane pon i Roum. Doh gine daan, ae maene ra marang uelueltula uanomo pukusina tamiraeim? Ahik nomanampe! Uamaluanampe tasisina gera la katongome, kara me keip tauete katongo tamiraeim.”
45013009	Recommendation	Ge a ualatut penine, “Ahik paho uiliatung pous, ahik paho uenau, ahik paho gehe tenas ineter gisiameh.” Doh hingia ponomper ualatut e tumana keip tar siokor ualatutonene. “Malauelhir tang uanotoum misiana ro malauelhir katongo peia.”
62003003	Faith	Doho tamata uakapasine ra uangoul keip tar nitagorong mana tang Kristo ra uadelauana katongois teres niguata uasa misiana tang Kristor delauana pe.
45007022	Faith	Ge i lolono pe totoguo u malauelhir tun tena ualatut God.
50004004	Recommendation	Uaha dede tar Tamata Noman! U kula uapoul polukuo, mu uaha dede.
66001012	Description	Gitie ku uagege uelhir peo tar marang banga maionene re menmene totoguo, inggo ku bang huara dedengua, toro mouit ro toktokono ro lam a nituha tar goul.
58003018	Sin	Ge mais pesina ke ualapagahais God pare, ahik tun pah ra turung lekala tenag buturung pepe uaho? Gisina teesis ka tagorong boho tatanon.
43010008	Sin	O tamata geka la uakikilanga me totoguo gisin o ueuenau, karo uoto leke uanomo tar kale tar mamang inetelik, bo gisis pukur sipsip ahik pah ka longoro tasisin.
60002018	Recommendation	Inggoumur karabus, uangoul i kukulebang, karung ueltada tenami tang kauek, ahik pah tas mais gera guata uaia ue ra hamhamas tamiuoum, bo tas mais ponompe ra guata uasantiehe tun tamiuoum.
44006013	Description	Gisina ka uamatoto tasir tamata tar boho tola tatanono pare, “A tamatene ahik tun pahe banotong uakenua tar meneng ueluelde tar buturener dedeil, kare ueluelde pono tar ualatut.
47005018	Faith	Ginina uakapa tununine e la tur tang God. Doh tena kalekinale Kristo God ke guata toro hiarouo tagigeig, doh tatanono katong. God ke heir tar kalekinale tagigeig tar uahiarouo tasir tamata uakap.
59005010	Recommendation	Ro bung uanotoug, mu namana uanono tasir propet geka uelhire tauete tar hanganar Tamata Noman. O uelmatan ka guata uasa tasisin, bo gisina puk ka uanguangoul hamas keip sikoro kompe tar niduhunin menia tar uelmahing. Mu guata sira tenas hagarisin, karung uakeluk.
44002021	Faith	Doh mais ra turung kila ualeik tar hanganar Tamata Nomana me nipoul, gisina tera turung udeil.’ ”
66007012	Faith	kara kula pare, “O mana tun! A niuatakai, kara nitampopokoh, kara ninamana ger i ranantiehe tun, kara niueltad, kara niuelpipih, kara nitampopokoho uakapa tun e la tur tang God ger nagigeig gere uangoul dede tar mamang binakalik, o mana tun!”
60003003	Recommendation	Ahik pah mu uamatmate hamas pukusioum tar inete, kara niguatanine: uir tar ulun, mindal, a kabon ger pang hain ger i ranar bulauan, kara gomono ger i ranar bulauan, ahik pah mu uamataia puk i morenehia.
55001008	Faith	Temaeit ingga haik paho sokoro tar hire tauete ueleheir tar Tamata Noman, doh ahik paho matala ka uamoko peio tar karabus ru kalekinale pe tatanon. Bo ingga o uinatoro uaia tanika kompeia tar huata tar niduh misiana totoguo. God e turung heir totomua tar nitampopokoho maro huata tar niduh gero kaleig.
43017019	Description	Doh inggo ku heir katongo manasaio Totomua tar poul tasisina mara heir katongo ponoisisina Totomua, maeit gisina ra turung dedeil tun toro man.”
66003002	Recommendation	Tentur! Uakodkodoho tar haua re tua sikoro harah gere uahuhutung mat, ge inggo pe ku tupara tar niguatar noumua, ahik pah ko uakuakapa hihir tenang kalekinale tar matana God ger noguo.
66016004	Description	A uatang touononar anggelou ke ding ter nan i rana toro kodom gero noro tur i lolono tar kot, kare toro kodom gero ualo turuha tar siusan. Ginin ke uapalihingua tar deuating.
45005002	Faith	Teeit teregi nitagorong maneig, temaeit Kristo ke keip tagigeig tar butur ri kale tar nimalauelhir menia keip tar nipoul gine ri uangoulieig. Kari uahauaha ri tagorong mana teil pe tena uiniatoro God.
49005005	Sin	Ge inggoum pe mu ate, o tamatasitier uoto ur ue ahik paho delauan ue ra pe ra gono tar bureher inet, ahik pah ra banotong lekala tar kale uahiua tar inete uaia tena Nitoia Kristo me God.
58011008	Faith	Abraham ke tagorong mana puk, maeit ke uakeluk tang God tar binaka ke kila tatanono tar la tar giameher uan geke ualapagahain God tar heir tatanon. Abraham e tel ia re la, bo ter nitagorong mana kompe, maeit ke hiliuiono tena uan, kare la.
49005018	Recommendation	Ahik pah mu sipak tar bino gere uapopouluana, kare uaroke puk tamiuoum. Bo mu uauoun pukusioum tar Iabena Dedeil.
61002002	Sin	O bureher tamatang lotu ra turung uakelukungua tenas niguatasinaniner sa, kara niguata ger ualamatal, maeit o gisiamehe ra turung menmene uasangua tar hagarininer man, teeit tar niguataninaniner sa ka guataigir tamatang lotu.
49002018	Faith	Ge i lolono pe tatanon, inggeimir Ju, doh inggoumur tamatang gime uan i siokor banotong la tang God Tamagigeig tar siokon siounur Iabena Dedeil.
44021025	Recommendation	Doh tasisine ahik paho Ju tagu, inggeim king bolo manasa tasisina tar uahire tenami ueluauiae pare, gisina paka hik baka pah ra ein me niein ge me niheiring uahung tasir godo bohoboh, kara toub pono tar deuating, kara hik pono pah ra ein mo inetesisir nilolo pous, kara uakenua pono tar ura ueltebeir.”
44005003	Sin	Maeit Pita ke kula pare, “Ananaias! Ingga ko uoun ro baloum tang Satan, maene ro marang boho ingga tar Iabena Dedeil, karo hiliu tar giniameher mani pare, a noum geka bulauaig tonongo mahar koto ingga?
49004014	Recommendation	Temaeit inggeig ahik paho keketik baka poluk gere puahpuaha ueltapokiseis toro butuan, dohe uu ueltapokiseis tar mamang rom misiana tar niualasir ger nasir tamatasis ra marang uelour tagigeig tenas boh gera tutig.
46006009	Sin	Inggoum ahik pah mung ate pare, o tamatasine i behia gera tagorong boho tang Kristo, gisina ahik menas hagar tagu tar Nitoiar nang God? Ahik pah mung bohboho katongosioum. Mai gere ura ueltebeir puk ue gere lotu tasir godo bohoboh ue gere uangoul uasa keip me kuaha ger le ue me bulout ger le ue a toking bulout ue a toking kuaha geura ueluelkale katongois ue mai gere heir ueltebeir puk tar tukununa tar hagar uasa,
58010025	Recommendation	Ahik pahi uakenua tar uiliodout misiana ka guata uoum per gisiameh, bo paki ueluaongole dedesieig. Guata ualatataunula tar puhunin ri banga to pe tena mareinir Tamata Noman e la uahuhutume.
51003005	Sin	Temaeit mu uakapa liu manasoum tar niguata uasang tar tukunumiu misiana tar niguatang ur ue a niguatang popotoro tar guata tar niguata uasa, kara nimalara uasa, kara niguatang siokor gono tar mamang inetelik, ge a puh peono te ngohina kompe tar tamata gere lotu tar god bohoboh.
52005008	Faith	Bo gine o nanar marein peeig, inggeig i kapil katongosieig, kari hiku tar nitagorong man, kara nimalauelhir, ter uatarar nagigeig. A nitagorong manene ri uangoul keipisieig ngohina pah tero taku o uatara tar lugigeig.
55001007	Grace	Ge a Iabene Dedeil pe geke heirin God tagigeig ahik pahe uasokoro tagigeig, bo ke uauoun tun tagigeig tar nitampopokoh, kara nimalauelhir, doh mari kaueke katongosieig.
62002004	Sin	A tamata gere kula pare, “Inggo u ate tang God,” doh ahik pahe uakeluk tena ualatohon, inggon a bohoboh, ahik pahe uangoul keip toro man.
50002002	Faith	
43007030	Description	Temaeit ka longoro per tamat, ke mene pe Iesu tar puhon, kara marang tur tane, kara kusa tatanon, bo ahik puk me tang sioko tasisina ke la uahuhut tar baka me pang lim, teeit na binakono halana te matotoin.
54006018	Recommendation	Ualatoho tun tasisina tar guata tar hagarininer uia, kara guata tar burehentiehe tunur ineter uia, kara turung liliaheir, kara uauia tar bul tenas mamang inetelik tang mai re katup.
43018030	Description	Doh gisina ka hire tapokis pare, “Ge pakene ahikiono paha tamata uasa, inggeim pake haik pah mi keipime tatanono totomua.”
45014006	Faith	Mair tamata re namana tar siokor marein pare, a marein uleik tar lotu tang God, inggon e lotu tar mareinon tar uatakai tar Tamata Noman. Ter siokono kompe gete me kalamiuoum e namana pare, auiar mamang nieinilik menia pono tar mahar singsingin, inggon e ein tananin tar uatakai tar Tamata Noman. Teeit ka heir pesina tar uatakai tang God song ka ein. Doh gete me kalamiuoum e naman a sar ein tar mahar singsingin, doha kahakahar niein, inggono ke malara tanik manasampe pare, mare uatakai tar hanganar Tamata Noman, kare uauaha tang God ke heir pe tar niein.
45012012	Recommendation	Mu uah, teeit rung pepe uangoul hamas pe tar haua re turung guatain God tamiuoum, karung uanguangoul sikoro tar binaka re pokosor niduh tamiuoum, karung lotu dede.
44024023	Description	Inggono ke ualatohongua tar tang siokor tamat tar tur kaueke tatanon, bo e uamaluana puk ponompe me giniameher binaka tatanon, kare uamaluana pono toso kaluanono ra me ruh koutumpe tatanon, kara bang a haua re katupagion.
46013007	Description	A uelmalauelhir e uoto uakeluk dede tar niguatanin; guata bolongur, tagorong man, tagorong mana teil tar haua re turung pokos i uoum, tur uanon.
47004013	Faith	Ge a puh pe geka bolo uahiuain tono uelhire God sioun, ka boloin pare, “Inggo ku tagorong mana, temaeit ku men.” Doh tar siokonor nitagorong manene. Inggeim mi mene teeit king tagorong mana pe.
52005014	Recommendation	Ro bung uanotoumiueim, inggeim mi dangata uapopokoho tun tamiuoum tar uatagin tasisit ra marapul, karung uaongolo tas mais ra sokor, karung poul tas mais gesir malmaluan. Doh mu uanguangoul sikoro keip tasir tamata uakap.
66016010	Description	A uatang toliminar anggelou ke ding ter nan i rana tono tabtabilar toia ger roke, kare kitup uakapanguar pang uanene re kauekeion. Doho tamata ke uelmahing uasantiehenguais, kara eiteit tar mias.
48006016	Grace	God e heir toro bal uaia tasisit uakapa ra uakeluk tar ineteninanine, kare guata uaia tasisin. Gisina tesir tamata tunur nang God.
44018025	Faith	Inggon a niualasira uaia tun tena hagarir Tamata Noman, dohe uoto uaha tun tar binaka re mene tauet, kare mene ualasira toro mana tang Iesu. Bo a hagaring uahuhu puk re atein Apolos ter uahuhu geke ualasirain Jon ger tang uahuhu.
46010031	Recommendation	Temaeit a haua gero einigia, karo inum ue a haua ro guatagia, uatakai keip dedempe taninina tang God.
62002027	Recommendation	Bo inggoum ke uahuhu manasa Iesu tar Iabena Dedeil, kare moko dedengua tamiuoum, ahik baka poluk pah mung sir me tamata re ualasira tamiuoum. A Iabena Dedeil tere ualasira manasa tamiuoum tar mamang inetelik. Doh na niualasiron a man, ahik paha boh. Uakeluk dede tar haua ke ualasiragiono tamiuoum marung uangoul keip dedeoum tatanon.
59002026	Faith	A siokono tar tukunun, inggon a mat geta hik uadeil me iaben. Doha nitagorong man a mat, geta hik pahe la keip me niguata uaia.
44027035	Description	Song ke kaleono tar giniameher bereit, kare heir tar niuaha tang Godane i uoum tasisin, kare pis toro mahar, kare uakekena tar ein.
44015020	Sin	Bo inggeig paki bolo puk mo bolobolo tasisin, tar uahire tasisina tar toub tar niein ge ahik paha delauan ger niheiring uahung tasir godo bohoboh, kara hik pah ra ura ueltebeir, doh ahik pono pah ra ein tasir inetesisir tua gesir nilolo pousur uekuekous, kara toubungua pono tar deuating.
44023003	Sin	Song ke kula Poul tatanono pare, “God e turung posara pono totomua, ge ingga pe a tang guata kokopoia mara namanaia pare, a tamata uaia. Ingga o tabila tar kedanga keip totoguo tar ualatut, bo ingga puk teko kategompe tar ualatut ko ualatoho pe pare, ra posaraio!”
45008001	Description	Temaene tar puh ku mene manasaio, ahik baka poluk me puh ra uakouhin tasisit ra uangoul tokaha keip tang Iesu Kristo.
52005009	Grace	Ge God pe ahik pah ke uamototo tagigeig tar me kale uelmahing tar nimalianar enon, bo ke uamototo tagigeig, maeit re uelkarusur Tamata Nomana tagigeig Iesu Kristo.
66020008	Violence	Inggon e turung la tauet, kare uelour tasir tamata uakap, toro toueit ro mahar tar pang uanene i kot. O tamata gera kilais o Gog menia tasir Magog gisina teka uelkeipana mes Satan tar uelkoi. Gisina ka burehentiehe tunungua misiana tar ion.
46006011	Grace	Sioun o gisiamehe tamiuoum ra kale teil tar niguatanin, bo inggoum puk ka uahuhu manasasioum, kara uadedeilisioum, kara uatur uakalaharasioum, o kodkodoho tun tar hangana nagi Tamata Nomaneig Iesu Kristo, kare tena Iabena Dedeil God ger nagigeig.
55001012	Faith	Doh ter tengkana kompeon, maeit ku huato tar niduh tar inetenine. Doh gine daan inggo ahik pahu matal, teeit inggo u ate tang maiene ru tagorong manain. Doh inggo u ate uaia tun, inggono na nitampopokoho e uaudeil totoguo e tuka tar binaka re tapokisime Kristo, ro hire teil pe ro Uelhire Uaia geke uaponoiono totoguo.
49006018	Faith	Karung lotu keip dede tar Iabena Dedeil tar mamang binakalik tar mamang lotu, doha nidangat. Doh tar binaka rung lotuoum uakeis dede ahik pah mu marapula kout. Karung heir dede menas lotu no tamata uakapa God.
52001001	Grace	O bolobolo rone o la tur tas Poul mes nu Sailas doh Timoti. Roono ka bololain tas mais gera uangoul teil tar lotu i Tesalonaika gesir nang God ge Tamagigeig me Iesu Kristo ge nagi Tamata Nomaneig, rasin ura heir tar hamhamas, karo hiarouo tamiuoum.
50004005	Faith	Inggoum mu hamhamas tasir tamata uakap mara bangasin tar niguata uaiar namiuoum. Ahik pahi reh a Tamata Noman gine manasa i hutun.
46011026	Faith	Ge a binaka pe rung einioum toro bereit roon, karung inum tola tar kap, inggoum mung tur keip, karung hire tauet, ke mata per Tamata Noman e tuka gete tapokisimeon.
59005015	Faith	A lotu ger nikotouo keip tar nitagorong man e turung uauia tar momouh. A Tamata Noman e turung uauia tatanon, doha niguata uasa geke guatagion ra turung kale liuig.
55001003	Faith	Inggo u heir tun tar niuaha tang God geku kalekinale keip tunuio na niate, inggo ku guata uakodkodoh misiana ka guata pe ro bubungug sioun, ru lotu dede pe tatanono totomua tar boung doh tar marein.
66006016	Description	Gisina ra kilkila tar siusana mer mahar tulaua pare, “Pungaha tamiueim, karo uaouo tamiueim tar mataneit re tabila tono tabtabilar toia, kare tena nimalianar Tunar Sipsip!
66002017	Description	“Mai ge kaein me talingan, longoro tar haua re hireinir Iabene Dedeil toro buturung lotu. Mais geka touahiua tar tang sa, inggo u turung heir tasisina tar giniameher mana ger ouoou. Inggo u turung heir pono tasisina kahakaha me gaugauilir palau e tur teilir timuhur hangan a nibolola tang roon. Mai kompe re kale tang roono tere ate.”
61002003	Sin	Doh toroso kipalasinar tamatang ualasira gesir bohoboh, gisina ra turung reih me mani tamiuoum tenas kiukiu puk. Ge a uabang manate pe gera kaleinisina ke moko tur manasa tar puhung barah, gisin ahik pah ra matotong uasiaua tar inete ger ualabir.
53002011	Sin	A puh e turung pokoso pare, mais ge ahik pah ka tagorong mana toro man, God e turung ualelio tun teres ninamanasin mara turung tagorong mana tar bohonin, kara uahauaha kompe tar niguataniner sa, gisina ra turung ualakouhunguais.
45002024	Sin	Temaeit pe no uelhire God o kula pare tar puhon, “Teoum ter tengkana maene ro kula no uelhire God pare, ‘Ka mene uasainir hangana God i uantinanina tasir gime uan.’ ”
55003008	Sin	Te misiana tas Janes me Jambres, rasina kura tur tane tang Moses, gisinar tamatasina ra tur tane pono toro man ahik pah ra namana uaia, kare punga res nitagorong man.
66003019	Recommendation	Inggo u uoto loulouar, karu ualatut uaia tun tas mais geru malauelhiris. Temaeit ingga o uapalih tun tenang niguataniner sa toro man.”
45005001	Faith	Gine ka uakodkodoho to manasa pesieig tar nitagorong man tar matana God, temaeit o moko keipingua ro hiarou tagigieg menia tang God tang Iesu Kristo ge nagi Tamata Nomaneig.
54004016	Recommendation	Kaueke uaia tun tenang niuangoul, kara haua ko ualasiraig, uakeluk uakodkodoho dede taninin. Geto uakeluk uaia tuna, God e uaudeil totomua, doh tas mais pono ka longoro totomua.
44026011	Violence	A bureher binak, inggo u la hahai toro umang lotu tar uauelmahing tasisin, karu petutupe tasisina tar hiliu tar Tamata Noman, kara uelhire uasa tatanon. Gine ru nimaliana uasa tun pe inggo tasisin, Temaeit inggo u la toro ginameher pang uan tar mamantouo tasisin.”
48005019	Sin	Inggoum kung iate manasa tar niguatang tar niuangoul uasang gane i kot, a hagarinina teenine: poulil, uraur, guata tar kinale.
46003007	Grace	Temaeit ahik me namana tang mai ke lebe ue tang mai ke pikur uamolo tar kodomo te God puk manasampe ke guat, maeit re huar inet.
46001007	Faith	Temaeit ahik baka poluk pah mung katupa me inete uaia re hireinir Iabena Dedeil, mung uanguangoul sikoro kompe tenagi Tamata Nomaneig Iesu Kristo gete tur uakalahar.
66014002	Description	Doh inggo ku longoro tar kaling e la turuha i Heuen, misiana toro puhung butuan, kare misiana gete pilantieher pil. Gitir kaling ku longoro misiana geta sarar tang sar tenas gita.
44010043	Faith	O mamang propeit ka mene tauete pare, o mana tun, o tamata gera tagorong mana tatanon, God e kuse luar keip tar hangana Iesu teres niguata uasasin.”
45002007	Faith	Tasisit ra tur uanon, kara guata dede tar niguata uaia, inggon e turung heir tar niuangoulung tar mamang binakalik, teeit ra sir pe tar kale tar uiniator, kara ueltad, kara niuangoul gere moko dede tar mamang binakalik.
66001004	Grace	Inggo Jon u bolola tamiuoumur toto tamatang lotu tar mouitir butur tar pang Esia. A hamhamas, karo hiarouo tamiuoum, e la tur tang God gere pepeene daan, kare uangoulung sioun, kare turung la polukume. Dohe la tur pono tar mouitir Iaben gera tur i uoum tono tabtabila God ger toia,
44019004	Faith	Kare kula Poul tasisina pare, “Na niuahuhu Jon a uahuhung uapalih tar niguat. Inggono ke kula tasir tamata tar tagorong mana tar tamata gere turung uakelukuha tatanon, inggono te Iesu.”
61002009	Violence	Doh gete te paaron, a Tamata Noman e turung uelkarus pono tasir tamata uaia gete kaleisir niduh, kare kusa tane tasir tamata uasa, kare heir tasisina tar uelmahing e la tuka tar binaka ra kedangaisir tamata uakapa tun.
58011016	Grace	Bo gisina puk ka sirsir tar pang uan uaiantieh, a uan i Heuen. Temaeit God e ualasira pare, ahik pahe matala ra kila pesina tatanon, nas God. Teeit ke kaleuatoro manasa pe tenas uan uleikisin.
54004007	Recommendation	Ahik paho uakapa to puk tenang binaka tar ualongoro tar kiukiu, doha uelhire ueltebeir ger tabo tengkan. Bo ingga o heirintiehe kompe tenang binak mare ate uaia tunuia tar haua na nimalara God, karo uakeluk.
66020009	Violence	Gisina ra turung uoun toro mamang buturulikane i kot, kara tur uiloho tar butur ra pepe no tamata God, gesir dedeil, inggono ter uan ger uleik gere malauelhirintiehe tunin God. Bo o hue puk ko hiua turuha i Heuen, karo me ein uakapa tasisin.
44010048	Description	Maeit inggono ke ualatoho pare, gisina ra uahuhu keipis tar hangana Iesu Kristo. I muduhia ke kapa baka per uahuhu, song ka dangatasina tang Pita tar uangoul tagu baka poluk tasisina me giniameher marein.
45002019	Grace	Inggoum kung ate tunusioum pare, mung matotong uoum keip tasir kut, doh inggoum a luh tasisit tar kitup.
62002025	Grace	Inggono ke ualapagaha tagigeig pare, “Inggeig i turung kale tar nitua gere moko dedengua.”
59003017	Description	Bor ninamana uaia gere la tur i Heuen te pare, uakikilangan a ninamanar delauan, kara tang uelhiarou, a hamhamas, e uoto longoro tenas ualatohor gisiameher tamat, a uoun tar niueldolom, kare uoto uakotpokoso tar kukuananar uia. Kare uoto guata uauelmatout tar siokonor hagar tasir tamata uakap, doh ahik pahe guata kokopo tar inet.
43003035	Faith	God Tamanon e malauelhirintiehe tun tar Tun, kare heir keip tatanono tar nitampopokoho tar mamang inetelik.
61003009	Grace	A Tamata Noman ahik paha gimih tar uakeluk tena ualapagaha misiana tasir gisiameher tamata ra namana pe. Inggon e uanguangoul sikoro keip tamiuoum, ahik pahe malara me tang sioko ra mamantouin. Inggon e malara tasir tamata uakapa tun, ra turung uapalih tenas niguata ger sa.
46007007	Grace	Inggo u uahantiehe tun pono geta siokor kamobo sirar bulout totoguo. Bo God ke heir kahakaha tar nipoul tasir tamata uakapa tun. Gisina ka uamatoto kahakahampeis tar uangoulung kamobo ue ra le.
46014001	Recommendation	Uakeluk tena niguata uaiar uelmalauelhir, karo malara tar inete uaia ke heirigir Iabena Dedeil, karo malarantiehe tun tar hire tauete tono uelhire God ngohinar propet.
47004006	Grace	Ge God pe ke kula pare, “Uahue tar luh gere bala uamarmarein tar kitup.” Doh inggono ke guata tar luh mare bala uamarmarein tar kolougigeig mare heir tar luhung naman manate gere la tur tena balbalana na uinatoro God gere bala tur tar porene Kristo.
44018024	Description	A tang siokor tamatang Ju, a hangana tang Apolos, a peng tar uan uleik i Aleksandria, ke lame i Epeses. Inggon a tamatang ate, dohe ate uaia tun tono uelhire God.
58013012	Grace	Temaeit Iesu ke kale to pono tar uelmahing i behia toro pirikinar uan uleik tar uadedeil keip tasir tamata uakapa toro deuatingin.
56002015	Recommendation	Ter mamang inetelikininanine pako ualasiragia, ualatut, karo louara uapopokoho sira pare, a tamatang uoum keip. Temaeit ahikia paho uamaluana me tamat e kula pare, nang uelhirea a iinetelik puk.
62004009	Grace	Gine teke ualasira pein God re malauelhir pe tagigeig. Inggono ke heiriha tar tang siokor Tunane i kot mari uangoul keipeig tar nitua e la tur tatanon.
43017024	Grace	“Tamoug, inggo u malara tasir tamatasine ko heirisia totoguo tar me uangoul tagu tar buturene ru pepeo. Inggo u malara tasisina ra banga tar uinatorene ko heiria totoguo binaka halanar koto te pokos.”
45003016	Sin	Ia ra lasina ra mamantouo tenas niuangoulur gisiameh,
58004014	Faith	Temaeit gitie nagi Patere Uleik peeig tang Iesu ger tuna God geke la kai i Heuen, ti uoho uanono dede tar inete ri tagorong manaig.
61001017	Grace	Ge inggono pe ke kale tur tar uleikir uiniator, kara uatakai tang God ge Tamanon. Tar binaka ke pokosor uau tang Iesu gere la tur tang Tamanon ger popokoho tunur barangan, inggono ke kula pare. “Gine ter Tuguo geru malauelhirintiehe tunin, inggo u uaha tun tatanon.”
