45003013	Sin	“Nas menesin a sa tun kenar benge nar keu, kara uauasisin a bohoboh.” “A baranganar soi ke sosoro tur tar bilisisin.”
49005028	Recommendation	Ter siokono sir kompe tar hagarionene, o bulout paka malauelhir tosnosio kuah misiana ra malauelhir katongo pe tar tukunus. A bulout gere malauelhir tena kuah, e malauelhir katongoin.
45009030	Faith	Hape ri kulangua pe inggeig? O gime uan pe ahik pah ka pentampopokoho tar kotpokos o kodkodoh, bo ka kale puk tar puhon, o kodkodoho tar nitagorong man,
54003009	Faith	Gisina paka kale uanono keip toro uelhire gero man gera tagorong manain tar niate pare, ka guata uakodkodoh.
54006002	Recommendation	Geta tamatang tagorong mana pono nang tamatang kaueka tang Kristo, ingga ahik paho namana pare, a uanotoum tatanon, kara hikingua paho ueltada tatanon. Ingga o kalekinalentiehempe, ge ingga pe o poul toso bung uanotoum, gisin o tamatang tagorong mana tang Kristo, doho malauelhir pono tasisin. Gininanine ter inete ro ualasiragia, karo mene uapopokoho tun tasisin.
45003003	Faith	Hape ge paka tagorong bohor gisiameher Ju tono uelhire God? A puhon e uamaluana tang God tar katego tena ualapagah?
43019034	Violence	Bo a tang sioko pukur tamatang uiliatung ke soup toro bele tar kapkapana Iesu, doh ahik me manasan, kare tit taueter deuating, kara kodom.
43015012	Recommendation	Doh inggo gine ru ualatut tamiuoum; “Uelmalauelhiresioum misiana ru malauelhirintiehe peo tamiuoum.”
45006013	Recommendation	Ahik pah mung uamaluana tar maharanar tukunumiu a ineteng guata keip tar niguata uasa, bo mung heirisioum tang God misiana tasisitie ka kale tapokis turis toro mat, kara tua. Karung heir tar maharanar tukunumiu tang God pare, a ineteng guata keip tar ineter kodkodoh.
58010039	Faith	Bo inggeig ahik paho tamatang tur tapokis, ahik pahi la i Hel, bo inggeig o tamatang tagorong man ka uaudeilisieig.
45011026	Grace	Tar hagarionene, o Israel uakapa tun ra turung uelkarusis, misianar nibolo uahiua peono tono uelhire God pare, “A tamatang uelkarus e turung la tur i Saion. Inggon e turung uapalih tasir bureher tamatar nang Jekop tar uakenua tenas niguata uasa.
52002015	Violence	geka uiliatung pous tar Tamata Noman Iesu Kristo doho propet, kara geil liu pono tamiueim. Doh gisin e huais tang God, kare tokouasais tasir tamata uakap.
58010026	Sin	Bo geti uakuakelukeig teregigir nimalar tar guata pukula tar niguata uasa ki kale baka pe toro man, ahik baka poluk me giameher uahung re kale liu tar niguata uasanin.
49002006	Grace	Doh God ke uatentur keip tapokis tagigeig tang Kristo, kara uatabila tagusieig tang Iesu Kristo tono tabtabil i Heuen.
49004025	Recommendation	Temaene inggoum uakapa mu luara tar boh, karung “ueluelmene keip pukusioum toro man,” ge inggeig pe i siokor uangoul teil tar siokon siounur tukunun.
48002005	Faith	Bo inggeim puk ahik tun pah king marang longoro tasisin, teeit inggeim king malara toro Uelhire Uaia gero man ahik paho uapalih o moko dede tamiuoum.
46014013	Recommendation	Temaeit mai geke heirinir Iabena Dedeil tar nitampopokoho tar mene tar uelhireng gime uan, inggon e lotu mare hire uakalahara tar tengkanar puhung mene ke menein.
44009001	Violence	Tar binakanin i Jerusalem, Sol e mene uasokoro dedempe tar marang mamantou, kare uamate tosno tamatang tagorong manar Tamata Noman. Inggono ke la tar pater ger i ran, tar kale mo bolobolong tonosio umang lotur Ju i Damaskus mare kale me nipoul gete tuparono mo tamata gera uakeluk tena lele Kristo, o bulout ue o kuah, inggon e marang kuse tasisin, kare la uamoko tasisina tar umang uih i Jerusalem.
43017013	Description	“Inggo gine manasa ru laha totomua, bo u lotu tanika baka kompe tar inetenine ru uangoul haraha peane i kot, maeit regu niuaho e la uoun tunungua tar koloususin.
60004013	Recommendation	bo mu uaha kompe, ge inggoum pe ke kale keip ponosioum tar uelmahing geke kalein Kristo, maeit inggoum mu turung uahantiehe tun gete pokoso uakalahara tunur uinatoror nanon.
44011006	Description	Inggo ku bangala i lolono tang roon, karu banga tasir ineteng tar kotosiner pang toueitir pang kekeis, o inetesiner roke, o pale mesir tetiuang tar hagar.
51003008	Recommendation	Bo gine puk daan inggoum mu uakuakapa liu hihir manasa tar niguatanine, a niguatang nimalian ue a niguatang uelmamangusul ue a niguatang bal uasa tar tang giameh, kara hik pah mu uelsigal ue mu soul.
44018003	Description	Doh Poul a tang bung tar taluh, temaene ke lang bangono tasrasin, ge rasina pe a toking tang bung pono toro taluh. Inggono ke la uangoul tagu, kare kalekinale uelkout tasrasin.
45006012	Sin	Temaeit ahikioum pah mung uamaluana tar niguata uasa e uoum keip tenami niuangouloum, karung longoro tar nimalara uasang tar tukunun.
53003012	Recommendation	Doh tar hangana nagi Tamata Nomaneig, inggeim mi ualatoho tun, karing uatagin tasir tamata tar puhonene mara uangoul uakodkodoh, kara kalekinale, kara bulaua katongo teres niein.
44007009	Sin	“Gisina ro bung tubugigeig ka nimalianang gehe tang Josep, temaene ka uabulauasina tatanono pare, a karabus tasir Isip. Bo God puk e uangoul tagu tatanon, kare uelkarusungua tatanono tar mamang binaka uasa.
44011028	Description	A tang sioko tasisin a hangana tang Agabus, ke tentur kai, kare mene keip tena nitampopokohor Iabena Dedeil. Inggono ke uatagin pare, “A gogo uleik e turung kotpokoso toro mamang buturulikane tar koto uakap.” (A puhonene ke kotpokoso tar binaka re toia Klodius ger Sisa i Roum.)
44020036	Description	I muduhia ke kula baka peono paar, inggono ke hatup uahiua keip tasisina uakap, kare lotu.
48005024	Faith	Doh mais gesir nang Kristo, ka tina to manasala tar korose tenas niuangoul uasang gane i kot, menia teres nimalarang gane i kot, doh ginina ke mata manas.
59001002	Recommendation	Ro bung uanotoug tar binaka re kotpokosor uatolaua tamiuoum, inggoum pakung uaha tun.
62001006	Sin	Temaeit geti kuleig pare, i uangoul tokaha uaia keip tang God, kari uangoul harahampela tar kitkitupun, inggeig o bohoboh, kara hik pahi uakeluk tun toro man.
44010011	Description	Inggono ke bang i Heuene ke takapuk, kare bangono tar inete ke la uahiuaha i kot. Inggono ngohina paho mahar gomono uleik, o nilolo ro toueitir gon.
44002009	Description	
51001010	Faith	Doh inggeim king lotu pon marung uakelukoum tena nimalaron, karung uauaha tatanono tar mamang hagarilik, doh mare uanaman manateono tamiuoum marung guata uaia dede tar mamang hagarir uia, kara hagaring poul tasir gisiameh, doh marung hua keip dedeoum tena niate uaia God.
54001018	Recommendation	Er tug Timoti! Gine tenag ualatoho ru heirin totomua. Namana dedempe toro uelhire geka meneinir propet sioun tar haua re turung pokoso totomua. Uakeluk uaia tun tar meneninanine maro uiliatung uaia ingga tar tur keip toro Uelhire Uaia gero man,
66019001	Faith	I muduhia tar inetenine ku banga baka uoumugio, inggo ku longoro sira tunumpe paho manai ra uatuatapuak ualeik i Heuen. Gisina ra kulkula ualeik tun pare, “Uatakai tang God! O udeil, a uinator, a nitampopokoh a nanar God ger nagigeig.
49002001	Grace	Sioun inggoum, kung uoto uangoul sirame tasir tamatasitier mat, teeit kung mahang longoro pe tang God, karung guata tar niguata uasa.
46010021	Sin	Inggoum ahik pah mung matotong inum tola tena kapar Tamata Noman, kare tena kapar liouana uasa. Ahik pah mung matotong ein to tena pateher Tamata Noman, kare tena pateher liouana uasa.
49005003	Recommendation	Bo i uantinanina puk tamiuoum, paka hik tun me sikir niguatang ura ueltebeir ue me niguatanitier ualamatal ue mu pe mu gono tar bureher inet. Ahik pah mu uamaluana me puh sira pare, ra tohotolain tamiuoum, ge inggoum pe no tamata God gesir dedeil.
56001015	Sin	Tasisitir delauanar kolous a mamang inetelik a delauan, bo tasisit pukur sa, kara hik paho tamatang tagorong man, ahik uadeil me ineter delauan, ge res ninamana pesin, doh res niate tar hauar uia ue a sa, a sa uakapa tunungua.
44009021	Description	O tamata uakapa tunusine ka longoro tatanono ka siokor lutarang toboul tun, kara ueldangateis pare, “A tamata dehene te giane ke mamantouo uasa tun tasir tamatang uakeluk tang Iesu i Jerusalem. Doh inggono teke lame tar me kuse mo tamatane gera tagorong mana tang Iesu, song re ueliuila tar pater ger i ran mara uamokoisisina tar karabus.”
58008006	Description	Bo gine puk daan, Iesu ka heir manasain tena kalekinaler pater ger i ranantiehe uain tar nasisin, te misiana kompe tar uelhote ger uiantieh, teeit re tengkana tur pe tar inete uaiantieh ger niualapagah.
50001021	Faith	Ter eiguor ninaman e baka siranguaono pare, getu tuao inggo u uangoul tokaha keip tang Kristo. Doh getu mato, inggo u kale tar inete uaiantiehe tun.
50001006	Faith	Doh inggo u tagorong mana tun tar puhene pare, God geke uakekene tar guata uaia tun i lolono tamiuoum, e turung guata dedempela e tuka geto la kapa tun roono tar uadouhinar marein re tapokis polukuha Iesu Kristo.
62005020	Faith	Doh inggeig i ate pono pare, a Tuna God ke laha tar me uanaman manate tagigeig, maeit ri ate inggeig tatanono pare, a God noman. Doh inggeig i uangoul tagu tatanono gere uaman, kare tar Tunono pon Iesu Kristo. Inggono ter God noman, kare ter nitua gere moko dedengua.
45012018	Recommendation	Geta uiaon, peng tampopokoho tar uangoul keip toro hiarouo tasir tamata uakap.
58010023	Faith	Inggeig i kale uanono tar haua ri tagorong mana teilin geri uelhire tauetein, ahik pahi uaruara naman, ge God pe e uamana tena ualapagah.
43014027	Grace	Doh inggo gine ru hiliu to toro hiarouo tamiuoum, kara uelhiarouonene ru heirio ahik pah misiana tar uelhiarouonine ra uoto guataigir tamata uakapane i kot, temaeit ahik pahe duhur balamiu ue mung sokor.”
47005006	Faith	Temaeit inggeig i tagorong mana dedempesieig, kari ate uaia tun pare, gine ri uangoul keip haraha pe inggeig tar tukununang gane i kot inggeig i uairehe harahampe tar Tamata Noman.
43012047	Grace	Doh ge me tang sioko ke longoro tenagu uelhireo, doh ahik pah ke ueltad, kare uakeluk taninin, inggo ahik pahu turung kedanga tatanon, teeit inggo ahik pah ku laha tar me kedanga tasir tamatane i kot, bo inggo ku laha tar me uaudeil tasisinane i kot.”
62003012	Sin	Doh ahik pahi guata sira misiana tang Ken ger nang Satan geke haluh pous tang tahin. Ae maene ke haluh pousono tatanon? Teeit tena nipilesono, kare na niguatono ger sa, bo na niguata tahinon a kodkodoh.
66016020	Description	O Toro uakapa tun ke siokor rouo tar nunon, kara mamang siusanalik ke siokor rouo uakap.
58011012	Description	Gitiempe ke horong mahoho tun pe Abraham, bo tar tang sioko pukur tamatono ka bour turur burehentieher tamat, ka burehentiehe sira tasir pitopitosinaha tar langit, doh ka burehentiehe sira tar iononiko i teh ge ahik me tamata re banotong ah.
54001017	Faith	Inggono ter Kristo gere toia dedengua, ahik pahe matotong mata tagu. Inggeig ahik pahi matotong bang huara tatanon, ge inggono pe ter God nomana tun. Temaeit inggeig i ueltada dede, kari uatakai tatanono tar mamang binakalik. O mana tun!
66014007	Faith	Inggonor anggelou ke kula ualeikintiehe tun pare, “Sokoro tang God, uatakai tatanon, ge na binaka peono tar kedang ke pokoso manas. Lotu tatanon geke tuh i ran, dohi kot, kare tar laur, karo kodomo gere tauete tur tar kot.”
44006001	Description	Tar binakanin, o tamatang tagorong mana ka burehentiehe uain. Doho Jusine ra ate toro uelhireng Grik ka menmeneng nimaliana tasir Jusiner peng Israel tun ra uelhire toro uelhireng Hibru, teene o kuaha nimate liuing Grik ahik pah ra uoto kale tagu me nipoul tar mamang binakalik gera buligir niein.
60002021	Grace	Tar ineteninanine, God ke kila tamiuoum, teeit Kristo ke kale uelmahing tamiuoum mara bangbanga toin na niguata Iesu rung uakeluk sira tun peoum tatanon.
53003010	Recommendation	Ge tar binaka pe king uangoul keipimeeim tamiuoum, inggeim king hire baka tar puhung ualatutene, ahik pah mu uahue me tamata gere de mate kalekinale tar ein me niein.
43003016	Grace	“God e malauelhirintiehe tun tasir tamatane i kot, kare heir tar tuna ger keketik bulout a tang siok. Mais uakapa tun ra tagorong mana tatanon, ahik pah ra turung mat, ge a nitua pe e moko dedengua tasisin.
44019015	Description	Bo a siokor binaka puk a liouana uasa ke mene hahaua tasisina pare, “Inggo u ate tang Iesu, karu ate pono tang Poul, bo inggoumene te maisioum?”
66019019	Violence	Song ku banga polukuo tar inete ger roke, doho toia uakapa tunane tar kot menia tosnosio tamatang uiliatung. Gisina ka siokor la toto uiliodout uakapa tun tar uelkoi keip tang gere ualo teil tar hos menia tosno tamatang uiliatung.
44027002	Description	Inggeim king panete tar parauing tar uan uleik i Adramitium, inggonor parau e marang bokboko hahaila toro biris gere moko toro binabatang tar pang uan i Esia. Gine king panete pe inggeim, a tang siokor tamata a hangana tang Aristarkus a peng Masedonia tar pang uan i Tesalonaika e la tagu teil pono tamiueim.
58013003	Recommendation	Mu namana toso uanotoumiusit ra uangoul tar uih, namana to ge pake inggoumuono rung uangoul tagu tasisin. Doh toso uanotoumiusit ra kale uelmahing, mu namana to ge pake inggoumuono rung kale uelmahing tagu tasisin.
51003017	Recommendation	Doh tar mamang inetelik rung guatagioum ue rung meneig, mu guata keip tar hangana Iesu ger Tamata Noman, karung heir tar uatakai tang God tamagigeig tang Iesu Kristo.
48006006	Recommendation	Mais geka ualasirais tono uelhire God, gisina paka uelpakaha tar bulaua ueleheir me inete uaia tosnosio tang ualasira tar poul tasisin.
44007005	Description	God ahik mate heir me sikir koto toro mahar koto roono tatanon pare, o nan. Tar binakon Abraham ahik me tun, bo God puk ke ualapagah tatanono pare, inggono meso bubunguna ra turung kale toro mahar koto roon.
44007019	Description	A toiaono ke tutlour tosnogio tamateig, kare guata uasa pono tasisin. Inggono ke petutupe pono tasisina tar baka tauete toso tususiner nihing poho mara mat.”
43020003	Description	Maeit Pita mer tang giameher tamatang uakuakeluk kura la toro lebanga geka uamokoinir tukununa Iesu.
44024016	Faith	Maeit inggo u uedanga tun tar uangoul uakodkodohane tar matana God, doh gane tar matasir tamat.”
65001013	Description	Gisina misianar butuana roke i laur, doh res niguata uasasinaniner ualamatala ke puraka sir tar peroper. Gisina ra uangoul sira tar pitopit gere uana ueltebeir puk i rana tar langit. Gisina ra turung uangoul dede tar butur kitupun geke uamatotoin God tasisin.
48001012	Description	Inggo ahik pah ku kale tur tang roono me tamata ue ka ualasiraio tang roon, ahik tun! Iesu Kristo katongompe ke ualasira uakalahara tang roono totoguo.
45007005	Sin	Sioun tar binaka ki uangouleig i kukulebanga tar nimalara uasang tar tukunugig, a ualatut ke uatentur tar nimalara uasaninanine gere uakotpokoso tar nimalara uasang tar tukunun gere keip pokoso toro mat.
54002007	Faith	Doh ter tengkanono temaene ka uamatotoio pare, a tamatang hire tauete tar uelhire, kara aposoul tar ualasira tasir gime uan ge ahik paho Ju tar nitagorong man, doh toro uelhire gero man. Inggo u uamana tun ahik pahu boh!
62003024	Faith	Mais ka uakeluk tena ualatohono ra uangoul tokaha uaia keip tatanon, doh inggon e uangoul tokaha uaia keip tasisin, doh inggeig i ate pare, inggon e uangoul tokaha keip tagigeig, teeit tar Iabena Dedeil geke heirihaiono tagigeig.
46010024	Recommendation	A tamat ahik pahe sir mena niuia katong, bo e sir kompe torosio uiar gisiameher tamat.
45012016	Recommendation	Mu kale tar ninamanang namana tasir tamata uakap. Ahik pah mung uairana katongosioum tesir i rana tasir gisiameh, bo mung kale uahiuasioum, karung matakaluana keip tasir tiome. Ahik pah mung namanasioum tesir uiantiehe tasir gisiameh.
49004031	Recommendation	Kale liu manasa tar niguatang mamangusul, kara nimalian, kara louar, kara uiliatung, kara mener boh tar marang mamantouo puk tar tang giameh, kara mamang niguata uasalikinitie re mamantou tar tamat.
51001025	Faith	God katongompe ke uamatoto totoguo, karu kotpokos a tamatang kalekinale tosno tamaton. Doh inggo nag kalekinale tar uelhire tauete tun tar mamang uelhirelikir nang God.
66001014	Description	O lunon, kara ulunon a gaugauilintiehe tun misiana tar ulunar sipsip gauil ue misiana tar mahar langit gaugauil, kara toking matanon e luh sira toro luhluhuna ro hue.
47004015	Grace	A mamang inetelikinine ka guataig e laig tamiuoum, temaeit a hamhamas ger nang God e la tasir bureher tamata mara heiringuaig me burehentieher niuaha tena uiniator God.
43006056	Faith	Mai re ein tar tukunuguo, kare inum tar deuatingiguo, inggon e uangoul tokaha keip totoguo, doh inggo u uangoul tokaha keip tatanon.
43011027	Faith	Marta ke hire tapokis pare, “Aa! Tamata Noman! Inggo u tagorong man ingga ter Kristo, a Tuna God geka heirihainane i kot.”
44002042	Faith	Gisina ra siokor ualongoro uaia tun tenas niualasirar aposoul, kara pepe tokaha pono tar namana huara tapokis toro uadouhina ro ein geke guatain Iesu, kara lotu tokah.
58001009	Grace	Ingga o malauelhir tar niguatar uia, karo de tar niguatar sa. Temaene, God ge nang Goda, ke uelpikur keip totomua tar uaiuaiang uah, a hagaring ueltad a uleik uain tar niuaheit ke heiriono toso uanotoumua.”
44012002	Violence	Inggono ke ualatoho tena tamata ke la uiliatung pous keip toro baenat tang Jems ge tahina Jon.
55002016	Recommendation	Tur uagele liu dede tar mene gere uasuasa tar hangana God, ge ginina pe e uoum keip uasantiehengua kompe tasir tamat mara uairehe tang God.
62003015	Sin	Doh mai gere tokouasain tang uanoton, inggon a tang haluh, kare inggoum mung ate pare, ger tang haluh ahik tagu mena nitua gere moko dedengua.
43021015	Faith	Tar binaka ka ein uakapa manasasin, kare dangata Iesu tang Pita pare, “Saimon Pita, ingga a tuna Jon, ingga o malauelhirintiehe nomanampe totoguo tasisine?” Kare hire tapokison, “Aa, Tamata Noman, ingga o ate pare, inggo u malauelhirintiehe tun totomua.” Kare kula Iesu pare, “Ualaein tosnogo tunar sipsipo.”
46012008	Grace	Na Iabena God ke heir kahakaha tar puhung uahire tasir gisiameher tamat, a uoun tar ninaman, kara niate uaia ter siokono komper Iabena ke heir pono tasir gisiameher tamata tar puhung uahireng tar niate.
44007013	Description	Tar uatorikinar nila tasisin, Josep ke uahire tasisina pare, mai tun, doh Pero ke la ate pono toso tahinalik Josep.
60003010	Recommendation	Ge o uelhire pe geka boloin sioun o hire teil pare, “Mai gere marang uangoul keip tar niuaha tena nitua, kare banga tar binaka uaia, inggon ahik pahe mene tar meneniner sa, kara hik pahe ueluatata tar boh.
44004032	Description	O mamang tamatang tagorong manalik ke siokor ueluiae tunis, kara sioko tun res ninaman. Ahik me tang sioko re kula pare, tena inet a nana me pahen, bo ra uelheirie puk tun tenas inet.
46015003	Grace	Ge a haua pe ru kaleio, inggo u heir uain taninina tamiuoum. A puhene ter puhung uleik tun; Kristo ke mat tar niguata uasar eigigeig, ro hire teil pe no uelhire God.
66018024	Violence	I Babilon ke kale tar uleikintieher tunur niduh, kara uleikintieher uelmahing, teeit inggono ka tupara toigir deuatingisir propet, kara deuatingis no tamata God, kara deuatingisir tamata uakapa tun geka tung pous toisane i kot.”
44013048	Faith	Tar binak ka longoror tamatasis ahik paho Ju tagu tar puhonene, gisina ka siokor uah, kara siokor uatakai tono uelhirer Tamata Noman. Doho tamata geke uamatotois God tar kale tar nitua gere moko dede, ka siokor tagorong man.
66022020	Description	Mai gere hire tauete tar uelhirenine. Inggon e kula ualeikingua pare, “Aa, inggo ku uahuhutung pokos.” O Mana tun. Lame Iesu ger Tamata Noman.
50004009	Recommendation	Doh mu guata keip manasa tar niate kara haua kung longoro turig totoguo menia tar haua ku guatagio, doh God gere heir toro hiarou e turung uangoul tokaha keip tamiuoum.
53003015	Recommendation	Bo ahik pukuoum pah mu guata sira tatanono tasir uelmatan, guata sira kompe paha tahimiu tatanon, karung ualatut.
51002008	Recommendation	Mu tagin, ahik tun pah mu uamaluana me tamat e uelour tamiuoum tar uakeluk tenas niualasirasina ger tabo tengkan, kara hik pahe tengkana keip mo man. A niualasiranin a ninamana kompe a niheir uain tur tasir gisiameher tamat, doh ra ualasira tasir tamata tar uakeluk tar ualatoh gere menmene tar ineteng tar kot, kara hik paha nang Kristo.
50003014	Faith	Temaeit inggo ku uatolaua kompela maru la uatuka tun maru kale me bulauoug tar nituang ganah i ran gere kilamein God totoguo, teeit ke mata ueleheir pe Iesu Kristo totoguo.
56002014	Faith	geke heir katongoin tar bulaua tapokis tur tagigeig tar mamang niguata uasalik doh tar uadelauana tasir tamat mari uangoul sira tuneig pare, o delauana tun, kari uangoul sira pare, o nana tunumpeon, kari malarantiehe tun tar guata tar mamang niguata uaialik.
43005024	Faith	“Inggo u hire tun tamiuoum toro man, mai re longoro tar haua ru hireio, kare tagorong mana tatanonene ke heiriha totoguo, inggono na nitua e moko dedengua, doh inggon ahik pah ra turung kedangain pare, ke guata uasa, inggono ke hiliu uoum toro mat, kare kale tar nitua gere moko dede.”
66021015	Description	Gitir anggelou ke menmene totoguo na sineir a nituha tar goul, inggono tere param keipiono tar uan uleikono menia tar pirikinon, kare tar pampantuiunaon.
50003019	Sin	Tar uadouhinar marein, gisina ra turung mamantouois, ge nas godo pesina ter nimalarang tar tukunun. Gisina ra kai kompe tar haua ge pake tera matala keipigisin, kara namana kompe tar ineteng tar kot.
54003006	Sin	Doh inggonor tamatang uoum keip ahik pah song re hiku pukume tar lotu mare haikiono pahe uakaiain ka uamatoto pein tar timuhur kalekinaleon, kare kalengua tar siokonor uabang manate geka heir uoumin tang Satan.
65001003	Recommendation	Inggoum ro bung kaloug, inggo ku namanantiehe tunumpe tar bolome tamiuoum tar uahire tar haua ke uaudeil tagigeig. Gine daan inggo ku bolome tamiuoum tar giamehe siokor inet, inggo u uatampopokoho tun tamiuoum tar tur keip toro uelhire ro man. God ke heir toro siokon sioun ro uelhire ro man tosno tamata dedeil, ahik pahe matotong uapalih.
44004002	Description	Gisina ka nimaliana uasa tun, teene rasina kura mene ualasir, kaura mene tauete pono tang Iesu pare, a tamatang uatua tapokis tasir tamat.
66018005	Sin	Ge na niguata uasa peono ke ueluelpone ke la tuk i rana tar langit. God ahik pahe matotong malabobour tar niguata uasanitir enon.
43004046	Description	Song ke la tapokis Iesu i Galili tar uan i Kena geke uapalih toono tar kodomo tar bino. Dohi Kena a tang siokor uleiking tar gavaman e uangoul, doha tunon a keketik bulout e momouh e uangoul tar uan i Kaperneam.
45012011	Recommendation	Ahik pah mung marapula kout, uakeluk dede kompe tar Iabena Dedeil, karung kalekinale tar Tamata Noman.
60001008	Faith	O man, inggoum ahik pah kung banga tatanon, karung malauelhirimpe tatanon. Gitiempe ahik peoum pah mu matotong banga tatanonene daan, bo inggoum kung tagorong mana dedempe. Temaeit inggoum kung uahauahantiehe tun, a uleikintiehe remi niuah.
62004013	Grace	Inggeig i ate pare, i uangoul tagu tang God, doh inggon e uangoul tagu pono tagigeig, teeit inggono ke heir tagigeig tena Iabena ger Dedeil.
43019029	Description	Doha itung kodom e tok a uoun tar bino ueltek, temaeit o pous ka uahuin taninina, kara uih tolain tar puhung douk ra kilain, o hisop, kara hue kaiatigin tar uauana Iesu.
51001013	Grace	Doh God teke uelkarus liu tur tagigeig tena nitoiar kitup, kare keip ualeka tagigeig tena nitoiar tun ger kuhur tunon.
45016017	Recommendation	Ro bung uanotoug, inggo u mene uapopokoho tamiuoum tar tagin tasir tamatasis ra uaueltageih tamiuoum mesir gisiameh. Nas niualasirasin e guata puk tamiuoum tar tur uiuir liu tang Kristo, doh nas uelhiresin ahik pahe siokono keip tar niualasir kung kalegioum. Ahik tun pah mung longlongoro tasisin.
45012007	Recommendation	Gete ka heiria tar niate uaia tar kalekinale i kukulebanga tasir gisiameh, kalekinale uaia tasisin. Gete ka heiria tar niate uaia tar ualualasir, kalkalekinale hamas uaia tununguampe binaka ro ualasir.
43016023	Faith	Doh tar mareinonene inggoum ahik pah mung turung dangata uapoul me inete totoguo. Inggo u uamana tun tamiuoum. Tamouguo e turung heir tamiuoum tar haua rung dangata tolagioum tar hangouguo.
66021019	Description	A palaua geka uatabilaig tar pampantuiunar uan uleikon a leleuara ueltebeir, kara abeaba uamatmata hamas tun. Gininar uatabil a siokor hangaul, kara torikir babeir re boto pe, a uakikilangan a palau gera kilaig a jaspa, song a palau ger bubulumungntiehe tun gera kilaig a sapaia, song a tabeliaha sikor gera kilaig a aget, song a bubulumungntiehe tun gera kilaig a emiral,
59004017	Sin	Namana uanon gete ko ate manasa ingga me siokor hagar uaia ro banotong guatain, bo ahik puk pah ko guat, ingga ko guata manasa tar niguata uasa.
66019005	Faith	Song ke mene turur uau tono tabtabilar toia pare, “Uatakai tar God ger nagigeig, inggoumene rung kalekinale tatanon! Uatakai tar God ger nagigeig, inggoumene rung ueltada tatanon, inggoum uakapa tun o tamata uleik, karo tatamatalik ueltebeir.”
47005002	Faith	Bo gine puk daan, inggeig ki haha manasa tar tukununonene ri uangoul keipinene daan. I malara puk manasa ra uamoko manasalainir tukununang Heuenane tagigeig.
48006004	Recommendation	A tang siok e uakodkodoho katongoin tena nipiles, song re uauaha katongoin, kara hik pahe kodoho tasir gisiamehe ra guata pe.
46007036	Recommendation	Bo gete me tang siokor bulout re namanang pesiaua sikor, kara hik pahe guata uaia tena kuaha geka uamatotoin, inggono ra uarikin tane tanikain, song gete la matotoin na binakon, kare namana sira pare, e marang le, inggon e guata uakeluk kompe tena nimalar, a puhon ahik paha sa. Inggon e le.
43016002	Violence	Ge inggoum pe ra turung uelueltula liu turusioum tenas umang lotur Ju, doha binak e turung pokosome tas mais ra tung pous tamiuoum ra turung namana pare, ka poul tang God tar uahung.
66015001	Description	Inggo ku banga i Heuen, doha uaparokene ku bangaio, ke me uatentur tun toro balouguo. A mouitir anggelou ra lang guata toro mouit ro mata uleik. Inggonene ter uadouhinar niduh, ge na nimaliana pe God e la keip teil taninin.
