55002018	Sin	Rasina kura lih sioko manasa tar lel gere hire toro man. Rasina kura kula pare, a nitua tapokis ke la manasain na binak, doh rasina kura mamantouongua teres nitagorong manar gisiameher tamat.
48005006	Faith	Ge tar binaka pe ri uangoul tokaha keipeig tang Kristo a niguatang poko tar kapokon ue a tabung pok a toking puh rasin a tabo tengkan. Bor puhung uleik tun te pare, inggeig i tagorong mana tang Kristo, kari malauelhirintiehe tun tasir gisiameher tamat.
58005009	Grace	Doh gitie ke longoro peon, kare uakuakeluk hihir tun tena nimalara God, ke kotpokosongua ter tengkanar uelkarus gere moko dede tar mamang binakalik tasir tamata gera longoro tatanon.
46016001	Recommendation	Gine daan inggo u marang mene baka tamiuoum tar mani geri uelbakesieig gere la tasir tamatang lotu i Jerusalem. Inggoum pakung guata sira ku ualatoho peo tasir tamatang lotu i Galesia.
49005022	Recommendation	Inggoumur kuahasisir le, mu ueltada tosnomio bulout misiana rung ueltada pe tar Tamata Noman.
43008012	Faith	Iesu ke menmene poluk tasir Parisi, kare kula pare, “Inggo ter luh gere luh uakubara tar uanene i kot, mai re uakeluk totoguo ahik pahe matot e uangoul tar kitup, bo inggon e turung kale tar luh gere heir tar nitua.”
65001017	Recommendation	Ro bung uanotoug, namana dede tar haua ra hireig no aposoul Iesu Kristo,
44017025	Grace	Inggon ahik pahe katupa tagu me siokor inet, doh ahik pono pahe malahir tagu me nipoulung tagigeig, ge inggono pe tere heir tasir tamata uakapa tun tar nitua, a romene ri ungaieig, kara mamang inetelik.
62005009	Faith	Inggeig i tagorong mana tar haua gera hire taueteigir tamata tagigeig, bo a haua puk geke hire taueteig God, ginina ter inete uleik, doh inggono ke hire tagigeig toro mana tar Tuna katong.
45013014	Faith	Bo i pilese uakeluk sira tena nipilese Iesu Kristo mara hikieig pahi uauaha tar nimalara uasang tar tukunugig.
58011030	Description	O Israel ka tagorong mana puk, maeit ke tatadur uahiuar padorong Jeriko i muduhia ka uiloho per Israel tar mouitir marein.
44019011	Grace	God ke guata tang Poul mare guata tar bureher nitouo popokoh.
43008034	Sin	Kare kula tapokis Iesu pare, “Inggo u hire tun tamiuoum toro man, o tamata uakapa tun gera uangoul keip tar niguata uasa, gisina ra karabus teil manasa tar niguata uasa.
62004011	Faith	Ro bung kaloug! Ge pare malauelhirintiehe nomana God tagigeig, inggeig i uelmalahire ponosieig.
44002028	Grace	Ingga ko ualasira manasa totoguo teru kale tar nitua gere moko dede. Ge inggo pe u kale tar niuaha uleik tar uangoul tagu totomua.’ ”
54004013	Recommendation	Doh getu otoung sikoro tar lame, ingga o banga dedempe tono Uelhire Uaia God karo uelhire ualasira tasisin.
47004008	Description	Inggeim king kale uelmahing tun tar mamang hagarilik, bo ahik pukumpe pah king uelueltageih ueltebeir ue king uaruara naman ahik pah king uamaluan.
44002013	Description	O gisiamehengua tasisina ka ueltang ualeng tasisin, kara kula pare, “Here ka inum dehesina me bureher bino.”
66021018	Description	A pampantuiunar uan uleikono ka tuhain tar palau gera kilaig, a daemon, dohi koboro uakapa tun ka tuhain tar goul uakapa tun a abeabantiehe tun misiana toro sisir.
66015006	Description	Doha mouitir anggelou gera lang guata toro mouit ro mata uleik ka tauet. Gisina ra loho teil tar delauana, kara abeaba uaia tunur gomon, kara kukuete ka auih uilohoig tar uaruarousisin a nituha tar goul.
45012014	Recommendation	Dangata tang God tar guata uaia tasisit ra guata uasa tamiuoum, dangata tatanono tar guata uaia, kara hik pahe guata uasa tasisin.
66001015	Description	Doha kekenon e abeaba sira tar brasener nisoro uaabeab, kara alalinganar uauanon e kaling sira toro reihin tar kodom.
43017026	Grace	Inggo ku uaate tasisina totomua, karu turung uaatentiehe dedempe, maeit reng nimalauelhiria totoguo e turung moko tasisin, doh inggo katongo ponompe u turung uangoul teil tasisin.”
45008032	Grace	O mana noman, God ahik pah ke ut tar tun tar me kale uelmahing, bo ke heir tatanono tagigeig. Doh gete pagiaron, inggon e turung heirheir pukungua pono tar mamang inetelik tagigeig.
65001018	Sin	gisina ka hire tamiuoum pare, o tamat ra turung uelualeng uasa tar Tamata Noman menia tasir tamata gera tagorong mana tatanon, kara uakeluk kompe teres nimalara katongonine re deig God.
45011018	Recommendation	Temaeit inggoum ahik pah mung uakaiasioum ka uatur palih pesioum tar ranan ger nikatego liu. Geto guata ingga, namnamana hamas tunungua tar puhene, “O uana ro douk ahik pah tero tur i rana tar ranan, bor ranan e tur uapon i rana toro uana ro douk.”
47001024	Faith	Inggeim ahik pah king petutup tamiuoum tar tagorong mana tar haua king hiregieim, bo inggeim king kalekinale keip puk tar niuahar eimiuoum. Teeit a nitagorong man, teene re uatur uanono tamiuoum.
43011001	Description	A tang siokor tamat hangana tang Lasarus e momouh. Inggon e uangoul tar uan uleik i Betani, tar uan re uangoul Maria me tahina kuaha Marta.
52004008	Sin	Temaene a tamata gere de tar uakeluk tar ualatutuninanine, inggon ahik pahe de puk tar tamat, bo e de tang God gere heir tamiuoum tar Iabena Dedeil.
62004002	Faith	Gine te hape rung turung ate paroko peoum ge pare, la turumper iabenono tang God ge me tang sioko re kula pare, “Iesu ger Kristo e la tur tang God ke la siraha tar tamat.” A iabenonene tar tamaton e la tur tang God.
65001008	Sin	Doh ter siokono sira komper hagaron tasir tamatasina ra borboriana tar inete gere guata uasa katongo tar tukunusisin, kara ueluelde tar nikaueke ger nanar Tamata Noman, kara menmene uasa tas mais gesir uelpipih gera uangoul i ran i Heuen.
60003011	Recommendation	Inggono pake turung tar mud tar niguataniner sa, kare uakeluk kompe tar niguata uaia. Inggono pake uatampopokoho tar guata tar uahiarouo tasir tamat.
51001023	Faith	Bo pakung kusa uanono kompe tar nitagorong man, rung tagorong mana teil pe toro Uelhire Uaia gekung longoroin. Ahik pah mu uamaluana uakeluk pukusioum. Inggo Poul ku kotpokos na tamatang kalekinale ro Uelhire Uaia roon, doh ku uelhire tauete tasir tamata uakapa tunane tar kot.
43008059	Violence	Tar binaka ke mene Iesu tar puhon, o tamata ka kale tenas palau, ra marang bakbak pous tatanon, bo Iesu puk ke uahuahoubour ueltebeirin, kare hiliuingua tar umang lotu ger dedeil.
49004024	Recommendation	karung hiku tar timuhur niuangoul ger nitouo sira tang God tar niuangoulur man, kara kodkodoh, kara dedeil.
66014012	Faith	Temaeit inggoumur tamatar nang God mung uanguangoul sikoro, karung kale uanono kompe tena ualatut God, karung tagorong mana kompe tang Iesu.
44013030	Description	Bo God puk ke uatua tapokis tatanon.
43010011	Description	“Inggo katongo ter tang kaueke uaia tasir sipsip. A tang kaueke tasir sipsip e turung heir katongo tar tukununa tar poul tasir sipsip.
49003002	Grace	Inggoum kung longoro manasa ke heir pe God totoguo tar kalekinale uleikene tar uelhire tauete tena nimalauelhir God tamiuoum.
56003010	Recommendation	Gete kaein me tamat e marang uataltaliaha tar lotu, ingga o uatagin uatorik puk tatanon, i muduhia ingga o agout tatanon.
43010019	Description	O Ju ka longoro poluk tar uelhirenin, kare la kahakahangua poluk res ninaman.
43003033	Faith	Bo mai ke sanga dede tar haua ke menegion, inggon e ualasira pare, God a uauaman.
61003014	Recommendation	Ro bung uanotoug, gine rung uanguangoul peoum tar inetenin, uedanga uapopokoho tun tar uangoul tar niuangoul ger delauan, kara kodkodoh ahik me inete ra tula tolain tamiuoum. Uangoul keip dede toro hiarouo tang God.
53003001	Faith	Ro uanotoumiueim, a uadouhinar men, inggo u dangata tamiuoum tar poul tamiueim tar lotu maeit ro la uakapa tun no uelhirer Tamata Nomana toro mamang buturulik mara ueltada uaia tunin misiana kung ueltada pe inggoum.
47004014	Faith	Inggeim mi ate tar God geke uatua tapokis tur tenagi Tamata Nomaneig Iesu toro mat, kare turung uatua tapokis pono tamiueim misiana tang Iesu, kare keip tamiueim menia tamiuoum i uoum tena butur.
59005014	Recommendation	Gete kaein me tang sioko tamiuoum re momouh, inggono pake kila tasir mamahoholikin tar lotu ra lotu keip tatanon, kara koboto tar uaiuai tatanono tar hanganar Tamata Noman.
44007023	Description	“Tar binaka ro toueitir hangaul no krismas Moses, inggono ke namana huara tar la ruh kout baka tosno tamat.
44023027	Violence	A tamatene ka kuseinir Ju, kara marang uiliatung pous tatanon, bo inggo puk ku keipila tosnogo tamatang uiliatung, karing la uelkarus tatanon, doh inggo ku ueltupar tatanono pare, a tamatang Roum pon.
44019029	Description	Ahik me sikir manasan, o tamata uakapane iuma tar uan uleik ka siokor menmene uauleik. Gisina ka reih tas Gaius me Aristarkus ger toking peng Masedonia geura la tagu teil tang Poul, gisina ka siokor lala tar umang tabila tokah.
44003014	Sin	Kung ueluelde tar tamata ger dedeil, kara tamata kodkodoh, bo kung malahir tang Pailat e uamaluana tar tang haluh pous tamata tere lame tamiuoum.
44015009	Faith	Inggon ahik pahe banga sira pare, tasisin o gisiamehe sioko tagigeig. Gine ka tagorong mana pesin, inggono ke uadedeil manasa tar koloususin.
46011028	Recommendation	A tamat e banga katongo bakain tena nipiles, song re ein tar bereit, kare inum tola tar kap.
46015058	Faith	Temaeit tamiuoum ro uanotoug mung tur uanono dede, ahik pah mung uahue me inete re ualilio tamiuoum, heir katongo nomana tunusioum tena kalekinaler Tamata Noman. Ge inggoum pe mung ate pare, nami kalekinaleioum tar Tamata Noman ahik paha tabo tengkan.
46004016	Recommendation	Temaeit inggo u kula uapopokoho tun tamiuoum tar petut sira tun totoguo.
46001021	Faith	Bo tar niate uaiar nang God, o tamatang gane i kot ahik pah ra banotong ate tang God teresir niate uaia. Temaeit inggono ke uah, kare heiriha tono uelhire gera kilain o tuktukara geka hire tauetein mare uaudeilono tas mais ra tagorong man.
60003001	Recommendation	Tar siokonor hagar inggoumur kuaha le mu guata sira pon, karung kale uahiua katongosioum tosnomio bulout, doh getung leoum mo bulout ge ahik pah ra tagorong mana tang Iesu, inggoum mu guata uakeluk kompe tar haua ra malaraisisin, maeit ra banga tosina tar nipileser namiuoumur kuah, kara turung tagorong manangua toro Uelhire Uaia, ahik pah mu petutup tasisina tar kale tang roon.
47005020	Recommendation	Temaeit inggeim tering tur keip manasa tang Kristo, ge God pe e uoto heir tunume tar popokohor mene tamiueim, inggeim mi mene uapopokoho tamiuoum ngohina pah te Kristo re menmene tun tamiuoum, “Mu uelhiarou keip tang God.”
44002024	Description	Bo God puk ke uatua tapokis tatanon, ke kale liu tur pe tatanono tar uelmahinging mat, teeit o mat o matoto leue tar kuse uanono tatanon.
59002007	Sin	Teesina deh gera uoto uelsigal dede tar hangana uaia Iesu ger nana tamiuoum.
54003003	Description	Doh ahik pono pahe uoto inumuntiehe tar inumunitier popokoh, doh ahik paha uoto nimaliana ualahur, bo a uanguangoul sikoro puk, doh ahik paha uoto nimalian, kare haik paha uaha mani.
43004014	Grace	bo mais ra inum tar kodom geru turung heirio, gisin ahik pah ra turung kamadaka uapoul poluk.”
62002005	Faith	Bo mai re longoro, kare uakeluk tono uelhire God, inggon e ualasirain pare, e malauelhirintiehe tun tang God, doha nimalauelhiron a kodkodoh tun. Inggono te paara, ri ate pe inggeig ri uangoul tokaha keip uaia pe tang God.
66016013	Description	Song ku bango tar tang touonor liouana uasa ra banga sirais tasir rokrok, gisina ka tauete tur tar uauanar soi uleik, kare tar uauanar inete ger roke, kare tar uauanar propet bohoboh.
59002008	Recommendation	Inggoum mu guata tar hagarir kodkodoh getung uakeluk tena puhung ualatut Godene re moko toro Uelhire Uaia, “Malauelhir tang uanotoum misiana ro malauelhir peia.”
47004005	Faith	A haua gering hire taueteisieim, ahik pah king menmene katongosieim, bo inggeim king hirhire tauete teil tang Iesu Kristo ger Tamata Noman. Inggeim mi uoto hire taueteisieim tamiuoum pare, inggeim teking kalekinale tamiuoum tar hangana Iesu.
46015033	Recommendation	Ahik pah mung uamaluana ra bohosioum, “Gerung ueldokout keipioum tasir tamata uasa, gisina ra uasuasa tamiuoum o uia pe.”
58013020	Grace	Inggo u lotu tar Godong Toro Hiarouo, geke kale tapokis tur tang Iesu nagi Tamata Nomaneig toro mat toro deuatinginar uelhote gere moko dede, doh ge nas uleikir Tamatang Kaueke tasir sipsip,
50001027	Recommendation	A inete uleik te pare, nami niuangouloum e kodkodoh dohe uakeluk tun tono Uelhire Uaia Kristo mare gete hape u me banotong bango tamiuoum ue u longoro ueluatata puk tamiuoum, inggo u turung ate pare, inggoum mu kusa uanono tar siokon siounur ninamana tar tur uapopokoh, karung siokor uatentur tar niualasirana ro Uelhire Uaia.
46006014	Grace	Na nitampopokoho God ke uatua tapokis tur tar Tamata Nomana toro mat, kare turung uatua tapokis pono tagigeig.
55001006	Recommendation	Temaeit inggo u kula uapopokoho dedempe totomua tar uatua dedempe tar haua geke heirheir pukin God totomua tar binaka ku lotuo, karu uapono tar limoug i rana totomua.
60004006	Grace	Ge inggono pe ter tengkan, maeit ka hire tauete ponoin, ro Uelhire Uaia tasir tamat geka mata uoum, maeit gisina ra turung kedangais, ra kedang uamatotois tenas niuangoulane i kot. Maeit gisina tar iabeis pake turung uangoul keip tar nimalarar nang God.
46007023	Recommendation	Inggoum a i ranantiehe tunur bulauamiu ke bulaua pe God, bo gine daan ingga ahik baka poluk paho pokos a karabus.
46010010	Recommendation	Ahik tun pah mung menmene uasa misiana ka guata per gisiamehe sioun tang Moses, kare tung pousunguar anggelou gere keip teil toro mat tasisin.
47002017	Faith	Inggeim ahik pah mi uabulaua tono uelhire God misiana ra guata per gisiameher tamat. Bo tar hangana Kristo puk, inggeim mi hire tauete toro mana tang God. Teeit inggeim mi ate God ke heiriha tamiueim tamiuoum.
45015001	Recommendation	Inggeigener tampopokoho uoum paki poul tar huata uelkout teres niduhusitir maluana harah. Ahik pahi uauaha katongosieig.
50002024	Faith	Doh inggo u tagorong mana teil tun tar Tamata Nomana pare, ahik pahi reh, karu turung la katkatongomeo tar me banga tamiuoum.
66007001	Description	I muduhia tanininanine, song ku bango tar tang toueitir anggelou ra tur toro toueit ro gon tar pang uanene i kot, gisina ra turtur tane tar toueitir rom gane i kot gete ume i rana tar uanene i kot ue i rana tar laur ue i rana tang hingiampe ro douk.
60004003	Sin	Ge inggoum pe kung uangoul keipime sioun tar niguata ra malaraisir tamata gera tele tang God geka uangoul keip toro uraur, o gehegehelik, uoto sipaka keip tar ninamana uasa, kara guata keip tar niein uelik tar inetenine, uasipaka tasir tamat, ura ueltebeir, kara guata uasantiehe tun tar lotu tasir god bohoboh.
66011005	Violence	Ge me tang sioko re uedanga tar uauelmahing tasrasin o hue o la tur tar uauas rasin, karo mamantouo tosnosira uelmatana rasin. Ter siokono kompe hape re turung mata pe me tamata gere marang uauelmahing tasrasin.
44023005	Recommendation	Kare mene hahaua Poul pare, “Ro bung tahig! Inggo deh ahik pah ku ate pare, inggono tenas uleikir pater, inggo ku guata uasa manas. Ge i lolono pe tono bolobolo God, inggon a nibolo pare, ‘Ahik paho uelsigala tas mai gera uoum keip tosnongo tamata.’ ”
66022015	Sin	Mais gera guata dedempela tar niguataniner sa, gisin ahik pah ra matotong uangoul tagu tar uan uleikonener nang God. Mais gera uelour tasir tamat, kara ualasira tar ineteniner boho tasisin, kare mais gera ura ueltebeir, kare maisir tang uelpus, kare mais ra lotu tar kaesa ue tar mahar palau, kare mais ra malauelhirintiehe tun toro boh tenas men kare tenas niguat.
66002014	Sin	Bo reng puha teene re tokouasain totoguo: o gisiameher tamata kaeis totomua ra kale teil haraha tar niguata ger nang Balam geke kouruin Balak tar uelour tasir Israel tar niguata ger sa, ka ein pe tar niein geka guata keipig tar uahung tasir god bohoboh, kara ura ueltebeir.
53001003	Faith	Ro bung uanotoumiueim, inggeim paking heir tun tar niuaha uleik tang God, teeit remi nitagorong mana inggoum e in kai uateuele tun, karung uelmalauelhiresioum.
46012002	Sin	Namana tapokis kompe tar binaka rung tele harahoum tang God. Inggoum ra uoto uoum keipisioum tar bureher lel tar binaka rung uangouloum i kukulebang tenas nikaueker god bohoboho gesir pau.
49005025	Recommendation	Doh tamiuoumur bulout le, mu malauelhirintiehe tun tosnomio kuah misiana tang Kristo re malauelhirintiehe tun pe tosno tamatang tagorong man, kare heir katongo tar tukununa tasir toto tamatang tagotong man
45012017	Recommendation	Ahik pah mung pehahaua tar niguata uasa ka guataig tatamiu. Mu tagin tun, binaka rung guata tar ineter kodkodoho tar matasir manai.
60005006	Recommendation	Kale uahiua katongosioum i kukulebanga tar limana God ger i ranantiehe tun mare turung kale kaiono tamiuoum gete matotoinir binak.
44014017	Grace	Bo Inggono puk ke ualasirain tar bureher hagar. Inggono ke ualasirain pare, ter God uaia, re heir tur peha i Heuene tar huan, kare uakotpokoso pono tar niein. Inggono ke heir tar bureher niein tagigeig, kare uauoun tagigeig tar niuah.”
54003011	Recommendation	Misiana ponompe tosnosio kuahasin, nas niguatasin paka uia, kara ueltadais, ahik paho uoto ngur, kara uaateis tar kaueke katongois, kara guata keip toro mana tar mamang inetelik ra guatain.
66002021	Sin	Inggo ku heir tatanono tar binaka mare uiuirin tono uraur, bo inggono puk hik pah ke malar.
44012020	Description	Inggono ke menmeneng nimaliana keip tasir tamatang Tair mesir Saidon tar puhung barah, maeit gisina ka la toto tar uamatoto tonosio tamat tar la mene tang Herot. Gisina ka uamamahoul baka tang Blastus ge na tamata uleikir toia mare poul tasisina tar la uakotpokoso me nipepe tokahang uelhiarou, teeit nasi toking pang uanisina ra uoto kale tur teres niein i Judia.
43008049	Sin	Kare kula tapokis Iesu pare, “Ahik me liouana uasa kaein totoguo. Inggo u ueltada tang Tamoug, bo inggoum ahik pah kung ueltada totoguo.
43006018	Description	Doh ahik me manasan, kare unguar uasul, kare uleik ponor butuanane tar kodom.
45008018	Faith	Inggo u ate teil tar niduhung daan, ahik paha inete uleik tagigeig tar huatala tar banga keip tar uiniatoreit ra turung ualasirain tagigeig.
62002012	Grace	Inggo ku bolome tamiuoum ro bung tug, teeit remi niguata uasaoum ka uadelauana manasaig tar hangana Kristo.
55001009	Grace	Inggono ke uaudeil tagigeig, kare kila no tamata tagigeig. Inggeig ahik pah ki guata me inete, maeit ke guatono pare, bo git a to tengkan, a nimalauelhir menia tar hamhamas a nanono katong. A nimalauelhir menia tar hamhamasonene ka heir turin tang Iesu Kristo tagigeig, ke uakekene pemer binak.
43019006	Violence	Tar binaka ka bangar tamata uleiking tasir patere, karo tamatang babata tang Iesu, kara kula ualeikingua pare, “Uakusa kai tatanono tar korose! Uakusa kai tatanono tar korose!” Bo Pailat puk ke kula tapokis pare, “Mu me kale tatanono marung uakusa kaia katongoum tatanono tar korose, teeit inggo ahik pah ku tupara me inete ke guata uasaion.”
60001010	Grace	Sioun o propet ka me menmene uoum teil tar puhonene ka uaudeil peisioum, kare tar hamhamas, kara niueldolomo gere turung lame tamiuoum. Gisina ka sirsir, kara heheke uaia tun,
63001007	Sin	O bureher tamatar bohoboho gera kula tang Iesu Kristo ahik pah ke la siraha tar tamat. Gisina ka la ueltebeir uakapane i koto uakap. Doha tamata gere kula paar, inggon a bohoboh, kare na uelmatan Kristo.
44024005	Sin	Ge Inggeim pe king ueltupara tar tamatene pare, e uoto uakotpokoso tar ueluelnimaliane, e uoto uatentur tar ueluelkoiane i uantinanina tasir Ju toro mamang buturulikane tar koto uakap. Inggono ter tamata uleik tar toto tamatang bohoboh ra kilais o Nasaret.
54003016	Grace	Ahik me dangata tar puhonene, a parakukuh tar uakalahara tar nitagorong manar eigigeig: Inggono ke kotpokoso sir tagigeigir tamat, doha Iabene ke ualasira uakalahara pare, inggon a kodkodoh. O anggelou ka bang, doh no ueluatatono ka hire tauetein toro mamang pang uanilikane i kot. O tamatang gane i koto ka tagorong mana tatanon. Inggono ka keip kaiain i rana tar uaning uinator.
66016021	Violence	Doha mahar ais a popokoho sira tar palau a tolimar hangaulur kilagram ro duh pe ro mahara siok, ke dud turuha tar langit i ranangua tasir tamat. Gisinar tamata ka ueluelhire uasangua tang God, teeit tar mahar aisinin a uelmahingintiehe tun.
61003013	Faith	Bo inggeig puk i uanguangoul tar ualapagaha ger nang God, inggon e turung uakotpokoso uatimuh tapokis i ran, kare tar pang uanane i kot, inggono tenas uanir tamata gesir kodkodoho nas niguat, kara niuangoul.
66006014	Description	A langit ke kauiuir misiana toro bolobol geka ligun uilohoin, doho siusan, karo toro tor ka uain liuig tar butur re tok.
58010010	Grace	Teeit Iesu Kristo ke guata tar haua ke malauelhirin God. Temaeitingua ka siokor uadedeil turusieig tar niguata uasa tar uahung geke guata keipiono tar tukunun tar siokon siounur binak e lain tar mamang binakalik.
52001002	Faith	Inggeim mi uoto hire tang God pare, mi uaha tun tamiuoum uakapa tun, karing uoto namana tamiuoum tenami lotu.
66006004	Violence	Song ke taueter uatorikinar hos, inggon a kubar. Gine re ualo teil tatanon, ka heirin tar nitampopokoho tar kale liu tar uahiarouo tasir tamata uakap, gane i kot, kare guata tasir tamata ra uelueltung pous katongois. Inggono ka heirin toro uleik ro baenat.
54006001	Recommendation	O tamatang tagorong mana tang Kristo, gesir karabus paka ueltadantiehe tun tosnosio tang kauek, maeit ahikir hangana God pah ra menmene uasain, kara haua geki ualasiragieig.
51003009	Recommendation	Ahik pah mu ueluelbohesioum gekung uakapa liu manasa peoum tar niuangoulung sioun menia tar niguata uasa.
66002020	Sin	Bo reng puha teene re tokouasain totoguo: ingga ko uahue tar kuah, Jesabel gere kula katongoin pare, na propet God tar ualasir, kare uoum keip uasa tosnogo tamatang kalekinaleo toro uraur, kara ein tar niein geka guata keipig tar uahung tasir god bohoboh.
48003008	Grace	Sioun no uelhire God ka boloin pare, “O gime uan ge ahik paho Ju ka uakodkodoho tois teres nitagorong man.” Karo Uelhire Uaia o uoum teil tar uelhire tauete tang Abraham pare, “Teeit totomua Abraham Inggo u turung guata uaiangua tasir tamata uakapane i kot.”
58012005	Recommendation	Ue kung malabobour uakapangua inggoum tar meneng uatampopokoho giniane ke meneig God tamiuoum ro bung tun? Inggono ke kula pare, “Ir tug, ualongoro tar binaka re uakokodohor Tamata Nomana totomua, kara hik paho kale uasa tar binaka re uamarorono totomua.
58013017	Recommendation	Mu longoro tosnomio mamahoholikin tar lotu, karung guata tar haua ra kulainisina gera kaueke pesina tamiuoum, ge gisina pe ra la turung hire sira tang God hape ka kalekinale pe. Getung longoroum tasisin, gisina ra banotong kalekinale keip tar niuah. Geta hikia paho longor, gisina ra turung kalekinale keip tar niduh, kara hikinguamper puhono pahe banotong poul totomua.
44013019	Description	Inggono ke mamantouo toro mouit ro matina tamat gera uangoul i Kenan, kare heir tenas kotosina tosno tamata pare, a nos.
54006003	Faith	Gete me tang sioko re ualasira me giniamehe siokor niualasir, doh ahik pono pahe uauia tar uakeluk tono uelhire Iesu Kristo ger Tamata Noman, doh tar niuangoulur uia ger nang God,
63001010	Recommendation	Doh mai re pokoso tamiuoum, doh ahik pahe uakeluk tar ualasirar nang Kristo, ahik pah mung kilauatoro tatanono tenami um, karung uamaluana tatanono tang hingiar hagar.
47001005	Grace	Ter siokono kompe geti kale inggeig me uleikir uelmahing ri kalekinale pe tang Kristo, inggeig i turung kale pono tar uleikir uamamahoul tur tang Kristo.
65001011	Sin	Kuasalik, God e turung heir tar uleikir uelmahing tun tasisin! Ka uakeluk pe tena niguata Ken, kara tang inete to tang Balam. Gisina ka mamantouois ngohina tang Korah ke mahang longoro pe tang Moses.
65001010	Sin	Doho tamatasinasine ra menmene uasa tun harahampe tar hauar inet, ahik pah ra naman manatein, kara guata kompe tar haua ra marang guatain misiana tasir inetesiner roke ter niguataninanine ke mamantouontiehe tun tasisin.
58011007	Faith	Noa ke tagorong mana puk, maeit ke uakeluk uelhir ke uatagin pe God tar inete re turung kotpokos i uoumuhia ge ahikiono pah ke banotong bang huar. Inggono ke longoro tang God, kare tuha tar parau geke banotong poul tasisina ro matmatame. O matmatame matmatang ione keip toso bung tus o niuelkarus. Noa ke tagorong man, maeit ke ualasiranguaono tasir tamatang tar koto uakap ge ahik pah ka tagorong man, ka guata uasa pe. Ke kotpokosonguaon a tang sioko pono tasisis ka uakodkodoho keipis tang God tar nitagorong man.
58009006	Description	Tar binaka ka uamokoigir mamang inetelik pagiare. O patere ra lekela tar uakikilanganar tine um tar mamang binakalik tar guata tenas lotu.
44007051	Sin	Doh Stiben ke mene tumana poluk pare, “Inggoum deho tamata mahang longor! Inggoum deh halanampe tung uapalih tenami niguat, karung longoro tang God. Inggoum mu ueluelde dedempe tar haua re uedangaigir Iabena Dedeil tar uahire tamiuoum, mu uakeluk sira kompe toso bung tubumiu ka guata uoum pe.”
54001009	Sin	Kari ate pono pare, a ualatutunin ahik pah ka guata uatuhaig a nasir tamata ger kodkodoho nas niguat, bo ginin a nasir tamata ge ahik pah ra longor, kara uakeluk tananin. Doh a nasisit re tokouasais tang God, kare mais gera de tono uelhireon, kare mais geka tung pous toso tinas doho tamas, kare maisir tang tung pous tamat.
46005009	Recommendation	Inggo ku bolome tamiuoum, ku kula tane ahikioum pah mung ueldokout keip tasir tamata gesir uraur.
48001015	Grace	Bo tar binaka puk halana tinouguo te poho totoguo, God ke uamatoto manasa totoguo. Doh tar hamhamasar nanon inggono ke kila to totoguo tar binaka ke uamatotoin tar kotpokoso pare, a nana katongo tunon,
45007015	Description	Inggo ahik uadeilimpe pahu naman manate katongoio. Ge u marang guata tun pe tar ineter kodkodoh, bo ahik puk pahu guat. U guata kalehe puk tar inetenitie ahik pahu marang guataig, a inete ru degio.
61003018	Faith	Bo mu hua kai keip kompe tar hamhamas, kara niate ger nana nagi Tamata Nomaneig, kara tang uaudeil Iesu Kristo. Siokor uatakai tatanonene daan, doh tar mamang binakalik! O Mana tun.
