58013009	Recommendation	Ahik pah mu uareihisioum tar mamang niualasiraniner giniamehe sioko tena niualasirar Tamata Noman. Auia geta uatampopokoho keipigir kolougigeig tar nimalauelhir doh na niueldolomo God, bo ahik pah tar ueluatatanar ualatutunar niein, ge gisis pe ka uakeluk taninin, ahikir puhunin pah ke poul baka tasisin.
52005012	Recommendation	Gine daan ro bung uanotoumiueim, inggeim mi dangata tamiuoum tar ueltada tasisit ra kalekinalentiehe tun i uantinanina tamiuoum, ge gisina pe ra uoum keip, kara kauek, kara ualatut tamiuoum tar niguatar nang Kristo.
43009022	Description	Rasitir toking tinanono kura kula puk pare, teeit rasin ura sokoro tasir Ju geka uelhote manasa pesina pare, ge me tang sioko re tagorong mana, kare kula pare, “Iesu ter Kristo,” inggono ra uelueltula liuin tar umang lotu.
50003003	Faith	Bo inggeig tesir Israel tun gesir nang God geri lotu keip tar Iabena Dedeil. Kari uatakai tar hangana Iesu Kristo, kara hik pahi namana pare, ka uelkarususieig tar haua ki guata katongoin.
62003023	Faith	Ginine tena ualatohon, “Tagorong mana tar hanganar Tunon Iesu Kristo, kari uelmalauelhiresieig,” ngohina ke ualatoho peono tagigeig.
66013011	Description	Song ku banga polukuo tar giamehe polukur inete roke e tauete turuha tar kot. Inggono no torik ro seir misiana tar sipsip, bo inggono puk e mene sira tar soi uleik.
46014020	Recommendation	Ro uanotoug ahik pah mung namnamanang keketik, bo mung uangoul uaia sira kompe tasir keketik tar niguataniner sa, karung kale puk tar ninamanang mahoh.
59005013	Recommendation	Gete kaein me tang sioko tamiuoum e huata teil me niduh, inggono pake lotu tang God. Doh gete kaein me tang sioko re uah, inggono pake ker tar kerekereng uatakai tar hangana God.
58012012	Recommendation	Temaeit, mu hue kai tar limamiuinit re maluana kusa puk, doh mu uapagpagolo tar kekemiuinitir malmaluan.
60001017	Recommendation	Inggoum mu kila tang God pare, Tamamiu, binaka rung lotu tatanon, inggono teke kedanga tasir tamata uakapa tun, e lampein tang hingiar hagar ke guatain, temaeit heir tar mamang binakalik rung uangoul pe tar sisikinalikir binakane i kot tar ueltada tang God.
58010036	Recommendation	Inggoum pakung uanguangoul hamas mare getung guata inggoum tar haua ke malaraig God, inggoum mu banotong kale tar haua ke ualapagahagion.
58011001	Faith	A niguatang tagorong mana te pare, inggeig i ate uaia tun tar mamang inetelik ri uanguangoulig tar kale, inggeig i turung kale nomana tananin. Gitiempe ahik peeig pahi bang huara tar inetenin, bo i ate tun pukumpe pare, e turung kotpokosonin.
49004017	Recommendation	Tar hanganar Tamata Noman, inggo u kula uapopokoho pare, ahik tun pah mu uangoul sira baka poluk tenas niuangoulur tamata gera tele tang God, kara tukar res ninaman,
51002016	Recommendation	Temaene ahikioum pah mu uamaluana me tamat e bang kedanga tar haua rung inumugioum ue rung einig ue tar marein uleik ue tar mareining lotu tar timuhur bialok ue tar Mareining Pepe Uah.
66007015	Faith	Temaeit gisina ra siokor tur i uoum tono tabtabila God ger toia, kara kalekinale tatanono tar marein, doh tar boung tena umang lotuono ger dedeil. Doh inggonene re tabila toro tabtabilar toia e turung uangoul tagu tasisin, kare kaueke tasisin, kare biana uauleik uain tena uma mare matoto tasisina uakap.
44020010	Description	Maeit Poul ke la uahiuako, kare la hatup uahiuane tatanon, kare buaka tatanon, kare kula pare, “Inggoum ahik pah mu sokor, ge inggono pe a tua.”
55002010	Faith	Temaeit inggo u siokor huata tar niduh tar mamang inetelik tas maisir tamata geke kedangais God, maeit re turung uaudeil pono Iesu Kirsto tasisin, kara kale tar uinatoro gere moko dedengua.
60005014	Recommendation	Mu ueluahe katongosioum, karung nguh keip tar uelmalalhir. Inggoum o nang Kristo, o hiarouo o la tamiuoum uakapa tun.
49005021	Recommendation	Mu ueltadesioum ge inggoum pe mu ueltada tang Kristo.
61003017	Recommendation	Temaeit inggoum ro bung uanotoug, gine kung ate manasa peoum tar puhonene, kaueke katongosioum mara hikir tamata gesir tabung ualatut, pah ra uoum keip tamiuoum tar lele uasa, ra boho pe tamiuoum, kara hikingua pah mu turung tagorong mana toro man.
51003018	Recommendation	Inggoumur kuaha le mu uangoul tar nikaueken tes nomio bulout geter puh peonor uia tasir tamatar nanar Tamata Noman.
54005020	Recommendation	Loulouara to tunumpe tar matasir manai tang mai ra tuparain ke guata uasa, maeit ra turung tagininguar gisiamehe geta guata sira ponois.
45014013	Recommendation	Temaeit inggeig i uakenua manasa tar ueluelkedangasieig, bo i namana uiuir pare, ahik pahi ualor, kari uapunga tar tang giamehe tar niguata uasa.
45002010	Grace	Bo tasisit ka guata tar niguata uaia ra turung heiris tar uiniator, a ueltad, karo hiarou, uakekene keip tasir Ju song o gime uan.
58011034	Violence	karo gisiamehe ka lomoho tar hue uleikintiehe tun, karo gisiamehe ka lukup tur tasir tamata geka marang tung pous keip tasisina tar baenat barah. Gisin o maluan, bo God puk ke uatampopokoho tasisin. Gisina ka tampopokoho tar uiliatung, kara geil uaroke tasir tamatang uiliatungun toro gime uan.
48006017	Faith	A uadouhina tun, inggo ahik pahu malara me tamata baka poluk tar heir me niduh totoguo, ge inggo pe e moko teilir potono Iesu Kristo tar tukunug.
66018021	Violence	Song ke kaler anggelou uelpipihintiehe tun toro tinana ro palakurum, kare dudur tang roon i laur, kare kula pare, “Te misiana tar uan uleikintiehe tun i Babilon ke dudur pe ahik pah ra banga kout baka polukin.
65001020	Faith	Bo inggoum ro bung uanotoug, mung uatampopokoho dedempesioum teremi nitagorong maneitir dedeilintiehe tun, karung lotu keip dede tar Iabena Dedeil.
45012002	Recommendation	Kara hik baka poluk pah mung uakeluk tar niguatang gane tar kot, bo mung uamaluana tena Iabena Dedeil God e uapalih teremi ninamanoum marung pilesoum me timuhur niuangoul. Tar hagarion, inggoum mung turung iate tar haua re malaraig God tamiuoum tar guat, a ineter uia, kara inete re uauaha tatanon.
46015009	Sin	Ge inggo pe ter aposoulener tabo hangan, doh inggo ahik tun paha tamata uaia mara kila taguio pare, a aposoul, teeit inggo ku guatguata uasame tosno tamata God.
62002015	Recommendation	Uakenua tar malauelhir i kot, doh tar ineteng gane i koto ger sa, bo gero malauelhira taninin na nimalauelhir God ahik pahe moko totomua.
45002001	Sin	Temaeit, inggaene ahik tun me puh maene ro bang kedanga tasir gisiameh, ge tang hingia per puh ro bang kedanga tolaia tasir gisiameh, ingga o uamoko tagu ponolaia. Ter hauon, inggaeit ro uoto bang kedang o uoto guata pono tar hararinin.
48002009	Description	Jems mes Pita, doh Jon tera keip o tamatang uoum keip tar lotu gisina ka bang paroko tar siokor kalekinale uleikonene ke heirin God totoguo, temaeit ka uelkuse pang lima keipinguasina tamiraeim me Barnabas tar ualasira pare, inggeim mi kalekinale tokah. Doh inggeim king ueluauiae pare, raeim me Barnabas teira la kalekinale tasir gime uan ahik paho Ju, bo gisina tera la kalekinale tasir Ju.
43019023	Description	Doh tar binaka ka uakusa kaia manasa per tamatang uiliatung tang Iesu tar korose, gisina ka kale tena hikhikuono, kara uelbule katongois taninina tar toueitir pain. A tang siok tang sioko tasisin e kale tono mahar. Gisina ka kale liu pono tono hikhikuono gero barah geka tuha keip pukin toro mahar sioko ro mahar gomono nikaere uatuk i sirun, ahik paho niuauelbabeir tagu.
45002021	Sin	O mana tun, inggoum mung ualasira tasir gisiameher tamat, bo maeit ahikioum pah mung ualasira katongosioum? Inggoum mung hire tasir tamat, “O sa ro uenau.” Bo inggoum ahik pah mung uenau?
46006019	Faith	Inggoum ahik pah mung ate pare, a tukunumiuoum pe na umang lotur Iabena Dedeil, inggonor Iabena Dedeil gekung kale turioum tang God gere uangoul teil i lolono tamiuoum. Ingga ahik paha noum totoum katong.
47005014	Grace	Ge na nimalauelhir pe Kristo, teene ke kaueke tamiueim, teeit inggeim king tagorong mana tun pare, Kristo ke mata ueleheir tagigeig uakapa tun, doh inggeig ki siokor mata pon.
58003001	Faith	Temaeit ro bung uanotoug gesir dedeil, inggoumeit ke kila ponois God i Heuen, mu uamoko tun teremi ninamana tang Iesu geke heirihain God a tamatang keip uelhire tagigeig, doha Patere Uleik geri hire taueteieig teregi nitagorong man.
44020035	Recommendation	Tar mamang kalekinalelik ku guatguatagio, inggo ku ualasira tamiuoum tar kalekinale uapopokoh mari banoteig i poul tasir tamata ge ahik pahe banot e poul katongois. Inggeig paki namana huara hape ke kula pe Iesu ger Tamata Noman, inggono ke kula pare, ‘A niuaha uleik e turung moko tar tamata gere heir tar inete tar tang giameh, a niuahon e i rana uain tar niuaha gere kaleiono gete namana pukin me pahen.’ ”
58013004	Recommendation	O le paka ueltadantiehe tuninir tamata uakap. Doho bulout le mesir kuahar le, paka uelueltadeis, doh paka uangoul uadedeil keip torosio le, ge God pe e turung bang kedanga tasisit ra uangoul uasa keip tosnosio kuahar gisiameh ue nosio buloutur gisiameh, doh gisis pon ra ura ueltebeir.
43020005	Description	Inggono ke la kokolo, kare uakatako, kare banga tar gomono geka auih uilohoig tatanon, bo ahik puk pah ke lek.
66016018	Description	Kare kanauanguar kanau, kare pilar pil, kare nunur nun a uleikintiehe tun ahik me nun misiana tatanono ke pokoso baka uoumane tar uanene i kot.
66019010	Faith	Gine ke hire peonor anggelou totoguo tar puhonene, inggo ku hatup uahiu, karu lotu puk manasa tatanon. Bo inggono puk ke kula tane totoguo pare, “Ahik paho guata paar! Inggo na tamatang kalekinaleon misiana totomua menia toso uanotoumua geka tagorong mana tono uelhire Iesu. Lotu tang God! Ge no uelhire pe Iesu te misiana puk tar Iabene Dedeil gere uangoul teil tasir propet.”
46002010	Grace	Bo God ke uakalahar tur tar Iabena Dedeil tar mamang inetelik. Ge a Iabena Dedeil pe e sir tar mamang inetelikir nang God gitimpe gete moko uaouonin i lolono teil tun.
50002029	Recommendation	Temaene inggoum pakung uahantiehe tun tar kale tapokis tang Epaproditus menia keip tar uleikir niuah misiana paha tahigigeig gere tagorong mana tar Tamata Noman. Inggoum pakung ueltadangua tar tamata sira pare,
51003020	Recommendation	Inggoumur keketik mu longoro tenas uelhire ro bung tamamiu doho tinamiu ge a puh peon a kodkodoho tar matanar Tamata Noman.
47001012	Faith	A puhene tering sala keip tunusieim ge remi niate peeim ke hire tauete tun toro mana pare, inggeim king guata uaia tun tasir tamatang gane i koto te tamiuoum tunumpeono king mene uakalahara pe, karing uamana ngohina ke guata pe God. Inggeim ahik pah king guata tar puhene e la tur tar niate uaiang gane i kot, bo e la tur tena nitampopokoho God.
43014021	Faith	Mai re ate tenagu ualatoho, kare uakeluk taninin, inggono tere malauelhirintiehe tun totoguo. Tamouguo e turung malauelhirintiehe pono tang mai re malauelhirintiehe totoguo, doh inggo u malauelhirintiehe pono tatanon, karu uamakaha katongoio tatanon.”
51002023	Sin	O mana noman a ualatutunin ra banga siraig pare, e turung uatampopokoho tagigeig tar uangoul uaia tun, kari lotu uapopokoh, kari kale uahiuasieig, kare uauelmahing tar tukunugigeig, temaene o gisiameher tamata ra namana tar ualatutunin e uakeluk tar ninaman, kara niate uaia, bo a ualatut pukunin ahik tun pahe banotong poul tagigeig tar kale uahiua tar nimalara uasang tar tukunun.
64001006	Recommendation	Gisina ka me hire tasir toto tamatane tar lotu, hape rung uelmalahire pesioum. Inggoum mu guata uaia dedempela tar ueltutue tasisina tar butur ra lihihia. Inggoum mu uakeluk uaia dedempe tar puhono tere malara pe God.
55002023	Recommendation	Tur uagele dede tar meneniner nasir tuktukar, kara uelperere ger tabo tengkan, ge ingga pe o ate ginin e uakotpokoso kompe tar nimalian.
47003018	Faith	Doh inggeig uakapa tunene ge ahik pah ka uataku tanesieig mare turung bala tapokisisieig tar balbalanar uinatoror Tamata Noman, inggeig ra uapalihisieig misianangua tatanon, kare misiana tar balbalana uinatoro gere moko dede gere la tur tatanon, ge inggono per Tamata Noman ter Iaben.
58009014	Grace	Doh gitier mana per puhene, namana ah ter nitampopokoh uleikintiehe ter deuatingina Kristo tar uadelauana tar kolougigeig, mari kalekinaleig tang God ger tua. Ge tena nitampopokoho per Iabena Dedeil gere moko dede tar mamang binakalik, Kristo ke heir katongoin a uahungeitier delauana tun tang God.
44011017	Grace	Maeit geke heir God tasisina tar inete ke heir ponoin tagigeigene ri tagorong mana pe tang Iesu Kristo ger Tamata Noman, doh inggo te hape ru baka pe maru banot u tur tane tena kalekinale God?”
49004030	Faith	Kara hik pah mu uaueldolomo tena Iabena Dedeil God, ge inggono pe teke uamatoto tamiuoum o nan, dohe me turung bulaua tapokis uakapa tun tamiuoum tar uadouhinar marein.
66003003	Recommendation	Namana tapokis tar haua ko kaleig, karo longoroig, uakeluk taninin, karo uapalih tenang niguataniner sa. Bo geta hikia paho tentur, karo guata tar puhonene, inggo u turung la sirame tar ueuenau, doh ingga hik paho turung ate tang hingiar binaka ru lameo totomua.”
62003007	Recommendation	Ro bung tug! Ahik pah mung longoro me tang sioko gere uelour tamiuoum. Teeit mai gere guata tar hauar uia, inggon a kodkodoh te misiana kompe tatanon ger kodkodoh.
62004001	Recommendation	Ro bung kaloug! Ahik pah mung uolong tagorong man tas mais ra kula pare, ra kale teil tar iaben. Bo mung uedanga baka tasisina ge pare, la turur iabeneit ra kale teilisisina tang God. Ge o burehe per propet bohoboh ra uangoul ueltebeir.
44013038	Grace	“Temaeit inggoum ro bung tahig, inggo u malahir pare, pakung ateoum pare, te Iesu puk manas, song re banoto God e kuse luara liu teremi niguata uasaoum.
50003001	Recommendation	Ro bung uanotoug, tar uakapa tar puhung uelhirenine, inggo u marang kula sira pare, inggoum mu uaha tar Tamata Noman. Ahik paha sa totoguo tar bolo polukula tamiuoum tar haua ku hiregio sioun tamiuoum, ginin pake terung kapil uaia tunugioum.
46011034	Recommendation	Mai tamiuoum, re gog, inggono pake ein to baka tena um, maeit ahikir uelpokosor namiuoum pahe kedangain God pare, a sa. Doh tar giniameher puhunit re mok, inggo u me banga taninin getu tapokisime.
43018031	Description	Doh Pailat ke kula tapokis tasisina pare, “Mu me kale tatanono marung la kodohoum tang hingiar ualatutur namiuoum ke kategogion.” Bo gisit pukur Ju ka hire tapokis pare, “Inggeim ahik pah ra tanganasieim tar uamoko me tang siokor tamata toro mat.”
46012031	Faith	Bo inggoum mung petutup tar malara me inete uaia me i ranantiehe tun tur tar Iabena Dedeil. Gine daan Inggo u marang ualasira uaia tun tamiuoum tar hagar uaiantiehe tun.
58007026	Description	Inggono ter paterer uleik ri uahingaieig, teeit inggon a dedeil, kara hik pah ke guata uasa me inet, doh inggon a niuatur liu sioko tasir tamatang guata tar niguata uasa, ka uairana uainin tar mamang ineteliking Heuen.
50004013	Faith	Ge inggo pe u banotong guata keip tar mamang hagarilik tena nitampopokoho Kristo gere uoto heir totoguo tar nitampopokoh.
52004003	Recommendation	God e malara pare, inggoum mu uadedeil tar tukunumiu uakapa tun, karung tur uagele toro ur.
51004002	Recommendation	Mu gulet karung lotu keip dede teremi nitagorong man, karung banga uaia dede gete pokoso me puh, karung heir dede tar uatakai tang God,
44007029	Description	Tar binak ke longorono tar puhon, inggono ke sokoro gete ate Pero, kare ualonguala i Midia. Teke la uangoul sirono pare, a pokos, kare lengua. Inggono ke uakotpokosongua tar tang torikir tun.”
46011007	Description	Bor bulout ahik tagu pahe taku uaouo toro lun, ge inggono pe tera banga toinir porene tar porene God, kare na uiniator God, bor kuah inggono tena uiniatoror bulout.
51003015	Faith	Karung uamaluana toro hiarouo gero la tur tang Kristo o uoum keip tar koloumiuoum, ge gitie pe rung uangoul teil peoum i lolono tar siokor tukunun, inggoum ra siokor kila totosioum tar uangoul toro hiarou, karung uauaha dede tatanon.
58002010	Grace	Doh auia nomananguampeono tang God geke touo tar mamang inetelik tena uiniatoro katong, doh geka touo turigir mamang inetelik, e keip ualeka toso bung tun tar butur re uangoul. Tena uelmahing Iesu, God ke guatangua tatanon a tamatang uoum keip uaia mare uelkarusono tasisin.
59004001	Sin	A hauar tengkanar uelpererinine tamiuoum? Doh ia re la turunin? Ginin e la tur tar nimalarang kapipis i lolono tar tukunun gere uoto uiliatung dede i uantinanina tamiuoum.
46005001	Sin	O mana noman, inggo ku longoro pare, o uraur o moko tamiuoum. A bulout ke kale katongo tena kuaha taman. A puhon ahik pahe uoto pokoso tagu tasir tamata gera tele tang God.
46010013	Faith	Namana huara kompe ahik me uatolaua uasanine re lame tamiuoum re giamehe sioko tanine re lame tasir tamata uakap, ge God pe a uauaman ahik pahe bangang duk tar uatolaua uasa re lame tamiuoum geta hikoum pah mung matot. Doh gete lamer uatolaua uasa tamiuoum, God e poul tamiuoum me hagar, maeit ahikioum pah mung pesiau.
44020029	Violence	Inggo u ate, i muduhia tar binaka ru hiliu baka pe inggo, o gisiameher tamata ra turung la sirame tasir lo roke tar marang uedanga tar mamantouo tasir sipsip.
53001004	Faith	Temaeit ring uoto la hahaia pe inggeim toro buturunine ra uangoul no toto tamata God, inggeim mi uoto uairana tun tamiuoum tasisin. Inggeim mi guata tar puhonene, teeit tar binaka ka heirir tamata tamiuoum tar uelmahing, kara niduh inggoum ahik pah kung uamaluan, bo kung tagorong mana dedempela tang God.
62004012	Faith	Ahik me tang sioko tagigeig ke banga tang God, bo geti uelmalahiresieig, God e uangoul tagu dede tagigeig, doh na nimalauelhiron e la uahiuo tunuhane i lolono tagigeig.
48001001	Description	O bolobolo rone o la tur tang Poul ger aposoul. Ahik me tamata ue mo tamata ka uamatoto totoguo, bo a kilonener noguo e la tur tang Iesu Kristo, doh God Tamagigeig geke uatentur tapokis tur tang Iesu toro mat.
58012003	Recommendation	O mana tun, mu namana kompe hape ke uatut pemeono tar nimatal e la tur tasir tamatang guata tar niguata uasa geka turtur tane tatanon. Inggono ke kalkale hamas tun tar uelmahing, kare huata bolongur mara hikoum pah mu maluan, karung maluana kout tar tagorong mana tang God.
45006005	Faith	Gitie ki uangoul tagu pe inggeig pare, tono maton, inggeig i turung uiliodout keipingua pono tatanono ke tua tapokis pe.
45015010	Recommendation	Doh no uelhire God o kula poluk pare, “Inggoumur gime uan mung uaha mesir Ju no tamaton.”
54004001	Sin	Bor Iabene Dedeil ke hire uakalahara tun pare, i muduhia o gisiameher tamata ra, turung tar mud toro uelhire gero man, kara uakeluk tar iabene ger bohoboh, kara uakeluk tar ualasira ger sa gera hireisir liouana uasa.
56003001	Recommendation	Taitus, o uanamana dede tasir tamatang tagorong mana ra longoro tasir tamatang uoum keip doho tamata uleikin tar gavaman, kara uakeluk tenas mamang ualatoholikisin, kara kaleuatoro tanikais tar guata me inete me hauamper uia.
61003005	Sin	Bo gisina puk ka malabobour pare, God ke mene puk, kare pokos i Heuen, kare uapopout kai tur tar pang uanene i koto tar laur, kare uamoko tar laur i tektekene uiloh.
60003018	Grace	Ge Iesu Kristo pe ke mata uasiokon sioun teres niguata uasar tamatang gane i kot. Ter tang siokor kodkodoh ke mata ueleheir tasir tamata ge ahik paho kodkodoh mare keip tasisina tang God. Inggono Kristo ka tung pousinir tukunun, kare uatua tapokisir Iabena Dedeil tatanon.
61002021	Sin	Temaeit, auiantiehe tun tasisina pare, ahik pah ra matotong ate tar hauar ineter kodkodoh, ter hauono geta atesina gisina ra turung turung tar mud dedempe tar ualatoho ger dedeil geka heirig tasisin.
53003006	Recommendation	Ro uanotoumiueim, inggeim mi ualatoho tun tamiuoum tar hanganar Tamata Noman Iesu Kristo tar uareing tasir tamat gesir manguh, kara hik pah ra uakeluk tar ualatut gekung kale turugioum tamiueim.
45005012	Sin	Temaeit a niguata uasa ke kotpokoso tur tar tang siokon siounur tamat, nu Adam, doh na niguata uasaono ke uakotpokoso toro mat. Temaeit ko la uakapangua ro mata tasir tamata uakap, teeit ka siokor guata pesina tar niguata uasa.
58011033	Faith	O tamatasinasine ka tagorong mana tang God, kara touahiua toro nitoia ka uiliatung keip pe. O gisiamehe ka guata tar puhur kodkodoh, kara kalengua tar haua ke ualapagahain God tasisin. O gisiamehe ka tagorong mana puk, maeit ka uoho uelngungut tar uauasir laion,
47004009	Faith	Inggeim ka guatguata uasasieim, bo God puk ahik pah ke hiliu tamiueim. Ka uauelmahingintiehe tunusieim, bo ahik puk pah king santiehe tun.
59004004	Sin	Inggoum kung hiliu tang God misiana tar kuahetie ke hiliu tena bulout, kare ura keip tasir gisiameher bulout. Ualongor! Ue ahikioum pah mu ate pare, gete me tamata re malara tar mamang inetelikin tar kot, inggono na uelmatan God? Mair tamata re ueldokout tasir tamata gera uoto guata tar niguata uasang gane tar kot, inggon e guata katongoin pare, na uelmatan God.
44016006	Description	Poul, doh Sailas kura lihila i uantinanin tar pang uan i Prigia, dohi Galesia, rasin ke tur taneisir Iabena Dedeil matura uelhire tauete toro Uelhire Uaia tar pang uan i Esia.
45010006	Faith	Bor inete tun ro kula teilin no buk God gero dedeil tar kodkodoho tola tang God tar nitagorong man e kula pare, “Ahik paho kula pare, ‘Mai re turung la kai taro i Heuen tar keip uahiuaha tang Kristo,
66016002	Violence	A uakikilanganar anggelou ke la, kare ding uoum ter nan i rana tar uanene i kot, kare pokosonguar pang kubar, kara uelmahing uleikintiehe tun tas mais geka bubunis tena bubunur inete ger roke, kara lotu tono kaesaon.
66005008	Description	Binaka ke kaleon, a toueitir inete gesir tua, kara torikir hangaul, doha tang toueitir mamahoholik ka siokor punga uahiu i uoum tar Tunar Sipsip. Gisina uakapa tun ra siokor uoho teil tenas gita, kara kale teil tar nouh a nituha tar goul a uoun tar adua. Gininar diku e uamuhuia tenas lotur tamata gesir nang God.
62005001	Faith	Maisir tamata gera tagorong mana tang Iesu pare, Inggono ter Kristo, gisina ka kotpokoso o bung tuna God, doh mais ra malauelhir tang Tamanon, gisina ra malauelhir pono tar Tunon.
48005026	Recommendation	Inggeig ahik pahi uauairana katongosieig, kara hik pahi ueluelualahuasieig, kara hik pahi ueluelgehesieig.
54005001	Recommendation	Ahik paho louara ue o perere me mamahoholiking tar lotu, menmene hamas kompe misiana paha tamoum tatanon, karo guata sira tasir bulout kalan o bung tahim, karo guata sira tasir kuaha mahoh o bung tinoum.
60002012	Recommendation	Uangoul keip uaia dede tasir tamata gera tele tang God, maeit geta marang boho tolasina tamiuoum me niguataniner sa, ahik pah ra matoto geta banga tar niguataniner uiar namiuoum, kara uatakai puk manasa tang God tar binaka re me banga tapokis tagigeig.
50003006	Sin	Karu tampopokoho tun tar guata tar haua ku namanain pare, na kalekinale God, teeit ku petpetutup peo pare, u mamantouo tasir tamatar nang Iesu Kristo, doh ku uakeluk uaia tun tenas puhung ualatutur Ju, doh gisin ahik pah ka banga me puh uasa hape ku uakeluk peo tar ualatut.
43004052	Description	Kare dangatanguaonor tamatang tar gauaman pare, “Mangiha tunur binaka ke uiar tuguo?” Kara hiresina pare, “Nerau tar binaka ke balara sikoror pisar, teke ariana toon.”
43019031	Violence	A mareinonene a mareining kaleuator, doh tar uagiamehener marein a Mareining Pepe Uah. Kare ter marein pono ra maligomo tunin, temaeit gisisir Ju ka de mate kusa uatukur tukunusisina tar korose tar Mareining Pepe Uah, kara dangatanguasina tang Pailat pare, ra haluh goigir kekeisisina mara mata ualahur, kara kale uahiuaigir tukunus.
43019012	Description	Doh ke longoro pe Pailat tar puhon, inggono ke marang sir me hagar mara luakain Iesu mare la. Bo gisis pukur Ju ka kula ualeikintiehe tun pare, “A tamata geke guata katongoin pare, a toia, inggon e tokouasain tang Sisa. Geto luaka ingga, karo uatauete tar tamatene, ingga ahik pah kaloum tang Sisa.”
43014001	Faith	Iesu ke hire tosno tamatang uakuakeluk pare, “Inggoum ahik pahe pirikir balamiu, karung malioh, mung tagorong mana kompe tang God, karung tagorong mana pono totoguo.
50001028	Faith	Ahik pah mu sokoro tosnomio uelmatan, mu uaongolo dedempesioum tar mamang binakalik, tar uabang paroko tasisin pare, God e turung mamantouo tasisin, kare uaudeil tamiuoum.
43015016	Grace	Inggoum ahik pah tekung kedanga totoguo, bo inggo teku kedanga tamiuoum, karu heir tamiuoum tar kalekinale tar la, karung ua me bureher kukuanan. A kukuanana gere moko dedengua. Song re heir Tamouguo tar mamang inetelik tamiuoum gerung dangata tolaig tar hangouguo.
58011004	Faith	Abel ke tagorong mana puk, maeit ke heir tar uahung tang God auia uain ter nang Ken. Tena nitagorong manon, inggono ke heiringua tar niuaha tang God, kare kilangua God tatanon, a tamatar kodkodoh. Abel ke mat bo na nitagorong mana pukuon e ualasira harahampe a haua tunur nitagorong man.
46004001	Recommendation	Inggoum pakung kale sira kompe tamiueimene pare, no tamatang kalekinale Kristo. God ke uamatoto tamiueim tar kauek, karing ualasira tena uelhireono ger ouoou.
66006013	Description	O pitopit i rana tar langit ka siokor dud uahiu i kot misiana tar kukuananar douk ger murak geke pung i kot tar binaka re uagunar pang rom.
46010014	Recommendation	Temaeit, inggoum ro bung kaloug, hiliu tar lotu tasir god bohoboh.
45012021	Recommendation	Ahik pah mung uamaluana tar niguata uasa e reih uahiua tamiuoum, bo mung kale uahiua keip tar niguata uasa tar niguatar uia.
55002014	Recommendation	Timoti uanamana dedempe tar inetenine tosnongo tamat, uatagin tasisina tang God mara hikisina pah ra uelperere tar men. Ginin ahik pahe guata uaia tasisin, bo e uasuasa kompe teres nitagorong manasit ra longoro taninin.
59004008	Recommendation	La uahuhutula tang God mare la uahuhutumeono tamiuoum. Inggoumeitir uoto guata tar niguata uasa, uadelauana tar tukunumiu! Inggoumeitir torik remi ninaman, uadelauana tar ninamana uasanit re moko tar balamiu.
59002009	Sin	Bo getung guata uaia pukuoum tar tang siokor tamat misiana ter tamata uaiantiehe tar tang giameh, inggoum kung guata uasa tena ualatut God, karung kotpokos o tamatang katego tar ualatut.
