52004006	Recommendation	Ama pipas kay ruwaykunapi wawqipanankunaman sallqaykuchunchu, imaraykuchus Apu Tataqa tukuy chaykuna ruwaqkunamanqa manchaytam asut'iykunqa, imaynatachus nuqayku willachkarqaykichis ajinata.
47005017	Faith	Ajinaqa, Cristopi kaq runaqa musuq runañam kapun; ñawpaq kawsayqa tukukupunmi, chaykunataq musuq kawsaymanmi kutiripunku.
43005020	Faith	Imaraykuchus Tataqa Churinta munakusqanraykum tukuy imachus ruwasqanta rikuchin; jinataq astawan athun ruwaykunataraqmi payman rikuchinqa, kaytaq qankunaman musphachkaqtaraqmi saqisunkichis.
49004028	Recommendation	Pichus suwakuyta yacharqan chayqa, makinkunawan llank'ayta qallarispa amaña suwakupuchunchu, ajinamanta pist'achikuqkunaman imawampas yanaparinampaq.
57001022	Recommendation	Jinallataq uj qurpa wasita chayman chayamunaypaq wakirichipuway, imaraykuchus Diosqa jamunaypaq mañakusqaykichismanqa uyart'anqam, ajinamantam nuqapaq jamunayta munanqa.
58013009	Recommendation	Qankunaqa waj mana riqsisqaykichis yachachiykunataqa ama uyart'aychischu. Ima kamachiykunachus mikhunakunajawamanta rimachkan chaykunaman uyarinamanta niqtimpas, Diospaq munakuynimpi sunsunchis kallpachakunankaqmi astawan allinqa; imaraykuchus chay mikhunakunajawamanta kamachiykunaqa manam jayk'aqpas allinchu kachkarqan.
52005012	Recommendation	Wawqipanakuna, qankuna chawpipi llank'achkanku chaykunaman allintapuni rikuychis, imaraykuchus paykunaqa Apu Tatapaq ruwayninkunapim pusasunkichis jinataq ninrincharisunkichispas.
43009022	Description	Chaytaqa manchaspam ajinata tatamamanta nirqanku, imaraykuchus judiokunaqa pikunachus Jesusta Mesías kasqanmanta riqsinqaku chaykunaman judiokunapaq tantakunan wasikunamanta wijch'urqumunapaq rimakipanakusqaku.
50003003	Faith	imaraykuchus chiqampipuni circuncisión ruwasqa kachkanku chaykunaqa nuqanchismi kanchis, pikunachus Ajayuwan kallpachasqa Diosman yupaychachkanchis chaykuna, Cristo Jesuspi kasqanchisraykupas athunchakunchis jinataq manam runakunapaq puriyninkumanjina ruwaykunapi sunqunchista churachkanchischu.
62003023	Faith	Kamachiynintaq Churin Jesucristoman iyawninanchis jinataq imaynatachus pay kamachichkawanchis chaymanjina ujmanta uj munakunanchismi.
66013011	Description	Chhikamantataq kaypachamanta chimpamuq waj wak'atam rikurqani. Chaytaq mut'u uwijapaq waqranjina iskay waqrakunayuqmi karqan, chaywampas lijrayuq pallijinam rimarqan.
46014020	Recommendation	Wawqipanakuna, qankunaqa ama uña wawakunajina yuwaychischu. Mana allin ruwaykunapaq uña wawakunajina kaychis; chaywampas yuwayniykichispiqa machu runakunajina kaychis.
59005013	Recommendation	Qankunamanta mayqimpas ancha llakisqa chhikaqa Diosmanta mañarikuchun. Mayqimpas kusisqa chhikaqa q'uchukunata wankarikuchun.
58012012	Recommendation	Ajinaqa, sayk'usqa makiykichiskunapaq jinataq pisi kallpayuq qunquriykichiskunapaq kallpanta musuqmanta kallpachaychis,
60001017	Recommendation	Qankunachus sapa ujman ruwasqanmantajina jinataq mana pitapas ajllikuspa juchanchachkan chay Diosman “Tatay” nispa ninkichis chhikaqa, kaypachapi tukuy kawsayniykichispim manchariywan k'umurispa payman uyart'anaykichisqa.
58010036	Recommendation	Qankunaqa, Diospaq munayninta ruwanapaq ñak'ariykunapiqa kallpacharisqam kanaykichis, ajinamanta paypaq rimaynin qusqanta jap'iqanaykichispaq.
58011001	Faith	Iyawniyuq kayqa, imatachus “jap'iqasaqmi” nispa tukuy sunquwan suyachkanchis chaymi. Imachus kachkan chayta amapas rikuchkasun chaypaq kasqanmanta allinta yachanam.
49004017	Recommendation	Kaymi Tatapaq sutimpi imatachus niykichis jinataq kunariykichispas chayqa: ama Diosman mana riqsiq runakunajina kawsapuychisñachu, imaraykuchus paykunaqa pantasqa yuwayninkumajinam kawsakunku,
51002016	Recommendation	Chayrayku, imatachus mikhunkichis, imatachus ujyankichis chaykunamantaqa manam pipas qankunaman juch'uychasunkichismanchu, jinallataq imamantataq raymikunatapas mana ruwankichis, wawa killa p'unchaykunata jinataq samarana p'unchaykunatapas mana allimpi qhawankichischu nispaqa manam pipas nisunkichismanchu.
66007015	Faith	“Chayraykum Diospaq tiyanan ñawpaqimpi kachkanku, jinaspataq tuta p'unchaymi wasimpi payman jaywanku. Pichus tiyanapi tiyachkan chaymi kachkasqanwan paykunaman imantinmanta waqaychanqa.
44020010	Description	Chhikataq Pabloqa uraqamuspa chay waynajawaman chhuqjatakurqan jinaspataq qhumaykurqan. Wawqikunamantaq ajinata nirqan: –Ama mulljakuychischu; kawsakuchkanmi –nispa.
55002010	Faith	Chayraykum tukuy pikunatachus Dios ajllikuchkan chaykunapaq allimpi kanankurayku ñak'arichkani, ajinamanta paykunaqa Cristo Jesuspi qhispichiyta jinataq imachus wiñaypaq athunchasqa kay kachkan chayta taripanankupaq.
60005014	Recommendation	Qankunapuraqa ujmanta uj ancha munakuywan napaykurikuychis. Tukuy qankuna pikunachus Cristopaq kankichis chaykunaqa sumaq kayniyuq kaychis.
49005021	Recommendation	Cristoman uyarikuq kasqaykichisraykuqa, qankunapura ujmanta uj uyart'anakuychis.
61003017	Recommendation	Chayrayku munasqa wawqipanakuna, kaykunata ñawpaqtaña yachasqaykichisraykuqa, pikunachus saqra runakuna kanku chaykunapaq sallqaykuyninkumanta jithiqaychis, ajinamanta ama paykunawan qatatisqa kanaykichispaq, qankunapas iyawniykichista ama chinkachikunaykichispaq.
51003018	Recommendation	Qhariyuq warmikuna, qhariykichisman uyart'akuychis, imaraykuchus qankunaqa Cristopi iyaw niqkunajinaqa ajinam kanaykichis.
54005020	Recommendation	Pikunachus juchata ruwakuchkallanku chaykunamanqa, tukuypaq ñawpaqimpim k'amiykunayki, ajinamantam wakinkunaqa mancharikupunqaku.
45014013	Recommendation	Chayrayku amaña ujmanta uj nuqanchispura juch'uychakupunanchisñachu. Astawampas wawqiykichiskunapaq iyaw nisqankuta ama chinkachikunankupaq jinataq paykunapaq ama uj mitk'akuyjina kanaykichispaqmi allinta yuwarikuychis.
45002010	Grace	Chaywampas tukuy pikunachus allin kachkan chay ruwaqkunamanqa Diosqa athunchasqa kayta jinataq sumaqpi kaynintam paykunaman qunqa, ñawpaqta judío runakunaman, mana judío runakuna kachkanku chaykunamampas ajinallatataqmi qunqa.
58011034	Violence	jinallataq paykunaqa manchay lawrachkaq ninakunatam wañuchirqanku, athun kuchillukunawan wañurachisqa kanamantam phawarirqanku, jayk'aqchus sipi kallpa kachkarqanku chhikaqa kallpatam jap'iqarqanku, tupjay maqanakuykunapitaq ancha atiyniyuqmi tukupurqanku, ajinamantam chhiqnikuqninkunataqa atipjarqanku.
48006017	Faith	Kunanmanta ñawpaqmanqa manañam pipas umay nanachinawanta munapuniñachu; imaraykuchus wasaykunapim Jesucristowan ujllapi kasqayrayku ñak'ariyniykunata ch'ikulliykusqatajina apapuni.
66018021	Violence	Chhikataq uj ancha atiyniyuq angelmi uj rumita uqharirqan, chay rumitaq piqan maranaman rijch'akuqmi karqan, quchaman chhuqaykuspataq ajinatam nirqan: “Babilonia athun llaqta, ajina chhuqaykusqam qan kanki, jinaspataq manañam jayk'aqpas rikupusunkichischu.
65001020	Faith	Chaywampas qankunaqa munasqa iyawniq wawqipanamasiykuna, ancha Ch'uwa iyawniykichispi sumaq thuruta sayarikuychis. Ch'uwa Ajayuta uyarispa pusasqanmanjina Diosmanta mañakuychis.
45012002	Recommendation	Amaña kunampacha yuwaykunamanjina kawsapuychisñachu; chaymanta niqtimpas, yuwayniykichispiqa musuqmanta yuwapuychis ajinamanta qankunapaq kawsayniykichisqa astawan allin kapunampaq tukuspa, ajinamantam qankunaqa Diospaq munayninta riqsipunkichis, kaytaq niyta munan, imachus allin kachkan, imachus paypaq sunqunman chayaq kachkan jinataq imachus chiqan kachkan chaytapas riqsinaykichispaq.
46015009	Sin	Imaraykuchus nuqaqa tukuy paypaq kachasqankunamantaqa astawan juch'uymanta riqsisqam kani, chaywampas manam paypaq kachasqanmanta riqsichikunaypaq chanimpaschu kani, Diospaq iglesianman qatiykachasqayraykuqa.
62002015	Recommendation	Kaypachata jinataq imachus kaypachapi kachkan chaykunataqa ama munaychischu. Mayqinchus kaypachata munan chayqa manam Dios Tataman munachkanchu;
45002001	Sin	Qanchus wakinkunaman juchanchachkanki chhikaqa, pipas kakuchkay chayqa manam imapaqpas allinchu kachkan, chayraykum qanqa juchaykimanta mana pampachachikunkichu. Wakinkunaman juchanchaspaqa qan kikinmi juchanchakuchkanki, imaraykuchus kikin paykunapaq ruwasqantam ruwachkallankitaq.
48002009	Description	Santiago, Cefas jinataq Juanpiwan pikunachus iglesiajawapi atiyniyuq karqanku chaykunaqa, Diospaq nuqaman ajllikusqawanmantam riparakurqanku, chhikataq nuqaman jinataq Bernabemanqa mana judío kaq runakunaman sumaq willaykunata willamunaykupaq, paykunataq judío runakunaman sumaq willaykunata willamunankupaqmi uj yuwayman waykurqayku, chayta tukuy sunqu ruwasqaykumanta riqsichinapaqtaq makiykunata japthapirispam puripurqayku.
43019023	Description	Jesusta chakataykupurqanku chhikamantataq, p'achankunata pallthapispaqa sapa uj pallapallakunapaqmi tawaniqman phatmispa ch'iqirachikurqanku. Allmillantapas jap'illarqankutaqmi, chaywampas mana ch'ukuyuq uj khallumanta ruwasqa kasqanraykutaq,
45002021	Sin	Ajinaqa, wakinkunamanchus yachachinki chhikaqa, ¿imamantataq qan kikin mana yachachikunkiri? Manam suwakunachu, nispa yachachinki chhikaqa, ¿imamantataq suwakuchkankiri?
46006019	Faith	¿Qankunaqa manachu yachachkankichis Diospaq qankunaman qusqan aychaykichisqa Ch'uwa Ajayupaq wasin kasqanmanta, jinataq Ch'uwa Ajayuqa qankunapi kawsakusqanmantari? Qankunaqa manam aychaykichisjawapiqa atiyniyuqchu kachkankichis,
47005014	Grace	Jayk'aqchus uj runa tukuyninchisrayku wañusqanmanta jinataq chayrayku tukuyninchis wañupusqanchismanta yuwayakupurqayku, chhikamantapacham Cristopaq munakuyninqa nuqaykumanta jap'iykukupuwanku.
58003001	Faith	Ch'uwa llaqtapi kaq wawqipanakuna, pikunachus Diospaq kanaykichispaq paypaq wajasqan karqankichis chaykuna, Cristo Jesusqa Diospaq kachasqan jinataq Athunkaq sacerdoten kasqanmanta allinta yuwatatarikuychis.
44020035	Recommendation	Qankunamanqa yachachirqaykichispunim, ajina llank'anamanta jinataq pikunachus pist'achikunku chaykunaman yanaparinamantaqa, Tata Jesuspaq chhaqay rimayninkunata yuwarispa: ‘Qunapiqa astawan kusikuymi kan jap'iqanamanta niqtimpasqa’ –nispa.”
58013004	Recommendation	Runachakuy kawsayta jinataq ch'uwa kaynintapas tukuyninku allimpi qhawachunku; imaraykuchus millakuy khuchi ruwaykunata ruwaspa puriykachaqkunamanqa Diosmi juchanchakuchkanqa.
43020005	Description	K'uñuykuspataq chay ukhuta qhawaykurqan, chaypitaq llawuykusqa kachkarqan chay thanthakunallatam rikupurqan, chaywampas manam waykusqachu.
66016018	Description	Chhikataq llijullijukuna, kunkakuna jinataq qhunqhunkuna imam karqan, kaypacha jallp'ataq manchaytam kharkhatirqan, chaytaq runa kasqanmantapacha ajina kharkhatiy mana jayk'aqpas kaqmi karqan.
66019010	Faith	Yupaychanapaqtaq angelpaq chakinkuna chhikapim killpiykukurqani, chaywampas payqa ajinatam nirqawan: “Ama chayta yanakuchkaychu, imaraykuchus nuqaqa qanjina jinataq pikunachus Jesuspaq willasqanmanjina mana iskayakuspa qatinku chay wawqimasiykikunajina Diospaq jaywaqninllataqmi nuqapas kani” –nispa. Imaraykuchus Jesuspaq chay willayninkunam Diospaq sutimpi willaqkunamampas yuwayta qun.
46002010	Grace	Kaykunam imakunatachus Diosqa Ajayuniqta riqsichichkawanchis chaykunaqa, imaraykuchus Ajayuqa tukuytam Diospaq ancha pakaykusqa kaqninkunantinta sumaqta qhawakipan.
50002029	Recommendation	Paytaqa Tatapi kasqanchisrayku uj wawqimasinchisjinata ancha kusikuywan jap'iqarikupuychis, jinaspataq pikunachus payjina kachkanku chaykunamanqa anchatapuni munakuychis,
51003020	Recommendation	Wawakuna, tatamamaykichista imantimpi uyariychis, imaraykuchus chay ruwasqaykichisqa Diostam kusirichin.
47001012	Faith	Ujmi nuqaykuman sunquykuta kusirichiwanku, chaytaq sunquyku ukhupi allin puriykachasqaykumanta willawanku, chiqampiqa kaypachapi jinataq qankunawan kuska kawsakusqayrayku. Nuqaykuqa manam runakunapaq yachayninmanjina puriykachachkaykuchu, manachayqa Diospaq munakuy khuyapayakuynimpim sunquykuta churayku.
43014021	Faith	Pichus kamachiyniykunata jap'iqan jinaspataq uyarichkan chayqa, chiqampipuni nuqaman munakusqawantam rikuchin. Nuqaman munaqtaqa Tatay munakullanqataqmi, nuqataq payman munakullasaqtaq jinaspataq payman rikuchikusaq” –nispa.
51002023	Sin	Ujniqmantaqa kay yachachiykunaqa allinjinallataqmi kankuman, imaraykuchus imayna puriykachanamanta, llamp'u sunquyuq kanamanta jinataq aychanchis apaykachanamanta imam yachachinku. Chaywampas chiqampiqa, manam imachus runajina kayninchispi munayninchista atipanapaq yanapachkawanchischu.
64001006	Recommendation	Paykunaqa tukuy tantakuypaq ñawpaqimpim imaynatachus qan paykunaman munakunki chaymanta rimanku. Imaynatachus Diospaq sunqunman chayachkan ajinamanjina puriyninkupi purikuchkanallankupaq imakunatachus pist'achikuchkanku chaywan yanaparinaykipaq mañarikuyki.
55002023	Recommendation	Qasi qallanakuykunamanqa ama uyariychu, yachankiñam chaykunapaq maqanakuykunapi tukuchapusqantaqa.
47003018	Faith	Chayrayku tukuy nuqanchisqa manaña uyanchis pakaykusqajina kapusqanrayku, uj ispijujinam Apu Tatapaq athun kayninta qhawarichinchis, ajinamantataq pay kikimpaq uyan lantinmi juch'uymanta juch'uy purisqanchispi kutikipapunchis, imaraykuchus sapa kutim paypaq athun kayninmanta uj chhika nuqanchispi kapun, kaytaq pichus Ajayu kachkan chay Tatapaq ruwasqanmanjinam ajinata ruwakun.
58009014	Grace	Kaychus ajina chhikaqa, Cristopaq yawarninqa astawan atiyniyuqmi. Imaraykuchus wiñay Ajayuniqtam Cristoqa pay kikin uj mana juchayuq jaywayjina Diosman jaywakurqan, chay ch'uwa yawarninmi ch'uwachawanchis, ajinamanta pampachasqa kapusqanchista yachananchispaq jinataq wiñaypaq kawsaq Diosman jaywayta atinanchispaq.
44011017	Grace	Ajinaqa, Dioschu nuqanchis Tata Jesucristopi iyaw niqkunaman quchkawanchis chay kikillantataq paykunaman qun chhikaqa, ¿pitaq nuqa kani Diospaq munayninman thuruchakunaypaqri? –Nispa.
49004030	Faith	Ama Diospaq Ch'uwa Ajayumpaq llakikunanta saqiychischu, imaraykuchus wiñaypaq qhispichiyta qupusunkichis chhikaqa, chaywanmi qankunaqa Diospaq kaqninkunajina riqsisqa kanaykichispaq ch'ikulliykusqa kapunkichis.
66003003	Recommendation	Ima yachachiytachus jap'iqachkarqanki chaymantaqa yuwarikuypuni, chayman qatiy jinasptaq Diosman kutirimpuy. Manachus rijch'arisqa kachkanki chhikaqa, imaynatachus suwaqa jamun ajinatam manaraq suyachkanki chhika qanman jamusaq.
62003007	Recommendation	Wawaykuna, ama piwampas sallqaykuchikuychischu: pichus chiqan kayta ruwan chayqa chiqanmi, imaynatachus Jesusqa chiqan kachkan ajinata.
62004001	Recommendation	Munasqa wawqipanakuna, tukuy pikunachus Diospaq yuwayachisqam kayku nispa niqkunamanqa ama usqhayllata iyawniychischu, manachayqa ñawpaqta yanariychis, ajinamanta Diospaq Ajayunniyuqchu manachu chayniyuq kachkan chayta rikunapaq. Imaraykuchus kaypachaqa llulla willaqkuna junt'am kakuchkan.
44013038	Grace	Ajinaqa wawqikuna, Jesusniqta juchakunapaq pampachasqa kasqanta qankunaman willasqa kachkasqa chaytaqa yachanaykichismi.
50003001	Recommendation	Kunanqa munasqa wawqipanaykuna, Tatapi kachkaspa kusirikuychis. Imatachus qilqamuchkarqaykichis chayta wajmanta ninayqa manam nuqapaq mana allinchu kachkan, qankunapaqtaq chayqa allimpi kanaykichispaqmi kanqa.
46011034	Recommendation	Jinataq maykaqpas yariqachikun chhikaqa pay kikimpaq wasimpi mikhukumuchun, ajinamanta yanjakusqanrayku Diosqa chay tantakuyta ama juchanchanampaq. Wakin tapukuykunakaqmantaqa jayk'aqchus qankunaman rikuq jamuchkasaq chhikan allich'asunchis.
43018031	Description	Pilatoqa paykunaman ajinata nirqan: –Pusakupuychis, kamachiyniykichismanjina juchanchamuychis –nispa. Chaywampas judío runakunapaq llaqta apaykachaqninkunaqa ajinata jaynimurqanku: –Judiokunapaqqa piman wañuchinapaqpas manam atiyniyku kanchu –nispa.
46012031	Faith	Qankunaqa astawan allin kachkan chay atiykunatam anchatapuni munanaykichisqa. Nuqaqa astawan allin kachkan chay ñantam rikuchisqaykichis.
58007026	Description	Ajinaqa, pi sacerdotetachus munachkarqanchis chay Athunkaq sacerdoteqa Jesús kikinmi, payqa ch'uwa, mana uj juch'uy saqra kayniyuq jinataq mana uj juch'uy juchayuq, jucharara runakunamanta wajniqman churasqa jinaspataq janaqpachamanta niqtimpas astawan janaqpi churasqam.
50004013	Faith	Cristo kallpachasqawanraykuqa, tukuy imantintam ruwayta atiyman.
52004003	Recommendation	Diosqa qankunapaq ch'uwa kanaykichistam munan, manam qankunapaq millay khuchi ruwaykuna ruwanaykichista munachkanchu,
51004002	Recommendation	Diosmanta mañarikuspa payman yuspäraspa jinataq allinta qhawaqarikuspapuni puriykachakuychis.
44007029	Description	Kayta uyarispataq Moisesqa phawaripurqanmi, jinaspataq Madian jallp'aniqman puripurqan. Chaypim puriq runajina kawsakupurqan, chaypitaq iskay wawakunayuq kapurqan.
46011007	Description	Qhariqa manam umanta qatqatakunanchu, imaraykuchus payqa Diospaq uyampas kanman ajinam, jinallataq Diospaq athumpi kaynintam rikuchin. Chaywampas warmikaqqa qharipaq athumpi kaynintam rikuchillantaq,
51003015	Faith	Cristopaq sumaqpi kaynintaq sunquykichispi tiyaykusqa kachun, imaraykuchus kayta yuwaspam Diosqa uj sapa aychaman tukunaykichispaq wajasunkichis. Jinaspataq imantinmanta Diosman yuspärakuspapuni kawsakuychis.
58002010	Grace	Tukuy imakaqpas Diospaqmi jinataq paypaq ruwasqanmi, payqa tukuy wawankuna qhapaq kaynimpi kanankutam munan. Chayraykum Diosqa ñak'ariyniqta pichus wawankunapaq Qhispichiqnin kachkan chay Jesucristoman uj chiqan runaman tukuchirqan.
59004001	Sin	¿Maymantataq qankunapura tupjanakuykuna jinataq maqanakuykuna jamunkuri? Qankunapaq sunquykichis ukhupi mana allin munapayaykuna kachkan chaykunamantam jamunku.
46005001	Sin	Qankunamanta ujkaq kikin tatampaq warminwan, paypaq warmimpas kanman ajina tiyaykukusqanmanta yachakun. Kayjina millay khuchi ruwayqa ancha mana allimpunim, imaraykuchus mana iyaw niq runakuna chawpipipas manam chayjina ruwaykunaqa ruwakunchu.
46010013	Faith	Qankunaqa manam runapaq mana atinanjina ñak'ariy yanariykunaman jalaykuchkankichischu. Jinaspataq Diosman sunquykichista churawaqchismi, imaraykuchus payqa qankunapaq mana atinaykichisjina ñak'ariy yanariykunaman jalaykunaykichistaqa manam saqichkasunkichischu. Astawampas, jayk'aqchus yanariykuna chayamunqa chhikaqa, Diosllataqmi chay yanariykunamanta lluqsinaykichispaq uj ñanta rikuchisunkichis, ajinamanta qankunaqa atipanaykichispaq.
44020029	Violence	Allinta yachani puripusqaymantaqa wajkuna millay saqra atuqkunajina iglesiata t'unarqunapaq jamunqaku.
53001004	Faith	Chayraykum nuqaykupas sunqu junt'asqapuni waj chhikakunapi kachkanku chay Diospaq iglesiankunaman qankunamanta willayku. Imaraykuchus qankunaqa ancha mana walt'aykuna kachkaqtimpas sumaq kallpacharisqapunim iyaw nisqaykichispi kachkankichis.
62004012	Faith	Diosmanqa jayk'aqpas manam pipas rikurqanchu. Chaywampas nuqanchispurachus ujmanta uj munakuywan kawsakusunchis chhikaqa, Diosqa nuqanchispim kawsan, munakuynintaq sut'intam nuqanchispi rikukupun.
48001001	Description	Mana runakunapaq kachasqan, manachayqa kikin Jesucristopaq jinataq pichus payman kawsarichimuchkarqan chay Dios Tatapaq kachasqan nuqa Pablo,
58012003	Recommendation	Chayrayku Jesuspaq ruwasqanmanta yuwarikuychis. Achkha jucharara runakunam paytaqa chiqnikurqanku jinataq ñak'arichirqanku, chaywampas payqa astawanmi ñawpaqman puriykurqan. Chayrayku qankunaqa ama sayk'uychischu, manataq iskayakuychispaschu.
45006005	Faith	Cristowanchus wañuynimpi ujlla kapurqanchis chhikaqa, kikillantataqmi wañusqamanta kawsarimuynimpiqa paywan ujlla kapusun.
45015010	Recommendation	Waj chhikapiqa, Qilqasqakunaqa ajinatam nin: “¡Llaqtakuna, Diospaq llaqtanwan kuska kusikuychis!” –Nispa.
54004001	Sin	Qhipa p'unchaykunapi wakinkunaqa iyaw niyninkuta chiriyachikupunqakum, llulla ajayukunawan sallqaykuchikunqaku jinataq millay saqra supaykunapaq yachachiyninkunatam qatinqaku, ajinata nispaqa sut'intam Ch'uwa Ajayuqa willawanchis.
56003001	Recommendation	Llaqtajawapi kurajkaqkunaman jinataq atiyniyuqkunaman uyart'anankupaq tukuy wawqipanakunaman yuwatatarichiy, paykunaqa uyart'akuq jinataq allin ruwaykuna ruwanapaqqa usqhayllapuni kachunku.
61003005	Sin	Chayjina yuwaq runakunaqa, ñawpaq pachakunamanta janaqpacha jinataq kaypachapas tiyt'achisqa kapusqanmantaqa manam riparakuyta munachkankuchu, mayqinkunatachus Diosqa rimayninwanmi unu ukhumanta lluqsichimurqan jinaspataq unu chawpipim kachikuchkan.
60003018	Grace	Imaraykuchus Cristo kikinmi uj kuti wiñaypaq juchanchiskunarayku wañuyninta ñak'arirqan. Payqa mana juchayuqmi karqan, chaywampas mana allin ruwaqkunaraykum ñak'arirqan, ajinamanta qankunata Dios qayllaman chayachinapaq. Runa kasqanraykum wañurqan; chaywampas ajayuniqpi uj sumaq kawsayniyuqmi wañusqamanta kawsarimpurqan,
61002021	Sin	Paykunapaqqa allinraqmi kanman karqan chiqan ñanta mana riqsinankuqa. Chaywampas kunanqa yachapunkuñam, Diosmanchus manaña uyart'apunqaku chhikaqa, ñawpaqmanta niqtimpas astawanraqmi tukupunqaku.
53003006	Recommendation	Wawqipanakuna, Tata Jesucristopaq sutimpi kamachiykichis: maykaq wawqipanachus mana uyart'akuspa puriykachan jinataq ima yachachiykunatachus saqirqaykichis chaymanjina mana puriykachan chaymantaqa jithiqaychis.
45005012	Sin	Uj runaraykullam kaypachaman juchaqa waykumurqan, chay juchaniqtataq wañuy waykumurqan, ajinamantam chay wañuyqa tukuyninkuman chayamun, imaraykuchus tukuninkum juchata ruwarqanku.
58011033	Faith	Iyawniyraykuqa achkha suyukunatam atipaspa jap'iykukurqanku, chiqan kaywanmi apaykacharqanku, chayraykutaq imatachus Diosqa qunapaq rimayninta quchkasqa chaytam jap'iqarqanku, jinataq machuq'arakunapaq siminkunatapas wisq'aykusqatam kachirqanku,
47004009	Faith	Qhatiykachasqam kayku, chaywampas manam mana tumpaqniyuq kachkaykuchu; urmachiwankum chaywampas manam t'unarquchkawankuchu.
59004004	Sin	Qankunaqa manam Diostaqa munankichischu, manallataq uyarinkichispaschu. ¿Kaypachawan sumaqpi kayqa Dioswan mana allin kana kasqantaqa manachu yachankichisri? Maykaqpas kaypachawan allimpi kayta munaqqa Diospaq chiqnikuqninmanmi tukupun.
44016006	Description	Ch'uwa Ajayuqa, Asia suyuniqkunapi sumaq willaykuna mana willakunanmanta munasqanraykuqa, Frigia jinataq Galacia suyuniqkunaman puripurqanku,
45010006	Faith	Chaywampas iyawniypi saruykusqa chiqan kachkan chaykaqmantataq, ajinatam nikun: Ama ajinata tapukuychu: ‘¿Pitaq janaqpachaman chimpanqari?’ –Nispaqa, –kayqa Cristopaq uraqamunampaqmi;
66016002	Violence	Ñawpaqkaq angel purirqan jinaspataq kaypacha jallp'a patamanmi pusillunta jich'awachamurqan; chhikataq tukuy pikunachus wak'apaq ch'ikullinniyuq karqanku jinataq lantintapas yupaycharqanku chay runakunamanqa uj manchay nanaykukuq lliqi unquymi jap'iykurqan.
66005008	Description	k'iruykusqa kachkarqan chay qilqasqata jap'iqtinjinataq, tawantin kawsachkaqkuna jinataq iskaychunka tawayuq machulakunantin chay Uwijapaq ñawpaqimpi killpiykukurqanku. Tukuy paykunam jasp'ina arpakunayuq karqanku jinataq kupala junt'a pusillukuna aparisqam karqanku, mayqinkunachus ch'uwa llaqtapaq mañakuyninkunam.
62005001	Faith	Tukuy pikunachus Jesuspaq Mesías kasqanta iyawninku chaykunaqa, Diospaq wawankunam kanku; jinataq pichus uj tataman munakun chayqa, chay tatapaq wawankunatapas munakullantaqmi.
48005026	Recommendation	Ama umanchista uqharikusunchischu, manallataq nuqanchispurapas apthapinakuq jinataq chhiqninjakuq kasunchu.
54005001	Recommendation	Sunquyuq machulakunamanqa ama k'amiykuychu; manachayqa tataykipas kanman ajinata kunariy, ajinallatataq waynakunamanqa kurajniyki manachayqa sullk'aykikunapas kankuman ajinata rikuriy.
60002012	Recommendation	Diospi mana iyawniq runakuna chawpipi kachkankichis chhikaqa allintapuni puriykachakuychis. Ajinamantam paykunaqa kunanchus qankunamanta mana allinkunata rimachkanku chhikaqa, chiqan runakuna kapusqaykichista riparakuspaqa Diosmanmi yupaychanqaku, jayk'aqchus payqa tukuyman juchanchaq jamuchkanqa chay p'unchayqa.
50003006	Sin	chay tukuytapuni tukuy sunquwan fariseokunapaq kamachiyninta junt'ay munaq kasqayraykuqa iglesiapi kaqkunatam qatiykachaq karqani. Jinataq chay kamachiypi imatachus juchanchanapaq nichkan chaykaqmantaqa manam pipas imata nichkawanmanchu karqan, imaraykuchus chay kamachiytaqa chiqampim junt'aq karqani.
43004052	Description	Paytaq, jayk'a pachamantataq churinqa k'uchiyayta qallaripurqan nispam paykunaman tapurirqan, paykunataq ajinata jaynirqanku: –Qayna p'unchay ñaqa kuska p'unchaymanta uj pachamantam, lliqti q'uñi unquyninqa uraqapurqan –nispa.
43019031	Violence	Pascua raymi p'unchaymanta ñawpaqkaq p'unchay karqan, judiokunataq samarana p'unchaypiqa ayakunata manam chakanapi chakataykusqapacha qhiparananta munaqchu karqanku, imaraykuchus chhaqay pachapiqa chay samarana p'unchayqa, tukuy samarana p'unchaykunamanta niqtimpas astawan kurajkaqmi karqan. Chayrayku chakatasqakunapaq usqhayllata wañupunankupaqqa phaka tullunkunata p'akiranapaq paykunaqa Pilatoman mañarqanku, ajinamanta ayakunata apaqampunankupaq.
43019012	Description	Chay chhikamantapacha Pilatoqa imaymanamanta Jesusman kacharipunapaq maskachkarqan; chaywampas judiokunaqa ajinata waqach'akurqanku: –¡Kachawachanki chhikaqa, manam athun suyukuna apaykachaqpaq wawqimasinchu kachkanki! ¡Maykaqpas qhapaq suyu apaykachaq kani nispa niqqa athun suyukuna apaykachaqman chhiqnikuqmi! –Nispa.
43014001	Faith	“Qankunaqa ama llakikuychischu. Diospi iyaw niychis jinataq nuqapipas iyaw nillaychistaq.
50001028	Faith	Chhiqnikuqniykichiskunataqa ama manchaychischu. Qankunachus kallpawan sayarikunkichis chhikaqa, imaynatachus chay chhiqnikuqniykichiskuna t'unarqusqa kanqaku chaytam rikunkichis, qankunataq qhispisqam kankichis, imaraykuchus Diosmi atipanaykichispaq kallpata qusunkichis.
43015016	Grace	Qankunaqa manam nuqata ajllikuchkawankichischu, manachayqa nuqam qankunata ajllikuykichis, jinaspataq purispa achkha urikunata urichimuychis, chay urikunataq wiñaypaq kachun nispam kunariykichis. Ajinamantam Tataqa tukuy imatachus sutiypi mañarikunkichis chayta qusunkichis.
58011004	Faith	Iyawniyraykum Abel runaqa Caín wawqinmanta niqtimpas astawan allinkaq jaywayta Diosman jaywarqan, chayraykum Diosqa payman chiqan runamanta riqsipurqan jinaspataq jaywasqankunatapas sumaqta jap'iqarqan. Ajinaqa Abel runa wañupun chhikapas, iyaw nisqanniqtam rimapayakuchkallawanchis.
