58011007	Faith	Iyawniyraykum, Noé runaqa Diosman uyart'arqan jinataq wasimasinkuna qhispichinapaq athun yamputapas ruwallarqantaq, jayk'aqchus Diosqa imaymana manaraq rikukuq ruwaykuna ruwakunanmanta willachkarqan chhikaqa. Chay iyawniyraykullataqmi Noé runaqa kaypacha runakunaman juchanchaykurqan, jinaspataq iyawniyniqtam imachus chiqankaq kachkan chay jap'iqaq runaman tukupurqan.
58009006	Description	Tukuy imapas ajinamanta wakicharisqam karqan chay yupaychana chhikapiqa. Sacerdotekunaqa sapa p'unchaymi chay Ch'uwa chhikaman yupaychay purichinapaq waykurqanku.
44007051	Sin	Estebanqa ajinata rimarqukuchkallarqanmi: “Chaywampas qankunaqa mana uyarikuq ancha k'ullu runakunapunim karqankichis, jinataq waj dioskunaman yupaychaq runakunajina ninriyuq jinataq sunquyuqmi kankichis. Ch'uwa Ajayuwan jap'inakuchkankichispunim. Ñawpaq machulaykichiskunajinam kankichis.
54001009	Sin	Kamachiyqa manam pikunachus allin kaqta ruwanku chaykunapaqchu kachkan, chaytaqa yuwarikunanchismi. Kamachiyqa pikunachus mana uyarikuq, kutkatakuq, saqrakunapaq, juchararakunapaq, pikunachus mana Diosman manchanku jinataq puriynintapas, pikunachus tatankuta wañuchinku manachayqa mamankutapas jinataq tukuy runa wañuchiqkunapaq,
46005009	Recommendation	Ujkaq p'anqaypiqa, pikunachus alquchakuy khuchi ruwaypi puriykachaqkunawanqa ima rimthapiytapas ama ruwanaykichischu nispam nirqaykichis.
48001015	Grace	Chaywampas Diosqa munakuynimpim mamaypaq wijsanmantapacha nuqaman wajakurqawan.
45007015	Description	Imachus ruwasqaymantaqa manam riparakunichu, imaraykuchus manam imatachus munani chaytaqa ruwanichu, chaywampas imakaqtachus chhiqnikuni chaykaqtapunim ruwani.
61003018	Faith	Chaywampas Tatanchis jinataq Qhispichiqninchis Jesucristoman sumaqta riqsiychis jinataq munakuynimpi wiñaychis ¡Athun kayqa kunampas jinataq wiñaypaqpas paypaq kachun! Ajina kachun.
46004010	Description	Nuqaykuqa, Cristorayku pisi sunqupas kaykuman ajinamanta rikusqam kayku; qankunakaqtaq ch'ikikunapas kawaqchis ajinamanta Cristorayku riqsisqa kankichis. Nuqaykuqa pisi kallpakuna kayku, qankunakaqtaq kallpayuq kankichis. Nuqaykumanqa juch'uychawanku, qankunakaqmantaq athumpi kachisunkichis.
60005009	Faith	Iyawniypi sumaqta sayarikuspa payman saykataychis, tukuy kaypachapi qankunapaq wawqipanaykichiskunapaq qankunajinallataq ñak'arisqankuta yachaspa.
51003022	Recommendation	Jaywaq wata runakuna, kaypachapi kaq wasiyuqniykichiskunamanqa imantimpi uyart'aychis, ama paykunawan allimpi rikusqa kanapaq qhawachkasunkichis chhikallaqa, manachayqa Apu Tataman mancharispa chiqan sunquwan ima ruwanapipas uyart'aychis.
66017012	Description	“Chay chunka waqrakunata rikuchkarqanki chaykunaqa, manaraq qhapaq suyukuna apaykachayta qallarichkanku chay chunka qhapaq suyu apaykachaqkunam kanku. Chaywampas uj pachallam wak'awan kuska atiyta jap'iqaspa qhapaq suyukunata apaykachanqaku.
46002012	Grace	Nuqanchisqa manam kaypacha ajayutachu jap'iqachkanchis, manachayqa Diosmanta jamuq ajayutam jap'iqanchis, ajinamanta Diosqa munakuynimpi imakunatachus quchkawanchis chayta yachananchispaq.
59005001	Recommendation	¡Qhapaq runakuna, kayta uyariychis! ¡Waqaychis jinataq qapariychis ima ñaq'ariykunachus qankunajawaman jamuchkanqa chaymantaqa!
66002010	Recommendation	Imaynatachus ñak'arinayki kanqa chaymantaqa ama manchaychu, imaraykuchus Supayqa qankunamanta wakinkunataqa wisq'ana wasikunamanmi churaykunqa, ajinamanta tukuy qankunaqa yanarisqa kanaykichispaq; jinaspam qankunaqa chunka p'unchaykuna ñak'arinkichis. Wañunayki p'unchaykama ama iskayakuspa sayarikuy, chay ruwasqaykimantataq nuqaqa kawsaytam qusqayki.
54006011	Recommendation	Timoteo, qanqa Diospaq jaywaqninmi kanki, chayrayku tukuy mana allinkunamanta jithiqay. Diosman uyariyta jinataq Jesucristopaq yachaqaq qatiqnin kaytapuni munay. Amapuni iyaw niykita chinkachikuychu jinataq tukuy wawqipanakunaman munakuy. Jayk'aqchus mana walt'aykuna qampaq kanqa chhikaqa, llamp'u sunquyuq kay jinataq wakinkunawanqa munakuq sunquyuq kallaytaq.
59005005	Sin	Kay pachapiqa imantin patapim qankuna qhapaq runakunaqa kawsakunkichis. Chaytukuytapuni wakajina wirayaykuspaqa wañurachina p'unchaypaqmi ajinata wirayaykunkichis.
66004004	Description	Tiyana muyuriypiqa waj iskaychunka tawayuq tiyanakunatam rikurqani, chaykunapitaq iskaychunka tawayuq machulakunam tiyarachkarqanku; paykunataq yuraq p'achawan p'achallt'asqam karqanku, umankupitaq uj quri pilluwan churqatasqam karqanku.
66018007	Description	Imaynatachus payqa uma uqharinaman jinataq munasqanta yanjakuspa puriykachanaman churakuchkarqan chaymanjina ñak'arichiychis. Imaraykuchus sunqun ukhupiqa ajinatam nichkan: ‘Kaypim qhapaq suyu apaykachaq warmijina tiyachkani. Manam sapayaq warmichu kachkani, manallataqmi jayk'aqpas ñak'arichkasaqchu’ –nispa.
60003007	Recommendation	Qankunakaqwantaq qharikuna, warmiykichiskunawan llamp'u sunquyuq kaychis. Paykunapaq t'ikajina kasqankuta ama qunqakuspa imaynatachus rikuna kachkan ajinata paykunaman athumpi kachispa rikuychis. Imaraykuchus paykunaqa ima kawsaytachus Diosqa tutipijina qusunkichis chaypi qankunawan kuska kawsakunaykichispaq wajasqam kanku. Qankunachus ajinata ruwankichis chhikaqa, mañarikusqaykichista Diosqa uyarinqam.
54002012	Recommendation	Manam warmikunapaq tukuypaq ñawpaqimpi yachachinankuta jinataq qhariman apaykachanankutapas munachkanichu. Paykunapaq jup'alla kanankutam munani,
46001009	Faith	Diosqa imata qunapaq rimayninta qun chhikaqa junt'ampunim, jinaspataq paymi Churin Jesucristo Tatanchiswan kuska ujllapi kawsakunaykichispaq wajasunkichis chayqa.
48005013	Recommendation	Wawqipanakuna, qankunaqa qhispichiyman wajasqam kapunkichis. Chaywampas chay kacharisqajina kawsayniykichistaqa, ama munasqaykichismanjina tukuy imata yanjakuspa qasiman tukjachiychischu. Astawampas qankunapura munakuywan jaywanakuychis.
59002012	Recommendation	Qankunaqa maykaq kamachiychus qhispichiyta apamuwanchis chaymanjina juchanchasqa kanapaqjinam rimanaykichis jinataq puriykachanaykichispasqa.
46012005	Faith	Imaymanamanta jaywanan kan, chaywampas tukuy chay jaywaykunaqa uj sapa kikin Apu Tatapaq kamachisqallanmantam jamun.
45009005	Description	Machulanchiskunapaq mirayninmanta jamuq runakunam kanku; Mesiastaq runajina jamuspaqa paykunapaq masinkunamantam jamurqan, pichus tukuy imakunajawapi Diosmi, paytaq wiñaypaq yupaychasqa kachun. Ajina kachun.
47001006	Description	Nuqaykuchus ñak'ariyku chhikaqa, qankunapaq sunquchasqa jinataq qhispisqa kanaykichispaqmi; Dioschus nuqaykuman sunquchawanku chhikaqa, qankunapaq sunquchasqa kanaykichispaqmi, jinataq imayna ñak'ariykunatachus nuqayku apayku kikillantataq qankunaqa kallpacharikuspa chay ñak'ariykuna apayta atinaykichisqa.
47001021	Faith	Diosllataqmi pichus nuqaykuta jinataq qankunata Cristoman ujchaspa thuruta sayaykuchiwanchis jinataq makinman churapuwanchis.
44010015	Recommendation	Chay kunkaqa wajmanta rimapayaspa ajinata nirqan: “Imatachus Diosqa picharachkan chaytaqa ama qhillim nispa niychu” –nispa.
66018009	Sin	Mayqin qhapaq suyu apaykachaqkunachus paywan millay khuchi ruwaykunata ruwarqanku jinataq imachus munasqankuta yanjakurqanku chaykunaqa, jayk'aqchus payta q'usñi ukhupi ruphaykuchkaqta rikunqaku chhikaqa anchatam waqanqaku jinataq qaparinqaku.
43014023	Faith	Jesustaq payman ajinata jaynirqan: –Pichus munakuwan chayqa rimayniykunataqa uyarinmi; Tataytaq payman munakunqa, jinaspataq Tataypiwan nuqawan paywan tiyakuq jamusaqku.
62004010	Grace	Chiqan munakuyqa manam nuqanchis Diosman munakusqanchispichu taripakuchkan, manachayqa Churinta kachamuspa nuqanchisman munakusqawanchista rikuchiwanchis ajinamanta jaywayniqta juchanchiskunamanta qhispisqa kananchispaq ruwachkarqan chaypim munakuyqa taripakun.
62001007	Faith	Chaywampas imaynatachus Dios k'anchaypi kachkan ajinata k'anchayllapitaq kawsakunchis chhikaqa, nuqanchispurapas ujchasqallataqmi kanchis, Churin Jesuspaq yawarnintaq tukuy juchanchiskunamantam mayllaqawanchis.
48004007	Grace	Ajinaqa, manañam wata runajinachu kapunchis, manachayqa Diospaq churinmi kapunchis; paypaq churin kapusqanchisraykutaq, paypaq kawsayninkunamanta tuti tupaqinchista jap'iqasunchis.
58001008	Faith	Chaywampas Churinkaqmantaqa ajinatam nin: “Qhapaq suyuykijawapi atiyniykiqa wiñaypaq wiñaynintimpaqmi kanqa, chay atiyniykitataq chiqan kaypaq allin kanampaqmi apaykachanki.
43010033	Sin	Judiokunataq payman ajinata jaynirqanku: –Manam maykaq sumaq ruwaykuna ruwasqaykimantachu, manachayqa rimayniykikunaqa Diospaq ñawpaqimpi mana allin kasqanraykum tiqirqusqaykichisqa. Uj qasi runallam qan kanki, chaywampas qan kikin Diosman tukuyta munachkanki –nispa.
66014011	Description	Pikunachus wak'aman jinataq lantinman yupaychanku chaykunapaq jinataq sutimpaq ch'ikullinta jap'iqachkanku chaykunapaq ñ'akarisqanku q'usñitaq wiñaypaq wiñaynintimpaqmi chimpamun, jinaspataq manam tutapas p'unchaypas samararikunanku kachkanchu” –nispa.
47004001	Faith	Chayraykum mana iskayakuykuchu, imaraykuchus Diosmi munakuynimpi kay llank'ayta nuqaykuman kunariwanku.
58013006	Faith	Ajinaqa tukuy sunquwan ajinata nichuwanmi: “Apu Tatam nuqapaq yanapaqniyqa; manam imatapas manchachkasaqchu. ¿Imanawanmantaq runari?” –Nispa.
45014003	Recommendation	Ajinaqa, pichus tukuy imata mikhuykun chayqa, pichus wakin q'umir mikhuykunallata mikhuchkan chaykunamanqa manam juch'uychananchu kachkan; jinataq pichus q'umir mikhuykunallata mikhuchkan chayqa, manallataqmi tukuy imakunata mikhuqman juch'uychananchu, imaraykuchus Diosmi tukuyman jap'iqapun.
45015005	Grace	Chaywampas Diosmi pichus llamp'u sunquta quchkawanchis jinataq kallpacharichkawanchis chayqa. Imaynatachus Jesucristo puriykachakurqan chaymanjina tukuyniykichis kawsakunaykichista yanaparinasunkichispaq Diosmanmi mañarikuni.
58007027	Description	Jesusqa manam waj Athunkaq sacerdotekunajina uywakunata wañuchispa sapa p'unchay, ñawpaqta paypaq juchankunamanta chhikamantataq llaqtapaq juchankunamanta Diosman jaywananchu kachkan. Manachayqa jayk'aqchus pay kikin wañuspa jaywakuchkarqan chhikaqa uj kutillam wiñaypaq jaywananta qupurqan.
62003017	Sin	Ujchus qhapaq runa jinaspataq wawqimpaq pist'achikusqanta rikun, chaywampas mana yanaparichkan chhikaqa ¿Imaynatataq Diospaq munakuyninqa sunqun ukhupi kanmanri?
47005008	Faith	chaywampas manam kacharisqajina kachkanchischu, astawampas kay aychanchista saqiwachaytam munachuwanqa, ajinamanta Apu Tatawan kuska kawsakuq puripunanchispaq.
60002011	Recommendation	Munasqa wawqipanakuna, kaypachapi puriq runakunapas kachkawaqchis ajinatam mañarikuykichis, kawsayninchiswan jap'inakuq aychapaq munapayayninkunawanqa amapuni atipachikuychischu.
60002017	Recommendation	Tukuy runakunaman allinta rikuychis. Wawqipanakunaman munakuychis, Diosman athunchaychis jinataq athun suyukuna apaykachaqmampas allinta rikuriychis.
44007025	Description	Chayta ruwaspataq, Moisesqa ichapas israelita wawqinkuna payniqta chay ñak'ariykunamanta Dios qhispichinman nispa riparakunankutam yuwachkarqan; chaywampas paykunaqa manam riparakurqankuchu.
50003002	Violence	Chay mana imapaq allin runakunamanta, mana allin llank'aqkunamanta jinataq pikunachus uj chhikan aychata ñak'aqachkanku circuncisionta ruwachikunaykichismi nispa chaykunamantaqa, qhawaqarikuspa jark'aqarikuychis;
56001016	Sin	Paykunaqa Diosta riqsiyku nispam ninku, chaywampas ruwayninkunawanqa Diosman mana riqsisqankutam rikuchichkanku. Paykunaqa chhiqnikuqkuna, mana uyart'akuqkuna jinataq ima allin ruwaykunatapas mana ruway atiqkunam kanku.
45010002	Faith	Paykunamanta rimqatakuspaqa ajinatam niyman: paykunaqa Diosman jaywayta munankum; chay jayway sunqu kasqankullam chiqankaq yachaypi mana saruykusqa kachkan.
47001004	Grace	Paymi tukuy ñak'ariyninchiskunapi sunquchariwanchis, ajinamanta nuqanchisqa pikunachus ñak'arichkanku chaykunaman sunqucharinallanchispaqtaq imaynatachus payqa sunqucharichkawanchis kikinta ruwaspa.
55002015	Recommendation	Dioswan allin runamanta jap'iqachikunaraykuqa imantin ruwanaman churakuy. Ajinamantam Diosqa mana imakaqmantapas p'inqakuyniyuq llank'aqmanta jinataq imachus chiqan kachkan chay willaynin chiqan willaqninmanta jap'iqapusunki.
53002004	Description	Kay runam Diospaq chhiqnikuqnin jinataq tukuy Diosman jaywasqa kachkan chay mana munaqqa. Diospaq wasintimpim tiyaykukunqa jinaspataq pay kikinmi nuqam Dios kani nispa ninqa.
49006004	Recommendation	Qankuna tatamamakunataq amapuni wawaykichista phiñachiychischu, manachayqa imaynatachus Apu Tataqa munachkan ajina chiqan kawsayniyuqta yachachikuychis.
45008037	Grace	Chaywampas tukuy kaykunamantaqa, pichus munakuchkawanchis chayniqta atipaqpunim lluqsimpunchis.
44026014	Violence	Tukuyniyku pampaman chhuqakurqayku, jinaspataq hebreo rimaypi nuqaman ajinata niq uj kunkata uyarirqani: ‘Saulo, Saulo, ¿imamantataq qatiykachachkawankiri?’ ‘Qan kikinmi chhuqrichakuchkanki, imaynatachus uj ari takarpuman jayt'achkawaq ajinata’ –nispa.
66002009	Sin	Ñak'ariyniykikunata jinataq pist'achikuypi puriykachakusqaykitapas nuqaqa riqsinim, chaywampas qhapaqmi kakuchkanki. Pikunachus judío runakunam kayku nichkanku chaykunapaq qanjawamanta mana allinkunata rimanku chaymantapas yachallanitaqmi, chaywampas paykunaqa Supaypaq tantakuq runakunam kanku.
46013006	Faith	mana chiqan kachkan chaykunamanta mana kusikuqmi kana, manachayqa chiqan kachkan chaymanta kusikuna, chaymi munakuyniyuq kanaqa.
59001021	Recommendation	Ajinaqa, tukuy qhilli kawsayta jinataq chay tukuy saqra kaykunata qankunaqa wijch'uwachaychis, jinaspataq llamp'u sunquwan sumaq willaykuna tarpusqa kachkarqan chayta iyaw nipuychis; imaraykuchus chay willaykunaqa qankunaman qhispichinapaq atiyniyuqmi.
46003006	Grace	Nuqa tarpurqani, Apolotaq qarparqan, chaywampas Diosmi pichus partusqata wiñachichkan chayqa.
66014008	Sin	Chhikamantataq iskaykaq angelqa qatirimurqallantaqmi, paytaq ajinatam nirqan: “¡Pichus tukuy suyukunata millay khuchi ruwayninkunawan machaykuchichkarqan chay Babilonia athun llaqtaqa urmaykupunmi!” –nispa.
43015014	Recommendation	Qankunachus kamachisqaymanjina ruwankichis chhikaqa wawqimasiykunam kankichis.
62005021	Recommendation	Wawaykuna llulla dioskunamanta qhawaqarikuychis.
55003006	Sin	imaraykuchus paykunaqa, may wasikunamampas lluskhuykukuchkallankum, chaypitaq pikunachus aychankupaq saqra munayninkunata mana apaykachayta atichkanku chay pisi kallpa jinataq jucharara warmikunatam sallqaykumunku.
49004015	Faith	Astawampas, munakuyqa imachus chiqan kachkan chayllatapunim rimachinawanchisqa, ajinamanta tukuy ima ruwasqanchispi juch'uymanta juch'uy astawan Cristoman rijch'akunanchispaq, pichus iglesiapaq umanmi.
49004003	Faith	sumaqpi kayniqmanta tukuyman ujchasqata kachichkan chay Ch'uwa Ajayuniqmanta jamuq ujchakuytaqa amapuni chinkachiychischu.
44009005	Description	Saulotaq ajinata tapurirqan: “¿Tata, pitaq kankiri?” –Nispa. Chay kunkataq payman ajinata jaynirqan: –“Pitachus qatiykachachkanki chay Jesusmi kani” –nispa.
60003015	Recommendation	manachayqa sunquykichis ukhupiqa uj Tatajina Cristoman athunchaychis. Imamantachus Cristopi jinataq rimaynin qusqankunapi sunquykichista churankichis chaymanta runakunaman jayninapaqqa wakicharisqapuni kachkaychis,
44007033	Recommendation	Chhikataq Dios Tataqa payman ajinata nirqan: ‘Usut'aykikunata jurqurakuy, imaraykuchus may chhikapichus kachkanki chayqa ch'uwa chhikam.
62002024	Faith	Chayrayku, ima yachachiykunatachus qallariymantapacha uyarirqankichis chaytaqa sunquykichispi pakaychis. Qallariymantapacha uyarisqaykichischus sunquykichispi qhiparapun chhikaqa, qankunapas Churiman jinataq Tataman ujchasqam kallankichistaq.
43008051	Faith	Sut'intapuni niykichis, pichus rimayniykunata uyarin chayqa manam wañunqachu –nispa.
66020011	Description	Uj athun yuraq tiyanata jinataq pichus chaypi tiyachkarqan chaytam rikurqani. Paypaq ñawpaqimpitaq, kaypachawan janaqpachawanqa mana ujtawan rikunatam chinkawachapurqanku, jinaspataq manañam may chhikapipas rikukupurqanchu.
46006013	Recommendation	Ajinataqa nikullantaqmi: “Mikhuyqa wijsapaq churasqa, wijsataq mikhuypaq churasqallataqmi” –nispa. Chayqa ajinapunim, chaywampas Diosmi chay iskayninman tukjachinqa. Chaywampas aychanchisqa manam alquchakuy khuchi ruwaykunapaq churasqachu kachkan, manachayqa Tatapaq churasqam, Tatataq aychanchispaq churasqallataqmi.
45006011	Faith	Ajinallatataq qankunaqa juchapaqqa wañusqajina kapuychis, chaywampas Dioskaqpaqqa, Cristo Jesuswan ujchakuspa kawsachkaq kapuychis.
47002014	Faith	Diosqa yuspäray qusqa kachun, imaraykuchus atipanamampunim payqa Cristoniqta pusachkawanchis, nuqanchisniqtataq sumaq willayninkunata riqsichin, maykaqchus uj sumaq q'apachkaq jampijina tukuyniqman ch'aqch'uwachakun.
62001005	Grace	Kaymi mayqin willaytachus Jesucristo yachachichkarqawanku chayqa, chaytataq qankunamanmi willapuykichis: Diosqa k'anchaymi, paypitaq manam ima ch'amakapas kachkanchu.
43006037	Grace	Tukuy pikunatachus Tatay quchkawan chaykunaqa nuqaman jamunku; nuqaman jamuqkunamantaq, manam jawaniqman chhuqawachachkasaqchu.
58013001	Recommendation	Qankunaqa wawqipanamasintinjinaqa amapuni sumaq munakuywan rikunakuyta saqiychischu.
58007025	Grace	Chayraykum tukuy pikunachus Diosman qayllachakunku chaykunataqa payniqta wiñaypaq qhispichiyta atin, imaraykuchus paykunarayku Diosmanta mañakunapaqqa wiñaypaqmi kawsan.
43019015	Violence	Chaywampas paykunaqa ajinata waqach'akurqanku: –¡Wañuchun! ¡Wañuchun! ¡Chakataykuy! –Nispa. Pilatotaq paykunaman ajinata tapurirqan: –¿Qhapaq suyu apaykachaqniykichista chakataykunaytachu mañachkawankichisri? –Nispa. Kurajkaq sacerdotekunataq payman ajinata jaynirqanku: –¡Nuqaykupaq qhapaq suyu apaykachaqniykuqa athun suyukuna apaykachaqllam, manam wajqa kapuwankuchu! –Nispa.
45011005	Grace	Ajinallataqmi kunanqa uj juch'uy puchulla qhiparapunqa, pikunatachus Diosqa munakuyninwan ajllikurqan chaykunata.
66017002	Sin	Tukuy kaypachapi kaq qhapaq suyu apaykachaq runakunam chay warmiwan khuchi ruwaykuna ruwanaman churakupunku, kaypacha runakunapas chay khuchi ruwayninkunawanmi machaykukupunku” –nispa.
45012010	Recommendation	Ujmanta ujkama wawqipanantimpurapas kachkawaqchis ajinata tukuy sunquwan munakuychis, sumaq kawsaypi yanaparikuspataq, qankunapura manchariywan rikunakuychis.
45008014	Faith	Tukuy pikunachus Diospaq Ajayunwan pusasqa kanku chaykunaqa, Diospaq wawankunam kanku.
66012003	Description	Janaqpachapiqa waj rikuchiymi rikhurirqallantaq: Uj manchay lijrayuq athun puka pallim rikhurimurqan, chaytaq qanchis umakunayuq, chunka waqrakunayuq jinataq sapa uj umapi quri pillukunawan churqatasqam karqan.
45008017	Faith	Paypaq wawankuna kapusqanchismantataq, ima tuti qunapaqchus payqa rimayninta quchkarqawanchis chaytapas jap'iqallasuntaqmi, mayqintachus Cristowan kuska jap'iqasunchis, imaraykuchus paywan kuskam ñak'arinchis ajinamanta sumaq k'anchaynimpi paywan kuskallataq kananchispaq.
54005017	Recommendation	Mayqin pusaq kurajkaqkunachus iglesiata allimpi pusanku chaykunaqa ancha allimpi rikusqam kananku, astawanraqmi pikunachus willaqkuna jinataq yachachiqkuna kachkanku chaykunaqa allimpi rikusqa kananku.
46008007	Sin	Chaywampas manam tukuyninku imachus chiqan kachkan chayta riqsinkuchu. Wakin pikunachus waj dioskunaman yupaychanapaq yacht'asqa karqanku chaykunaqa, kunankamapas ima mikhuykunachus waj dioskunaman jaywasqa kachkarqan chay dioskunaman jaywasqa kasqanta yuwaspaqa chay mikhuykunata mikhukuchkallankum; pisi kallpa sunquyuq kasqankuraykutaq, chay waj dioswan qhillichasqa kasqankuta yuwayakunku.
43015002	Grace	Nuqapaq ujkaq ch'ampaychus mana urin chhikaqa paymi p'ataqan; chaywampas uvaskunatachus urinku chhikaqa, chay ch'ampata pichararin, jinaspataq astawan urinampaqmi allich'arin.
60005003	Recommendation	Pikunachus qankunapaq makiykichispi kachkanku chaykunamanqa ama wasiyuqnimpas kawaqchis ajinata yanjaychischu, manachayqa paykunapaq uj rikuchiyjina kanaman churakuychis.
52004013	Recommendation	Munasqa wawqipanakuna, imachus wañusqakunawan ruwakuchkanqa chayta mana yachaspaqa manam qhiparapunaykichista munachkaykuchu, ajinamanta qankunaqa ama wakin mana suyay sunquyuq runakunajina llakisqa qhiparapunaykichispaq.
58011029	Description	Iyawniyraykum israelitakunaqa Puka Quchaniqta ch'aki pampapas kanman ajinata ujniqman chimpkatarqanku; chhikamantataq jayk'aqchus Egipto llaqtapi kaq runakuna kikin ruwayta munarqanku chhikataq, unu ukhuman jalaykuspam mikirakupurqanku.
44007020	Description	Chhaqay p'unchaykunapim Moisesqa paqarirqan. Paytaq ancha munay qhawaykachakuyniyuq qhari wawam karqan, tatamamankunataq kimsa killampacha wasinkullapi uywarqanku.
58005002	Grace	Kay sacerdotetaq runa kasqanrayku pisi kallpa kaynimpiqa, pikunachus mana yachachkanku jinataq juchayuq kachkanku chaykunamantaqa qhuyapayarikunmanmi;
45013012	Recommendation	Tutaqa tukukupuchkaqtin p'unchaytatampuchkanñam; chayraykum imachus ch'amakapi ruwana kachkan chaykunata saqiwachapunanchisqa, jinaspataq k'anchaywan wajmanta p'achalliykukupunanchis, imaynatachus uj pallapallaqa sumaqta p'achalliykukun ajinata.
49006009	Recommendation	Wasiyuq runakuna, qankunaqa imaynachus jaywaqniykichiskunaqa llamp'u sunquwan kawsakunku ajinata ama paykunaman manchayta quspa kawsakullaychistaq. Qankuna jinataq paykunapas janaqpachapi kachkan chay Apu Tatapaq atiynimpi kasqaykichista yuwatatarikuychis, imaraykuchus paypaqqa manam pipas waqmantaqa astawan munasqa kachkanchu.
45012015	Recommendation	Kusikuychis pikunachus kusikuchkanku chaykunawanqa, jinataq pikunachus waqachkanku chaykunawanqa waqallaychistaq.
45002005	Sin	Chaywampas k'ullu kasqaykirayku, jinaspataq mana Diosman kutirimusqaykimantaqa, kikin qan patapi asut'iykunata juchanchay p'unchaypaq tantakuchkanki, jayk'aqchus Diosqa chay p'unchay rikhurimuchkanqa chhikapaq,
44014019	Violence	Chhikataq Antioquiamanta jinataq Iconio llaqtakunamanta kaq uj judiokuna chayamurqanku, paykunataq runakunaman simita sat'ispa wajkunata yuwachipurqanku, chhikataq chay runakunaqa Pablota rumiwan ch'aqirqupurqanku, wañuchisqankuta yuwaspataq llaqta jawaniqman qatatirqumuspa aysawachampurqanku.
43013021	Description	Kayta nirqan chhikamantataq Jesusqa anchata llakirikuspa sunqunta nanarichikurqan, jinaspataq sut'inta kaytawan nirqan: –Sut'intam niykichis, qankunamanta ujkaqmi ranqaykuwanqa –nispa.
48003022	Faith	Chaywampas Qilqasqakunapiqa jucham tukuy nuqanchisman atipawanchis ninmi, ajinamanta pikunachus Jesucristopi iyaw ninku chaykunaqa Diospaq rimaynin qusqan jap'iqanankupaq.
66011007	Violence	Chaywampas jayk'aqchus willaykuna willayta tukuchapunqaku chhikataq, ukhupachamanta chimpamuq wak'am paykunaman phawqatanqa, atipjanqa jinataq wañurachinqa.
58003014	Faith	Tukuchaykamachus qallariypijina iyaw nisqanchispi tukuy sunqu Cristowan thuru sayarikuspa puriykusun chhikaqa, imachus Cristopaq jap'iqanan kachkan chaytaqa paywan kuskam nuqanchispas jap'iqallasuntaq.
45008010	Faith	Cristochus qankunapi kawsan chhikaqa, ajayum qankunapi kawsan, aychaqa jucharayku wañuyman purinampaq chaninchasqapas kachun chhikapas, Diosmi qankunaman chiqan runakunaman tukuchipusunkichis.
44007052	Sin	¿Qankunapaq ñawpaq machulaykichiskunaqa, maykaq Diospaq sutimpi willaqtataq mana chhuqrincharqankuri? Paykunaqa pichus jamunan kachkarqan chay chiqan runamanta willaqkunataqa wañurachirqankum, kunantaq chay chiqan runa chayampun chhikataq, qankunaqa ranqaykurqankichis jinaspataq wañurquchirqankichismi.
48005021	Sin	Paykunaqa runata mana allin qhawaqkuna, machaykukuqkuna, ancha thathaqkuna jinataq waj chayjinakunapiwan kanku. Imaynatachus ñawpaqpi nichkarqaykichis ajinataqa nikuchkallaykichismi, pikunachus ajinata puriykachachkanku chaykunaqa manam Diospaq qhapaq suyumpi jap'iqasqachu kachkanqaku.
43012036	Faith	K'anchayqa qankunawanraq kachkaqtin chayman iyaw niychis, ajinamanta qankunaqa chay k'anchaypaq wawankuna kanaykichispaq. Kaykunata nirqan chhikamantataq, Jesusqa puripurqan jinaspataq paykunamanta pakaykukumpurqanmi.
58003002	Faith	Imaraykuchus Jesusqa Diosman jaywanapaq uyarimpunim, imaynatachus Moisesqa Diospaq wasimpi tukuy sunquwan jaywarqan ajinata.
56003006	Grace	Imaraykuchus Qhispichiqninchis Jesucristoniqtam kurajyachkaqtaraq Ch'uwa Ajayuta quwanchis,
44004036	Description	Uj Leví runapaq mirayninmanta jamuq José sutiyuq Chipre nisqa qucha chawpi jallp'aniqpi kawsakuq runam karqan, pimanchus kachasqakunaqa Bernabé nispa sutichaq karqanku, (chaytaq: “sunquchaypaq churin” niytam munan).
48006009	Recommendation	Ajinaqa manam allin ruwaykuna ruwanamantaqa sayk'unanchischu kachkan; manachus sayk'upuchkasun chhikaqa, pachampim tarpusqanchismanta apthapiykunata uqharipusunqa.
48002019	Faith	Imaraykuchus kamachiyniqtam kamachiyman nuqaqa wañuni, ajinamanta Diospaq kawsakunaypaq. Cristowanmi chakataykusqa karqani,
66011001	Recommendation	Chhikamantataq uj suqus k'aspiman sijch'akuq tupuna k'aspitam qurqawanku: “Jatariy Diospaq wasinta jinataq jaywana patantawan tupurqumuy, jinaspataq jayk'ayuqchus chaypi yupaychachkanku chayta yuparqumullaytaq.
66014004	Description	Paykunaqa warmiwan mana puñuykuq runakunam karqanku, warmikunawanqa manam khuchi juchakunata ruwachkarqankuchu. Maymanchus Uwija purichkan chayman pikunachus qatichkanku chaykunam paykunaqa kanku. Runakuna chawpimantaqa Diosman jinataq Uwijaman ñawpaqkaq jaywayjina qhispisqam karqanku.
66009007	Description	T'isku t'iskukunaqa maqanakuyman purqaruq silla uywakunajina wakicharisqam karqanku; umankupiqa qurimanta ruwasqa pilluwan churqatasqajinam karqanku, uyankunataq runapaq uyanman riqch'akuqmi karqan.
60002016	Recommendation	Diospaq jaywaqninkuna kasqaykichisrayku qankunaqa kacharisqakunam kankichis. Chaywampas kacharisqa kasqaykichis tumpawanqa amapuni mana allinkunata ruwaychischu. Astawampas Diospaq jaywaqninkunajina puriykachakuychis.
54004010	Faith	Chayraykullataqmi llank'anchis jinataq kallpachakunchispasqa, imaraykuchus kawsachkaq Diospim suyayninchista churanchis, pichus tukuypaq qhispichiqninmi, astawanraqmi paypi iyaw niqkunapaqqa.
