44007023	Description	Ɲyɛ Musa shìŋ'à pa nɔ yyee beeshuunni na ke, u cìnmpyiibii pi ɲyɛ Izirayɛli shiinbii ke, ka u u li lwɔ́ uye funŋ'i si sà fworo pi na.
44023027	Violence	Nàŋi u ŋge mii à tùugo wani mu yyére ke, Yahutuubii pìi mpyi a u cû raa bùu. Mii à lógo na Ɔrɔmu shin u ɲyɛ u wi ke, ka mii i na sòrolashikuruŋke kà yaha k'à sà u shwɔ pi na.
44019029	Description	Ɲyɛ ka pi i kànhe puni ɲyàha a wùrugo ná puru tùnmpe e. Lire mpyi a Poli ɲaaraɲɛɛbii pìi shuunni, Gayusi ná Asitariki ta wani. Masedoni kùluni shiin pi mpyi pire, ka sùpyire si ntíl'a pire cyán a cû mà kàre tafage e.
44003014	Sin	Ŋge u à ɲwɔ maa ntíi ke, yii à cyé uru na, ŋge u à boore pyi ke, maa Pilati ɲáare na u uru cye yaha.
44015009	Faith	Kile ɲyɛ a sìɲcwɔɔnrɔgɔ pyi wuu ná pire shwɔhɔl'e mɛ. U à pi zòompii fíniŋɛ, ɲaha na yɛ pi à dániyaŋi pyi Yesu na.
46011028	Recommendation	Lire kurugo yii shin maha shin à yaa u uye kàanmucya, u u nta u a uru bwúuruŋi lyî, u raa byii lire fùnɲcwokwuuni i.
46015058	Faith	Lire kurugo mii ntàannamacinmpyiibii, yii fànha le yiye e, yii àha yafyin yaha ku yii pyi yii a núruli kàntugo mɛ, yii a sì yyaha na Kafooŋi báaraŋi i tèrigii puni i. Yii li cè mà yii yaha Kafooŋi báaraŋi na, kanhare yii à pyi ke, tire sì n‑sìi n‑pyi ɲùŋɔ baa mɛ.
46004016	Recommendation	Mà tàanna ná lire e, mii na li caa yii á, yii raa yii karigii pyi mii wogigii fiige.
46001021	Faith	Mà tàanna ná Kile yákilifente e, u à li lwɔ́ ŋge diɲyɛŋi yákilifeebii kà n‑jà uru cè ná pi yabilimpii yákilifente e mɛ. Lire kurugo jwumpe wuu ɲyɛ na yu, ná diɲyɛŋi sùpyire na pu sɔ̂nŋi sìɲcomɔ ke, Kile à li lwɔ́ sùpyire t'à dá puru jwumpe na ke, si pire shwɔ.
60003001	Recommendation	Ɲyɛ lire pyiŋkanni na, cyeebii, yii yiye tîrige yii nàmbaabil'á. Lire e ali li mɛ́ɛ ká nta pi pìi ɲyɛ a ɲɛɛ Kile jwumpe na mɛ, bà pire si mpyi si jyè Kile kuni i yii toroŋkanni cye kurugo, mà ta yii ɲyɛ a yaaga jwo pi á mɛ,
47005020	Recommendation	Lire e ke wuu maha yu Kirisita cyaga numɛ. Li ɲyɛ mu à jwo Kile yabiliŋi u ɲyɛ na yu wuu cye kurugo. Kirisita mɛge na, wuu na li caa yii á, yii yii ná Kile shwɔ̀hɔŋi yaha u ɲwɔ.
44002024	Description	Ŋka Kile à u ɲùŋɔ wwû kwùŋi yapwoyi i, maa u ɲɛ̀ a yige kwùŋi i. Ɲaha kurugo yɛ li fànhe mpyi kwùŋi na u jà a u cû a yaha wani mɛ.
59002007	Sin	Yesu Kirisita mɛtange ku ɲyɛ yii na ke, pire nàfuufeebii ninuubii bà pi ɲyɛ na kuru mɛge kɛ̀ɛge mà?
54003003	Description	U ɲyɛ a yaa u pyi sinmbya mɛ, u mú ɲyɛ a yaa u pyi supyikyanga mɛ, ŋka u à yaa u pyi ɲùmpiŋɛfoo. U ɲyɛ a yaa u pyi kàshikwɔn mɛ, u múnaani mú ɲyɛ a yaa li lwɔ́ a pwɔ nàfuuŋi na mɛ.
43004014	Grace	Ŋka ŋgemu ká mii lùkange bya ke, byage saha sì n‑sìi urufoo ta mɛ. Ɲaha na yɛ lwɔhe mii sí n‑kan u á ke, kuru sí n‑pyi u funŋke e lùbili. Uru lùbiliŋi sí u pyi u shìŋi niŋkwombaaŋi ta.»
62002005	Faith	Ŋka ŋgemu u ɲyɛ na u jwumpe kurigii ɲaare ke, uru maha li cyêe na Kile kyal'à táan ur'á sèeŋi na. Lire cye kurugo, wuu maha li cè na wuu ná Kile à wwɔ̀.
66016013	Description	Lire kàntugo ka mii i múnapegii taanre ɲya ntàsɛɛn fiige, là à fworo wwòlyɛge ɲwɔge e, ka là si fworo sige yapege ɲwɔge e, ka là sí fworo tùnntunŋi kafiniviniŋi ɲwɔge e.
59002008	Recommendation	Yii aha a Kile Saanre Saliyaŋi kurigii ɲaare, bà l'à sémɛ Kile Jwumpe Semɛŋi i mɛ na: «Ma shinɲɛɛŋi kyaa táan may'á, ma yabiliŋi fiige» lire na ɲyɛ kyaa niɲcɛnnɛ.
47004005	Faith	Wuu ɲyɛ na wuye kyaa yu yii á mà dɛ! Yesu Kirisita kyaa wuu ɲyɛ na yu, uru u ɲyɛ Kafooŋi. Wuu pi ke, wuu na báare yii á Yesu kurugo.
46015033	Recommendation	Yii a yiye kàanmucaa: «Sùpyaŋi ɲaaraɲɛɛŋi ká mpyi u ɲyɛ a ɲwɔ mɛ, uru u maha u wurugo, maa u le kumpiini i.»
58013020	Grace	Yyeɲiŋkefoo Kile u à wuu Kafooŋi Yesu ɲɛ̀ a yige kwùŋi i ke, uru u yii tɛ̀gɛ yii jà yii a karigii niɲcɛnŋkii shiŋi puni pyi, yii raa u ɲyii wogigii pyi. Nde l'à táan u á ke, u yii yaha yii jà yii a lire pyi Yesu Kirisita cye kurugo. Uru u ɲyɛ mpànahaŋi niɲcɛnŋi. U sìshange k'à pyi sárage ke, kur'à wuu le tunmbyaare niŋkwombaare e. U mɛge ku pêe tèrigii puni i fo tèekwombaa! Amiina.
50001027	Recommendation	Ŋka Jwumpe Nintanmpe p'à jwo Kirisita kyaa na ke, yii kapyiiŋkii pun'à yaa cyi yyaha tíi ná pur'e. Mii ɲyɛ yii shwɔhɔl'e yo, mii laag'à tɔɔn yii na yo, li tɛgɛni li ɲyɛ mii u lógo na yii na wá a kwôro ɲwɔmɛɛ niŋkin na, maa yii sɔ̀nŋɔre pyi niŋkin, maa yii fànhe pyi niŋkin báaraŋi na, mpii pi ɲyɛ na Jwumpe Nintanmpe tùnni ke, bà yii fyagara baa wuubii si mpyi si pire sige lire na mɛ. Pire u kapyiiŋkil'à li cyêe na Kile sí pi shi bò, yii kapyiiŋkii s'à li cyêe na Kile sí yii shwɔ. Kile mú sí u à lire yaa,
46006014	Grace	Kile à Kafooŋi ɲɛ̀ mà yige kwùŋi i. Kile sí n‑pa wuu mú ɲɛ̀ n‑yige kwùŋi i ná u sífente e.
55001006	Recommendation	Lire kurugo tèni i mii à na cyeyi taha mu ɲùŋke na maa Kile ɲáare, ka mu u Kile màkange ŋkemu ta u báaraŋi mɛɛ na ke, maye pwɔ bà kuru si mpyi si ŋkwôro mu cye e mɛ.
60004006	Grace	Lire kurugo mpii pi à kwû ke, Jwumpe Nintanmpe mpyi a jwo pir'á mú, bà li si mpyi kwùŋi ká nɔ pi na sùpyire sannte fiige, pi i shìŋi niŋkwombaaŋi ta Kile á, u Munaani cye kurugo mɛ.
46007023	Recommendation	Kile à yii ɲùŋɔ wwû ná loŋgare e, lire e yii àha núru ɲɛɛ sùpyire t'a yii kɛ̂ɛnŋi ná pi sɔ̀nŋɔŋkanni i mɛ.
46010010	Recommendation	Yii àha raa Kile ɲùŋke tahare bà pi pìl'à li pyi mɛ. Ɲyɛ mpii pi à lire pyi ke, Kile mɛ̀lɛkɛŋi u maha kakyaare pyi ke, ka Kile si uru yaha u à pa pire bò.
47002017	Faith	Shinɲyahara à Kile jwumpe pyi nàfuu cya kuro, ŋka wuu ɲyɛ pire fiige mɛ. Kile u à wuu tun, u à li cè na wuu na u jwumpe yu fyìnmpe funŋke e, Kirisita wwoɲɛɛge e.
45015001	Recommendation	Wuu mpiimu pi à fànha ta Kile kuni i ke, mpii pi ɲyɛ pi sàha fànha ta l'e mɛ, wuu pi fànhaɲcyɛrɛrɛ karigii kwú wuye e. Wuu àha raa wuu ɲyii karigii kanni caa raa mpyi mɛ.
50002024	Faith	Mii mú s'à tɛ̀ɛn ná l'e, Kafooŋi ká ɲɛɛ, li saha sì mɔ mɛ, mii yabiliŋi sí n‑sà n‑fworo yii na.
66007001	Description	Lire kàntugo ka mii i Kile mɛ̀lɛkɛɛ sicyɛɛre ɲya pi à yyére diɲyɛŋi ɲùɲyi sicyɛɛreŋi na. Pi mpyi a kafɛɛge kwɔ̀n diɲyɛŋi ɲùɲyi sicyɛɛreŋi na, bà li si mpyi kafɛɛgɛ kà núru vwɔ ɲìŋke ná suumpe lwɔhe ná cige kà tufiige na mɛ.
60004003	Sin	Yii li cè na tèni l'e, mpii pi ɲyɛ pi ɲyɛ Kile kuni i ná yii e mɛ, pire mpyi na piye mùntanma karigii ɲcyiimu pyi ke, yii à mɔ a tòro pire mùntanma karigii mpyiŋi i. Yii mpyi na silege baa karigii pyi, maa mpyi ná yaayi lapege e, maa sinmpe byii na ɲcwo, yii mpyi lakyanhayafee, yii mpyi sinmbyampiye, maa mpyi kacyinzunmii lire s'à núr'a pɛn Kile á.
66011005	Violence	Sùpya la ká mpyi si kawaa pyi pi na, nage maha fworo pi ɲwɔyi i, maa uru zàmpɛnŋi bò. Sèeŋi na, sùpya maha sùpya la ká mpyi si kawaa pyi pi na, urufol'à yaa u bò amuni.
44023005	Recommendation	Ka u u pi pyi: «Mii cìnmpyiibii, mii ɲyɛ a mpyi a cè na Kile sáragawwuubii ɲùŋufembwɔhe ki mɛ, lire baare e mii mpyi na sì ɲɛɛ yi jwo mɛ. Ɲaha kurugo yɛ y'à sémɛ Kile Jwumpe Semɛŋi i na “Ma hà jwumpimɛ jwo yii shiŋi yyaha yyére shinŋi na mɛ.”»
66022015	Sin	Ŋka kaɲwɔhɔyi pyifeebii ná sìnŋkanfeebii ná jacwoobii ná shinbuubii ná kacyinzunmpii ná kafinar'à táan mpiimu á pi mú si i fini ke, pire sí n-kwôro kànhe kàntugo.
66002014	Sin	Cyire mú i, mii à tìgire cyán yii na, ɲaha na yɛ pìi na ɲyɛ yii shwɔhɔl'e, pir'à taha Balamu kàlaŋi fye e. Balamu u mpyi a saanŋi Balaki sɔ̀n, ka lire si mpyi kaɲuŋɔ mà Izirayɛli shiinbii yaha yasunɲyi kyaare ŋkyaŋi ná jacwɔɔre karigii mpyiŋi na.
53001003	Faith	Wuu cìnmpyiibii, wuu à yaa wuu a fwù kaan Kile á tèrigii puni i yii kyaa na. Lir'à yaa ná mpyi i, ɲaha na yɛ yii na sì yyaha na Kile kuni i sèl'e, ntàannamagare ti ɲyɛ yii mú puni niŋkin niŋkinŋi ná yiye shwɔhɔl'e ke, là sí i bârali tire na na wá.
46012002	Sin	Pyiŋkanni na yii mpyi mà yii yaha yii sàha Kile cè mɛ, yii sɔ̂nŋɔ lire na kɛ! Yii mpyi a yiye pwɔ kacinŋkwuŋi na sèl'e, mà li ta cyire kacyanhigii ɲyɛ na jà a jwo mɛ.
49005025	Recommendation	Nàmbaabii, yii yii cyeebii kyaa táan yiy'á, bà Kirisita à dánafeebii kuruŋke kyaa táan uy'á, fo mà uye kan sáraga ku kurugo mɛ.
45012017	Recommendation	Yii àha kapii fwoo tò ná kapil'e mɛ, yii yiye waha yii raa kacɛnŋii pyi sùpyire puni na.
60005006	Recommendation	Lire kurugo yii yiye tîrige Kile cyɛge fànhaɲyahaga wog'á, bà u si mpyi si yii dùrugo u ɲyii tèni i mɛ.
44014017	Grace	Ŋka lire ná li wuuni mú i, Kile maha u tàange cyêre yii na ná kacɛnŋii niɲyahagil'e: u maha zànhe kaan yii á na yîri nìɲyiŋi na, maa yii sùmaŋi pyi u u ɲwɔge u tèefaani i, maa ɲjyìŋi kaan yii á fo maha yii funɲyi táan.»
54003011	Recommendation	Cyeebii mú à yaa pi pyi mɛtangafee, pi ɲyɛ a yaa pi a sùpyire sannte mɛyi kɛ̀ɛge mɛ, pi à yaa pi piye pɛ̀rɛge cè, pi à yaa pi pyi dánasupyii karigii puni i.
66002021	Sin	Mii à tère kan u á u u toroŋkanni kɛ̂ɛnŋɛ, ŋka u la ɲyɛ sì láha u jacwɔɔre karigii na mɛ.
44012020	Description	Lire mpyi a saanŋi Erɔdi lùuni ta l'à yîri Tiri ná Sidɔn kànyi shiinbii taan sèe sèl'e. Ka pire si bɛ̂ niŋkin na, maa sà jwo a ɲwɔ ná saanŋi bage ɲùŋufooŋi i, uru mɛge na mpyi Bilasitusi. Lire kàntugo maa ŋkàr'a sà saanŋi ɲáare na u uye sanŋi yaha u u yoge kwɔ̀, ɲaha na yɛ Erɔdi kìni i pire mpyi na pi ɲjyìŋi taa.
43008049	Sin	Ka Yesu si pi pyi: «Jína ɲyɛ mii i mɛ. Sèeŋi na, mii na na Tuŋi pêre, yii sí ɲyɛ na mii pêre mɛ.
43006018	Description	Mà pi yaha bakwɔɔge e ka kafeebwɔhɔ si yîri na lwɔhe ɲyàha sèl'e.
45008018	Faith	Mii à li cè na yyefuge e wuu ɲyɛ amɛ numɛ ke, kuru ɲyɛ yafyin mɛ, sìnampe nimpampe Kile sí n‑kan wuu á ke, ku bá sì n‑jà n‑tàanna ná pur'e mɛ.
62002012	Grace	Mii pyìibii, mii na ɲje sémɛni si ntun yii á, ɲaha na yɛ yii kapegigil'à yàfa yii na Yesu mɛge na.
55001009	Grace	Kile u à wuu shwɔ, maa wuu yyer'a pyi sùpyii fwɔnrɔ baa wuu. Wuu kacɛnŋkii kurugo bà u à lire pyi mɛ, wuu ná Yesu Kirisita wwoɲɛɛge kurugo, u à ɲwɔ wuu na maa lire pyi mà tàanna ná u ɲyii wuuni i, mà diɲyɛŋi ta u sàha sìi mɛ.
43019006	Violence	Tèni i Kile sáragawwuubii ɲùŋufeebii ná Kileɲaarebage saɲcwɔnsigibii ɲyiigil'à tɛ̀gɛ Yesu na ke, ka pi i jwo fànha na: «U kwòro cige na! U kwòro cige na!» Ka Pilati si jwo: «Yii yabilimpii pi u cû, yii sà ŋkwòro cige na, mii nàha a sàa tìgire cyaga ta u na mɛ.»
60001010	Grace	Kile tùnntunmpil'à uru zhwoŋi kani yyaha cya sèe sèl'e, tèni i pi à jwo kuru Kile màkange kyaa na, kuru ŋkemu Kile à yaha yii yahare e ke.
63001007	Sin	Mpii pi ɲyɛ na sùpyire ɲwɔ fáanŋi na leni kumpiini i ke, pir'à ɲyaha diɲyɛŋi yyaha kurugo numɛ. Pi ɲyɛ na ɲɛɛg'a tɛ̀ɛn li taan na Yesu Kirisita à pa diɲyɛŋi i ná supyicyeere e mɛ. Shin maha shin u ɲyɛ amuni ke, urufoo na ɲyɛ kafiniviniwe, maa mpyi Kirisita zàmpɛn.
44024005	Sin	Wuu à li kàanmucya mà li ɲya na ŋge nàŋ'à pyi yapege sùpyire shwɔhɔl'e. U à Yahutuubii puni yákilibii ɲyàha a wùrugo diɲyɛŋi cyeyi puni i. Uru u ɲyɛ Nazarɛti shiinbii Kile kuni yyaha yyére shinŋi.
54003016	Grace	Sèe wi, kani li mpyi a ŋwɔhɔ Kile kuni i ke, li mpyi a pêe sèe sèl'e, sùpya sì n‑sìi n‑jà nàkaana pyi lire e mɛ: Kirisita à uye pyi sùpya, maa uye cyêe sùpyire na, Kile Munaani à li cyêe na u à tíi, Kile mɛ̀lɛkɛɛbil'à u ɲya. U kyal'à jwo supyishiŋi pun'á, Diɲyɛŋi cyeyi puni i, pìl'à dá u na, Kile à u lwɔ́ a kàre nìɲyiŋi na maa u pêe.
66016021	Violence	Ka zànhafunɲcɛɛnyɛ nitabaaya si wá na ɲcwo sùpyire ɲuŋ'i. Yi puni niŋkin niŋkinŋi mpyi a dùgo sèe sèl'e. Ka sùpyire si wá na Kile mɛge kɛ̀ɛge kuru yyefuge mpèeŋi kurugo.
61003013	Faith	Ŋka wuu pi ke, bà Kile à li ɲwɔmɛɛni lwɔ́ wuu á mɛ, wuu sí nìɲyiŋi nivɔnŋi ná ɲìŋke nivɔnŋke ta, katiigii kanni cyi sí raa n‑pyi wani, lire wuu ɲyɛ na sigili.
66006014	Description	Ka nìɲyiŋi si myígil'a lwɔ́ wani, bà wà maha sémɛweŋɛ myígile mɛ. Ɲaɲyi ná kìripyɛɛre ti ɲyɛ suumpe lwɔhe niŋke e ke, ka yire puni si ɲcúnŋɔ ɲcúnŋ'a lwɔ́ yi tatɛɛny'e.
58010010	Grace	Yesu Kirisita à Kile ɲyii wuuni pyi. U yabiliŋ'à uye kan mà pyi sáraga tɔɔgɔ niŋkin tèrigii puni mɛɛ na, lire pyiŋkanni na wuu kapegigil'à jyé a láha wuu na.
52001002	Faith	Wuu maha fwù kaan Kile á yii kyaa na tèrigii puni i. Wuu aha a si raa u ɲáare tère o tère e ke, wuu funŋɔ ɲyɛ na wwùu yii na mɛ.
66006004	Violence	Ɲyɛ ka shɔnge kabɛrɛ si fworo. Kuru mpyi a ɲáaŋa. Fànhe mpyi a kan ku fèvooŋ'á u yyeɲiŋke kwɔ̀ ɲìŋke na, bà sùpyire si mpyi s'a tiye bùu mɛ. Kàshikwɔnŋwɔtɔɔngɔ mpyi a kan u á.
54006001	Recommendation	Bilibil'à yaa pi a pi ɲùŋufeebii pêre, bà sùpyire si mpyi t'àha raa Kile mɛge kɛ̀ɛge, si wuu kàlaŋi pyi laaga baa mɛ.
51003009	Recommendation	Yii àha núru raa fini yiye na mɛ, ɲaha kurugo yɛ yii à fworo yii lyempe e, maa yii kapyiɲjyɛgigii yaha.
66002020	Sin	Cyire mú i, mii à tìgire cyán yii na, ɲaha na yɛ ceeŋi u ɲyɛ Zhezabɛli ke, ur'à finɛ na uru na ɲyɛ Kile tùnntunŋɔ, ŋka yii à u yaha u u mii báarapyiibii leni kumpiini i ná u kàlaŋi i, bà pi si mpyi s'a jacwɔɔre pyi, s'a yasunɲyi kyaare kyàa mɛ.
48003008	Grace	Kile Jwumpe Semɛŋi mú s'à jwo a kwɔ̀ na Kile na sí supyishiŋi sanŋi pyi shintiilii u yyahe taan, pi dániyaŋi kurugo. Lire kurugo u à jwo Ibirayima á na: «Mii sí jwó le supyishiŋi pun'á mu cye kurugo.»
58012005	Recommendation	Yii pi ɲyɛ Kile pyìibii ke, yɛrɛge Kile à kan yii á maa màban le yii e ke, yii funŋ'à wwɔ̀ kuru na la? U à jwo: «Mii jyaŋi, Kafooŋi ká mu kíbe, ma hà lire wíi ɲcwo mɛ. U aha mu cɛ̂ɛgɛ mú, lire kà ma yatanɲyi bò mɛ.
58013017	Recommendation	Yii yii yyaha yyére shiinbii ɲwɔmyahigii cû, yii i yiye tîrige pi á, ɲaha na yɛ pire pi ɲyɛ na yii kàanmucaa maa yaha yii na. Pire Kile sí n‑yíbe nùmpanŋa yii múnahigii kyaa na. Yii kúu pi á, lire ká mpyi, pi sí raa pi báaraŋi pyi ná funntange e. Lire baare e pi sí n‑pyi yyetanhare e, yii sí sì tɔ̀ɔn ta mɛ.
44013019	Description	Lire kàntugo u à supyishi kuuyo baashuunni shi bò a yige Kana kìni i, maa pire u taare kan pi á.
54006003	Faith	Wà ha a kàlaŋi wabɛrɛ kaan sùpyir'á ŋgemu u à kàntugo wà wuu Kafooŋi Yesu Kirisita kàlaŋi niɲcɛnŋi ná Kile kun'á ke,
63001010	Recommendation	Wà ha mpa yii á ná kàlaŋi wabɛr'e, ŋgemu u ɲyɛ u ɲyɛ a yyaha tíi ná Kirisita kani i mɛ, yii àha ɲɛɛ urufoo yaha u sunmbage lèŋɛ yii pyɛnge e mɛ. Yii àha urufoo shɛ́ɛre bá mɛ,
47001005	Grace	Yii li cè na, bà wuu maha yyefuge taa sèl'e Kirisita mɛge kurugo mɛ, amuni Kile mú maha màban leni wuu e sèl'e Kirisita cye kurugo.
65001011	Sin	Pi wuun'à kɛ̀ɛge, ɲaha kurugo yɛ pi à kumpiini lwɔ́ Kanɲi fiige. Wyɛ́rɛŋi kurugo pi à sùpyire wurugo Balamu fiige. Pi à ɲùŋɔ kyán Kile na, bà Kore mpyi a ɲùŋɔ kyán mɛ, lire kurugo Kile sí pi shi bò.
65001010	Sin	Ŋka pire kafinivinibii ɲyɛ a yaage ŋkemu cè mɛ, pi maha kuru ɲjini fare, pi na ɲyɛ mu à jwo sige yaaya. Pi maha karigii pyi piye ɲùŋɔ kurugo, pi yabilimpii kapyiini li sí pi shi tò.
58011007	Faith	Nuhu à dá Kile na, lire kurugo u mpyi na Kile yɛrɛyi núru mà yyaha tíi ná karigii nimpaŋkil'e ɲcyiimu cyi ɲyɛ cyi sàha ŋkwɔ̀ na ɲaa mɛ. U à Kile jwumpe cû ná sèl'e, maa bakwɔɔge yaa ŋkemu i u ná u pyɛngɛ shiinbil'à shwɔ ke, ka lire si sùpyire sannte ntiimbaaŋi cyêe. U à dá Kile na, lire e Kile à jwo na u à tíi.
58009006	Description	Ɲyɛ vàanŋke bage ná ku funŋɔ yaayi mpyi a bégele lire bègeleŋkanni na. Sáragawwuubii mpyi maha jyè kuru bage babilini niɲcyiini i canŋa maha canŋa na pi báaraŋi pyi.
44007051	Sin	Ɲyɛ Ecyɛni à puru jwumpe taha a kwɔ̀ ke, maa jwo: «Yii à kwɔ̀n, ŋka yii à yii zòompii ná yii niŋgyigigii tò Kile yini yyaha na, maa ɲcyé Kile Munaani na. Yii à pyi yii tulyeyi fiige.
54001009	Sin	Wuu à li cè mú na uru Saliyaŋi ɲyɛ a tìŋɛ shintiibii kurugo mɛ, ŋka u à tìŋɛ shinpiibii kurugo. Mpii pi à ɲùŋɔ kyán Kile na ke, mpii pi ɲyɛ pi ɲyɛ na fyáge Kile na mɛ, ná kapimpyiibii, Kile à Saliyaŋi tìŋɛ pire mpii puni mɛɛ na. Mpii pi ɲyɛ pi ɲyɛ na Kile pêre mú mɛ, ná Kile mɛkɛɛgɛ feebii ná mpii pi à pi sifeebii cùmu lemɛ pi ke, ná supyiboompii, Kile à u Saliyaŋi tìŋɛ pire puni mɛɛ na,
46005009	Recommendation	Lɛtɛrɛŋi mii à fyânha a kan yii á ke, ur'e mii mpyi a yi jwo yii á na yii àha jacwoobii pyi yii kapyiɲɛɛ mɛ.
48001015	Grace	Ŋka Kile à ɲwɔ mii na mà mii ta mii sàha si mɛ, maa mii cwɔɔnrɔ, mii a báare ur'á.
45007015	Description	Ɲaha na yɛ nde mii na mpyi ke, mii ɲyɛ na lire yyaha cìni mɛ. Nde l'à táan mii á ke, mii ɲyɛ na lire pyi mɛ, nde l'à pɛn mii á ke, lire mii maha mpyi.
61003018	Faith	Pyiŋkanni na Kile maha ɲwɔge yii na ke, yii a sɔ̂nŋi lire na, yii raa ɲwɔge yiye na. Wuu Kafooŋi u ɲyɛ wuu Shwofooŋi Yesu Kirisita ke, yii raa sì yyaha na uru ɲcèŋi i. Uru u à yaa ná pèente e, numɛ fo tèekwombaa. Amiina!
46004010	Description	Wuu à pyi sìcyerefee fiige Kirisita mɛge kurugo, ŋka yii pi ke, yii na sɔ̂nŋi na yii à Kirisita yákilifente puni ta a kwɔ̀. Yii à jwo na wuu pi ɲyɛ fànhaɲcyɛrɛrɛ sùpyiibii, maa yiye sɔ̂nŋi na yii pi ɲyɛ fànhaɲyahaga wuubii. Sùpyire ɲyɛ a wuu le dá e mɛ, ŋka yii pi ke, pi à yii pêe.
60005009	Faith	Yii yiye pwɔ Kile kuni i, yii i u tùn. Yii li cè na kuru yyefuge ninuge e yii cìnmpyiibii ɲyɛ diɲyɛŋi yyaha kurugo.
51003022	Recommendation	Bilibii, yii yii ɲùŋufeebii ɲwɔmyahigii cû karigii puni i. Yii àha raa pi ɲyiɲyaga báaraŋi kanni pyi si nta ntáan pi á mɛ. Yii a u pyi ná funvyinge e, yii raa Kafooŋi Yesu pêre.
66017012	Description	Ɲɛɛŋkii kɛŋi mu à ɲya ke, cyire na ɲyɛ saanlii kɛ, pire sàha ŋkwɔ̀ a tɛ̀ɛn fànhe na mɛ. Pire sí n‑pa ɲùŋufente ta si tère nimbilere kanna pyi ná ŋke sige yapege e siɲcyan.
46002012	Grace	Wuu sí pi ke, Kile à u Munaani le wuu e, lire l'à wuu ná sùpyire sannte sɔ̀nŋɔŋkanni pyi l'à wwû liye e. U à lire pyi bà li si mpyi, u à ɲwɔ wuu na maa yaayi ɲjemu kan wuu á ke, wuu u yire cè mɛ.
59005001	Recommendation	Ɲyɛ yii pi ɲyɛ nàfuufeebii ke, yii lógo! Yyefuge ku ɲyɛ yii yyaha na ke, yii a myahii súu, yii raa kwuuyi wàa kuru yyaha na.
66002010	Recommendation	Yyefuge ku sí raa yii taa ke, yii àha vyá kuru yyaha na mɛ. Yii lógo, Sitaanniŋi sí yii pìi le kàsuŋi i, bà pi si mpyi si yii zò shwɔ ŋgíi mɛ. Yii sí canmpyaa kɛ yyefugo pyi, ŋka yii kwôro Kile kuni i, pi mɛ́ɛ ká mpyi na sí yii bò. Lire ká mpyi, mii sí shìŋi niŋkwombaaŋi kan yii pyi yii kajaɲjwooni.
54006011	Recommendation	Ŋka Timɔti, mu u ɲyɛ Kile sùpya ke, laaga tɔɔn cyire karigii puni na, ma a maye waha katiigii mpyiŋi na Kile yyahe taan. Fànha le ma a maye pwɔ Kile na, ma a mpyi dánasupya, ma a ma shinɲɛɛbii kyaa táan may'á sèl'e, ma a maye waha Kile kuni ɲaaraŋi i, ma a mpyi ɲùmpiŋɛfoo.
59005005	Sin	Yii à yii diɲyɛŋi canmpyaagii puni pyi ntàanŋi kanni na, marii yii ɲyii karigii pyi. Yii à pêe mu à jwo yatɔɔgɔ, ŋkemu pi à byé si mbò mpyi kyara ke.
66004004	Description	Saanra yatɛɛnyɛ beɲjaaga ná sicyɛɛre mpyi a saanre yatɛɛnŋke niɲcyiige kwûulo. Kacwɔnrii beɲjaaga ná sicyɛɛre mpyi a tɛ̀ɛn y'e, pi mpyi a vàanvyinre le, maa sɛɛnŋi ɲùntoɲyi tò pi ɲùɲyi na.
66018007	Description	Bà k'à yasinayi ná nàfuuŋi tɛ̀g'a kuye pêe mɛ, yii kyaage ná nàvunŋke pyi ku nɔ ku na amuni, ɲaha na yɛ k'à kuye pyi saancwo, na kuru ɲyɛ leŋkwucwo mɛ, na kuru sì n‑sìi yamɛɛ sú mɛ.
60003007	Recommendation	Lire pyiŋkanni na mú, nàmbaabii, yii yii cyeebii cùmu lemɛ ɲwɔ, ɲaha na yɛ cɛɛre na ɲyɛ yaaga ŋkemu fànhe k'à cyɛ́rɛ yii woge na ke. Kile à ɲwɔ wuu na maa shìŋi niŋkwombaaŋi ŋgemu kan wuu á ke, yii ná yii cyeebil'à uru ta siɲcyan. Lire e yii pi le ɲjire e, bà li si mpyi yaaga kà ɲjà yii Kileɲarege pyi kà raa nɔni Kile na mɛ.
54002012	Recommendation	Mii ɲyɛ a ɲɛɛ ceewe u a sùpyire kâlali na cyeebii ɲyɛ nàmbaabii ɲùŋɔ na mɛ, u à yaa u tɛ̀ɛn tanuge e.
46001009	Faith	Kile na ɲyɛ ɲwɔmɛɛ niŋkinfoo, uru u à yii yyere bà yii si mpyi si mpyi u Jyaŋi, wuu Kafooŋi Yesu Kirisita wwoɲɛɛge e mɛ.
48005013	Recommendation	Mii cìnmpyiibii, yii pi ke, Kile à yii yyer'a yige bilere e, ŋka yii àha lire pyi kaɲuŋɔ s'a yii ɲyii wogigii pyi mɛ. Yii yiye kyaa táan yiy'á, yii raa ɲwɔge yiye na.
59002012	Recommendation	Saliyaŋi u à yii yige kapegigii mpyiŋi bilere e ke, Kile sí yii toroŋkanni tàanna ná ur'e. Lire kurugo yii yii jwuŋkanni ná yii kapyiiŋkii puni yaha cyi yyaha tíi ná uru Saliyaŋi i.
46012005	Faith	Báaraŋi Kile Munaani maha ŋkaan ke, u shiŋ'à ɲyaha. Ŋka Kafooŋi ninuŋ'á uru báaraŋi puni maha mpyi.
45009005	Description	Pi à fworo tiibii niɲcyiibil'e. Pire cye na Kirisita à pa, uru u ɲyɛ yaayi puni ɲùŋɔ na, uru u ɲyɛ Kile. U à yaa u a mpêre tèrigii puni i, fo tèekwombaa. Amiina.
47001006	Description	Mu aha wuu ɲya yyefuge e, lire ɲùŋke ku ɲyɛ si màban le yii e, yii raa sì yyaha na Kile kuni i. Kile ká màban le wuu e, lire ɲùŋke ku ɲyɛ si màban le yii e, si yii pyi yii jà a wuu kyaage shiŋi kwú yiye e.
47001021	Faith	Kile yabiliŋi u maha wuu ná yii fànhe ɲyahage Kirisita wwoɲɛɛge e, uru mú u à wuu cwɔɔnrɔ mà pyi uye wuu,
44010015	Recommendation	Ka mɛjwuuni si núr'a fworo maa jwo: «Yaage Kile à pyi na k'à fíniŋɛ ke, ma hà ɲjwo na kur'à ɲwɔ́hɔ mɛ.»
66018009	Sin	Ɲyɛ ɲìŋke saanbii pi à jacwɔɔre pyi ná k'e, maa ku pùcyage loŋgara yaayi ta ke, pire ká ku súugo súugo naŋguruge ɲya, pi sí raa ŋkwúuli s'a yamɛɛni súu sèe sèl'e.
43014023	Faith	Ka Yesu si u pyi: «Ŋgemu ká mii kyaa táan uy'á ke, urufoo sí raa mii jwumpe kurigii ɲaare. Mii Tuŋi mú sí urufoo kyaa táan uy'á. Wuu sí n‑pa n‑tɛ̀ɛn urufoo yyére.
62004010	Grace	Kuru tàange ku ɲyɛ: wuu bà pi à Kile kyaa táan wuy'á mà dɛ! Ŋka Kile u à wuu kyaa táan uy'á, maa u Jyaŋi tun u à pa mpyi sáraga maa wuu kapegigii tugure lwɔ́ maa Kile lùuni tìŋɛ.
62001007	Faith	Ŋka wuu aha a ɲaare bɛ̀ɛnmpe e, bà Kile yabiliŋi ɲyɛ bɛ̀ɛnmpe e mɛ, wwoɲɛɛge sí n‑pyi wuu ná wuye shwɔhɔl'e. U Jyaŋi Yesu sìshange sí wuu kapegigii puni jyé n‑láha wuu na.
48004007	Grace	Ɲyɛ lir'à li cyêe na yii à fworo bilere e. Yii à pyi numɛ Kile pyìi. Ná yii s'à pyi u pyìi de, yaayi puni u à bégel'a yaha u pyìibii mɛɛ na ke, yii pi ɲyɛ yire tafeebii.
58001008	Faith	Ŋka Kile à yi jwo u Jyaŋi á: «Mu u ɲyɛ Kile, mu sí n‑kwôro ɲùŋufente e tèrigii puni i. Mpii ɲùŋɔ na mu ɲyɛ ke, mu à tíi pir'á.
43010033	Sin	Ka pi i u pyi: «Mu kacɛnni là kurugo bà mɛ, ŋka mu Kile mɛkɛɛgɛ jwumpe kurugo. Mu shintiiwe, ka mu u wá na maye pyi Kile.»
66014011	Description	Nage e u sí n‑pyi ke, kuru sì n‑sìi n-fùgo mɛ. Mpii pi à sige yapege ná ku nàɲjaŋi pêe, ku mɛge fyèŋi sí ɲyɛ pi na ke, pìlaga bâra canŋa na, ŋɔmɔ sì n‑pyi pir'á mɛ.»
47004001	Faith	Kile à ɲùɲaara ta wuu na, maa ŋge báaraŋi le wuu cye e. Lire e sàage ɲyɛ na jyè wuu e mɛ.
58013006	Faith	Lire kurugo wuu maha jà a jwo fyagara baa: «Kafooŋi u ɲyɛ mii tɛgɛfooŋi, mii sì n‑fyá yafyin na mɛ, ɲaha shi sùpya sí n‑jà n‑pyi mii na yɛ?»
45014003	Recommendation	Ŋge u ɲyɛ na yi puni lyî ke, uru kà raa yi puni lyìmbaafooŋi fare mɛ, yi puni lyìmbaafooŋi mú kà raa yi puni lyìfooŋi fwɔ́hɔre mɛ, ɲaha na yɛ Kile à ɲɛɛ uru na mú.
45015005	Grace	Kile u maha wuu pyi wuu a wuye waha, maa wuu zòompii taali ke, uru u yii sɔ̀nŋɔre pyi niŋkin, bà Yesu Kirisita ɲyɛ na li caa mɛ,
58007027	Description	Yesu ɲyɛ sáragawwuubii ɲùŋufembwoyi sanɲyi fiige mɛ, u kuro ɲyɛ canŋa maha canŋa sáragawwuuni i uye kapegigii yàfaŋi kurugo si nta sùpyire sannte wogigii yàfaŋi sárayi wwû mɛ. U à uye pyi sáraga tɔɔgɔ niŋkin tèrigii puni mɛɛ na.
62003017	Sin	Nàfuufoo ká u cìnmpworoŋi wà ɲya kanhare e, maa mpyi u ɲyɛ a ɲɛn'a u tɛ̀gɛ mɛ, tá Kile tàange ɲyɛ urufol'e?
47005008	Faith	Sèeŋi na, wuu yákilibil'à sàa tɛ̀ɛn, wuu la mú sí ɲyɛ si fworo nte cyeere e si sà ntɛ̀ɛn Kafooŋi yyére.
60002011	Recommendation	Mii ntàannamacinmpyiibii, yii na ɲyɛ ŋge diɲyɛŋi i mu à jwo nàmpwuun, kùshee fiige, lire kurugo mii na li caa yii á, yi raa yiye kàanmucaa sùpyaŋi ɲyii karigii nimpegigii na, cyire karigii maha yii tùnni Kile kuni i.
60002017	Recommendation	Yii a sùpyire puni pêre, yii yii cìnmpyiibii kyaa táan yiy'á, yii raa fyáge Kile na, yii raa saanbwɔhe pêre.
44007025	Description	Musa mpyi na sɔ̂nŋi na lire mpyiŋi sí uru cìnmpyiibii pyi pi li cè na Kile na sí pi yige bilere e uru cye kurugo, ŋka u cìnmpyiibii ɲyɛ a jà a yi yyaha cè mɛ.
