48006017	Faith	Sùpya kà núru na kànha mɛ, nɔɔpiiyi yi ɲyɛ mii cyeere na ke, Yesu kurugo mii à yire ta.
66018021	Violence	Ɲyɛ ka Kile mɛ̀lɛkɛŋi wà si kafaabwɔhɔ lwɔ́ mu à jwo tiraga, maa ku wà suumpe lwɔhe e, maa jwo: «Amɛ Babilɔnni kànbwɔhe sí n‑wà fànha na, wà saha sì ku ɲya mɛ.
65001020	Faith	Ŋka yii pi ke, mii ntàannamacinmpyiibii, yii yiye waha yii raa sì yyaha na Kile kuni i, yii raa Kile ɲáare u Munaani fànhe cye kurugo.
45012002	Recommendation	Yii àha raa yii karigii pyi diɲyɛ sùpyire wogigii fiige mɛ, ŋka yii Kile yaha u a yii kɛ̂ɛnŋi, u u yákilii nivɔnmii kan yii á. Lire ká mpyi, nde li ɲyɛ Kile ɲyii wuuni, maa ɲwɔ, maa ntáan ná cyaga ɲyɛ a li fô mɛ, yii sí lire cè.
46015009	Sin	Yii li cè, mii u ɲyɛ Yesu tùnntunmpii puni kàntugo yyére wuŋi. Mii bá mpyi a yaa mii u tɔ̀rɔ u tùnntunmpil'e mɛ, ɲaha na yɛ mii mpyi maha Kile dánafeebii kuruŋke kyérege sèl'e.
62002015	Recommendation	Yii àha diɲyɛŋi ná u funŋɔ karigii kyaa táan yiy'á mɛ. Shinŋi u à diɲyɛŋi kyaa táan uy'á ke, Tufooŋi kyaa maha ntáan urufol'á mɛ.
45002001	Sin	Ɲyɛ mu shin maha shin u maha sùpyire sannte cɛ̂ɛge ke, tànga ɲyɛ a sìi mu á mɛ. Mu aha a sùpyire sannte cɛ̂ɛge, mu maha ɲcɛ̀ɛgɛŋi cyán maye na, ɲaha na yɛ karigii na mu na sùpyire sannte cɛ̂ɛge ke, mu mú na cyire pyi.
48002009	Description	Amuni, Yakuba ná Pyɛri ná Yuhana pire pi ɲyɛ ɲùŋufeebii, maa ntɛ̀ɛn li taan na Kile à ɲwɔ mii na, mii u a nte tùnnture pyi. Lire na pi à Barinabasi cyɛge ná ndoge cû, si li cyêe na wuu ná pire na ɲyɛ wwoɲɛɛ. Wuu à bínn'a tɛ̀ɛn maa ɲwɔ li na na pire sí n‑sà a Jwumpe Nintanmpe yu Yahutuubil'á. Wuu pi ke, wuu sí n‑sà a pu yu supyishiŋi sanŋ'á.
43019023	Description	Ɲyɛ sòrolashiibil'à Yesu kwòr'a kwɔ̀ cige na ke, maa u vàanɲyi lwɔ́ a táa tataayi sicyɛɛre, pi shin maha shin à taaga lwɔ́, ka pi i u vàanntinmbwɔhe lwɔ́ mú, kuru na mpyi jwòoŋkuriibaa.
45002021	Sin	Ɲyɛ mu u ɲyɛ na sùpyire sannte kâlili ke, maye kâla kɛ! Mu u ɲyɛ na ŋko na nàŋkaage ɲyɛ a ɲwɔ mɛ, mu sí i ku pyi mà de?
46006019	Faith	Yii ɲyɛ a li cè na yii shin maha shin cyeere ti ɲyɛ Kileɲaarebage, Kile Munaani à tɛ̀ɛn kuru ŋkemu i mà? Kile à u Munaani pyi l'à tɛ̀ɛn yii e, lire e yii ɲyɛ yiye wuu mɛ.
47005014	Grace	Yii li cè na bà Kirisita à wuu kyaa táan uy'á mɛ, wuu na wuu karigii puni pyi kuru tàange kurugo. Wuu à dá li na na uru niŋkinŋi u à kwû sùpyire puni cyaga, lir'à pyi mu à jwo ti pun'à kwû.
58003001	Faith	Lire e ke mii cìnmpyiibii, yii Kile à yyére mà pyi uye wuu ke, yii a Yesu wíi. Wuu Kile kuni i, uru u ɲyɛ Kile tùnntunŋi ná Kile sáragawwuɲuŋufembwɔhe.
44020035	Recommendation	Mii à li cyêe yii na pyiŋkannigii puni na, na amuni wuu à yaa wuu a báaraŋi pyi, wuu raa fòŋɔfeebii tɛ̀re, mà bâra lire na, wuu u funŋɔ cwo Kafooŋi Yesu jwumpe na. U à jwo na “Jwóŋi na ntaa ŋkanŋi i mà tòro ntaŋi taan.”»
58013004	Recommendation	Shin maha shin u fúruŋi yaha ɲjire e, fúrupyiɲɛɛŋi wà ɲyɛ a yaa u tasinnaga pyi ná wabɛr'e u bage wuŋi kàntugo na mɛ. Ɲaha kurugo yɛ mpii pi ɲyɛ pi ɲyɛ a kúu pi fúrupyiɲɛɛbii na mɛ, Kile sí n‑pa pire ná jacwɔɔre pyifeebii cɛ̂ɛgɛ.
43020005	Description	U à lyêele ke, maa lempe ɲya ɲìŋke na, ŋka u ɲyɛ a jyè mɛ.
66016018	Description	Ka kileɲini ná tùnmpe ná kiletinni si mpyi, ka ɲìŋke si ɲcyɛ̂ɛnnɛ sèl'e. Mà lwɔ́ sùpyire ɲyɛ ɲìŋke na ke, ku mpyi na saha ɲcyɛ̂ɛnnɛ lire cyɛ̀ɛnnɛŋkanni na mɛ.
66019010	Faith	Ka mii i niŋkure sín u fere e si u pêe, ŋka u à mii pyi: «Ma hà li pyi mɛ, mii mú na ɲyɛ Kile báarapyi mu à jwo mu ná ma cìnmpyiibii pi ɲyɛ na Yesu kyaa yu sùpyir'á ke. Kile mu à yaa mu u a mpêre.» Jwumpe pu ɲyɛ na yu Yesu kyaa na ke, puru pu ɲyɛ Kile tùnntunmpii tùnnture ɲùŋke.
46002010	Grace	Wuu pi ke, Kile à lire kani cyêe wuu na, u Munaani cye kurugo. Lire li maha karigii puni yyaha caa, ali karigii Kile à ŋwɔhɔ ke, li maha cyire puni yyaha caa, si cyi cè,
50002029	Recommendation	Lire e ke u aha bú nɔ wani yii yyére, yii i u ɲùŋɔ bɛ̂ ná funntange e Kafooŋi Yesu wwoɲɛɛge kurugo. Yii à yaa yii a pèente tare nte sùpyire shiŋi na.
51003020	Recommendation	Nàŋkopyire, yii yii sifeebii ɲwɔmyahigii cû karigii puni i. Yii aha a lire pyi, lire sí n‑táan Kafooŋi Yesu i.
47001012	Faith	Nde l'à wuu ɲùɲyi yîrige ke, lire li ɲyɛ wuu toroŋkanni diɲyɛŋi i, mà cye cyán tèni i wuu mpyi yii shwɔhɔl'e ke. Wuu à li cè wuye e na wuu à lire pyi ná funvyinge ná sèeŋi i, Kile barag'e. Sùpyire yákilifente bà t'à lire pyi mɛ, ŋka Kile ntɛ̀gɛŋi cye kurugo l'à pyi.
43014021	Faith	Ŋgemu ká mii toŋi karigii lógo, maa cyi kurigii ɲaare ke, urufol'à mii kyaa táan uy'á. Ŋgemu ká mii kyaa táan uy'á ke, mii Tuŋi mú sí urufoo kyaa táan uy'á, mii mú sí urufoo kyaa táan nay'á, si naye cyêe urufoo na.»
51002023	Sin	Pìi na sɔ̂nŋi na cyire karigii na ɲyɛ ɲcè, ɲaha kurugo yɛ cyi na yu Kile pèeŋkanni ná sùpyaŋi uye ŋkyèregeŋi kyaa na. Mà li ta, kaɲwɔɔ ɲyɛ cyi na mɛ, sùpyire maha tiye pêre ná cyi e, Kile bà pi ɲyɛ na mpêre ná cyi e mɛ.
64001006	Recommendation	Pyiŋkanni na mu à li cyêe pi na na pi kyal'à táan mu á ke, pi à pa lire jwo naha dánafeebii kuruŋk'á. Mu aha yákili yaha pi na, maa pi tɛ̀gɛ pi kùsheeni i mà tàanna ná Kile ɲyii wuuni i, lire sí n‑yaa.
55002023	Recommendation	Ma hà raa ma ɲwɔge leni nàkaante laaga baa woore e mɛ, tire maha ma ná yoge e.
47003018	Faith	Vàanŋa ɲyɛ a para wuu mpiimu yyaha na mɛ, wuu puni pi maha Kafooŋi sìnampe ɲaa. Lire kurugo canŋa maha canŋa, wuu maha ŋkɛ̂ɛnŋi na mpyi Kafooŋi fiige, sìnampe pà sí i bârali pà na. Kafooŋi Munaani cye kurugo lire maha mpyi.
58009014	Grace	Yatɔɔre sìshange mpyi na lire pyi, Kirisita woge s'à pwɔ́rɔ kuru na. Kile Munaani li sí n-kwôro fo tèekwombaa ke, lire l'à u yyaha cû, ka u u uye kan sáraga cwò cyaga baa wogo Kile á. Karigii cyi maha kwùŋi nɔ wuu na ke, u sìshange sí n‑jà wuu zòompii fíniŋɛ cyire e. Lire ká mpyi, wuu sí n‑jà n‑file Kile ɲyii wuŋi na, s'a báara u á.
44011017	Grace	Ɲyɛ lire pyiŋkanni na, wuu pi à dá Kafooŋi Yesu Kirisita na ke, Kile à ɲwɔ wuu na maa màkange ŋkemu kan wuu á ke, kuru ninuge u à kan pi á, lire e ke, di mii mpyi na sí n‑jà Kile ɲyii wuuni fyìinnɛ n‑jwo yɛ?»
49004030	Faith	Yii àha raa Kile Munaani lùyiri karigii pyi mɛ. Lire li ɲyɛ Kile fyèŋi yii na, ŋgemu u à li cyêe na Kile sí n‑pa yii ɲùŋɔ wwû feefee canŋka ke.
66003003	Recommendation	Kàlaŋi yii à lógo maa ɲɛɛ u na ke, yii funŋɔ cwo uru na, yii i u cû yii tàanna ná u lógoŋkanni i, yii i yii toroŋkanni kɛ̂ɛnŋɛ. Ná yii ɲyɛ a ɲyiigii múgo mɛ, mii sí n‑pâa yii e nàŋkaawa fiige, yii sì mii tèepani cè mɛ.
62003007	Recommendation	Mii pyìibii, yii àha ŋkwɔ̀ wà yaha u yii le kumpiini i mɛ. Shin maha shin u ɲyɛ na katiigii pyi ke, urufol'à tíi bà Yesu Kirisita à tíi mɛ.
62004001	Recommendation	Mii ntàannamacinmpyiibii, mpii puni pi ɲyɛ na ma yii á, na pire na ɲyɛ Kile tùnntunmii ke, yii àha ndá pi puni na mɛ, yii a pi zòompii shuu yii a wíi, yii i ɲcè kampyi Kile u à pi tun, ɲaha na yɛ shinɲyahara na fini diɲyɛŋi yyaha kurugo na pire na ɲyɛ Kile tùnntunmii.
44013038	Grace	Mii cìnmpyiibii, yii à yaa yii li cè na uru cye kurugo, yii kapegigii sí n‑jà yàfa yii na. Kile tùnntunŋi Musa Saliyaŋi mpyi na sì n‑jà cyi yàfa yii na mɛ.
50003001	Recommendation	Ɲyɛ mii cìnmpyiibii, yii pyi funntange e Kafooŋi kurugo. Jwumpe mii à fyânha a jwo yii á ke, mii sì n‑sìi n‑kànha si puru ninumpe taha yii á mɛ. Puru pu sí yii pyi yii kwôro kuni niɲcɛnni i.
46011034	Recommendation	Katege ká mpyi ŋgemu na ke, urufoo u lyî u pyɛnge e, u u nta u a ma Kafooŋi ɲjyìŋi talyige e, bà li si mpyi yii àha ŋkwɔ̀ kapyimbaala pyi uru ɲjyìŋi talyige e, Kile si yii sâra a tàanna ná lire e mɛ. Mii aha nɔ wani yii yyére tèni ndemu i ke, karigii sanŋkii cyi à yáaŋa a yaha ke, mii sí cyire cwɔɔnrɔ.
43018031	Description	Ka Pilati si pi pyi: «Yii yabilimpii pi u cû yii i u kataanmpe cwɔɔnrɔ yii tàanna ná yii Saliyaŋi i.» Ka Yahutuubii ɲùŋufeebii si u pyi: «Kuni ɲyɛ a kan wuu á, wuu sùpya bò mɛ.»
46012031	Faith	Yii a Kile Munaani màkanyi puni niɲcɛnɲyi caa. Lire e mii sí lire kuni niɲcɛnni le yii taan numɛ.
58007026	Description	Sáragawwuɲuŋufembwɔhe kurugo wuu mpyi ke, kuru ku ɲyɛ Yesu. U à fíniŋɛ, ɲcɛ̀ɛgɛ cyaga ná ɲwɔhɔmɔ cyaga ɲyɛ u na mɛ. Kile à u láha kapimpyiibii na, maa u dùrugo fo nìɲyiŋi tɛgɛni na.
50004013	Faith	Kirisita à fànhe ŋkemu kan mii á ke, kuru ku maha mii pyi mii u jìni cyire karigii puni na.
52004003	Recommendation	Nde l'à táan Kile á ke, lire li ɲyɛ: yii pyi fyìnmɛ sùpyii, yii i ɲcû jacwɔɔre mpyiŋi na.
51004002	Recommendation	Yii àha ndáha Kileɲarege na mɛ, yii yyaha le ku na, yii raa fwù kaan Kile á tèrigii puni i.
44007029	Description	Nàŋ'à puru jwo ke, ka Musa si fê a kàre Madiyani kìni i. Maa ceewe fúru wani maa pùnampyire shuunni ta u na.
46011007	Description	Nɔ̀ŋi kɔni ɲyɛ a yaa u a ɲùntoŋɔ tùni Kileɲarege tèni i mɛ, ɲaha na yɛ nɔ̀ŋi u ɲyɛ Kile malwɔɔre, u sìnampe mú maha pèenɛ taha Kile na. Ceeŋi sí wi ke, uru sìnampe maha pèenɛ taha nɔ̀ŋi na.
51003015	Faith	Mbèŋi Kirisita à le yii shwɔhɔl'e ke, uru u kwôro yii shwɔhɔl'e, ɲaha na yɛ Kile u à yii yyere yii i mpyi niŋkin. Yii a fwù kaan u á mú.
58002010	Grace	Kile à yaayi puni yaa uye wuyo. Lire kurugo li mpyi a ɲwɔ na Yesu u kyaala, bà u si mpyi si shinɲyahara pyi ti pyi shinbwoo u yyére mɛ. Kyaage cye kurugo, Yesu à pyi ɲùŋufoo niɲcɛnŋɛ, ŋgemu u à jà a kuni múgo shinɲyahara á, bà ti si mpyi si nùmpanŋa ta mɛ.
59004001	Sin	Ɲyɛ yoge ná nàkaante ti ɲyɛ yii shwɔhɔl'e ke, ɲaha ku ɲyɛ ná lire e bɛ? Yii ɲyii karigii nimpegigii cyi à yii yyaha ɲî ke, cyire fyè bàl'à?
46005001	Sin	Mii cìnmpyiibii, wuu à lógo na silegebaara kani là à pyi yii shwɔhɔl'e, ali Kilecembaabii mú bà sì ɲɛɛ ndemu pyi mɛ. Pi à jwo na yii wà na wá a u tuŋi cwoŋi lèŋɛ.
46010013	Faith	Pyiŋkanni na Sitaanniŋi ɲyɛ na yii sɔ̀nni na wàa kapegigii na ke, amuni u ɲyɛ na li pyi sùpyire sannte na. Ŋka Kile na ɲyɛ ɲwɔmɛɛ niŋkinfoo, u sì ɲɛɛ Sitaanniŋi u yii tɛgɛlɛ ta fo si ntòro yii pɛ̀rɛge taan mɛ. Kawaa mɛ́ɛ ká yii ta, Kile sí fànha kan yii á, bà yii si mpyi si li kwú yiye e fo si sà nɔ li tɛgɛni na mɛ.
44020029	Violence	Mii à li cè, mii kareŋkwooni kàntugo, bà sigepwuunbii maha jyè mpàkuruŋke shwɔhɔl'e maa ku bwɔ̀n a caala mɛ, amuni sùpyire tà sí n‑pa jyè yii shwɔhɔl'e si yii wurugo.
53001004	Faith	Lire kurugo wuu aha a yii shɛnrɛ yu Kile dánafeebii kuruɲyi sanɲy'á, wuu ɲùɲyi maha yîrige. Pyiŋkanni na yii à yiye waha yyefuge tèrigii puni ná nàvunŋke tèrigii puni i, maa ntɛ̀ɛn Kile kuni i ke, wuu maha yire yu pi á.
62004012	Faith	Sùpya ɲyii ɲyɛ a tɛ̀g'a ɲya Kile na mɛ, ŋka wuu aha wuye kyaa táan wuy'á, wuu sí n‑kwôro Kile wwoɲɛɛge e, u tàange mú sí raa ɲaa wuu shwɔhɔl'e sèeŋi na.
48001001	Description	Mii Poli u ɲyɛ Yesu Kirisita tùnntunŋɔ ke, mii u à ŋge lɛtɛrɛŋi tùugo yii á. Mii u pyi Yesu Kirisita tùnntunŋɔ, sùpya bà u à lire yaa mɛ, sùpya bà u à mii tun mɛ. Yesu Kirisita u à ɲɛ̀ a fworo kwùŋi i Tufooŋi cye kurugo ke, uru ná Tufooŋi Kile u à wwɔ̀ lire na.
58012003	Recommendation	Kapimpyiibil'à ntùŋke taha u na maa u kyérege sèl'e, u à lire kwú uye e pyiŋkanni ndemu na ke, yii funŋɔ cwo lire na, bà li si mpyi yii àha ŋkànha mɛ, yii yatanɲyi kà ŋkwû mɛ.
45006005	Faith	Sèeŋi na, ná wuu s'à wwɔ̀ ná u e u kwùŋi shiŋi i, wuu mú sí n‑wwɔ̀ ná u e u ɲɛ̀ŋi shiŋi i.
45015010	Recommendation	Y'à sémɛ mú na: «Supyishiŋi sanŋi puni, yii pyi funntange e ná Kile shiinbil'e siɲcyan.»
54004001	Sin	Ɲyɛ Kile Munaani à yi fíniŋ'a jwo wuu á na diɲyɛŋi tèekwooni ká byanhara, pìi sí kàntugo wà Kile kun'á, si ntaha kafinivinibii pìi ɲwɔh'i, mpii pi ɲyɛ na sùpyire wurugo ke, pire u kàlaŋi s'à fworo jínabil'e.
56003001	Recommendation	Yi jwo dánafeebil'á ma a pi funŋɔ cwo, na pi piye tîrige fànhafeebii ná kìni ɲùŋufeebil'á, pi i pi ɲwɔmɛɛni cû, pi i piye pwɔ kacɛnŋkii mpyiŋi na tèrigii puni i.
61003005	Sin	Ɲyɛ tire sùpyire ɲyɛ na ɲɛɛg'a tɛ̀ɛn li taan, na nìɲyiŋi ná ɲìŋk'à yaa l'à mɔ mɛ. Kile à yire yaa u yabiliŋi ɲwɔjwumpe cye kurugo. U à ɲìŋke yige lwɔhe e, maa ku ná lwɔhe tɛgɛni wwû.
60003018	Grace	Yii li cè na Kirisita yabiliŋi mú à kyaala tɔɔgɔ niŋkin wuu kapegigii kurugo. Uru u à tíi ke, u à kwû shintiimbaabii kurugo, bà u si mpyi si yii yyaha kɛ̂ɛnŋɛ Kile á mɛ. Sùpyir'à u bò naha ɲìŋke na, ŋka Kile Munaani cye kurugo u à ɲɛ̀ a fworo kwùŋi i.
61002021	Sin	Li mú bá mpyi a pwɔ́rɔ pi á, pi àha kuni nintiini cè mɛ, mà tòro pi li cè pi i núr'a kàntugo wà Kile toŋi na, u à uru ŋgemu kan pi á ke.
53003006	Recommendation	Wuu cìnmpyiibii, mpii pi ɲyɛ na fàhafaha na mâre là mpyimbaa yii shwɔhɔl'e, maa mpyi pi ɲyɛ na wuu yɛrɛyi kurigii ɲaare mɛ, wuu na li ɲáare yii á, wuu Kafooŋi Yesu Kirisita mɛge na, yii àha pire pyi yii kapyiɲɛɛ mɛ.
45005012	Sin	Kapegigil'à jyè diɲyɛŋi i shin niŋkin cye kurugo, uru u ɲyɛ Adama, ka kapegigii si mpa ná kwùŋi i. Lire pyiŋkanni na, kwùŋ'à nɔ sùpyire puni na, ɲaha na yɛ pi pun'à kapegigii pyi.
58011033	Faith	Pir'à dá Kile na, lire kurugo pi à jà saanbii pìi na, maa fànhe pyi ná ntìiŋi i, yaayi ɲwɔmɛɛni Kile mpyi a lwɔ́ ke, maa yire ta, maa cànriyi yà ɲwɔyɔ pwɔ.
47004009	Faith	Pi maha wuu kyérege, ŋka Kile à kwôro ná wuu e. Pi maha wuu bwùun na ɲcyáan, ŋka wuu maha yîri.
59004004	Sin	Yii pi à kàntugo wà Kile á, maa ntaha diɲyɛŋi ɲyii karigii fye e ke, yii ɲyɛ a cè a jwo na shinŋi u à diɲyɛŋi ɲyii karigii kyaa táan uy'á ke, na urufoo maha Kile kyaa pɛn uy'á mà? Amuni li mú ɲyɛ, ŋgemu ká diɲyɛŋi karigii kyaa táan uy'á ke, urufoo maha uye pyi Kile zàmpɛn.
44016006	Description	Ɲyɛ Poli ná u shɛ̀rɛfeebii la mpyi si sà Kile jwumpe jwo Azi kùluni i, ŋka Kile Munaani ɲyɛ a ɲɛɛ mɛ. Lire e ka pi i Firijyi kùluni jyiile mà kàre Galati kùluni i.
45010006	Faith	Ntìiŋi u maha ntaa dániyaŋi kuni i ke, shinŋi u ɲyɛ na ɲáare lire kuni i ke, urufoo sí n‑jà n‑jwo Kile tùnntunŋi Musa fiige na: «Li ɲyɛ a nɔ yii pi dùgo nìɲyiŋi i (yii sà Kirisita cya yii tîrige mɛ.)
66016002	Violence	Ɲyɛ ka Kile mɛ̀lɛkɛŋi niɲcyiiŋi si sà u ŋkunaani sùguro ɲìŋke na. Lir'à pyi ke, sige yapege fyèŋi mpyi mpiimu na, pi sí i ku nàɲjaŋi pêre ke, ka nɔwapiye si fworo pire na.
66005008	Description	Lir'à pyi ke, ka ɲyii yaayi sicyɛɛreŋi ná kacwɔnribii beɲjaaga ná sicyɛɛreŋi si piye tîrig'a cyán Mpabilini á. Pi shin maha shin mpyi ná ŋkɔ̀nn'i, mà bâra sɛɛn ŋkunahii, cyire puni mpyi a ɲî wusuna nùguntanga wu na. Ɲareyi Kile wuubii maha mpyi ke, yire yi mpyi uru wusunaŋi.
62005001	Faith	Shin maha shin u à dá li na na Yesu u ɲyɛ Kile Niɲcwɔnrɔŋi ke, urufoo na ɲyɛ Kile pyà. Tufooŋi Kile kyal'à táan shin maha shin á ke, u pyìibii kyaa maha ntáan urufol'á mú.
48005026	Recommendation	Wuu wà kà uye pêe mɛ, wuu àha raa wuye ɲwɔ cwôre mɛ, wuu àha raa wuye yiɲcyɛge pyi mɛ.
54005001	Recommendation	Ma hà raa jwuɲjwumbaama yu nàŋkolyeebii na mɛ, ŋka ta pi yɛrɛge ná lùtaanni i mu à jwo mu tii pi. Lire pyiŋkanni na mú, ta nàɲjiibii yɛrɛge mu à jwo mu cìnmpyii.
60002012	Recommendation	Mpii pi ɲyɛ pi ɲyɛ Kile kuni i ná yii e mɛ, yii yii ɲaaraŋkanni cè pire shwɔhɔl'e. Lire e pi mɛ́ɛ ká a fini na ntare yii na na yii à kapii pyi, pi sí raa yii kacɛnŋkii ɲaa si Kile pêe canŋke u sí n‑pa fworo pi na ke.
50003006	Sin	Mii mpyi a sàa naye pwɔ lire na fo mii mpyi maha dánafeebii kyérege. Tìgire cyaga ɲyɛ a mpyi mii na Saliyaŋi kàmpanŋke na mɛ.
43004052	Description	Ka u u pi yíbe: «Tèni ndire e u à pwɔ́rɔ yɛ?» Ka pi i u pyi: «Cifwur'à u yaha, taɲjaa mà canŋke yaha ɲùŋɔ niŋi i.»
43019031	Violence	Ɲyɛ kuru canŋke nùmpanŋa mpyi Yahutuubii canŋɔŋɔ, kuru mpyi a pêe canŋɔɲyi sanɲyi na. Lire kurugo Yahutuubii ɲùŋufeebii la ɲyɛ a mpyi pi kwôro ciyi na canŋɔŋke e mɛ. Ka pi i ŋkàre Pilati á maa sà u ɲáare na u pire yaha pi sà pi tooyi bwɔ̀n a kyɛɛgɛ, pi i wyɛ̀r'a kwû, pi i pi buwuubii tîrige ciyi na.
43019012	Description	Yesu à puru jwo ke, ka Pilati si wá na kaɲuŋɔ caa si Yesu ta ɲjaha. Ŋka Yahutuubii saha mpyi ŋko fànha na: «Mu aha ŋge nàŋi yaha, mu saha sì n‑pyi Ɔrɔmu saanbwɔhe Sezari cevooŋi mɛ. Shin maha shin u à uye pyi saanwa ke, urufoo sí n‑pyi Sezari zàmpɛn.»
43014001	Faith	Lire kàntugo Yesu à jwo u cyelempyiibil'á: «Yii àha kyaa tɛ̀gɛ yiye funŋɔ pɛn mɛ. Yii dá Kile na, yii dá mii na mú.
43015016	Grace	Yii bà pi à mii cwɔɔnrɔ mà dɛ! Ŋka mii u à yii cwɔɔnrɔ mà pyi tùnntunmii, yii raa báare Kile á, u u mpyi báara ŋgemu tɔ̀ɔnŋi u ɲyɛ u sì n‑kwɔ̀ mɛ. Lire pyiŋkanni na, yii aha kyaa maha kyaa ɲáare mii Tuŋi á ná mii mɛge e ke, u sí lire kan yii á.
58011004	Faith	Abɛli à dá Kile na, lire kurugo sárage u à wwû Kile á ke, kur'à pwɔ́rɔ Kanɲi woge na. U dániyaŋi kurugo, Kile à jwo na u à tíi maa ɲɛɛ u sárayi na. U à kwû, ŋka u dániyaŋi kani maha wuu kâlili ali niɲjaa.
46004001	Recommendation	Lire kurugo yii li cè na wuu na ɲyɛ Kirisita báarapyii kanna, maa mpyi kacwɔnrii fiige. Karigii Kile mpyi a ŋwɔhɔ sùpyire na tèecyiini i ke, Kile à cyire cyêe wuu na, bà wuu si mpyi s'a cyi yyaha yu sùpyir'á mɛ.
66006013	Description	Ka wɔrigii si yîri nìɲyiŋi i mà pa ɲcwo ɲcwo ɲìŋke na mu à jwo kafeebwɔhɔ k'à fizhiye cige nimpimbaaga ɲâhara a wwû.
46010014	Recommendation	Lire kurugo mii ntàannamacinmpyiibii, yii láha kacyinzunni na feefee.
45012021	Recommendation	Ma hà kapegigii mpyiŋi lage yaha ku fànha ta ma na mɛ, maye waha ma a kacɛnŋkii pyi, ma a fànha ta kapegigii mpyiŋi na.
55002014	Recommendation	Ta sùpyire funŋɔ cwo mpe jwumpe na, yi jwo a waha pi á Kile ɲyii na, na pi àha raa nàkaante laaga baa woore pyi mɛ, kaɲwɔɔ ɲyɛ ti na mɛ, ti mú ɲyɛ na ti lógofeebii leni kuro niɲcɛnni i mɛ, ti maha pi wuuni kɛ̀ɛge.
59004008	Recommendation	Yii file Kile na, Kile sí n‑file yii na mú. Yii mpii pi ɲyɛ na kapegigii pyi ke, yii yii cyeyi jyè a yige cyire mpyiŋi i feefee. Yii funɲyi shuunnifeebii, yii yii zòmpyaagii yaha cyi fíniŋɛ.
59002009	Sin	Ŋka yii aha sùpya pwɔ́ɔŋɔ sùpya na, yii à kapii pyi, ka Kile Saliyaŋi si yii cɛ̂ɛgɛ, ɲaha na yɛ yii ɲyɛ a uru Saliyaŋi kurigii ɲaare mɛ.
52004007	Grace	Yii li cè na Kile ɲyɛ a wuu yyere katupwɔhɔyi mpyiŋi mɛɛ na mɛ, fo fyinmpe karigii.
45001018	Sin	Mpii pi ɲyɛ pi ɲyɛ na fyáge Kile na, maa mpyi pi ɲyɛ a tíi mɛ, Kile lùyirini na liye cyêre mà yîri nìɲyiŋi i pire mɛɛ na, ɲaha na yɛ pi ntiimbaaŋi kurugo, pi à cyé sèeŋi na.
62004007	Faith	Mii ntàannamacinmpyiibii, wuu wuye kyaa táan wuy'á, ɲaha na yɛ tàang'à fworo Kile e. Shin maha shiin u à u cìnmpyiibii kyaa táan uy'á ke, urufoo na ɲyɛ Kile pyà, maa u cè.
62002009	Sin	Shinŋi u à jwo na uru na ɲaare bɛ̀ɛnmpe e, mà li ta u à u cìnmpworoŋi kyaa pɛn uy'á ke, urufoo saha na ɲyɛ numpini i.
60004014	Grace	Wà ha yii cyahala mà lire ɲùŋke pyi na yii na ɲyɛ Kirisita wuu, yii wuun'à ɲwɔ, ɲaha na yɛ Kile Munaani li ɲyɛ sìnampe wuuni ke, lire na ɲyɛ ná yii e.
44021019	Grace	Fwùŋi pyiŋkwooni kàntugo, Poli à jwumpe lwɔ́, karigii Kile à pyi mà u yaha supyishiŋi sanŋi shwɔhɔl'e ke, maa cyire puni yyaha jwo pi á niŋkin niŋkin.
43008046	Sin	Yii puni shwɔhɔl'e, jofoo niŋkin u sí n‑jà li cyêe na mii à kapii pyi yɛ? Mii sí i sèeŋi yu yii á, ka yii i mpyi yii ɲyɛ a dá mii na ɲaha na mà yɛ?
58010017	Grace	Maa núr'a jwo: «Mii saha sì na yákiliŋi yaha pi kapegigii ná pi ntiimbaaŋi karigii na mɛ.»
46001005	Grace	Mà yii yaha kuru wwoɲɛɛge e, yii à Kile màkanyi shiŋi puni ta, mà cye cyán jwumpe ná ɲcèŋi na.
45015030	Recommendation	Ɲyɛ mii cìnmpyiibii, ná wuu sí ɲyɛ Kafooŋi Yesu Kirisita wuu, Kile Munaani s'à wuu pyi wuu u wuye kyaa táan wuy'á, mii na li caa yii á, yii raa Kile ɲáare mii á na zhìleni na,
43007020	Violence	Ka pìi si jwo sùpyire shwɔhɔl'e: «Jínacyan u ɲyɛ mu, sùpya ɲyɛ na mu caa raa bùu mà dɛ!»
45003025	Grace	Kile à Yesu yaha a pa, pi i u kwòro cige na, bà u si mpyi si Kile lùuni tìŋɛ, si wuu kapegigii yàfa wuu na, u sìshange ŋguŋi cye kurugo mɛ. Mà ta lire sàha mpyi mɛ, Kile lùtaanni kurugo, u ɲyɛ a mpyi a sùpyire cû a tàanna ná ti kapyiiŋkil'e mɛ. Numɛ, Yesu à pa, mpii pi à dá u na ke, ali mà ta pi à kapegigii pyi, Kile à jwo na pi à tíi. Lire Kile à pyi ke, ntiimbaa bà mɛ, ɲaha na yɛ Yesu à pi kapegigii tugure lwɔ́.
43018018	Description	L'à pyi wyeere tèni i, báarapyiibii ná Kileɲaarebage saɲcwɔnsigibii mpyi a yyére na kyànhigii nage ware, Pyɛri mú mpyi a yyére na ku ware ná pi e.
49006011	Recommendation	Yii Kile kàshikwɔnyaayi puni le yiye na, bà yii si mpyi si jà tayyérege niɲcɛnŋɛ wwû, si Sitaanniŋi nàɲwɔhɔre karigii ɲùŋɔ bɛ̂ mɛ.
43013037	Faith	Ka Pyɛri si núr'a u pyi: «Kafooŋi, ɲaha kurugo mii sì n‑jà n‑pa mu fye e numɛ mà yɛ? Mii à tɛ̀ɛn li tɛɛnl'e si na múnaani kan mu kurugo.»
50004007	Faith	Lire ká mpyi, yyeɲiŋke Kile maha ŋkaan ná k'à tòro sùpyaŋi sɔ̀nŋɔŋkanni taan ke, kuru sí n-kwôro yii zòompii ná yii sɔ̀nŋɔre na Yesu Kirisita wwoɲɛɛge e.
59003009	Faith	Kafooŋi Kile u ɲyɛ wuu Tuŋi ke, wuu maha uru pêre ná ɲjini i, marii jwumpimpe yu sùpyire na ná lire ɲjini ninuuni i, Kile à ntemu dá mà pyi u yabiliŋi malwɔrɔ ke.
46005010	Sin	Ŋka mii ɲyɛ a jwo yii á na mpii pi ɲyɛ pi ɲyɛ Kile kuni i ná yii e mɛ, ná pi na jacwɔɔre pyi, lire ɲyɛ mɛ na nàɲwɔhɔrɔ pyi, lire ɲyɛ mɛ na nàŋkaage pyi, lire ɲyɛ mɛ na kacyanhigii sunni ke, na yii àha pire pyi yii kapyiɲɛɛ mà dɛ! Lire baare e li sí n‑pyi kee yii sí n‑fworo diɲyɛŋi i dɛ!
44026009	Sin	Mii mú mpyi na sɔ̂nŋi na fànha ki, mii i sàa Nazarɛti kànhe shinŋi Yesu mɛge tùn.
61002014	Sin	Jacwɔɔre kanni t'à pi yyaha ɲî, pi ɲyɛ na ŋkànre kapegigii mpyiŋi taan mɛ. Mpii pi ɲyɛ pi sàha fànha ta Kile kuni i mɛ, pi maha pire yákilibii kɛ̂ɛnŋi ná pi ɲwɔtanyi i. Pi yákilibii pun'à taha nàfuuŋi na, pi à láŋa.
43010012	Description	Sàrampanahawa ɲyɛ mpàabii foo mɛ. U aha sige yaaga ɲya, u maha fê maa mpàabii yaha. Sige yaage maha pìi cû, pi sanmpil'a sì ɲcaala.
59001019	Recommendation	Mii ntàannamacinmpyiibii, yii ɲcyii karigii lóg'a tàra, shin maha shin à yaa u u niŋgyiini pɛ́rɛ, u raa núru, u ɲwɔge kà ŋgyɛ̀rɛ mɛ, u lùuni kà mpɛn mɛ.
46009014	Recommendation	Amuni li mú ɲyɛ, mpii pi ɲyɛ na Jwumpe Nintanmpe yu ke, Kafooŋi à jwo na pire u ɲwɔcyɛɛre t'a fwore uru báaraŋi i.
43012046	Grace	Mii wi ke, mii à pa ŋge diɲyɛŋi i si mpyi bɛ̀ɛnmɛ, bà shin maha shin u à dá mii na ke, urufoo kà núru ɲaare numpini i mɛ.
43005014	Description	Lire kàntugo Yesu à sà u ɲya Kileɲaarebage ntàani na, maa u pyi: «Lógo, mu à cùuŋ'a kwɔ̀. Ma hà núru cye le kapiini labɛr'e nde li sí mu pyi mu u kyaa ta nde l'à waha niɲcyiini na mɛ.»
46016014	Recommendation	Ntàannamagar'à yaa t'a ɲaa yii kapyiiŋkii puni i.
43014015	Recommendation	Kampyi mii kyal'à táan yii á, yii sí raa mii toŋi kurigii ɲaare.
58012025	Recommendation	Yii a yiye kàanmucaa, Kile ká a yii yɛrɛge, yii àha ɲcyé logogo mɛ. Musa u mpyi na Kile jwumpe yu mà u yaha ɲìŋke na ke, Izirayɛli shiinbil'à cyé uru yɛrɛge logogo, lire kurugo kakyaar'à nɔ pi na. Ɲyɛ Kile ká jwo ná wuu e mà u yaha nìɲyiŋi i maa wuu yɛrɛ, wuu aha ɲcyé, di wuu sí n‑shwɔ n‑jwo yɛ?
48004008	Sin	Ɲyɛ tèecyiini i, yii mpyi na sàha ŋkwɔ̀ a pyi ná Kile e mɛ, lire e yii mpyi a yiye le yasunɲyi bilere e, ɲjemu yi ɲyɛ yi ɲyɛ Kile sèe wuŋi mɛ.
44003026	Grace	Lire e Kile à u báarapyiŋi yaha a pa yii Izirayɛli shiinbii mɛɛ na yyecyiige na, u u jwó le yii á, yii i láha pege karigii na.»
44010039	Violence	Karigii puni u à pyi Zheruzalɛmu kànhe ná Yahutuubii kànyi sanɲyi na ke, wuu na ɲyɛ cyire shérii. Pi à u kwòro cige na mà bò.
46001010	Recommendation	Mii cìnmpyiibii, mii na li ɲáare yii á, wuu Kafooŋi Yesu Kirisita mɛge na, yii i bɛ̂ niŋkin na, yii àha n‑láha yiye na mɛ. Yii bɛ̂, yii i mpyi ná sɔ̀nŋɔrɔ niŋkin i, yii i yii karigii kapyiini ɲùŋke yaha ku pyi niŋkin.
51001021	Sin	Tèecyiini i, yii sɔ̀nŋɔpeere ná yii kapyiiŋkii mpyi a li cyêe na yii laage mpyi a tɔɔn Kile na, maa mpyi u zàmpɛnmii.
55002022	Recommendation	Timɔti, nàɲjiibii na dìrili pi ɲyii karigii nintiimbaagii ɲcyiimu kurugo ke, laaga tɔɔn cyire na feefee! Maye waha ma a katiigii pyi, ma a mpyi dánasupya, ma a ma shinɲɛɛbii kyaa táan may'á, mpii pi ɲyɛ na Kafooŋi pêre ná zòvyinre e ke, mu ná pire pi bɛ̂.
