62003016	Faith	Christ iví wówátsi naˀin gimuuḏi imä́gi, heḏânkunho gínhanginná háawin in koḏi̖ˀnin séegí namuuˀin. Heḏiho naˀin wáˀ gínkhâyˀä̖ˀ gikhâymúníˀin naˀinbí tíˀûuwin páaḏéˀingîˀ-á naˀinbí wówátsi âymä̂äníḏí.
43013001	Grace	Wîˀ thaa waˀ natáy i Passover shánkîˀḏi thaagîˀ. Jesus ûnhanginná i thaa napowaˀä̖ˀin nä́ä oepáa kꞌayḏi iweḏi iví Táḏávíˀpiyeˀ namú-íḏí. Hä̖̂ä̖ḏi wänbo tꞌä̖hkí in ivíˀin ûnmuuˀin ovâyséegí waˀ nä́äḏí nayiˀ ihayḏi, heḏi nää ovâykeekankhâymáa hânho ovâyséegíˀin.
60001014	Recommendation	Undá Jôesi Táḏáví ây ímuu, heḏiho háa natsonpóe waagi úvíkanhûuwí. Waˀ Jôesi Táḏá bîntaapíḏíbo háa íwänpicha̖a̖ waa úvíˀan, hebo nää-á haˀwâa unbí wówátsi wívînhûuwípí.
45011032	Grace	Yôesi-á natú̖ tꞌä̖hkí tꞌowaḏi wíˀóeˀaˀgindopíḏí inbí tꞌaywó̖ˀdi dínmuuˀiḏiho pan waagiˀinbá dipaa, heḏi kindiḏi tꞌä̖hkí tꞌowa handa̖ˀ ovâymáaḏí tꞌä̖hkívíˀpiyeˀ naˀiyapúwí.
59004010	Recommendation	Yôesiví páaḏépiyeˀ áagéˀin bípuwave, heḏi iḏáho shánkí kwꞌâayá wovâytegé-í.
44017031	Grace	gá owáy wí thaa ideˀmandiˀ nanáˀ diwe ovâytaˀgekeekwꞌôení tꞌä̖hkí tꞌowa háa híwó háa híwóhpí dívíˀannin, heḏi wí senho óesóge gin ovâytu̖ˀa̖míḏí, heḏi nä́ˀi sen óewáywówápaaḏi thayˀeeḏi dînkeeyan óesógeˀin” gin Paul-di ovâytu̖ˀan.
43019002	Description	In sundaḏo wên wä̖́ä̖khän dâyˀophíḏéˀandi óepꞌó̖htógi. Heḏáháˀ wên pꞌí tsá̖a̖wä̖́ˀin kꞌéwéˀin to-á óetógi, tsondi hayˀiví aa waagiˀinbá namuuˀin,
54005014	Recommendation	Heḏânho otû̖ˀ shánkí híwó̖ˀ namúníˀin in shánkí tsꞌa̖a̖min kwiyä̖ˀ inbí senäˀ dínchuuˀindá dívíkhóˀyâ̖a̖-íḏí heḏá dâyˀâykwꞌôení, heḏá inbí kꞌaygi dâyˀá̖yîngiˀa̖mí, heḏânho in toˀwên naˀinbíˀpiyeˀ háa dicha̖a̖ˀin háabo yanäkí tu̖u̖ namuuˀi wíḏâymáˀve-ípí naˀinbí̖ˀgeḏi ditú̖níḏí.
43014011	Faith	Nä́ˀi naaḏi wâytu̖máaˀi binwhä̖́yú̖: Naa-á i Táḏá-áḏí omuu, heḏá i Táḏá-á naa-áḏá namuu. Hewänbo naví híˀ dînwhä̖yundepíḏáhoˀ, i hä̖ä̖wí dáyˀoˀi namuuḏi bíwhä̖́yú̖ wé̖ˀge gamuuˀin.
44013018	Description	Heḏi jónä́ntä̖ pa̖a̖yo ahkon niˀge dijiˀ ihayḏi ovâyˀá̖yîngiˀan.
44016037	Violence	Hebo Paul-dá in á̖yí̖ˀnin senäˀ dipówáˀin ovâytu̖ˀan, “Tobá wí tꞌaywóˀdi wíḏînshaapí wänboˀ, heḏá tobá oe Rome gä́nkhá̖wä̖́taˀkꞌóe wänboˀ, in búˀwin tsonnin ditsonpóe naˀin díwhä̖́ä̖níˀin in tꞌowa tꞌä̖hkí dímúuní iwe, heḏáháˀ dípansóge. Heḏá nää-á kaaḏibo wáypiye dísaaníˀin didaˀ. Hebo háˀto han díˀa̖mí. Jaˀ ovâytu̖ˀan nä́we wíˀbo diˀä̖ä̖-í heḏi indân dípeemä̂äní.”
45013009	Recommendation	I tsontu̖u̖ kinnân namuu: Wíyá toˀwíví sedó-áḏí háa kwiyó-áḏí wíˀúvíwho̖hkwomáˀve-ípí, wívîntꞌowatꞌa̖há̖nú-ípí, wíˀúvísä̖ˀmâamípí, thúuḏí wíyá toˀwíví hä̖ä̖wí wíˀídaˀípí, heḏá wíyá ha̖ˀbi tsontu̖u̖ wáˀ nakwꞌó̖. Hewänbo tꞌä̖hkí nä́ˀi tsontu̖u̖ wé̖ˀge wên wéhpêeḏa̖ˀ tsontu̖u̖ waagiˀbá namuu, kinnân: Háa un wíˀbo úvípiséegí waagibá, wé̖ˀgeˀin tꞌowa wáˀ bînséegíhûuwí.
62003003	Faith	Toˀwên tꞌä̖hkí nä́ˀin napúwíˀin pín taˀge hayḏi dâytsíkhaˀmáaˀindá yä̖ˀḏâapíkan tꞌä̖hkí iweḏi dívíyâaˀoˀ, háa Christ iweḏi iyâaˀan waagibá.
45007022	Faith	Naví píˀnä́ khóˀyé-á ochanpoˀ Yôesiví tsontu̖u̖-á híwó̖ˀdiḏa̖ˀ namuuˀin.
50004004	Recommendation	Naˀinbí Sedó Jesus-víˀin ímuuḏi hä̖̂ä̖ḏi wänbo tꞌä̖hkí úvíhíhchanmáˀve-í, heḏá wíyá hanbá wâytu̖ˀâ̖a̖mí, úvíhíhchanmáˀve-í.
43010008	Sin	Báyékí in naví páaḏé diˀä̖ä̖ˀin sänmin waagiˀinbá dimuu, hewänbo in tꞌowa naví kꞌúwá waagiˀinbá dimuuˀindi wíˀovâytꞌóyanpí.
60002018	Recommendation	Un pantꞌôeˀin ímuuˀin, unbí tsonninbí khómaphoˀ úvípikwꞌôení tobáháa wovâytsonmáa wänboˀ. In tꞌä̖hkí bînˀaˀgeení, in híwóˀnin dimuuˀin heḏá in ûnpꞌoe kháapíˀin dimuuˀinda̖ˀbá joe, hewänbo in tꞌayjaaˀin dimuuˀin wáˀ.
44006013	Description	Heḏi wên senäˀ ovâytsꞌúḏe iví̖ˀgeḏi dívíhójoˀa̖míḏí. Ginnân ditú̖: “Nä́ˀi sendá hä̖̂ä̖ḏi wänbo tꞌä̖hkí híwóhpí ihéeˀo nä́ˀi Jôesi Táḏáví méesate i̖ˀgeḏi heḏá iˀ tsontun Moses itaˀnan niˀgeḏá.
59005010	Recommendation	Tíˀûuwin páaḏéˀin, háḏíḏí úvíyä̖́ä̖ˀa̖míˀin únhanginnáníḏí, bíˀánshaaˀan in hä́nˀoeˀin Yôesiví tukhe̖ˀminbí̖ˀgeḏi, indá Naˀinbí Sedó Yôesigîˀ dívíhéeˀan, heḏi tꞌôephaḏe iwe ovâykwꞌóḏi wänbo dívíyä̖́ä̖ˀan.
44002021	Faith	Hebo toˀwên tꞌä̖hkí naa díkhá̖yä̖́ˀdeḏi díkhä̖geˀdaaˀannin dovâyˀaywoení,’ gin Jôesi Táḏáví híˀ ûnmuu Joel itaˀnandiˀ.”
60003003	Recommendation	Wíˀúvíkhä̖ä̖-ípí shánkí saˀwóˀnin ímúuníḏí unbí phó hânho bînkoḏiˀoḏiboˀ, háa báyékí hä̖ä̖wí óeḏoḏi napaˀandi úvítóeˀóḏíboˀ, háa nachä̖ˀmuuˀiˀ aaḏi úvíˀawendeḏiboˀ.
55001008	Faith	Heḏiho wíˀunwôedaˀípí Nanbí Sedó Jesus-ví̖ˀgeḏi tꞌowa ovâytꞌôeˀa̖míḏí, heḏá wíḏíwôedaˀípí tobá iví tꞌôe dônˀoḏibo dípansóge wänboˀ, hewänbo shánkíḏí naa tꞌôephaḏe iwe oˀä́n waagibá un wáˀ unkhâymúní mäntꞌôephaḏé-íḏí Yôesi Táḏáví híwó̖ˀdi tu̖u̖ tꞌowa ovâytꞌôeˀa̖míḏí, heḏi Yôesi Táḏáḏáho kay wóemä̂äní kin biˀa̖míḏí.
43017019	Description	In navíˀin dînmuuḏi naa uvíˀpiyeˀ dáymäˀ heḏânho in wáˀ taˀgendi uvíˀpiyeˀ dívímä̂äníḏí.
45005002	Faith	Heḏi naˀinbí whä̖yu̖ gínmuuḏibá Jesus-di Yôesi Táḏávíˀpiyeˀ díkán, iví séegísehkanä âytáa-íḏí, heḏi hä̖̂ä̖ḏi wänbo tꞌä̖hkí nä́ˀi séegísehkanä-á âymáˀve-í. Heḏi hânho ívíhíhchandoˀ, gá gínhanginnândân wáy wí thaa-á Yôesiví saˀwó̖ˀdi kohthay iwe i-áḏí gikwo̖ˀgítꞌóeˀin.
44021025	Recommendation	Hewänbo in Huḏíyo dimuupíˀin Jesus-víˀpiye dívíwä̖yundeˀin naˀindi âytaˀnan âytu̖ˀâ̖a̖míḏí nä́ˀin naˀin âywéhpêeˀannin: Wíḏâykꞌoˀípí iˀ koegîˀ in wéˀgen tꞌowa inbí jôesi dâymä́giˀiˀ, heḏá wíḏâyˀûnpꞌoekꞌoˀípí, heḏá in animâa ovâykꞌéwhihá̖núˀinbí píví iˀ ûnpꞌoe napeepîˀ wáˀ wíḏâykꞌoˀípí, heḏá wíyá toˀwíví kwee-áḏí háa sendáḏí wíḏívíwhoˀkwꞌôenípí.”
44005003	Sin	Peter-di óetu̖ˀan, “Ananias, Satan iˀ Penísendi uví píˀnä́ khóˀjépiye nâatsuḏemä́gipíˀan. Iˀḏá wóetu̖ˀan iˀ Yä̖ˀḏâaˀi Pꞌoewa̖a̖hâ̖a̖víˀpiye bihójoˀa̖míˀin, heḏiho tꞌä̖hkí iˀ chä̖ˀ iˀ nava dä̂nku̖ˀpꞌégi iweḏiˀiˀ wínâamaapí.
52005008	Faith	Hewänbo naˀin thaaḏiˀin gimuu, heḏiho naˀinbí tsiyekan gínkhâyˀä̖ˀ âyˀá̖yîngiˀâ̖a̖míˀin. Yôesivípiyeˀ ívíwhä̖yú̖-í heḏá tꞌowa-á âyséegíhûuwí, heḏi kin ívíˀoḏá wên sundaḏo dikhâywinnin waagiˀinbá gimúní, inbí pí̖hkhú̖ iweˀi kwä̖́kꞌu aa dívípitógiḏi inbí túuˀú dâyˀá̖yîngiˀa̖míḏí. Heḏá pín taˀgeḏi gitsíkha-í Yôesiḏi dînˀaywoeníḏí, heḏi handiḏá in sundaḏo inbí kwä̖́kꞌu pꞌó̖hkhändá inbí pꞌôn dâyˀá̖yîngiˀoˀin waagiˀinbá gimúní.
55001007	Grace	Yôesi Táḏáḏí naˀin khuwôedaˀ wíḏímä́gipí naˀinbí píˀnä́ khóˀyé, hewänbo kay-áho dímäˀ, heḏá díkhä̖ge̖ˀdo tꞌowa âyséegímáˀve-íḏí, heḏá hangintandá dímäˀ naˀinbí wówátsi híwó̖ˀ âyhûuwíḏí.
62002004	Sin	Wí toˀwí Yôesi Táḏá óetaa gin natú̖ḏí hewänbo iví tsontu̖u̖ wíˀônˀaˀgindopíḏá, i-áho wí hôeyóˀi namuu, heḏá in taˀgen namuuˀin iví píˀnä́ khóˀyé wíˀimáapí.
50002002	Faith	Heḏiho únkhâyˀä̖ˀ wéhpêeḏa̖ˀ íˀánshaamúníˀin heḏá wíˀnä́ táye-á úvíséegíhûuwíˀin heḏá tꞌä̖hkí unbí hâ̖a̖-á unbí taachandá handa̖ˀ únmúníˀindá. Handiḏiho shánkí wänbo naa díhíhchanmä̂äní.
43007030	Description	Jesus-ví híˀ ûnmuuḏi óepankéyíˀin didaˀ, hewänbo óekéyí ihayḏi waˀ wíˀûnnáhpíḏí toˀwíḏí wänbo wíˀóeyâ̖ˀpí.
54006018	Recommendation	Nä́ˀin koḏitꞌowa dimuuˀin ovâytu̖ˀâ̖a̖mí híwó̖ˀgí dívíkanhûuwíˀin. Indá báyékí hä̖ä̖wí híwó̖ˀdi dínkwꞌó̖, heḏiho dínkhâyˀä̖ˀ báyékí híwó̖ˀdi-á dívíˀâ̖a̖míˀin, heḏá inbí hä̖ä̖wí iweḏá wíḏihä̖ä̖khâ̖a̖-ípí, heḏá wé̖ˀgeˀin tꞌowa-áḏá dívíwiyé-í.
43018030	Description	In Huḏíyoḏi óetu̖ˀan, “Nä́ˀi sen wên tꞌaywó̖ˀnin iˀanpíḏá háˀto uvíˀpiyeˀ âymáˀíwän.”
45014006	Faith	I toˀwí wí thaa wíyá thaaví shánkí iˀaˀgindoˀi-á Naˀinbí Sedó óeˀaˀginnamíḏân iˀoˀ. Heḏi i toˀwí tꞌä̖mägîˀ koegiˀ ikꞌoˀi-á wáˀ Naˀinbí Sedó óeˀaˀgeeníḏí kin iˀoˀ, gá i koegiˀ óemä́giḏi Yôesi óekú̖ˀdaaˀoḏân, heḏi i toˀwí wí hä̖ä̖wí ikꞌohpîˀ-á Naˀinbí Sedó óeˀaˀgeeníḏí kin iˀoˀ, i wáˀ nakú̖ˀdaapóeḏí kinbá iˀoˀ.
45012012	Recommendation	Yôesiví híwó̖ˀdi hä̖ä̖wí wovâypä̖gítꞌóeˀi bîntsíkhaˀmáaḏíboˀ íhíhcha̖a̖-í. Bîntꞌôephaḏende wänbo bíyä̖́ä̖ˀan. Hä̖̂ä̖ḏi wänbo tꞌä̖hkí úvíyûusuˀâ̖a̖mí.
44024023	Description	Heḏiho wí sundaḏoví tsondi gin óetu̖ˀan, “Nä́ˀi sen náˀá̖yîngiˀan, hewänbo napannä́n waagiḏá joe. Iví kꞌemaˀin iˀ ovâypu̖wä̖mä̂äní, iˀ hä̖ä̖wí ûntáyˀiˀ ônkáaníḏí.”
52005014	Recommendation	Tíˀûuwin páaḏéˀin, nä́ˀin tumakhe wáˀ wâymä̂äní: In ditꞌôedaˀpíˀin bîntu̖ˀâ̖a̖mí ha̖ˀmin wíḏimúnípí. In dikhuwôedaˀin dimuuˀin ovâykhä̖ge̖ˀnamí wíḏikhuwôedaˀ-ípíḏí. In kayˀindi dívíwí̖núndepíˀindá wáˀ ovâykhä̖ge̖ˀnamí. Tꞌä̖hkí tꞌowa-áḏí úvíboˀatä̖́ˀa̖mí.
44018025	Faith	I-á Nanbí Sedó Jesus-ví khuu i̖ˀgeḏi ûnhanginná, heḏiho pín taˀgeḏi wây-á tꞌowa i̖ˀgeḏi ovâyhíˀmáa, heḏá á̖yîngiḏá Jesus-ví̖ˀgeḏi ovâyhá̖ˀoˀ, tobá John iˀ pꞌóˀpꞌoekandiví há̖hkan niˀgeḏiḏa̖ˀ ûnhanginnân wänboˀ.
62002027	Recommendation	Hewänbo Yôesi Táḏáḏí i Yä̖ˀḏâaˀi Pꞌoewa̖a̖hâ̖a̖ wovâymä́gi, heḏá unbí píˀnä́ khóˀyébo bînmáa, heḏiho wíˀúntáypí wíyá toˀwíḏí Yôesiví̖ˀgeḏi wovâyhá̖ˀa̖míḏí, gá i Yä̖ˀḏâaˀi Pꞌoewa̖a̖hâ̖a̖ḏá hä̖ä̖wí tꞌä̖hkí wovâyhá̖ˀoḏân, heḏi i hä̖ä̖wí wovâyhá̖ˀoˀi-á taˀgen namuu, wên hôeyó wänbo wínamuupí. Heḏiho únkhâyˀä̖ˀ Christ-áḏí wé̖ˀge ímúníˀin, háa i Yä̖ˀḏâaˀi Pꞌoewa̖a̖hâ̖a̖ḏi wovâyhá̖ˀan waabá.
59002026	Faith	Wí toˀwí iví túuˀúḏí i pꞌoewa̖a̖hâ̖a̖ ûnpeeḏá chuˀi namuu. Heḏi hanbá namuu wí toˀwí iwhä̖yundeˀi hewänbo híwó̖ˀgí hä̖ä̖wí wíˀiˀopíḏí. Iví whä̖yu̖-á chuˀin waagiˀinbá ûnmuu.
44027035	Description	Ihíˀbowa ihayḏi wí pává ikêˀḏi Jôesi Táa ikú̖ˀdaaˀan, heḏi wí iháveḏi ikꞌoe.
44015020	Sin	Han ívíˀa̖mívíˀweḏi, âytaˀnamí ginnân âytu̖ˀâ̖a̖míḏí: Wíḏâykꞌoˀípí iˀ koegîˀ nakoekhâ̖a̖kꞌóeˀi gá in wéˀgen tꞌowa inbí jôesi dâymä́giḏân, heḏá wíyá toˀwíví kwee-áḏí háa sendáḏí wíḏívíwhoˀkwꞌôenípí, heḏá in animâa ovâykꞌéwhihá̖núˀinbí píví iˀ ûnpꞌoe napeepîˀ-á wíḏâykꞌoˀípí, heḏá iˀ ûnpꞌoe wänbo-á wíḏâykꞌoˀípí.
44023003	Sin	Paul-di óetu̖ˀan, “U̖-ân Jôesi Táḏáḏí wóemaphavekhâymáa. Wí paa ijánúmáaˀi waagiˀbá unmuu. Úkhâyˀä̖ˀ úhanginpúuwíˀin háa wên tꞌaywóˀnin dáyˀannin háa joe, nä́ˀi tsontun namuuˀi natû̖ˀ waagi, hewänbo u̖ wíˀbo hä̖ˀi tsontunbá wínâaˀaˀginpí, nä́ˀin tꞌowa dísómaphâave-íˀin ovâytu̖ˀandi.”
45008001	Description	Heḏiho nää-á in toˀwên Christ Jesus-áḏí dimuuˀindá Yôesi Táḏáḏí wíˀovâytuchä̖nú-ípí,
52005009	Grace	Naˀinbí Sedó Jesus naˀingîˀ iˀannin namuuḏi Yôesi Táḏáḏí díde̖ˀman dînˀaywoeníḏí, tꞌayḏi dítuchä̖nú-íḏá yoe.
55001012	Faith	Heḏi nä́ˀi tꞌôe dáyˀoˀi namuuḏi naa tꞌôephaḏe iwe nää oˀä́n. Hewänbo tobáháa kin dînpoˀ wänbo wóˀwôedaˀpí, dînhanginnândi toˀwívíˀpiyeˀ naa dáywhä̖yundeˀin, heḏá híwó̖ˀdá dînhanginná i-á ûnkoeḏiˀin i hääwí iví mange dônyoeˀandiˀ dînˀá̖yîngiˀa̖míḏí i tꞌä̖ˀgi thaa napówá píhay.
52001001	Grace	Naˀin Paul-á Silas-á heḏá Timothy-á gimuuˀindi un méesateˀin tꞌowa oe Thessalonica búuˀú íthaaˀin wâyta̖ˀdoˀ, undá Yôesi naˀinbí Táḏávíˀin heḏá Naˀinbí Sedó Jesus Christ-víˀindá ímuu. Yôesiví séegísehkanä bînmáˀve-í, heḏi iḏi wovâykhä̖ge̖ˀnamí ánshaaginpíḏíboˀ íkwo̖ˀníḏí.
50004005	Faith	Tꞌä̖hkí tꞌowa-áḏí híwó̖ˀda̖ˀ ímúní, Naˀinbí Sedó Jesus-áho hanwaapíḏíbo naˀä̖ḏi.
59005015	Faith	Úvíyûusuˀoḏi Yôesivíˀpiye úvíwhä̖yundeḏá, i nahayˀi nawówa-í unbí yûusu únmuuḏi. Kindiḏi Yôesiḏi i nahayˀi hehkháa óemä̂äní, heḏi itꞌaywó̖ˀnandáhoˀ, iví tꞌaywó̖ˀdi-á ônˀowóyé-í.
55001003	Faith	Naa Yôesi Táḏá dókú̖ˀdaaˀoˀ, i-á namuu iví tꞌôe dônkanmáaˀiˀ, heḏi dînhanginná pín taˀge hayḏi kin dáyˀoˀin, naví thehtáy pahpáˀin dívíˀan waabá. I dókú̖ˀdaaˀoˀ u̖ˀ unmuuḏi, khu̖u̖-á thaa-á u̖gîˀ dáyyûusuˀoḏi.
53002011	Sin	Heḏiho Yôesi Táḏáḏí in taˀgen namuuˀin diweḏi dívíyâaˀa̖míḏí ovâymä̂äní, heḏiho hôeyóḏa̖ˀ dívíwhä̖yu̖khâymáa.
45002024	Sin	Háa Yôesiví ta̖ˀnin diwe nata̖ˀmuu waa napoˀ, kinnân natû̖ˀdi: Háa un Huḏíyo ímuuˀin úvíˀoˀin namuuḏi nä́ˀin Huḏíyo dimuupíˀin Yôesiví̖ˀgeḏi yanäkí dívíhéeˀoˀ.
55003008	Sin	Ha̖ˀmin há̖hkannindá in taˀgen namuuˀin dâyyoegiˀoˀ, hä́nˀoe Jannes-áḏí Jambres-áḏí Moses-ví híˀ dä̂nyoegiˀan waabá. Nä́ˀin há̖hkanninbí ánshaa yä̖ˀḏâapîˀḏa̖ˀ dínmuuḏi inbí whä̖yu̖ Yôesivíˀpiyeho wíḏínchä̖ˀmuupí.
45005001	Faith	Heḏiho nää Naˀinbí Sedó Jesus Christ-di naˀindáḏí Yôesi Táḏá-áḏí díwón, gá Yôesi Táḏáḏá dícha̖a̖máaḏân tꞌaywó̖ˀdi wíˀâymáapí waagi naˀinbí whä̖yu̖ gínmuuḏi.
54004016	Recommendation	Nakhâyˀä̖ˀ biˀá̖yîngiˀa̖míˀin háa uví wówátsi mänhon waa heḏá hä̖ä̖wí ovâyhá̖ˀoˀi-á. Kin biˀâ̖a̖mí heḏânho wíˀbo biˀaywoeníḏí heḏá in toˀwên wôntꞌóyandeˀindá wáˀ ovâyˀaywoení.
44026011	Violence	Hä̖́yä́nbo naa omää in Huḏíyoví méesate eejepiye otsonpúuwíḏí ovâywhä̖́hwhä̖́ˀnamíḏí, heḏá dáykhä̖ä̖ dovâykaygiˀa̖míḏí ditú̖u̖níḏí Jesus-víˀpiye wíḏívíwä̖yundepíˀin. Naa hânho inbíˀpiye otꞌayyaapóeḏí Huḏíyo namuupîˀwi búˀ i̖ˀge dáykhenjíyénde dovâyhóeníḏí.”
44010043	Faith	Tꞌä̖hkí Jôesi Táḏáví tukheˀmindi dítu̖ˀan, tꞌä̖hkí toˀwên Jesus-víˀpiye dívíwä̖yundeˀinbí tꞌaywóˀdi dínˀowóˀjen. Jesus-ânkun ônkꞌûˀ gin dînˀa̖míḏí.”
45002007	Faith	Wáy wên tꞌowa-á hä̖̂ä̖ḏi wänbo tꞌä̖hkí híwó̖ˀ dívíkanhon, heḏi didaˀ Yôesiḏi ovâytegé-íˀin heḏá híwó̖ˀ ovâymáˀve-íˀin, heḏá didaˀ hä̂nhay wänbo tꞌä̖hkí diwówáyê̖e̖níˀin. Nä́ˀin tꞌowa-á Yôesiḏi wówátsi nahándepíˀin ovâymä̂äní.
44019004	Faith	Paul-di ovâytu̖ˀan, “John-di in tꞌowa ovâypꞌóˀpꞌoeˀan gá inbí tꞌaywóˀdi dâyjoeˀandân, heḏi ovâytu̖máa, ‘Naví tíˀúugé wí napowagíˀoˀivíˀpiye úvíwä̖ä̖yú̖-í.’ Heḏi hä̖ˀi-á Jesus-ân namuu.”
54004007	Recommendation	Hewänbo nä́ˀi híˀ pehtsiye waagiˀbá namuuˀi-á wínâaˀá̖yîngiˀa̖mípí, nä́ˀi híˀḏá tꞌowa-á Yôesi Táḏávíˀweḏá ovâywänpiyâaˀoˀ. U̖-á shánkíḏí ú̖khâyˀä̖ˀ bikhä̖́ä̖-íˀin uví wówátsi mänhûuwíḏí Yôesi Táḏá nadaˀ waabá.
44010048	Description	Heḏiho in Cornelius-ˀin ovâytu̖ˀan dínkhâyˀä̖ˀ dipꞌóˀpꞌoepúuwíˀin, dâykeeya̖míḏí Jesus Christ-víˀin dimuuˀin. Heḏáháˀ indi óedaaˀan wí hä̖́yú̖ thaa indáḏí iwóyí̖ˀníḏí.
45002019	Grace	heḏiho naˀándeˀ ovâypahûuwíˀin in toˀwên tsíˀtꞌaaˀin waagiˀinbá dimuuˀin, Yôesiví̖ˀgeḏi wíḏínhanginnáhpíḏí, heḏá in toˀwên phahkhu̖u̖ ee dikwꞌó̖ˀningîˀ-á wí kohthay waagibá namuu gin naˀándeˀ.
62002025	Grace	Heḏi Yôesi Táḏáví ay-á iví tu̖u̖ imä́gi in wówátsi nahándepíˀin naˀin dípä̖gítꞌóeˀin.
59003017	Description	Hewänbo i toˀwí oe kwꞌáye naˀä́ndiḏi híwó̖ˀnin hangintan dímä́giḏá, naˀin píˀnä́ khóˀyé híwó̖ˀdiḏa̖ˀ gínkwꞌó̖, heḏânho wíˀívíyá̖ˀbe-ípí, heḏá ûnpꞌoe kháapíˀin gimúní, heḏá wé̖ˀgeˀinbí ánshaa-á âyˀaˀginnamí, heḏá in dâytꞌôephaḏehonninbíˀpiyá gisehkanäpúwí heḏiho báyékí híwó̖ˀdi ingîˀ âyˀâ̖a̖mí, heḏá tꞌä̖hkí tꞌowa handa̖ˀ âymáˀve-í, heḏá wí paa waagibá wíˀívíyánúmáˀve-ípí.
43003035	Faith	Yôesi Táḏá iví ay iséegíḏí tꞌä̖hkí tsonkhuu óemä́gi hä̖ä̖wí tꞌä̖hkí i̖ˀgeḏi natsonyê̖e̖níḏí.
44018024	Description	Ihayhä̖̂ä̖ḏibá wí Huḏíyo sen Alexandria búˀ iwe naˀaypu̖yä̖ˀiˀ Apollos gin nakhá̖wä̖́ˀiˀ oe Ephesus-bá napówá. Nä́ˀi sendá nahíˀmagan, heḏá Jôesi Táḏáví taˀnindá híwóˀdá ôntaa.
56002015	Recommendation	Nä́ˀi hä̖ä̖wí i̖ˀgeḏi tꞌowa ovâyhéeˀa̖mí. Kaygi̖ˀdi ovâytu̖ˀâ̖a̖mí háa dívíˀâ̖a̖míˀin, heḏá in toˀwên híwó̖ˀpí dívíkanhonnin ovâytaˀgepꞌóegésaaní. U̖-á ú̖kꞌóe kin biˀa̖míḏí, heḏânho toˀwí wänbo wíˀûnkoeḏipíḏí wóeˀaˀginhá̖nú-íḏí.
62004009	Grace	Kinnân Yôesi Táḏáḏí dînkeeyan díséegíˀin: I-á iví wîˀ ayḏa̖ˀ ûnˀä́ndiˀ isan nä́ä oepáa kꞌayḏipiyeˀ heḏânho in koḏi̖ˀnin wówátsi dímä̂äníḏí.
43017024	Grace	“Naví Táḏá, naa odaˀ in u̖ḏi dímä́giˀin naa-áḏí dikwo̖ˀníˀin wáy naa ochangítꞌóe iwebá, heḏânho u̖ḏi naa hayˀi dípaaˀin dâymúníḏí. U̖ḏi naa hayˀi dípaa gá ho waˀḏi nä́ˀi nan oepáa nâakhíyépíḏíbo naa díséegíḏân.
45003016	Sin	wä̖́hä̖̂ä̖ dimää wänbo hä̖ä̖wí dâypeḏeeˀoˀ, heḏá tꞌowa-á ovâyḏaháachandoˀ.
44018017	Violence	Ihayḏi in tꞌowaḏi nä́ˀi Huḏíyoví méesate pꞌóˀḏéḏîˀ óeyâ̖ˀ, i-á Sosthenes gin nakhá̖wä̖́, heḏi Gallio-ví páaḏépiyebo óewhä̖ˀ, hewänbo háa dívíˀoˀindi Gallio wíˀóeˀá̖yîngimä́gipí.
43010039	Violence	Ihayḏi wíyá óepankéyíˀin didaˀ, hewänbo inbíˀweḏi namapꞌä̖́.
43012003	Description	Heḏi Mary wí ka̖ˀpꞌoe saˀwó̖ˀ nasu̖u̖ˀi nard kin dâytu̖ˀoˀiˀ imaa. I ka̖ˀpꞌoe-á wîˀ taa nakháa heḏá hânho nachä̖ˀmuu. Heḏáháˀ Jesus-ví ân deeḏi ônˀewe, heḏá iví phóḏá Jesus-ví ân deeḏi óepíḏi. I ka̖ˀpꞌoeḏi ee íve i̖ˀge tꞌä̖hkí saˀwó̖ˀ nasu̖ˀpꞌíḏe.
50003017	Recommendation	Tíˀûuwin páaḏéˀin, háa naa naví wówátsi donhon waabá un wáˀ tꞌä̖hkí hanbá unbí wówátsi bînhûuwí. In toˀwên yä̖ˀḏâaˀin wówátsi dâyhonnin háa wâykeeyan waagibá híwó̖ˀ bînmúní, heḏi háa dívíˀo waa un wáˀ hanbá úvíˀâ̖a̖mí.
59002024	Faith	Heḏiho únhanginná Yôesi Táḏáḏí wí toˀwí óecha̖a̖máa tꞌaywó̖ˀdi wíˀimáapí waagi iví híwó̖ˀdi tsiyekandi iwhä̖yu̖keeyoḏi, in whä̖yu̖ imáaˀin nawänpitú̖ḏíḏa̖ˀbá yoe.
45009014	Faith	Heḏân ti gitú̖ní Yôesi Táḏá-á taˀge wíˀiˀopí wí toˀwí óede̖ˀboḏi heḏá wíyá toˀwí óeyoegiˀoḏá? Heḏân yoe. I-áho ûnkoeḏi kin iˀa̖míḏí, heḏiho Moses óetu̖ˀan, Toˀwívíˀpiyeˀ naa odaˀi-áho oˀiyapúwí, toˀwívíˀpiyeˀ osehkanäkandaˀi-áho dósehkanäˀa̖mí.
45014001	Recommendation	Wí toˀwí iví whä̖yu̖ kayˀin wíˀûnmuupí wänbo binséegíkeˀ, hewänbo hä̖ä̖wí híwó̖ˀ nakaˀpóya̖ˀpí i̖ˀgeḏiḏa̖ˀ i-áḏí úvítu̖hä́nmâamíḏá yoe.
60003009	Recommendation	Wí toˀwíḏí jänäkí wovâyˀandi háa wovâytunsúuˀandi, híwóhpîˀḏibá wívînwáywáˀâa-ípí, hewänbo Jôesi bîndaaˀa̖mí híwó ônˀa̖míḏí. Hannânkun Jôesiḏi wovâytu̖ˀan úvíˀâ̖a̖ˀa̖míḏí, ivíˀin ímúuníḏí wovâytu̖hkánnan dihayḏi, heḏânho un wáˀ híwó iˀḏi wovâyˀâ̖a̖míḏí.
43008029	Grace	I dísandiˀ naa-áḏí nayiˀ. Wíˀbo wíḏíyoeˀanpí, gá naa-á hä̖̂ä̖ḏi wänbo tꞌä̖hkí i óehíhchandoˀiḏa̖ˀ dáyˀoḏân.”
50002013	Grace	Yôesi Táḏá-ân unbí píˀnä́ khóˀyé únˀä́ndí iwebá itꞌôemáa, heḏá iḏáho wovâykhä̖ge̖ˀmáa heḏânho ídaˀíḏí háa i natsonpóe waa úvíkanhûuwíˀin, heḏá wáˀ wovâykhä̖ge̖ˀdoˀ kin úvíˀâ̖a̖míḏí.
43015011	Grace	Nä́ˀi tꞌä̖hkí wâytu̖ˀan heḏânhoˀ i híhchan dómáa waagibá un wáˀ unbí píˀnä́ khóˀyé bînmáˀve-íḏí, heḏá tꞌä̖hkí híhchanda̖ˀ bînmáˀve-í.
54001001	Description	Naa Paul omuuˀi nä́ˀin ta̖ˀnin dóta̖ˀdoˀ. Naa Christ Jesus-ví tꞌôekhuwaˀi omuu, Yôesi Táḏá naˀinbí aywondi gínmuuˀiḏi heḏá Christ Jesus i pín taˀge hayḏi âytsíkhaˀmáaˀiḏá dítu̖ˀandi ki̖ˀbi tꞌôeˀi omúníˀin.
54002009	Recommendation	Heḏá in kwiyä̖ˀ wáˀ odaˀ ha̖ˀminbá dimúníˀin. Indá dínkhâyˀä̖ˀ híwó̖ˀda̖ˀ dívíˀáwe̖ˀbé-íˀin, dívíyêngiˀa̖mígîˀḏa̖ˀbá yoe, hewänbo dívípiˀaˀgindo waa díncha̖a̖-íḏí dívíˀawé-í. Wíḏívíwänpiphóhkoeḏiˀâ̖a̖mípí heḏá wíḏívíwänpitôenípí báyékí óeḏo-á, saˀwó̖ˀdi kꞌuu-á, aa hânho nachä̖ˀmuuˀi-á, dívíwänpicha̖a̖ˀâ̖a̖míḏí.
43002015	Violence	Wên púwhí̖ˀ whihkannindi ipaa, heḏi tꞌä̖hkí i méesate hayˀi iweḏi ovâykhe̖hpiye inbí kꞌúwá-á inbí wéyu-á wóegé, heḏi in dâychä̖ˀegóˀoˀindá inbí chä̖ˀ tꞌä̖mäpiyeˀ ovâychꞌáa heḏi inbí mä́äsa ovâyyánú.
60004012	Recommendation	Un naaḏi wâysígíˀin, tobáháa báyékí bîntꞌôephaḏendeḏi phaa i̖ˀge ímän waagibá ícha̖a̖ wänboˀ, wíˀítsikapúuwípí, “Háaḏan naa gin dînpoeˀo?” Wíˀítú̖u̖nípí, “Naa oˀân nä́ˀi dînpoeˀoˀi-á háˀto dînpúuwíˀin.” Nä́ˀi-á wovâytayi̖ˀníḏânho únpoeˀo.
44007024	Violence	Heḏi namää ihayḏi wí Egypt-wi sendi wí Israel-ˀiˀ sen óewa̖ˀoḏi óemûˀ, heḏiho Moses-di nä́ˀi Israel-ˀiˀ ônˀaywoeníḏí namää, heḏi háa iˀ Egypt-wiḏi iˀ Israel-ˀiˀ óeˀan waabá Moses-di iˀ Egypt-wi óeˀan óeḏahay píhay.
53003013	Recommendation	Hewänbo tíˀûuwin páaḏéˀin, undá ihayḏa̖ˀ híwó̖ˀda̖ˀ úvíkanhûuwí, wíˀúvíwóyí̖ˀnípí.
44007043	Sin	Naa díˀaˀginmä̂änívíˀweḏi wí hí̖yä̖̂ä̖ˀi teˀaaˀay phoˀ Moloch bînsóge bînhûuwíḏí, heḏá wí hä̖ä̖wí wí agóyó waabá ûncha̖a̖ˀiˀ Rephan gin dâytu̖ˀoˀi-á bînhon. Nä́ˀin wíjeḏi mandibo bînpaaˀin bînˀaˀginmä́gi. Heḏânho wên tꞌowa dovâysankhâymáa wovâyhúuwíḏí kayi̖ˀ wä̖́hä̖̂ä̖piye oe Babylon-ví shánkí onäḏi.
53002015	Recommendation	Heḏiho tíˀûuwin páaḏéˀin, toˀwí wänbo wívînmä̂änípí wovâyˀegóˀa̖míḏí háa úvíwhä̖yunde waagi, heḏá in khuu naˀindi naˀinbí híˀḏá heḏá ta̖ˀnindá wâyhá̖ˀannin wívînyoeˀa̖mípí.
54002011	Recommendation	Kwiyä̖ˀdáho hânda̖ˀdibo-á aˀgindi-á ee méesate dikwo̖ˀní Yôesiví tu̖u̖ dihá̖hpúwíḏí.
54005019	Recommendation	Wîˀḏa̖ˀ wí toˀwíḏí wên háawên híwó̖ˀpíˀin wí méesateˀi tsondi ônchä̖nundeḏi wínâatꞌóyaanípí. Hebo wên wíye háa poeye tꞌowa híwó̖ˀpí iˀannin ditú̖ḏíḏa̖ˀmânho ovâytꞌóyaaní.
45016016	Recommendation	Wíˀnä́ táye úvíséegísengitu̖ˀâ̖a̖mí. Tꞌä̖hkí Christ-ví méesate eeyewin tꞌowa tꞌä̖mäpiyeˀ dikwꞌó̖ˀnindi wovâysengitu̖ˀoˀ.
62003001	Grace	Bíˀánshaaˀan Yôesi Táḏáḏí naˀin báyékí díséegíˀin, heḏi báyékí díséegíḏânkun iví ây kin dítu̖ˀoˀ. Heḏi taˀgendi iví ây-ânkun gimuu. Heḏiho in toˀwên Yôesi Táḏá dâytaapíˀin dimuuˀindá wíḏínhanginnáhpí háawin gimuuˀin, háawi i namuu wänbo wíḏínhanginnáhpíḏí.
