44006001	Description	Ihayhä̖̂ä̖bá shánkí wänbo tꞌowa Jesus-víˀpiye dívíwä̖yundeˀ, heḏi in Israel nangeḏi jáˀwéḏí diˀä̖ä̖ˀin Huḏíyo in koḏi Israel-ˀinbíˀpiyeˀ ditꞌayyaapóe. Ditû̖ˀ in kwiyä̖ˀ inbí senäˀ díntꞌahánnin thamuwaagi ovâykoegîˀhä̖ä̖wímäˀ dihayḏi nä́ˀin jáˀwéḏí diˀä̖ä̖ˀin kwiyä̖ˀ shánkí hí̖ˀínda̖ˀ ovâykoegiˀmäˀ in koḏi Huḏíyo kwiyä̖ˀvíˀweḏi.
60002021	Grace	Jôesi Táḏáḏí wovâytu̖hkánnan ivíˀin ímúuníḏí heḏânho bîntꞌôephaḏende wänbo úvíyä̖́ä̖ˀamíˀin íhá̖hpúuwí, gá Christ wáˀ ungîˀ itꞌôephaḏeḏân. Gindiḏi wovâyjéye háa únkhâyˀä̖ˀ úvíˀâ̖a̖míˀin, heḏi iví a̖htaa i̖ˀgebá ímú-í.
53003010	Recommendation	Waˀḏi undáḏí giyiˀ ihayḏibo nä́ˀin tsontu̖u̖ wâymä́gi: Toˀwí natꞌôedaˀpîˀ-á wívînhúuyôenípí.
43003016	Grace	Yôesi Táḏáḏí tꞌä̖hkí tꞌowa hânho ovâyséegíḏí iví wîˀ ayḏa̖ˀ ûnˀä́ndiˀ imä́gi, heḏiho toˀwên tꞌä̖hkí iví ayvíˀpiyeˀ dívíwhä̖yu̖ˀin háˀto dipeḏée-í hewänbo wówátsi nahándepíˀin dâymáˀve-í.
44019015	Description	Hewänbo han ditú̖ ihayḏi, iˀ yä̖ˀḏâapîˀ pꞌoewa̖a̖hâ̖a̖ḏi ovâytu̖ˀan, “Jesus dótaa, heḏá toˀwí Paul namuuˀindá dînhanginná. Hebo undá — toˀinnan ímuu?”
44027002	Description	Wí sen Aristarchus gin nakhá̖wä̖́ˀi wáˀ naˀindáḏí najiˀ, i-á Macedonia nangewi búˀ Thessalonica iweḏiˀi namuu. Heḏi wí kophé Adramyttium búˀ iweḏiˀiˀ ívítógi. Nä́ˀi kophé-á nakhâymuu iˀ búˀây eeje oe Asia nange pꞌo kíngé i̖ˀgepiye namú-íḏí.
44007005	Description	Jôesi Táḏáḏí Abraham hä̖ä̖wí wänbo nä́ˀi nange iwe wíˀóemä́gipí ivîˀ ûnmúuníḏí, wí nan iˀa̖hkêeníˀi wänbo joe. Hewänbo Jôesi Táḏá iví tun imä́gi wáy wí thaa nä́ˀi nan óepä̖hkhâymáaˀin ivîˀ ûnmúuníḏí, heḏá owáy nachuu ihayḏá iví tíˀúugé kä̖ˀä̖ä̖ˀindá inbîˀ dínpuwagíˀo. Heḏi nä́ˀi tꞌä̖hkí Jôesi Táḏáḏí Abraham óetu̖ˀan waˀḏi iví páaḏéˀi ay ûnpu̖yä̖píḏíboˀ.
44007019	Description	I-á wên háawên jänäkíˀin nanbí tꞌowavíˀpiye iˀan, iˀḏá nanbí thehtáy pahpáˀin ovâykaygiˀan inbí ây hí̖ˀínnin jáˀwébo dâyjoeˀa̖míḏí dínchuu-íḏí.
43020003	Description	Heḏiho Peter-áḏí i wîˀ khä̖ge̖ˀdi-áḏí Jerusalem búuˀúḏí dapeeḏi i tꞌovápho iwepiye damää dä̂nmúníḏí háa iwe nakꞌóeˀin háa yoe.
44024016	Faith	Heḏi gin dáywä̖yundeḏi, hä̖̂ä̖ḏi wänbo tꞌä̖hkí dáykhä̖ä̖ḏe Jôesi Táḏáví páaḏépiye heḏá tꞌowaví páaḏépiyá híwó dáytsiyeˀa̖míḏí, heḏânho naví píˀnä́ khóˀjé dînhanginnáaníḏí híwó dáykanhonnin.
45007005	Sin	Háa giwänpidaˀ waagi ívítꞌaywó̖ˀdoḏi naˀinbí wówátsi âyhonwänhoˀ, heḏi ihayḏá wíyá shánkí ívítꞌaywó̖ˀnamíˀin gidaˀpoˀ nä́ˀi tsontu̖u̖ gitꞌoˀḏi, heḏi chuwa iwe gipóya̖ˀwän nä́ˀi tꞌaywó̖ˀdiḏi naˀinbí túuˀú dîntsonmáaḏíboˀ.
54002007	Faith	Heḏi Yôesiḏi naaho dísóge igîˀ dáyhéeˀa̖míḏí heḏá iví tꞌôekhuwaˀi-á omúníḏí, tꞌowa dovâytꞌôeˀa̖míḏí nä́ˀi hä̖ä̖wí i̖ˀgeḏi. In taˀgen wâytu̖máa, wíḏáyhôeyómáapí, naaho dísógeˀi-ân omuu nä́ˀin Huḏíyo dimuupíˀin tꞌowa dovâyhá̖ˀa̖míḏí háa dívíwhä̖yú̖-íˀin heḏá hä̖ä̖wí taˀgen namuuˀi-á.
62003024	Faith	Toˀwên Yôesi Táḏáví tsontu̖u̖ ônˀaˀginhonnindá i-áḏí wé̖ˀge dimuu, heḏá i-á indáḏíbá namuu, heḏi nä́ˀin gínhanginná gá iví Yä̖ˀḏâaˀi Pꞌoewa̖a̖hâ̖a̖ dímä́giḏân.
45012016	Recommendation	Tꞌä̖hkíḏí handa̖ˀ úvímáˀve-í. Wíˀúvíyêngiˀánshaamáˀve-ípí, hewänbo in wä̖hphaḏe kwꞌáyeˀin dimuupíˀindáḏí úvíwóení. Wíˀíˀâ̖a̖nípí hä̖ä̖ tꞌä̖hkí íhá̖ˀin.
43006056	Faith	Toˀwí naví tûu ûnpꞌoeḏi óekhóekhú̖u̖mä́giˀi-á naa-áḏí namuu heḏá naa-á i-áḏá.
43011027	Faith	Martha-ḏi óetu̖ˀan, “Heḏân ha̖a̖, Naˀinbí Sedó, naa dáywhä̖yundeˀ u̖-ân unmuu i Yôesi Táḏáḏí wóesógeˀiˀ tꞌowa ovâyˀaywoeníḏí, Yôesi Táḏáví ay-ân unmuu. Ívítsíkhaˀmáawän nä́ä oepáa kꞌayḏipiyeˀ unˀä̖́ä̖-íḏí.”
44002042	Faith	Heḏi ginnân dívíkanhon: In Jesus-ví tꞌôekhuwaˀinbí há̖hkan tꞌä̖hkí dâytꞌôeyandeḏá dâysígíhóndeˀ, heḏá in wéˀgen dívíwä̖yu̖ˀindáḏí híhchandi dívíwéˀgeˀoˀ, heḏá wéˀgá dívíhúujoḏá dívíjûusuˀoˀ.
44012002	Violence	Heḏá wáˀ natsonpóe James wí tsijó pháˀḏí óeháyjíḏí, i-á John-bí páˀḏây ûnmuu.
55002016	Recommendation	In tꞌowa Yôesi dâyˀaˀginpí waa dívíhéeˀoˀinbíˀweḏi heḏá toˀwên inbí híˀ dínchä̖ˀmuupíˀinbíˀweḏi biyâaˀa̖mí. Haˀwâaˀi híˀḏí tꞌowa Yôesivíˀweḏi shánkí ovâyyâaˀoˀ.
62003015	Sin	Toˀwên inbí tíˀûuwin páaḏéˀin dínmuuˀin dâytꞌayhonnindá tꞌowa tꞌa̖kha̖nuˀin waagiˀinbá dimuu, heḏi un únhanginná wí toˀwí natꞌowatꞌa̖kha̖nutꞌóeˀi-á in wówátsi nahándepíˀin wíˀimáapíˀin.
43021015	Faith	Dívíhúubowa ihayḏi Jesus-di Simon Peter óetsikáyin, “Simon, John-bí ay, ti u̖ḏi naa díséegí nä́ˀin wé̖ˀgeˀindiví shánkí?” Peter-di óetu̖ˀan, “Hoi, Naˀinbí Sedó, u̖-ân ú̖hanginná naaḏi wíséegíˀin.” Jesus-di óetu̖ˀan, “In tꞌowa naví kꞌúwáˀây waagiˀinbá dînmuuˀin ovâyhúuyôení.”
44007013	Description	Heḏi wíyá dimää ihayḏi Joseph-di ovâykeeyan i-á inbí tíˀûu dínmuuˀin, heḏá Pharaoh-á ûntsꞌanhanginpóe toˀwên Joseph-ví tꞌowa ûnmuuˀin.
60003010	Recommendation	Iví taˀnin diwe ginnân ûntaˀmuu: Wí toˀwí iví wówátsi híhchandi ihûuwíˀin nadaˀiˀ heḏá híwóˀdi thaa nadaˀḏá, wíˀûnkhâyˀä̖hpí yä̖ˀḏâapí tun ihéeˀa̖míˀin heḏá wínahójotꞌôenípí.
44004032	Description	Tꞌä̖hkí in Jesus-víˀpiye dívíwä̖yundeˀin handa̖ˀ diˀánshaapóe, heḏá wêeḏa̖ˀ dimuu waa dicha̖a̖ inbí píˀnä́ khóˀjé. Toˀwí wänbo wínatú̖hpí, “Nä́ˀi naa dómáaˀiˀ navîˀḏa̖ˀ dînmuu,” hewänbo tꞌä̖hkíḏíbo inbí hä̖ä̖wí tꞌä̖hkí dívíyä̖́múndeˀ.
44013048	Faith	In Huḏíyo dimuupíˀin iwebá dijiˀin nä́ˀi híˀ ditꞌoeḏi hânho dihíhchanpóe, heḏi ditú̖, “Nanbí Sedó Jôesi Táḏáví híˀ híwóˀdi ûnmuu.” Heḏi tꞌä̖hkí in toˀwên Jôesi Táḏáḏí ovâydeˀmannin nä́ˀin wówátsi nahándepíˀin dâykáyjíḏí ivíˀpiye dívíwä̖yu̖.
50004009	Recommendation	Naví híˀ ítꞌoe heḏá naví tsiyekan dînmûˀ, heḏiho tꞌä̖hkí navíˀweḏi íhá̖hpóeˀi-áḏí i há̖hkan navíˀweḏi bînhógiˀi-áḏí ihayḏa̖ˀ úvíkanhûuwí, heḏi kin úvíˀoḏá Yôesi Táḏá undáḏí nayê̖e̖ní, iḏá díkhä̖ge̖ˀdoˀ ánshaaginpíḏíbo gikwo̖ˀníḏí.
53003015	Recommendation	Naa wóˀtu̖ˀdaˀpí toˀwí ha̖ˀbiˀ namuuˀiˀ unbí hä́nbiˀ únmuu waagibá bîncha̖a̖máˀve-íˀin, hewänbo shánkíḏí unbí tíˀûu bîntumakheˀo waagibá nä́ˀi toˀwí bîntumakheˀa̖mí heḏânho i-á ûnhanginpúwíḏí híwó̖ˀ wíˀikanhonpíˀin.
50003014	Faith	Wí ä̖ä̖ˀiˀ páaḏébo napówá-íḏí ikhä̖ä̖ḏe waabá naa wáˀ dáykhä̖ä̖ḏe heḏânho hä̖ä̖wí Yôesi Táḏáḏí dímä̂äníˀin otꞌanpúwíḏí. Heḏi kinnân iḏi dînkhâymáa: Christ Jesus naagîˀ iˀannin namuuḏi Yôesi Táḏáḏí makówápiyeˀ dítu̖kánkhâymáa.
56002014	Faith	I-á naˀingîˀ ipimä́gi naˀinbí tꞌaywó̖ˀdi iweḏi dímaˀpꞌä̖́ḏi-íḏí heḏá nä́ˀi tꞌaywó̖ˀdi dînyâaˀa̖míḏá, heḏânho taˀgendi iví tꞌowa gimúníḏí, heḏi pín taˀge hayḏi gidaˀíḏí híwó̖ˀda̖ˀ ívíkanhûuwíḏí.
43005024	Faith	“Taˀgendi wâytu̖máa, toˀwên naví híˀ dîntꞌóyandeḏi heḏá i naa dísandivíˀpiyeˀ dívíwhä̖yundeḏá wówátsi nahándepíˀin dâymáa, heḏi wíˀovâytuchä̖nú-ípí. Chuˀin waagiˀinbá nää wíḏimuupí, gá wówátsi dâykêˀḏân.
50003019	Sin	Indáho péyégépiyeho dimän. Yôesi dâyˀaˀginmä̂änívíˀweḏi húukandá su̖wä̖-á i̖ˀgeḏi shánkí dívíˀánshaaˀoˀ. Hä̖ä̖wí wôedaˀwó̖ˀdi dívíˀoˀ i̖ˀgeḏá dívíyêngihéeˀoˀ. Indá i hä̖ä̖wí nä́ä oepáa kꞌayḏiwi i̖ˀgeḏiḏa̖ˀ dívíˀanshaamáa.
54003006	Sin	Heḏi i-áho Jesus-víˀpiyeˀ itsꞌanwhä̖yu̖ˀi wínamúnípí, gá ki̖ˀbi namuuḏáho maˀḏi iyêngi-í heḏi kin iˀandáho Yôesi Táḏá iví̖ˀgeḏi natú̖ní itꞌaywó̖ˀnan gin, háa Yôesi Táḏá i Penísendiví̖ˀgeḏi natú̖ waabá, iyêngimáaḏí itꞌaywó̖ˀnan.
44004002	Description	Háa in wíjeḏi in tꞌowa ovâyhá̖ˀoˀin wíˀovâyhí̖ˀanpí, gá Jesus nawáywówápóe i̖ˀgeḏi ovâytu̖máaḏân, heḏi nä́ˀi natundaˀ wéˀgen tꞌowa ho dichuuˀin wáˀ diwáywówápuwagíˀo.
43004046	Description	Ee Galilee nange iwebá, i búuˀúˀay Cana gin dâytu̖ˀo iwepiyeˀ Jesus nawáymää. Iwânkun naná hä́ndíḏí pꞌoeḏi ho iméenapaa. Ee Cana wí sen hayˀi nayiˀ, heḏi iví eˀnú oe Capernaum búuˀúˀay iwe ûnhaykꞌóe.
45012011	Recommendation	Wíˀíbâa-ípí, hewänbo pín taˀge hayḏi Naˀinbí Sedó Yôesigîˀ úvítꞌôeˀa̖mí.
60001008	Faith	Undi Jesus bînsígí tobá wáymûu wänbo bînmûˀpí wänboˀ. Heḏi tobá nää bînmúndepí wänboˀ ivíˀpiye úvíwä̖yundeˀ, heḏá iweḏi hânho-á íhíhchan. Unbí híhchandá báyékí únmuu heḏá hânho saˀwóˀdi-á únmuuḏi ihay híˀ-á wíˀúnkwꞌóhpí bînthayya̖míḏí háawi únmuuˀin.
62004013	Grace	Kindiḏân gínhanginná Yôesi Táḏá-áḏí wé̖ˀge gimuuˀin heḏá i-á naˀindáḏá: Iḏi iví Yä̖ˀḏâaˀi Pꞌoewa̖a̖hâ̖a̖ dímä́gi.
43019029	Description	Iwe núˀ wên sä̖ˀä̖́wé whoegiˀin naméenaˀoyohayˀisaaˀin nachá̖, heḏiho wên hä̖ä̖wên napꞌohsaaḏeeˀin i méena iwe dâypꞌohtógi, heḏi wên poesú hyssop kin dâytu̖ˀoˀ eeḏi dâytꞌiˀkꞌûˀḏi Jesus-ví sóe iwepiyeˀ ôntegeḏi,
45016017	Recommendation	Tíˀûuwin páaḏéˀin kaygi̖ˀdi wâytumakhemáa, in toˀwên wovâywiyé-íˀin heḏá in taˀgeˀin pꞌôe iweḏi wovâyhângeˀa̖míˀin didaˀinbí̖ˀgeḏi úvíˀá̖yîngiˀa̖mí, indáho hä̖ä̖wí íhá̖hpóeˀivíˀweḏi wíyá piháawi wovâyhá̖ˀoˀ. Inbíˀweḏi úvíyâaˀa̖mí.
45012007	Recommendation	Toˀwí méesatewi khä̖ge̖ˀdiˀ namúníˀin ûnkoeḏiˀi-á ûnkhâyˀä̖ˀ híwó̖ iˀa̖míˀin. Toˀwí Yôesiví tu̖u̖ ovâyhá̖ˀa̖míˀi namuuˀi-á ûnkhâyˀä̖ˀ híwó̖ˀ ovâyhá̖ˀa̖míˀin.
43016023	Faith	“Heḏi ihayḏi wíˀúntâynípí hä̖ä̖wí wänbo dítsikáyi̖ˀníḏí. Taˀgendi wâytu̖máa, hä̖ä̖wí naví Táḏá bîndaaˀandiˀ, navíˀpiyeˀ úvíwhä̖yundeḏi, iḏi wovâymä̂äní.
59004017	Sin	Toˀwí ûnhanginnândi ûnkhâyˀä̖ˀin híwó̖ˀ iˀa̖míˀin hewänbo iˀanpíḏá, i-á itꞌaywó̖ˀdoˀ.
43016002	Violence	In Huḏíyoḏi inbí méesate íve wovâytsuḏekhâ̖a̖ˀa̖mí, heḏá wáˀ shánkí wänbo únpúwí, wáy wí thaa nanáˀ diwe wovâytꞌa̖há̖núḏáho diˀâ̖a̖ní Yôesi Táḏágîˀ dívítꞌôemáaˀin.
43018023	Description	Jesus-di óetu̖ˀan, “Wên háawên híwó̖ˀpíˀin naa otú̖ḏáhoˀ, ú̖khâyˀä̖ˀ ovâytu̖ˀâ̖a̖míˀin hä̖ä̖wí namuuˀin. Hewänbo háa otú̖ waa in taˀgen namuu-ákun, heḏânho wíˀú̖kꞌóepí dítsꞌemapháve-íˀin.”
50004003	Recommendation	Heḏá u̖ taˀgendi naa-áḏí bitꞌôeˀoˀiˀ unmuuḏi, wídaˀmáa nä́ˀin kwiyä̖ˀ ovä̂nkhä̖ge̖ˀnamíḏí wîˀ dapúwíḏí, indá däntꞌôeˀoˀ i híwó̖ˀdi tu̖u̖ Jesus-ví̖ˀgeḏi tꞌowa dä̂ntꞌôeˀa̖míḏí. Heḏá Clement-dáḏí wây-á wé̖ˀgeˀindáḏí hanbá dívítꞌôeˀoˀ, inbí khá̖wä̖́-áho in ta̖ˀnin diwe dínta̖ˀmuu, iwe natû̖ˀ toˀwên dimuu in wówátsi nahándepíˀin dâymáaˀin.
45006002	Sin	Heḏân yoe. Tꞌowa chuˀin dimuuˀindá wíḏívítꞌaywó̖ˀdopí, heḏiho tꞌowa chuˀin waagiˀinbá gínkhâyˀä̖ˀ gimúníˀin heḏânho tꞌaywó̖ˀdi eeye wíˀívíhûuwípíḏí.
54006009	Sin	Hewänbo in toˀwên dikoḏitꞌowapáa-íˀin diwänpidaˀin dimuuˀindá yä̖ˀḏâapíḏa̖ˀ dívíkanhûuwíˀin dichanpoˀ, i hä̖ä̖wí didaˀi dâyhóníḏí. Inbí tꞌaywó̖ˀdi dínmúníˀiḏi wên phay ovâykꞌûˀ waabá dínpóe, heḏi iwe diwhêe. Indá dívíˀánshaaˀanpíḏíboˀ i hä̖ä̖wí ovâywänpiwha̖hkangítꞌóeˀi didaˀ, heḏi nä́ˀi hä̖ä̖wíḏá áagépiyeˀ ovâywhá̖ve-í heḏá peḏee iwe ovâytôení.
45003009	Sin	Nää otsikapúwí, ti naˀin Huḏíyo shánkí híwó̖ˀnin gimuu in wé̖ˀgeˀin tꞌowavíˀweḏi? Heḏân yoe. Naaḏi ho wâykeekwꞌóḏi tꞌä̖hkíḏíbo tꞌaywó̖ˀtoˀinda̖ˀ gimuuˀin, naˀin Huḏíyo-á heḏá in Huḏíyo dimuupíˀindá.
44007041	Sin	Ihayhä̖̂ä̖ḏi wí hä̖ä̖wí wí wáasíˀay waa ûncha̖a̖ˀi dâypaa, i-á inbí jôesi dínmuu waa dâycha̖a̖, heḏá dâyˀanimâatꞌahá̖nú inbí aˀgin dívímä̂äníḏí, heḏi nä́ˀi hä̖ä̖wí inbí mandibo dâypaaˀiˀḏi báyékí ovâyhíhchanmä́gi.
44002040	Recommendation	Báyékí wíyá ha̖ˀbibá Peter-di kayˀindi ovâytu̖ˀan, heḏá háa dívíˀa̖míˀin ovâytumakheˀandi ovâytu̖ˀan: “Úntáy wovâyˀaywoeníˀin heḏânho wíwovâytuhchä̖ä̖nú-ípíḏí nä́ˀin híwóhpíˀin tꞌowa nä́we dithaaˀin ovâytuhchä̖nukhâymáa waagibá.”
45008013	Faith	Háa íwänpidaˀ waagiḏa̖ˀ unbí wówátsi bînhondá íchuu-í. Hewänbo i Yä̖ˀḏâaˀi Pꞌoewa̖a̖hâ̖a̖ úvímä́giḏáho wovâykhä̖ge̖ˀnamíḏí i tꞌaywó̖ˀdi unbí túuˀúḏí úvíˀoˀi bînyâaˀa̖míḏí, kindiḏânho in taˀgennin wówátsi bînkéyí.
45010011	Faith	Yôesiví ta̖ˀnin diwá ûntû̖ˀ, In toˀwên ivíˀpiyeˀ dívíwhä̖yundeˀindá háˀto dichanpúwí híwó̖ˀpîˀpiyeˀ dívíwhä̖yundeˀin.
45001008	Faith	Heḏi nää-á hä̖̂ä̖ḏi Jesus Christ dóhéeˀan ginhay-á Yôesi naví Táḏá dókú̖ˀdaaˀoˀ un tꞌä̖hkí ímuuḏi, gá wéngé tꞌä̖hkí tꞌowa dívíhíˀmáaḏân unbí whä̖yu̖ i̖ˀgeḏi.
52001004	Faith	Tíˀûuwin páaḏéˀin, un Yôesi Táḏáḏí wovâyséegíˀin, gínhanginná iḏi wovâyde̖ˀmannin ivíˀin ímúníḏí.
60004008	Recommendation	Nä́ˀindá shánkí nachä̖ˀmuu: Pín taˀgeḏi wíˀnä́ táye úvísígíhûuwí, gá tꞌowa bînsígíḏá báyékí inbí tꞌaywóˀdi bînˀowójéndeḏân.
44027001	Description	Heḏiho in tsonnin diˀánshaapóe naˀin kophé iweḏi oe Italy-piye dísaaníḏí, heḏiho Paul heḏá wây-á pandáḏí ovâyjoeˀan wí tä̖gintä̖ (100) sundaḏo ovâytsonmáaˀiví mange. Nä́ˀi sendá Julius gin nakhá̖wä̖́, heḏi in sundaḏo iˀ Rome-wi tsondi pꞌóˀḏéḏîˀvíˀin gin ovâykhá̖yä̖́ˀdeˀin diweḏiˀi-ân namuu.
60002002	Faith	Wí hínchä̖́ˀi ay natsꞌanˀaypu̖yä̖ˀi nawâapꞌodaˀ waagibá, un wáˀ únkhâyˀä̖ˀ hânho ídaˀíˀin Jôesiví tun íhá̖hpúuwíˀin. Iví tundá yä̖ˀḏâaˀiḏa̖ˀ ûnmuu, heḏá nä́ˀi tundá unbí píˀnä́ khóˀjé únkwꞌôndi wovâykhóekhú̖u̖mäˀ, heḏiho bînhógiḏá unbí wä̖yu̖-á únkaypúuwí, heḏá wovâyˀaywoení.
59001027	Faith	Hewänbo wí toˀwíḏí Yôesi naˀinbí Táḏá taˀgendi óeˀaˀginmäˀi-á kinnân ikhâymáa: In toˀwên yíyápíˀindá táḏápíˀindá dimuuˀin heḏá in kwiyä̖ˀ inbí senäˀ dínchuuˀin dimuuˀindá iḏi ovâypu̖wä̖khâymáa ovâykhä̖ge̖ˀnamíḏí inbí tꞌôephaḏe iweḏi ovâyyâaˀa̖míḏí, heḏá wáˀ ipiˀá̖yîngiˀa̖mí heḏânho nä́ˀi yä̖ˀḏâapíkan in tꞌowa Yôesi Táḏá dâytaapíˀin dívíˀoˀi namuuˀiḏi wíˀóepeḏeeˀa̖mípíḏí.
44007058	Violence	Heḏi khóhkayḏi oe búˀ jáˀwépiye óehoˀ, heḏi in ôntꞌeˀpꞌíḏeˀin inbí kꞌéwéˀi to dívípꞌä̖́ḏiḏi wí eˀnú Saul gin nakhá̖wä̖́ˀiví núˀ dâyjoeˀan iˀá̖yîngiˀa̖míḏí, heḏáháˀ Stephen óekꞌusä̖yu̖ óeháyjíḏí.
45015011	Faith	Heḏá wíyá wáygá wáˀ nata̖ˀmuu: Un Huḏíyo ímuupíˀindi Naˀinbí Sedó bintégé, un tꞌowa tꞌä̖mäpiyeˀ ówîngeˀindi báyékí bintégé.
45011036	Faith	Yôesi-áho hä̖ä̖wí tꞌä̖hkí ikhíyé. Hä̖ä̖ tꞌä̖hkí waˀḏi namän Yôesiví mange imáaḏí, heḏá hä̖ä̖ tꞌä̖hká ivîˀ-á ûnmuu. Heḏiho hä̂nhay wänbo tꞌä̖hkí kwꞌáayéboˀ âymáˀve-í. Hamân.
43001029	Faith	Wíyá tháwä́n John-di Jesus óemûˀ ee nayiˀ iwepiyeˀ naˀä̖ḏi, heḏi iví̖ˀgeḏi natú̖, “Binmúˀḏí i naˀä̖ˀiˀ. I-á Yôesi Táḏáḏí óesan wí kꞌúwáˀay waagiˀbá nachúu-íḏí, tꞌä̖hkí tꞌowaví tꞌaywó̖ˀdi ovâyyâaˀa̖míḏí.
43010010	Grace	Wí sänbiˀ-á naˀä̖ˀ in kꞌúwá ovâysänhóníḏí heḏá ovâytꞌa̖há̖nú-íḏá, heḏá ovâyháˀḏä̂nnamíḏá. Hewänbo naa-á oˀä̖ä̖ tꞌowa dovâywówátsimä̂äníḏí, heḏi nä́ˀin wówátsi dovâymäˀi-á shánkí híwó̖ˀnin namuu.
50003020	Faith	Hewänbo naˀindáho makówá i̖ˀgeḏá ívíˀánshaaˀoˀ, gá iwá naˀinbí ú̖wä̖́nä́ waagibá gínnândân, heḏiho pín taˀge hayḏi âytsíkhaˀmáa naˀinbí aywondi gínmuuˀiˀ iweḏi gínwáyˀä̖ä̖-íḏí, i-á Naˀinbí Sedó Jesus Christ namuu,
45015007	Recommendation	Wíˀnä́ táye bíséegíhóˀgí. Christ-di un wovâyséegíhógi waagibá, un wáˀ wíˀnä́ táye úvíséegíhûuwí, heḏânho tꞌowa Yôesi Táḏá dâytegé-íḏí.
44021024	Recommendation	Indáḏí ópûn, heḏi háa ditú̖ waa dívíbowaˀin dâykeeyan dihayḏi, u̖-á háa dívíˀo waa hanbá biˀa̖mí, heḏá ingîˀ ovâywáˀâa-í tꞌä̖hkí ovâykꞌoewá-íḏí. Gin biˀandáho tꞌä̖hkí tꞌowa dínhanginnáaní nä́ˀi Moses-ví tsontun mânˀaˀgindoˀin, heḏiho hä̖ä̖wí uví̖ˀgeḏi ditû̖ˀdi-á taˀgen wínamuupíˀin.
45004012	Faith	Heḏá in toˀwên kin ditaamuuˀindá wáˀ Abraham-dá inbí táḏá waagiˀbá dínmuu, hewänbo in tꞌä̖hkívîˀ-á yoe. Abraham-bí ây waagiˀin taˀgendi dimúníḏí, indá díntáy iví a̖htaa eeye dívíˀa̖htuyé-íḏí, i waagibá whä̖yu̖ dâymáˀvé-íḏí, in taaḏa̖ˀbá yoe, gá nä́ˀi whä̖yu̖-áho Abraham imáaḏân waˀ in taa ikêˀpíḏíboˀ.
44001026	Description	Heḏi wíje kꞌuˀây eeḏi in senäˀbí khá̖wä̖́ ovä̂ntaˀkꞌûˀ, heḏi wêe kꞌuu dâykêˀ Matthias-ví khá̖wä̖́ ûnkꞌóeˀiˀ. Heḏiho Matthias-á wí Jesus-ví tꞌôekhuwaˀi-á napóeḏí in wéˀgen tꞌôekhuwaˀindáḏíbá iwón.
45004007	Grace	Kinnân ita̖ˀnan: In toˀwên inbí yä̖ˀḏâapí tsiyekan ovâyˀowóyéˀindáḏí in toˀwên inbí tꞌaywó̖ˀdi ovâyyâaˀannindáḏí dihíhcha̖a̖.
59004009	Recommendation	Unbí tꞌaywó̖ˀdi únmuuḏi bítaachanpuwave, heḏá bíkꞌáykháapuwave, heḏá bísíhtä̖ä̖. Íséeyê̖e̖níˀin únkhâyˀä̖ˀ ípꞌâayê̖e̖nívíˀweḏi. Íhíhcha̖a̖-ívíˀweḏi, bînkeeya̖mí íkꞌáykháapóeˀin.
64001011	Recommendation	U̖ wíséegíˀiˀ, in toˀwên híwó̖ˀ dívítsiyekanhonnin waagiˀbá unmúní, in híwó̖ˀpîˀ dívítsiyekanhonnin waagá yoe. Toˀwên híwó̖ˀ dívítsiyekanhonnindá Yôesi Táḏávíˀin dimuu, hewänbo in toˀwên híwó̖ˀpîˀ dívítsiyekanhonnindá wíḏínhanginnáhpí háawi i namuuˀin.
45004011	Faith	Tíˀúugéḏân Yôesi natú̖ Abraham in taa ikéyíˀin nathaypúwíḏí Yôesiḏi ho óecha̖a̖máaˀin tꞌaywó̖ˀdi wíˀimáapí waagi. Hewänbo kin Yôesi ho iˀan Abraham-bí whä̖yu̖ ûnmuuḏibo waˀ in taa imáapíḏíboˀ. Heḏânkun Abraham-dá tꞌä̖hkí in toˀwên taˀgendi Yôesivíˀpiyeˀ dívíwhä̖yundeˀinbí táḏá waagiˀbá dínmúní, tobá nä́ˀin Huḏíyoví kꞌewe̖ˀ taa dâymáapí wänboˀ, heḏi in wáˀ Yôesiḏi ovâycha̖a̖máa tꞌaywó̖ˀdi wíḏâymáapí waagi.
45006007	Grace	gá toˀwên dichuuˀindá tꞌaywó̖ˀ diweḏi dimaˀpä̂ndân.
50002021	Sin	Tꞌä̖hkí in wé̖ˀgeˀin inbí wówátsi i̖ˀgeḏiḏa̖ˀ dívíˀánshaamáa, Christ Jesus-ví tꞌôe i̖ˀgeḏá yoe.
43006039	Grace	I dísandiˀ nadaˀ in tꞌowa naa dímä́giˀin naaḏi dovâyˀá̖yîngiˀa̖míˀin heḏânho wîˀ wänbo in diweḏi wínapeḏée-ípí, hewänbo i tꞌä̖ˀgi thaa nanáˀ dihayḏi naaḏi in tꞌä̖hkí wíyá dovâywáywówápaa-í.
52003006	Description	Hewänbo nää-á Timothy naˀinbíˀwe nawáypówá, heḏi wí híwó̖ˀdi tu̖u̖ úvíkanhon niˀgeḏi dînkán. Iḏi dítu̖ˀan unbí whä̖yu̖ waˀḏi únkayˀin heḏá séegí-á bînmáaˀin, heḏá hä̖̂ä̖ḏi wänbo tꞌä̖hkí naˀinbí̖ˀgeḏi híwó̖ˀda̖ˀ úvíˀánshaamáaˀin, heḏá taˀgendá ídaˀin wíyá díwáymúníˀin, naˀindi wâymúníˀin gidaˀ waagibá.
60005004	Grace	Christ-á iˀ kꞌúwá á̖yí̖ˀdi pꞌóˀḏéḏîˀ waagiˀbá namuu. Heḏi híwó igîˀ úvítꞌôemáaḏá, owáy nawáypówá ihayḏi iˀ úntꞌanmuuˀiˀ bînhóení, hä̖ˀi-á hä̂nhay wänbo saˀwóˀdi namúuní heḏá háˀto nahá̖a̖ní.
43012006	Sin	
62004016	Faith	Heḏiho gihá̖hpóe heḏá ívíwhä̖yunde Yôesi Táḏáḏí díséegíˀin. I-ân naséegítꞌóe, heḏi toˀwên in séegí dâyhonnindá Yôesi Táḏá-áḏí dimuu heḏá i-á indáḏá.
44011019	Description	Stephen óehay ihayḏi pha̖a̖piyeḏi in Jesus-víˀpiye dívíwä̖yu̖ndeˀin ovâyjänäkíˀoˀ heḏiho tꞌä̖mäpiye dishavemää. Wáy wên oe Phoenicia nangepiye dimää, wây-á oe Cyprus nangepiyá, heḏá wây-á oe Antioch búˀpiyá. Eeje indi in Huḏíyo tꞌowaḏa̖ˀmânho Jesus-ví̖ˀgeḏi ovâytu̖ˀan, in Huḏíyo dimuupíˀin tꞌowa-á joe.
54006006	Faith	Hewänbo in toˀwên Yôesiví khuu ipiyeˀ dívíwhä̖yundeˀindáho dihíhcha̖a̖ i hä̖ä̖wí dínkwꞌó̖ˀdiḏiboˀ, heḏiho koḏitꞌowa waagiˀinbá ho dimuu.
60002020	Faith	Yä̖ˀḏâapíkan úvíˀoḏi wovâywhä̖́ḏiḏi úvíyä̖́ä̖ˀandáhoˀ, i̖ˀgeḏi wíˀúvíjêngihéeˀa̖mípí. Hewänbo tobá híwó úvíˀo wänbo wovâytꞌôephadekandoḏáhoˀ, heḏá úvíyä̖́ä̖ˀandá, Jôesi Táḏá undáḏí nahíhchanpúuwí.
45006001	Sin	Báyékí tꞌaywó̖ˀdi dînˀowóyéndeḏiho Yôesiví séegísehkanä shánkí ûnkeepoˀ. Heḏiho hân gínkhâyˀä̖ˀ ívíˀa̖míˀin? Ti in taˀgen gínkꞌóe ívítꞌaywó̖ˀkanhûuwíḏí wíyá shánkí iví séegísehkanä ûnkeepúwíḏíboˀ?
45004016	Faith	Heḏânkun hä̖ä̖wí híwó̖ˀdi ívíˀanpíḏíbo Yôesi iví tu̖u̖ imä́gi tꞌä̖hkí in Abraham-bí ây iweḏiˀin dimuuˀin dínkoeḏi iví séegísehkanä dâykéyíˀin inbí whä̖yu̖ dínmuuḏi. Heḏi kin Yôesiḏi ovâyˀâ̖a̖mí in toˀwên i tsontu̖u̖ dâymáaˀinda̖ˀbá yoe, hewänbo tꞌä̖hkí in toˀwên dívíwhä̖yundeˀin Abraham iwhä̖yu̖ waagibá. Abraham-dá táḏá waagiˀbá gínmuu tꞌä̖hkí naˀin taˀgendi Yôesivíˀpiyeˀ ívíwhä̖yundeˀingîˀ.
44028018	Description	In Rome-windi háawin tꞌaywóˀnin naa dáyˀannin dînnuwä̖, hewänbo indá dínhanginpóe háawin díháyjíˀin wänbo wíḏáyˀanpíḏí, heḏiho dímaˀpꞌä̖̂ä̖ḏi-íˀin didaˀwän.
45009016	Grace	Heḏânkun Yôesiví iya ûnmuuḏibo wí toˀwí ide̖ˀboˀ, nä́ˀi toˀwí óede̖ˀmamíˀin nawänpidaˀḏibo-á yoe, háa isóˀḏíndeḏibo-á yoe.
45007023	Sin	Hewänbo dînhanginná hä̖̂ä̖ḏi wänbo tꞌä̖hkí naví túuˀú tꞌä̖hkí iwe wíyá piˀwí hä̖ä̖wí nayiˀ, i-á naví híwó̖ˀdi ánshaa-áḏí ihä́nbo waagibá, heḏi naví túuˀú iweḏi owänpitꞌaywó̖ˀdikandaˀḏi wí pantꞌôeˀi waagi opoˀ.
59002014	Faith	Naví tíˀûuwin páaḏéˀin, tobá wí toˀwí natû̖ˀ wänbo in whä̖yu̖ Jesus-víˀpiyeˀ imáaˀin, wây-á tꞌowa iḏi híwó̖ˀ wíˀovâyˀohpíḏáhoˀ, ti nä́ˀi toˀwíví híˀ ûnchä̖ˀmuu? Ti Yôesi Táḏáḏí ônˀaywoení wí toˀwí ki̖ˀmin whä̖yu̖ ûnmuuḏiboˀ? Yoe, háˀtoˀ.
43007025	Description	Wên tꞌowa ee Jerusalem diweˀin ditú̖, “Ti nä́ˀi sen i toˀwí naˀinbí tsonnindi óehéyíˀin didaˀi wínamuupíˀan?
43020022	Faith	Kin natú̖ ihayḏi iví hâ̖a̖ḏi ovâysiphayḏi, heḏi ovâytu̖ˀan, “I Yä̖ˀḏâaˀi Pꞌoewa̖a̖hâ̖a̖ unbí píˀnä́ khóˀyé úntsꞌú̖ní.
45010003	Sin	Ho wíḏínhanginnáhpí háa Yôesi iˀoˀin heḏânho iḏi tꞌowa ovâycha̖a̖máˀve-íḏí tꞌaywó̖ˀdi wíḏâymáapí waagi, heḏiho indá dâytu̖wä̖máa háḏíḏí ha̖ˀmin wíˀbo dívípipáa-íḏí, heḏiho háa Yôesiḏi kin ovâyˀa̖míˀin wíḏâyhóndepí.
62005010	Faith	Toˀwên Yôesi Táḏáví ayvíˀpiyeˀ dívíwhä̖yundeˀindá inbí píˀnä́ khóˀyé dínhanginná háa Yôesi Táḏá natú̖ waa taˀgen namuuˀin. Hewänbo toˀwên Yôesi Táḏáví híˀ wíˀônwhä̖yundepíˀindá wí hôeyóˀi waagibá óepaˀ, háa iḏi iví ayví̖ˀgeḏi dítu̖ˀannin wíḏívíwhä̖yundepíḏí.
