43014012	Faith	Taˀgendi wáytu̖máa, toˀwên navíˀpiyeˀ dívíwhä̖yundeˀindá, naa dáyˀan waabá in wáˀ dívíkankhâymáa, heḏá waˀḏi shánkí heˀendi hä̖ä̖wí-á dívíkankhâymáa, gá naa naví Táḏávíˀpiyeˀ omändân.
56002009	Recommendation	In pantꞌôeˀin dimuuˀin ovâytu̖ˀâ̖a̖mí inbí tsonninbí tu̖u̖ dâytꞌóyaaní, heḏá i tꞌôe dâyˀoˀiḏi inbí tsonnin ovâyhíhchannamí, heḏá wáˀ wíḏívítu̖whä́nnâamípí,
54003007	Recommendation	Heḏi nakhâyˀä̖ˀ wáˀ in tꞌowa méesateˀin dimuupíˀindi nä́ˀi méesatewi tsondi óeˀaˀgeeníˀin, heḏânho yä̖ˀḏâapí iví̖ˀgeḏi wíḏívíhíˀmáve-ípí heḏi Penísendiḏáho ônphaykꞌûˀ iwá wínawhêe-ípí.
60003016	Recommendation	Hä̖̂ä̖ḏi wänbo tꞌä̖hkí únkhâyˀä̖ˀ unbí píˀnä́ khóˀjé únhanginnáaníˀin yä̖ˀḏâaḏa̖ˀ úvíkanhonnin, heḏânho wí toˀwí jänäkí unbí̖ˀgeḏi ihéeˀan wänbo nawôedaˀpúuwí iví híˀ ûnmuuḏi, gá Christ-víˀpiye úvíwä̖yundeḏi yä̖ˀḏâaˀin wówátsi bînhondân.
43006040	Faith	Kinho naví Táḏá nadaˀ dáyˀa̖míˀin, gá nadaˀḏân tꞌä̖hkí in dínhanginnáˀnin naa iví ay omuuˀin, heḏá navíˀpiyeˀ dívíwhä̖yundeˀin wówátsi nahándepíˀin dâymáˀve-íˀin. Heḏi i tꞌä̖ˀgi thaa nanáˀ dihayḏi naaḏá wíyá dovâywáywówápaa-í” kin Jesus-di ovâytu̖ˀan.
44012023	Violence	Wesebo Nanbí Sedó Jôesi Táḏáḏí wí makówáwi tꞌôepa̖ˀa̖a̖ˀiˀ óesan Herod óehayˀámíḏí, heḏi pubä́ḏí iví see ônkꞌoeḏiho nachuu. Han ûnpóe iḏi in tꞌowa wíˀovâytu̖ˀanpíḏí Jôesi Táḏáḏa̖ˀmân hayˀi namuuˀin.
54001006	Sin	Hewänbo wên tꞌowa-áho han wíḏívíˀopí, hewänbo hä̖ä̖wí nachä̖ˀmuupí i̖ˀgeḏiḏa̖ˀ dívíhéeˀoḏi Yôesiví taˀgeˀin pꞌóegéḏí dívíhângeˀan.
45001016	Faith	Yôesi Táḏáví híwó̖ˀdi tu̖u̖ḏi naa wíḏíwôedaˀmähpí. Nä́ˀi tu̖u̖-ân nakay, heḏi i̖ˀgeḏi Yôesiḏi tꞌä̖hkí tꞌowa in ipiyeˀ dívíwhä̖yundeˀin ovâyˀaywondeˀ, páaḏé in Huḏíyo dimuuˀindá, heḏá in Huḏíyo dimuupíˀindá wáˀ.
54004014	Recommendation	In Yôesi Táḏáví tukhe̖ˀmindi wóehéeˀandi in méesateˀin tsonnindá uvîˀḏi dívímankwꞌóḏiḏi Yôesi Táḏáḏí háawên híwó̖ˀnin wóemä́gi heḏânho iví tꞌôe mânˀa̖míḏí, heḏiho nää-á nä́ˀin wóemä́giˀindá ú̖khâyˀä̖ˀ híwó̖ˀ mânˀá̖yîngiˀâ̖a̖míˀin.
52005016	Recommendation	Hä̖̂ä̖ḏi wänbo tꞌä̖hkí íhíhcha̖a̖-í.
52004014	Faith	Ívíwhä̖yunde Jesus nachuuˀin heḏá nawáywówápóeˀindá, heḏânkun kin wáˀ ívíwhä̖yundeˀ: Toˀwên Jesus-víˀpiyeˀ dívíwhä̖yundeˀin inbí wówátsi dâybowa wänboˀ, Yôesi Táḏáḏí ovâywáywówápaa-í Jesus-áḏí dikwo̖ˀníḏí owáy nawáyˀä̖ä̖ ihayḏi.
62004015	Faith	Tꞌä̖hkí toˀwên in tꞌowaví páaḏépiyeˀ ditû̖ˀnin Jesus-á Yôesi Táḏáví ay namuuˀin, Yôesi Táḏá indáḏí namuu heḏá indá i-áḏá.
43010009	Grace	Naa wên khaa phóḏi waagiˀinbá omuu, heḏá in navíˀpiyeˀ dívíwhä̖yundeˀin wên kꞌúwá in phéhkhaa búge ditsꞌú̖ˀnin waagiˀinbá-á dimuu. Heḏi kꞌúwá dipiˀ inbí koegîˀ dâysháa-íḏí heḏá wíyá ditsꞌúya̖ˀ waagibá, in navíˀpiyeˀ dívíwhä̖yundeˀin ovâyˀaywoení heḏá hä̖ä̖wí díntáyˀi-á dâymáˀve-í.
62002029	Faith	Únhanginná Christ-ân híwó̖ˀda̖ˀ iˀoˀin, heḏiho únhanginná wáˀ tꞌä̖hkí toˀwên inbí wówátsi taˀge dâyhonnindá Yôesi Táḏávíˀweḏi diˀâypu̖yä̖ˀin.
44013047	Grace	gá Nanbí Sedó Jôesi Táḏáḏí iví taˀnin diwe naˀin ginnân dítu̖ˀandân: Naaḏi u̖ˀ wídeˀman wí ko waagiˀbá unmúuníḏí, in Huḏíyo dimuupíˀinbíˀpiye unmú-íḏí, in tꞌowa tꞌä̖hkí nä́ä oepáa kꞌayḏi háḏíḏí ovâyˀaywoeníˀin ovâytu̖ˀâ̖a̖míḏí.”
44002033	Description	Jôesi Táḏáḏí Jesus-á makówápiye óepiyeḏi iví koˀḏíngéḏí óesóge. Jôesi Táḏá iví tun imä́gi iˀ Yä̖ˀḏâaˀi Pꞌoewa̖a̖hâ̖a̖-á Jesus óemä̂äníḏí, heḏi háa natú̖ waa iˀan. Heḏiho iˀ hä̖ä̖wí nää nä́we ítꞌoeˀoˀiˀ heḏá bînmúndeˀi-á iˀ Yä̖ˀḏâaˀi Pꞌoewa̖a̖hâ̖a̖-ân iˀoˀ.
43011004	Faith	Jesus nä́ˀin natꞌoe ihayḏi natú̖, “Tobáháa nahay wänbo nawówáyê̖e̖ní, heḏiho háa ûnpúwíˀin namuuḏi in tꞌowa dâymûˀḏi Yôesi Táḏá kwꞌáayéboˀ óemáˀve-í, heḏá naa iví ay omuuˀi wáˀ kwꞌáayébo dímáˀve-í.”
45001017	Faith	Nä́ˀi híwó̖ˀdi tu̖u̖ḏi díhá̖ˀandi gínhanginná háa Yôesi Táḏáḏí tꞌowa ovâycha̖a̖máaˀin tꞌaywó̖ˀdi dâymáapí waagi. Hewänbo inbí whä̖yu̖ dínmuuˀiḏiḏa̖ˀ kin iˀoˀ, hä̖ä̖wí híwó̖ˀdi dívíˀoˀi namuuḏá yoe, iví ta̖ˀnin diwe ûnta̖ˀmuu waagi: Wí toˀwí Yôesivíˀpiyeˀ taˀgendi iwhä̖yundeḏáhoˀ, iví whä̖yu̖ ûnmuuḏibo Yôesiḏi óecha̖a̖máa tꞌaywó̖ˀdi imáapí waagi, heḏi wówátsi óemä̂äní.
43019017	Description	Heḏáháˀ Jesus óehoˀḏi iweḏi napee wên phéˀwan igíˀin ipiˀíhhondi, heḏi in okú “Pꞌó̖hkhú̖bay” gin dâytu̖ˀoˀ iwe dipówá, Hebrew tu̖u̖ḏá ditû̖ˀ “Golgotha” gin.
45012006	Faith	Yôesiḏi piˀḏinbo magan dímä́gi, hewänbo tꞌä̖hkí ha̖ˀbiḏa̖ˀ wígínmuupí. Wí toˀwí ûnkoeḏiḏi wí Yôesiví tukhe̖ˀbi waagibá ihéeˀa̖míḏí, i-á ûnkhâyˀä̖ˀ kin iˀa̖míˀin hä̖́yú̖ iví whä̖yu̖ ûnmuu ihay iweḏi.
45010012	Grace	Tꞌä̖hkí tꞌowagîˀ handa̖ˀ napoˀ, in Huḏíyogíˀindá, in Huḏíyo dimuupíˀingíˀindá wáˀ, gá tꞌä̖hkí tꞌowagîˀ wîˀḏa̖ˀ wí shánkí natsonyiˀi naˀä́ndân, heḏi iḏá báyékí híwó̖ˀdi ovâymäˀ in toˀwên ivíˀpiyeˀ dívíyûusuˀannin ovâykhä̖ge̖ˀnamíḏí.
45010004	Faith	Nääho tꞌä̖hkí in toˀwên Christ-víˀpiyeˀ dívíwhä̖yundeˀindá wíyá ho wíḏíntáypí dívísóˀḏêe-íḏí i tsontu̖u̖ dâyˀaˀginnamíḏí heḏânho dipúwíḏí in toˀwên Yôesi Táḏáḏí ovâycha̖a̖máaˀin tꞌaywó̖ˀdi wíḏâymáapí waagi.
50004006	Recommendation	Báyékí ánshaa iwe wíˀíkwo̖ˀnípí, hewänbo hä̖ä̖wí tꞌä̖hkí i̖ˀgeḏi úvíyûusuˀâ̖a̖mí-á, heḏá Yôesi Táḏá-á hä̖ä̖wí úntáyˀi bîndaaˀa̖mí, heḏi kin úvíˀoḏi bînkú̖ˀdaaˀâ̖a̖mí wáˀ.
52004006	Recommendation	Toˀwí wänbo wíˀûnkhâyˀä̖hpí wíyá toˀwí Jesus-víˀpiyeˀ iwhä̖yundeˀi híwó̖ˀpí óemáˀve-íˀin háa iví kwee háa sen óekwee-íˀin. Thayˀeeḏi heḏá kayˀindá ho wâytu̖ˀan, Naˀinbí Sedó Yôesiḏi in toˀwên han dívíˀoˀindá ovâytuchä̖nukhâymáa.
43005020	Faith	I Táḏáḏí naa díséegí, heḏiho hä̖ä̖wí tꞌä̖hkí iˀoˀi dînkeeyoˀ, heḏi iḏá hä̖ä̖wí shánkí heˀendi-á dóˀa̖míˀiˀin naa dînkeekankhâymáa, heḏânho un wovâyháaˀa̖míḏí.
57001022	Recommendation	Heḏi nää waˀḏi wíyá hä̖ä̖wí wídaaˀa̖mí: Ti wí íve dînkhâyˀa̖mí dáywhonwóyí̖ˀníḏí? Undi dînyûusuˀoḏiho naa ocha̖a̖ hanwaapíḏíbo Yôesi Táḏáḏí díwáypunmä̂äníˀin unbíwepiyeˀ.
52005012	Recommendation	Tíˀûuwin páaḏéˀin, nä́ˀin naˀindi wâydaˀmáa: Bînˀaˀginnamí in toˀwên unbí̖ˀge diyiˀin Naˀinbí Sedó Yôesiḏi ovâykwꞌóḏiˀin wovâypahûuwíḏí heḏá wovâyhá̖ˀa̖míḏí. Indá kin dâyˀa̖míḏí báyékí dívítꞌôemáa.
43009022	Description	I senbí táḏáˀin in Huḏíyoví pꞌóˀḏéḏíˀin dä̂nkhuwôedaˀmáa, gá dâywéhpêeˀandân i méesate ee ovâytsuḏekhâ̖a̖ˀa̖míḏí toˀwên ditû̖ˀnin Jesus-á namuu i toˀwí Yôesi Táḏáḏí óesógeˀiˀ tꞌowa ovâyˀaywoeníḏí.
50003003	Faith	Naˀinnân in taˀgen kꞌewe̖ˀ taa waagiˀinbá âymáaˀin gimuu, gá Yôesiví Pꞌoewa̖a̖hâ̖a̖ḏi naˀin díkhä̖ge̖ˀdoḏân Yôesi Táḏá âyˀaˀginmä̂äníḏí, heḏá naˀindá híhchandi gitû̖ˀ Christ Jesus-víˀin gimuuˀin, heḏá wíˀívíwhä̖yundepí hä̖ä̖wí wíˀbo ívíˀoˀiḏibo naˀin dînˀowóyé-íˀin.
62003023	Faith	Heḏi nä́ˀinnân iví tsontu̖u̖ ûnmuu: Gínkhâyˀä̖ˀ iví ay Jesus Christ-víˀpiyeˀ ívíwhä̖yú̖-íˀin, heḏá iḏá díyôn waagibá wíˀnä́ táye-á ívíséegíhûuwí.
59005013	Recommendation	Wénä wên un bîntꞌôephaḏendeḏi únkhâyˀä̖ˀ úvíyûusuˀa̖míˀin; heḏi íhíhchandiḏá bînkhaˀwa̖mí Yôesi bîntegé-íḏí.
60001017	Recommendation	Jôesi Táḏávíˀpiye úvíjûusuˀoḏi bîntu̖ˀo “Nanbí Táḏá” gin, heḏi i-ân namuu iˀ ûnhanginnáˀdiˀ háa naˀin tꞌowa wíˀínbo ívíˀoˀin, heḏiho handa̖ˀ dímáaḏí wíˀínbo taˀgendi dítu̖ˀoˀ háa híwó háa híwóhpí ívíˀannin. Heḏânho waˀḏi nä́ä oepáa kꞌayḏi íkwꞌôndibo únkhâyˀä̖ˀ unbí wówátsi bînhûuwíˀin iˀ bînˀaˀginmáaḏí.
44020010	Description	Paul whaˀkꞌayḏi nawá̖, heḏi idégeˀdisógeḏi iˀ eˀnú óebaˀaakêˀ, heḏi ovâytu̖ˀan, “Ívíwoˀgi wíˀítaachanpúuwípí. Nä́ˀi-á nää nawówámuu.”
55002010	Faith	Tobá háa naa dînpoˀ wänbo dáyyä̖́ä̖ˀoˀ in Yôesi Táḏáḏí ovâyde̖ˀmannin dimuuˀin dovâykhä̖ge̖ˀnamíḏí heḏânho in wáˀ Christ Jesus-di ovâyˀaywoeníḏí, heḏiho hä̂nhay wänbo tꞌä̖hkí saˀwó̖ˀda̖ˀ nanáˀ diwe ditháa-í.
60005014	Recommendation	Wíˀnä́ táye úvísígísengitu̖ˀâ̖a̖mí. Un Christ-víˀin ímuuˀindá ánshaaginpíḏíboˀ íkwoní.
54005020	Recommendation	Hewänbo taˀgendi wí méesateˀi tsondiˀ itꞌaywó̖ˀkanhondáhoˀ, in méesateˀin tꞌowa tꞌä̖hkíví páaḏépiyebo iví tꞌaywó̖ˀdi nâatu̖ˀâ̖a̖mí, heḏânho in wé̖ˀgeˀin méesateˀin tsonnin dikhuwôedaˀíḏí dívítꞌaywó̖ˀnamíḏí.
45014013	Recommendation	Heḏânkun wíyá ívítu̖u̖súuˀâ̖a̖mívíˀweḏi, ívíˀánshaamä̂äní hä̖ä̖wí wänbo wíˀívíˀa̖mípíˀin naˀinbí tíˀûu páaḏéˀiˀ óetꞌaywó̖ˀkannamíˀiˀ.
45002010	Grace	Hewänbo in tꞌowa híwó̖ˀ dívíˀannindá Yôesiḏi ovâytegé-í heḏá híwó̖ˀ ovâymáˀve-í, heḏá híhchan ánshaa-á ovâymä̂äní, páaḏé in Huḏíyo dimuuˀindá, hewänbo wáˀ in Huḏíyo dimuupíˀindá,
45012002	Recommendation	Háa in tꞌowa Yôesi dâytaapíˀin dívíˀo waagibá wíˀúvíkanhûuwípí, hewänbo binmä́ä Yôesiḏi ánshaa tsꞌa̖a̖bi wovâymä̖̂ä̖níḏí, heḏi handiḏiho unbí wówátsi wovâyˀegóˀa̖míḏí. Kindiḏânho únhanginpúwí háa Yôesi nadaˀin úvíˀa̖míˀindá híwó̖ˀninda̖ˀ namuuˀin, heḏá óehíhchandoˀindá, heḏá tꞌä̖hkí taˀgennindá.
62002015	Recommendation	Wíwovâyhí̖ˀa̖mípí unbí wówátsi bînhûuwíḏí háa in tꞌowa Yôesi Táḏá dâytaapíˀin inbí wówátsi dâyhon waagibá, heḏá i yä̖ˀḏâapîˀ hä̖ä̖wí indá ovâyhí̖ˀandi-á wíwovâyhí̖ˀa̖mípí. Wí toˀwí nä́ˀi híwó̖ˀpîˀ namuuˀiˀ óehí̖ˀandáho Yôesi Táḏá pín taˀge hayḏi wíˀóeséegípí.
45002001	Sin	Heḏiho wí toˀwíḏí wây-á tꞌowa ovâytu̖u̖súuˀoḏi natû̖ˀ tꞌaywó̖ˀtoˀin dimuuˀin, i-á háˀto ûnkoeḏí-í natú̖níˀin wíˀbo wíˀitꞌaywó̖ˀnanpíˀin, tobá toˀwí namúní wänboˀ. In wé̖ˀgeˀinbí̖ˀgeḏi kin waagi ihéeˀoḏi, wíˀbo iví tꞌaywó̖ˀdi ipikeekwꞌóeˀó, gá in waagibá itꞌaywó̖ˀdoḏân.
43019023	Description	In yôenu sundaḏoḏi Jesus phéˀwan deeḏi óetꞌóhtä̖gekꞌûˀ ihayḏi iví aa dívíwiye, heḏi piˀḏinbo wí̖ˀíngí dâyhógi. Hewänbo iví kꞌéwéˀin to heˀyinbo namuuḏi wáygé wänbo wíˀûnpänyeˀenpí.
45002021	Sin	Iḏi piˀwên tꞌowa ovâyhá̖ˀoˀ, heḏi háaḏan i-á wíˀbo wíˀipihá̖ˀopí? Iḏi ovâytumakheˀo wíḏívísä̖ˀmamípíḏí, heḏi háaḏan i isä̖ˀboˀ?
44020035	Recommendation	Naa hä̖̂ä̖ḏi wä̂nbo tꞌä̖hkí haˀwâa dáyˀan wâykeeya̖míḏí háa únkhâyˀä̖ˀin úvíˀa̖míˀin. Hânho úvíkhä̖ä̖-í toˀwên díntáyˀin bînkhä̖geˀnamíḏí. Wíˀúnˀôeḏe-ípí nä́ˀi tun Nanbí Sedó Jesus-ân wíˀbo natú̖ˀin: ‘Toˀwí imäˀi-á shánkí nahíhchan toˀwí ihóndeˀivíˀweḏi.” ’
43020005	Description	Itꞌä̖́ä̖ itsíhkêeníḏí, heḏi i aa Jesus óeˀánnandiˀ oe íve nange nakwꞌôndi imûˀ, hewänboˀ ee tꞌovápho ee wínatsꞌú̖hpí.
50002029	Recommendation	I-á Naˀinbí Sedó Jesus-vîˀ namuuḏi híwó̖ˀ híhchandi bînséegíkéyí. I-áḏí heḏá toˀwên i waagiˀbá dimuuˀindáḏí bînˀaˀginnamí,
43014021	Faith	“Toˀwên naví tsontu̖u̖ dînhógiˀin heḏá dînˀaˀgindoˀindá, indânho naa díséegí, heḏi toˀwên naa díséegíˀindá naví Táḏáḏí ovâyséegí, heḏá naaḏi wáˀ dovâyséegí, heḏi dovâykhä̖ge̖ˀna̖mí shánkí híwó̖ˀ dítaa-íḏí” kin Jesus natú̖.
64001006	Recommendation	Nä́ˀin tíˀûuwin páaḏéˀindi in méesate iweˀin tꞌowa nä́we dikwꞌó̖ˀnin uví séegí ú̖muu i̖ˀgeḏi ho ovâytꞌôeˀan. Híwó̖ˀ bikanhon inbí pꞌóegé dimän dipiyeˀ ovâykhä̖ge̖ˀdoḏi, heḏi kin bikanhondi Yôesi Táḏá nâahíhchandoˀ.
55002023	Recommendation	Tꞌowa ánshaapíˀin dimuuˀin heḏá hä̖ä̖wí wänbo wíḏínhanginnáhpíˀin dimuuˀindá dívítu̖hkandoḏi wíˀovâytꞌóyaanípí. Haˀwâaˀi híˀ dâypiyemáaˀin dimuuˀindá wíˀnä́ táye dívíwänpitꞌayyaaˀoˀ.
44011017	Grace	Jôesi Táḏáḏí iˀ Yä̖ˀḏâaˀi Pꞌoewa̖a̖hâ̖a̖ ovâymä́gi, heḏá hanbá naˀin dímä́gi, Nanbí Sedó Jesus Christ-víˀpiye ívíwä̖yu̖ ihayḏi. Heḏiho hä̖ä̖-an naa omuu, ti naa dînkꞌóe Jôesi Táḏá dówóyí̖ˀníḏí? Naa-á joe.”
62003007	Recommendation	Naví áyyä̖̂ä̖, toˀwên hä̖̂ä̖ḏi waa in taˀgeˀin pꞌôe i̖ˀge dimänninda̖ˀmân inbí wówátsi taˀge dínmuu, Christ-ví wówátsi ûnmuu waagibá. Heḏiho wíˀúvímä̂änípí toˀwíḏí wänbo in taˀgen namuu iweḏi wovâyyâaˀa̖míḏí.
62004001	Recommendation	Un wâyséegíˀin, tꞌä̖hkí toˀwên ditû̖ˀnin Yôesigîˀ dívíhéeˀoˀin wíˀúvíwhä̖yú̖-ípí. Páaḏé bîntayi̖ˀní únhanginpúwíḏí tigú taˀgendi Yôesiví Pꞌoewa̖a̖hâ̖a̖ dâymáaˀin, gá báyékí dihôeyóˀin wáyyé tꞌä̖hkí dikwꞌôndân, indá Yôesi Táḏáví tukhe̖ˀmin dimuu gin ditû̖ˀ.
44013038	Grace	“Tíˀûuwin páaḏéˀin, naa odaˀ íkapóewíˀin nä́ˀin nää wâytu̖hkankhâymáaˀin: Háa Jesus iˀannin namuuḏi unbí tꞌaywóˀdi wovâyˀowóejé-í. Tobá iˀ tsontun Moses itaˀnandi bînˀaˀginnamíḏí úvíkhä̖ä̖ḏe wänboˀ, háˀto unbí tꞌaywóˀdi wovâyjâaˀa̖mí, hewänbo Jesus-víˀpiye úvíwä̖yundeḏáho wovâyjâaˀa̖mí-ákun.
50003001	Recommendation	Tíˀûuwin páaḏéˀin, nää nä́ˀi wâytu̖ˀâ̖a̖mí: Naˀinbí Sedó Jesus-víˀin ímuuḏihoˀ úvíhíhchanmáˀve-í. Tobá nä́ˀi hä̖ä̖wí i̖ˀgeḏi wâyta̖ˀnan wänboˀ, kaykhan wíḏînpoˀpí inho wâyta̖ˀnanninbá nää wíyá wâyta̖ˀnamíḏí, heḏi nä́ˀi híˀ wâyta̖ˀdoˀiḏá wovâyˀaywoení.
43018031	Description	Pilate-di ovâytu̖ˀan, “Un wíˀbo binpihûu iˀ, heḏá bintu̖yóˀnandi binˀan unbí tsontu̖u̖ úntû̖ˀ waagibá.” In Huḏíyoḏá óetu̖ˀan, “Hewänbo un Rome-ˀindá naˀin Huḏíyo wíḏînkꞌúya̖ˀpí wí toˀwí âyhéyíˀin, yä̖ˀḏâapí iˀandi âyshaa wänboˀ.”
50004013	Faith	Christ-di in kay dímäḏiho nä́ˀi hä̖ä̖wí tꞌä̖hkí dînkoeḏi dáyˀa̖míˀin.
52004003	Recommendation	Kinnân Yôesi Táḏá nadaˀ úvíkanhûuwíˀin: Yä̖ˀḏâaˀinda̖ˀ unbí wówátsi bînhûuwí, heḏiho toˀwí unbí sedó háa kwiyó wíˀúnmuupîˀ-áḏí wíˀúvíwho̖hkwomáˀve-ípí.
44007029	Description	Moses nä́ˀin natꞌoeḏi Egypt-di nashavepee, heḏi oe Midian nangepiye namääḏi iwe wí jáˀwéḏíˀi waagibá ithaye. Iwáy wä̖́hä̖̂ä̖ho wíje eˀnûn ûnpu̖yä̖.
59004001	Sin	Háaḏan wáy wên un tꞌowa úvíyándeˀ heḏá úvítꞌaymáa? Hä̖ä̖wíḏí unbí píˀnä́ khóˀyé wovâyhä́nbo waa ícha̖a̖, gá hä̖̂ä̖ḏi wänbo tꞌä̖hkí únwänpihéegínáníˀinda̖ˀ ídaˀḏân.
44020029	Violence	Naa dînhanginná owáy naaḏi wâyjoeˀan dihayḏáhoˀ, wây-á wên tꞌowa unbíˀye dipowagíˀo, wên tꞌayjaaˀin khunjó in kꞌúwá dâyhá̖a̖nú-íḏí diˀä̖ä̖ˀä̖ waagibá,
53001004	Faith	Heḏânkun wä̖́hä̖̂ä̖ wänbo tꞌä̖hkí Yôesi óeˀaˀginmäˀ eeye híhchandi unbí̖ˀgeḏi ívíhéeˀoˀ, gá úvíyä̖́ä̖ˀoḏân heḏá úvíwhä̖yu̖hondá tobáháa unbí whä̖yu̖ únmuuḏiho tꞌowaḏi wovâywha̖ˀo heḏá wovâytꞌôephaḏekando wänboˀ.
62004012	Faith	Toˀwíḏí wänbo hä̂nhay wänbo Yôesi Táḏá wíˀóemûˀpí, hewänbo wíˀnä́ táye ívíséegíḏá i-á naˀindáḏí namuu, heḏá iví séegí iḏi dímäˀi-á naˀinbí píˀnä́ khóˀyé gínsôemäˀ.
45006005	Faith	I-áḏí gichuu waagibá gipóe, heḏiho kindiḏi i-áḏí wîˀḏa̖ˀ waagibá gipóe. Heḏânkun i nawáywówápóe waagibá naˀin wáˀ díwáywówápaa-í.
45015010	Recommendation	Wíyá wáygá kinnân nata̖ˀmuu: Un Huḏíyo ímuupíˀin Yôesiví tꞌowa-áḏí bíhíhchanpuwave.
54004001	Sin	I Yä̖ˀḏâaˀi Pꞌoewa̖a̖hâ̖a̖ho thayˀeeḏi natú̖ i tꞌä̖ˀgi thaa napowaˀä̖ˀ ihayḏi wên tꞌowa inbí whä̖yu̖ Yôesivíˀpiye dâyyoegikankhâymáa heḏi kin dívíˀandiho ovâytꞌóyankhâymáa in tꞌowa in dihôeyóˀin pꞌoewa̖a̖hâ̖a̖ḏi ovâymáaˀin, heḏá nä́ˀin yä̖ˀḏâapíˀin pꞌoewa̖a̖hâ̖a̖ví há̖hkanho dâyséegíˀa̖mí.
56003001	Recommendation	Ihayḏa̖ˀ in tꞌowa ovâyˀánshaakannâamí tꞌä̖hkí in nangeˀin tsonkhuu dâymáaˀinbí khómaphoˀ dívíkwꞌôení. Dínkhâyˀä̖ˀ diˀaˀgintꞌôeníˀin, heḏá dikhâymúní hä̖ä̖wí tꞌä̖hkí híwó̖ˀdi namuuˀiˀ dívíˀâ̖a̖míḏí.
60003018	Grace	Wíˀúnˀôeḏe-ípí Christ wáˀ óetꞌôephaḏekannannin. I-á híwóˀdiḏa̖ˀ namuu, hewänbo in híwóhpíˀin tꞌowa dimuuˀingîˀ nachuu. Wáymûuḏa̖ˀ nachuu nanbí tꞌaywóˀdi gínmuuḏi heḏânho Jôesi Táḏávíˀpiye díkáaníḏí. Hewänbo tobá iví túˀ ônhay wänbo iví pꞌoewa̖a̖hâ̖a̖-á wówáˀi ûnmuu.
53003006	Recommendation	Tíˀûuwin páaḏéˀin, nä́ˀin tsontu̖u̖ Naˀinbí Sedó Jesus Christ-di dînkꞌûˀ wâymä̂äníḏí: Wí toˀwí naˀinbí tíˀûu páaḏéˀibá namuuˀi bâaˀin wówátsi ihondáho heḏá naˀindi wâyhá̖ˀan waagi wínathaapíḏá, undá wí toˀwí ki̖ˀbi namuuˀivíˀweḏi úvíyâaˀa̖mí.
45005012	Sin	Wí wîˀ toˀwí Adam gin nakhá̖wä̖́ˀiˀ itꞌaywó̖ˀnan, heḏi i-á itꞌaywó̖ˀnandi tꞌä̖hkí tꞌowa tꞌaywó̖ˀdi giyä̖́mu. Adam-dá itꞌaywó̖ˀnandi nachuu, heḏi naˀin wáˀ ívítꞌaywó̖ˀnandibo tꞌä̖hkíḏíbo gitꞌa̖há̖a̖ní.
59004004	Sin	Ti wíˀúnhanginnáhpíˀan wí toˀwí in tꞌowa Yôesi dâytaapíˀinbí tsiyekan óehí̖ˀandá Yôesiví hä́nbiˀ waagiˀbá napaa. Undá haˀwâa úvíkanmáa, heḏi handiḏi nä́ˀi hä̖ä̖wí Yôesiví shánkí bînséegíḏíhoˀ, wên kwiyä̖ˀ waagiˀinbá ípaa inbí senäˀ dâyyoeˀandi wây-á piˀwên senäˀdáḏí dívíthayé-íḏí.
44016006	Description	Oe Asia iˀ Yä̖ˀḏâaˀi Pꞌoewa̖a̖hâ̖a̖ḏi Jôesi Táḏáví híˀ i̖ˀgeḏi wíˀovâyhíˀmä́gipí, heḏiho in nange Phrygia-á Galatia-á i̖ˀge diphaḏe.
45010006	Faith	Hewänbo kinnân nata̖ˀmuu in toˀwênbí̖ˀgeḏi inbí whä̖yu̖ dínmuuḏi Yôesiḏi ovâycha̖a̖ˀin tꞌaywó̖ˀdi wíḏâymáapí waagi: Wíˀítú̖nípí, “Toˀwí ûnkhâyˀä̖ˀ makówápiyeˀ napée-íˀin.” (Nä́ˀindá natu̖ˀdaˀ, Christ óedaaˀa̖míḏí makówáḏí nawha̖veˀä̖́ä̖-íḏí.) Heḏá wáˀ nata̖ˀmuu:
62005001	Faith	Jesus-á i toˀwí namuu Yôesi Táḏáḏí óesógeˀiˀ tꞌowa ovâyˀaywoeníḏí. Toˀwên nä́ˀin dívíwhä̖yundeˀindá Yôesi Táḏávíˀweḏi ho wíyá diˀâypu̖yä̖, heḏi toˀwên i Táḏá dâyséegíˀindá, iví ây wáˀ dâyséegí.
54005001	Recommendation	In senäˀ uví shánkí saydôe dimuuˀin u̖ḏi ovâytumakhemáaḏá tꞌaygiḏi wíˀovâyhéeˀa̖mípí, hewänbo shánkíḏí ovâyhéeˀa̖mí uví táḏá mänhéeˀo waagibá. Heḏá in shánkí tsꞌa̖a̖min senäˀdá uví tíˀûuwin mänhéeˀo waabá ovâyhéeˀa̖mí.
60002012	Recommendation	Undá nä́ˀin tꞌowa Jôesivíˀpiye dívíwä̖yundepíˀinbí jâa íjiˀ, heḏiho yä̖ˀḏâaˀi wówátsiḏa̖ˀ bînhûuwíˀin únkhâyˀä̖ˀ. Gindiḏiho tobáháa híwóhpí úvíˀoˀin ditû̖ˀ wänboˀ, in híwóˀnin úvíkanhonnin dâymúuní, heḏiho owáy Jôesi dínpówá ihayḏáho indi kwꞌáayébo óemáˀve-í.
50003006	Sin	heḏi pín taˀge hayḏi naví whä̖yu̖ khuu donhondi in Jesus-víˀpiyeˀ dívíwhä̖yundeˀin tꞌowa tꞌôephaḏe iwe dovâykwꞌóḏi. I tsontu̖u̖ Moses ita̖ˀnandiˀ tꞌä̖hkí dóˀaˀgindoḏi toˀwí wänbo wíˀûnkoeḏipí dîntꞌeˀpꞌíḏe-íḏí.
43004052	Description	Iḏi ovâytsikáyin, “Hä̖́yú̖ ihayḏan naná ûnhehkháapóe ihayḏi?” Óetu̖ˀan, “Tsá̖ˀdi théˀêeḏi wîˀ iwe i tsá̖wä̖pꞌíḏe ûnhán.”
43019031	Violence	I thaa in Huḏíyo dâyhä̖ä̖wíkhâyˀoˀi kaykhanwówá thaagîˀ naná, heḏi nä́ˀi kaykhanwówá thaa naˀä̖ˀi shánkí hayˀi thaa dínmuuḏi wíḏidaˀpí in chuˀin ee phéˀwan deeḏi ovâyyoeˀa̖míˀin. Heḏiho Pilate óedaaˀan natsonpúwíḏí in ditꞌóhtä̖gekwꞌó̖ˀnin ovâypóthâaníˀin shánkí a̖ˀyu̖u̖gi dichúu-íḏí, heḏá phéˀwan deeyeḏá ovâywhá̖ve-í.
43019012	Description	Pilate nä́ˀin natꞌoe ihayḏi shánkí wänbo nadaˀ Jesus óemaˀpꞌä̖́ḏi-íˀin, hewänbo in Huḏíyo dívítu̖wí̖nú, “Nä́ˀi sen nâamaˀpꞌä̖́ḏiḏá, u̖ i tsondi Caesar-víˀnäpiyeˀ wíˀunmuupí. Wí toˀwí wí tsondi hayˀi namuu gin natû̖ˀdi-á Caesar-ví hä́nbiˀ namuu.”
43014001	Faith	Heḏáháˀ Jesus tꞌä̖hkí iví khä̖ge̖ˀnin itu̖ˀan, “Ánshaa iwe wíˀíkwo̖ˀnípí. Yôesi Táḏávíˀpiyeˀ úvíwhä̖yu̖hûuwí heḏá navíˀpiyá.
50001028	Faith	Toˀwên unbíˀpiyeˀ híwó̖ˀ dicha̖a̖píˀin hây wänbo wívînkhuwôedaˀípí. Íkhuwôedaˀpíˀin wovâymúndeḏi bînkeekwꞌôení indá dipeḏeemuuˀin, hewänbo undá Yôesi Táḏáḏânho wovâyˀaywoeníˀin.
43015016	Grace	Undi naa wíḏíde̖ˀmanpí, naaḏá un wâyde̖ˀman, heḏá wovâykwꞌóḏi báyékí híwó̖ˀ úvíˀa̖míḏí, heḏi i híwó̖ˀ úvíˀoˀi-á nakâypúwí. Naví Táḏáḏí naa dînkꞌûˀ hä̖ä̖wí ídaˀpóeˀiˀ wâyˀa̖míḏí, heḏiho úvíwhä̖yundeḏáhoˀ iḏi wovâymä̂äní.
45012021	Recommendation	Wívînmä̂änípí hä̖ä̖wí yä̖ˀḏâapîˀ namuuˀiḏi wovâytꞌaaníḏí, hewänbo híwó̖ˀ úvíˀoḏibo yä̖ˀḏâapîˀ hä̖ä̖wí namuuˀiˀ bîntꞌaaní.
55002014	Recommendation	U̖-á ú̖khâyˀä̖ˀ in méesateˀin tꞌowa nä́ˀi hä̖ä̖wí wítu̖ˀan niˀgeḏi ovâyˀánshaakannamíˀin, heḏá Yôesi Táḏáví páaḏépiyeˀ kayˀindiḏá ovâytu̖ˀâ̖a̖mí tu̖u̖ i̖ˀgeḏiḏa̖ˀ wíḏívítu̖hä́nmáˀve-ípí. Han dívítu̖hkanmáaḏáhoˀ wíḏínchä̖ˀmuupí, heḏi in toˀwên dívítꞌóyandeˀinbí ánshaa-á ovâywänpipeḏeeˀoˀ.
59004008	Recommendation	Yôesiví núˀpiye bíha̖ḏi, heḏá i-á unbí núˀpiyá shánká ihá̖ḏi-í. Un tꞌaywó̖ˀkannin ímuuˀin, bînyä̖ˀḏâapítsiyekanwóyí̖ˀ. Un toˀwên unbí ánshaa wíˀúntaˀgemuupíˀin, binyâaˀan hä̖ˀi tꞌaywó̖ˀdi unbí píˀnä́ khóˀyé bînmáaˀiˀ.
59002009	Sin	Hewänbo wáy wên tꞌowaḏa̖ˀ in wé̖ˀgeˀinbí shánkí híwó̖ˀ bînmáaḏá, handiḏi úvítꞌaywó̖ˀdoˀ, heḏi Yôesi Táaḏí tꞌaywó̖ˀkannin wovâyshaa, gá iví tsontu̖u̖ ûnmuuˀin bînˀaˀginhá̖núndeḏân.
52004007	Grace	Yôesi Táḏáḏí naˀin dítu̖kánnan ivíˀin gimúníḏí heḏânho yä̖ˀḏâaˀinda̖ˀ gipúwíḏí, tsé waagiˀinbá giyê̖e̖niḏá yoe.
45001018	Sin	Yôesi Táḏá oe makówá naˀä́ndiḏi dînkeeyoˀ ovâytuchä̖nukhâymáaˀin in toˀwên óeˀaˀginpíˀindá heḏá in yä̖ˀḏâapîˀ dívíˀoˀindá, háa dívíˀoˀin namuuḏi natꞌayḏi. Heḏi híwó̖ˀpí dívíˀoḏibo Yôesiví taˀgen ûnmuuˀin ônkaayo heḏânho wé̖ˀgeˀin tꞌowa wíḏâytáa-ípíḏí.
62004007	Faith	Un wâyséegíˀin, wíˀnä́ táye ívíséegíhûuwí, gá in séegí Yôesi Táḏávíˀweḏi naˀä̖ḏân, heḏi toˀwên tꞌä̖hkí in séegí dâymáaˀinda Yôesi Táḏávíˀweḏi diˀâypu̖yä̖, heḏá Yôesi Táḏá-á dâytaa.
62002009	Sin	Wí toˀwí nakohthaynáˀ niˀge iví wówátsi ihon gin natú̖ḏí, hewänbo iví tíˀûu páaḏéˀi itꞌayḏá, i-á waˀḏi khu̖u̖ i̖ˀgebo nayiˀ.
60004014	Grace	Christ-víˀin ímuuḏibo tꞌowa jänäkí unbí̖ˀgeḏi dívíhíˀmáa wänbo bíhíhchanpuwave, gá Jôesiví Pꞌoewa̖a̖hâ̖a̖ iˀ shánkí hayˀi namuuˀi-á undáḏíbá hä̖̂ä̖ḏi wänbo tꞌä̖hkí najiḏân.
