58009014	Grace	Mətəu nɨra Iesu in tatos nəsanəniən asoli tapirəkɨs natimnati mɨn u . Krɨsto in təmol aru sakrifais lan , e nəsanəniən rəha Narmɨn iətəm tətatɨg itulɨn . In sakrifais kəti iətəm təhruahru agɨn , nərahiən kəti tɨkə lan . Tol lanəha , kəni nɨran in tatos nəsanəniən , təhmen o nafəliən nɨkitəmah o noliən mɨn iətəm kotəhrun niti-pəniən itəmi e nɨmɨsiən , məmə itəmah onəkotəfaki əmə kəm Uhgɨn iətəm tətəmiəgəh .
44011017	Grace	Kəni nəmə Uhgɨn tətəfən kəm Nanihluə mɨn Narmɨn kətiəh əmə iətəm təməfa kəm tah nətəm Isrel nian kitah kəmotəni nɨpəhriəniən e Iesu Krɨsto , iəu iətəmimi əmə u , ko iəsəniəhuiən Uhgɨn o nati nak iətəm in tolkeikei məmə otol kəm lah . ”
49004030	Faith	Sotoliən Narmɨn Rəha Uhgɨn tətəu nahməiən o noliən rəhatəmah , mətəu-inu in nəmtətiən rəhatəmah məmə itəmah rəha Uhgɨn , kəni in otos rəkɨs itəmah e noliən tərah mɨn e nian rəha nosmiəgəhiən .
66003003	Recommendation	Tol lanəha , nɨkitəmah təhti nəghatiən iətəm nəmotos , kəni mautətəu aupən . Otol , kəni motəuhlin itəmah . Mətəu nəmə nəkotapɨli alu , oiəkiet pətɨgəm o təmah təhmen e iakləh , kəni itəmah ko nəsotəhruniən məmə nian nak iəkuvnə o təmah .
62003007	Recommendation	Kəlkələh mɨn , sotoliən iətəmi kəti teiuə e təmah e nati u . Iətəmi tatol nati əhruahru , nɨpətɨn u məmə in iətəmi əhruahru təhmen e Krɨsto məmə in iətəmi əhruahru .
62004001	Recommendation	Nɨkik mɨn , nəmə iətəmimi kəti tətəni məmə Narmɨn rəha Uhgɨn tətatɨg lan , matol in tətəni pətɨgəm rəhan nəghatiən , kəni təuvɨr pɨk məmə onəkoteruh vivi motakil mətɨg məmə narmɨn əha tətatɨg lan , in rəha Uhgɨn pəhriən , uə səniəmə rəha Uhgɨn . Kitah okotəkeikei moteh vivi mətəu-inu iəni eiuə mɨn tepət kɨnohiet rəkɨs məutəghati e nəhue nɨftəni .
44013038	Grace	“ Tol lanəha piak mɨn , iəkolkeikei məmə onəkotəhrun məmə rəueiu iətəni=pɨnə kəm təmah məmə e Iesu , Uhgɨn otos rəkɨs noliən tərah mɨn rəhatəmah .
50003001	Recommendation	Rəhak mɨn nətəmimi iətəm iəkolkeikei pɨk , pəh iəkəni nɨpɨlga nəghatiən nəuvetɨn mɨn . Otagiən o Iərmənɨg . Kəni iəkətei mɨn əmə nəghatiən kətiəh iətəm iəmətei kəm təmah aupən , mətəu səniəmə in nati tiəkɨs ohniəu , kəni in otasiru e təmah mahtɨpəsɨg e təmah o nəghatiən eiuə mɨn .
46011034	Recommendation	Nəmə iətəmi kəti nəumɨs tus , təuvɨr məmə otauən iman ikɨn lahuənu , məmə nian nəkotuhapumɨn , Uhgɨn otəsəfɨnəiən nalpɨniən kəm təmah o noliən mɨn əha rəhatəmah . Nian iəkuvnə , oiəkəfɨnə suaru e natimnati pɨsɨn nəuvein mɨn iətəm nəkotətapuəh ohni .
43018031	Description	Kəni Pailət təni=pən kəm lah məmə , “ Təuvɨr məmə itəmah onəkotələs in məhuvən , kəni itəmah motakil , tɨtəu=pən lou mɨn rəhatəmah . ” Mətəu ilah kotəni=pən kəm in məmə , “ Mətəu nətəm Rom əmə ilah kotegəhan məmə kəhrun nohamuiən itəmi . ”
46012031	Faith	Mətəu təuvɨr məmə nəkotələhu=pən əskasɨk nətəlɨgiən rəhatəmah o nosiən nəsanəniən pɨsɨn pɨsɨn mɨn iətəm Narmɨn Rəha Uhgɨn tətəfa , ilah mɨn əha kotəuvɨr agɨn . Mətəu rəueiu iəkəni=pɨnə suaru təuvɨr agɨn .
58007026	Description	O nati u inu , in pris asoli agɨn iətəm in təhmen o nasiruiən e tah . In tasim , kəni məhruahru vivi , in təsoliən noliən tərah . In tol pɨsɨn agɨn e nətəm kautol təfagə tərah , kəni in ilɨs tapirəkɨs ilah əpəha e negəu e neai .
50004013	Faith	Mətəu-inu Krɨsto tətəfa rəhan nəsanəniən kəm iəu , kəni iəkəhrun naliuəkiən e nəuvɨriən uə nərahiən .
52004003	Recommendation	Nətəlɨgiən rəha Uhgɨn məmə in təmələhu kalɨn itəmah məmə rəhan mɨn məmə nəkotol nati iətəm təhruahru vivi : sotohtəu-pəniən suaru rəha nɨpətan mɨne nəman iətəm kautit oneuən ilah mɨn .
51004002	Recommendation	Itəmah onəkotəkeikei məutəghati=pən kəm Uhgɨn e nəfakiən e nian rəfin . Kəni nian onətəfaki , rəhatəmah nətəlɨgiən otəkeikei mətatɨg lan , kəni nian rəfin agɨn nəkotəkeikei məutəni kəm Uhgɨn məmə nɨkitəmah tətagiən o natimnati iətəm in təmol kəm təmah .
44007029	Description	Nian Mosɨs təmətəu nəghatiən əha , kəni təməgɨn kəni miet Ijɨp magɨm muvən əpəha isəu ikɨn Mitian mətatɨg ikɨn məhmen e iapɨspɨs kəti . Nian təmətatɨg mətatɨg mit pətan ikɨn kəti , kəni mələs nətɨn keiu iərman mil .
46011007	Description	Təuvɨr məmə iərman kəti təsəhtərainiən rəhn-kapə mətəu-inu nian Uhgɨn təmol iətəmimi , iətəmimi təmos narmɨ Uhgɨn , kəni matol pətɨgəm nəuvɨriən rəha Uhgɨn ; mətəu pətan tatol pətɨgəm nəuvɨriən rəha iərman rəhan .
51003015	Faith	Otos nəməlinuiən rəha Krɨsto pəh in tətarmənɨg e nɨkitəmah , mətəu inko Uhgɨn təmauɨn e təmah məmə nəkəhuva motol kətiəh , kəni məutatɨg əmə e nəməlinuiən . Kəni nian rəfin otəni kəm Uhgɨn məmə nɨkitəmah tətagiən o natimnati iətəm in təmol kəm təmah .
58002010	Grace	Uhgɨn təmol natimnati mɨn rəfin mətəu-inu in təmolkeikei lanəha , kəni natimnati rəfin kəutatɨg=pən e nəhlmɨn . Tol lanəha , in təuvɨr agɨn mɨne məhruahru məmə Uhgɨn təmol məmə Iesu otuva suaru o nosmiəgəhiən nɨmənin nətəmimi tepət kəhuva nenətɨ Uhgɨn məhuva motatɨg e nəhagəhagiən rəha nəuvɨriən mɨne nəsanəniən rəhan . Kəni təuvɨr məhruahru məmə e nətəlɨgiən rəha Uhgɨn , Iesu təkeikei mətəu nahməiən e nɨmɨsiən məmə in otuva iətəmi təhmen agɨn məmə otosmiəgəh ilah .
59004001	Sin	? Nak u nəukətɨ nəməuiən mɨne norgəhuiən rəhatəmah ? Natimnati mɨn əha kəutəhuva mətəu-inu itəmah nəkotolkeikei nətəuiən təuvɨr e nɨpətɨtəmah , kəni nətəlɨgiən mɨn əha rəha nətəuiən təuvɨr , ilah kəutəluagɨn e nɨkitəmah kətiəh kətiəh məmə okəhuva nətəmi asoli mɨn e nəmiəgəhiən rəhatəmah .
46005001	Sin	Kəməni pətɨgəm kəm iəu məmə iətəmi kəti u e nɨkitəmah tətakləh e pətan kəti , kəni təmol e noliən tərah kəti iətəm tapirəkɨs noliən rəha nətəm kəsotəfakiən . In tətakləh e pətan vi rəha rəhan tatə .
46010013	Faith	Nəfeifeiən iətəm tətuva e nəmiəgəhiən rəhatəmah təhmen əmə e iətəm katol lan e nətəmimi rəfin . Mətəu nian rəfin , kitah kotəhrun nəhatətəiən e Uhgɨn , kəni otəsegəhaniən e nəfeifeiən otuva e nəmiəgəhiən rəhatəmah məmə in təskasɨk mapirəkɨs nəsanəniən rəhatəmah . Mətəu nian nəfeifeiən tətuva e nəmiəgəhiən rəhatəmah , Uhgɨn otol suaru kəti məmə onəkotəhrun nosiən nəhtuliən rəhatəmah , məmə nati əha otəsiuvi-pəniən itəmah e nərahiən .
44020029	Violence	Inəhrun rəkɨs məmə nian iəkiet rəkɨs e təmah , nətəmimi nəuvein iətəm kotəhmen e kuri arpɨn mɨn okəhuva məmə okotus itəmah nətəmimi rəha Iesu .
53001004	Faith	Tol lanəha , itɨmahal iəhləni pətɨgəm kəm nətəmimi rəha niməfaki rəha Uhgɨn e ikɨn mɨn rəfin məmə nɨkitɨmahal tagiən pɨk o təmah . Itɨmahal iəhləni lanəha mətəu-inu nian rəfin , itəmah nautəhtul əskasɨk e nəmiəgəhiən rəhatəmah e Krɨsto , kəni məutaskəlɨm əskasɨk əhanəh nəhatətəiən rəhatəmah , nati əpnapɨn nətəmi ihluə kautol tərah e təmah , kəni mol itəmah nəutətəu nahməiən tepət .
62004012	Faith	Iətəmi kəti təsehiən Uhgɨn nian kəti mɨne . Mətəu nəmə kitah kotolkeikei itah mɨn , kəni Uhgɨn tatɨg e nɨkitah , kəni nolkeikeiən rəhan təmatɨg mɨnpi vivi pəhriən e nɨkitah .
48001001	Description	Piak mɨn mɨne nəuvɨnɨk mɨn nətəm kəutəfaki lahuənu pɨsɨn pɨsɨn mɨn ikɨn Kəlesiə , iəu Pol , iəu aposɨl kəti rəha Uhgɨn , iətəm Iesu Krɨsto mɨne Tatə Uhgɨn kəmuəfəri iəu məmə iəu rəhalau aposɨl . Səniəmə iətəmimi əpnapɨn əmə kəti təmauɨn lak kəni məfəri iəu , mətəu Uhgɨn . Uhgɨn u , in təməfəri Iesu tair=pa mɨn e rəhan nɨmɨsiən . ! Tol lanəha , onəkotəkeikei motətəu ! Iəkətei nauəuə u , mətahli=pɨnə kəm təmah . Iəu mɨne piatah mɨn nəuvein nətəm kautəfaki u ikɨnu , iəkotolkeikei məmə iəkotəni “ təuvɨr ” kəm təmah .
58012003	Recommendation	Təuvɨr məmə nɨkitəmah otəhti Iesu , mɨne rəhan nəhtul əskasɨkiən e nian nol təfagə mɨn kəmotəraki=pən e nəghatiən tərah mɨn kəm in , məmə nɨkitəmah otəsəpəouiən kəni motəpəh nəhatətəiən rəhatəmah .
45006005	Faith	Tol lanəha mətəu-inu , kəməhuva kətiəh kitah min e nɨmɨsiən rəhan , kəni okəhuva mɨn kətiəh kitah min e noliən iətəm Uhgɨn təmosmiəgəh in lan e nɨmɨsiən .
45015010	Recommendation	Kəni tətəni mɨn məmə , “ Otagiən , Nanihluə mɨn , itəmah rəhan mɨn nətəmimi . ”
54004001	Sin	Narmɨn Rəha Uhgɨn tətəni pətɨgəm vivi məmə e nian mɨn uərisɨg Iesu otəpanuva lan , nətəmimi nəuvein okotəpəh nɨtəu-pəniən noliən pəhriən rəha nəhatətəiən e Uhgɨn . Ilah okotohtəu=pən narmɨn eiuə mɨn kəni motohtəu=pən nəgətuniən rəha iərmɨs mɨn .
56003001	Recommendation	Taitəs , əni=pən vivi mɨn kəm rəham nətəmimi məmə okotɨsiai nətəmi asoli mɨne kəpmən rəhalah . Okotəkeikei mautol nəuialah , kəni mautəhtul maru e nian rəfin o noliən uək iətəm otasiru e nətəmimi .
61003005	Sin	Kəutəni lanəha , mətəu ilah kəsotolkeikeiən məmə okotətəlɨg e nɨpəhriəniən u məmə Uhgɨn təməghati , kəni təmol neai mɨne nɨftəni e nəghatiən rəhan . Kəni mol nɨftəni tiet e nəlugɨ nəhu , kəni mos nəhu mol ikɨn mɨn rəfin e nəhue nɨftəni .
60003018	Grace	Tol lanəha mətəu-inu , Krɨsto təmɨmɨs o təfagə tərah mɨn , təmɨmɨs nian kətiəh əmə tɨnəhmen , ko təsɨmɨs mɨniən nian kəti . In iətəmi in təhruahru agɨn , mətəu təmɨmɨs o nətəm kəsotəhruahruiən məmə otos itəmah muvən kəm Uhgɨn . Kəmotuhamu in kəni nɨpətɨn tɨmɨs , mətəu Uhgɨn təmol məmə in təmiəgəh mɨn e nɨmɨsiən , e nəmiəgəhiən kəti rəha negəu e neai .
61002021	Sin	Nəmə ilah kəmotəruru agɨn suaru rəha nol-əhruahruiən , kəsi , in nati tərah nəuvetɨn o lah . Mətəu tərah pɨk agɨn o lah nəmə ilah kɨnotəhrun suaru əha rəha nol-əhruahruiən , kəni uərisɨg lan kotəuhlin nəmtahlah e nəghatiən rəha Uhgɨn iətəm təməfən kəm lah .
53003006	Recommendation	Piak mɨn mɨne nəuvɨnɨk mɨn . E nərgɨ Iərmənɨg Iesu Krɨsto , iəhləni əskasɨk kəm təmah məmə nəkotəhtul isəu o piatah mɨn iətəm kautol noliən rəha nəlpahiən , kəni məsotatɨgiən mətɨtəu=pən nəgətuniən iətəm nəmotos o tɨmahal .
45005012	Sin	Aupən agɨn , suah u Atəm , təmol təfagə tərah , kəni tol lanəha , iətəmi kətiəh əmə u təmos təfagə tərah muva e nəhue nɨftəni . Kəni təfagə tərah təmələs nɨmɨsiən muva ikɨn . Kəni tol lanəha , nətəmimi rəfin okotəkeikei mohmɨs mətəu-inu ilah rəfin kautol təfagə tərah .
58011033	Faith	Ilah u kəmotəhatətə əskasɨk e Uhgɨn , kəni tol lanəha , ilah kəmotol natimnati tepət . Ilah kəmotit nəuanɨləuɨs mɨn rəha Isrel məhuvən motəluagɨn ilah nətəm ikɨ pɨsɨn pɨsɨn mɨn , kəni mautol win e lah . Ilah kəmautol noliən əhruahru mɨn , kəni mautos natimnati təuvɨr mɨn iətəm Uhgɨn təməni-əskasɨk məmə otəfən kəm lah . Kəmotahtɨpəsɨg e nohlɨ laion mɨn məmə okəsotuniən ilah ,
47004009	Faith	Nətəmimi kautol nərahiən kəm tɨmah , mətəu Uhgɨn təsəpəhiən itɨmah . Kautoh itɨmah , mətəu kəsotərəkɨniən itɨmah .
59004004	Sin	Itəmah nəmotəpəh Uhgɨn kəni mautohtəu=pən natimnati rəha nəhue nɨftəni , təhmen e pətan iətəm təsɨsiaiən rəhan iərman , məpəh kəni mətɨtəu=pən əpnapɨn əmə nəman . Nəkotəhrun uə kəpə məmə , iətəmimi iətəm tolkeikei pɨk natimnati rəha nəhue nɨftəni , in tətəməki e Uhgɨn . Kəni iətəmimi kəti iətəm tatɨtəpɨn məmə otolkeikei natimnati rəha nəhue nɨftəni , in tətuva məmə in tɨkɨmɨr rəha Uhgɨn .
44016006	Description	Kəni ilahal kəmhluvən=pən əpəha Fritiə mɨne Kəlesiə ikɨn , mətəu-inu Narmɨn Rəha Uhgɨn təməsegəhaniən e lahal məmə okɨhluvən=pən Esiə məhləni pətɨgəm nəghatiən əha ikɨn əha .
45010006	Faith	Mətəu suaru rəha nəhatətəiən məmə iətəmi kəti tuva məhruahru e nəhmtɨ Uhgɨn təpiə əmə , məmə kitah kəsotoliən nati kəti mətəu-inu Krɨsto tɨnol rəkɨs rəfin . Təhmen e Nauəuə Rəha Uhgɨn iətəm tətəni məmə , “ Səniəmə nəkəkeikei muvən e negəu e neai , ” məmə onəkəsal e Krɨsto mələs meiuaiu muva məmə otasiru lam .
66016002	Violence	Agelo iətəm tətaupən , təmuvən mauvəregɨn pətɨgəm pesɨn rəhan e nɨftəni . Kəni əmeiko , nətəmimi nətəm kautos mak rəha nati miəgəh e rəhn-kapə lah səpɨn , kəni mautəfaki kəm narmɨn iətəm kəmɨsɨkəuvɨn e nɨgi , nɨməgɨm təməmɨrəuei nɨpətɨlah .
66005008	Description	Kəni nian in tɨnaskəlɨm nauəuə kəha , kəni nati mɨn əha u kəutəmiəgəh ilah kuvət , mɨne nətəmi asoli nətəm kəmotos nəhuitən ilah tuenti-fo , ilah kəutasiəulɨn nəulɨlah o Nətɨ Sipsip , moteiuaiu , nɨpənəgɨlah tatek nɨftəni . Ilah rəfin kautos hap mɨn mɨne pesɨn mɨn iətəm kəmol e aiən u kol tətoraip-oraip , təriauəh e nati pien-pien mɨn iətəm nəmiəvɨn təuvɨr . Kəni nati pien-pien u , in təhmen e nəfakiən mɨn rəha nətəmimi rəha Uhgɨn .
62005001	Faith	Iətəmimi iətəm tətəhatətə e Iesu məmə in Krɨsto iətəm Uhgɨn təməni məmə otahli=pa , iətəmi inu , in nətɨ Uhgɨn , kəni iətəmimi iətəm in tolkeikei Tatə Uhgɨn , in tolkeikei mɨn nenətɨn mɨn .
48005026	Recommendation	Tərah məmə kitah okotəfəri kəni motəfəri aru itah , motiuvi-pəri nərahiən , kəni mautetet itah mɨn .
54005001	Recommendation	Sagət əskasɨkiən e nauəhli mɨn , mətəu əghati kəm lah e nɨsiaiən məmə nəkiuvi rəhalah nətəlɨgiən , təhmen əmə məmə ilah rəham tatə əhruahru mɨn . E noliən kətiəh mɨn əmə , ol təhmen əmə kəm nətəm aluə təhmen əmə məmə ilah piam əhruahru mɨn .
60002012	Recommendation	Nian rəfin kitah kəutatɨg e nəlugɨn e nətəmimi nətəm rəhalah nəhatətəiən tɨkə . Kəni nəmiəgəhiən rəhatəmah in otəkeikei məhruahru vivi agɨn məmə nati əpnapɨn ilah okotətu=pɨnə nəghatiən tərah e təmah , mətəu okoteruh noliən təuvɨr mɨn rəhatəmah , kəni ilah okotəfən nɨsiaiən kəm Uhgɨn e nian in otuva mɨn makil nətəmimi lan .
50003006	Sin	Iəmolkeikei pɨk məmə nəfakiən kəm Uhgɨn in təhruahru agɨn , tol lanəha , iəmol nərahiən kəm nətəm kəutəhatətə e Iesu . Mətəu-inu e rəhak nətəlɨgiən , ilah kəmotol nəfakiən kəm Uhgɨn tamɨkmɨk . Kəməseh=paiən nati tərah kəti mɨne e nəmiəgəhiən rəhak mətəu-inu iəmɨtəu=pən rəfin lou mɨn rəha nati Isrel .
43004052	Description	Kəni in təmətapuəh o lah məmə , “ ? Təməuvɨr e nian nak ? ” Kəni ilah kəmotəni=pən kəm in məmə , “ Nəniuv ləhnaiuv e uan klok rəhan nəpiapeiən təmɨkə . ”
43019031	Violence	Nian əha rəha nol əpenə-penəiən , mətəu-inu okəni lauɨg lan , nian rəha Sapət . ( Kəni Sapət u , in Sapət keikei kəti . ) Kəni nətəmi asoli rəha nətəm Isrel kəsotolkeikeiən məmə nɨpətɨ suah milahal əha okəhləhkul e nɨgi kəməluau mətəuarus=pən nian əha . Kəni o nati əha inəha , ilah kəməhuvən motətapuəh o Pailət məmə otahli=pən rəhan mɨn nətəmimi , kəhuvən , motahtɨhli nəhlkɨlahal , pəh ilahal okɨhlɨmɨs uəhai əmə . Konu ilah okotələs rəkɨs nɨpətɨlahal .
43019012	Description	Kəni tətuəuin e nian əha , Pailət təmolkeikei məmə otəhlman e Iesu . Mətəu nətəmi asoli mɨn rəha nətəm Isrel kəutagət əfəməh mautəni məmə , “ Nəmə nəkəhlman e suah u mahli pətɨgəm , kəni ik səniəmə iətəmimi rəha Sisə . Iətəmi kəti u iətəm tətəni məmə in kig in tɨkɨmɨr rəha Sisə . ”
43014001	Faith	Kəni Iesu təməni=pən kəm lah məmə , “ Nɨkitəmah təsahməiən . Itəmah nəkotəkeikei motəhatətə e Uhgɨn , kəni motəhatətə mɨn lak .
50001028	Faith	kəni məmə nəsotəgɨniən e rəhatəmah mɨn tɨkɨmɨr . Inu nəmtətiən pəhriən kəti o lah məmə Uhgɨn otərəkɨn ilah , mətəu in otosmiəgəh itəmah . Uhgɨn otol natimnati mɨn əha rəfin .
43015016	Grace	Itəmah nəməsotɨtəpɨniən iəu , mətəu iəu iəmɨtəpɨn itəmah . Kəni iəu iəmələhu=pən itəmah məmə itəmah onəkəhuvən motol uək , kəni uək rəhatəmah otəuə e nəuan . Kəni nəuan u , in otətatɨg . Tol lanəha , kəni nəmə nəkoteasiə e natimnati mɨn kəm Tatə Uhgɨn e nərgək , kəni in otəfɨnə kəm təmah .
58011004	Faith	Epɨl in təməhatətə əskasɨk e Uhgɨn , tol lanəha in təməfən nati kəti kəm Uhgɨn iətəm təuvɨr mapirəkɨs rəha Ken . Kəni mətəu-inu in təməhatətə əskasɨk e Uhgɨn lanəha , kəni Uhgɨn təməni pətɨgəm məmə in iətəmi əhruahru kəti , kəni nɨkin tagiən o nosiən rəhan natimnati . Kəni nati əpnapɨn məmə iətəmi u təmɨmɨs rəkɨs , mətəu noliən rəha nəhatətəiən rəhan in tətəghati əhanəh kəm tah .
46004001	Recommendation	Tol lanəha , nətəmimi okotəkeikei moteh itɨmah təhmen e noluək mɨn rəha Krɨsto iətəm Uhgɨn təmələhu=pən e nəhlmɨtɨmah məmə itɨmah iəkotol əpu nəlpəkauiən oneuən rəha Uhgɨn .
66006013	Description	Kəni məhau mɨn əpəha ilɨs e neai kəmotəmei=pən e nəhue nɨftəni , təhmen e nəua nɨgi iətəm nɨmətagi asoli təmarɨgrɨg e nəuan pɨkɨs tɨmərəgrəg .
46010014	Recommendation	Tol lanəha rəhak mɨn , otagɨm rəkɨs e noliən rəha nəfakiən kəm narmɨ nati mɨn .
45012021	Recommendation	Sotegəhaniən məmə noliən tərah , otətəuarus itəmah mələs iahu itəmah , mətəu otol məmə rəhatəmah noliən təuvɨr otosiahu noliən tərah .
55002014	Recommendation	Natimnati mɨn u , onəkəkeikei mətəni mətɨsɨmaru lan kəm rəham mɨn nətəmimi . Əni əskasɨk kəm lah lanəha məmə , “ Iatəni e nərgɨ Uhgɨn məmə itəmah nəsotorgəhuiən o nɨpətɨ nəghatiən mɨn . ” Norgəhuiən lanəha təsasiruiən e iətəmi kəti , mətəu tətərəkɨn əmə nətəmimi nətəm kəutətəu .
59004008	Recommendation	Əhuvən iuəkɨr o Uhgɨn , kəni in otuva iuəkɨr o təmah . Itəmah u nol təfagə tərah , otafəl nəhlmɨtəmah . Kəni itəmah u rəhatəmah nəhtuliən keiu , otol nɨkitəmah tuva kətiəh məhruahru .
59002009	Sin	Mətəu təfagə tərah kəti tol lanu , nəmə nauteh nətəmimi nəuvein məmə ilah ilɨs tapirəkɨs nətəmimi nəuvein mɨn . Kəni nəghatiən rəha Lou tətəni məmə nətəmimi kautol lanəha , ilah nətəmi rəha natgəhliən Lou .
52004007	Grace	Tol lanəha mətəu Uhgɨn təməsauniən e tah məmə okotamɨkmɨk e nəhmtɨn , okotatɨg e nəmiəgəhiən iətəm kəmotələhu kalɨn məmə rəhan .
45001018	Sin	Mətəu Uhgɨn e negəu e neai tətəgətun rəhan niəməha mɨne nalpɨniən o nətəmimi rəfin nətəm kəutəhti nəuian mautol noliən tərah mɨn rəhalah . Ilah kəutəhtul pəsɨg e nɨpəhriəniən rəha Uhgɨn e noliən tərah mɨn rəhalah ,
62004007	Faith	Nɨkik mɨn , pəh kitah kotəkeikei mautolkeikei itah mɨn , mətəu-inu nolkeikeiən in tatsɨpən e Uhgɨn , kəni iətəm tatol nolkeikeiən , in təmair vi mɨn muva nati Uhgɨn kəti , kəni təhrun Uhgɨn .
62002009	Sin	Kəni iətəmi u tətəni məmə in tətatɨg e nəhagəhagiən mətəu tətəməki e pian , in tətatɨg əhanəh e napinəpuiən .
60004014	Grace	Nəmə nətəmimi kəutəni rah itəmah o nərgɨ Krɨsto , kəni onəkotatɨg e nəuvɨriən pəhriən , mətəu-inu nian kəutəni rah itəmah o Krɨsto , inu tətəgətun məmə Narmɨn Rəha Uhgɨn iətəm təsanən məhagəhag mətatɨg o təmah .
44021019	Grace	Pol təməni təuvɨr kəm lah kəni məni pətɨgəm vivi kəm lah natimnati rəfin agɨn e rəhan naliuəkiən iətəm Uhgɨn təmol kəm Nanihluə mɨn .
43008046	Sin	? Təhro ? Itəmah kəti u ikɨnu təhrun nəgətuniən məmə iəu iəmol noliən tərah kəti mɨne ? ? Nəmə iəu iətəni nəghatiən pəhriən mɨn , kəni təhro itəmah nəsotəhatətəiən lak ?
58010017	Grace	Kəni in tətəni mɨn məmə , “ Iəu oiəkalu e rəhalah noliən tərah mɨn , kəni nɨkik otəsəhti mɨniən noliən mɨn rəhalah nətəm kəutatgəhli Lou . ”
46001005	Grace	Təməfɨnə rəhan nəuvɨriən u tepət kəm təmah e noliən mɨn rəfin , e nasiruiən o nəni pətɨgəm viviən natimnati mɨn mɨne neinatɨgiən o nəhruniən nəghatiən rəhan .
45015030	Recommendation	Piak mɨn mɨne nəuvɨnɨk mɨn , mətəu-inu kitah kəutəhatətə e Iərmənɨg rəhatah Iesu Krɨsto , kəni Narmɨn Rəha Uhgɨn tatol məmə kitah kautolkeikei itah mɨn , iəkətapuəh əskasɨk o təmah məmə nəkotəfaki əskasɨk kəm Uhgɨn ohniəu , kəni e noliən əha , nəkotasiru lak e nəluagɨniən rəhak .
43007020	Violence	Kəni nɨmənin nətəmimi kotəni məmə , “ ! Nəman ! ! Narmɨn tərah kəti u tətatɨg lam ! ? Pəh təni məmə otoh ik mɨne ? ”
45003025	Grace	Uhgɨn təmahli=pa Krɨsto məmə in sakrifais iətəm təmos nalpɨniən mɨne niəməha rəhan o təfagə tərah mɨn , nian nɨra Krɨsto təmaiu . Kəni Uhgɨn təmafəl təfagə tərah mɨn rəha nətəmimi nian nətəmimi kotəhatətə məmə Krɨsto təmɨmɨs o lah . Uhgɨn təmol suaru əha məmə otəgətun məmə rəhan noliən in təhruahru agɨn , mətəu-inu e nətəlɨgiən əfəməh rəhan , in təsoliən nalpɨniən o təfagə tərah mɨn iətəm nətəmimi kəmotol aupən .
43018018	Description	Kəni e nian əha , in nian rəha nətəpuiən , kəni noluək mɨn rəha pris asoli agɨn , mɨne soldiə mɨn , ilah kəmotahli nɨgəm e nəmtahlɨ nɨgəm , kəni mautəhtul tɨtəlau lan , məutətogəm . Kəni Pitə mɨn , in təmuvən matəhtul , matətogəm e nɨgəm .
49006011	Recommendation	Əhuvən e natimnati rəfin rəha Uhgɨn o nəluagɨniən məmə nəkotəhrun nosiən nəhtuliən rəhatəmah nian Setən tatol nəlpəkauiən eiuə o nohiən itəmah .
43013037	Faith	Kəni Pitə tətapuəh ohni məmə , “ ? Iərmənɨg , oiəsɨtəu-pəniən ik u rəueiu o nak ? Iəu , nɨkik tagiən əmə məmə iəkɨmɨs ohnik . ”
50004007	Faith	Kəni Uhgɨn otəfɨnə kəm təmah nəməlinuiən iətəm iahgin pɨk tapirəkɨs nəhruniən rəfin rəha nətəmimi . Kəni nəməlinuiən əha otarmənɨg vivi e nɨkitəmah mɨne nətəlɨgiən rəhatəmah mətəu-inu nəutəhatətə e Krɨsto Iesu .
59003009	Faith	E namɨtah , kəutəni-vivi Iərmənɨg Tatə Uhgɨn rəhatah , kəni e namɨtah kəutəni rah nətəmimi lan iətəm Uhgɨn təmol ilah kotol məmə in mɨne .
46005010	Sin	Iəsəniəhuiən məmə nəsotaniən itəmah nətəm kəsotəfakiən nati əpnapɨn noliən rəhalah tol lanəha : ilah kəutakləh e nɨpətan , ilah navərəs , ilah nakləh mɨn e neiuəiən , kəni ilah kəutəfaki kəm narmɨ nati mɨn . Nətəmimi tepət agɨn kotol lanu lan u rəueiu e nəhue nɨftəni . Nəmə nəsotaniən itəmah min ilah , kəni nəkotəkeikei mohiet agɨn ikɨnu e nəhue nɨftəni .
44026009	Sin	“ Aupən , iəu aru nɨkik təməhti məmə iəkəkeikei mol natimnati tepət pəh mərəkɨn nərgɨ suah kəha Iesu , iətəm Nasərɨt .
61002014	Sin	Nian rəfin rəhalah nətəlɨgiən tatuvən o nakləhiən e nɨpətan u rəhalah nətəlɨgiən tɨmətɨg əmə . Kəni nian rəfin kautol təfagə tərah məsotəpəhiən . Kautiuvi kalɨn rəkɨs nətəmimi nətəm rəhalah nətəlɨgiən təsəskasɨkiən kautəhuvən o noliən tərah . Ilah kəutəgətun aru ilah e noliən rəha navərəsiən . Uhgɨn təməni rəkɨs nalpɨniən rəhalah .
43010012	Description	Sipsip mɨn , ilah rəha Iətəmimi rəha Nəsal Viviən e Sipsip Mɨn . Mətəu iətəmimi kəti iətəm kətətəou məmə in otətəsal o sipsip mɨn , in səniəmə iətəmi əhruahru rəha nəsaliən o sipsip . Səniəmə in rəhan əha sipsip mɨn . Kəni nəmə tafu kuri arpɨn kəti tuva məmə otus ilah , kəni in otaiu magɨm məpəh ilah . Kəni kuri arpɨn u , tuvən mus sipsip mɨn nəuvein , kəni məhgi atiti ilah kətiəh kətiəh .
59001019	Recommendation	Piak mɨn mɨne nəuvɨnɨk mɨn nətəm iəkolkeikei pɨk itəmah . Nɨkitəmah otəkeikei mətəhti nəghatiən u . Pəh itəmah kətiəh kətiəh onəkotəkeikei motətəlɨg vi nian nətəmimi kəutəghati , mətəu onəsotauɨt-auɨt pɨkiən o nəghatiən , sotoliən məmə niəməha tatol uəhai əmə itəmah ,
46009014	Recommendation	E suaru kətiəh əmə , Iərmənɨg təməni əskasɨk məmə , nətəmimi nətəm kəutəni pətɨgəm nanusiən təuvɨr , rəhalah natimnati o natɨgiən otəkeikei mɨsɨpən ikɨn .
43012046	Grace	Iəu u nəhagəhagiən . Iəmuva e nəhue nɨftəni u , məmə iətəmimi iətəm otəhatətə lak , otəsatɨgiən e napinəpuiən .
43005014	Description	Kəni uərisɨg , Iesu təmeruh suah kəha e Nimə Rəha Uhgɨn , kəni təni=pən kəm in məmə , “ ! Ei ! ! Eruh-to ! ! Ik nɨnəuvɨr rəkɨs ! Mətəu onətətəu ik məmə nəsol mɨniən təfagə tərah mɨn . Nəmə nəkol , nərahiən kəti otos mɨn ik , iətəm tərah pɨk mɨn . ”
46016014	Recommendation	Natimnati rəfin agɨn iətəm itəmah nautol , otol e nolkeikeiən .
