51001010	Faith	Iautəfaki lanu məmə naliuəkiən rəhatəmah otəfən nɨsiaiən kəm Uhgɨn pəh tol nɨkin tətagiən ohni , kəni məmə rəhatəmah nəmiəgəhiən otəuə e nəuan iətəm təuvɨr o uək rəfin rəha Uhgɨn iətəm nautol . Pəh Uhgɨn otasiru e təmah məmə nəkotəhrun vivi in .
54001018	Recommendation	Kəni inəha nətɨk Timoti . Inu rəhak nəghatiən təhmen=pən e nəghatiən rəha iəni mɨn nətəm kəmautəni kəm ik aupən . Ik onəkəkeikei maskəlɨm nəghatiən mɨn əha pəh tol rəham nətəlɨgiən təskasɨk , kəni ik onəkəluagɨn vivi e nəluagɨniən rəha nəhatətəiən .
66019001	Faith	Uərisɨg e nəghatiən rəha agelo kəha , iəkətəu nəuian asoli kəti təhmen e nətəmimi tepət tepət kəutagət əfəməh , əpəha e negəu e neai , mautəni məmə , “ ! Aleluiə ! ! Pəh kotəni-vivi Iərmənɨg ! ! In Uhgɨn u , təmosmiəgəh itah ! Nepətiən əhagəhag mɨne nəsanəniən in rəhan pɨsɨn əmə ,
49002001	Grace	Itəmah u , aupən təhmen əmə məmə nəmohmɨs e narmɨtəmah mətəu-inu nəmotəhti nəuia Uhgɨn , kəni motol noliən tərah mɨn .
46010021	Sin	Itəmah onəsəhuvəniən motos pɨret mɨne wain e Nauəniən Rəha Nəmtətiən Rəha Iesu , kəni motatɨg məhuvən mɨn e niməfaki rəha narmɨ nati mɨn motun sakrifais mɨne motəmnɨm wain rəha iərmɨs mɨn itəmah nətəm kəutəfaki lan .
49005003	Recommendation	Mətəu-inu itəmah nətəmimi rəha Uhgɨn iətəm nəkotəhruahru , kəni itəmah onəsotol agɨniən noliən nati kəti məmə okəni rah itəmah ohni . Iatəni noliən tərah mɨn təhmen e nɨpətan mɨne nəman mɨne , kautit oneuən ilah mɨn ; mɨne noliən tərah rəfin iətəm tol naulɨsiən o nəniən ; mɨne nətəmimi mɨn u navərəs mɨn .
56001015	Sin	Kəni nəkotəhrun məmə nətəmimi nətəm kotəhruahru e nəhmtɨ Uhgɨn , nati tɨkə iətəm otol ilah kotamɨkmɨk . Mətəu nətəmimi nətəm kəutamɨkmɨk e nəhmtɨ Uhgɨn mətəu-inu ilah kəsotəhatətəiən e Iesu , kəti noliən kəti tɨkə iətəm otol ilah kotəhruahru . Kəni tol lanəha , nətəlɨgiən mɨne nɨkilah pəti kəsuəhruahruiən , kəni ilah kotəruru nakiliən nati iətəm təuvɨr , mɨne nati iətəm tərah .
44009021	Description	Kəni nətəmi rəfin nətəm kəmotətəu in , kəmotauɨt pɨk ohni , kəni məutəni məmə , “ ! Ei ! ? Suah u inu təmatol nərahiən kəm nətəm kəutəhatətə e Iesu əpəha Jerusɨləm aupən , uə kəpə ? Kəni in təmuva ikɨnu məmə otaskəlɨm ilah məmki ilah muvən kəm pris asoli mɨn . ? Mə inəha , uə kəpə ? ”
58008006	Description	Mətəu rəueiu , Iesu , pris asoli agɨn u rəhatah , in tɨnos rəhan uək iətəm təuvɨr pɨk agɨn mapirəkɨs uək rəha pris mɨn aupən . Kəni e noliən kətiəh əmə , Iesu in suaru rəha nəniəskasɨkiən vi rəha nasiruiən u iətəm in təuvɨr mapirəkɨs nəniəskasɨkiən əuas rəha nasiruiən , mətəu-inu nəniəskasɨkiən vi u , in tətəhtul-pəri e nəghatiən mɨn iətəm kotəuvɨr motapirəkɨs .
50001021	Faith	Tol lanəha mətəu-inu nəmiəgəhiən rəhak in Krɨsto əmə , kəni nəmə iəkɨmɨs , in nati təuvɨr tapirəkɨs .
50001006	Faith	Tol lanəha iəkəhrun vivi məmə Uhgɨn iətəm təmətuəuin uək təuvɨr e nəmiəgəhiən rəhatəmah , in otəkeikei matol lanəha , kəni otəpanol naunun lan e nian Krɨsto Iesu otɨtəlɨg=pa mɨn .
62005020	Faith	Kitah kotəhrun mɨn məmə Nətɨ Uhgɨn təmuva kəni məfa neinatɨgiən kəm tah , məmə kitah okotəhrun in , u in nɨpəhriəniən . Konu kitah kautəhtul=pən e Uhgɨn u in nɨpəhriəniən , mətəu-inu kitah kautəhtul=pən e Nətɨn Iesu Krɨsto . In u , in Uhgɨn pəhriən , kəni in nəukətɨ nəmiəgəhiən itulɨn .
45012018	Recommendation	Otol natimnati rəfin iətəm nəkotəhrun noliən məmə itəmah nəkotatɨg e nəməlinuiən itəmah nətəmimi rəfin .
58010023	Faith	Kitah kotəni məmə kəmotələhu=pən nətəlɨgiən rəhatah e Krɨsto . Tol lanəha , pəh kotəhtul məha-məha lan , məsotəlauəl-auəliən , mətəu-inu kitah kotəhrun nahgəliən e rəhan nəghatiən mɨn iətəm təməni əskasɨk rəkɨs kəm tah .
43014027	Grace	“ Rəueiu əha tɨnuəkɨr məmə iəu oiəkəpəh itəmah . Iəu iətələhu nəməlinuiən rəhak tətatɨg o təmah . Konu nəməlinuiən u , iətəm iəkəfɨnə , təsəhmeniən e nəməlinuiən iətəm nəhue nɨftəni u tətəfɨnə . Itəmah , nɨkitəmah təsahməiən kəni məsotəgɨniən .
47005006	Faith	Kəni tol lanəha , nətəlɨgiən rəhatah təskasɨk , kəni kitah kotəhrun vivi məmə nian kəutatɨg əhanəh u ikɨnu mautos əmə nɨpətɨn rəha nəhue nɨftəni u , kitah kautəhtul əhanəh ihluə ima Iərmənɨg ikɨn rəhatah .
43012047	Grace	Iətəmimi iətəm tətətəu rəhak nəghatiən , məsoliən , ko iəu iəsəni pətɨgəmiən rəhan nalpɨniən , mətəu-inu iəməsuvaiən e nəhue nɨftəni u məmə iəkəni pətɨgəm nalpɨniən rəha nətəmimi . Mətəu iəmuva məmə iəkosmiəgəh ilah .
62003012	Sin	Sotoliən nɨtai Ken , iətəm in iətəmimi rəha Setən kəni təhuamu pian . ? Kəni təmohamu pian o nak ? Təmohamu mətəu-inu rəhan noliən mɨn tərah , konu rəha pian , noliən mɨn in təhruahru .
66016020	Description	Nɨtəni əlkələh mɨn rəfin kəmotagɨm , mohkə , kəni nɨtəuət mɨn kəseh mɨniən ilah .
58011012	Description	Epraham tɨnauəhli rəkɨs təsuvəhiən tɨmɨs , mətəu nəuanɨləuɨs mɨn tepət kəmotsɨpən lan . Nati əpnapɨn məmə in iətəmimi kətiəh əmə , mətəu nəuanɨləuɨs mɨn əha rəhan , ilah tepət pɨk , təhmen əmə e məhau mɨn e neai mɨne nɨpəkɨl e nɨkalkalɨ nɨtəhi kəruru nafiniən .
54001017	Faith	! Kotəni-vivi Uhgɨn ! Pəh kotɨsiai Uhgɨn rəhatah . In Iərmənɨg itulɨn ; in təsɨmɨsiən ; kəseruhiən in ; kəni in pɨsɨn əmə in Uhgɨn . Pəh kotəfəri nərgɨn tatuvən matuvən matuvən naunun tɨkə . Əuəh .
66014007	Faith	In tətəni əfəməh məmə , “ Otəgɨn motɨsiai Uhgɨn , kəni motəni nɨpəhriəniən e rəhan nepətiən , mətəu-inu nian əhruahru rəhan tɨnuva , o nəfəniən nalpɨniən kəm nətəmimi . Otəfaki kəm in , iətəm təmol natimnati rəfin agɨn : neai mɨne nɨftəni , nɨtəhi mɨne nəhmtɨ nəhu mɨn . ”
44006001	Description	Nian nəuvein tɨnuva rəkɨs muvən , kəni nətəmi rəha Iesu tɨnətəri mɨnatepət . Nəuvein ilah nəuanɨləuɨs rəha Isrel kəmotsɨpən ikɨn pɨsɨn pɨsɨn mɨn , kəni məutəni əmə nəghatiən Kris , məsotəniən nəghatiən rəha Isrel . Kəni tepət , ilah nətəm Isrel əmə . Mətəu nəfaki mɨn iətəm kəutəni əmə nəghatiən Kris kɨnəutəni nɨkalɨ nəfaki mɨn u nətəm Isrel , məutəni məmə nian kəutəuəri məni mɨne nauəniən kəm pətalɨmɨs mɨn , mətəu kəsoteh viviən pətalɨmɨs mɨn rəha nətəmi mɨn u kəutəni nəghatiən Kris .
60002021	Grace	Uhgɨn təmauɨn e təmah məmə nautol noliən təuvɨr u , mətəu-inu Krɨsto təmos nahməiən o təmah . In təmaupən məgətun noliən əhruahru əha məmə itəmah nəkotohtəu=pən əmə nɨmei nəhlkɨn .
53003010	Recommendation	Kəni nian iəməhlatɨg əha kitah min itəmah , iəmhləfɨnə lou u məmə , “ Nəmə iətəmi təlpah , kəni kəsəfəniən nauəniən kəm in . ”
43003016	Grace	“ Tol lanəha , Uhgɨn təmolkeikei pɨk nətəmimi e nəhue nɨftəni , tol=pən in təməfa Nətɨn Nəuan Kətiəh Əmə , məmə nətəmimi mɨn rəfin u nətəm kəutəhatətə lan , ilah ko kəsəhuvəniən e nɨgəm itulɨn , mətəu okotos nəmiəgəhiən itulɨn .
44019015	Description	Mətəu narmɨn tərah təməni=pən kəm lah məmə , “ Iəkəhrun suah u Iesu , kəni məhrun mɨn Pol . ? Mətəu itəmah nɨpəh mɨn u ? ”
66019019	Violence	Kəni əmeikonu , iəkatɨg mafu mɨn nati miəgəh əpələ , mɨne kig mɨn rəha nəhue nɨftəni , mɨne rəhalah soldiə mɨn . Ilah kəmotuhapumɨn ilah mɨn məmə okotəluagɨn ilah iətəm tətasuə e əhos kəruən , mɨne rəhan soldiə mɨn .
44027002	Description	Kəni negəu kəti təmiet əpəha Atramitiam mətuva , kəni matɨg mɨnatɨtəlɨg=pən mɨn əpəha Esiə , kəni iəkəhuvən lan . Kəni iətəm kəti təmiuvɨg=pa itɨmah min , nərgɨn u Aristakəs , in iətəm Təsalonaikə əpəha e nɨtəni u Masetoniə . Kəni negəu təmietɨgəm .
58013003	Recommendation	Sotaluiən e nətəm kəutatɨg e kaləpus . Nɨkitəmah otatəhti ilah , mətahmə o lah təhmen əmə məmə inu ik mɨn nətatɨg e kaləpus . Otətəu pəti nahməiən e nɨkitəmah , itəmah nətəmi mɨn ko nətəm katol tərah e lah , təhmen əmə məmə inu ik natətəu nahməiən e nɨpətɨm aru .
51003017	Recommendation	Kitah u nəhlmɨ Iərmənɨg Iesu mɨn , kəni tol lanəha , natimnati rəfin u nautol , mɨne nəghatiən mɨn rəfin u nautəni , mətəu nəkotol əmə e nərgɨ Iərmənɨg Iesu . Kəni nian rəfin itəmah onəkotəkeikei motəni kəm Uhgɨn , tatə rəhatah , məmə nɨkitəmah tətagiən o natimnati iətəm Iesu təmol kəm təmah .
48006006	Recommendation	Itəmah u , təuvɨr məmə itəmah nəkotətuati e natimnati mɨn nəuvein kəm rəhatəmah nəgətun mɨn , nətəm kəutəgətun itəmah e nəghatiən rəha Uhgɨn .
44007005	Description	Mətəu təməsəfən əhanəhiən nɨftəni əkəku agɨn nəuvetɨn kəm in məmə rəhan əhruahru . Mətəu Uhgɨn təməni əskasɨk kəm in məmə otəpanəfən rəfin nɨtəni əha kəm in mɨne namipɨn mɨn . Kəni nɨtəni u otuva imalah agɨn ikɨn , nati əpnapɨn e nian əha Epraham təməsələsiən nətɨn kəti .
44007019	Description	In təmosiahu tɨpɨtah mɨn e nətəlɨgiən tərah mɨn rəhan , matol nahməiən kəm lah . Kəni in təmol lou kəti məmə okotəmki pətɨgəm nenətɨlah mɨn iəpəou amrərə mɨn ihluə məmə okohmɨs .
43020003	Description	Kəni Pitə mɨne iətəmimi kəti mɨn u rəha Iesu , kəmiaiet mətian məmə okueruh nɨpəg əha .
44024016	Faith	Mətəu-inu tol lanəha , kəni iətalkut pɨk məmə iəkol nati iəu iəkəhrun məmə təhruahru e nəhmtɨ Uhgɨn mɨne nətəmimi .
65001013	Description	Peau-peau ləuantəhi kəutorasɨlig məutəruən əpnapɨn əmə , kəni kitah rəfin kəuteruh əmə . Kəni təhmen əmə , kəuteruh naulɨsiən rəha nətəmimi əha nətəm kautol pətɨgəm əmə noliən tərah e rəhalah nəmiəgəhiən . Ilah kotəhmen e məhau mɨn iətəm kəmotəmkarəpən e suaru rəhalah . Tol lanəha , Uhgɨn tətaskəlɨm imalah ikɨn əpəha e napinəpuiən iətəm nəhagəhagiən tɨkə agɨn ikɨn .
48001012	Description	Nanusiən Təuvɨr u , səniəmə iətəmi kəti təməfa kəm iəu , kəni məgətun iəu lan , mətəu Iesu Krɨsto əmə in təmerəh e rəhk-kapə .
45007005	Sin	Nian nətəlɨgiən tərah rəha iətəmimi tətarmənɨg e tah , nətəlɨgiən tərah mɨn rəhatah kautiuvi=pən itah məmə okotol noliən tərah mɨn e nɨpətɨtah . Kəni nian Lou tətəni məmə okəsotoliən noliən tərah mɨn əha , tol məmə nɨkitah tətəhti pɨk noliən tərah mɨn , kəni kautolkeikei mautol təhmɨn noliən tərah mɨn . Tol lanəha , kəmotol təfagə tərah tepət . Kəni nəua təfagə tərah mɨn əha , in nɨmɨsiən əmə .
54002007	Faith	Kəni e nəghatiən əha , Uhgɨn təməfəri iəu məmə iəu aposɨl kəti rəhan o nəni pətɨgəmiən nanusiən təuvɨr u kəm Nanihluə mɨn , nətəmimi nətəm kəsəniə məmə nətəm Isrel , kəni təməfəri iəu məmə iəgətun kəti rəha nəhatətəiən pəhriən . Iəu iatəni pəhriən , iəseiuəiən .
62003024	Faith	Nətəmimi mɨn u nətəm kautol nəuian , ilah kautəhtul=pən vivi lan , kəni in tətəhtul=pən vivi e lah . Kəni kitah kotəhrun məmə in tətatɨg e nɨkitah , mətəu-inu Narmɨn Rəha Uhgɨn iətəm in təməfa , in tətəgətun kəm tah .
46010024	Recommendation	Təsəuvɨriən məmə itəmah kəti tətəsal aru e rəhan nəuvɨriən , mətəu təkeikei mətəsal mɨn e nəuvɨriən rəha nətəmimi mɨn nəuvein .
45012016	Recommendation	Otol rəhatəmah nətəlɨgiən təhmen-əhmen əmə e təmah mɨn rəfin . Nɨkitəmah təsəhtiən məmə itəmah nəuvein ilɨs , mətəu nɨkitəmah otagiən əmə məmə nəutan pəti əmə itəmah nətəmi mɨn u ləhtəni . Nɨkitəmah təsəhtiən məmə nəkotəhrun pɨk .
49004031	Recommendation	Kəni əraki rəfin e natimnati mɨn u : nahməiən e nɨkitəmah iətəm tətatɨg tatuvəh o nati kəti tərah iətəmi təmol e təmah ; kəni əraki mɨn e noliən niəməha ; mɨne noliən rəha nəni rahiən nətəmimi ; mɨne noliən rəha nɨkitəmah mɨne nohlɨtəmah tɨtatɨperəh pɨk təhmen e kaluəluə ; mɨne noliən rəha norgəhuiən ; mɨne noliən mɨn rəfin iətəm okotol nərahiən kəm nətəmimi .
51001025	Faith	Uhgɨn əmə təmləfəri iəu məmə iəkol uək e niməfaki rəhan . Rəueiu əha , iəkəhrun nasiruiən e təmah e uək iətəm Uhgɨn təmələhu=pən e nəhlmək . Rəhak uək məmə iətəni pətɨgəm nəghatiən mɨn rəfin rəha Uhgɨn pəh nəkotəhrun vivi ,
66001014	Description	Rəhn-kapə mɨne nəuanun təruən təruən təhmen e nəuaui nɨtəhi , kəni nəhmtɨn təhmen e nəmnamɨ nɨgəm .
47004015	Grace	Natimnati rəfin u o nəuvɨriən rəhatəmah , kəni nian nəuvɨriən rəha Uhgɨn tatiuvi=pa nətəmimi tepət təhmɨn mɨn okəhuva o Krɨsto , kəni okotəfən nəni-viviən tepət kəm Uhgɨn , kəni okotəfəri nərgɨn ilɨs ilɨs agɨn .
43006056	Faith	Iətəmimi iətəm tatun nəhuvegək , kəni mətəmnɨm nɨrak , in otatɨg lak . Kəni iəu iətatɨg lan .
43011027	Faith	Matə təni=pən kəm in məmə , “ Əuəh , Iərmənɨg . Iəu inəhatətə lam , məmə ik Krɨsto iətəm Uhgɨn təməni məmə otahli=pa . Ik Nətɨ Uhgɨn . Ik u inu , aupən kəməni e Nauəuə Rəha Uhgɨn məmə ik onəpanuva e nəhue nɨftəni . ”
44002042	Faith	Nian rəfin nətəmimi mɨn u kəutəni nɨpəhriəniən e Iesu , kəutətəlɨg e nəghatiən iətəm aposɨl mɨn kəutəgətun ilah lan . E naliuəkiən rəhalah kəməhuva kətiəh , e nauəniən mɨne Nauəniən Rəha Nəmtətiən Rəha Iesu , mɨne nəfakiən . Kəni nian rəfin nɨkilah tətəskasɨk məmə okotəkeikei mautol nati əha .
58001009	Grace	Ik nəmolkeikei əmə nəhruahruiən kəni mətəməki e noliən ekəu-ekəu mɨn . Tol lanəha , iəu u , rəham əhruahru Uhgɨn , iəu iəmələhu aupən ik , kəni ik ilɨs e ik mɨn nəuvein . Kəni iəmol=pən kalɨku e rəhm-kapə e nɨsiaiən , matol nɨkim tagiən tapirəkɨs ik mɨn nəuvein . ”
44012002	Violence	Təmahli=pən rəhan mɨn nətəmimi kəməhuvən motaskəlɨm Jemɨs pia Jon kəni motohamu e rəhalah nau asoli .
55002016	Recommendation	Mətəu əpəh nəghatiən mɨn u tol tanpən əmə iətəm kotərah məsotɨsiaiən Uhgɨn , mətəu-inu nətəmimi nətəm kəutəghati lanəha , nəmiəgəhiən rəhalah tatuvən matuvən əmə o noliən mɨn iətəm Uhgɨn təməki lan .
62003015	Sin	Iətəmimi u iətəm tətəməki e pian in təhmen e iətəm tətəhuamu iətəmi , kəni itəmah nəkotəhrun məmə iətəm tətəhuamu itəmi , in təsosiən nəmiəgəhiən itulɨn .
43021015	Faith	Nian ilah kɨnotauən rəkɨs , Iesu təmətapuəh o Saimon Pitə , məmə , “ Saimon Pitə , nətɨ Jon . ? Ik nəkolkeikei iəu tapirəkɨs nətəmi mɨn u ? ” Pitə təni=pən kəm in məmə , “ Əuəh , Iərmənɨg , ik nəkəhrun məmə iəu iəkolkeikei pɨk ik . ” Kəni Iesu təni=pən kəm in məmə , “ Intəh , ik onəkaugɨn rəhak nenətɨ sipsip mɨn . ”
46012008	Grace	Iətəmi kəti , Narmɨn tətəfən nəghatiən rəha neinatɨgiən kəm in . Kəni kəti mɨn , Narmɨn kətiəh əmə tətəfən nəghatiən rəha nəhruniən nati kəm in .
44007013	Description	Kəni uərisɨg , ilah kəməhuvən mɨn , kəni in təməni pətɨgəm in kəm lah , mətəu ilah kəsotəhruniən məmə in Josɨp pialah . Kəni kig rəha Ijɨp təmətəu nəniən o Josɨp mɨne pian mɨn .
60003010	Recommendation	Nauəuə Rəha Uhgɨn tətəni məmə , “ Iətəmimi iətəm tolkeikei nəmiəgəhiən təuvɨr , kəni molkeikei məmə otətəu təuvɨr nian rəfin , in otəkeikei məsəniən nəghatiən tərah mɨn , kəni in otəkeikei məsəniən neiuəiən .
44004032	Description	Nətəmi kəutəni nɨpəhriəniən e Iesu rəhalah nətəlɨgiən təmuva kətiəh . Kəti təməsəhluaigiən e rəhan nautə , mətəu kəmautəuəri nautə rəhalah kəm lah mɨn .
46015003	Grace	Inəni=pɨnə rəkɨs kəm təmah natimnati agɨn mɨn iətəm iəmətəu məmə , Krɨsto təmɨmɨs o rəhatah noliən tərah mɨn təhmen e Nauəuə Rəha Uhgɨn təməni rəkɨs mɨne ,
66018024	Violence	Taun asoli u Papilon in təmos nalpɨniən mətəu-inu kəmatiuvi nɨra iəni mɨn mɨne nətəmimi mɨn rəhan Uhgɨn ikɨn mɨn rəfin e nəhue nɨftəni . Nɨpəhriəniən , nɨra nətəmimi rəfin nətəm kəmohamu ilah , in tətatɨg e taun asoli u . ”
44013048	Faith	Nian Nanihluə mɨn kəmotətəu nəghatiən əha , nɨkilah təmagiən ohni , kəni mɨnəutəni-əni kəm lah mɨn məmə nəghatiən rəha Iərmənɨg Iesu in təuvɨr pɨk . Kəni nətəmi mɨn Uhgɨn təmɨtəpɨn rəkɨs e lah məmə okotos nəmiəgəhiən iətəm ko təsɨkəiən , ilah kəmotəni nɨpəhriəniən lan .
66022020	Description	Iətəmimi iətəm tətəni pətɨgəm natimnati mɨn u , təni məmə , “ Əuəh , otəsuvəhiən iəkuvnə . ” ! Əuəh ! Va-tə Iərmənɨg Iesu .
50004009	Recommendation	Otol nati nak iətəm iəməgətun itəmah lan , iətəm nəmotos e nəmiəgəhiən rəhatəmah , kəni otol mɨn nati nak iətəm iəu iəməni , kəni otol nati nak nəmoteh=pa lak . Nian nəkotol lanəha , kəni Uhgɨn iətəm tətəfɨnə nəməlinuiən kəm təmah , otətan itəmah min e nian mɨn rəfin .
53003015	Recommendation	Mətəu nəsoteruhiən ilah məmə rəhatəmah tɨkɨmɨr mɨn , mətəu ilah piatəmah mɨn , kəni təuvɨr məmə nəkotagət asoli e lah məmə okotair asoli e rəhalah nətəlɨgiən .
51002008	Recommendation	Otətəu vivi itəmah məmə nətəmimi kəsotaskəlɨmiən kəni məsotiuvi mɨniən itəmah e nəgətuniən eiuə mɨn rəhalah . Nəgətun eiuə mɨn əha tatɨtəu=pən nətəlɨgiən rəha nətəmimi əmə mɨne nəukətɨ lou mɨn iətəm tətəghati e natimnati rəha nɨftəni əmə . Nəghatiən mɨn əha tatsɨpən e nətəlɨgiən əuas mɨn rəha nətəmimi , mətəu kəsotsɨpəniən e Krɨsto .
50003014	Faith	kəni təhmen e suah kəti iətəm tətaiu məmə otaupən mos nətəouiən , kəni iəu iətaiu o nosiən nəua nalkutiən rəhak . Kəni nəua nalkutiən əha in nəmiəgəhiən vi e Krɨsto Iesu iətəm Uhgɨn təmauɨn lak məmə iəkos .
56002014	Faith	Iesu nɨkin təmagiən məmə otɨmɨs o tah , kəni mətəou nəmiəgəhiən rəhatah mos rəkɨs e nəsanəniən rəha noliən tərah mɨn rəfin , kəni mafəl vivi itah məmə kitah okəhuva rəhan mɨn nətəmimi nətəm kotolkeikei məmə kautol əmə nati iətəm təuvɨr .
43005024	Faith	“ Nɨpəhriəniən agɨn u iatəni kəm təmah məmə , iətəmimi iətəm tətətəu rəhak nəghatiən , kəni mətəhatətə e Uhgɨn iətəm təmahli=pa iəu iəkuva , in tɨnatos nəmiəgəhiən itulɨn . Ko in təsəhtuliən e nəhmtək məmə oiəkəni pətɨgəm nalpɨniən rəhan . In tɨnagɨm rəkɨs e nɨmɨsiən , kəni mɨnuva o nəmiəgəhiən .
66021015	Description	Agelo iətəm tətəghati kəm iəu , in tatos nati kəti kəmol e aiən u kol , o nosiən mak rəha taun əha , mɨne ket mɨn , mɨne nɨkalɨn rəhan .
50003019	Sin	Uhgɨn otərəkɨn ilah . Kautətəlɨg pɨk əmə e natimnati mɨn tərah u nɨkilah tolkeikei . Kəni natimnati mɨn əha , in uhgɨn rəhalah , kəni məutəfəri ilah o noliən natimnati iətəmi tol naulɨsiən , kəni motəfəri ilah o natimnati rəha nəhue nɨftəni .
54003006	Sin	Iətəmimi tətəhatətə vi əmə e Iesu , in təsəhmeniən məmə otos uək u , məta in tətəfəri pɨk in , kəni Uhgɨn tol nalpɨniən kəm in təhmen e inəha təmol e Setən u iəfəri pɨk .
65001003	Recommendation	Iəu mɨn nəuvein , aupən , iəmolkeikei pɨk məmə iəkətei nauəuə u tuvnə o təmah o nəghatiən e suaru iətəm Uhgɨn tatos o nosmiəgəhiən itah . Mətəu rəueiu , iətətəu məmə iəkəkeikei mətei nəghatiən u tuvnə o təmah məmə iəkol əskasɨk nɨkitəmah məmə onəkotəluagɨn əskasɨk o naskəlɨmiən nəghatiən pəhriən rəha nəhatətəiən rəhatah . Uhgɨn təmələhu=pən nəghatiən u e nəhlmɨ iəfaki mɨn e nian kətiəh əmə , kəni ko təsəuhliniən .
44004002	Description	Nɨkilah təmahmə pɨk mətəu-inu ilau kətuəgətun nətəmimi məmə Iesu təmɨmɨs kəni məmiəgəh mɨn . Kəni inu təmol suaru məmə nətəmi mɨn u kəmohmɨs , Uhgɨn otosmiəgəh mɨn ilah .
66018005	Sin	mətəu-inko in təmətoriarun rəhan noliən tərah təri iuəkɨr əmə tek neai , mol Uhgɨn təsaluiən e rəhan noliən tərah mɨn .
43004046	Description	Kəni Iesu təmɨtəlɨg=pən mɨn e lahuənu Kenə , əpəha Kaləli . Ikɨn əha aupən , in təmol nəhu tuva mol wain . Kəni e Kapeniəm iuəkɨr əmə , iətəmi asoli kəti rəha kig tətatɨg ikɨn . Kəni nətɨn kəti tatɨmɨs .
45012011	Recommendation	Otəkeikei nian rəfin o noliən uək rəha Uhgɨn e nɨkitəmah rəfin təhmen e nɨgəm tatuəu , kəni məsotəpəouiən .
60001008	Faith	Nati əpnapɨn nəməsoteruh pauiən Iesu Krɨsto , mətəu nautolkeikei in . Kəni nati əpnapɨn nəsotehiən u rəueiu , mətəu nəutəhatətə lan . Kəni nɨkitəmah təməri məriauəh e nagiəniən iətəm in təuvɨr pɨk agɨn tapirəkɨs , kəni ko iətəmi kəti təruru nəni ərəfiniən nəuvɨriən rəha nagiəniən əha .
62004013	Grace	Kitah kotəhrun məmə kitah kotatɨg lan , kəni in tətatɨg e tah , mətəu-inu tɨnəfa rəkɨs rəhan Narmɨn kəm tah .
43019029	Description	Kəni nosɨnati əkəku kəti əha ikɨn tətəharəg , kəmiuvi=pən wain lanu tarfu , məni lan nəhmtɨn teiuaiu . Kəni ilah kəmotələs nati kəti talus-alus təhmen e kotɨn , kəni motəfən e wain u , kəni motətu=pən e nəhlmɨ nɨgi kəti kətəni məmə hisop , kəni motləfəri tuvən iuəkɨr o nohlɨ Iesu , məmə otəmnɨm .
51001013	Grace	Kəni Uhgɨn təmol lanəha nian in təmos rəkɨs itah e narmənɨgiən rəha napinəpuiən , mɨnol itah kɨnəhuva e narmənɨgiən rəha Nətɨn iətəm in tolkeikei pɨk .
45016017	Recommendation	Piak mɨn mɨne nəuvɨnɨk mɨn . Iəkətapuəh əskasɨk o təmah məmə nəkotətəu vivi itəmah o nətəmi kautol məmə nəkotəhapu itəmah mɨn , kəni kautəgətun natimnati iətəm kautol nətəmimi kəutəmkarəpən e nəhatətəiən rəhalah , kəni nəgətuniən əha tol pɨsɨn agɨn e nəgətuniən iətəm nəmotos rəkɨs . Otəhtul isəu o lah ,
45012007	Recommendation	Nəmə iətəmi kəti tatos nəsanəniən o nasiruiən , pəh in tasiru ; nəmə in tatos nəsanəniən o nəgətuniən , pəh in təgətun ;
43016023	Faith	O nian əha , itəmah onəsotətapuəh mɨniən o nati kəti ohniəu . Nɨpəhriəniən agɨn u iətəni kəm təmah məmə , nəmə itəmah nəkotətapuəh e nati kəti o Tatə Uhgɨn e nərgək , kəni in otəfɨnə kəm təmah .
66021019	Description	Kəpiel mɨn iətəm kəmuvləkɨn nəukətɨ nɨkalɨn lan , kəmol malə-malə e lah e kəpiel təuvɨr mɨn . Kəmotaupən motəlɨn=pən kəpiel təuvɨr mɨn u jaspə ; kəni nəmpə tu lan , kəmotəlɨn=pən kəpiel təuvɨr mɨn u safaia ; kəni nəmpə tri lan , kəmotəlɨn=pən kəpiel təuvɨr mɨn u akat ; kəni nəmpə fo lan , kəmotəlɨn=pən kəpiel təuvɨr mɨn u emɨrəl .
59004017	Sin	Tol lanəha , in təfagə tərah kəti nəmə iətəmimi təhrun nati kəti təuvɨr iətəm təkeikei mol , mətəu təsoliən .
66019005	Faith	Kəni əmeiko , nəuian kəti təmsɨ=pən əpəha e jeə rəha kig , mətəni məmə , “ ! Otəni-vivi Uhgɨn rəhatah ! ! Itəmah rəhan noluək mɨn rəfin , otəni-vivi in ! ! Itəmah u , nəutɨsiai , mautəgɨn e Uhgɨn , otəni-vivi in ! ! Nati əpnapɨn nəmə itəmah nautos nepətiən asoli mɨn , o nətəmi əpnapɨn əmə , mətəu otəni-vivi Uhgɨn ! ”
47005002	Faith	Mətəu rəueiu e nɨpətɨtah rəha nəhue nɨftəni , kautəhgi nɨkitah , kəni kotolkeikei pɨk məmə nian otuva iətəm kitah okotos nɨpətɨtah vi o negəu e neai , təhmen mə kautəhuvən e napən vi .
48006004	Recommendation	Mətəu itəmah onəkotəkeikei moteruh vivi-to natimnati iətəm nautol . Tol lanəha məmə , ko nəsakil aruiən rəham uək mɨne uək rəha iətəmimi kəti mɨn . Mətəu nateruh vivi əmə rəham uək . Mətəu-inu , nətəmimi rəhalah uək mɨn tol pɨsɨn pɨsɨn . Kəni ilah kautos katipə fɨgəm pɨsɨn pɨsɨn mɨn e nəmiəgəhiən rəhalah kətiəh kətiəh . Mətəu təuvɨr məmə nɨkim otagiən o rəham uək , nəmə rəham uək təuvɨr əmə .
46007036	Recommendation	Mətəu e nɨkalɨn rəha iərman vi kəti mɨne pətan vi kəti . Nəmə tol lanu lan məmə , kɨnəniəkɨs məmə ilau okuol marɨt . Uərisɨg , kəni iərman təni məmə okuəpəh pɨpɨm . Mətəu rəueiu , nɨkin təhti məmə təsoliən noliən əhruahru e pətan əha , kəni iərman nɨkin təhti məmə təkeikei mol-tə marɨt e pətan əha , kəni təuvɨr məmə , in təhrun noliən . In təsoliən təfagə tərah , mətəu təuvɨr məmə in otol marɨt .
43016002	Violence	Ilah okəpanotəhgi pətɨgəm itəmah e nimə mɨn rəha nuhapumɨniən rəhalah ; kəni nɨpəhriəniən agɨn , nian əha ikɨn tətuva iətəm nətəmimi okotohamu itəmah , kəni nɨkilah təhti məmə ilah kautol uək təuvɨr kəti rəha Uhgɨn .
66015001	Description	Iəməsal=pən əpəha e negəu e neai mafu mɨn nəmtətiən kəti mɨn iətəm tuhapɨspɨs ohniəu . Nagelo ilah səpɨn kautos naunu nalpɨniən mɨn , ilah səpɨn . Nalpɨniən mɨn əha , ilah kautol niəməha apiəpiə rəha Uhgɨn tol naunun lan .
