44022004	Violence	“ Aupən iəmatɨtəu məmə iəkol nərahiən kəm nətəmimi nətəm kautohtəu=pən Suaru Rəha Iesu . Kəni mətaskəlɨm ilah , nəman mɨne nɨpətan , mətəmki=pən ilah e kaləpus kəni mol nəuvein kohmɨs .
43007043	Description	Tol lanəha , kəni nɨmənin nətəmimi mɨn u , kəmotuəri ilah mɨn o Iesu .
60005002	Recommendation	Inu rəhak nəghatiən kəm təmah məmə , otol uək rəha neh viviən nətəmimi rəha Uhgɨn nətəm kəutatɨg e nəhlmɨtəmah , təhmen e iətəmi rəha sipsip iətəm tateh vivi rəhan sipsip mɨn . Kəni otol e nɨkin agiən mətəu-inu nəkotolkeikei məmə nəkotol . Inu nətəlɨgiən iətəm Uhgɨn tolkeikei . Mətəu təsəuvɨriən məmə nəkotol nɨkitəmah təsagiəniən məmə nəkotol . Kəni sotoliən mətəu-inu nɨkitəmah təhti məmə onəkotos pɨk məni lan . Mətəu otol əmə mətəu-inu nɨkitəmah tətagiən məmə onəkotasiru .
46015056	Sin	Rəueiu , təfagə tərah in təhmen e nati kəti tatus iətəmi kəni mətuva in nɨmɨsiən , kəni Lou tatol təfagə tərah nəsanəniən rəhan tatepət .
59005004	Sin	! Otətəlɨg-to e nati u ! Rəhatəmah noluək mɨn kəmotəulək e rəhatəmah nasumiən mɨn , mətəu nəməsotətəouiən e məni nəuvetɨn rəhalah . Kəni nətəouiən iətəm nəməsotəfəniən kəm lah , kəutəni pətɨgəm rəhatəmah noliən tərah mɨn . Iərmənɨg Əsanən Pɨk Agɨn , tɨnatətəu nasəkiən rəha noluək mɨn rəhatəmah .
60002001	Recommendation	Mətəu-inu o nəghatiən mɨn əha , otəraki e noliən mɨn u kohiet rəkɨs e rəhatəmah nəmiəgəhiən : noliən rəfin rəha nəməkiən e nətəmimi kəni matol nərahiən kəm lah ; noliən rəfin rəha neiuəiən ; noliən rəha nətəm kəutəni pɨk nati , mətəu kəsotoliən ; noliən rəha netetiən ; noliən rəfin rəha nəni rahiən nətəmimi .
46007039	Recommendation	Pətan otəkeikei mətatɨg ilau rəhan iərman e nian rəfin , mətəu nəmə rəhan iərman tɨmɨs , in təhrun noliən marɨt e suah kəti mɨn iətəm in tolkeikei , mətəu nati kətiəh əmə , in təkeikei mol marɨt e iərman kəti iətəm tətəfaki kəm Uhgɨn .
55002018	Sin	iətəm kɨnəmkarəpən rəkɨs e suaru rəha nɨpəhriəniən . Katuəni məmə Uhgɨn təmol itah kotəmiəgəh mɨn rəkɨs e nɨmɨsiən , kəni ko Uhgɨn təsəfa mɨniən nɨpətɨtah vi nian Iesu tuva mɨn . Kəni suah mil u kətuərəkɨn nəhatətəiən rəha nətəmimi nəuvein .
48005006	Faith	Nian kitah kəhuva motəhkul=pən e Iesu Krɨsto , nati əpnapɨn nəmə iətəmimi kəməhgi=pən uə kəsəhgi-pəniən , mətəu nati asoli konu , in rəhatah əmə nəhatətəiən e Iesu Krɨsto . Nəhatətəiən əha , in tol itah kotolkeikei Uhgɨn , motatɨg mautol mɨn nolkeikeiən kəm nətəmimi mɨn .
58005009	Grace	kəni təmuva iətəmi təhmen agɨn rəha noliən uək rəha pris asoli agɨn rəhatah . Kəni in təmol suaru o nosmiəgəhiən itulɨn rəhan nətəmimi mɨn u kautol nəuian , matos vivi ilah , matuvən matuvən naunun tɨkə .
46016001	Recommendation	Rəueiu iəkəni məni o nasiruiən e nəfaki mɨn əpəha Jerusɨləm . Otol təhmen əmə məmə iəməni mɨne kəm niməfaki mɨn əpəha profens əha Kəlesiə .
49005022	Recommendation	Itəmah nɨpətan nətəm nɨnotol rəkɨs marɨt , otətəlɨg kəni motol nəghatiən rəha nəman mɨn rəhatəmah təhmen məmə nautol kəm Iərmənɨg .
43008012	Faith	Kəni Iesu təmətəghati mɨn kəm lah , mətəni məmə , “ Iəu u , iəu Nəhagəhagiən rəha nətəmimi u e nəhue nɨftəni . Iətəmimi iətəm tətɨtəu=pa iəu , ko in təsaliuəkiən e napinəpuiən nian kəti mɨne , mətəu in otos nəhagəhagiən e nəmiəgəhiən rəhan . ”
65001017	Recommendation	Mətəu rəhak mɨn nətəmimi , nɨkitəmah tətəhti nati nak aposɨl mɨn rəha rəhatah Iərmənɨg Iesu Krɨsto kəmotəni aupən , məmə otuva .
44017025	Grace	Nati kəti təsɨkəiən ohni u kitah nətəmimi kotəhrun noliən məmə kotəfən kəm in . Mətəu in pɨsɨn əmə tətəfa nəmiəgəhiən kəm tah kətiəh kətiəh , mətəfa natimnati mɨn rəfin kəm tah .
62005009	Faith	Nian mɨn , kitah kautətəu nəghatiən mɨn iətəm nətəmimi kəutəni pətɨgəm , məutəhatətə e lah . Mətəu nian Uhgɨn tətəni pətɨgəm nati kəti , in iahgin tapirəkɨs , kəni kitah okotəhrun nəhatətə təhmɨn mɨn e rəhan nəghatiən , mətəu-inu in Uhgɨn , kəni in tətəhtul pətɨgəm o Nətɨn .
45013014	Faith	Mətəu otegəhan əmə məmə Iərmənɨg Iesu otarmənɨg e nəmiəgəhiən rəhatəmah , kəni sotətəlɨgiən e suaru mɨn o noliən təfagə tərah mɨn iətəm nətəlɨgiən tərah rəhatəmah tolkeikei .
58011030	Description	Nəuanɨləuɨs mɨn rəha Isrel kəmotəhatətə əskasɨk e Uhgɨn , kəni tol lanəha , ilah kotaliuək mohtəlau e nɨpai asoli e Jeriko . Nɨpai asoli u , kəmol e kəpiel . Ilah kəmautohtəlau , mautohtəlau e nɨpai asoli əha , motətəuarus nian səpɨn , kəni əmeiko nɨpai asoli u , tɨtəgɨt mɨmərɨs-mərɨs .
44019011	Grace	Kəni Uhgɨn təməfən nəsanəniən kəm Pol məmə otol nati apɨspɨs mɨn iətəm tol pɨsɨn agɨn .
43008034	Sin	Kəni Iesu təni=pən kəm lah məmə , “ Nɨpəhriəniən agɨn u iətəni=pɨnə kəm təmah , nətəmimi nətəm kautol noliən tərah , kəni noliən tərah u , in tətarmənɨg e lah , kəni mətaskəlɨm matol ilah kəutəhuva rəhan mɨn slef .
62004011	Faith	Piak mɨn , Uhgɨn təmolkeikei pɨk itah lanu , kəni tol lanu lan , kitah mɨn okotəkeikei motol mɨn nolkeikeiən əha kəm tah mɨn .
44002028	Grace	Ik nəməgətun rəkɨs suaru rəha nəmiəgəhiən kəm iəu , kəni ik onəkol iəu nɨkik tətagiən pɨk nian iətatɨg kilau mɨn ik . ’ Inu nəghatiən Tefɨt təməni e Iesu aupən .
54004013	Recommendation	Ol natimnati mɨn əha , kəni nati kɨsɨl mɨn əha ikɨn . Onəkəkeikei mol vivi ilahal mətəuarus iəkuvnə : afin Nauəuə Rəha Uhgɨn kəm nətəmimi , kəni məni pətɨgəm Nauəuə Rəha Uhgɨn , kəni məgətun Nauəuə Rəha Uhgɨn .
47004008	Description	Nərahiən tepət kəutələs pɨkɨn itɨmah e suaru mɨn rəfin , mətəu təsərəkɨniən itɨmah . Nian nəuvein iəkotəruru suaru , mətəu iəsotəpəhiən nalkutiən .
44002013	Description	Mətəu nəuvein kəmotaləh əuvsan e lah , məutəni məmə , “ Nati kəutapɨs əpəha . ”
66021018	Description	Nɨkalɨn u , kəmol e kəpiel təuvɨr u jaspə , kəni kəmol taun e aiən u kol , in əmə in əmə . Kəni kol u in təuvɨr , in təhlan məmə kɨlas .
66015006	Description	Nagelo mɨn ilah səpɨn kəmohiet e Ikɨn Uhgɨn Tətatɨg Ikɨn , kautos nalpɨniən mɨn ilah səpɨn . Ilah kautəhuvən e napən təuvɨr u , linən , iətəm tatɨpɨtɨpɨt , kəni kəməlis nɨmankɨlahalah e kətəuti iətəm kəmol e aiən u kol tətoraip-oraip .
45012014	Recommendation	Otətapuəh o Uhgɨn məmə otol nəuvɨriən kəm nətəm kautol nərahiən kəm təmah . Sotəuiakəniən e lah , mətəu otətapuəh o Uhgɨn məmə otol nəuvɨriən kəm lah .
66001015	Description	Nəhlkɨn təhmen e prons , iətəm kəmuvan e nɨgəm məmə otaiəh rəkɨs e namrəiən , mafəl iətəm təuvɨr , kəni uərisɨg ko , kərəpei məmə otəuvɨr mətoraip-oraip . Kəni nəuian iahgin təhmen e nɨtəhi asoli kəti tatɨtəgɨt e nɨmas ;
43017026	Grace	Iəu iəmol əpu ik kəm lah , məmə ilah okotəhrun vivi ik , konu iəu , oiəkəkeikei matol əpu ik lanəha , məmə nolkeikeiən rəham otɨnpi vivi nɨkilah , kəni məmə iəu aru oiəkatɨg e nɨkilah . Nolkeikeiən u iətəghati lan , in nolkeikeiən rəham , təhmen məmə inu ik nəkolkeikei iəu lan . ”
45008032	Grace	In təməsəgɨniən o Nətɨn əhruahru məmə otɨmɨs o tah rəfin , mətəu in təmegəhan əmə lan . Kəni nəmə in təməfa Nətɨn kəm tah , kəni nati əkəku əmə məmə in otean itah e natimnati mɨn rəfin .
65001018	Sin	Kəmotəni kəm təmah məmə , “ E nian iətəm naunun nian tətuva iuəkɨr , nətəmimi nətəm kəutəghati əuvsan məutəni rah natimnati rəfin , ilah okotohtəu=pən aru əmə rəhalah nətəlɨgiən tərah e nɨkilah iətəm ilah aru kotolkeikei məmə okotol . ”
45011018	Recommendation	Mətəu itəmah Nanihluə mɨn , nəsotəghati əuvsaniən məmə Uhgɨn təmɨlpɨn itəmah e nɨgi iətəm təmatgəhli rəkɨs ikɨn , u təhmen e nətəm Isrel nəuvein . Sotaluiən məmə nəukətɨ nɨgi tətaugɨn itəmah , mətəu səniəmə itəmah nəhlmɨ nɨgi nəutaugɨn nəukətɨ nɨgi .
47001024	Faith	Iəsotolkeikeiən məmə iəkotarmənɨg e nəhatətəiən rəhatəmah , kəpə . Mətəu iautol uək kitah min itəmah o nagiəniən rəhatəmah , mətəu-inu itəmah nɨnautəhtul əskasɨk rəkɨs e nəhatətəiən rəhatəmah .
43011001	Description	Iətəm Petəni kəti , nərgɨn u Lasɨrɨs , tatɨmɨs . Petəni , in lahuənu kəti , ima Meri mɨne pian Matə .
52004008	Sin	Tol lanəha , iətəm tətəuhlin nəmtahn e nəghatiən əha , səniəmə tətəuhlin nəmtahn kəm iətəmimi , mətəu tatəuhlin nəmtahn kəm Uhgɨn iətəm təməfa Narmɨn Rəhan kəm təmah .
62004002	Faith	Tol lanəha , itəmah onəkotəhrun vivi məmə in Narmɨn Rəha Uhgɨn iətəm tətatɨg e iətəmimi kəti , inu , Narmɨn iətəm tətəni pətɨgəm məmə Iesu in Krɨsto iətəm Uhgɨn təməni məmə otahli=pa , kəni in təmuva e nɨpətɨn , narmɨn əha in Narmɨn əhruahru rəha Uhgɨn .
65001008	Sin	Nati əpnapɨn nətəmimi mɨn əha kotəhrun natimnati mɨn əha , mətəu e noliən kətiəh əmə , ilah kəutəni məmə kəmoteruh nati kəti təhmen e nəməhlairiən iətəm təmegəhan e noliən tərah mɨn rəhalah , kəni tol lanəha kotəni məmə təuvɨr əmə məmə kautol noliən tərah e nɨpətɨlah mautəhuvən əmə lanəha , kəni kəutəpəh narmənɨgiən mɨn rəfin , kəni kəutəni rah nagelo mɨn u ilah ilɨs pɨk .
60003011	Recommendation	In otəkeikei məuhlin in , miet rəkɨs e noliən tərah mɨn , kəni mol əmə natimnati mɨn iətəm kotəuvɨr . In otəkeikei malkut pɨk məmə otatɨg ilah nətəmimi rəfin e nəməlinuiən .
51001023	Faith	Natimnati mɨn u tol lanəha nəmə itəmah nəutəhtul əskasɨk e rəhatəmah nəhatətəiən e Iesu . Nəmotətəu nanusiən təuvɨr iətəm tətəgətun natimnati iətəm Uhgɨn otol kəm təmah əpəha e negəu e neai , kəni rəhatəmah nətəlɨgiən otəkeikei matəhtul əskasɨk e natimnati mɨn əha . Nanusiən təuvɨr u , iətəm nəmautətəu rəkɨs , kəmətanus pətɨgəm ikɨn mɨn e nɨtəni mɨn , kəni iəu Pol , Uhgɨn təmauɨn lak məmə iətəni pətɨgəm nanusiən təuvɨr əha .
43008059	Violence	Kəni əmeiko , ilah kəmotəmki kəpiel apɨn , motəni məmə okotəhti Iesu lan ; mətəu Iesu təməhluaig , kəni miet e Nimə Rəha Uhgɨn matuvən .
49004024	Recommendation	Kəni itəmah onəkotəkeikei məhuva nətəmimi vi mɨn e noliən mɨn mɨne nətəlɨgiən mɨn rəhatəmah , iətəm Uhgɨn təmol məmə okotəhmen lan , inu noliən mɨn iətəm nɨkin tətagiən lan , mɨne noliən mɨn əhruahru pəhriən .
66014012	Faith	Nəghatiən u , nɨpətɨn u məmə nətəmimi rəha Uhgɨn nətəm kəutohtəu=pən nəuia Uhgɨn , kəni məutəhatətə e Iesu , ilah kotəkeikei motəhtul əskasɨk .
44013030	Description	Mətəu Uhgɨn təmol in təmiəgəh mɨn e nɨmɨsiən .
43010011	Description	“ Iəu u , Iətəmimi rəha Nəsal Viviən Sipsip Mɨn . Iətəmi təuvɨr u , iətəm tətəsal vivi o sipsip mɨn , in nɨkin tagiən əmə məmə otəfən nəmiəgəhiən rəhan o sipsip mɨn .
49003002	Grace	Itəmah nəkotəhrun rəkɨs məmə Uhgɨn təməfa uək asoli u kəm iəu məmə iəkəni pətɨgəm nəuvɨriən rəhan kəm təmah .
56003010	Recommendation	Nəmə iətəmi kəti tatol nətəmimi kəutəuəri ilah mɨn o nəghatiən tol mɨn lanəha , onəkuvən məghati əskasɨk kəm in kəni məniəhu . Mətəu nəmə tatol mɨn , kəni nəkuvən mɨn məniəhu mɨn . Nəmə nəməniəhu pau mau keiu , mətəu in tatəkeikei e rəhan noliən , kəni otəhtul=pən isəu ohni motəpəh .
43010019	Description	Kəni nətəm Isrel u , ilah kəmotəhapu mɨn ilah mɨn .
43003033	Faith	Iətəmimi iətəm təmos rəhan nəghatiən kəni mətəhatətə lan , in tətəhtul pətɨgəm məmə nəghatiən iətəm Uhgɨn təməni , in nɨpəhriəniən .
61003014	Recommendation	Tol lanəha , iəu mɨn nəuvein . Kəni mətəu-inu nəkəutəhtahnin nian əha iətəm tətuva , otalkut əskasɨk o nati milahal u məmə , aupən Uhgɨn otəsehiən napɨniən kəti e nəmiəgəhiən rəhatəmah , kəni uərisɨg məmə təfagə tərah kəti tɨkə lan , kəni naunun nəkotatɨg e nəməlinuiən itəmah min .
53003001	Faith	Piak mɨn mɨne nəuvɨnɨk mɨn . Inu naunun nəghatiən . Otəfaki o tɨmahal məmə nəghatiən rəha Iərmənɨg otuvən uəhai əmə ikɨn mɨn rəfin , kəni nətəmimi okotɨsiai motohtəu=pən , təhmen əmə e təmah nətəm nəmotɨsiai in məutohtəu=pən .
47004014	Faith	mətəu-inu itɨmah iəkotəhrun məmə , iətəmi təmol Iərmənɨg Iesu təmiəgəh mɨn e nɨmɨsiən , in otol itɨmah min itəmah , kitah rəfin kotəmiəgəh mɨn e nɨmɨsiən kitah Iesu , kəni məfu pətɨgəm itah e nəhmtɨn .
59005014	Recommendation	Nəmə iətəmi kəti tatɨmɨs , təuvɨr məmə otauɨn e eldə mɨn rəha niməfaki məmə okəhuva motəfaki lan , kəni motol=pən oiel e nərgɨ Iərmənɨg .
44007023	Description	“ Nian tɨnos nu fote , nɨkin təhti məmə otuvən-to meruh-to nətəmiman mɨn , nətəm Isrel ,
44023027	Violence	Suah u , nətəm Isrel kɨnotaskəlɨm rəkɨs , kəni iuəkɨr kotohamu . Mətəu iəmətəu məmə in iətəm Rom , kəni iəkuvən itɨmah rəhak soldiə mɨn motələs rəkɨs o lah .
44019029	Description	Kəni nətəmimi rəfin e taun kɨnotapɨs e nalməliən . Kəni nətəmimi tepət kəməhuva kətiəh məhuvən motaskəlɨm iətəm Masetoniə mil əha iətəm kətualiuək ilahal Pol , nərgɨlau u Kaeəs mɨne Aristakəs . Kəni kəməhuvən pəti motiuvi=pən ilau əpəha ikɨn nian rəfin kəutuhapumɨn asoli ikɨn .
44003014	Sin	Itəmah nəmotəpəh Iesu u in iol əhruahru mɨne iətəm təuvɨr e nəhmtɨ Uhgɨn , kəni nəmotətapuəh o Pailət məmə otəhlman e suah kəha iohamu itəmi .
44015009	Faith	In təməsol pɨsɨniən əmə kəm lah . ! Kəpə ! In təmafəl rəkɨs rəhalah noliən tərah mɨn mətəu-inu kəutəni nɨpəhriəniən lan təhmen=pən əmə mə inu tɨnol rəkɨs kəm tah .
46011028	Recommendation	Iətəmimi otəkeikei maupən makil rəhan nəmiəgəhiən , uərisɨg təpanun pɨret mɨne məmnɨm kap wain ,
46015058	Faith	Tol lanəha , piak mɨn mɨne nəuvɨnɨk mɨn , otəhtul əskasɨk . Sotegəhaniən məmə nati kəti təlauəl e təmah . Nian rəfin , otol uək rəha Iərmənɨg e nɨkitəmah rəfin , mətəu-inu nəkotəhrun məmə uək rəha Iərmənɨg iətəm nautol , səniəmə nati əpnapɨn əmə mətəu in nati agɨn .
46004016	Recommendation	Tol lanəha , iəkətapuəh əskasɨk o təmah məmə onəkotohtəu=pa rəhak noliən mɨn .
46001021	Faith	Tol lanəha mətəu-inu , e neinatɨgiən rəha Uhgɨn , təmol məmə nətəmimi rəha nəhue nɨftəni okəsotəhruniən in e nəhruniən əmə rəhalah iətəm kautəni məmə neinatɨgiən . Mətəu in təmol məmə nəghatiən alməli mɨn rəhatɨmah otosmiəgəh nətəmimi nətəm kəutəni nɨpəhriəniən lan .
60003001	Recommendation	Kəni e noliən əhmen əmə rəha nɨsiaiən Iərmənɨg , itəmah nɨpətan nəkotəkeikei motol nəuia rəhatəmah mɨn nəman mətəu-inu o nati u . Nəmə ilah kəsotəhatətəiən e nəghatiən rəha Uhgɨn , kəni rəhatəmah noliən təuvɨr mɨn əmə okotiuvi=pən rəhalah nətəlɨgiən o Uhgɨn . Noliən təuvɨr mɨn rəhatəmah kotəhmen , motapirəkɨs nəmə nəutəghati kəm lah .
47005020	Recommendation	Tol lanəha , itɨmah iəni əhruin mɨn rəha Krɨsto , kəni təhmen məmə Uhgɨn tətauɨn e nətəmimi e nəuiatɨmah . Kəni iəutətapuəh əskasɨk o təmah e nərgɨ Krɨsto məmə nəkotəpəh noliən tɨkɨmɨr , kəni məhuva niəli mɨn rəha Uhgɨn .
44002024	Description	“ Mətəu Uhgɨn təmɨtɨs Iesu e nahməiən rəha nɨmɨsiən , kəni mol in təmiəgəh mɨn e nɨmɨsiən , mətəu-inu nɨmɨsiən , rəhan nəsanəniən tɨkə o naskəlɨmiən in .
59002007	Sin	Kəni nətəmimi mɨn u kəutəghati rah e nərgɨn u ilɨs , nərgɨ Iesu iətəm rəhan u itəmah .
54003003	Description	səniəmə iətəmimi kəti rəha napɨsiən uə nəhtiən itəmi ; mətəu in iətəmi mətɨg ; səniəmə in iətəmi rəhan nəghatiən tɨtatɨperəh pɨk təhmen e kaluəluə ; nɨkin təsuvən pɨkiən e məni ;
43004014	Grace	Mətəu iətəmimi iətəm otəmnɨm nəhu iətəm iəu iəkəfən kəm in , ko təsəuauə mɨniən nian kəti mɨne . Nəhu iətəm iəu oiəkəfən kəm in , in təhmen e nəhmtɨ nəhu kəti iətəm tətapuəl-apuəl mətaiu əpəha imə e nɨkin nian rəfin , mətəfən nəmiəgəhiən itulɨn kəm in , iətəm otəsoliən naunun . ”
62002005	Faith	Mətəu iətəmi u tatol rəhan nəghatiən , nolkeikeiən rəha Uhgɨn təmatɨg mɨnpi vivi pəhriən e nɨkin . Iətəmi u tətəni məmə tətəhtul=pən lan , otəkeikei mɨtəu suaru kətiəh əmə iətəm Iesu təmɨtəu . Noliən u tətəgətun əsas məmə kitah kautatɨg lan .
66016013	Description	Kəni əmeiko , iəkəfu mɨn narmɨn tərah kɨsɨl kɨhləhmen e fɨrok . Kəti təmiet e nɨpəgnəua ialkitə , kəti tiet e nɨpəgnəua nati miəgəh rəhn-kapə lah səpɨn , kəni kəti tiet e nɨpəgnəua iəni eiuə .
59002008	Recommendation	Lou rəha Kig iətəm tətatɨg e Nauəuə Rəha Uhgɨn tətəni məmə , “ Olkeikei ik kəti təhmen əmə məmə nəkolkeikei aru ik . ” Nəmə nəutətəu=pən pəhriən nəghatiən u , nautol noliən əhruahru .
47004005	Faith	Itɨmah iəsotəni pətɨgəm aruiən itɨmah , mətəu iəutəni pətɨgəm Iesu Krɨsto məmə in Iərmənɨg , kəni itɨmah noluək mɨn rəhatəmah o nərgɨ Iesu .
46015033	Recommendation	Sotoliən nətəmimi koteiuə e təmah . Inu nɨpəhriəniən iətəm iətəmi kəti təməni , “ Nian nətəmimi rəhalah noliən təuvɨr kəutan ilah nətəm kotərah , nətəm kotərah kəutərəkɨn noliən təuvɨr rəhalah . ”
58013020	Grace	Iətəfaki mɨn o təmah mɨn məmə , Uhgɨn otasiru e təmah . Uhgɨn u , in nəukətɨ nəməlinuiən . Kəni in təmol rəhatah Iərmənɨg Iesu təmiəgəh mɨn e nɨmɨsiən , mətəu-inu nɨran təmaiu o noliən nəniəskasɨkiən itulɨn in tətatɨg mətəmiəgəh . Iesu əha , in iətəmi təuvɨr mapirəkɨs o neh viviən sipsip mɨn rəhan . Iətəfaki məmə Uhgɨn u ,
50001027	Recommendation	Kəni nati asoli , itəmah onəkotəkeikei motol məmə noliən mɨn rəfin e nəmiəgəhiən rəhatəmah okotəfən nɨsiaiən kəm nanusiən təuvɨr rəha Iesu Krɨsto . Kəni nati əpnapɨn nəmə iəkuvnə uə iəsuvnəiən , pəh oiəkətəu məmə nəutalkut əskasɨk e nətəlɨgiən kətiəh əmə , kəni məmə itəmah rəfin , itəmah nəutalkut e nətəlɨgiən kətiəh əmə o nəhtul əskasɨkiən o nanusiən təuvɨr ,
46006014	Grace	Kitah okohmɨs . Mətəu o nian kəti e rəhan nəsanəniən , Uhgɨn otosmiəgəh mɨn itah e nɨmɨsiən mol vivi nɨpətɨtah . Kəni inu təhmen əhmen əmə məmə nian Iərmənɨg təmɨmɨs , Uhgɨn təmosmiəgəh in e nɨmɨsiən mol vivi nɨpətɨn .
55001006	Recommendation	Kəni tol lanəha , iətəni mɨn kəm ik məmə onəkelel nɨgəm rəha nəsanəniən iətəm Uhgɨn təməfɨnə o noliən rəhan uək . Uhgɨn təməfɨnə nəsanəniən əha nian iəmələhu=pən nəhlmək mətəfaki=pɨnə lam .
60004006	Grace	Tol lanəha , nətəmimi mɨn u nətəm kəmohmɨs rəkɨs , ilah kəmotətəu nanusiən təuvɨr məmə nati əpnapɨn kəmohmɨs təhmen e nətəmimi rəfin , mətəu Uhgɨn təhrun noliən ilah okotəmiəgəh mɨn e narmɨn , təhmen lan .
46007023	Recommendation	Uhgɨn təmətəou rəkɨs itəmah e nətəouiən iətəm nəhmtɨn tiəkɨs . Sotoliən məmə itəmah nəkəhuva slef mɨn rəha nətəmimi .
46010010	Recommendation	Tərah məmə nəkotəni nɨkalɨ Uhgɨn təhmen e lah nəuvein kəmautol aupən , kəni agelo rəha nɨmɨsiən tohamu ilah .
47002017	Faith	Mətəu itɨmah iəsotəhmeniən e nətəmi tepət mɨn , nətəm kəutəni pətɨgəm nəghatiən rəha Uhgɨn o nos əməiən məni . Kəpə , mətəu Uhgɨn təmahli=pən itɨmah , kəni e Krɨsto , itɨmah iəutəni pətɨgəm nanusiən təuvɨr e nəhmtɨ Uhgɨn , kəni nəghatiən rəhatɨmah təmsɨpən e nɨkitɨmah iətəm təhruahru əmə .
45015001	Recommendation	Kitah nəuvein , nəhatətəiən rəhatah təskasɨk , kəni kitah kotəhrun məmə nati əlkələh mɨn əha , ilah nati əpnapɨn əmə . Mətəu kitah kəsotəkeikeiən o noliən natimnati mɨn əha iətəm nɨkitah əmə tətagiən lan . Nɨkitah təkeikei məhti piatah mɨn mɨne nəuvɨnɨtah mɨn nətəm rəhalah nətəlɨgiən keiu e natimnati mɨn əha .
50002024	Faith	kəni iətəhatətə e Iərmənɨg məmə otəsuvəhiən iəu mɨn iəkuvnə meh itəmah .
66007001	Description	Kəni əmeiko iəkafu agelo kuvət kəutəhtul=pən e kaugə ilah kuvət e nəhue nɨftəni . Kəmotəmkərain rəfin nɨmətagi kuvət e kaugə kuvət rəha nəhue nɨftəni , məmə nɨmətagi otɨkə e nəhue nɨftəni , mɨne nɨtəhi , mɨne nɨgi mɨn .
60004003	Sin	Nəmotərəkɨn rəkɨs nian tepət o nɨtəu-pəniən noliən mɨn rəha nətəmimi mɨn u kəsotəniən nɨpəhriəniən e Uhgɨn . Aupən , itəmah nəmautit əpnapɨn nɨpətan ; kəni nətəlɨgiən rəhatəmah təmatuvən o natimnati tərah mɨn ; kəni nəməutapɨs ; kəni nəmautol lafet rəha nɨtəuiən nɨpətan ; kəni nəməutəmnɨm alikol məutapɨs məutalməli ; kəni nəməutəfaki kəm narmɨ nati mɨn iətəm in noliən tərah agɨn .
66011005	Violence	Nəmə iətəmi tətalkut o nərəkɨniən ilau , kəni nəmnamɨ nɨgəm otɨsɨ=pən e nohlɨlau , kəni mus rəhalau tɨkɨmɨr mɨn . Iətəmimi iətəm tolkeikei nərəkɨniən ilau , in otəkeikei mɨmɨs lanəha .
44023005	Recommendation	Kəni Pol təni məmə , “ Piak mɨn . Iəu iəsəhrun agɨniən məmə in pris asoli agɨn rəha Uhgɨn . Mətəu iəu iəkəhrun məmə Nauəuə Rəha Uhgɨn tətəni lanu məmə , ‘ Səghati rahiən e nətəm kotepət lam . ’ ”
66022015	Sin	Mətəu nətəmimi nəuvein mɨn əha ikɨn nətəm ko kəsəhuvaiən imə . Ilah u , nətəm kotamɨkmɨk , mɨne nətəmi mɨn ko nətəm kautol kləpə mɨne mautəmki nərɨk , mɨne kautit oneuən ilah mɨn , mɨne mautohamu itəmi , məutəfaki kəm narmɨ nati mɨn , mɨne nətəmi rəfin nətəm kotolkeikei neiuəiən .
66002014	Sin	Mətəu in əmə ko , iateh nɨpəgnəmtɨn mɨn nəuvein iətəm itəmah nautol iətəm təsəhruahruiən e nəhmtək . Itəmah nəuvein u ko ikɨn ko , nəutəgətun nətəmimi ko ikɨn ko məmə okotos nəgətuniən rəha Paləm . Paləm u , in təmol suaru kəm Kig Palək məmə in otəfən-əfən kəm nətəm Isrel , kəni pəh ilah kotol noliən tərah , mautun nauəniən iətəm kəmol sakrifais lan tatuvən kəm narmɨ nati iətəm kəmɨsɨkəuvɨn e nɨgi , kəni mautit əpnapɨn ilah mɨn .
53001003	Faith	Piak mɨn mɨne nəuvɨnɨk mɨn . Nian rəfin itɨmahal iəhlətəu məmə iəkləkeikei məhləni kəm Uhgɨn məmə nɨkitɨmahal tagiən o təmah . Kəni təhruahru əmə məmə iəklol lanəha , mətəu-inu nian rəfin nəhatətəiən rəhatəmah tətuva mətəskasɨk , kəni nian rəfin itəmah rəfin nautolkeikei pɨk itəmah mɨn , kəni nolkeikeiən mɨne nəhatətəiən əha katueviə mətuəri mətuəskasɨk .
46012002	Sin	Itəmah nəkotəhrun məmə aupən , nian nəməsotəfakiən kəm Uhgɨn , katiuvi=pən rəhatəmah nətəlɨgiən katit itəmah e suaru o nəfakiən kəm narmɨ nati mɨn iətəm kəsotəghatiən .
49005025	Recommendation	Kəni itəmah nəman nətəm nɨnotol rəkɨs marɨt , otolkeikei rəhatəmah nɨpətan təhmen əmə məmə Krɨsto təmolkeikei niməfaki , kəni məfən rəhan nəmiəgəhiən ohni .
45012017	Recommendation	Nəmə iətəmi kəti tatol tərah e təmah , sotalpɨniən rəhan noliən . Onəkotolkeikei motalkut məmə nəkotol noliən iətəm nətəmimi rəfin okoteruh məmə təhruahru .
60005006	Recommendation	Kəni tol lanəha , otosiahu aru itəmah motatɨg ahgəl nəhlmɨ Uhgɨn əsanən , məmə in otəfəri itəmah e nian əhruahru rəhan .
44014017	Grace	Mətəu nian rəfin in tatol suaru kəm lah məmə ilah kotəhrun neruhiən rəhan nəuvɨriən iətəm in tatol . In tatol nuhuən tətəfuv , matol nauəniən mɨn e nasumiən , kəni kautol nɨpətɨlah e nian əhruahru rəhalah . In tətəfən nauəniən kəm təmah mol itəmah nəutətəu təuvɨr . ”
54003011	Recommendation	Kəni təhmen-əhmen əmə , nɨpətan rəha dikon mɨn , ilah mɨn okotəkeikei motol rəhalah nəmiəgəhiən təhruahru vivi . Təsəuvɨriən məmə ilah nɨpətan nətəm kəutəni nɨkalɨtəmi , uə nɨpətan rəha napɨsiən , mətəu ilah nɨpətan nətəm nətəmimi kəutəhatətə e lah e nian rəfin .
66002021	Sin	Iəmətəhtahnin pətan əha məmə in otəuhlin rəhan noliən rəha nɨtəu=pən əpnapɨniən nəman , mətəu in təpəh .
44012020	Description	E nian əha , Kig Herot Akripə Uan niəməha təməu pɨk kəni tətəməki e nətəm kəutatɨg e taun mil əha , Taea mɨne Saedon . Kəni nətəmi asoli mɨn e taun mil əha kəməhuva pəti kəni məhuvən məmə okoteruh Kig məmə kotol vivi ilah min , mətəu-inu nətəm imalah ikɨn kautəhuvən məutos nəhmtɨ nauəniən ima Kig ikɨn . Mətəu aupən ilah kəmautəhuvən məuteruh Kig , kəmotəghati ilah suah kəti nərgɨn u Plastus , u in iətəmi asoli kəti rəha Kig Herot , motiuvi=pən məmə otasiru e lah .
