50001027	Recommendation	Ohun yówù kó ṣẹlẹ̀, ẹ jẹ́ kí ìgbé ayé yín ri gẹ́gẹ́ bí ìyìnrere Kristi: pé yálà bi mo tilẹ̀ wá wò yín, tàbí bí èmi kò wá, kí èmi kí ó lè máa gbúròó bí ẹ ti ń ṣe, pé ẹ̀yin dúró ṣinṣin nínú Ẹ̀mí kan, ẹ̀yin jùmọ̀ jìjàkadì nítorí ìgbàgbọ́ ìyìnrere, pẹ̀lú ọkàn kan.
46006014	Grace	Nínú agbára rẹ̀, Ọlọ́run jí Olúwa dìde kúrò nínú òkú bẹ́ẹ̀ gẹ́gẹ́ ni yóò jí àwa náà dìde.
55001006	Recommendation	Nítorí ìdí èyí ni mo ṣe ń ran ọ létí pé kí ó máa rú ẹ̀bùn Ọlọ́run sókè èyí ti ń bẹ nínú rẹ nípa ìgbọ́wọ́lé mi.
60004006	Grace	Nítorí èyí ní a sá ṣe wàásù ìyìnrere fún àwọn òkú, kí a lè ṣe ìdájọ́ wọn gẹ́gẹ́ bí ènìyàn nípa ti ara, ṣùgbọ́n kí wọ́n lè wà láààyè si Ọlọ́run nípa tí Ẹ̀mí.
46007023	Recommendation	A sì ti rà yín ní iye kan, nítorí náà ẹ má ṣe di ẹrú ènìyàn.
46010010	Recommendation	Bẹ́ẹ̀ ni kí ẹ̀yin kí ó má ṣe kùn, gẹ́gẹ́ bí àwọn mìíràn nínú wọ́n ṣe kùn, tí a sì ti ọwọ́ olùparun run wọ́n.
47002017	Faith	Nítorí àwa kò dàbí àwọn ọ̀pọ̀lọpọ̀, tí ń fi ọ̀rọ̀ Ọlọ́run ṣòwò jẹun; ṣùgbọ́n nínú òtítọ́ inú àwa ń sọ̀rọ̀ níwájú Ọlọ́run nínú Kristi gẹ́gẹ́ bí àwọn tí a rán láti ọ̀dọ̀ Ọlọ́run wá.
45015001	Recommendation	Àwa tí a jẹ́ alágbára nínú ìgbàgbọ́ yẹ kí ó máa ru ẹrù àìlera àwọn aláìlera, kí a má sì ṣe ohun tí ó wu ara wa.
50002024	Faith	Ṣùgbọ́n mo ní gbẹ́kẹ̀lé nínú Olúwa, pé èmi tìkára mi pẹ̀lú yóò wá ní àìpẹ́.
66007001	Description	Lẹ́yìn èyí ni mo rí angẹli mẹ́rin dúró ní igun mẹ́rẹ̀ẹ̀rin ayé, wọ́n di afẹ́fẹ́ mẹ́rẹ̀ẹ̀rin ayé mú, kí ó má ṣe fẹ́ sórí ilẹ̀, tàbí sórí Òkun, tàbí sára igikígi.
60004003	Sin	Nítorí ìgbà tí ó ti kọjá ti tó fún ṣíṣe ìfẹ́ àwọn aláìkọlà, rínrìn nínú ìwà wọ̀bìà, ìfẹ́kúfẹ̀ẹ́, ọtí àmupara, ìréde òru, kíkó ẹ̀gbẹ́ ọ̀mùtí, àti ìbọ̀rìṣà tí í ṣe ohun ìríra.
66011005	Violence	Bí ẹnikẹ́ni bá sì fẹ́ pa wọn lára, iná ó ti ẹnu wọn jáde, a sì pa àwọn ọ̀tá wọn run, báyìí ni a ó sì pa ẹnikẹ́ni tí ó ba ń fẹ́ pa wọn lára run.
44023005	Recommendation	Paulu sì dá wọn lóhùn pé, “Ẹ̀yin arákùnrin mi, èmi kò mọ̀ pé olórí àlùfáà ni: nítorí a tí kọ ọ́ pé, ‘Ìwọ kò gbọdọ̀ sọ̀rọ̀ olórí àwọn ènìyàn rẹ̀ ní búburú.’ ”
66022015	Sin	Nítorí ni òde ni àwọn ajá gbé wà, àti àwọn oṣó, àti àwọn àgbèrè, àti àwọn apànìyàn, àti àwọn abọ̀rìṣà, àti olúkúlùkù ẹni tí ó fẹ́ràn èké tí ó sì ń hùwà èké.
66002014	Sin	Ṣùgbọ́n mo ni nǹkan díẹ̀ wí sí ọ; nítorí tí ìwọ ní àwọn kan tí ó di ẹ̀kọ́ Balaamu mú síbẹ̀, ẹni tí ó kọ́ Balaki láti mú ohun ìkọ̀sẹ̀ wá síwájú àwọn ọmọ Israẹli, láti máa jẹ ohun tí a pa rú ẹbọ sí òrìṣà, àti láti máa ṣe àgbèrè.
53001003	Faith	Ó yẹ kí a máa dúpẹ́ lọ́wọ́ Ọlọ́run nígbà gbogbo nítorí yín, ará, àní gẹ́gẹ́ bí ó ti yẹ, nítorí pé ìgbàgbọ́ yín ń dàgbà gidigidi, àti ìfẹ́ olúkúlùkù yín sí ara yín ń di púpọ̀.
46012002	Sin	Ẹ̀yin kò mọ̀ pé nígbà tí ẹ̀yin jẹ́ kèfèrí, a fà yín lọ sọ́dọ̀ àwọn odi òrìṣà.
49005025	Recommendation	Ẹ̀yin ọkọ, ẹ fẹ́ràn àwọn aya yín, gẹ́gẹ́ bí Kristi tí fẹ́ràn ìjọ, tí ó sì fi ara rẹ̀ fún un.
45012017	Recommendation	Ẹ má ṣe fi búburú san búburú fún ẹnikẹ́ni. Ẹ má pèsè ohun tí ó tọ́ níwájú gbogbo ènìyàn.
60005006	Recommendation	Nítorí náà, ẹ rẹ ara yin sílẹ̀ lábẹ́ ọwọ́ agbára Ọlọ́run, kí òun lè gbe yín ga lákokò.
44014017	Grace	Ṣùgbọ́n kò fi ara rẹ̀ sílẹ̀ ní àìní ẹ̀rí, ní ti pé ó ṣe rere, ó ń fún yín lójò láti ọ̀run wá, àti ni àkókò èso, ó ń fi oúnjẹ àti ayọ̀ kún ọkàn yín.”
54003011	Recommendation	Bẹ́ẹ̀ gẹ́gẹ́ ni ó yẹ fún àwọn obìnrin láti ni ìwà àgbà, kí wọn má jẹ́ asọ̀rọ̀ ẹni lẹ́yìn bí kò ṣe aláìrékọjá, olóòtítọ́ ní ohun gbogbo.
66002021	Sin	Èmi fi àkókò fún un, láti ronúpìwàdà; ṣùgbọ́n òun kò fẹ́ ronúpìwàdà àgbèrè rẹ̀.
44012020	Description	Herodu sí ń bínú gidigidi sí àwọn ará Tire àti Sidoni; ṣùgbọ́n wọ́n fi ìmọ̀ ṣọ̀kan wá sọ́dọ̀ rẹ̀, nígbà tí wọn sì ti tu Bilasitu ìwẹ̀fà ọba lójú, wọn ń bẹ̀bẹ̀ fún àlàáfíà, nítorí pé ìlú ọba náà ni ìlú tí wọ́n ti ń gba oúnjẹ.
43008049	Sin	Jesu sì dáhùn pé, “Èmi kò ní ẹ̀mí èṣù, ṣùgbọ́n èmi ń bu ọlá fún Baba mi, ẹ̀yin kò sì bu ọlá fún mi.
43006018	Description	Òkun sì ń ru nítorí ẹ̀fúùfù líle tí ń fẹ́.
45008018	Faith	Síbẹ̀síbẹ̀, ìyà tí a ń jẹ nísinsin yìí kò jámọ́ nǹkan nígbà tí a bá fiwé ògo tí yóò fún wa ní ìkẹyìn.
62002012	Grace	Èmi ń kọ̀wé sí yín, ẹ̀yin ọmọ mi ọ̀wọ́n, nítorí tí a darí ẹ̀ṣẹ̀ yín jì yín nítorí orúkọ rẹ̀.
55001009	Grace	ẹni ti ó gbà wá là, ti ó si pè wá sínú ìwà mímọ́—kì í ṣe nípa iṣẹ́ tí a ṣe ṣùgbọ́n nípasẹ̀ ète àti oore-ọ̀fẹ́ rẹ̀. Oore-ọ̀fẹ́ yìí ni a fi fún wa nínú Kristi Jesu láti ìpìlẹ̀ ayérayé,
43019006	Violence	Nítorí náà nígbà tí àwọn olórí àlùfáà, àti àwọn oníṣẹ́ rí i, wọ́n kígbe wí pé, “Kàn án mọ́ àgbélébùú, kàn án mọ́ àgbélébùú.” Pilatu wí fún wọn pé, “Ẹ mú un fún ara yín, kí ẹ sì kàn án mọ́ àgbélébùú: nítorí èmi kò rí ẹ̀ṣẹ̀ lọ́wọ́ rẹ̀.”
60001010	Grace	Ní ti ìgbàlà yìí, àwọn wòlíì tí wọ́n sọ àsọtẹ́lẹ̀ nípa oore-ọ̀fẹ́ tí ó mú tọ̀ yín wá, wọ́n wádìí jinlẹ̀ lẹ́sọ̀ lẹ́sọ̀.
63001007	Sin	Nítorí ẹlẹ́tàn púpọ̀ ti jáde wa sínú ayé, àwọn tí kò jẹ́wọ́ pé Jesu Kristi wá nínú ara. Èyí ni ẹlẹ́tàn àti aṣòdì sí Kristi.
44024005	Sin	“Nítorí àwa rí ọkùnrin yìí, ó jẹ́ oníjàngbàn ènìyàn, ẹni tí ó ń dá rúkèrúdò sílẹ̀ láàrín gbogbo àwọn Júù tí ó wà ní gbogbo ayé. Òun ni aṣáájú búburú kan nínú ẹ̀yà àwọn Nasarene,
54003016	Grace	Láìṣiyèméjì, títóbi ní ohun ìjìnlẹ̀ ìwà-bí-Ọlọ́run: ẹni tí a fihàn nínú ara, tí a dá láre nínú Ẹ̀mí, ti àwọn angẹli rí, tí a wàásù rẹ̀ láàrín àwọn orílẹ̀-èdè, tí a gbàgbọ́ nínú ayé, tí a sì gbà sókè sínú ògo.
66016021	Violence	Yìnyín ńlá, tí ọ̀kọ̀ọ̀kan rẹ̀ tó tálẹ́ǹtì ní ìwọ̀n, sì bọ́ lù àwọn ènìyàn láti ọ̀run wà, àwọn ènìyàn sì sọ̀rọ̀-òdì sí Ọlọ́run nítorí ìyọnu yìnyín náà; nítorí tí ìyọnu rẹ̀ náà pọ̀ gidigidi.
61003013	Faith	Ṣùgbọ́n gẹ́gẹ́ bí ìlérí rẹ̀, àwa ń retí àwọn ọ̀run tuntun àti ayé títún nínú èyí tí òdodo ń gbé.
66006014	Description	A sì ká ọ̀run kúrò bí ìwé tí a ká, àti olúkúlùkù òkè àti erékùṣù ní a sì ṣí kúrò ní ipò wọn.
58010010	Grace	Nípa ìfẹ́ náà ni a ti sọ wá di mímọ́ nípa ẹbọ ti Jesu Kristi fi ara rẹ̀ rú lẹ́ẹ̀kan ṣoṣo.
52001002	Faith	Gbogbo ìgbà ni a máa ń fi ọpẹ́ fún Ọlọ́run nítorí yín, a sì ń gbàdúrà fún un yín nígbà gbogbo pẹ̀lú.
66006004	Violence	Ẹṣin mìíràn tí ó pupa sì jáde, a sì fi agbára fún ẹni tí ó jókòó lórí rẹ̀, láti gba àlàáfíà kúrò lórí ilẹ̀ ayé, àti pé kí wọn kí ó máa pa ara wọn, a sì fi idà ńlá kan lé e lọ́wọ́.
54006001	Recommendation	Jẹ́ kí gbogbo àwọn tí i ṣe ẹrú lábẹ́ ìsìnrú máa ka àwọn olówó tí ó ni wọ́n yẹ sí ọlá gbogbo, kí a má bà á sọ̀rọ̀-òdì sí orúkọ Ọlọ́run àti ẹ̀kọ́ rẹ̀.
51003009	Recommendation	Ẹ má ṣe purọ́ fún ara yín, níwọ̀n ìgbà tí ẹ ti bọ́ ògbólógbòó ara yín pẹ̀lú ìṣe rẹ̀ sílẹ̀,
66002020	Sin	Ṣùgbọ́n èyí ni mo rí wí sí ọ, nítorí tí ìwọ fi ààyè sílẹ̀ fún obìnrin Jesebeli tí ó ń pe ara rẹ̀ ní wòlíì. Nípasẹ̀ ẹ̀kọ́ rẹ̀, ó sì ń kọ́ àwọn ìránṣẹ́ mi, ó sì ń tàn wọ́n láti máa ṣe àgbèrè, àti láti máa jẹ ohun tí a pa rú ẹbọ sì òrìṣà.
48003008	Grace	Bí ìwé mímọ́ sì tí wí tẹ́lẹ̀ pé, Ọlọ́run yóò dá aláìkọlà láre nípa ìgbàgbọ́, ó tí wàásù ìyìnrere ṣáájú fún Abrahamu, ó ń wí pé, “Nínú rẹ̀ ni a ó bùkún fún gbogbo orílẹ̀-èdè.”
58012005	Recommendation	Ẹ̀yin sì ti gbàgbé ọ̀rọ̀ ìyànjú tí ó n ba yin sọ̀rọ̀ bí ọmọ pé, “Ọmọ mi, ma ṣe aláìnání ìbáwí Olúwa, kí o má sì ṣe rẹ̀wẹ̀sì nígbà tí a bá ń ti ọwọ́ rẹ̀ ba ọ wí,
58013017	Recommendation	Ẹ máa gbọ́ ti àwọn tí ń ṣe olórí yín, kí ẹ sì máa tẹríba fún wọ́n, nítorí wọn ń ṣọ́ ẹ̀ṣọ́ nítorí ọkàn yín, bí àwọn ti yóò ṣe ìṣirò, kí wọn lè fi ayọ̀ ṣe èyí, kì í ṣe pẹ̀lú ìbànújẹ́, nítorí èyí yìí yóò jẹ àìlérè fún yín.
44013019	Description	nígbà tí ó sì ti run orílẹ̀-èdè méje ni ilẹ̀ Kenaani, ó sì fi ilẹ̀ wọn fún àwọn ènìyàn rẹ̀ ni ìní.
54006003	Faith	Bí ẹnikẹ́ni bá ń kọ́ni ní ẹ̀kọ́ mìíràn, ti kò sì gba ọ̀rọ̀ ti ó yè kooro, ti Jesu Kristi Olúwa wa, àti ẹ̀kọ́ ti ó bá ìwà-bí-Ọlọ́run mu,
63001010	Recommendation	Bí ẹnikẹ́ni bá tọ̀ yín wá, tí kò sì mu ẹ̀kọ́ yìí wá, ẹ má ṣe gbà á sí ilé, kí ẹ má sì ṣe kí i kú ààbọ̀.
47001005	Grace	Nítorí pé bí àwa ti pín nínú ìjìyà Kristi, gẹ́gẹ́ bẹ́ẹ̀ nì ìtùnú wa dí púpọ̀ pẹ̀lú nípa Kristi.
65001011	Sin	Ègbé ni fún wọn! Nítorí tí wọ́n ti rìn ní ọ̀nà Kaini, wọ́n sì fi ìwọra súré sínú ìṣìnà Balaamu nítorí ère, wọn ṣègbé nínú ìṣọ̀tẹ̀ Kora.
65001010	Sin	Ṣùgbọ́n àwọn wọ̀nyí n sọ̀rọ̀-òdì sí ohun gbogbo ti kò yé wọn: ṣùgbọ́n ohun gbogbo tí wọn mọ̀ nípa èrò ara ni, bí ẹranko tí kò ní ìyè, nípasẹ̀ nǹkan wọ̀nyí ni wọ́n di ẹni ìparun.
58011007	Faith	Nípa ìgbàgbọ́ ni Noa, nígbà ti Ọlọ́run, kìlọ̀ ohun tí a kóò tí ì rí fún un, o bẹ̀rù Ọlọ́run ó sì kan ọkọ̀ fún ìgbàlà ilé rẹ̀, nípa èyí tí ó da ayé lẹ́bi, ó sì di ajogún òdodo tí i ṣe nípa ìgbàgbọ́.
58009006	Description	Ǹjẹ́ nígbà tí a ti ṣe ètò nǹkan wọ̀nyí báyìí, àwọn àlùfáà a máa lọ nígbàkígbà sínú àgọ́ èkínní, wọn a máa ṣe iṣẹ́ ìsìn.
44007051	Sin	“Ẹ̀yin ọlọ́rùn líle àti aláìkọlà àyà àti etí! Bí àwọn baba yín gẹ́lẹ́ ni ẹ̀yin rí. Nígbà gbogbo ni ẹ̀yin máa ń dènà Ẹ̀mí Mímọ́!
54001009	Sin	Bí a ti mọ̀ pé, a kò ṣe òfin fún olódodo, bí kò ṣe fún àwọn aláìwà-bí-Ọlọ́run àti àwọn ẹlẹ́ṣẹ̀, fún àwọn aláìmọ́ àti àwọn ẹlẹ́gàn, fún àwọn tí ń pa baba àti àwọn tí ń pa ìyá wọn àti àwọn apànìyàn,
46005009	Recommendation	Nígbà tí mo kọ̀wé ṣáájú sí i yín, mo sọ fún yín pé, kí ẹ má ṣe darapọ̀ pẹ̀lú àwọn alágbèrè ènìyàn.
48001015	Grace	Ṣùgbọ́n nígbà tí ó wú Ọlọ́run ẹni tí ó yà mí sọ́tọ̀ láti inú ìyá mi wá, tí ó sì pé mi nípa oore-ọ̀fẹ́ rẹ̀.
45007015	Description	Èmi pàápàá, kò mọ̀ ohun tí èmi ń ṣe. Nítorí pé, ohun tí mo fẹ́ ṣe gan an n kò ṣe é, ṣùgbọ́n ohun tí mo kórìíra ni mo ń ṣe.
61003018	Faith	Ṣùgbọ́n ẹ máa dàgbà nínú oore-ọ̀fẹ́ àti nínú ìmọ̀ Olúwa àti Olùgbàlà wa Jesu Kristi. Ẹni tí ògo wà fún nísinsin yìí àti títí láé! Àmín.
46004010	Description	Àwa jẹ́ aṣiwèrè nítorí Kristi, ṣùgbọ́n ẹ̀yin jẹ́ ọlọ́gbọ́n nínú Kristi! Àwa jẹ́ aláìlera, ṣùgbọ́n ẹ̀yin jẹ́ alágbára! Ẹ̀yin jẹ́ ẹni àyẹ́sí, àwa jẹ ẹni ẹ̀gàn!
60005009	Faith	Ẹ kọ ojú ìjà sí i pẹ̀lú ìdúró ṣinṣin nínú ìgbàgbọ́, bí ẹ̀yin ti mọ̀ pé ìyà kan náà ni àwọn ará yín tí ń bẹ nínú ayé ń jẹ.
51003022	Recommendation	Ẹ̀yin ẹrú, ẹ gbọ́ ti àwọn olówó yín nípa ti ara ní ohun gbogbo; kì í ṣe ní àrọ́júṣe, bí àwọn aláṣehàn ènìyàn; ṣùgbọ́n ní òtítọ́ inú, ní ìbẹ̀rù Ọlọ́run.
66017012	Description	“Ìwo mẹ́wàá tí ìwọ sì rí ni ọba mẹ́wàá ni wọn, tí wọn kò ì ti gba ìjọba; ṣùgbọ́n wọn gba àṣẹ bí ọba pẹ̀lú ẹranko náà fún wákàtí kan.
46002012	Grace	Àwa kò gbà ẹ̀mí ti ayé yìí, bí kò ṣe Ẹ̀mí ẹni tí ó ti ọ̀dọ̀ Ọlọ́run wa, kí a lè ní òye ohun tí Ọlọ́run fi fún wa lọ́fẹ̀ẹ́.
59005001	Recommendation	Ẹ wá nísinsin yìí, ẹ̀yin ọlọ́rọ̀, ẹ máa sọkún kí ẹ sì máa pohùnréré ẹkún nítorí òsì tí ó ń bọ̀ wá ta yín.
66002010	Recommendation	Má ṣe bẹ̀rù ohunkóhun tí ìwọ ń bọ wá jìyà rẹ̀. Kíyèsi i, èṣù yóò gbé nínú yín jù sínú túbú, kí a lè dán yin wò; ẹ̀yin ó sì ní ìpọ́njú ní ọjọ́ mẹ́wàá, ìwọ ṣa ṣe olóòtítọ́ dé ojú ikú, èmi ó sì fi adé ìyè fún ọ.
54006011	Recommendation	Ṣùgbọ́n ìwọ ènìyàn Ọlọ́run, sá fún nǹkan wọ̀nyí; kí ó sì máa lépa òdodo, ìwà-bí-Ọlọ́run, ìgbàgbọ́, ìfẹ́ sùúrù, ìwà tútù.
59005005	Sin	Ẹ̀yin ti jẹ adùn ní ayé, ẹ̀yin sì ti fi ara yín fún ayé jíjẹ; ẹ̀yin ti mú ara yín sanra de ọjọ́ pípa.
66004004	Description	Yí ìtẹ́ náà ká sì ni ìtẹ́ mẹ́rìnlélógún mìíràn; àti lórí àwọn ìtẹ́ náà mo rí àwọn àgbà mẹ́rìnlélógún jókòó, tí a wọ̀ ni aṣọ àlà; adé wúrà sì wà ni orí wọn.
66018007	Description	Níwọ́n bí o ti yin ara rẹ̀ lógo tó, tí ó sì hùwà wọ̀bìà, níwọ̀n bẹ́ẹ̀ ni kí ẹ dá a lóró kí ẹ sì fún un ní ìbànújẹ́; nítorí tí ó wí ní ọkàn rẹ̀ pé, ‘Mo jókòó bí ọbabìnrin, èmi kì sì í ṣe opó, èmí kì yóò sì rí ìbànújẹ́ láé.’
60003007	Recommendation	Bẹ́ẹ̀ gẹ́gẹ́ ẹ̀yin ọkọ, ẹ máa fi òye ba àwọn aya yín gbé, ẹ máa fi ọlá fún aya, bi ohun èlò ti kò lágbára, àti pẹ̀lú bí àjùmọ̀jogún oore-ọ̀fẹ́ ìyè; kí àdúrà yín má bà á ní ìdènà.
54002012	Recommendation	Ṣùgbọ́n èmi kò fi àṣẹ fún obìnrin láti máa kọ́ni, tàbí láti pàṣẹ lórí ọkùnrin, bí kò ṣe kí ó dákẹ́ jẹ́ẹ́.
46001009	Faith	Ọlọ́run, nípasẹ̀ ẹni ti a pè yín sínú ìdàpọ̀ pẹ̀lú Ọmọ rẹ̀ Jesu Kristi Olúwa wa, jẹ́ Olóòtítọ́.
48005013	Recommendation	Nítorí a ti pè yín sí òmìnira, ará kìkì pé kí ẹ má ṣe lo òmìnira yín bí àǹfààní sípa ti ara, ṣùgbọ́n ẹ máa fi ìfẹ́ sin ọmọnìkejì yín.
59002012	Recommendation	Ẹ máa sọ̀rọ̀, ẹ sì máa hùwà, bí àwọn tí a ó fi òfin òmìnira dá lẹ́jọ́.
46012005	Faith	Onírúurú iṣẹ́ ìránṣẹ́ ni ó sì wà, ṣùgbọ́n Ọlọ́run kan náà sì ni.
45009005	Description	Tí ẹni tí àwọn Baba í ṣe, àti láti ọ̀dọ̀ àwọn ẹni tí Kristi ti wá nípa ti ara, ẹni tí ó borí ohun gbogbo, Ọlọ́run olùbùkún láéláé. Àmín.
47001006	Description	Ṣùgbọ́n bí a bá sì ń pọ́n wa lójú, ó jẹ́ fún ìtùnú àti ìgbàlà yín; tàbí bi a bá ń tù wá nínú, ó jẹ́ fún ìtùnú yín ti ń ṣiṣẹ́ sùúrù láti mú yin ní irú ìfaradà ìyà kan náà ti àwa pẹ̀lú ń jẹ́.
47001021	Faith	Ǹjẹ́ nísinsin yìí, Ọlọ́run ni ó fi ẹsẹ̀ wa múlẹ̀ pẹ̀lú yín nínú Kristi, Òun ni ó ti fi àmì òróró yàn wá,
44010015	Recommendation	Ohùn kan sì tún fọ̀ sí i lẹ́ẹ̀méjì pé, “Ohun tí Ọlọ́run bá ti wẹ̀mọ́, ìwọ má ṣe pè é ní èèwọ̀ mọ́.”
66018009	Sin	“Àti àwọn ọba ayé, tí ó ti ń bá a ṣe àgbèrè, tiwọn sì ń hùwà wọ̀bìà, yóò sì pohùnréré ẹkún lé e lórí, nígbà tí wọn bá wo èéfín ìjóná rẹ̀.
43014023	Faith	Jesu dáhùn ó sì wí fún un pé, “Bí ẹnìkan bá fẹ́ràn mi, yóò pa ọ̀rọ̀ mi mọ́. Baba mi yóò sì fẹ́ràn rẹ̀, àwa ó sì tọ̀ ọ́ wá, a ó sì ṣe ibùgbé wa pẹ̀lú rẹ̀.
62004010	Grace	Nínú èyí ni ìfẹ́ wà, kì í ṣe pé àwa fẹ́ Ọlọ́run, ṣùgbọ́n òun fẹ́ wá, ó sì rán Ọmọ rẹ̀ láti jẹ́ ètùtù fún ẹ̀ṣẹ̀ wa.
62001007	Faith	Ṣùgbọ́n bí àwa bá ń rìn nínú ìmọ́lẹ̀, gẹ́gẹ́ bí òun ti ń wà nínú ìmọ́lẹ̀, àwa ní ìdàpọ̀ pẹ̀lú ara wa, àti pé ẹ̀jẹ̀ Jesu Kristi, Ọmọ rẹ̀, wẹ̀ wá nù kúrò nínú ẹ̀ṣẹ̀ gbogbo.
48004007	Grace	Nítorí náà ìwọ kì í ṣe ẹrú, bí kò ṣe ọmọ; àti bí ìwọ bá ń ṣe ọmọ, ǹjẹ́ ìwọ di àrólé Ọlọ́run nípasẹ̀ Kristi.
58001008	Faith	Ṣùgbọ́n ó sọ nípa tí Ọmọ rẹ̀ pé, “Ìtẹ́ rẹ, Ọlọ́run, láé àti láéláé ni, ọ̀pá aládé òdodo ni ọ̀pá ìjọba rẹ.
43010033	Sin	Àwọn Júù sì dá a lóhùn pé, “Àwa kò sọ ọ́ lókùúta nítorí iṣẹ́ rere, ṣùgbọ́n nítorí ọ̀rọ̀-òdì, àti nítorí ìwọ tí í ṣe ènìyàn ń fi ara rẹ pe Ọlọ́run.”
66014011	Description	Èéfín ìdálóró wọn ń lọ sókè títí láéláé wọn kò sì ní ìsinmi ni ọ̀sán àti ní òru, àwọn tí ń foríbalẹ̀ fún ẹranko náà àti fún àwòrán rẹ̀, àti ẹnikẹ́ni tí o ba sì gba àmì orúkọ rẹ̀.”
47004001	Faith	Nítorí náà, níwọ̀n bí ó ti jẹ́ pé nípa àánú Ọlọ́run ni a rí iṣẹ́ ìránṣẹ́ yìí gba, àárẹ̀ kò mú ọkàn wa rara,
58013006	Faith	Nítorí náà ni àwa ṣe ń fi ìgboyà wí pé, “Olúwa ni olùrànlọ́wọ́ mi, èmi kì yóò bẹ̀rù; kín ni ènìyàn lè ṣe sí mi?”
45014003	Recommendation	Kí ẹni tí ń jẹ ohun gbogbo má ṣe kẹ́gàn ẹni tí kò jẹ; kí ẹni tí kò sì jẹ ohun gbogbo kí ó má ṣe dá ẹni tí ń jẹ lẹ́bi nítorí Ọlọ́run ti gbà á.
45015005	Grace	Kí Ọlọ́run, ẹni tí ń fún ni ní sùúrù àti ìtùnú fún yin láti ní inú kan sí ara yín gẹ́gẹ́ bí i Jesu Kristi,
58007027	Description	Ẹni tí kò ní láti máa rú ẹbọ lójoojúmọ́, bí àwọn olórí àlùfáà, fún ẹ̀ṣẹ̀ ti ara rẹ̀ náà, àti lẹ́yìn náà fún tí àwọn ènìyàn; nítorí èyí ni tí ó ṣe lẹ́ẹ̀kan ṣoṣo, nígbà tí ó fi ara rẹ̀ rú ẹbọ.
62003017	Sin	Ṣùgbọ́n ẹni tí ó bá ni ohun ìní ayé, tí ó sì ri arákùnrin rẹ̀ tí ó ṣe aláìní, tí ó sì sé ìlẹ̀kùn ìyọ́nú rẹ̀ mọ́ ọn, báwo ni ìfẹ́ Ọlọ́run ṣe ń gbé inú rẹ̀?
47005008	Faith	Mo ní, àwa ní ìgboyà, àwa sì ń fẹ́ kí a kúkú ti inú ara kúrò, kí a sì lè wà ní ilé lọ́dọ̀ Olúwa.
60002011	Recommendation	Olùfẹ́ ọ̀wọ́n, mo bẹ̀ yín, bí àjèjì àti àtìpó, láti fàsẹ́yìn kúrò nínú ìfẹ́kúfẹ̀ẹ́ ara, tí ń ba ọkàn jagun.
60002017	Recommendation	Ẹ bọ̀wọ̀ fún gbogbo ènìyàn, ẹ fẹ́ àwọn ará, ẹ bẹ̀rù Ọlọ́run, ẹ bọ̀wọ̀ fún ọba.
44007025	Description	Mose rò bí àwọn ará òun mọ̀ pé Ọlọ́run yóò ti ọwọ́ òun gbà wọn; ṣùgbọ́n wọn kò mọ̀.
50003002	Violence	Ẹ kíyèsára lọ́dọ̀ àwọn ajá, ẹ kíyèsára lọ́dọ̀ àwọn oníṣẹ́ búburú, ẹ sì kíyèsára lọ́dọ̀ àwọn onílà.
56001016	Sin	Wọ́n ń fẹnu sọ wí pé àwọn mọ Ọlọ́run, ṣùgbọ́n wọ́n sẹ́ ẹ nípa ìṣe wọn. Wọ́n díbàjẹ́, wọn si jẹ aláìgbọ́ràn, bẹ́ẹ̀ ni wọ́n kò wúlò lọ́nàkọnà ní ti iṣẹ́ rere gbogbo.
45010002	Faith	Nítorí mo gba ẹ̀rí wọn jẹ́ wí pé, wọ́n ní ìtara fún Ọlọ́run, ṣùgbọ́n kì í ṣe gẹ́gẹ́ bí ìmọ̀.
47001004	Grace	Ẹni tí ń tù wá nínú ni gbogbo ìdààmú wa, ki àwa pẹ̀lú lè máa tu àwọn tí ó wá nínú ìdààmú nínú, nípá ìtùnú náà ti a fi ń tú àwa fúnra wa nínú láti ọ̀dọ̀ Ọlọ́run wá.
55002015	Recommendation	Ṣaápọn láti fi ara rẹ̀ hàn níwájú Ọlọ́run bi ẹni tí ó yege àti òṣìṣẹ́ tí kò ní láti tijú, tí ó ń pín ọ̀rọ̀ òtítọ́ bí ó ti yẹ.
53002004	Description	Òun yóò lòdì sí, yóò sì gbé ara rẹ̀ ga sí gbogbo ohun tí a ń pè ní Ọlọ́run tàbí tí a ń sìn, dé ibi pé yóò gbé ara rẹ̀ jókòó nínú tẹmpili Ọlọ́run, tí yóò sì pe ara rẹ̀ ní Ọlọ́run.
49006004	Recommendation	Àti ẹ̀yin baba, ẹ má ṣe mú àwọn ọmọ yín bínú, ṣùgbọ́n ẹ máa tọ́ wọn nínú ẹ̀kọ́ àti ìkìlọ̀ Olúwa.
45008037	Grace	Ṣùgbọ́n nínú gbogbo nǹkan wọ̀nyí, àwa ju ẹni tí ó ṣẹ́gun lọ nípasẹ̀ Kristi ẹni tí ó fẹ́ wa.
44026014	Violence	Gbogbo wa sì ṣubú lulẹ̀, mo gbọ́ ohùn tí ń fọ sì mi ni èdè Heberu pé, ‘Saulu, Saulu! Èéṣe tí ìwọ fi ń ṣe inúnibíni sí mi? Ohun ìrora ní fún ọ láti tàpá sí ẹ̀gún!’
66002009	Sin	Èmi mọ iṣẹ́ rẹ, àti ìpọ́njú, àti àìní rẹ—ṣùgbọ́n ọlọ́rọ̀ ni ọ́, èmi sì mọ ọ̀rọ̀-òdì tí àwọn tí ń wí pé, Júù ni àwọn tìkára wọn, tí wọn kì sì í ṣe bẹ́ẹ̀, ṣùgbọ́n tí wọ́n jẹ́ Sinagọgu ti Satani.
46013006	Faith	Inú ìfẹ́ kì í dùn sí àìṣòótọ́. Ṣùgbọ́n inú rẹ̀ a máa dùn nígbà gbogbo.
59001021	Recommendation	Nítorí náà, ẹ lépa láti borí gbogbo èérí àti ìwà búburú tí ó gbilẹ̀ yíká, kí ẹ sì fi ọkàn tútù gba ọ̀rọ̀ náà tí a gbìn, tí ó lè gba ọkàn yín là.
46003006	Grace	Èmi gbìn, Apollo ń bomirin; ṣùgbọ́n Ọlọ́run ni ń mú ìbísí wá.
66014008	Sin	Angẹli mìíràn sì tẹ̀lé e, ó ń wí pé, “o ṣubú, Babeli ńlá ṣubú, èyí ti o tí ń mú gbogbo orílẹ̀-èdè mu nínú ọtí wáìnì àìmọ́ àgbèrè rẹ̀!”
43015014	Recommendation	Ọ̀rẹ́ mi ni ẹ̀yin ń ṣe, bí ẹ bá ṣe ohun tí èmi pàṣẹ fún yín.
62005021	Recommendation	Ẹ̀yin ọmọ mi, ẹ pa ara yín mọ́ kúrò nínú òrìṣà.
55003006	Sin	Nítorí nínú irú èyí ni àwọn ti ń rákò wọ inú ilé, tí wọ́n sì ń di àwọn obìnrin aláìlọ́gbọ́n tí a di ẹ̀ṣẹ̀ rù ní ìgbèkùn, tí a sì ń fi onírúurú ìfẹ́kúfẹ̀ẹ́ fà kiri.
49004015	Faith	Ṣùgbọ́n ká a máa sọ òtítọ́ ní ìfẹ́, kí a lè máa dàgbàsókè nínú rẹ̀ ní ohun gbogbo ẹni tí i ṣe orí, àní Kristi.
49004003	Faith	Kí ẹ sì máa làkàkà láti pa ìṣọ̀kan Ẹ̀mí mọ́ ni ìdàpọ̀ àlàáfíà.
44009005	Description	Ó sì wí pé, “Ìwọ ta ni, Olúwa?” Olúwa sì wí fún pé, “Èmi ni Jesu, ẹni ti ìwọ ń ṣe inúnibíni sí.
60003015	Recommendation	Ṣùgbọ́n ẹ bọ̀wọ̀ fún Kristi bí Olúwa ní ọkàn yín: kí ẹ sì múra tan nígbà gbogbo láti dá olúkúlùkù lóhùn tí ń béèrè ìrètí tí o ń bẹ nínú yín, ṣùgbọ́n pẹ̀lú ọkàn tútù àti ìbẹ̀rù.
44007033	Recommendation	“Olúwa sì wí fún un pé, ‘Bọ́ bàtà rẹ kúrò ní ẹsẹ̀ rẹ, nítorí ibi tí ìwọ dúró sí i nì ilẹ̀ mímọ́ ni.
62002024	Faith	Ẹ jẹ́ kí èyí tí ẹ tí gbọ́ ni àtètèkọ́ṣe máa gbé inú yín. Bí èyí tí ẹ̀yin tí gbọ́ ní àtètèkọ́ṣe bá ń gbé inú yín, ẹ̀yin ó sì dúró nínú Ọmọ àti nínú Baba.
43008051	Faith	Lóòótọ́, lóòótọ́ ni mo wí fún yín, bí ẹnìkan bá pa ọ̀rọ̀ mi mọ́, kì yóò rí ikú láéláé.”
66020011	Description	Mo sì rí ìtẹ́ funfun ńlá kan, àti ẹni tí ó jókòó lórí rẹ̀, níwájú ẹni tí ayé àti ọ̀run fò lọ; a kò sì rí ààyè fún wọn mọ́.
46006013	Recommendation	“Oúnjẹ fún inú àti inú fún oúnjẹ,” ṣùgbọ́n Ọlọ́run yóò fi òpin sí méjèèjì, ara kì í ṣe fún ìwà àgbèrè ṣíṣe, ṣùgbọ́n fún Olúwa, àti Olúwa fún ara náà.
45006011	Faith	Nítorí náà, ẹ ka ara yín bí òkú sí ẹ̀ṣẹ̀, ṣùgbọ́n bí alààyè sí Ọlọ́run nínú Kristi Jesu.
