46006019	Faith	Tàbí, ẹ̀yin kò mọ̀ pé ara yín ni tẹmpili Ẹ̀mí Mímọ́, ti ń bẹ nínú yín, ti ẹ̀yin ti gbà lọ́wọ́ Ọlọ́run? Ẹ̀yin kì í ṣe ti ara yín,
47005014	Grace	Nítorí ìfẹ́ Kristi ń rọ̀ wá, nítorí àwa mọ̀ báyìí pé, bí ẹnìkan bá kú fún gbogbo ènìyàn, ǹjẹ́ nígbà náà, gbogbo wọ́n ni ó ti kú.
58003001	Faith	Nítorí náà ẹ̀yin ará mímọ́, alábápín ìpè ọ̀run, ẹ gba ti aposteli àti olórí àlùfáà ìjẹ́wọ́ wa rò, àní Jesu;
44020035	Recommendation	Nínú ohun gbogbo mo fi àpẹẹrẹ fún un yín pé, nípa ṣíṣe iṣẹ́ bẹ́ẹ̀, ó yẹ kí ẹ máa ran àwọn aláìlera lọ́wọ́, ki ẹ sì máa rántí ọ̀rọ̀ Jesu Olúwa, bí òun tìkára rẹ̀ tí wí pé, ‘Láti fún ni ní ìbùkún ju láti gbà lọ.’ ”
58013004	Recommendation	Kí ìgbéyàwó lọ́lá láàrín gbogbo ènìyàn, kí àkéte si jẹ́ aláìléèérí, nítorí àwọn àgbèrè àti àwọn panṣágà ni Ọlọ́run yóò dá lẹ́jọ́.
43020005	Description	Ó sì bẹ̀rẹ̀ láti wo inú rẹ̀, ó rí aṣọ ọ̀gbọ̀ náà ní ilẹ̀; ṣùgbọ́n òun kò wọ inú rẹ̀.
66016018	Description	Mọ̀nàmọ́ná sì kọ, a sì gbọ́ ohùn, àrá sì sán, ìṣẹ̀lẹ̀ ńlá sì ṣẹ̀, irú èyí tí kò ṣẹ̀ ri láti ìgbà tí ènìyàn ti wà lórí ilẹ̀, irú ìṣẹ̀lẹ̀ ńlá bẹ́ẹ̀, tí ó sì lágbára tó bẹ́ẹ̀.
66019010	Faith	Mo sì wólẹ̀ ní ẹsẹ̀ rẹ̀ láti foríbalẹ̀ fún un. Ó sì wí fún mi pé, “Wò ó, má ṣe bẹ́ẹ̀: ìránṣẹ́ ẹlẹgbẹ́ rẹ̀ ni èmi, àti ti àwọn arákùnrin rẹ̀ tí wọ́n di ẹ̀rí Jesu mú. Foríbalẹ̀ fún Ọlọ́run: nítorí pé ẹ̀rí Jesu ni ìsọtẹ́lẹ̀.”
46002010	Grace	Ṣùgbọ́n Ọlọ́run ti fi í hàn fún wa nípasẹ̀ Ẹ̀mí rẹ̀. Ẹ̀mí á máa wádìí ohun gbogbo, kódà àwọn àṣírí Ọlọ́run tó jinlẹ̀ jùlọ.
50002029	Recommendation	Nítorí náà, ẹ fi ayọ̀ púpọ̀ gbà á nínú Olúwa; kí ẹ sì máa bu ọlá fún irú àwọn ẹni bẹ́ẹ̀.
51003020	Recommendation	Ẹ̀yin ọmọ ẹ máa gbọ́ ti àwọn òbí yín ní ohun gbogbo, nítorí èyí dára gidigidi nínú Olúwa.
47001012	Faith	Nítorí èyí ní ìṣògo wá, ẹ̀rí láti inú ọkàn wa pẹ̀lú si jẹ́rìí wí pé àwa ń gbé ìgbésí ayé tí ó ní ìtumọ̀ pàápàá jùlọ nínú ìbágbépọ̀ wa pẹ̀lú yín, nínú ìwà mímọ́ àti òtítọ́ láti ọ̀dọ̀ Ọlọ́run wá. Kì í ṣe nípa ọgbọ́n ti ara ni àwa ń ṣe èyí bí kò ṣe nípa oore-ọ̀fẹ́ Ọlọ́run.
43014021	Faith	Ẹni tí ó bá ní òfin mi, tí ó bá sì ń pa wọ́n mọ́, òun ni ẹni tí ó fẹ́ràn mi, ẹni tí ó bá sì fẹ́ràn mi, a ó fẹ́ràn rẹ̀ láti ọ̀dọ̀ Baba mi, èmi ó sì fẹ́ràn rẹ̀, èmi ó sì fi ara mi hàn fún un.”
51002023	Sin	Àwọn nǹkan tí ó ní àfarawé ọgbọ́n nítòótọ́, nípasẹ̀ àdábọwọ́ ìsìn, àti ìrẹ̀lẹ̀, àti ìpọ́nra-ẹni-lójú, ṣùgbọ́n tí kò ni èrè láti di ìfẹ́kúfẹ̀ẹ́ ara ku.
64001006	Recommendation	Tí wọn ń jẹ́rìí sí ìfẹ́ rẹ̀ níwájú ìjọ, bí ìwọ bá ń pèsè fún wọn ní ọ̀nà àjò wọn gẹ́gẹ́ bí ó tí yẹ nínú Ọlọ́run.
55002023	Recommendation	Ìbéèrè òmùgọ̀ àti aláìní ẹ̀kọ́ nínú ni kí o kọ̀, bí o ti mọ̀ pe wọn máa dá ìjà sílẹ̀.
47003018	Faith	Ṣùgbọ́n gbogbo wa ń wo ògo Olúwa láìsí ìbòjú bí ẹni pé nínú àwòjìji, a sì ń pa wa dà sí àwòrán kan náà láti ògo dé ògo, àní bí láti ọ̀dọ̀ Olúwa tí í ṣe Ẹ̀mí.
58009014	Grace	mélòó mélòó ni ẹ̀jẹ̀ Kristi, ẹni, nípa Ẹ̀mí ayérayé, tí ó fi ara rẹ̀ rú ẹbọ sí Ọlọ́run láìní àbàwọ́n, yóò wẹ èérí ọkàn yín nù kúrò nínú òkú iṣẹ́ láti sin Ọlọ́run alààyè?
44011017	Grace	Ǹjẹ́ bí Ọlọ́run sì ti fi irú ẹ̀bùn kan náà fún wọn bí ó ti fi fún àwa pẹ̀lú nígbà tí a gba Jesu Kristi Olúwa gbọ́, ta ni èmi tí n ó fi rò pé mo le è de Ọlọ́run ní ọ̀nà?”
49004030	Faith	Ẹ má sì ṣe mú Ẹ̀mí Mímọ́ Ọlọ́run bínú, ẹni tí a fi ṣe èdìdì yín dé ọjọ́ ìdáǹdè.
66003003	Recommendation	Nítorí náà rántí bí ìwọ ti gbà, àti bí ìwọ ti gbọ́, kí o sì pa á mọ́, kí o sì ronúpìwàdà. Ǹjẹ́, bí ìwọ kò ba ṣọ́ra, èmi yóò dé sí ọ bí olè, ìwọ kì yóò sì mọ́ wákàtí tí èmi yóò dé sí ọ.
62003007	Recommendation	Ẹ̀yin ọmọ mi, ẹ má ṣe jẹ́ kí ẹnikẹ́ni tàn yín, ẹni tí ó bá ń ṣe òdodo, ó jásí olódodo, gẹ́gẹ́ bí òun tí jẹ olódodo.
62004001	Recommendation	Olùfẹ́, ẹ má ṣe gba gbogbo ẹ̀mí gbọ́, ṣùgbọ́n ẹ dán àwọn ẹ̀mí wò bí wọn ba ń ṣe tí Ọlọ́run, nítorí àwọn wòlíì èké púpọ̀ tí jáde lọ sínú ayé.
44013038	Grace	“Ǹjẹ́ kí ó yé yín, ará pé nípasẹ̀ Jesu yìí ni a ń wàásù ìdáríjì ẹ̀ṣẹ̀ fún yín.
50003001	Recommendation	Ní àkótán ará, ẹ máa yọ̀ nínú Olúwa wa. Kì í ṣe ìnira fún mi láti kọ̀wé ohun kan náà sí yín, ṣùgbọ́n fún yín ó jẹ́ ohun ààbò.
46011034	Recommendation	Bí ebi bá ń pa ẹnikẹ́ni nínú yin, kí ó jẹun láti ilé wá, kí ó má ba á mú ìjìyà wá sórí ara rẹ̀ nígbà tí ẹ bá péjọ. Tí mo bá dé, èmi yóò máa sọ̀rọ̀ lórí àwọn kókó-ọ̀rọ̀ ìyókù tí n kò ì ti fẹnu bà lẹ́sẹẹsẹ.
43018031	Description	Nítorí náà Pilatu wí fún wọn pé, “Ẹ mú un tìkára yín, kí ẹ sì ṣe ìdájọ́ rẹ̀ gẹ́gẹ́ bí òfin yín.” Nítorí náà ni àwọn Júù wí fún un pé, “Kò tọ́ fún wa láti pa ẹnikẹ́ni.”
46012031	Faith	Ṣùgbọ́n, ẹ máa fi ìtara ṣàfẹ́rí ẹ̀bùn ti ó tóbi jù. Síbẹ̀ èmi o fi ọ̀nà kan tí ó tayọ rékọjá hàn yín.
58007026	Description	Nítorí pé irú olórí àlùfáà bẹ́ẹ̀ ni o yẹ wá, mímọ́, àìlẹ́gàn, àìléèérí, tí a yà sọ́tọ̀ kúrò láàrín àwọn ẹlẹ́ṣẹ̀, tí a sì gbéga ju àwọn ọ̀run lọ.
50004013	Faith	Èmi le ṣe ohun gbogbo nínú Kristi ẹni ti ń fi agbára fún mi.
52004003	Recommendation	Nítorí ìfẹ́ Ọlọ́run ni pé kí ẹ jẹ́ mímọ́, kí ẹ sì yàgò kúrò nínú ẹ̀ṣẹ̀ àgbèrè,
51004002	Recommendation	Ẹ fi ara yín jì fún àdúrà gbígbà, kí ẹ ṣọ́ra kí ẹ sì máa dúpẹ́;
44007029	Description	Mose sì sá nítorí ọ̀rọ̀ yìí, ó sì wa ṣe àtìpó ni ilẹ̀ Midiani, níbi tí ó gbé bí ọmọ méjì.
46011007	Description	Ṣùgbọ́n ọkùnrin kò ní láti fi nǹkan bo orí rẹ́ nígbà tí ó bá ń sìn, nítorí àwòrán àti ògo Ọlọ́run ni òun í ṣe, ṣùgbọ́n ògo ọkùnrin ni obìnrin í ṣe.
51003015	Faith	Ẹ sì jẹ́ kí àlàáfíà Ọlọ́run kí ó máa ṣe àkóso ọkàn yín, sínú èyí tí a pè yín pẹ̀lú nínú ara kan; kí ẹ sì máa dúpẹ́.
58002010	Grace	Nítorí pé ó yẹ fún Ọlọ́run, nítorí nípasẹ̀ ẹni tí ohun gbogbo ṣẹ̀ wà, láti mú àwọn ọmọ púpọ̀ wá sínú ògo, láti ṣe balógun ìgbàlà wọn ni àṣepé nípa ìjìyà.
59004001	Sin	Níbo ni ogun ti wá, níbo ni ìjà sì ti wá láàrín yín? Ìfẹ́kúfẹ̀ẹ́ ara yín ha kọ́ ni tí ó ń jagun nínú àwọn ẹ̀yà ara yín bí?
46005001	Sin	Ìròyìn rẹ ń tàn kalẹ̀ pé ìwà àgbèrè wa láàrín yín, irú àgbèrè tí a kò tilẹ̀ gbúròó rẹ̀ láàrín àwọn aláìkọlà pé, ẹnìkan nínú yín ń fẹ́ ìyàwó baba rẹ̀.
46010013	Faith	Kò sí ìdánwò kan tí ó ti bá yín, bí kò ṣe irú èyí tí ó mọ níwọ̀n fún ènìyàn, ṣùgbọ́n olódodo ni Ọlọ́run, ẹni ti kì yóò jẹ́ kí á dán an yín wò ju bí ẹ̀yin ti le gbà, ṣùgbọ́n tí yóò sì ṣe ọ̀nà àbáyọ pẹ̀lú nínú ìdánwò náà, kí ẹ̀yin ba à lè faradà á.
44020029	Violence	Nítorí tí èmi mọ̀ pé, lẹ́yìn lílọ mi, ìkookò búburú yóò wọ àárín yín, yóò sì tú agbo ká.
53001004	Faith	Nítorí náà, àwa tìkára wa ń fi yín ṣògo nínú ìjọ Ọlọ́run, nítorí sùúrù àti ìgbàgbọ́ yín nínú gbogbo inúnibíni àti wàhálà yín tí ẹ̀yin náà ń fi ara dà.
62004012	Faith	Ẹnikẹ́ni kò ri Ọlọ́run nígbà kan rí. Bí àwa bá fẹ́ràn ara wa, Ọlọ́run ń gbé inú wa, a sì mú ìfẹ́ rẹ̀ pé nínú wa.
48001001	Description	Paulu, aposteli tí a rán kì í ṣe láti ọ̀dọ̀ ènìyàn wá, tàbí nípa ènìyàn, ṣùgbọ́n nípa Jesu Kristi àti Ọlọ́run Baba, ẹni tí ó jí i dìde kúrò nínú òkú.
58012003	Recommendation	Máa ro ti ẹni tí ó faradà irú ìsọ̀rọ̀-òdì yìí láti ọ̀dọ̀ àwọn ẹlẹ́ṣẹ̀ si ara rẹ̀, kí ẹ má ba á rẹ̀wẹ̀sì ni ọkàn yín, kí àárẹ̀ si mu yín.
45006005	Faith	Nítorí pé ẹ̀yin ti di ọ̀kan ṣoṣo pẹ̀lú rẹ̀, àti pé ẹ kú pẹ̀lú rẹ̀, nígbà tí òun kú. Nísinsin yìí, ẹ ń pín ìyè tuntun rẹ̀, ẹ̀yin yóò sì jí dìde gẹ́gẹ́ bí òun náà ti jí dìde.
45015010	Recommendation	Ó sì tún wí pé, “Ẹ̀yin Kèfèrí, ẹ ma yọ̀, pẹ̀lú àwọn ènìyàn rẹ̀.”
54004001	Sin	Nísinsin yìí, èmi ń tẹnumọ́ ọ́ pé ní ìgbà ìkẹyìn àwọn mìíràn yóò kúrò nínú ìgbàgbọ́, wọn yóò máa fiyèsí àwọn ẹ̀mí tí ń tannijẹ, àti ẹ̀kọ́ àwọn ẹ̀mí èṣù.
56003001	Recommendation	Rán àwọn ènìyàn náà létí láti máa tẹríba fún ìjọba àti àwọn aláṣẹ. Kí wọn ṣe ìgbọ́ràn nígbà gbogbo, kí wọn sì múra fún iṣẹ́ rere gbogbo.
61003005	Sin	Nítorí èyí ni wọ́n mọ̀ ọ́n mọ̀ ṣe àìfẹ́ ẹ́ mọ̀ pé nípa ọ̀rọ̀ Ọlọ́run ni àwọn ọ̀run ti wà láti ìgbà àtijọ́ àti tí ilẹ̀ yọrí jáde nínú omi, tí ó sì dúró nínú omi.
60003018	Grace	Nítorí tí Kristi pẹ̀lú jìyà lẹ́ẹ̀kan nítorí ẹ̀ṣẹ̀ wa, olóòótọ́ fún àwọn aláìṣòótọ́, kí a lè mú wa dé ọ̀dọ̀ Ọlọ́run, ẹni tí a pa nínú ara, ṣùgbọ́n tí a sọ di ààyè nínú ẹ̀mí.
61002021	Sin	Nítorí ìbá sàn fún wọn, kí wọn má mọ́ ọ̀nà òdodo, jù pé lẹ́yìn tí wọ́n mọ̀ ọ́n tán, kí wọn yípadà kúrò nínú òfin mímọ́ tí a fi fún wọn.
53003006	Recommendation	Ní orúkọ Jesu Kristi Olúwa wa, àwa pàṣẹ fún un yín ará, pé kí ẹ yẹra fún gbogbo àwọn arákùnrin yín tí ń ṣe ìmẹ́lẹ́, tí kò sì gbé ní ìbámu pẹ̀lú ẹ̀kọ́ tí ẹ gbà ní ọ̀dọ̀ wa.
45005012	Sin	Nítorí gẹ́gẹ́ bí ẹ̀ṣẹ̀ ti tipa ọ̀dọ̀ ènìyàn kan wọ ayé, àti ikú nípa ẹ̀ṣẹ̀ bẹ́ẹ̀ ni ikú sì kọjá sórí ènìyàn gbogbo, láti ọ̀dọ̀ ẹni tí gbogbo ènìyàn ti dẹ́ṣẹ̀.
58011033	Faith	àwọn ẹni nípasẹ̀ ìgbàgbọ́ tiwọn ṣẹ́gun ilẹ̀ ọba, tí wọn ṣiṣẹ́ òdodo, tiwọn gba ìlérí, tiwọn dí àwọn kìnnìún lénu,
47004009	Faith	A ń ṣe inúnibíni sí wa, ṣùgbọ́n a kò kọ̀ wá sílẹ̀; a ń rẹ̀ wá sílẹ̀ ṣùgbọ́n a kò pa wá run.
59004004	Sin	Ẹ̀yin panṣágà ọkùnrin, àti panṣágà obìnrin, ẹ kò mọ̀ pé ìbárẹ́ ayé ìṣọ̀tá Ọlọ́run ni? Nítorí náà ẹni tí ó bá fẹ́ láti jẹ́ ọ̀rẹ́ ayé di ọ̀tá Ọlọ́run.
44016006	Description	Wọ́n sì la agbègbè Frigia já, àti Galatia, nítorí tí Ẹ̀mí Mímọ́ kọ̀ fún wọn láti sọ ọ̀rọ̀ náà ni Asia.
45010006	Faith	Ṣùgbọ́n òdodo tí í ṣe ìgbàgbọ́ wí pé, “Má ṣe wí ni ọkàn rẹ̀ pé, ‘Ta ni yóò gòkè lọ si ọ̀run?’ ” (èyí ni, láti mú Kristi sọ̀kalẹ̀),
66016002	Violence	Èkínní sì lọ, ó sì tú ago tirẹ̀ sí orílẹ̀ ayé: egbò kíkẹ̀ tí ó sì díbàjẹ́ sì dá àwọn ènìyàn tí ó ní àmì ẹranko náà, àti àwọn tí ń foríbalẹ̀ fún àwòrán rẹ̀.
66005008	Description	Nígbà tí ó sì gba ìwé náà, àwọn ẹ̀dá alààyè mẹ́rin náà, àti àwọn àgbà mẹ́rìnlélógún náà wólẹ̀ níwájú Ọ̀dọ́-àgùntàn náà, olúkúlùkù wọn mú ohun èlò orin olókùn kan lọ́wọ́, àti ago wúrà tí ó kún fún tùràrí tí i ṣe àdúrà àwọn ènìyàn mímọ́.
62005001	Faith	Olúkúlùkù ẹni tí ó bá gbàgbọ́ pé Jesu ni Kristi, a bí i nípa ti Ọlọ́run: àti olúkúlùkù ẹni tí ó fẹ́ràn. Ẹni tí ó bi nì, ó fẹ́ràn ẹni tí a bí nípasẹ̀ rẹ̀ pẹ̀lú.
48005026	Recommendation	Ẹ má ṣe jẹ́ kí a máa ṣe ògo asán, kí a má mú ọmọnìkejì wa bínú, kí a má ṣe ìlara ọmọnìkejì wa.
54005001	Recommendation	Má ṣe bá àgbàlagbà ọkùnrin wí, ṣùgbọ́n kí ó máa gbà á níyànjú bí i baba; àwọn ọ̀dọ́mọkùnrin bí arákùnrin.
60002012	Recommendation	Kí ìwà yín láàrín àwọn aláìkọlà dára; pé, bí wọ́n ti ń sọ̀rọ̀ yín bí olùṣe búburú, nípa iṣẹ́ rere yín tí wọn ó máa kíyèsi, kí wọ́n lè máa yin Ọlọ́run lógo lọ́jọ́ ti òun ba bẹ̀ wá wò.
50003006	Sin	ní ti ìtara, èmi ń ṣe inúnibíni sí ìjọ; ní ti òdodo tí ó wà nínú òfin, mo jẹ́ aláìlẹ́gàn.
43004052	Description	Nígbà náà ni ó béèrè wákàtí tí ara rẹ̀ bẹ̀rẹ̀ sí í yá lọ́wọ́ wọn, wọ́n sì wí fún un pé, “Ní àná, ní wákàtí keje ni ibà náà fi í sílẹ̀.”
43019031	Violence	Nítorí ó jẹ́ ọjọ́ ìpalẹ̀mọ́, kí òkú wọn má ba à wà lórí àgbélébùú ní ọjọ́ ìsinmi (nítorí ọjọ́ ńlá ni ọjọ́ ìsinmi náà), nítorí náà, àwọn Júù bẹ Pilatu pé kí a ṣẹ́ egungun itan wọn, kí a sì gbé wọn kúrò.
43019012	Description	Nítorí èyí, Pilatu ń wá ọ̀nà láti dá a sílẹ̀, ṣùgbọ́n àwọn Júù kígbe, wí pé, “Bí ìwọ bá dá ọkùnrin yìí sílẹ̀, ìwọ kì í ṣe ọ̀rẹ́ Kesari: ẹnikẹ́ni tí ó bá ṣe ara rẹ̀ ní ọba, ó sọ̀rọ̀-òdì sí Kesari.”
43014001	Faith	“Ẹ má ṣe jẹ́ kí ọkàn yín kí ó dàrú, ẹ gba Ọlọ́run gbọ́, kí ẹ sì gbà mí gbọ́ pẹ̀lú.
50001028	Faith	Kí ẹ má sì jẹ́ ki àwọn ọ̀tá dẹ́rùbà yin ni ohunkóhun: èyí tí í ṣe àmì tí ó dájú pé a ó pa wọ́n run, ṣùgbọ́n Ọlọ́run tìkára rẹ̀ ni yóò gbà yin là.
43015016	Grace	Kì í ṣe ẹ̀yin ni ó yàn mí, ṣùgbọ́n èmi ni ó yàn yín, mo sì fi yín sípò, kí ẹ̀yin kí ó lè lọ, kí ẹ sì so èso, àti kí èso yín lè dúró; kí ohunkóhun tí ẹ bá béèrè lọ́wọ́ Baba ní orúkọ mi, kí ó lè fi í fún yín.
58011004	Faith	Nípa ìgbàgbọ́ ní Abeli rú ẹbọ sí Ọlọ́run tí ó sàn ju ti Kaini lọ, nípa èyí tí a jẹ́rìí rẹ̀ pe olódodo ni, Ọlọ́run sí ń jẹ́rìí ẹ̀bùn rẹ̀, àti nípa rẹ̀ náà, bí o ti jẹ́ pé o ti kú, síbẹ̀ o ń fọhùn.
46004001	Recommendation	Nítorí náà, ṣe ló yẹ kí ènìyàn máa wò wá gẹ́gẹ́ bí ìránṣẹ́ àti ìríjú tí a fún ni oore-ọ̀fẹ́ láti mọ Kristi tí a fún ní oore-ọ̀fẹ́ láti mọ àwọn ohun ìjìnlẹ̀ Ọlọ́run.
66006013	Description	àwọn ìràwọ̀ ojú ọ̀run sì ṣubú sílẹ̀ gẹ́gẹ́ bí igi ọ̀pọ̀tọ́ tí ń rẹ̀ àìgbó èso rẹ̀ dànù, nígbà tí ẹ̀fúùfù ńlá bá mì í.
46010014	Recommendation	Nítorí náà, ẹ̀yin olùfẹ́ ọ̀wọ́n, ẹ sá fún ìbọ̀rìṣà.
45012021	Recommendation	Má ṣe jẹ́ kí búburú ṣẹ́gun rẹ, ṣùgbọ́n fi rere ṣẹ́gun búburú.
55002014	Recommendation	Nǹkan wọ̀nyí ni ki ó máa rán wọn létí. Máa kìlọ̀ fún wọn níwájú Olúwa pé, ki wọn ó yẹra kúrò nínú jíjiyàn ọ̀rọ̀ tí kò léèrè, bí kò ṣe ìparun fún àwọn tí ń gbọ́.
59004008	Recommendation	Ẹ súnmọ́ Ọlọ́run, òun ó sì súnmọ́ yín. Ẹ wẹ ọwọ́ yín mọ́, ẹ̀yin ẹlẹ́ṣẹ̀; ẹ sì ṣe ọkàn yín ní mímọ́, ẹ̀yin oníyèméjì.
59002009	Sin	Ṣùgbọ́n bí ẹ̀yin bá ń ṣe ojúsàájú ènìyàn, ẹ̀yin ń dẹ́ṣẹ̀, a sì ń dá yín lẹ́bi nípa òfin bí arúfin.
52004007	Grace	Nítorí Ọlọ́run kò pè wá sínú ìwà èérí, bí kò ṣe sínú ìgbé ayé mímọ́.
45001018	Sin	Ṣùgbọ́n Ọlọ́run fi ìbínú rẹ̀ hàn láti ọ̀run wá sí gbogbo àìwà-bí-Ọlọ́run àti gbogbo àìṣòdodo ènìyàn, àwọn tí ń fi ìwà búburú dènà ìmọ̀ òtítọ́ lọ́dọ̀ ènìyàn.
62004007	Faith	Olùfẹ́, ẹ jẹ́ kí a fẹ́ràn ara wa, nítorí ìfẹ́ ti ọ̀dọ̀ Ọlọ́run wá; àti gbogbo ẹni tí ó bá ní ìfẹ́, a bí i nípa ti Ọlọ́run, ó sì mọ Ọlọ́run.
62002009	Sin	Ẹni tí ó bá sì wí pé òun ń wà nínú ìmọ́lẹ̀, tí ó sì kórìíra arákùnrin rẹ̀ sì ń bẹ nínú òkùnkùn.
60004014	Grace	Bí a bá gàn yín nítorí orúkọ Kristi, ẹni ìbùkún ni yín: nítorí Ẹ̀mí Ògo àti ti Ọlọ́run bà lé yín.
44021019	Grace	Nígbà tí ó sì kí wọn tan, ó ròyìn lẹ́sẹẹsẹ ohun gbogbo tí Ọlọ́run ṣe láàrín àwọn aláìkọlà nípa iṣẹ́ ìránṣẹ́ rẹ̀.
43008046	Sin	Ta ni nínú yín tí ó ti dá mi lẹ́bi ẹ̀ṣẹ̀? Bí mo bá ń ṣọ òtítọ́, èéṣe tí ẹ̀yin kò fi gbà mí gbọ́?
58010017	Grace	Ó tún sọ wí pé: “Ẹ̀ṣẹ̀ wọn àti àìṣedéédéé wọn lèmi kì yóò sì rántí mọ́.”
46001005	Grace	Nítorí nínú rẹ̀ ni a ti sọ yín di ọlọ́rọ̀ nínú ọ̀rọ̀ sísọ yín gbogbo àti nínú ìmọ̀ yín gbogbo.
45015030	Recommendation	Èmí rọ̀ yín, ẹ̀yin arákùnrin àti arábìnrin, nítorí Olúwa wa Jesu Kristi, àti nítorí ìfẹ́ Ẹ̀mí, kí ẹ̀yin kí ó kún mi láti bá mi làkàkà nínú àdúrà yín sí Ọlọ́run fún mi.
43007020	Violence	Ìjọ ènìyàn dáhùn, wọ́n sì wí pé, “Ìwọ ní ẹ̀mí èṣù, ta ni ń wá ọ̀nà láti pa ọ́?”
45003025	Grace	Ẹni tí Ọlọ́run ti gbé kalẹ̀ láti jẹ́ ètùtù nípa ìgbàgbọ́ nípa ẹ̀jẹ̀ rẹ̀, láti fi òdodo rẹ̀ hàn nítorí ìdáríjì àwọn ẹ̀ṣẹ̀ tí ó ti kọjá, nínú ìpamọ́ra Ọlọ́run,
43018018	Description	Àwọn ọmọ ọ̀dọ̀ àti àwọn aláṣẹ sì dúró níbẹ̀, àwọn ẹni tí ó ti dáná nítorí ti òtútù mú, wọ́n sì ń yáná, Peteru sì dúró pẹ̀lú wọn, ó ń yáná.
49006011	Recommendation	Ẹ gbé gbogbo ìhámọ́ra Ọlọ́run wọ̀, kí ẹ̀yin lè kọ ojú ìjà sí àrékérekè èṣù.
43013037	Faith	Peteru wí fún un pé, “Olúwa èéṣe tí èmi kò fi le tọ̀ ọ́ lẹ́hìn nísinsin yìí? Èmi ó fi ẹ̀mí mi lélẹ̀ nítorí rẹ.”
50004007	Faith	Àti àlàáfíà Ọlọ́run, tí ó ju ìmòye gbogbo lọ, yóò pa ọkàn àti èrò yín mọ nínú Kristi Jesu.
59003009	Faith	Òun ni àwa fi ń yin Olúwa àti Baba, òun ni a sì fi ń bú ènìyàn tí a dá ní àwòrán Ọlọ́run.
46005010	Sin	Nígbà tí mo sọ bẹ́ẹ̀ ń kò sọ̀rọ̀ nípa àwọn tí ayé yìí, tí wọ́n ń gbé ìgbé ayé wọn nínú ẹ̀ṣẹ̀ àgbèrè, àti àwọn olójúkòkòrò tí ń rẹ́ ni jẹ, àwọn olè àti àwọn abọ̀rìṣà. Nítorí ó dájú pé ẹ̀yin gbọdọ̀ kúrò nínú ayé yìí láti yẹra fún wọn.
44026009	Sin	“Èmi tilẹ̀ rò nínú ará mi nítòótọ́ pé, ó yẹ ki èmi ṣe ọ̀pọ̀lọpọ̀ ohun lòdì sí orúkọ Jesu tí Nasareti.
61002014	Sin	Ojú wọn kún fún panṣágà, wọn kò sì dẹ́kun ẹ̀ṣẹ̀ dídá; wọ́n ń tan àwọn tí ọkàn kò fi ẹsẹ̀ múlẹ̀ jẹ; àwọn tí wọ́n ní ọkàn tí ó ti yege nínú wọ̀bìà, ọmọ ègún ni wọ́n.
43010012	Description	Ṣùgbọ́n alágbàṣe, tí kì í ṣe olùṣọ́-àgùntàn, ẹni tí àwọn àgùntàn kì í ṣe tirẹ̀, ó rí ìkookò ń bọ̀, ó sì fi àgùntàn sílẹ̀, ó sì fọ́n wọn ká kiri.
59001019	Recommendation	Kí ẹ mọ èyí, ẹ̀yin ará mi olùfẹ́; jẹ́ kí olúkúlùkù ènìyàn kí ó máa yára láti gbọ́, kí ó lọ́ra láti fọhùn, kí ó si lọ́ra láti bínú;
46009014	Recommendation	Gẹ́gẹ́ bẹ́ẹ̀ ni Olúwa ti fi àṣẹ lélẹ̀ pé, àwọn tí ń wàásù ìyìnrere kí wọn sì máa jẹ́ nípa ìyìnrere.
43012046	Grace	Èmi ni ìmọ́lẹ̀ tí ó wá sí ayé, kí ẹnikẹ́ni tí ó bá gbà mí gbọ́ má ṣe wà nínú òkùnkùn.
43005014	Description	Lẹ́yìn náà, Jesu rí i nínú tẹmpili ó sì wí fún un pé, “Wò ó, a mú ọ láradá: má ṣe dẹ́ṣẹ̀ mọ́, kí ohun tí ó burú ju èyí lọ má ba à bá ọ!”
46016014	Recommendation	Ẹ máa ṣe ohun gbogbo nínú ìfẹ́.
43014015	Recommendation	“Bí ẹ̀yin bá fẹ́ràn mi, ẹ ó pa òfin mi mọ́.
58012025	Recommendation	Kíyèsi i, kí ẹ má ṣe kọ̀ ẹni tí ń kìlọ̀. Nítorí bí àwọn wọ̀nyí kò bá bọ́ nígbà tí wọn kọ̀ ẹni ti ń kìlọ̀ ni ayé, mélòó mélòó ni àwa kì yóò bọ́, bí àwa ba pẹ̀yìndà sí ẹni tí ń kìlọ̀ láti ọ̀run wá,
48004008	Sin	Tẹ́lẹ̀tẹ́lẹ̀, nígbà tí ẹ̀yin kò tí i mọ Ọlọ́run, ẹ̀yin ti ṣe ẹrú fún àwọn tí kì í ṣe Ọlọ́run nípa ìṣẹ̀dá.
44003026	Grace	Nígbà ti Ọlọ́run jí Jesu Ọmọ rẹ̀ dìde, ó kọ́ rán an sí i yín láti bùkún fún un yín, nípa yíyí olúkúlùkù yín padà kúrò nínú ìwà búburú rẹ̀.”
44010039	Violence	“Àwa sì ni ẹlẹ́rìí gbogbo ohun tí ó ṣe, ní ilẹ̀ àwọn Júù, àti ni Jerusalẹmu. Ẹni tí wọ́n pa nípa gbígbékọ́ sí orí igi.
46001010	Recommendation	Mo bẹ̀ yín ẹ̀yin ara, ní orúkọ Olúwa wa Jesu Kristi, pé kí gbogbo yín fohùn ṣọ̀kan kí ó máa ṣe sí ìyapa láàrín yín, àti pé kí a lè ṣe yín pé ní inú àti ìmọ̀ kan náà.
51001021	Sin	Ẹ̀yin ya ara yín nípá kúrò lọ́dọ̀ Ọlọ́run nígbà kan rí, ẹ jẹ́ ọ̀tá nínú ọkàn yín nítorí ìwà búburú yín.
55002022	Recommendation	Máa sá fún ìfẹ́kúfẹ̀ẹ́ èwe, sì máa lépa òdodo, ìgbàgbọ́, ìfẹ́, àlàáfíà, pẹ̀lú àwọn tí ń ké pe Olúwa láti inú ọkàn funfun wá.
51003001	Faith	Níwọ́n ìgbà tí a ti jí yín dìde pẹ̀lú Kristi ẹ máa ṣàfẹ́rí àwọn nǹkan tí ń bẹ lókè, níbi tí Kristi gbé wà tí ó jókòó ní ọwọ́ ọ̀tún Ọlọ́run.
66008007	Violence	Èkínní sì fọn ìpè tirẹ̀, Yìnyín àti iná, tí o dàpọ̀ pẹ̀lú ẹ̀jẹ̀, sì jáde, a sì dà wọ́n sórí ilẹ̀ ayé: ìdámẹ́ta ilẹ̀ ayé si jóná, ìdámẹ́ta àwọn igi sì jóná, àti gbogbo koríko tútù sì jóná.
66011017	Faith	wí pé: “Àwa fi ọpẹ́ fún ọ, Olúwa Ọlọ́run, Olódùmarè, tí ń bẹ, tí ó sì ti wà, nítorí pé ìwọ ti gba agbára ńlá rẹ̀, ìwọ sì ti jẹ ọba.
43004010	Grace	Jesu dáhùn, ó sì wí fún un pé, “Ìbá ṣe pé ìwọ mọ ẹ̀bùn Ọlọ́run, àti ẹni tí ó wí fún ọ pé, ‘Fún mi ni omi mu’, ìwọ ìbá sì ti béèrè lọ́wọ́ rẹ̀, òun ìbá ti fi omi ìyè fún ọ.”
51003004	Grace	Nígbà tí Kristi, ẹni tí í ṣe ìyè yín yóò farahàn, nígbà náà ni ẹ̀yin pẹ̀lú yóò farahàn pẹ̀lú rẹ̀ nínú ògo.
43020031	Faith	Ṣùgbọ́n wọ̀nyí ni a kọ, kí ẹ̀yin lè gbàgbọ́ pé Jesu ní í ṣe Kristi náà, Ọmọ Ọlọ́run, àti pé nípa gbígbàgbọ́, kí ẹ̀yin lè ní ìyè ní orúkọ rẹ̀.
62004006	Faith	Ti Ọlọ́run ni àwa: ẹni tí ó bá mọ Ọlọ́run, ó ń gbọ́ tiwa; ẹni tí kì í ṣe ti Ọlọ́run kò ni gbọ́ ti wa. Nípa èyí ni àwa mọ ẹ̀mí òtítọ́, àti ẹ̀mí èké.
65001012	Description	Àwọn wọ̀nyí ní ó jẹ́ àbàwọ́n nínú àsè ìfẹ́ yín, nígbà tí wọ́n ń bá yín jẹ àsè, àwọn olùṣọ́-àgùntàn ti ń bọ́ ara wọn láìbẹ̀rù. Wọ́n jẹ́ ìkùùkuu láìrọ òjò, tí a ń ti ọwọ́ afẹ́fẹ́ gbá kiri; àwọn igi aláìléso ní àkókò èso, wọ́n kú lẹ́ẹ̀méjì, a sì fà wọ́n tú tigbòǹgbò tigbòǹgbò.
44005015	Description	Tó bẹ́ẹ̀ tí wọn ń gbé àwọn abirùn jáde sí òpópónà, tí wọn ń tẹ́ wọn sí orí ibùsùn àti àkéte kí òjìji Peteru ba à le gba orí ẹlòmíràn nínú wọn bí ó bá ti ń kọjá lọ.
49006016	Faith	Ní àfikún, ẹ mú àpáta ìgbàgbọ́, nípa èyí tí ẹ̀yin lè máa fi paná gbogbo ọfà iná ẹni ibi náà.
51003023	Recommendation	Ohunkóhun tí ẹ̀yin bá ń ṣe, ẹ máa fi tọkàntọkàn ṣe é fún Olúwa, kí í ṣe fún ènìyàn;
58012016	Recommendation	Kí o má bá à si àgbèrè kan tàbí aláìwà-bí-Ọlọ́run bi Esau, ẹni tí o tìtorí òkèlè oúnjẹ kan ta ogún ìbí rẹ̀.
43018040	Sin	Nítorí náà gbogbo wọn tún kígbe pé, “Kì í ṣe ọkùnrin yìí, bí kò ṣe Baraba!” Ọlọ́ṣà sì ni Baraba.
