43012023	Description	Bubiʼë didzaʼ Jesús, rëʼ légaquiëʼ: ―Chizóa idxín dza gátiaʼ nedaʼ, Bönniʼ Guljëʼ Bönachi, huöjaʼ xilatjaʼ yehuaʼ yubá.
45002022	Sin	Rnnaliʼ caʼ: “Bitiʼ gunuʼ dul-laʼ le riguitsaj xibá que yöl-laʼ nutsaga naʼ.” ¿Naruʼ rúntsaliʼ libíʼiliʼ dul-laʼ le riguitsaj xibá que yöl-laʼ nutsaga naʼ? Libíʼiliʼ bitiʼ riléʼeliʼ dxiʼa yuguʼ budóʼ guiö́j budóʼ yaga. ¿Naruʼ ribántsaliʼ le dzöʼö lu yudoʼ quéguequi?
45007008	Sin	Cateʼ bidxín quiaʼ xibá naʼ, guca bëʼ le naca dul-laʼ naʼ run dxin lu idútë le nacaʼ, ateʼ ben ga gúquibeʼedaʼ rizë́ ládxaʼa yúguʼtë le ruáʼ döʼ. Ga bitiʼ ridxini xibá naʼ, bitiʼ naca bëʼ le naca dul-laʼ.
44026017	Grace	Usöláʼ liʼ lu náʼagaquiëʼ bönniʼ uládz quiuʼ, en lu náʼagaquiëʼ bönniʼ izáʼa, lógaca nupa niʼ risö́l-laʼa liʼ naʼa.
56003003	Sin	Lëscaʼ rëʼu, zíʼalö gúcaruʼ yuguʼ bönniʼ bitiʼ taʼyéajniʼinëʼ, en gudáʼbagaʼruʼ Dios. Gudaruʼ nanítiruʼ, en gúcaruʼ ca nupa nadóʼogaca, tuʼ benruʼ le guzë́ ládxiʼruʼ le ruáʼ döʼ, en iaʼbal-la le guyaza ládxiʼruʼ. Benruʼ caʼ le ruáʼ döʼ, en buzxéʼeruʼ luzáʼaruʼ. Bitiʼ bilaʼléʼe bönachi rëʼu dxiʼa, ateʼ rëʼu bitiʼ biléʼeruʼ dxiʼa luzáʼaruʼ turuʼ iaʼturuʼ.
54005021	Recommendation	Niʼa queëʼ Xanruʼ Dios, en Xanruʼ Jesucristo, en niʼa quégaquiëʼ gubáz láʼayi rö queëʼ, rinná béʼedaʼ liʼ gunuʼ ca taʼnná didzaʼ ni. Tuz ca ral-laʼ uchiʼa usörö́uʼ yúguʼtë bönachi, en bitiʼ gunuʼ bal tuzëʼ bönniʼ.
58010035	Recommendation	Naʼa, bitiʼ ucáʼanaliʼ lë naʼ runliʼ löza, le nachë́ʼ tu le zxön ubiʼë Dios queë́liʼ.
46004002	Faith	Yuguʼ bönniʼ, Dios nudödëʼ lu náʼagaquiëʼ uluʼgunëʼ dxin le nequi queëʼ, run bayudxi ilunëʼ idú dxiʼa le tunëʼ.
44009043	Description	Bugáʼanëʼ Pedro yödzö Jope naʼ zián dza lu yuʼu lidxëʼ Simón, bönniʼ runëʼ tsahuiʼ guídi zxa bëdxi.
46003016	Grace	¿Naruʼ cabí nö́ziliʼ naca cázaliʼ yudoʼ queëʼ Dios, ateʼ zoëʼ Dios Böʼ Láʼayi icja ládxiʼdoʼoliʼ?
58010019	Faith	Naʼa, yuguʼ böchiʼ luzáʼadoʼ, idú ládxiʼruʼ gaca idxinruʼ lahuëʼ Dios caz, niʼa que xichönëʼ Jesucristo.
43008021	Sin	Leyúbölö Jesús rëʼ légaquiëʼ, rnnëʼ: ―Uzáʼa yödzölió ni, ateʼ uguíljaliʼ nu usölá libíʼiliʼ, pero ugáʼana dul-laʼ nabágaʼliʼ, en gátiliʼ. Ga tsejaʼ nedaʼ, bitiʼ gaca guídaliʼ.
51003012	Recommendation	Dios nadxíʼinëʼ libíʼiliʼ, en gurö́ëʼ libíʼiliʼ para guéquiliʼ quez queëʼ. Que lë ni naʼ, ral-laʼ: Güíʼi ládxiʼliʼ luzáʼaliʼ, en gácaliʼ dxiʼi ladxiʼ, en nöxaj ladxiʼ, en cuidiʼ ladxiʼ, en cö́zaliʼ zxön ladxiʼ.
43012026	Faith	Channö rë́ʼënëʼ nu bönniʼ gunëʼ xichinaʼ, ral-laʼ tëʼë nedaʼ bönniʼ naʼ, ateʼ ga niʼ tsöjsóaʼ nedaʼ, niʼ tsöjsóëʼ caʼ bönniʼ naʼ runëʼ xichinaʼ. Channö runëʼ xichinaʼ nu bönniʼ, Xuzaʼ Dios gunëʼ bal bönniʼ naʼ.
54003004	Description	Ral-laʼ gáquiëʼ bönniʼ rinná béʼenëʼ dxiʼa bönachi nacuáʼ lidxëʼ. Ral-laʼ ilunbiʼ zxíʼinëʼ ca rnna xtídzëʼë lu yöl-laʼ run bal xúzgacabiʼ.
52005011	Recommendation	Que lë ni naʼ ral-laʼ utípaliʼ ládxiʼliʼ tuliʼ iaʼtuliʼ, en gunliʼ tsutsu tuliʼ iaʼtuliʼ ca naʼ chirunliʼ.
62003011	Recommendation	Lë ni naca didzaʼ biyö́niliʼ dza niʼte, le rnna: Ral-laʼ idxíʼiruʼ luzáʼaruʼ turuʼ iaʼturuʼ.
46007026	Recommendation	Tuʼ taca zián le raca queë́ruʼ dza ni zóaruʼ naʼa, runi nedaʼ gácarö dxiʼa channö uluʼgáʼanëʼ yúguʼtë bönniʼ ca nácagaquiëʼ naʼa.
43003001	Description	Nicodemo, tu bönniʼ yudoʼ fariseo, nabábalenëʼ yuguʼ bönniʼ judío unná bëʼ.
59002025	Description	Lëscaʼ caní guca queë́nu Rahab, nigula bë́ʼënu bönachi lataj. Lëscaʼ naca bëʼ burúajnu dxiʼa tuʼ zoa tu le tsahuiʼ bennu, lë naʼ bennu cateʼ niʼ bennu bönniʼ tuʼyulan bal, en gúcalennu légaquiëʼ para buluʼguélëʼë yöjhuö́jgaquiëʼ nöza yúbölö.
54002015	Faith	pero ulanu nu nigula ruzóanu-biʼ bíʼidoʼ channö gúnticaʼsinu ca röjlö́z le réajlëʼëruʼ Dios, en yöl-laʼ nadxíʼi, en channö gácanu idú dxiʼa, en idú ladxiʼ.
44013017	Grace	Xanruʼ Dios, Nu taʼyéaj ládxiʼgaca bönachi Israel, gurö́ cazëʼ xuz xtóʼoruʼ, en benëʼ ga gulaʼyándëʼë cateʼ niʼ nácagaquiëʼ bönniʼ ziʼtuʼ luyú Egipto. Len yöl-laʼ huáca zxön queëʼ bubéajëʼ légaquiëʼ luyú niʼ.
44015008	Grace	Dios, Nu nunbëʼ caz le yuʼu icja ládxiʼdoʼgaca bönachi, buzóëʼ le naca bëʼ runëʼ légaquiëʼ bal, gusö́l-lëʼë Dios Böʼ Láʼayi quégaquiëʼ, ca naʼ gusö́l-lëʼë Lëʼ queë́ruʼ.
59002011	Sin	Lë cazëʼ Dios gunnë́ʼ: “Bitiʼ gunuʼ dul-laʼ le riguitsaj xibá que yöl-laʼ nutsaga naʼ”, en gunnë́ʼ caʼ: “Bitiʼ gútiuʼ bönachi.” Naʼa, channö cabí runuʼ dul-laʼ le riguitsaj xibá que yöl-laʼ nutsaga naʼ, pero rútiuʼ bönachi, nabáguʼu xíguiaʼ que idútë xibá queëʼ Dios.
43010028	Grace	Nedaʼ runödzjaʼ yöl-laʼ naʼbán idú quégacabaʼ, ateʼ bitiʼ caʼ ilaʼnítibaʼ, ateʼ cuntu nu sequiʼ ubéaj légacabaʼ lu naʼa nedaʼ.
45016020	Grace	Dios, Nu run ga zóaruʼ dxi ladxiʼ, siʼ gunëʼ ga ucúl-laliʼ Satanás, tuʼ xihuiʼ. Rinábidaʼ-nëʼ Xanruʼ Jesucristo uzáʼ ládxëʼë queë́liʼ le gácalen libíʼiliʼ.
55003005	Sin	Uluʼluíʼi cuíngaquiëʼ ca bönniʼ núnbëʼgaquiëʼ Dios. Ilaʼdáʼbaguëʼë le ruzáʼ ládxëʼë Dios queë́ruʼ. Gucuíta ga nacuáʼ bönachi caní.
45012005	Description	lëscaʼ caní naca queë́ruʼ. Sal-laʼ zianruʼ zóaruʼ, nácaruʼ ca tuz le naca cázaruʼ tuʼ nácaruʼ tuz len Cristo, ateʼ que lë ni naʼ yúguʼtëruʼ nácaruʼ tuz turuʼ len iaʼturuʼ.
56003008	Faith	Didzaʼ idútë li lë ni nuzúajaʼ lu guichi. Rë́ʼëndaʼ usédideʼenuʼ yuguʼ bönniʼ niʼ yuguʼ lë ni para iluíʼi ládxiʼgaquiëʼ ilúnticaʼsëʼ le naca dxiʼa tuʼ taʼyéajlëʼë Dios. Lë ni naca dxiʼa, en nácadaʼ lesacaʼ ilaʼzíʼ lu náʼagaca yúguʼtë bönachi.
59002023	Faith	Caní guca lë naʼ nazúaj lu guichi láʼayi le rnna: “Abraham guyéajlëʼë Dios, ateʼ Dios biléʼenëʼ lë naʼ benëʼ ca tu le ben ga böáquiëʼ Abraham tsahuiʼ.” Que lë ni naʼ guzxíʼi lëʼ: “Luzë́ʼë Dios.”
59002001	Faith	Böchiʼ luzáʼadoʼ, channö réajlëʼëliʼ Xanruʼ Jesucristo, Nu nácatërö lo, bitiʼ ral-laʼ utsáʼaliʼ ca gunliʼ bal tu tu bönachi.
45003013	Sin	Lubáʼagaquiëʼ nácagaca ca yeru ba nayáljagaca. Len yöl-laʼ rinnësö quégaquiëʼ taʼzíʼ yéʼenëʼ luzáʼagaquiëʼ. Didzaʼ rirúaj ruáʼagaquiëʼ naca ca le yudzu láyaʼbaʼ bëla síniaʼ.
49005028	Recommendation	Ral-laʼ idxíʼiliʼ-nu nigula que queë́liʼ ca naʼ nadxíʼi cuinliʼ. Nu bönniʼ nadxíʼinëʼ-nu nigula queëʼ, nadxíʼi cuinëʼ.
45009030	Faith	¿Bizxi caz innaruʼ naʼa? Yuguʼ bönniʼ bitiʼ nabábagaquiëʼ Israel chibilaʼdéliʼnëʼ nuhuöácagaquiëʼ tsahuiʼ lahuëʼ Dios, en bitiʼ gulunëʼ bayudxi uluʼhuöáquiëʼ tsahuiʼ lahuëʼ Dios, pero nuhuöácagaquiëʼ tsahuiʼ tuʼ taʼyéajlëʼë Dios.
54003009	Faith	Ral-laʼ gaca ilapa chiʼë idútë le réajlëʼëruʼ Cristo. Ral-laʼ ilaca idú dxiʼa icja ládxiʼdoʼgaquiëʼ.
54006002	Recommendation	Nupa niʼ nacuʼë xángaca taʼyéajlëʼë Cristo, bitiʼ ral-laʼ uluʼcáʼana cáʼasö légaquiëʼ tuʼ nácagaquiëʼ bö́chiʼguequi. Ral-laʼ ilunrö dxiʼa xichíngaquiëʼ tuʼ taʼyéajlëʼë Cristo, bönniʼ niʼ tuʼziʼë xibé dxin dxiʼa naʼ, tuʼ nadxíʼinëʼ Lë cazëʼ légaquiëʼ. Ca naca lë ni, busëdi bönachi nacuáʼ niʼ, en guchiza le icja nágagaquiëʼ.
45003003	Faith	Bal-lëʼ bitiʼ taʼyéajlëʼë Dios. ¿Naruʼ réquitsenuʼ bitiʼ gunëʼ Dios ca rnna xtídzëʼë tuʼ cabí taʼyéajlëʼë Lëʼ?
43019034	Violence	Níʼirö tuëʼ bönniʼ naʼ reajëʼ gudil-la bunë́ʼë yaga tuchiʼ cuita lëʼë Jesús, ateʼ laʼ birúajtë rön, en nisa.
43015012	Recommendation	Lë ni naca le reaʼ libíʼiliʼ gunliʼ: Guliʼdxíʼi luzáʼaliʼ tuliʼ iaʼtuliʼ, ca naʼ nedaʼ caʼ nadxíʼidaʼ libíʼiliʼ.
45006013	Recommendation	Bitiʼ udödi cuinliʼ lu dul-laʼ, bitiʼ gunliʼ le ruáʼ döʼ, pero guliʼdödi cuinliʼ lu nëʼë Dios tuʼ nubanliʼ lu yöl-laʼ guti, en guliʼdödi lu nëʼë idútë le naca cázaliʼ para ugúnlenëʼ le le naca dxiʼa.
58010039	Faith	Naʼa, rëʼu ni, bitiʼ nácaruʼ ca nupa tuʼhuö́aj ladxiʼ, en taʼdáʼbagaʼ Dios, en ilaʼniti, pero réajlëʼëruʼ Cristo, en nadéliʼruʼ yöl-laʼ rusölá.
45011026	Grace	Tödi naʼ gataʼ lataj uluʼlë́ʼ caʼ yúguʼtë bönniʼ Israel, ca naʼ nazúaj lu guichi láʼayi, rnna: Irúaj yödzö Sión Nu rusölá, en ugúa le ruáʼ döʼ nabágaʼgaca zxíʼini xiʼsóëʼ Jacob.
52002015	Violence	Yuguʼ bönniʼ judío naʼ gulútiëʼ Xanruʼ Jesús, en gulútiëʼ caʼ yuguʼ bönniʼ guluʼë didzaʼ uláz queëʼ Dios. Gulaʼbía ládxiʼgaquiëʼ, en buluʼláguëʼ caʼ netuʼ. Bitiʼ tunëʼ le raza ládxëʼë Dios, tuʼ cabí taʼléʼenëʼ dxiʼa yúguʼtë bönachi izáʼa.
58010026	Sin	Channö zéajlenruʼ runruʼ dul-laʼ tödi núnbëʼëruʼ le naca idútë li, bitiʼ caʼ nagáʼana bi gaca cúʼuruʼ lahuëʼ Dios le ugúa dul-laʼ.
49002006	Grace	Dios busubanëʼ rëʼu tsözxö́n len Cristo para gunëʼ ga cö́ʼöruʼ tsözxö́n len Lëʼ ga niʼ rinná bëʼë yehuaʼ yubá.
49004025	Recommendation	Que lë ni naʼ, bítiʼrö siʼ yë́ʼëliʼ. Yúguʼtëruʼ ral-laʼ güíʼilenruʼ luzáʼaruʼ didzaʼ le nácatë, tuʼ dzágaruʼ yúguʼtëruʼ idútë le naca cazëʼ Cristo.
48002005	Faith	Bitiʼ caʼ bëʼtuʼ légaquiëʼ lataj. Caní bentuʼ para gun chíʼituʼ le nácatë que le rinnë́ dxiʼa para gaca uzíʼiliʼ xibé le rinnë́ dxiʼa naʼ.
46014013	Recommendation	Que lë ni naʼ caʼ, nu ruíʼi didzaʼ yúbölö le cabí nazëda ral-laʼ ulidza Dios, en inabi Lëʼ gunnëʼ que yöl-laʼ huáca quixjöʼ le rë́ʼëni inná didzaʼ naʼ ruíʼi nu naʼ.
44009001	Violence	Niʼ ruzenëʼ bach Saulo nupa taʼyéajlëʼ Xanruʼ, gúʼunnëʼ gútiëʼ légaquiëʼ. Para gunëʼ caní bidxinëʼ lahuëʼ bixúz lo,
43017013	Description	’Naʼa udusóalenaʼ Liʼ, ateʼ tsanni ni zoaʼ yödzölió ni, ruáʼa yuguʼ didzaʼ ni para gaca idú yöl-laʼ rudzeja quégaquiëʼ ca naʼ raca quiaʼ nedaʼ yöl-laʼ rudzeja.
60004013	Recommendation	Guliʼdzéjadeʼe tuʼ dë lataj queë́liʼ gunliʼ-nëʼ tsözxö́n Cristo lu le riguíʼi rizáquëʼë Lëʼ niʼa que bönachi queëʼ para gaca udzéjaliʼ caʼ dza naʼ huödëʼ Cristo, cateʼ iléʼeliʼ yöl-laʼ zxön queëʼ.
44011006	Description	Cateʼ niʼ ruyúaʼ le para iléʼedaʼ le dxía láhuilö, biléʼegacadaʼ-baʼ böaʼ guixiʼ nacuáʼ tapa níʼagacabaʼ, yuguʼ böaʼ guixiʼ síniaʼ, en böaʼ táʼayöj lë́ʼegacabaʼ lu yu, en böaʼ zoa xíligacabaʼ.
51003008	Recommendation	Naʼa, bítiʼrö gunliʼ yuguʼ lë ni: Bítiʼrö idzáʼaliʼ, en bítiʼrö leliʼ. Bítiʼrö nu gunliʼ ziʼ, en bítiʼrö innë́ xíhuiʼliʼ. Bítiʼrö innaliʼ le ruáʼ döʼ.
44018003	Description	tuʼ naca tuz dxin tunëʼ Aquilo, en Pablo. Bugáʼanalenëʼ légaquiëʼ, ateʼ tsözxö́n gulunëʼ dxin, tunëʼ yuguʼ yuʼu guídidoʼ.
45006012	Sin	Que lë ni naʼ, bitiʼ güíʼiliʼ lataj le naca dul-laʼ, para cabí gun ga gunliʼ dul-laʼ lu le naca cázaliʼ le gati caz. Bitiʼ gunliʼ ca naca le rizë́ ládxiʼliʼ le ruáʼ döʼ, lu le naca cázaliʼ.
53003012	Recommendation	Niʼa queëʼ Xanruʼ Jesucristo ruchíʼatuʼ yuguʼ bönniʼ tunëʼ caní, en richízatuʼ icja nágagaquiëʼ ilunëʼ dxin lu yöl-laʼ riböza dxíʼadoʼ, para gaca ilahuëʼ le nequi quégacasëʼ.
44007009	Sin	’Yuguʼ xuz xtóʼoruʼ naʼ, lu yöl-laʼ ruzxéʼe quégaquiëʼ, gulútiʼë-biʼ biʼi José, bö́chiʼgaquiëʼ, lu náʼagaquiëʼ bönniʼ niʼ gulútiʼgaquiëʼ-biʼ luyú Egipto. Dios guzóalenëʼ-biʼ biʼi José naʼ
44011028	Description	Guzuínëʼ Agabo, bönniʼ dzáguiëʼ yuguʼ bönniʼ naʼ, en uláz queëʼ Dios Böʼ Láʼayi buzéajniʼinëʼ légaquiëʼ, gunnë́ʼ: ―Siʼ gaca gubín idútë yödzölió. Guca gubín naʼ cateʼ niʼ rinná bëʼë Claudio, lu yödzö Roma.
44020036	Description	Cateʼ budxi bëʼë Pablo didzaʼ ni, buzóa zxibëʼ, ateʼ benëʼ tsözxö́n yúguʼtëʼ, buluʼlidzëʼ Dios.
48005024	Faith	Nupa néquiguequi queëʼ Cristo bítiʼrö tun ca të́ʼëni quez, en cabí tun le taʼzësö ladxiʼ lu yöl-laʼ bönáchisö quéguequi.
59001002	Recommendation	Böchiʼ luzáʼadoʼ, cateʼ gaca bi gaca queë́liʼ le siʼ bëʼ libíʼiliʼ, ral-laʼ udzéjaliʼ idú ládxiʼliʼ
62001006	Sin	Channö innaruʼ: “Nácaruʼ tuz len Dios”, pero channö runruʼ le naca chul-la que dul-laʼ, lë ni naca bëʼ rizíʼ yë́ʼëruʼ, en bitiʼ runruʼ le naca idútë li.
44010011	Description	Biléʼenëʼ nayalaj lúzxiba, en ruhuötaj tu le naca ca tu lariʼ guitsaʼ zxön ga zoëʼ, le nagaʼ idapa laʼa.
44002009	Description	Rëʼu ni nácaruʼ bönniʼ zián yödzö, bönniʼ narúajgaquiëʼ luyú Partia, en luyú Media, en luyú Elam, en luyú Mesopotamia, en luyú Judea, en luyú Capadocia, en luyú Ponto, en luyú Asia,
51001010	Faith	Caní rinábituʼ-nëʼ para gaca gunliʼ ca ral-laʼ ilún nupa néquiguequi queëʼ Xanruʼ, gunliʼ yúguʼtë le raza ládxëʼë Lëʼ, en séquiʼliʼ gunliʼ yúguʼtë le naca dxiʼa, en gácarö idú ca núnbëʼëliʼ-nëʼ Dios.
54001018	Recommendation	Zxíʼinaʼdoʼ Timoteo, rudödaʼ lu noʼo xibá ni para gunuʼ xichinëʼ Dios ca runëʼ tu bönniʼ idú ládxëʼë rejëʼ gudil-la, en para uziʼu xibé yuguʼ le gulaʼguíxjöʼ zíʼalö nupa niʼ guluíʼi didzaʼ uláz queëʼ Dios ca gaca quiuʼ.
66019001	Faith	Gudödi lë ni biyöndaʼ tuíʼi zidzaj didzaʼ bönachi zián nacuáʼ yehuaʼ yubá, taʼnná: ¡Yöl-laʼ ba Dios! ¡Yöl-laʼ rusölá runëʼ, ateʼ yöl-laʼ zxön, en yöl-laʼ unná bëʼ napëʼ Dios queë́ruʼ!
49002001	Grace	Dios chibennëʼ yöl-laʼ naʼbán idú queë́liʼ, sal-laʼ gúcaliʼ zíʼatëlö ca bönniʼ nátigaca tuʼ nözi dul-laʼ nabágaʼliʼ, en niʼa que döʼ biáʼaliʼ.
46010021	Sin	Bitiʼ gaca guíʼjaliʼ le ruluíʼi nácaruʼ tuz len Xanruʼ, encaʼ lë naʼ uluíʼi nácaliʼ tuz len yuguʼ böʼ xihuiʼ. Bitiʼ gaca gáguliʼ le ruluíʼi dzágaruʼ-nëʼ Xanruʼ, encaʼ le uluíʼi dzágaliʼ yuguʼ böʼ xihuiʼ.
49005003	Recommendation	Tuʼ nácaliʼ queëʼ Dios, bitiʼ caʼ gunliʼ le ruáʼ döʼ, en bitiʼ gunliʼ le cabí ral-laʼ gunliʼ, en bitiʼ uhuídiʼliʼ. Níʼirö cuntu nu gaca bi innë́ queë́liʼ.
56001015	Sin	Yúguʼtë naca dxiʼa quégaca nupa nácagaca dxiʼa, pero quégaca nupa nácagaca xihuiʼ, en bitiʼ taʼyéajlëʼ, bitiʼ bi naca dxiʼa, pero nácagaca xihuiʼ ga ridxintë le taʼbequi ícjaguequi, en le taʼzáʼ ládxiʼgaca.
44009021	Description	Buluʼbáninëʼ yúguʼtë bönniʼ niʼ taʼyönnëʼ lëʼ, taʼnnë́ʼ: ―¿Naruʼ calëga bönniʼ ni bönniʼ naʼ busunítiëʼ nupa nacuáʼ Jerusalén, en tuʼlidza Dios lu Lëʼ Jesús? Para gunëʼ caní bidëʼ caʼ ni para ichë́ʼë légaquiëʼ nadzúngaquiëʼ lógaquiëʼ bixúz unná bëʼ.
58008006	Description	Naʼa, Bixúz Lo queë́ruʼ ni runëʼ dxin que le nácatërö lesacaʼ, ateʼ niʼa que le benëʼ Lëʼ zoa tu didzaʼ rucáʼana tsahuiʼ queë́ruʼ le nácatërö lesacaʼ, en le ruíʼi didzaʼ que le nácatërö lesacaʼ guzxíʼ lu nëʼë Dios gataʼ queë́ruʼ.
50001021	Faith	Ca runi nedaʼ, channö zoaʼ nabanaʼ, naca para gacaʼ ca náquiëʼ Cristo, en channö gátiaʼ, naca tu le uzíʼiraʼ xibé.
50001006	Faith	Dios gusí lahuëʼ runëʼ tu le naca dxiʼa lu icja ládxiʼdoʼoliʼ. Ruzxöni ládxaʼa Lëʼ gúnticaʼsëʼ caní ga idxintë dza huödëʼ Jesucristo.
62005020	Faith	Naʼa, nö́ziruʼ chibidëʼ Zxíʼinëʼ Dios, en bennëʼ yöl-laʼ réajniʼi queë́ruʼ, para gúnbëʼëruʼ Nu naʼ naca idútë li. Zóalenruʼ Nu naʼ naca idútë li tuʼ zóalenruʼ-nëʼ Jesucristo, Zxíʼinëʼ Dios. Nu ni naca Dios idú, en Nu runna yöl-laʼ naʼbán idú queë́ruʼ.
45012018	Recommendation	Channö huáca, tsca séquiʼliʼ, guliʼcö́z dxiʼa len yúguʼtë bönachi.
58010023	Faith	Ral-laʼ gácaruʼ tsutsu, en cabí gaca chopa ládxiʼruʼ ca naca le runruʼ löza que le nazíʼ lu náʼaruʼ, le guzxíʼ lu nëʼë Dios gunnëʼ queë́ruʼ, ateʼ Lëʼ runëʼ ca rnnëʼ.
43014027	Grace	’Rucáʼanaʼ queë́liʼ le cuéqui dxi ládxiʼliʼ. Runnaʼ queë́liʼ yöl-laʼ röʼö dxi ladxiʼ quiaʼ. Yöl-laʼ röʼö dxi ladxiʼ naʼ runnaʼ queë́liʼ bitiʼ naca ca le tunna queë́liʼ bönachi yödzölió ni. Bitiʼ ichixi icja ládxiʼdoʼoliʼ, en bitiʼ gadxi idzö́biliʼ.
47005006	Faith	Que lë ni naʼ nadipa ládxiʼruʼ. Tsanni ni yúʼuruʼ lu le naca cázaruʼ, nö́ziruʼ zóaruʼ ziʼtuʼ ga zoa lidxëʼ Xanruʼ.
43012047	Grace	Channö riyönnëʼ nu bönniʼ xtídzaʼa, en bitiʼ runëʼ le bal, calëga nedaʼ ichugaʼ queëʼ bönniʼ naʼ gátiëʼ, tuʼ bidaʼ ni, calëga para ichugaʼ quégaca bönachi yödzölió ni, pero para usöláʼ bönachi yödzölió ni.
62003012	Sin	Bitiʼ ral-laʼ gunruʼ ca naʼ benëʼ Caín. Gúquiëʼ Caín que tuʼ xihuiʼ, ateʼ bë́tiëʼ-biʼ biʼi bö́chëʼë. ¿Bizx que bë́tiëʼ-biʼ biʼi bö́chëʼë? Bë́tiëʼ-biʼ tuʼ gulaca le benëʼ Caín naʼ le ruáʼ döʼ, pero le benbiʼ biʼi bö́chëʼë, gulaca tsahuiʼ.
66016020	Description	Bilaʼgachiʼ yuguʼ luyú bidxi dzöʼö lu nísadoʼ, ateʼ bítiʼrö gulaʼláʼ yuguʼ guíʼadoʼ.
58011012	Description	Que lë ni naʼ, sal-laʼ chibigúladëʼë Abraham, gulaʼcuáʼabiʼ ziántëröbiʼ zxíʼini xiʼsóëʼ. Gulaʼcuáʼabiʼ tsca rö́ʼöbaʼ bölaj lúzxiba, en tsca röʼö yuzxi tu raʼ nisa zxön, cuntu nu gaca ulaba légacabiʼ.
54001017	Faith	Naʼa rnníaʼ: ¡Yöl-laʼ ba Dios, Nu rinná bë́ʼticaʼsö, Nu catu caz údxi que, en Nu bitiʼ gaca iléʼeruʼ, laʼs dui Dios Nu nözi caz yúguʼtë! ¡Queëʼ Lëʼ gácaticaʼsö yöl-laʼ run bal, en yöl-laʼ ba, naʼa dza, en yúguʼtë dza záʼgaca! ¡Caʼ gaca!
66014007	Faith	Ruʼë zidzaj didzaʼ, rnnëʼ: “¡Gulíʼgádxi Dios, en guliʼcuʼë yöl-laʼ ba tuʼ chizóa uchiʼa usörö́ëʼ bönachi! ¡Guliʼtséaj ládxëʼë Dios, nunëʼ lúzxiba, en luyú, en nísadoʼ, en gapa ralaj nisa!”
44006001	Description	Dza niʼ, tuʼ gulaʼyán bönachi taʼyéajlëʼ Cristo, yuguʼ bönniʼ judío tuʼë didzaʼ griego gulaʼnnë́ʼ quégaquiëʼ bönniʼ judío tuʼë didzaʼ hebreo tuʼ nözi le raca cateʼ taʼguísiëʼ le ilágunu nigula uzëbi, tuʼ cuntu nu ruíʼi le ilágunu nigula uzëbi quégaquiëʼ bönniʼ niʼ tuʼë didzaʼ griego.
60002021	Grace	Dios bulidzëʼ libíʼiliʼ para quíʼi sácaʼliʼ caní, tuʼ gudíʼi guzxáquëʼë Lë cazëʼ Cristo uláz queë́liʼ, en buzóëʼ queë́liʼ tu le ruluíʼi libíʼiliʼ ca ral-laʼ gunliʼ, para quíʼi sácaʼliʼ ca naʼ gudíʼi guzxáquëʼë Lëʼ.
53003010	Recommendation	Lëscaʼ cateʼ niʼ guzóalentuʼ libíʼiliʼ, buchíʼatuʼ libíʼiliʼ caní, le rnna: “Channö cabí rë́ʼënëʼ nu bönniʼ gunëʼ dxin, bitiʼ güíʼiliʼ le gahuëʼ.”
43003016	Grace	Tuʼ bidxíʼideʼenëʼ Dios bönachi yödzölió, buzáʼ ládxëʼë quéguequi Zxíʼinëʼ laʼ buduínëʼ, para cabí ilaʼniti yúguʼtë nupa ilaʼyéajlëʼ Lëʼ, pero gataʼ yöl-laʼ naʼbán idú quéguequi.
44019015	Description	Bubíʼi didzaʼ böʼ xihuiʼ naʼ, gunná: ―Núnbëʼa-nëʼ Jesús, en núnbeʼedaʼ bönniʼ lëʼ Pablo, pero libíʼiliʼ, ¿núzxitë libíʼiliʼ?
66019019	Violence	Níʼirö biléʼedaʼ-baʼ böaʼ síniaʼ naʼ, encaʼ yuguʼ bönniʼ taʼnná bëʼë yödzölió, en bönniʼ röjáquiëʼ gudil-la guizxi yu quégaquiëʼ, nudúbigaquiëʼ para ilúnlenëʼ gudil-la Bönniʼ dxíëʼ-baʼ böaʼ chiguichi, dzágagaca Lëʼ niʼa nëʼë guizxi yu.
44027002	Description	Gurentuʼ tu lëʼe barco que luyú Adramitio, le ral-laʼ tödi yuguʼ yödzö gapa taʼdxín barco ga naca luyú Asia, ateʼ yúʼusötuʼ caʼ lëʼe barco naʼ, buzáʼatuʼ yödzö Cesarea. Aristarco, tu bönniʼ yödz Tesalónica, le nababa luyú Macedonia dzáguiëʼ netuʼ.
58013003	Recommendation	Guliʼtsöjné nupa nadzúngaca lidxi guíë tsca nunliʼ légaquiëʼ tsözxö́n, nadzunliʼ caʼ lidxi guíë. Guliʼgüíʼ ládxiʼliʼ yuguʼ bönniʼ taʼbía ládxiʼgaca bönachi légaquiëʼ, tsca libíʼiliʼ riguíʼi rizácaʼlenliʼ légaquiëʼ tsözxö́n.
51003017	Recommendation	Yúguʼtë le runliʼ, le naca didzaʼ ruíʼiliʼ o le naca dxin runliʼ, guliʼgún yúguʼtë lu Lëʼ Xanruʼ Jesús, en guië́liʼ-nëʼ Dios Xuz: “Xclenuʼ”, dzáguiëʼ Cristo libíʼiliʼ.
48006006	Recommendation	Channö zoa nu rusedi libíʼiliʼ ca naca le rinnë́ dxiʼa, ral-laʼ unö́dzjaliʼ nu naʼ rusedi libíʼiliʼ latiʼ que yúguʼtë le doʼ dë queë́liʼ.
44007005	Description	Dios bitiʼ bëʼë lëʼ lataj guequi queëʼ luyú ni. Calëga látiʼsö bunödzjëʼ queëʼ ga soëʼ luyú ni, pero guzxíʼ lu nëʼë Dios unödzjëʼ queëʼ luyú ni, ateʼ tödi gátiëʼ Abraham guequi luyú ni quégaca zxíʼini xiʼsóëʼ, sal-laʼ bitiʼ nacuíʼinibiʼ biʼi queëʼ.
44007019	Description	Bönniʼ unná bëʼ naʼ biʼë döʼ quégaca bönachi uládz queë́ruʼ. Busacaʼ ziʼë yuguʼ xuz xtóʼoruʼ naʼ, en benëʼ ga buluʼsanëʼ-biʼ biʼi bönniʼ huë́ʼënidoʼ que queë́gaquiëʼ, para ilátibiʼ.
43020003	Description	Níʼirö bilaʼrúajëʼ Pedro, en iaʼtúëʼ bönniʼ usëda naʼ, söjáquiëʼ raʼ yeru ba naʼ.
44024016	Faith	Que lë ni naʼ ruíʼi ládxiʼticaʼsaʼ cabí ibágaʼa le gun ga uxö́s ládxiʼdaʼahuaʼ nedaʼ lahuëʼ Dios o lógaca bönachi.
65001013	Description	Nácagaquiëʼ caʼ ca nísadoʼ cateʼ riyasa ridxía, ateʼ ribö́ʼ bidxinaʼ que, lë naʼ ruluíʼi ca naca yöl-laʼ stuʼ tunëʼ. Nácagaquiëʼ ca yuguʼ bölaj lúzxiba nucáʼanagacabaʼ xinö́zgacabaʼ. Dios chinunëʼ quégaquiëʼ ilaʼyáziëʼ tsaz lataj chul-la.
48001012	Description	Cuntu nu bönniʼ budödëʼ lu naʼa le rinnë́ dxiʼa naʼ, en calëga nu bönniʼ busédinëʼ nedaʼ le. Jesucristo caz buzéajniʼinëʼ nedaʼ ca naca le rinnë́ dxiʼa queëʼ.
45007005	Sin	Tsanni niʼ guyúʼuruʼ lu naʼ yöl-laʼ bönáchisö queë́ruʼ, le rinná bëʼ xibá naʼ ben ga gulaca bëʼ le guzë́ ládxiʼruʼ le ruáʼ döʼ, le gulún dxin lu idútë le naca cázaruʼ para ilún ga gátiruʼ.
54002007	Faith	Ca naca lë ni, Dios buzóëʼ nedaʼ para gunaʼ libán que, en gacaʼ gubáz nasö́l-lëʼë Cristo, para usédigacadaʼ bönachi izáʼa ca naca le réajlëʼëruʼ Cristo, en ca naca le naca idútë li. Rilítedaʼ, en bitiʼ caʼ rizíʼ yëʼa.
62003024	Faith	Zóalen Dios nu run ca rinná bëʼ xibá queëʼ, ateʼ Dios caz zóalenëʼ nu naʼ. Caní nö́ziruʼ dzágaticaʼsëʼ Lëʼ rëʼu, tuʼ chigusö́l-lëʼë Dios Böʼ Láʼayi queë́ruʼ.
46010024	Recommendation	Ral-laʼ güíʼi ládxiʼruʼ gunruʼ le gun ga gaca dxiʼa quégaquiëʼ böchiʼ luzáʼaruʼ, en calë́gasö le gun ga gaca dxiʼa que laʼ cuínsiruʼ.
45012016	Recommendation	Guliʼgaca tuz len luzáʼaliʼ. Bitiʼ gun ba zxön cuinliʼ, pero guliʼgún tsözxö́n yuguʼ bönniʼ nöxaj ladxiʼ. Bitiʼ guéquiliʼ chinadéliʼliʼ idútë yöl-laʼ réajniʼi.
49004031	Recommendation	Guliʼcúa ladaj libíʼiliʼ yöl-laʼ ruzxëʼe, en yöl-laʼ ridzáʼa, en yöl-laʼ rilé, en yöl-laʼ ridil-la didzaʼ, en yöl-laʼ rutsaga yudxi, en yúguʼtë yöl-laʼ bitiʼ riléʼe luzáʼaliʼ dxiʼa.
51001025	Faith	Dios benëʼ ga nacaʼ huen dxin quégaca bönachi queëʼ Cristo, ateʼ runaʼ xichinëʼ Dios, le budödëʼ lu naʼa gunaʼ para gácalenaʼ libíʼiliʼ, quíxjöʼa idú ca naca xtídzëʼë Dios.
66001014	Description	Chiguíchidoʼos naca guitsaʼ icjëʼ ca naca zxilaʼ o ca rináʼ böguiʼ, ateʼ rëpi yösa beníʼ guiö́j lahuëʼ ca guíʼ.
47004015	Grace	Raca caní yúguʼtë lë ni para gaca bi uzíʼiliʼ xibé. Channö ilaʼdeliʼ ziánrö caʼ bönachi le ruzáʼ ládxëʼë Dios queë́ruʼ, ilaʼnnë́ʼ: “Xclenëʼ Dios”, ateʼ gaca yöl-laʼ ba queëʼ Dios.
43006056	Faith	Nútiʼtës bönniʼ gahuëʼ xipë́laʼa, en guíʼjëʼ xichönaʼ, sóalenticaʼsëʼ bönniʼ naʼ nedaʼ, ateʼ nedaʼ sóalenticaʼsaʼ lëʼ.
43011027	Faith	Marta rënu Lëʼ: ―Ön, Xan. Réajlëʼa nacuʼ Liʼ Cristo, Zxíʼinëʼ Dios, Bönniʼ naʼ guzxíʼ lu nëʼë Dios isö́l-lëʼë yödzölió ni.
44002042	Faith	Gulunëʼ yúguʼtëʼ idútë le buluʼsédinëʼ gubáz nasö́l-lëʼë Cristo légaquiëʼ. Guláquiëʼ tuz tuëʼ len iaʼtúëʼ, en gulahuëʼ tsözxö́n le rusáʼ ládxiʼruʼ ca gútiëʼ Jesús, ateʼ gulunëʼ tsözxö́n, buluʼlidzëʼ Dios.
58001009	Grace	Nadxíʼinuʼ le naca tsahuiʼ, en calëga le ruáʼ döʼ. Que lë ni naʼ Dios budödëʼ lu noʼo yöl-laʼ unná bëʼ, en benëʼ ga ruzíʼitëruʼ Liʼ xibé yöl-laʼ unná bëʼ ca le tuʼzíʼi xibé luzóʼo.
44012002	Violence	Gunná béʼenëʼ bönniʼ gulútiëʼ Jacobo, bö́chëʼë Juan. Guluʼë lëʼ guíë tuchiʼ.
55002016	Recommendation	Naʼa, gucuíta ga nacuáʼ nupa tuíʼi didzaʼ bitiʼ nazacaʼ, en didzaʼ cáʼasö, tuʼ tun didzaʼ caní ga ilunrëʼ le cabí rë́ʼënëʼ Dios.
62003015	Sin	Nútiʼtës nu bitiʼ riléʼe dxiʼa böchiʼ luzë́ʼe, naca huëti bönachi nu naʼ, ateʼ nö́ziliʼ nu ruti bönachi bitiʼ dë yöl-laʼ naʼbán idú que.
