54002012	Recommendation	Bitiʼ runnaʼ yuguʼ nigula lataj uluʼsédinu, en calëga ilaʼnná béʼenu yuguʼ bönniʼ. Ral-laʼ ilaʼcuáʼanu dxisö ga nudúbigaca bönachi queëʼ Cristo.
46001009	Faith	Dios runëʼ ca rnnëʼ, en Lë cazëʼ bulidzëʼ libíʼiliʼ para gácaliʼ tuz len Zxíʼinëʼ, Xanruʼ Jesucristo.
48005013	Recommendation	Ca naca queë́liʼ, böchiʼ zánaʼdoʼ, Dios bulidzëʼ libíʼiliʼ para gácaliʼ bönachi nazángaca. Bitiʼ ugunliʼ dxin yöl-laʼ nazán naʼ para gunliʼ ca rizësö ládxiʼliʼ, pero para gunliʼ dxin que luzáʼaliʼ, tuliʼ iaʼtuliʼ, tuʼ nadxíʼiliʼ luzáʼaliʼ.
59002012	Recommendation	Ca innaliʼ, en ca gunliʼ, ral-laʼ gunliʼ ca ral-laʼ ilún nupa uchiʼa usörö́ëʼ Dios légaquiëʼ ca rinná bëʼ xibá naʼ, le run ga uláruʼ.
46012005	Faith	Lëscaʼ caní, nadzáʼgaca tu tu dxin riguʼë Xanruʼ lu náʼaruʼ, pero tuzëʼ náquiëʼ Xanruʼ naʼ.
45009005	Description	Nácagaquiëʼ zxíʼini xiʼsóagaquiëʼ xuz xtóʼotuʼ Abraham, en Isaac, en Jacob, ateʼ ladaj diʼa dza quégaquiëʼ, ca naca yöl-laʼ bönachi queëʼ, guljëʼ Cristo, Nu naca caz Dios, en rinná béʼenëʼ yúguʼtë. ¡Rácaticaʼsö queëʼ yöl-laʼ ba! ¡Caʼ gaca!
47001006	Description	Que lë ni naʼ, channö bi riguíʼi rizácaʼtuʼ, raca caní queë́tuʼ para gaca huë tsáhuiʼtuʼ libíʼiliʼ, en guntuʼ ga uláliʼ. Channö Dios ruhuë́ tsáhuëʼë netuʼ, raca caní para gaca huë tsáhuiʼtuʼ libíʼiliʼ, ateʼ lu yöl-laʼ riböza zxön ladxiʼ queë́liʼ, gaca guáʼ ilenliʼ yuguʼ le quíʼi sácaʼliʼ, ca naʼ raca caʼ queë́tuʼ.
47001021	Faith	Dios caz runëʼ ga runtuʼ löza tsözxö́n len libíʼiliʼ néquiruʼ queëʼ Cristo, en budödëʼ lu naʼtuʼ dxin queëʼ runtuʼ.
44010015	Recommendation	Le buropi luzuí biyönnëʼ chiʼi nu naʼ gudxi lëʼ: ―Le nunëʼ Dios dxiʼa, bitiʼ innóʼ que: “Bitiʼ naca dxiʼa.”
66018009	Sin	Níʼirö gunnë́ʼ: “Ilaʼbödxi nupa taʼnná bëʼ luyú yödzölió, en gulún le ruáʼ döʼ tsözxö́n len légaquiëʼ, en buluʼzíʼ xibé le nequi quégaquiëʼ. Ilaʼbödxëʼ, en ilaʼbödxi yéchëʼë cateʼ ilaʼléʼenëʼ dzön que yödzö zxön naʼ régui.
43014023	Faith	Bubiʼë didzaʼ Jesús, rëʼ lëʼ: ―Nu bönniʼ nadxíʼinëʼ nedaʼ gunëʼ ca rnna xtídzaʼa, ateʼ Xuzaʼ Dios idxíʼinëʼ bönniʼ naʼ, ateʼ guídatuʼ idisóalentuʼ-nëʼ bönniʼ naʼ lu icja ládxiʼdaʼahuëʼ.
62004010	Grace	Caní naca bëʼ yöl-laʼ nadxíʼi idú, calëga ca nadxíʼiruʼ-nëʼ Dios, pero ca naʼ Lëʼ bidxíʼinëʼ rëʼu, en gusö́l-lëʼë Zxíʼini cazëʼ para gútiëʼ, en caní bugǘëʼ dul-laʼ nabágaʼruʼ.
62001007	Faith	Naʼa, channö runruʼ le naca tsahuiʼ, en ridaruʼ lu beníʼ ca naʼ Lëʼ náquiëʼ tsahuiʼ, en zoëʼ lu beníʼ, nácaruʼ tuz turuʼ len iaʼturuʼ, ateʼ xichönëʼ Jesucristo, Zxíʼinëʼ Dios ruún rëʼu dxiʼa, en rugúa yúguʼtë dul-laʼ nabágaʼruʼ.
48004007	Grace	Caní naca, chinácaliʼ biʼi queëʼ Dios, en bítiʼrö nácaliʼ ca yuguʼ bönniʼ tsaz nácagaquiëʼ huen dxin. Naʼa, tuʼ nácaliʼ biʼi queë cazëʼ Dios, Lë cazëʼ nazíʼ ladxiʼ nëʼë guequi queë́liʼ le nequi queëʼ tuʼ nácaliʼ tuz len Cristo.
58001008	Faith	Naʼa, ca naca cazëʼ Zxíʼinëʼ, rnnëʼ: Ga röʼu rinná bëʼu, inná bë́ʼticaʼsuʼ, Dios. Tsahuiʼ naca ca rinná bëʼu.
43010033	Sin	Buluʼbiʼë didzaʼ bönniʼ judío unná bëʼ naʼ, tëʼ Lëʼ: ―Niʼa que dxin dxiʼa bitiʼ uládxiʼtuʼ liʼ guiö́j, pero tuʼ cabí rnníoʼ dxiʼa queëʼ Dios, tuʼ nacuʼ liʼ bönáchisö, en run cuinuʼ Dios.
66014011	Description	Cuénticaʼsö dzön que guíʼ ga niʼ quíʼi sacaʼ nu naʼ. Rëla, en te dza quiʼi sacaʼ, ateʼ catu caz gataʼ lataj uluʼzíʼ ládxiʼgaca nupa ilaʼyéaj ládxiʼgaca-baʼ böaʼ síniaʼ naʼ, en budóʼ queë́baʼ. Bitiʼ uluʼzíʼ ládxiʼgaca nupa iluíʼi lataj taʼ labaʼ léguequi.
47004001	Faith	Dios buéchiʼ ládxëʼë netuʼ, en budödëʼ lu naʼtuʼ dxin ni runtuʼ. Que lë ni naʼ bitiʼ raca chopa ládxiʼtuʼ.
58013006	Faith	Caní naca, huáca innaruʼ idú ládxiʼruʼ lë naʼ rnna: Xanruʼ náquiëʼ Nu rácalen nedaʼ. Bitiʼ caʼ gádxidaʼ bi gun bönachi quiaʼ.
45014003	Recommendation	Naʼa, bönniʼ naʼ rahuëʼ yúguʼtë bitiʼ ral-laʼ uzóëʼ tsöláʼalö nu bönniʼ bitiʼ rahuëʼ yúguʼtë, en lëscaʼ caní, bönniʼ naʼ bitiʼ rahuëʼ yúguʼtë bitiʼ ral-laʼ siʼ quídzëʼë bönniʼ naʼ rahuëʼ yúguʼtë, tuʼ nazíʼ lu nëʼë Dios iropëʼ bönniʼ naʼ taʼyéajlëʼë Cristo.
45015005	Grace	Rinábidaʼ-nëʼ Dios, Nu run ga ribö́zaruʼ zxön ladxiʼ, en Nu ruhuë́ tsahuiʼ rëʼu, gunëʼ ga gunliʼ tuz ca rusácaʼliʼ queë́liʼ, para gácaliʼ ca naʼ rë́ʼënëʼ Jesucristo.
58007027	Description	Jesús ni, bitiʼ náquiëʼ ca yuguʼ bixúz lo yödzölió ni, tuʼ ben bayudxi gulaʼguʼë rön lahuëʼ Dios yuguʼ dza, ateʼ gulútiëʼ-baʼ böaʼ bëdxi lahuëʼ Lëʼ tuʼ nözi dul-laʼ nabágaʼgaca cazëʼ, ateʼ gudödi niʼ gulunëʼ caní tuʼ nözi dul-laʼ nabágaʼgaca bönachi. Naʼa, Jesús, tsaz guluʼë rön lahuëʼ Dios, cateʼ niʼ budödi cuinëʼ lahuëʼ Dios, en bulaljëʼ xichö́n cazëʼ tuʼ nözi dul-laʼ nabágaʼgaca yúguʼtë bönachi.
62003017	Sin	Naʼa, nútiʼtës nu dë yöl-laʼ tsahuiʼ que, lë naʼ dë yödzölió ni, ateʼ riléʼe böchiʼ luzë́ʼe, bi riyadzaj queëʼ, en bitiʼ ruhuéchiʼ ladxiʼ lëʼ, bi unödzaj queëʼ, ¿naruʼ nadxíʼitsö nu naʼ Dios?
47005008	Faith	Tuʼ runruʼ löza lë ni, rë́ʼëniruʼ ucáʼanaruʼ le naca cázaruʼ ni para tsöjsóalenruʼ-nëʼ Xanruʼ.
60002011	Recommendation	Böchiʼ luzáʼadoʼ, nácaliʼ ca bönachi ziʼtuʼ, en ridásiliʼ yödzölió ni. Que lë ni naʼ, rátaʼyuaʼ loliʼ, bitiʼ güíʼiliʼ lataj ilaʼnná beʼe le rizësö ládxiʼliʼ libíʼiliʼ, yuguʼ le taʼdíl-lalen böʼ naca cázaliʼ.
60002017	Recommendation	Guliʼgún bal yúguʼtë bönachi. Guliʼdxíʼi yuguʼ böchiʼ luzáʼaliʼ. Guliʼgadxi-nëʼ Dios. Guliʼgún bal bönniʼ naʼ rinná béʼenëʼ idútë yödzölió.
44007025	Description	Gúquibiʼ Moisés hualaʼyéajniʼinëʼ bönniʼ bö́chiʼbiʼ gunëʼ Dios ga usölábiʼ lë cázabiʼ légaquiëʼ, pero légaquiëʼ bitiʼ gulaʼyéajniʼinëʼ.
50003002	Violence	Guliʼgún chiʼi cuinliʼ lógaca nupa niʼ tuáʼ döʼ. Nácagaca ca yuguʼ böʼcuʼ síniaʼ, nupa naʼ tun bayudxi irugu lu xipë́laʼgaquiëʼ bönniʼ le naca bëʼ nazíʼ lu náʼgaquiëʼ xtídzëʼë Dios.
56001016	Sin	Taʼnnë́ʼ núnbëʼgaquiëʼ Dios, pero le túngaquiëʼ bitiʼ röjlö́z le taʼnnë́ʼ tuʼ nácagaquiëʼ bönniʼ tuʼdíʼinëʼ Dios. Taʼdáʼbaguëʼë xtídzëʼë, en bitiʼ caʼ gaca ilunëʼ le naca dxiʼa.
45010002	Faith	Runaʼ ba nalí quégaquiëʼ, idú ládxiʼgaquiëʼ tuíʼi ládxiʼgaquiëʼ Dios, pero calëga len yöl-laʼ réajniʼi idú.
47001004	Grace	Dios ruhuë́ tsáhuëʼë rëʼu cateʼ raca bítiʼtës bi raca queë́ruʼ, para gaca huë tsáhuiʼruʼ caʼ nupa bi raca quéguequi. Ruhuë́ tsáhuiʼruʼ légaquiëʼ ca naʼ Dios ruhuë́ tsáhuëʼë rëʼu.
55002015	Recommendation	Bë́ʼticaʼsö ládxuʼu urúajuʼ dxiʼa lahuëʼ Dios para gacuʼ ca tu bönniʼ huen dxin bitiʼ rutuíʼinëʼ ca naca dxin nunëʼ. Dxíʼadoʼ ral-laʼ ugunuʼ dxin didzaʼ idútë li.
53002004	Description	Bönniʼ ni uzáguëʼë, ateʼ lu yöl-laʼ run ba zxön cuinëʼ táʼbaguëʼë yúguʼtë le nequi queëʼ Dios, o le tun zxön bönachi lu yöl-laʼ run Dios bal quéguequi. Gunëʼ bönniʼ naʼ caní ga idxintë cöʼë ca Dios caz lu yudoʼ ga naca xilatjëʼ Dios, en gun cuinëʼ ca Dios.
49006004	Recommendation	Libíʼiliʼ, yuguʼ xuz, bitiʼ gun leliʼ zxíʼiniliʼ, pero buliʼxö́n légacabiʼ, en guliʼsínaʼ légacabiʼ, en buliʼsëdi légacabiʼ ca raza ládxëʼë Xanruʼ.
45008037	Grace	Naʼa, tuʼ zóalen rëʼu Nu naʼ nadxíʼi rëʼu, nácatërö löza idéliʼruʼ lu le raca queë́ruʼ.
44026014	Violence	Níʼirö yúguʼtëtuʼ gudzö́ʼötuʼ lu yu, ateʼ biyöndaʼ chiʼi nu bulidza nedaʼ. Bëʼë didzaʼ hebreo, gunnë́ʼ: “Saulo, Saulo, ¿bizx que ribía ládxuʼu nedaʼ? Run ziʼ cuinuʼ, ridáʼbaguʼu nedaʼ. Raca quiuʼ ca raca queë́baʼ bëdxi, run ziʼ cuinbaʼ, richéguʼbaʼ yaga tuchiʼ le túndëʼë-baʼ ziʼ.”
66002009	Sin	Caní rnníaʼ: Nedaʼ nöz quézidaʼ le runliʼ, en ca riguíʼi rizácaʼliʼ. Nözdaʼ nácaliʼ yechiʼ, pero le nácatë riléʼeliʼ yöl-laʼ tsahuiʼ le naca idú. Nözdaʼ caʼ ca taʼnnë́ queë́liʼ nupa niʼ taʼnná nácagaca bönachi judío, pero bitiʼ caʼ nácagaca caní. Nupa ni taʼdáʼ Satanás, tuʼ xihuiʼ.
46013006	Faith	Bitiʼ caʼ rudzéjanëʼ cateʼ nu run le ruáʼ döʼ. Rudzéjanëʼ cateʼ nu run le naca idútë li.
59001021	Recommendation	Que lë ni naʼ, guliʼcáʼana yúguʼtë le ruáʼ döʼ, en yúguʼtë le zián le cabí naca tsahuiʼ, ateʼ lu yöl-laʼ nöxaj ladxiʼ guliʼsíʼ lu náʼaliʼ didzaʼ naʼ chinayaza icja ládxiʼdoʼoliʼ, tuʼ huáca gun didzaʼ ni ga uláliʼ.
46003006	Grace	Dxin bentuʼ lu icja ládxiʼdoʼoliʼ naca ca dxin run nu raza ruzóa. Nedaʼ guzaʼ xisedoʼ, ateʼ Apolos guluʼë nisa, pero Dios benëʼ ga gulén, en guzxö́n xisedoʼ naʼ nadúz icja ládxiʼdoʼoliʼ.
66014008	Sin	Iaʼtúëʼ gubáz láʼayi söjnáhuëʼ gubáz láʼayi ni, en rnnëʼ: “¡Chibudxi que yödzö Babilonia! ¡Chibudxi que yödzö zxön naʼ! Caní guca que, tuʼ gulún nupa nacuáʼ niʼ ga gulaʼzíʼ lu náʼagaquiëʼ bönniʼ yúguʼtë yödzö ilunëʼ ca nácagaca le taʼzë́ ládxiʼgaquiëʼ le ruáʼ döʼ.”
43015014	Recommendation	Libíʼiliʼ nácaliʼ böchiʼ luzáʼa channö gunliʼ ca naʼ chigudxaʼ libíʼiliʼ gunliʼ.
62005021	Recommendation	Zxíʼinaʼdoʼ, guliʼgún chiʼi cuinliʼ para cabí tseaj ládxiʼliʼ yuguʼ budóʼ guiö́j budóʼ yaga. ¡Caʼ gaca!
55003006	Sin	Lëscaʼ caní, lu yöl-laʼ banísa quégaquiëʼ ilaʼyazëʼ gapa naca lu yuʼu, en ilaʼzíʼ yéʼenëʼ yuguʼ nigula bitiʼ bi nö́zguequinu para ilaʼzíʼ lu náʼagacanu le uluʼsédinëʼ. Ilaʼbágaʼnu nigula naʼ dul-laʼ zián, en iluíʼi ládxiʼgacanu yuguʼ le ilaʼzësö ládxiʼgacanu le cabí nazacaʼ.
49004015	Faith	Naʼa, rëʼu ni, tuʼ nadxíʼiruʼ luzáʼaruʼ, ral-laʼ güíʼiruʼ didzaʼ le naca idútë li para gaca huöácaruʼ idú ca náquiëʼ Cristo, en gácaruʼ tuz len Lëʼ, Nu naca Xani idú le naca cazëʼ, le nácaruʼ rëʼu.
49004003	Faith	Guliʼgüíʼ ladxiʼ gácaticaʼsiliʼ tuz ca naʼ chinunëʼ Dios Böʼ Láʼayi libíʼiliʼ, gunliʼ caní lu yöl-laʼ riböza tsáhuiʼdoʼ queë́liʼ le rutsaga libíʼiliʼ.
44009005	Description	Saulo gunábinëʼ Lëʼ, gunnë́ʼ: ―¿Nuzxi liʼ, Xan? Lëʼ gunnë́ʼ: ―Nedaʼ Jesús, Nu ribía ládxuʼu. Run ziʼ cuinuʼ, ridáʼbaguʼu nedaʼ. Raca quiuʼ ca naʼ raca queë́baʼ bëdxi, run ziʼ cuinbaʼ richéguʼbaʼ yaga tuchiʼ túndëʼë-baʼ ziʼ.
60003015	Recommendation	pero buliʼzxöni ládxiʼliʼ-nëʼ Cristo, en güíʼiliʼ Lëʼ lataj inná béʼenëʼ lu icja ládxiʼdoʼoliʼ. Guliʼsóa sinaʼ quíxjöiʼiliʼ yúguʼtë nupa ilaʼnabi libíʼiliʼ bizx que runliʼ löza Cristo, en gunliʼ lë ni lu yöl-laʼ nöxaj ladxiʼ queë́liʼ, en lu yöl-laʼ run bal nupa naʼ.
44007033	Recommendation	Xanruʼ gudxëʼ lëʼ: “Guléaj xirachuʼ nudóʼo, tuʼ naca láʼayi ga ni zuʼ tuʼ zoa cazaʼ nedaʼ, Dios, ni.
62002024	Faith	Naʼa, guliʼgüíʼ lataj le biyö́niliʼ dza niʼte ugáʼanalenticaʼsö libíʼiliʼ. Channö le biyö́niliʼ dza niʼte ugáʼanalenticaʼsö libíʼiliʼ, lëscaʼ libíʼiliʼ ugáʼanalenticaʼsiliʼ-nëʼ Dios Zxíʼini, encaʼ len Dios Xuz.
43008051	Faith	Le nácatë reaʼ libíʼiliʼ: Nu bönniʼ siʼ lu nëʼë xtídzaʼa, bitiʼ caʼ gátiëʼ bönniʼ naʼ.
66020011	Description	Níʼirö biléʼedaʼ tu lataj lo chiguichi, en biléʼedaʼ caʼ Nu röʼö ruchiʼa rusörö́ëʼ lataj naʼ. Lahuiʼ lo Nu ni gulaʼnítitë yödzölió, en lúzxiba, ateʼ bítiʼrö budzöli xilátjaguequi.
46006013	Recommendation	Taʼnná caʼ bönachi: “Laʼ huagu naca le tsaz lë́ʼëruʼ, ateʼ lë́ʼëruʼ naca ga tsudzu laʼ huagu.” Nácatë didzaʼ ni, pero idxín dza usunítiëʼ Dios laʼ huagu, encaʼ lë́ʼëruʼ. Dios benëʼ idútë le naca cázaruʼ, calëga para ugunruʼ le dxin gunruʼ le ruáʼ döʼ. Naca para uziʼë xibé Xanruʼ, ateʼ Xanruʼ náquiëʼ para uzíʼ xibë́ʼ idútë le naca cázaruʼ.
45006011	Faith	Lëscaʼ caní ral-laʼ usácaʼliʼ queë́liʼ naca queë́liʼ ca chinati cázaliʼ para cabirö gunliʼ dul-laʼ, pero zóaliʼ nabanliʼ para gunliʼ ca rnna xtídzëʼë Dios tuʼ nácaliʼ tuz len Xanruʼ Jesucristo.
47002014	Faith	¡Xclenëʼ Dios! Richë́ʼticaʼsëʼ rëʼu ca tu le naca bëʼ bidéliʼnëʼ Cristo yöl-laʼ rusölá queë́ruʼ. Dios rugunëʼ dxin rëʼu para ruluʼë lahui ca gaca ilúnbëʼe bönachi Cristo. Le nácaruʼ naca ca tu le riláʼ zxixi, le riguisi gátiʼtës.
62001005	Grace	Lë ni naca didzaʼ biyö́nituʼ bë́ʼlenëʼ Jesús netuʼ, ateʼ le rusiyöntuʼ libíʼiliʼ. Caní rnna: Dios náquiëʼ beníʼ, ateʼ nitú le naca chul-la que dul-laʼ bitiʼ zóalen Lëʼ.
43006037	Grace	Yúguʼtë nupa naʼ runnëʼ Xuzaʼ quiaʼ, ídigaca quiaʼ, ateʼ nupa naʼ zaca quiaʼ, bitiʼ usáʼgacaʼ-nëʼ.
58013001	Recommendation	Ral-laʼ idxíʼiticaʼsiliʼ luzáʼaliʼ tuliʼ iaʼtuliʼ.
58007025	Grace	Que lë ni naʼ, tsaz gaca usölë́ʼ nupa taʼbigaʼ galaʼ ga zoëʼ Dios, nupa tuʼgún dxin Lëʼ, tuʼ zóaticaʼsëʼ nabanëʼ, en rnnëʼ dxiʼa uláz quégaquiëʼ lahuëʼ Dios.
43019015	Violence	Guluʼë zidzaj didzaʼ, taʼnnë́ʼ: ―¡Bë́tiëʼ! ¡Bë́tiëʼ! ¡Budë́ʼë lëʼe yaga cruz! Pilato rëʼ légaquiëʼ: ―¿Rinábitseliʼ nedaʼ udáʼa-nëʼ lëʼe yaga cruz bönniʼ rinná béʼenëʼ libíʼiliʼ? Buluʼbiʼë didzaʼ bixúz unná bëʼ, taʼnnë́ʼ: ―Cúnturö nu zoa rinná beʼe netuʼ. Tuzëʼ César rinná béʼenëʼ netuʼ.
45011005	Grace	Lëscaʼ caní naca dza ni zóaruʼ naʼa, nagáʼanagaca bal-la bönachi Israel, nupa naʼ gurö́ cazëʼ queëʼ Dios tuʼ ruzáʼ ládxëʼë caní quégaquiëʼ.
66017002	Sin	Gulaʼcuaʼlen lënu nupa taʼnná bëʼ luyú yödzölió, en gulún le ruáʼ döʼ, ateʼ gulaʼzudxi nupa nacuáʼ yödzölió ni, tuʼ gulunlen lënu le bitiʼ naca dxiʼa.”
45012010	Recommendation	Guliʼdxíʼi-guéquinëʼ luzáʼaliʼ ca nadxíʼiguecliʼ-nëʼ böchiʼ cázaliʼ. Ca runliʼ-nëʼ bal luzáʼaliʼ ral-laʼ gunliʼ ga gácarëʼ lo ca nácaliʼ laʼ cuínsiliʼ.
45008014	Faith	Yúguʼtë nupa tun ca rë́ʼënëʼ Dios Böʼ Láʼayi nácagaca zxíʼinëʼ Dios.
66012003	Description	Níʼirö iaʼtú le naca bëʼ biláʼ lahui yehuaʼ yubá. Buluíʼi lobaʼ tubaʼ bëla zxön xitsiníʼ. Nácabaʼ xiná guiʼis, ateʼ dxíagaca gadxi ícjabaʼ, en chi lúzubaʼ, ateʼ dxía tu le néquini oro tu tu ícjabaʼ naʼ.
45008017	Faith	Channö chinácaruʼ zxíʼinëʼ Dios, gataʼ caʼ queë́ruʼ tsözxö́n len Cristo le nequi queëʼ Xúziruʼ Dios. Caní gaca queë́ruʼ channö riguíʼi rizácaʼlenruʼ-nëʼ tsözxö́n Cristo para uzíʼiruʼ xibé tsözxö́n len Cristo yöl-laʼ zxön queëʼ Dios.
54005017	Recommendation	Benrö bal yuguʼ bönniʼ gula tapa chiʼë bönachi queëʼ Cristo, yuguʼ bönniʼ naʼ taʼnná bëʼë dxiʼa, en béntërö caʼ bal yuguʼ bönniʼ gula naʼ tunëʼ dxin, tunëʼ libán, en tuʼsédinëʼ bönachi.
46008007	Sin	Calëga yúguʼtë böchiʼ luzáʼaruʼ taʼyéajniʼinëʼ lë ni. Bal-lëʼ, nupa niʼ zíʼalö gulaʼyéaj ládxiʼgaca budóʼ guiö́j budóʼ yaga, ga ridxintë naʼa dza tëʼaj tahuëʼ le gulaʼgúʼu bönachi lógaca budóʼ guiö́j budóʼ yaga, ateʼ téquinëʼ napa yöl-laʼ huáca que budóʼ naʼ. Tuʼ cabí naca idú ládxiʼgaquiëʼ, que lë ni naʼ téquinëʼ nabágaʼgaquiëʼ xíguiaʼ channö tahuëʼ lë naʼ.
43015002	Grace	Ugǘëʼ yúguʼtë niʼa nëʼe lubá naʼ nacaʼ nedaʼ, le cabí bi taʼbía, ateʼ uchiʼë yúguʼtë niʼa nëʼe naʼ taʼbía, para ilaʼbía iaʼlatiʼ.
60005003	Recommendation	en calëga tuʼ rë́ʼëniliʼ inná béʼesiliʼ nupa naʼ naguʼë lu náʼaliʼ. Guliʼgüíʼ ládxiʼliʼ gácaliʼ tu le ruluíʼi ca ral-laʼ ilaca nupa naʼ run chíʼiliʼ.
52004013	Recommendation	Lëscaʼ, böchiʼ luzáʼatuʼ, rë́ʼënituʼ inö́ziliʼ ca raca quégaca nupa chinátigaca, para cabí huíʼiniliʼ ca tun iaʼzícaʼrö bönachi bitiʼ zoa le tun löza.
58011029	Description	Tuʼ gulaʼyéajlëʼë yuguʼ bönniʼ Israel Dios, gulaʼdödëʼ luyú bidxi gatsaj láhuiʼlö nísadoʼ nazíʼi le Nisa Xiná. Cateʼ gulë́ʼënnëʼ ilaʼdödëʼ caʼ bönniʼ Egipto niʼ, gulaʼyë́pinëʼ nisa, en gulátigaquiëʼ lu Nisa Xiná naʼ.
44007020	Description	Laʼ dza níʼisö gúljabiʼ caʼ bíʼidoʼ Moisés, ateʼ Dios guyaza ládxëʼë-biʼ. Xuz xináʼabiʼ buluʼsculëʼ-biʼ lídxigaquiëʼ idú ca tsonna beoʼ.
58005002	Grace	Bixúz lo naʼ, tuʼ raca queëʼ lë́bisö ca raca quégaca bönachi, gaca gáquiëʼ zxön ladxiʼ len nupa nácagaca yuguʼ bönniʼ canö́z, en nupa taʼchixi taʼnigui.
45013012	Recommendation	Ga zóaruʼ naʼa naca ca chiʼi dzö́ʼölö, ateʼ chizóa tödi rëla naʼ, pero ga naʼ zoëʼ Cristo naca ca lahuiʼ dza, ateʼ chizóa tsöjsóaruʼ niʼ. Que lë ni naʼ ral-laʼ ucáʼanaruʼ le tun bönachi ga naca chul-la que dul-laʼ. Ca naʼ rugacu cuinëʼ tu bönniʼ rejëʼ gudil-la le run chiʼi lëʼ lu gudil-la, ral-laʼ taruʼ lu beníʼ queëʼ Dios, le gun chiʼi rëʼu lu naʼ tuʼ xihuiʼ.
49006009	Recommendation	Libíʼiliʼ, nacuáʼ queë́liʼ bönniʼ nadóʼogaca, guliʼgún dxiʼa caní quégaca huen dxin queë́liʼ naʼ, en bitiʼ uzéliʼ ba nadx légaquiëʼ. Guliʼtsöjné ca naca queë́liʼ, yúʼuliʼ lu nëʼë Xanruʼ zoëʼ yehuaʼ yubá laʼ ca nácatë quégaquiëʼ, ateʼ Lëʼ bitiʼ rutsë́ʼë ca runëʼ que que bönachi.
45012015	Recommendation	Buliʼdzéjalen nupa tuʼdzeja. Guliʼcö́dxilen nupa taʼbödxi.
45002005	Sin	Lu yöl-laʼ ládxiʼdoʼ zidi quiuʼ bitiʼ rubíʼi ládxuʼu. Que lë ni naʼ rusubagaʼ cuinuʼ xíguiaʼ gunëʼ Dios liʼ cateʼ uchiʼa usörö́ëʼ bönachi, ateʼ gaca bëʼ naca ca ral-laʼ gunëʼ Dios cateʼ ichúguiëʼ quégaca bönachi ilátigaca.
44014019	Violence	Níʼirö bal-lëʼ bönniʼ judío bitiʼ taʼyéajlëʼë, narúajgaquiëʼ Antioquía, en Iconio, bilaʼdxinëʼ niʼ, ateʼ gulaʼgúʼu yö́l-lëʼë bönachi zián naʼ. Níʼirö yúguʼtëʼ buluʼladxëʼ Pablo guiö́j, en guláʼayöjëʼ lëʼ níʼilö raʼ yödzö naʼ, tuʼ téquinëʼ chinátiëʼ.
43013021	Description	Cateʼ Jesús budxi bëʼë didzaʼ ni, buíʼinnëʼ, ateʼ yálajdoʼ gunnë́ʼ: ―Le nácatë reaʼ libíʼiliʼ: Tu bönniʼ nútsëʼë ládjaliʼ udödëʼ nedaʼ.
48003022	Faith	Tsca naca lë naʼ nazúaj lu guichi láʼayi, yúguʼtëruʼ nabágaʼruʼ dul-laʼ. Caní naca para gaca síʼiruʼ lë naʼ guzxíʼ lu nëʼë Dios gataʼ queë́ruʼ cateʼ tseja ládxiʼruʼ Jesucristo.
66011007	Violence	Cateʼ údxi ilunëʼ ba nalí, irúajbaʼ böaʼ síniaʼ lataj chul-la, en tíl-lalenbaʼ légaquiëʼ, en ucúl-labaʼ légaquiëʼ, en gútibaʼ légaquiëʼ.
58003014	Faith	Yúguʼtëruʼ gunruʼ tsözxö́n Cristo channö gácaruʼ tsutsu ga idxinrö dza údxi, ca naʼ gusí lo ridipa ládxiʼruʼ.
45008010	Faith	Tuʼ zóalenëʼ Cristo libíʼiliʼ, chinati caz idútë le guca cázaliʼ tuʼ nözi dul-laʼ, ateʼ naʼa nabániliʼ-nëʼ Dios Böʼ Láʼayi tuʼ nunëʼ Dios libíʼiliʼ tsahuiʼ.
44007052	Sin	Gulaʼbía ládxiʼgaquiëʼ xuz xtóʼoliʼ naʼ yúguʼtë bönniʼ niʼ guluʼë didzaʼ uláz queëʼ Dios. Lëscaʼ gulútiëʼ bönniʼ niʼ gulaʼguíxjöʼë zíʼalö ca ral-laʼ guídëʼ Cristo, Bönniʼ Tsahuiʼ, ateʼ naʼa, cateʼ niʼ bidxinëʼ Bönniʼ Tsahuiʼ naʼ, libíʼi cázaliʼ bë́tiliʼ-nëʼ lu náʼagaquiëʼ bönniʼ gulútiëʼ Lëʼ.
48005021	Sin	Taʼzë́ ladxiʼ le dë que luzë́ʼeguequi, en taʼguilaj xíguiaʼ. Taʼzudxi, en tagu lëʼe. Tuʼdödi bëʼ ca túnguequi. Le zián le caní túnguequi. Nedaʼ ruxösaʼ ládxiʼliʼ naʼa para cabí gunliʼ caní ca naʼ buxösaʼ ládxiʼliʼ zíʼalö, rnníaʼ: Nupa túngaca caní bitiʼ caʼ ilaʼdeliʼ ilaʼyúʼu ga naʼ rinná bëʼë Dios.
43012036	Faith	Tsanni ni zóalenaʼ libíʼiliʼ, nacaʼ beníʼ queë́liʼ. Guliʼtséajlëʼ nedaʼ nacaʼ beníʼ queë́liʼ para iléʼeliʼ beníʼ naʼ naca idú. Cateʼ Jesús budxi bëʼë didzaʼ ni, yöjhuöjëʼ yöjcachiʼ lahuëʼ lógaquiëʼ.
58003002	Faith	Jesús ni runëʼ ca rnna xtídzëʼë Dios, Nu naʼ buzóa Lëʼ xilatjëʼ, ca naʼ benëʼ caʼ Moisés, benëʼ ca rnna xtídzëʼë Dios lógaca yúguʼtë bönachi queëʼ Dios.
56003006	Grace	Dios gusö́l-lëʼë Dios Böʼ Láʼayi queë́ruʼ tuʼ néquiruʼ queëʼ Jesucristo, Nu rusölá rëʼu.
44004036	Description	Zoëʼ José niʼ, bönniʼ buluʼzóëʼ gubáz naʼ nasö́l-lëʼë Cristo iaʼtú lëʼ Bernabé, le rnna lu didzaʼ xidzaʼ, Bönniʼ Ruhuë́ Tsáhuëʼë. Nabábalenëʼ zxíʼini xiʼsóëʼ Leví, en guljëʼ luyú Chipre.
48006009	Recommendation	Caní naca, bitiʼ ral-laʼ huöa ládxiʼruʼ gunruʼ le naca dxiʼa, tuʼ channö cabí huöa ládxiʼruʼ, idxín dza uláparuʼ.
48002019	Faith	Tuʼ cabí guca uzóaʼ didzaʼ xibá naʼ gunná bëʼë Moisés, guca quiaʼ tsca chinátiaʼ. Tuʼ caní naca, nuláʼ naʼa lu xibá naʼ para soaʼ ibanaʼ, en gunaʼ ca rë́ʼënëʼ Dios.
66011001	Recommendation	Níʼirö bidxín nu benna tu gui quiaʼ le naca ca tu yaga ribixi, en gudxi nedaʼ: “Guyasa, en burixi yudoʼ queëʼ Dios. Burixi caʼ bucugu láʼayi que, en bulaba nupa nacuáʼ niʼ taʼyéaj ládxiʼgaca Dios.
66014004	Description	Nácagaquiëʼ bönniʼ ni idú ladxiʼ. Bitiʼ gulaʼcuáʼlenëʼ nigula, tuʼ nácagaquiëʼ idú bönniʼ raʼbán. Söjácalenëʼ Bönniʼ naʼ náquiëʼ Böʼcuʼ Zxílaʼdoʼ gátiʼtës ga saʼyéajëʼ. Cristo caz böáʼuëʼ légaquiëʼ ládjagaca bönachi, ateʼ nácagaca nupa buluʼdödi cuíngaquiëʼ zíʼalö queëʼ Dios, encaʼ queëʼ Bönniʼ naʼ náquiëʼ Böʼcuʼ Zxílaʼdoʼ.
66009007	Description	Naláʼgacabaʼ bö́chiʼzu naʼ ca nácagacabaʼ böaʼ nácugacabaʼ le néquiguequini guíë, para tsöjácabaʼ gudil-la. Dxíagaca ícjagacabaʼ le nácagaca ca tu le néquini oro. Naca lógacabaʼ ca naca lógaca bönachi.
60002016	Recommendation	Guliʼgaca ca yuguʼ bönniʼ nazángaquiëʼ, pero bitiʼ ugunliʼ dxin yöl-laʼ nazán queë́liʼ para gunliʼ le ruáʼ döʼ. Guliʼgaca ca yuguʼ bönniʼ nadóʼogaquiëʼ queëʼ Dios.
54004010	Faith	Que lë ni naʼ, rusácaʼdaʼ ziʼ cuinruʼ runruʼ dxin, tuʼ runruʼ löza Dios ban. Cristo gútiëʼ para usölë́ʼ yúguʼtë bönachi. Tuʼzíʼ xibé le benëʼ nupa naʼ taʼyéajlëʼ Lëʼ.
58010029	Sin	Naʼa, nu bönniʼ uzóëʼ tsöláʼalö Zxíʼinëʼ Dios, en uzóëʼ tsöláʼalö caʼ xichönëʼ le run tsutsu didzaʼ rucáʼana tsahuiʼ, le ruún rëʼu dxiʼa, ibágaʼrëʼ caʼ xíguiaʼ. Nu bönniʼ gunëʼ caní ucáʼanëʼ cáʼasö Dios Böʼ Láʼayi, Nu ruzáʼ ladxiʼ queë́ruʼ le riquíniruʼ.
43020021	Grace	Níʼirö Jesús rëʼ légaquiëʼ leyúbölö, rnnëʼ: ―Guliʼzóa dxi ládxiʼliʼ. Ca benëʼ Xuzaʼ, gusö́l-lëʼë nedaʼ, lëscaʼ caní risö́l-laʼa libíʼiliʼ tsöjenliʼ xichinaʼ.
65001016	Sin	Yuguʼ bönniʼ caní taʼnnë́ʼ queëʼ, en taʼzíʼ quídzëʼë, en tunëʼ ca naca le taʼzësö ládxiʼgaquiëʼ. Tuʼë didzaʼ lu yöl-laʼ run ba zxön cuíngaquiëʼ, en para uluʼziʼë xibéguequi, tuʼë didzaʼ le taʼgúʼu bönachi yöl-laʼ zxön.
66006015	Description	Níʼirö yuguʼ bönniʼ taʼnná bëʼë luyú, en yuguʼ bönniʼ lo, en yuguʼ bönniʼ taʼléʼenëʼ yöl-laʼ tsahuiʼ, en yuguʼ bönniʼ taʼnná béʼenëʼ bönniʼ röjáquiëʼ gudil-la, en yuguʼ bönniʼ dë lu náʼagaquiëʼ, en yúguʼtë nupa nadóʼogaca, en yúguʼtë nupa bitiʼ nadóʼogaca buluʼcachiʼ lógaquiëʼ gapa naca zxan bulóaj, en gapa naca lëʼe guiö́j lu guíʼadoʼ.
66021008	Sin	pero nupa tadxi, en nupa bitiʼ taʼyéajlëʼ nedaʼ, en nupa nácagaca xihuiʼ, en nupa tuti bönachi, en nupa tun le bitiʼ naca tsahuiʼ, en nupa nácagaca udzáʼ, en nupa taʼyéaj ládxiʼgaca budóʼ guiö́j budóʼ yaga, en yúguʼtë nupa taʼzíʼ yëʼ, chizóa riböza xilátjaguequi lu guíʼ, ga niʼ röʼö guíʼ zxön que lë naʼ ruzéguiʼdaʼ, lë naʼ naca yöl-laʼ guti le raca burópilö.”
44022016	Recommendation	Naʼa, ¿bizx que ridzenuʼ? ¡Guyasa, en bidila nisa! Bulidzëʼ Xanruʼ para únëʼ liʼ dxiʼa, en ugǘëʼ dul-laʼ nabáguʼu.”
66009008	Description	Naca guitsaʼ ícjagacabaʼ ca naca guitsaʼ ícjanu nigula. Nácagaca láyiʼgacabaʼ ca nácagaca láyiʼbaʼ bëdxi guixiʼ.
55002024	Recommendation	Bönniʼ huen dxin queëʼ Xanruʼ bitiʼ ral-laʼ tíl-lalenëʼ bönachi didzaʼ, pero ral-laʼ gáquiëʼ nöxaj ladxiʼ lógaca yúguʼtë bönachi. Ral-laʼ gaca usédinëʼ bönachi, en gáquiëʼ caʼ zxön ladxiʼ.
51002005	Faith	Sal-laʼ zoaʼ ziʼtuʼ ga zóaliʼ lu idútë le nacaʼ, lu böʼ naca cazaʼ zóalenaʼ libíʼiliʼ, en rudzéjadaʼ tuʼ riléʼedaʼ röʼö xibá queë́liʼ, en nácaliʼ tsutsu ca réajlëʼëliʼ Cristo.
60003012	Sin	Xanruʼ rapa chiʼë yuguʼ bönniʼ tsahuiʼ en ruzë́ náguiëʼ le tuʼlidzëʼ Lëʼ, pero ruzáguëʼë xinö́zguequi nupa tuaʼ döʼ.
