62003016	Faith	Caní núnbëʼëruʼ yöl-laʼ nadxíʼi le naca idú. Naca ca budödëʼ Jesús yöl-laʼ naʼbán queëʼ, en gútiëʼ uláz queë́ruʼ. Lëscaʼ caní rëʼu ral-laʼ udö́diruʼ yöl-laʼ naʼbán queë́ruʼ, para gácalenruʼ yuguʼ bö́chiʼruʼ.
43013001	Grace	Niʼ naca dza siʼ idxín Laní Pascua cateʼ tuʼsubanëʼ bönniʼ judío ca benëʼ Dios, bubéajëʼ bönachi queëʼ luyú Egipto. Nö́zinëʼ Jesús chibidxín dza queëʼ gátiëʼ, cateʼ ral-laʼ uzë́ʼë yödzölió ni, en huöjëʼ ga zoëʼ Xuzëʼ. Ca naʼ nadxíʼinëʼ bönachi queëʼ nacuáʼ yödzölió ni, naʼa nadxíʼinëʼ légaquiëʼ ga idxintë gátiëʼ uláz quégaquiëʼ.
58003017	Sin	¿Nupxi naʼ gulénëʼ Dios idú ca choáʼ iz? Gulaca nupa niʼ gulún dul-laʼ, ateʼ gulati lu lataj cáʼasö.
60001014	Recommendation	Guliʼgún ca rnna xtídzëʼë Dios, en bitiʼ güíʼiliʼ lataj yuguʼ le rizë́ ládxiʼliʼ ilaʼchë́ʼ libíʼiliʼ ga yúbölö, ca naʼ benliʼ dza niʼ bitiʼ núnbëʼëniliʼ-nëʼ Dios.
45011032	Grace	Dios guléaj ládxëʼë yúguʼtë bönachi para ilaʼdáʼbaguëʼë xtídzëʼë, para gaca huéchiʼ ládxëʼë yúguʼtëʼ.
66006006	Description	Biyöndaʼ ruíʼi didzaʼ tu chiʼi gatsaj láhuiʼlö tapa naʼ nabángaca, ateʼ gunná: “Chopa guíë zxoaʼ xtila len lazxaj que tu dza huen dxin tuʼ gaca gubín, en xopa guíë zxoaʼ cebada len lazxaj que tu dza huen dxin, pero bitiʼ gunuʼ ga yadzaj le naca za, en bitiʼ bi gunuʼ que xisi uva nal-la.”
59004010	Recommendation	Guliʼgaca nöxaj ladxiʼ lahuëʼ Xanruʼ, ateʼ Lëʼ gunëʼ ga tsë́pisëliʼ.
44017031	Grace	Dios chinuluʼë tu dza cateʼ uchiʼa usörö́ëʼ yúguʼtë bönachi. Idú tsahuiʼ naca ca uchiʼa usörö́ëʼ légaquiëʼ lu nëʼë Jesús, bönniʼ naʼ buzóa cazëʼ Lëʼ, ateʼ lógaca yúguʼtë bönachi benëʼ tsutsu gaca caní tuʼ busubanëʼ Lëʼ lu yöl-laʼ guti.
43019002	Description	Bönniʼ röjáquiëʼ gudil-la naʼ gulunëʼ tu breguiʼ niʼa nëʼe yötsiʼ, ateʼ buluʼdxíëʼ le icjëʼ Jesús, en buluʼgácuëʼ Lëʼ tu lariʼ tunna xiná chul-la ca naca le tácuëʼ bönniʼ taʼnná bëʼë.
54005014	Recommendation	Que lë ni naʼ, rë́ʼëndaʼ uluʼtsaga náʼgacanu leyúbölö nigula túzinu cani yúʼugacanu iz cuidiʼ, en uluʼscúlanu-biʼ yuguʼ bíʼidoʼ, en ilaʼnná béʼenu biʼi nacuáʼabiʼ yuʼu que queë́gacanu, para cabí iluíʼinu nu ridáʼbagaʼ rëʼu lataj bi innë́ queë́ruʼ, rëʼu naʼ réajlëʼëruʼ Cristo.
43014011	Faith	Guliʼtséajlëʼ nedaʼ, zóalen cazaʼ-nëʼ Xuzaʼ, ateʼ Xuzaʼ zóalen cazëʼ nedaʼ. Channö cabí gaca gunliʼ caní, guliʼtséajlëʼ nedaʼ niʼa quégaca dxin ni runaʼ.
66020014	Violence	Níʼirö yöjtsázagaca yöl-laʼ guti, en lataj chul-la ga niʼ röʼö guíʼ zxön le naca lataj que yöl-laʼ guti le raca burópilö.
58009026	Description	Laʼtuʼ guca caní, gun bayudxi quiʼi sáquëʼë Cristo, en gátiëʼ zián luzuí dza niʼte cateʼ gutaʼ yödzölió ga ridxintë naʼa dza, pero naʼa cateʼ naca dza údxi, tsaz buluíʼi lahuëʼ tu luzuísö, en budödi cuinëʼ lahuëʼ Dios, cateʼ gútiëʼ para bugǘëʼ dul-laʼ nabágaʼruʼ.
44013018	Description	Idú choáʼ iz Dios biáʼ gulénëʼ quégaquiëʼ cateʼ niʼ gulaʼdë́ʼ idú luyú bidxi lu lataj cáʼasö.
46011033	Recommendation	Que lë ni naʼ, böchiʼ luzáʼadoʼ, cateʼ udúbiliʼ para guíʼaj gáguliʼ para usubanliʼ ca gútiëʼ Xanruʼ, guliʼcöza luzáʼaliʼ.
66006012	Violence	Cateʼ buládzuʼë le buzxopi le naguelaʼ guichi naʼ, buyúaʼ, en biléʼedaʼ gudö́didaʼ budóʼ zxuʼ luyú. Böáca gasaj gubidza, en guca ca tu lariʼ guitsaʼ gasaj, ateʼ böáca beoʼ xiná ca naca rön.
58011035	Violence	Yuguʼ nigula dza niʼ buluʼzíʼinu biʼi que queë́gacanu nubángacabiʼ lu yöl-laʼ guti. Iaʼbal-lëʼ bönniʼ niʼ gulátiëʼ lu náʼagaquiëʼ bönniʼ niʼ buluʼsacaʼ ziʼë légaquiëʼ, en tuʼ cabí gulë́ʼënnëʼ uluʼcáʼanëʼ Dios, bitiʼ gulaʼziʼë lataj nu usán légaquiëʼ. Caní gulunëʼ para ilaʼdéliʼnëʼ yöl-laʼ rubán lu yöl-laʼ guti, lë naʼ guléquinëʼ nazácaʼrö.
44016037	Violence	Níʼirö birúajëʼ Pablo, en gudxëʼ yuguʼ niʼa náʼagaquiëʼ bönniʼ yúlahuiʼ naʼ, gunnë́ʼ: ―Chigulaʼguínëʼ netuʼ lógaca bönachi sal-laʼ bitiʼ narúguini queë́tuʼ ca rinná bëʼ xibá, en gulaʼguʼë netuʼ lidxi guíë, ateʼ netuʼ ni nabábatuʼ Roma. ¿Naruʼ tuʼsantsëʼ netuʼ bagáchiʼsö? ¡Bitiʼ caʼ gaca! ¡Ilídigarëʼ légaquiëʼ udusángaquiëʼ netuʼ!
45013009	Recommendation	Caní taʼnná bëʼ xibá naʼ: Bitiʼ gunuʼ dul-laʼ le riguitsaj xibá que yöl-laʼ nutsaga naʼ. Bitiʼ gútiuʼ bönachi. Bitiʼ cuanuʼ. Bitiʼ inníoʼ que luzóʼo le cabí nácatë. Bitiʼ së ládxuʼu le dë que luzóʼo. Yuguʼ xibá ni, en yúguʼtë xibá iaʼzícaʼrö, údxi gun nu run ca rnna didzaʼ rnna caní: Bidxíʼi luzóʼo ca nadxíʼi cuinuʼ.
62003003	Faith	Nútiʼtës nu run löza gaca ca náquiëʼ Jesús, ruíʼi ladxiʼ nu naʼ gaca dxiʼa ca naʼ náquiëʼ Jesús dxiʼa.
45007022	Faith	Lu icja ládxiʼdaʼahuaʼ raza ládxaʼa xibá queëʼ Dios
50004004	Recommendation	¡Buliʼdzéjalenticaʼsö-nëʼ Xanruʼ! Leyúbölö, rnníaʼ: ¡Buliʼdzeja!
66001012	Description	Buécjaʼ para iléʼedaʼ Bönniʼ naʼ rulidzëʼ nedaʼ. Cateʼ buécjaʼ, biléʼedaʼ gadxi le nuáʼgaca guíʼ le néquiguequini oro.
58003018	Sin	¿Nupxi niʼ benëʼ tsutsu xtídzëʼë Dios, gunnë́ʼ bitiʼ ilaʼyaza ga uluʼzíʼ ládxiʼguequi tsözxö́n len Lëʼ? Gulaca nupa niʼ bitiʼ gulún ca rnna xtídzëʼë Dios.
43010008	Sin	Chigulaʼlë́ʼë zián bönniʼ gulaʼnnë́ʼ nácagaquiëʼ Cristo, pero yúguʼtë bönniʼ naʼ bilaʼdxinëʼ zíʼalö ca nedaʼ, nácagaquiëʼ gubán, en taʼbán cazëʼ, ateʼ bitiʼ buluʼzë́ nágabaʼ böʼcuʼ zxilaʼ naʼ légaquiëʼ.
60002018	Recommendation	Núlöliʼ nácaliʼ bönniʼ nadóʼogaca, guliʼgadxi bönniʼ xanliʼ, en guliʼgún légaquiëʼ bal, calë́gasö gunliʼ bal yuguʼ bönniʼ xanliʼ naʼ nácagaquiëʼ tsahuiʼ, en tuíʼi ládxiʼgaquiëʼ libíʼiliʼ, pero guliʼgún bal caʼ yuguʼ bönniʼ xanliʼ naʼ tuʼsacaʼ ziʼë libíʼiliʼ lu dxin runliʼ quégaquiëʼ.
44006013	Description	Lëscaʼ buluʼcuʼë lógaquiëʼ nupa gulaʼguíxjöʼ le cabí nácatë, bönniʼ naʼ gulaʼnnë́ʼ: ―Bitiʼ zoëʼ dxisö bönniʼ ni rnnë ziʼë que yudoʼ láʼayi ni, en que xibá queëʼ Dios.
47005018	Faith	Yúguʼtë lë ni nunëʼ Dios, Nu bun rëʼu tuz len Lëʼ lu nëʼë Cristo, en budödëʼ lu naʼtuʼ guntuʼ libán ca gaca uluʼhuöáca yúguʼtë bönachi tuz len Lëʼ.
59005010	Recommendation	Böchiʼ luzáʼadoʼ, buliʼyú ca guca quégaquiëʼ bönniʼ guluʼë didzaʼ uláz queëʼ Xanruʼ. Nácagaquiëʼ ca tu le ruluíʼi rëʼu ca ral-laʼ quíʼi sácaʼruʼ, en cö́zaruʼ zxön ladxiʼ.
44002021	Faith	Uluʼlágaca yúguʼtë nupa niʼ uluʼlidza Lëʼ Xanruʼ, lu yöl-laʼ réajlëʼ quéguequi Lëʼ.
66007012	Faith	taʼnnë́ʼ: ¡Caʼ gaca! ¡Yöl-laʼ ba Liʼ, Dios queë́tuʼ! ¡Napuʼ yöl-laʼ zxön, en yöl-laʼ réajniʼi! ¡Rëtuʼ Liʼ: “Xclenuʼ”, en runtuʼ Liʼ bal! ¡Napuʼ yöl-laʼ unná bëʼ, en yöl-laʼ huáca! ¡Gácaticaʼsö caní quiuʼ, Dios queë́tuʼ! ¡Caʼ gaca!
60003003	Recommendation	Yöl-laʼ lachi queë́liʼ bitiʼ naca le zoa láhuisö, tsca rupáʼaliʼ ícjaliʼ, en tsca nácagaca le néquini oro nusíʼ cuinliʼ, en lariʼ nazácaʼdaʼ náculiʼ.
55001008	Faith	Que lë ni naʼ, bitiʼ utuíʼinuʼ gunuʼ ba nalí queëʼ Xanruʼ, en bitiʼ utuíʼinuʼ ca raca quiaʼ nedaʼ ni, nadzunaʼ lidxi guíë tuʼ runaʼ xichinëʼ, pero ben tsözxö́n nupa taʼguíʼi taʼzacaʼ tuʼ tun libán que didzaʼ dxiʼa. Dios gunnëʼ yöl-laʼ huáca quiuʼ para gunuʼ caní.
43017019	Description	Tuʼ nadxíʼigacadaʼ-nëʼ rudödi cuinaʼ quiuʼ, para uluʼrúajëʼ caʼ légaquiëʼ quez quiuʼ tuʼ nazíʼ lu náʼagaquiëʼ le naca idútë li.
66003002	Recommendation	Buliʼsubán ládxiʼliʼ. Guliʼgún tsutsu le nacuáʼlen libíʼiliʼ, le chizóa ilátigaca, tuʼ réquibeʼedaʼ le runliʼ bitiʼ naca idú tsahuiʼ lahuëʼ Dios.
66016004	Description	Guyijëʼ gubáz láʼayi bunni, en yöjlaljëʼ le yudzu zxígaʼdoʼ naʼ zönëʼ gapa dë yegu, en gapa ralaj nisa, ateʼ gapa dë nisa naʼ buluʼhuöáca rön.
45005002	Faith	Tuʼ réajlëʼëruʼ Jesucristo, ruzíʼiruʼ xibé le ruzáʼ ládxëʼë Dios queë́ruʼ, le rutipa ládxiʼruʼ. Rudzéjaruʼ tuʼ runruʼ löza uzíʼiruʼ caʼ xibé yöl-laʼ zxön queëʼ Dios.
49005005	Sin	Chinö́z quéziliʼ nitúëʼ bönniʼ runëʼ le ruáʼ döʼ bitiʼ caʼ tsáziëʼ ga rinná bëʼë Cristo tsözxö́n len Dios, o nu bönniʼ runëʼ le cabí ral-laʼ gunëʼ, o nu bönniʼ ruhuídiʼnëʼ. Nu naʼ ruhuidiʼ naca ca nu reaj ladxiʼ budóʼ guiö́j budóʼ yaga.
58011008	Faith	Cateʼ niʼ Dios bulidzëʼ Abraham, tuʼ guyéajlëʼë Abraham Lëʼ, benëʼ ca rnna xtídzëʼë Dios, en buzë́ʼë ladzëʼ para tsejëʼ lataj niʼ ral-laʼ siʼë ca tu le guequi tsaz queëʼ, ateʼ birúajëʼ ladzëʼ sal-laʼ bitiʼ nö́zinëʼ gazxi naʼ ral-laʼ tsejëʼ.
49005018	Recommendation	Bitiʼ súdxiliʼ, tuʼ gun yöl-laʼ rizudxi ga nítiliʼ tsaz. Guliʼgüíʼidaʼ lataj inná béʼenëʼ Dios Böʼ Láʼayi libíʼiliʼ.
61002002	Sin	Zianliʼ libíʼiliʼ gunliʼ légaquiëʼ tsözxö́n lu le ruáʼ döʼ ilunëʼ, ateʼ tuʼ gunliʼ bál-laliʼ caní ilaʼnnë́ xihuiʼ bönachi que didzaʼ dxiʼa le naca idútë li.
49002018	Faith	Naʼa, niʼa que le benëʼ Cristo, gaca ibígaʼruʼ lahuëʼ Xúziruʼ Dios, tuʼ zóalenëʼ Lë cazëʼ Dios Böʼ Láʼayi rëʼu, sal-laʼ nácaruʼ bönachi judío o bönachi izáʼa.
44021025	Recommendation	Ca naca quégaca bönachi izáʼa, nupa niʼ chitaʼyéajlëʼ Cristo, chibén xtídzaʼtuʼ, en buzúajtuʼ lu guichi ca ral-laʼ ilunëʼ. Bitiʼ run bayudxi ilún chiʼë yuguʼ lë ni tunëʼ bönniʼ judío, pero tuz: Bitiʼ ilahuëʼ le taʼgúʼu bönachi lógaca budóʼ guiö́j budóʼ yaga. Bitiʼ ilahuëʼ rön. Bitiʼ ilahuëʼ xipë́laʼgacabaʼ böaʼ guixiʼ bitiʼ narúaj-gácabaʼ rön. Bitiʼ ilunëʼ le ruáʼ döʼ.
44005003	Sin	Pedro gudxëʼ lëʼ: ―Ananías, ¿naruʼ guyázatsö Satanás tuʼ xihuiʼ lu icja ládxiʼdoʼo, en ben ga rizíʼ yéʼenuʼ Dios Böʼ Láʼayi, ateʼ bucachiʼ lanuʼ lateʼ dumí que xiyúʼ naʼ?
49004014	Recommendation	Bítiʼrö gácaruʼ ca yuguʼ bíʼidoʼ, ca nácagaca nupa naʼ tuʼtsaʼtë ca túngaca, en nácagaca ca tu le nachë́ʼ lu yegu, o ca tu le röjchë́ʼ bítiʼtës böʼ recja, tuʼ taʼzíʼ lu në́ʼeguequi bítiʼtës didzaʼ nu rusëdi léguequi, nu naʼ rizíʼ yeʼe léguequi len yöl-laʼ sinaʼ que, en run ga taʼchixi taʼnigui.
46006009	Sin	¿Naruʼ cabí nö́ziliʼ bitiʼ ilaʼyaza bönachi bitiʼ nácagaca tsahuiʼ ga rinná bëʼë Dios? ¡Bitiʼ siʼ yeʼe cuinliʼ! Bitiʼ caʼ tsaz ga rinná bëʼë Dios nu run le ruáʼ döʼ: Cuntu nu reaj ladxiʼ budóʼ guiö́j budóʼ yaga, en cuntu nu riguitsaj xibá que yöl-laʼ nutsaga naʼ, en cuntu nu bönniʼ run cuinëʼ ca nigula, en cuntu nu bönniʼ zóalenëʼ laʼ luzë́ʼe bö́nniʼsëʼ, en cuntu nu bönniʼ gubán, en cuntu nu ruhuidiʼ, en cuntu nu rizudxi, en cuntu nu rinnë́ xihuiʼ, en cuntu nu rucáchiʼlan. Bitiʼ caʼ tsaz nu run caní ga rinná bëʼë Dios.
58010025	Recommendation	Bal-la bönachi bítiʼrö tuʼdubi len rëʼu. Bitiʼ ral-laʼ gunruʼ ca tun bönachi naʼ, pero ral-laʼ utipa ládxiʼruʼ turuʼ iaʼturuʼ, en gúnröruʼ caní tuʼ riléʼeruʼ chizóa idxín dza huödëʼ Xanruʼ.
51003005	Sin	Que lë ni naʼ, guliʼgún ga ilaʼniti le nacuáʼlen libíʼiliʼ que yödzölió ni: Yuguʼ le ruáʼ döʼ, en le nácagaca xihuiʼ, en yuguʼ le rizë́ ládxiʼliʼ le ruáʼ döʼ, en yuguʼ le rizë́ ládxiʼliʼ le naca xihuiʼ, en yöl-laʼ ruhuidiʼ. Yöl-laʼ ruhuidiʼ naca lëbi ca nu reaj ladxiʼ budóʼ guiö́j budóʼ yaga, tuʼ cabí reaj ladxiʼ Dios nu ruhuidiʼ.
52005008	Faith	Naʼa, rëʼu ni, nácaruʼ que lahuiʼ dza, en ral-laʼ cö́zaruʼ baʼa ládxiʼdoʼ, tuʼ chinácuruʼ zxaruʼ le run chiʼi rëʼu, le naca yöl-laʼ réajlëʼ queë́ruʼ Dios, en yöl-laʼ nadxíʼi, ateʼ le runruʼ löza uláruʼ naca ca tu luʼu guíë le run chiʼi ícjaruʼ.
55001007	Grace	Böʼ naʼ bennëʼ Dios queë́ruʼ bitiʼ naca tu böʼ le gun ga gádxiruʼ, pero bennëʼ queë́ruʼ Böʼ Láʼayi Nu run ga náparuʼ yöl-laʼ huáca, en run ga nadxíʼiruʼ luzáʼaruʼ, en run caʼ ga rinná beʼe cuinruʼ.
62002004	Sin	Nu rnna: “Nedaʼ núnbëʼa-nëʼ Dios” pero bitiʼ run ca rinná bëʼ xibá queëʼ, nu ni rizíʼ yëʼ, en bitiʼ run le naca idútë li.
50002002	Faith	Naʼa guliʼgún ga udzéjarö ládxaʼa. Para gunliʼ caní, ral-laʼ gácaliʼ tuz len luzáʼaliʼ, en gaca lë́bisö ca nadxíʼiliʼ luzáʼaliʼ tuliʼ iaʼtuliʼ. Lëscaʼ caní ral-laʼ gácaliʼ tuz lu böʼ naca cázaliʼ, en ca rizáʼ ládxiʼliʼ.
43007030	Description	Níʼirö gulunëʼ bayudxi ilaʼzönëʼ Lëʼ, pero cuntu nu guzxö́n Lëʼ, tuʼ cabí ridxini dza queëʼ tsuʼë lu náʼagaquiëʼ.
54006018	Recommendation	Gunná beʼe légaquiëʼ ilunëʼ le naca dxiʼa, para ilaʼyandaʼ dxin dxiʼa tunëʼ, lë naʼ naca tu yöl-laʼ tsahuiʼ idú. Ral-laʼ bi uluʼnödzjëʼ quégaca bönachi yechiʼ, en iluíʼi ládxiʼgaquiëʼ léguequi.
43018030	Description	Buluʼbiʼë didzaʼ, tëʼ lëʼ: ―Laʼtuʼ cabí nuʼë bönniʼ ni döʼ, bitiʼ udö́dituʼ-nëʼ loʼ.
45014006	Faith	Bönniʼ naʼ runëʼ bal tu dza, runëʼ le bal para tseaj ládxëʼë Xanruʼ, ateʼ bönniʼ naʼ bitiʼ runëʼ bal dza naʼ, para tseaj ládxëʼë Xanruʼ bitiʼ runëʼ bal dza naʼ. Lëscaʼ caní, bönniʼ naʼ rahuëʼ yúguʼtë, rahuëʼ caní para tseaj ládxëʼë Xanruʼ, en rëʼë Dios: “Xclenuʼ”, ateʼ bönniʼ naʼ bitiʼ rahuëʼ yúguʼtë, bitiʼ rahuëʼ le para tseaj ládxëʼë Xanruʼ, en rëʼë caʼ Dios: “Xclenuʼ.”
45012012	Recommendation	Buliʼdzeja tuʼ zoa le runliʼ löza. Guliʼcö́z zxön ladxiʼ cateʼ bi riguíʼi rizácaʼliʼ. Buliʼlídzaticaʼsëʼ Dios.
44024023	Description	Níʼirö Félix gunná béʼenëʼ tu bönniʼ nacuʼë lu nëʼë bönniʼ röjáquiëʼ gudil-la zoëʼ niʼ, gun chiʼë Pablo, pero guʼë lëʼ lataj tëʼ löʼa, en bitiʼ uzáguëʼë xinö́zgaquiëʼ böchiʼ luzë́ʼë duyúgaquiëʼ lëʼ bi dxin ilunëʼ queëʼ.
46013007	Description	Ruáʼ rilenëʼ bítiʼtës bi gun luzë́ʼë queëʼ. Réajlëʼticaʼsëʼ luzë́ʼë. Rúnticaʼsëʼ löza gun luzë́ʼë le naca dxiʼa. Ribö́zaticaʼsëʼ zxön ladxiʼ.
47004013	Faith	Nazúaj lu guichi láʼayi le rnna: “Guyéajlëʼa Dios, ateʼ que lë ni naʼ bëʼa didzaʼ.” Lëscaʼ caní raca queë́tuʼ, réajlëʼëtuʼ Dios, en que lë ni naʼ ruíʼituʼ didzaʼ.
52005014	Recommendation	Lëscaʼ caní richízatuʼ icja nágaliʼ, böchiʼ luzáʼatuʼ, para usáʼaliʼ ládxiʼgaca nupa bitiʼ túngaca dxin, en utípaliʼ ládxiʼgaca nupa tuʼhuö́aj ládxiʼguequi, en gácalenliʼ nupa bitiʼ naca tsutsu ca taʼyéajlëʼ Cristo, en gácaliʼ nöxaj ladxiʼ lógaca yúguʼtë bönachi.
66016010	Description	Guyijëʼ gubáz láʼayi guyuʼ naʼ, en yöjlaljëʼ le yudzu zxígaʼdoʼ zönëʼ lu xilataj böaʼ síniaʼ ga naʼ rinná bë́ʼëbaʼ, ateʼ gurö́ʼö chul-la gapa rinná bë́ʼëbaʼ. Níʼirö, tuʼ gulaʼguíʼi gulaʼzacaʼ bönachi, guláguyaʼa lúdxiʼguequi,
48006016	Grace	Yúguʼtë bönniʼ naʼ tunëʼ ca rinná bë xibá runaʼ ni, en yúguʼtë bönniʼ naʼ néquiguequinëʼ queëʼ Dios, rinábidaʼ-nëʼ Dios gunëʼ ga soa dxi ládxiʼdoʼgaquiëʼ, en huéchiʼ ládxëʼë légaquiëʼ.
44018025	Faith	Chinazëdëʼ bönniʼ ni ca naca le réajlëʼëruʼ Xanruʼ. Idú ládxëʼë bëʼë didzaʼ, en ca nácatë busédinëʼ bönachi ca naca queëʼ Jesús, sal-laʼ núnbëʼë tuz le ruquíla bönachi nisa ca benëʼ Juan.
46010031	Recommendation	Channö bi gáguliʼ o bi guíʼjaliʼ, o bítiʼtës bi gunliʼ, guliʼgún yúguʼtë para gaca queëʼ Dios yöl-laʼ ba.
62002027	Recommendation	Naʼa, zóalenëʼ Dios Böʼ Láʼayi libíʼiliʼ. Cristo gusö́l-lëʼë Lëʼ queë́liʼ, ateʼ Lë cazëʼ zóalenticaʼsëʼ libíʼiliʼ. Que lë ni naʼ bitiʼ riquíniliʼ nu usedi libíʼiliʼ, tuʼ chizóalen Nu naʼ libíʼiliʼ, en rusedi libíʼiliʼ. Didzaʼ idútë li ruʼë Lëʼ, en bitiʼ rizíʼ yëʼë. Ca naʼ chinazë́daliʼ, guliʼsóalenticaʼsëʼ Cristo.
59002026	Faith	Ca naʼ raca que idútë le naca cázaruʼ channö cabí yuʼu böʼ, chinati, lëscaʼ caní naca que le réajlëʼëruʼ Cristo channö cabí naláʼ yöl-laʼ run que, bitiʼ naca lesacaʼ.
44027035	Description	Cateʼ Pablo budxi bëʼë didzaʼ ni, gudélëʼë yöta xtila, en gudxëʼ Dios: “Xclenuʼ.” Caní benëʼ lógaquiëʼ yúguʼtëʼ. Níʼirö buzxuzxjëʼ yöta xtila naʼ, en gusí lahuëʼ rahuëʼ.
44015020	Sin	Ral-laʼ uzúajruʼ lu guichi quégaquiëʼ uluʼcáʼanëʼ yuguʼ le bitiʼ ral-laʼ ilahuëʼ, le nadödi lógaca budóʼ guiö́j budóʼ yaga, en cabí ilunëʼ le ruáʼ döʼ, en cabí ilahuëʼ xipë́laʼgacabaʼ böaʼ guixiʼ bitiʼ narúaj-gácabaʼ rön, en cabí ilahuëʼ xichönbaʼ bítiʼtës böaʼ guixiʼ.
44023003	Sin	Pablo gudxëʼ lëʼ: ―Lëzcaʼ caní Dios ubiʼë quiuʼ, liʼ, ruluíʼisö tsahuiʼ cuinuʼ. ¿Naruʼ röʼö cazuʼ ruchiʼa rusörö́uʼ nedaʼ ca rinná bëʼ xibá, pero ridödi bëʼtsoʼ ca rinná bëʼ xibá naʼ, naʼ rinná béʼenuʼ ilaʼgápëʼë nedaʼ?
45008001	Description	Que lë ni naʼ, bítiʼrö bi xíguiaʼ nabágaʼgaquiëʼ yuguʼ bönniʼ néquiguequinëʼ queëʼ Jesucristo, bönniʼ naʼ bítiʼrö tunëʼ ca rë́ʼëni yöl-laʼ bönáchisö quégaquiëʼ, pero ca rë́ʼënëʼ Dios Böʼ Láʼayi tunëʼ.
52005009	Grace	Caní naca, tuʼ nuzóëʼ Dios rëʼu ni, calëga para idxinruʼ ga ichúguiëʼ queë́ruʼ, pero para uláruʼ tuʼ ruzxöni ládxiʼruʼ-nëʼ Xanruʼ Jesucristo,
66020008	Violence	Urúaj Satanás, en tsöjzxíʼ yeʼe bönachi yuguʼ yödzö nacuáʼ idapa laʼa yödzölió. Siʼ yeʼe caʼ bönachi yödzö Gog, en yödzö Magog, ateʼ utubi léguequi lu gudil-la. Tsca nácagaca nupa ni, nácagaca ca naca yuzxi röʼö tu raʼ yegu zxön.
46006011	Grace	Caní gúcaliʼ bál-laliʼ libíʼiliʼ, pero naʼa chinuhuöácaliʼ dxiʼa que dul-laʼ gubágaʼliʼ, en chinéquiliʼ quez queëʼ Dios, en chinuhuöácaliʼ tsahuiʼ niʼa que le benëʼ Xanruʼ Jesús. Böʼ Láʼayi queëʼ Dios runëʼ ga raca caní.
55001012	Faith	Que lë ni naʼ riguíʼi rizácaʼa caʼ yuguʼ le raca quiaʼ ni, pero bitiʼ rutuíʼidaʼ, tuʼ núnbëʼa Nu naʼ réajlëʼa. Runaʼ löza Lëʼ, napëʼ yöl-laʼ huáca gapa chiʼë le budödaʼ lu nëʼë ga idxintë dza niʼ huödëʼ.
49006018	Faith	Guliʼgún yúguʼtë lë ni, en buliʼlidzëʼ Dios inábiliʼ-nëʼ gácalenëʼ libíʼiliʼ. Buliʼlídzaticaʼsëʼ Dios zóalenëʼ Dios Böʼ Láʼayi libíʼiliʼ. Para gunliʼ caní ral-laʼ usubán ládxiʼliʼ en cabí huö́aj ládxiʼliʼ, inábiliʼ-nëʼ Dios gácalenëʼ nupa néquiguequi queëʼ.
52001001	Grace	Nedaʼ, Pablo, rugapaʼ Dios libíʼiliʼ, zóaliʼ Tesalónica. Néquiliʼ queëʼ Cristo, ateʼ nácaliʼ tuz len Dios, encaʼ len Xanruʼ Jesucristo. Dzágagaquiëʼ nedaʼ Silvano, en biʼi Timoteo. Rinábidaʼ-nëʼ Xúziruʼ Dios, encaʼ Xanruʼ Jesucristo uzáʼ ládxëʼë queë́liʼ, en gunëʼ ga soa dxi icja ládxiʼdoʼoliʼ.
50004005	Faith	¡Guliʼgaca dxiʼi ladxiʼ len yúguʼtë bönachi! ¡Chizóa huödëʼ Xanruʼ!
46011026	Faith	Caní gaca ga idxintë dza huödëʼ Xanruʼ. Yúguʼtë luzuí gáguliʼ yöta xtila caní, en guíʼjaliʼ que le yudzu zxígaʼdoʼ caní, uluíʼiliʼ lahui ca gútiëʼ Xanruʼ.
59005015	Faith	Cateʼ uluʼlidzëʼ Dios, en taʼyéajlëʼë gunëʼ Cristo ga huöáquiëʼ bönniʼ huëʼ naʼ, níʼirö gunëʼ Xanruʼ ga huöása uzóëʼ, en channö benëʼ dul-laʼ bönniʼ huëʼ naʼ, Xanruʼ uniti lahuëʼ lëʼ.
55001003	Faith	Reaʼ-nëʼ Dios: “Xclenuʼ” ca naca quiuʼ cateʼ rulidzaʼ-nëʼ Dios. Bitiʼ rizóa dxíaʼ rinabaʼ niʼa quiuʼ rëla, en te dza lahuëʼ Dios, Nu naʼ runaʼ xichinëʼ idú ládxaʼa ca naʼ gulunëʼ xuz xtáʼahuaʼ.
66006016	Description	Gulë́ʼ yuguʼ guíʼadoʼ naʼ, en yuguʼ lëʼe guiö́j naʼ: “Guliʼdubágaʼ netuʼ, en buliʼcachiʼ netuʼ, para cabí iléʼe Nu naʼ röʼö lataj lo niʼ netuʼ, en para cabí ideliʼ yöl-laʼ rilé queëʼ Bönniʼ naʼ náquiëʼ Böʼcuʼ Zxílaʼdoʼ netuʼ.
66002017	Description	Nu riyöni ral-laʼ uzë́ nagui lë ni rnnëʼ Dios Böʼ Láʼayi, ruíʼilenëʼ yuguʼ cöʼ bönachi quiaʼ nedaʼ, Cristo, didzaʼ, rnnëʼ: Nupa ilaʼdeliʼ lu le raca yödzölió, gunaʼ ga ilágugaca yöta maná nagachiʼ. Unödzjaʼ caʼ tu guiö́j chiguíchidoʼ quégaquiëʼ, ateʼ lu guiö́j naʼ nazúaj tu la cubi, cuntu nu nunbëʼ le, pero núpasö naʼ ilaʼzíʼi le, ilúnbëʼe la naʼ.”
61002003	Sin	Lu yöl-laʼ ruhuidiʼ quégaquiëʼ uluʼsédinëʼ libíʼiliʼ le cabí nácatë, para gataʼ quégaquiëʼ dumí queë́liʼ. Chinarugu quégaquiëʼ bönniʼ ni, ateʼ naca löza ilaʼnítiëʼ tsaz.
53002011	Sin	Que lë ni naʼ Dios guʼë lataj idxín quéguequi tu nu run yöl-laʼ huáca, nu siʼ yeʼe léguequi para ilaʼyéajlëʼ le cabí nácatë.
45002024	Sin	Nazúaj lu guichi láʼayi ca runliʼ, rnna: Niʼa que le runliʼ libíʼiliʼ nupa bitiʼ nácagaca judío taʼnnë́ ziʼ queëʼ Dios.
55003008	Sin	Ca naʼ guláquiëʼ Janes, en Jambres, bönniʼ niʼ gulaʼdáʼbaguëʼë Moisés, lëscaʼ caní ilácagaquiëʼ bönniʼ ni, ilaʼdáʼbaguëʼë le naca idútë li. Ilácagaquiëʼ chul-la niti, en ilaʼchíxinëʼ ca naca le réajlëʼëruʼ Cristo.
66003019	Recommendation	Nedaʼ ruzedaʼ bach, en run ziʼa yúguʼtë nupa nadxíʼidaʼ channö cabí tun le naca dxiʼa. Que lë ni naʼ, buliʼbíʼi ládxiʼliʼ, en guliʼgún xichinaʼ idú ládxiʼliʼ.
45005001	Faith	Naʼa, rnnëʼ Dios nuhuöácaruʼ tsahuiʼ lahuëʼ Lëʼ niʼa que le benëʼ Xanruʼ Jesucristo, channö réajlëʼëruʼ Lëʼ, ateʼ que lë ni naʼ nuhuöácaruʼ tuz len Lëʼ.
54004016	Recommendation	Gudapa chiʼi cuinuʼ, en gudapa chiʼi xibá rusédiruʼ. Bénticaʼsö yuguʼ lë ni, ateʼ channö gunuʼ caní, ulóʼ liʼ, en uluʼlágaca caʼ nupa ilaʼyöni liʼ.
44026011	Violence	Zián luzuí busacaʼ ziʼa yuguʼ bönniʼ niʼ para uluʼsán ládxiʼgaquiëʼ ca taʼyéajlëʼë Cristo. Caní benaʼ gapa naca lu yuʼu ga tuʼdubëʼ bönniʼ judío, en tuʼsëdëʼ queëʼ Dios. Gulédeʼedaʼ légaquiëʼ, ateʼ gudxía ládxaʼa légaquiëʼ ga bidxintë guyijaʼ gapa nacuáʼ yödzö ziʼtuʼ para tsöjxö́ngacaʼ-nëʼ.
48005019	Sin	Naca bëʼ le tun bönachi lu yöl-laʼ bönáchisö quéguequi. Tun dul-laʼ le riguitsaj xibá que yöl-laʼ nutsaga naʼ, encaʼ dul-laʼ le lëʼë. Tun yuguʼ le naxihuiʼ, en yuguʼ le catsahuiʼ.
46003007	Grace	Caní naca, látiʼdoʼos nazáquiëʼ bönniʼ guz, en látiʼdoʼos caʼ bönniʼ riguʼë nisa, pero nazácaʼdëʼë Dios Nu run ga rilén, en rizxö́n xisedoʼ naʼ.
46001007	Faith	Que lë ni naʼ, bitiʼ bi riyadzaj queë́liʼ que le runnëʼ Dios Böʼ Láʼayi queë́ruʼ, tsanni ni ribö́zaliʼ dza naʼ iláʼ lahuëʼ Xanruʼ Jesucristo.
66014002	Description	Níʼirö biyöndaʼ tu le rigúʼu bö yehuaʼ yubá, le rinnë́ zidzaj ca rinnë́ tu yegu zxön, en ca rinnë́ guziúʼ. Biyöndaʼ le riyö́n cateʼ taʼguínniëʼ lëʼe tu le rul-la zë zián du que.
44010043	Faith	Lëscaʼ yúguʼtë bönniʼ guluʼë didzaʼ uláz queëʼ Dios gulunëʼ ba nalí queëʼ Jesús, gulaʼnnë́ʼ: “Yúguʼtë nupa ilaʼyéajlëʼ Lëʼ, Dios uniti lahuëʼ dul-laʼ nabágaʼgaquiëʼ niʼa que le benëʼ Lëʼ.”
45002007	Faith	Unödzjëʼ yöl-laʼ naʼbán idú quégaca nupa túnticaʼsö le naca dxiʼa, tuʼ tuíʼi ládxiʼgaquiëʼ uluʼziʼë xibë́ʼ Dios, en uluʼrúajëʼ dxiʼa lahuëʼ Lëʼ, en ilaʼcuáʼticaʼsëʼ.
66001004	Grace	Nedaʼ, Juan, ruzúajaʼ lu guichi didzaʼ ni le uzéajniʼi gadxi cöʼ bönachi queëʼ Cristo nacuáʼ luyú Asia. Dios, Bönniʼ zoa cazëʼ, en guzóaticaʼsëʼ, en ral-laʼ huödëʼ, rinábidaʼ-nëʼ uzáʼ ládxëʼë queë́liʼ, en gunëʼ ga cöʼö dxi icja ládxiʼdoʼoliʼ, ateʼ dzágagaca gadxi böʼ Lëʼ nacuáʼ lahuëʼ Lëʼ ga niʼ röʼë rinná bëʼë.
44019004	Faith	Pablo gunnë́ʼ: ―Buquílëʼ Juan bönachi nisa, nupa niʼ buluʼbíʼi ládxiʼguequi, ateʼ Juan caz gudxëʼ léguequi ral-laʼ ilaʼyéajlëʼ Bönniʼ naʼ siʼ záʼtëlëʼ ca lëʼ, ateʼ Bönniʼ ni naquiëʼ Jesús, Lëʼ Cristo.
61002009	Violence	Caní naca, Xanruʼ nö́zinëʼ usölë́ʼ nupa naʼ tadxi Lëʼ lu naʼ nu run ga tsázagaca bönachi nöza dul-laʼ, pero nucö́zëʼ xíguiaʼ gunëʼ nupa bitiʼ nácagaca tsahuiʼ ga idxinrö dza ichúguiëʼ quéguequi ilaʼniti tsaz.
58011016	Grace	pero gulaʼzáʼ ládxiʼgaquiëʼ que luyú naʼ nácarö dxiʼa, le röʼ yehuaʼ yubá. Que lë ni naʼ bitiʼ rutuíʼinëʼ Dios cateʼ taʼnnë́ʼ náquiëʼ Dios quégaquiëʼ, tuʼ chinupë́ʼë tu yödzö quégaquiëʼ.
54004007	Recommendation	Gurúʼuna yuguʼ didzaʼ ridasö que yödzölió ca naca didzaʼ tuíʼinu yuguʼ nigula gula. Bénticaʼsö le gun ga gacuʼ tsutsu para gunuʼ ca rë́ʼënëʼ Dios.
