47004008	Description	Mas cya' la rzac de̱ coz deet, tees walab nu nit loñ de̱. Yu' nu dzi drush de̱ shcab, tees waglazh la consuel ne̱ de̱.
44002013	Description	Tees yu' ga' mbecy canu rgubdzaa dey. Orze' nay: ―¡Ni ricy dey gun rzugy yu! ―na dey.
66021018	Description	Orze' lo' ze' byaañ nu tub lo gyita' nu la jaspe. Nunu gyedz ze' byaañ nu du ub or la. Nunu rabeeñ gal nu rabee guan nu nap byecy lo.
66015006	Description	Orze' ze' bruu gagy anc, yad nu dey gagy cashtig. Orze' de anc ze' zu dey tub negy cacy nu la lino. Tona' la ryal ñi. Ze' ri sinch or lyush yu.
45012014	Recommendation	Bdiiñ der lo Ñgyoozh nu nap gyicy num de mbecy nu rshet zi de ru. Bdiiñ der lom nu nap gyicy num dey. Cue' ca nu shiñ gyicy num dey.
66001015	Description	Nunu ryal gyi'm gal nu ryal gyiib cach nu ryanap nañ yo. Nunu ti'm rzigy ñi gal nu rzigy ze' nu yet nis.
43017026	Grace	Ya̱ bi brica̱ nu gad lagy dey nu cyu nac ru, nunu gric zira̱ nu gad lagy dey par lo, gun orze' mod nu ru rcar ya̱, laaba' mod ze' ca dey losa'y. Nunu laab ya̱ tub zi'l naca̱ du̱ dey ―na Jesuuz rab mi Ñgyoozh.
45008032	Grace	Gun Ñgyoozh wantiily lom. Gashtal I'ñ mi bzeed mi nu gut mi nu nac dela den. Orze' segur la cuic mi dela coz ni den gal nu I'ñ mi.
65001018	Sin	De yu ze' mnii dey: “Ornu bi yad lazh tiem, orze' gruu zac mbecy rgubdzaa. Orze' de yu ze' zaab gyicy la dey de coz nu rlagy ub zi'l yu”, na de aposht.
45011018	Recommendation	Tees cue' nii too der nu nap zir der gaze' de mbecy nu guc gal nu na yaa yag nu guch ze'. Benu rash der shcab nu nap zir der, orze' cue' nit lagy der nu walab yaañ rbic ñi fers ni lyuñ, sinu lyuñ rbic ñi fers ni de yaañ.
47001024	Faith	Walab nu rlagy de̱ nu por fers la cheña lagy der de coz nu gne̱e̱, gun de ru bi rzu fert der nu nac de coz ni Crisht. Coz nu rlagy de̱, nde' nu gyicya̱ riiñ tublaazh la nu de ru, gun orze' zu cyit lagy der nu nac de riiñ nu gyicy den.
43011001	Description	Bzu tub mbecy rat: yu nu la Lázaro. Yu ze' tub mbecy Betania, gyedz ze' nu rcyiiñ Li nu bily ñii Mart.
52004008	Sin	Orze' cyu zi'l mbecy nu washet ic nu gyicy gal nu rdunii ii, yu ze' walab nu wacshet ic yu de coz nu rnii mbecy zi'l, sinu washet ic yu nu gyicy yu de coz nu rnii Ñgyoozh, biñ nu rbic Espiriit Yon nim ni den.
62004002	Faith	Nii tub mod nu gac gad lagy der nu ca na mbecy nu ricy cup Espiriit Yon ni Ñgyoozh nañ lardoo: dela mbecy nu driib cuen nu Jesucrisht biid mi gyishlombecy byac mi mbecy nu rishli, orze' dela de yu ze' ricy cup yu Espiriit Yon ni Ñgyoozh.
65001008	Sin	Tees ni' zi'l mod ricy de mbecy rguu nu gu' dze ga lat der ze'. Pcaal rniiñ lo dey nu lac mod gyicy yu. Orze' ricy dey cyi nu ricy ñi nu rabag cuerp ni dey. Nunu rzuub yaa dey de riidz nu rnii Shuaan den Jesuuz nu gyicy na. Nunu rab zi dey de anc fert.
60003011	Recommendation	Bruu chu der lo de coz a̱' nap. Orze' bicy der coz nap. Byub der tub mod nu nap nu chu' nur de losa'r. Orze' nde' zaab bicy la der ñii.
51001023	Faith	Tees par nu ni ricy Ñgyoozh num de ru, orze' rlagy ñi nu gzu fert der nu nac de coz nu bi ricy cup der consuel lo. Orze' cue' glaa yaa der de coz nu rgyish lo der lo, de coz nu guud ni der ornu güeñ ru de riidz nu sac ni Jesucrisht. De nde' riidz nu rdunii lo de mbecy dutuub la gyishlombecy. Nunu gaza̱' ya̱ Baly rlocyuuba̱ nu rshaala̱ de riidz ze'.
43008059	Violence	Orze' brugyi' rte' dey gyita' nu gow gyita' dey mi gal gat lam. Tees wansac dey ca gush mi. Orze' bruum loli' ni yu' nu driib zily mbecy Ñgyoozh zam.
49004024	Recommendation	Orze' rlagy ñi gyac der tub mbecy cub, dub gal mod nu psa' lagy Ñgyoozh. Orze' rabee nu ni na der nu nac nu ricy ru mod nu se'ñ, mod nu rlagy Ñgyoozh. Ricy der mod nu rishli.
66014012	Faith	Orze' dela de mbecy ni Ñgyoozh rlagy ñi nu gyicy cup dey pase̱z. De yu nu rzuub gyidag nim, de yu nu ricy paa ni Jesuuz, dela dey rlagy ñi nu gyicy cup dey pase̱z ―nay.
44013030	Description	Tees Ñgyoozh bicy mi nu byabañ mi.
43010011	Description	’Ya̱ na gal nu na tub biñ nu nap rña shily. Ze' biñ nu nap rña shily ze', shet ic mi nu gat mi nu nac de shily ze'.
49003002	Grace	Tees de ru segur la bi neñ der nu Ñgyoozh dzi nap mi. Nde' nu bdu'm riiñ ya̱a̱, gun nu nde' coz nu cyiiñ par de ru.
56003010	Recommendation	Ze' benu ca na mbecy ricy yu nu yacyup nac de mbecy ni Crisht, mas bi pshuu nur yu tub tir o cyup tir, ze' benu wagyicy cuen yu de coz nu rniir, orze' cor yu lat de mbecy ni Crisht.
43010019	Description	Orze' byac cyup nac de mbecy Israeel tuuba' tir nu nac de riidz nu mniim ze'.
43003033	Faith	Tees de mbecy nu “O” rnii ni de coz nu rniim, yu ze' ricy dey nu gabe nu par ub yu, de riidz nu rnii Ñgyoozh, nde' riidz rishli.
61003014	Recommendation	Nde' nu der bicy na nu dzi rca̱, lat nu rbez der de coz ze', orze' bicy der dela coz ca na la nu gac nir, gun ornu Ñgyoozh gyap mi der, orze' lat ze' nap yu' nu der losa'r, nunu sac ni tub la falt ni der.
53003001	Faith	Ze' laab nii la stub coz nu ne̱e̱ lo der bicy na, nde' nu cyiñ der lo Ñgyoozh nu nac de̱ ya̱. Cyiñ der lom nu dzach grush las de riidz ni Shuaan den Jesuuz dela lugaar nunu cyiñ der lom nu ca lagy de mbecy loñ gal nu guc lat de ru.
47004014	Faith	Gun rad lagy de̱ nu Ñgyoozh, biñ nu bicy nu byabañ Shuaan den Jesuuz, ni' zi'l gyicy mi nu gyabañ de̱ ya̱ nu Jesuuz. Nunu gyicy mi nu tublaazh la gyecha̱' de̱ gal nu de ru lom.
59005014	Recommendation	¿A yu' mbecy rat lat der? Orze' rlagy ñi nu cuedz dey de yu bel nu zu riiñ lat de mbecy ni Crisht. Orze' cyiñ dey lo Ñgyoozh nu nac yu rat ze'. Nunu coo dey asecy tooy. Orze' nii dey lo Shuaan den nu gyicy yac mi yu.
44007023	Description	’Na ornu Moisees yu'y tub ña'n cyuu, orze' mnii tooy nu cha güiiy la ricy de losa'y, de mbecy Israeel.
44023027	Violence	De mbecy Israeel bdu' yaa dey mbecy nu zeeda̱ lor ii, nunu bicy pee dey nu ñgyut dey yu. Mbecy briic yu nu gad lagya̱ nu nash yu Rom. Orze' gua̱ du̱ soldad ne̱, nunu blo̱o̱ mbaña̱y.
44019029	Description	Orze' dutuub la lat gyedz brush las nu zu redz ze'. Orze' de mbecy zigy bdu' yaa dey Gayo nu Aristarco, cyup mbecy Macedonia nu rded nu Baly. Orze' za nu dey yu carer par nañ yu' nu ryatublaazh de mbecy.
44003014	Sin	Mi ze' biñ yon, biñ nu sac cyi, tees de ru mne' der mi. Lugaar nu nii der nu ndulaa mi ze', ca tub yu nu rut mbecy mnii der nu dulaay.
44015009	Faith	Mod nu bicy num de ub na laab ni' zi'l mod bicy num dey. Bicy sulagy mi de cyi nu bicy dey, gun ricy cup dey consuel lo Crisht.
46011028	Recommendation	Orze' tub ga la mbecy rlagy ñi nu gash dey shcab ben lac mod na dey. Gaze' nu gow dey gyishtily ze', nunu go' dey ñup ze'.
46015058	Faith	Na der bicy na, bzu fert der nu nac de coz ni Crisht, nunu bicy paa der nim. Bloo lo der nu de riiñ nu ricy ru ni Ñgyoozh, gun bi neñ der nu la zi'l coz ni Ñgyoozh nu ricy der walab nu leew la ricy der ñii.
46004016	Recommendation	Nde' nu rnishba̱a̱ lo der nu gyicy der gal nu ricy ya̱.
46001021	Faith	Gun Ñgyoozh, nu nac nu yu' shcab nim, bicy mi nu rila wac chu' lo de mbecy mi nu nac shcab lily ni de ub zi'l dey. Sinu ricy mi nu gruu mbañ mbecy nu ricy cup consuel lom par nu nac de riidz nu rshaal na nim, mas mbecy rzii dey nu riidz ze', nde' riidz ton.
60003001	Recommendation	Na de ru biñ mñaa, ni' zi'l rlagy ñi nu “O” nii der ni ñgyeer, gun benu nac yu mbecy nu wagyicy cup consuel lo de riidz nu sac ni Crisht, orze' ornu gzac yu de mod nap nu ricy der, orze' dzi ga guugy lardooy. Orze' gyicy cup yu consuel. Orze' ni walagy ñi nu niir ni tub la riidz,
47005020	Recommendation	Orze' de̱ ya̱ naca̱ mbecy nu bzuu nez Crisht nu cha̱ por cuen nim. Nañ gal nu na nu Ñgyoozh rniim lo der nu nac de̱ ya̱. Nde' nu rnishba̱a̱ de̱ lo der nu gyanap riidz nir nur mi ze'.
44002024	Description	Tees Ñgyoozh bicy mi nu byabañ mi. Bloom mi lat de mbecy gut, gun ze' nu yu' mbecy gut wac soow ñi lom.
59002007	Sin	¿A walab de yu ze' yu nu rnii zi ni Jesucrisht, biñ nu rzat zi mbecy ornu rzat zi dey de ru?
54003003	Description	Cue' gac yu mbecy rzugy. Cue' gac yu mbecy dzech na. Sinu rlagy ñi nu gac yu mbecy nu nap ri lardoo. Rlagy ñi nu gac yu mbecy gugy na. Cue' gac yu mbecy nu ye rzac lo tiñ.
43004014	Grace	Ze' de mbecy nu go' nis nu ya̱ grica̱, de mbecy ze' rila wabigya' dey nis. Gun nis nu ya̱ grica̱, nde' gyicy ñi nu gyac nañ lardoo dey gal na tub ze' nu driib nis. Nis ze' gyicy ñi nu cui mbañ dey tub la ―nam.
62002005	Faith	Ze' mbecy nu ricy yac de riidz nim, yu ze' rca za' lay mi. Nunu nde' mod nu gad lagy na nu tub zi'l nac naa dun mi.
66016013	Description	Orze' bzaaca̱ chon nuras. Na dey gal nu na bigy. Orze' bruu dey ru' low dañ ze', gal nu ru' bañ dañ ze', gal nu ru' mbecy fals nu rnii por cuen ni Ñgyoozh.
59002008	Recommendation	Benu gyicy yac der gal nu rnii leey zub lo ni Ñgyoozh, ze' nu rniiñ: “Pca der losa'r gal nu rcar ub ru”, rniiñ, benu ni ricy der, orze' nap.
47004005	Faith	Ornu rshaal de̱ de riidz ni Ñgyoozh, walab nu rzat de̱ uba̱, sinu rne̱e̱ de̱ nu Jesucrisht nac mi Shuaan den. Nunu rne̱e̱ de̱ nu de̱ ya̱ naca̱ mbecy nu ricy coz nu rlagy ñi ni de ru nu nac Jesuuz. Nde' zi'l riiñ nu ricy de̱.
46015033	Recommendation	Cue' zaan der nu guu mbecy ru. “Benu mbecy a̱' nap chesa nuy mbecy nap, orze' gyicy yu nu gnu mbecy nap”, rnii dey.
58013020	Grace	Orze' Shuaan den Jesuuz nac mi biñ lily nu rña de mbecy nu nac shily nim nu nac reñ mi nu bzu nap trat ni Ñgyoozh nu rila waded ni. Orze' Ñgyoozh, biñ nu rbic gyel ri zu, mi ze' bicy mi nu byabañ Jesuuz.
50001027	Recommendation	Bzu der cuidad. Nu se'ñ gu' der gal nu rlagy ñi nu chu' mbecy nu rzeña lagy ni de riidz nu sac ni Crisht. Gun orze' mas yap güi̱i̱ der o mas saca̱ lat der, tees rlagya̱ gyeña̱ nu ricy der tub zi'l shcab. Nunu rlagya̱ gyeña̱ nu gal gaa la rzu fert zir der ni de coz nu rzeña lagy den, de coz nu rnii de riidz nu sac ni Jesuuz.
46006014	Grace	Nunu gal nu Ñgyoozh bicy mi nu byabañ Shuaan den ornu gut mi, ni' zi'l gyicy mi nu gyabañ de ub na ornu gat den nu nac coz ily nu ricy mi.
55001006	Recommendation	Nde' nu ya̱ ne̱e̱ lor nu co lor nu nac riiñ nu briic Ñgyoozh nu gyicy ru ornu briib ya̱a̱ toor.
60004006	Grace	Tees Crisht gua shaal mi de riidz nu sac nim lat de mbecy nu bi gut, gun orze' Espiriit Yon nim gyicy mi nu cui mbañ dey gal nu Ñgyoozh mbañ mi. Nomaas lat nu pcyiiñ dey gyishlombecy nu cuerp niy, orze' Ñgyoozh briic mi cashtig ni dey gal nu ricy num de' zir de mbecy.
46007023	Recommendation	Gun Ñgyoozh ñgyup briib mi der. Orze' cue' zu bich der nu nac coz nu rlagy mbecy. Lugaar ni nde', nap zir bzu bich der nu nac de coz ni Ñgyoozh.
46010010	Recommendation	Ni cue' nii zi den ni Ñgyoozh gal nu bicy la be de gyitoo bel ne̱ de̱. Orze' tub anc nu la Anc nu Rbic Cashtig ni Ñgyoozh biit yu dey.
47002017	Faith	De̱ ya̱ cyiiñ de̱, gun wagyicy du̱ de̱ de riidz ni Ñgyoozh gal nu ricy de mbecy nu ricy dalje̱z nu la coz, gun yu' zigy mbecy nu ni ricy yu. De̱ ya̱, lugaar nu ni gyicy de̱, lo la Ñgyoozh li rshaal de̱ de riidz nim. Gun mi ze' bzuu nez mi de̱ ya̱, nunu de̱ ya̱ nac du̱ de̱ Crisht nunu mi ze' nac num de̱ ya̱.
45015001	Recommendation	Orze' de ub na, mbecy nu rad lagy nap de coz ni Crisht, rlagy ñi nu locyuub den losa'n ornu wagad lagy nap dey. Walagy ñi gyicy den coz nu rlagy ub zi'l na,
50002024	Faith	Nunu drish lo̱ nu Shuaan den Jesuuz gyicy mi nu ni' ya̱ yap gyiilya̱ lo der.
66007001	Description	Despuees ni de nu nde', orze' bzaaca̱ tap anc zu tub gay za' tap la scyiñ ni gyishlombecy. Orze' de yu ze' bicy dey nu cuez za' tap la bi ni gyishlombecy, gun orze' cue' nu gruuñ lo nisyudoo, ni lo yu. Ni lo ni tub la yag waruuñ.
60004003	Sin	Gun bi guzañ tiem nu de ru ni' zi'l bicy der laab de coz nu ricy de mbecy nu a̱' yu' lo Ñgyoozh. Lat nu gusa der gulas, orze' bicy der de lo la coz nu druu nañ lardoor. Nunu bgyiiñ lagy der lo de coz a̱' nap. Nunu bzugy shaad der gal ze' wagaca' la. Nunu bicy der sa' a̱' nap. Nunu go' der gashtal wancuica' la der raso̱o̱. Nunu briib zily der nab a̱' nap.
66011005	Violence	Benu ca na tub mbecy galagy yu shiñ gyicy nuy dey, orze' grib gyi ru' dey nu gnit lo mbecy ze'. Orze' ni mod gat cyu zi'l mbecy nu galagy nu shiñ gyicy nu de yu ze'.
44023005	Recommendation	Orze' na ga' Baly: ―Der bicy na, ya̱ wangad lagya̱ nu yu ze' nac yu yu nu riib ic de uz, gun riidz ni Ñgyoozh rniiñ: “Cue' nii zir ni yu nu riib ic losa'r”, rniiñ ―nay.
66022015	Sin	Orze' zet ru' gyedz chu' de mbecy a̱' nap. Yu' de mbecy nu ricy fis ni gyel tu'. Yu' de mbecy nu ricy gyel che̱'. Yu' de mbecy nu rut losa'. Yu' de mbecy nu driib zily nab. Yu' de mbecy rguu. Rguu dey nu nac mod nu ricy yu. Nunu rguu dey nu nac coz nu rniiy. Dela de yu ze' yu' dey par ich gyedz ze'.
66002014	Sin	Tees ya̱ ricy cupa̱ la be gyel cha' ic nu nac der. Lat de ru yu' la be mbecy nu walagy yu laa yaay de coz nu blyuu Balaam, yu nu briic consef ni Balac par nu gad lagy yu lac mod gyicy yu par nu gyicy yu nu gyicy mbecy Israeel coz cyi. Blyuuy ni dey nu gow yu de coz nu gua lo nab, nunu blyuuy ni dey nu gal dey losa'y nu wanchelaay.
53001003	Faith	Der bicy na, rlagy ñi nu dub laa tiem gric de̱ gras ni Ñgyoozh nu nac de ru gal nu yad ñi, gun tub dzi ga zaab gyicy cup zir der consuel lo Crisht, nunu zaab ca zir der de losa'r.
46012002	Sin	De ru rad lagy der nu anzir nu gyicy cup der consuel lo Crisht, mas lac ruu tees dzi radza der nu nac de nab gop nu wagac nii.
49005025	Recommendation	Na de ru yu gyeey, pca der mñaar gal nu Crisht pcam de mbecy nim, nunu pshet ic mi nu gut mi nu nac dey.
45012017	Recommendation	Benu tub mbecy shiñ ricy nuy de ru, orze' cue' gyicy gal ga der ñii. Byub der tub mod nu gyicy ru coz nu nap par dela mbecy.
60005006	Recommendation	Orze' bicy der gyel gyidz nir lo Ñgyoozh, biñ nu tona' la fert rña de ub na, gun orze' gyicy mi nu gac der mbecy lily tiem nu galagy ñi.
44014017	Grace	Tees dub laa tiem rlyuum cyu nac mi ornu ricy mi coz nap. Ricy mi nu yet gyey, nunu rbic mi cosech. Rbic mi coz nu gow der, nunu ricy mi nu zu cyit lagy der ―na dey.
54003011	Recommendation	Ni' zi'l mñaa dey rlagy ñi nu gac dem mbecy nu rca lagy losa' lo. Nunu cue' gac dem mbecy nu rnii rishcuen. Rlagy ñi nu gac dem mbecy nu zu cuidad nu nac ub. Nunu rlagy ñi gyicy paa dem nu dela coz nu gyicy mi.
66002021	Sin	Ya̱ brica̱ tiem nim par nu chaam mod nu gyicy mi, tees mi ze' wangalagy mi. Ni walagy mi laa yaam nu ral mi mbecy nu wanchelaam.
44012020	Description	Orze' Herodes tona' la guzi lagy yu lo de mbecy Tiro nu Sidón. Orze' tublaazh la gua güii dey yu. Nu loga la bicy dey Blasto par amig. Yu ze' zuy riiñ nu riib ic yu nañ yu' ni Herodes. Orze' mnishbaa dey lo Herodes nu cue' chucoo nuy dey, gun de coz nu row dey druuñ de lugaar nu riib ic yu.
43008049	Sin	Orze' na ga' Jesuuz rab mi dey: ―Walab nu bicy ni nuras ya̱. Tees driib zilya̱ Ñgyoozh uza̱. Ze' de ru rgüii naañ der lo̱.
43006018	Description	Laab or ze' tona' la fert bru'ña tub bi ily, nunu tona' la ricy ñi nu rzup nguuly lo nisyudoo ze'.
45008018	Faith	Ya̱ drusha̱ shcab ni de coz nu rzac zi den na wasaap ñi gyel lily nu lyuu Ñgyoozh lo den par lo.
62002012	Grace	Ya̱ zeeda̱ gyicy ii lo de ru yu nguzh, gun Ñgyoozh bi bicy sulagy mi de cyir nu nac Jesucrisht.
55001009	Grace	Orze' Ñgyoozh bi bloo mbañ mi de ub na, nunu bloo sum den nu chu'n mod nu se'ñ. Walab nu nac coz nu ricy de ub na, nde' nu ni bicy mi, sinu bicy mi ñii par nu nde' coz nu rlagy ub mi, nunu par nu nac faboor nu bicy num den nu nac Jesucrisht. Orze' nese anzir nu gzub gyi' gyishlombecy, bi psa' lagy mi nu ni gyicy mi.
43019006	Violence	Na ornu bzaac de yu zub lo ni de uz gal nu de yu nu rña nañ yu' nu driib zily mbecy Ñgyoozh, orze' brugyi' rbish ti dey. Orze' na dey: ―¡Cut ruy lo cruuz! ¡Cut ruy lo cruuz! ―na dey. Orze' na ga' Pilato rab yu dey: ―Laab de ru gua nu der yu nu caa der yu lo cruuz. Ze' ya̱, ya̱ wagyapa̱ ni tub la cyi nu bicy yu ―nay.
60001010	Grace	Orze' gulas de yu nu mnii por cuen ni Ñgyoozh nap tona' la psya' dey nu byub yu de ze' nu rniiñ ni de riidz nu gruu mbañ de mbecy. Nunu bzat dey de coz nu gyicy Ñgyoozh faboor num de ru nu cuic mi ni der.
63001007	Sin	Tees gyishlombecy ii tona' la zigy de mbecy rguu chesa dey. Wagnii dey nu Jesucrisht biid mi gyishlombecy ii nu rishli byac mi mbecy. De mbecy nu ni ricy ze', yu ze' nac yu mbecy rguu, nunu zay contr ni Crisht.
44024005	Sin	Byap de̱ mbecy ii tona' la ricy deet yu nu losa'y. Dutuub la gyishlombecy ricy cyup la'y de mbecy Israeel, nunu riib ic yu tub nac mbecy nu la nazarenos.
54003016	Grace	Rishli gaal dzi coz ily de riidz nim nu gal na briic mi nu gad lagy den. Riidz ze', nde' nu: Crisht gush mi cuerp ni mbecy, nunu bruu zac mi gyishlombecy ii. Orze' Espiriit Yon ni Ñgyoozh bicy mi nu byu' bee nu nac mi biñ nu sac ni tub la falt ni. De anc bzaac dey mi. Orze' brush las riidz nu rnii de coz nu bicy mi lat zañ nac mbecy. Orze' bicy cup mbecy consuel lom zañ lugaar ni gyishlombecy. Nunu despuees ni de nu nde', pshupa' Ñgyoozh mi gyibaa.  De nde' de riidz nu gal tiem na briic Ñgyoozh nu gad lagy den.
66016021	Violence	Orze' bruu gyey gye baa bet ñi too de mbecy. Tona' la zily ñi. Yu'ñ mas gashtal cyuu cyil tub gañ. Orze' mnii zi de mbecy ni Ñgyoozh nu nac cashtig ni gyey gye ze', gun nde' tona' la cashtig ily.
61003013	Faith	Tees de ub na rlez naa gal or gruu zac tub baa cub nu tub gyishlombecy cub, dub gal mod nu mnii Ñgyoozh. Orze' lugaar ze' chu' dela mbecy nap, de yu nu ricy gal mod nu rlagy ñi.
66006014	Description	Orze' mnit baa gal nu rzac tub lyag gyicy ornu rtub mbecy ñi. Orze' dela bicy nu dela yu nu ri lo nisyudoo, delañ bruu chuñ se'ñ.
58010010	Grace	Como Jesucrisht bicy mi gal nu rlagy Ñgyoozh, orze' bya' lo dela cyi den nu nac nu tub tir zi'l briic mi cuerp nim par tub gun lo Ñgyoozh.
52001002	Faith	Dub laa tiem dric de̱ gras ni Ñgyoozh nu nac dela der, nunu rzat de̱ de ru lat nu rne̱e̱ du̱ de̱ Ñgyoozh.
66006004	Violence	Orze' bruu zac tuuba' cuay coloor ña. Ze' yu nu riib ma ze', yu ze' guud rishbeey niy nu coy gyel ri zu gyishlombecy, nunu gyicy yu nu cut mbecy losa'y. Orze' guud tub mandzicy ily niy.
54006001	Recommendation	Dela moz nu byac ni mbecy por fers la rlagy ñi nu gyicy dey patro̱o̱ niy par mbecy nu yad ñi ni nu ca lagy yu lo nu dutuub la lardooy, gun orze' cue' nii zi mbecy ni Ñgyoozh nunu cue' nii dey nu coz a̱' nap de coz nu rlyuu den.
51003009	Recommendation	Cue' nu guu tub, guu tub zi'l der losa'r, gun mod nu na der gulas walaba' ni na der na. Nunu wagyicya' der de coz nu bicy ru gulas.
66002020	Sin	Tees ya̱ ricy cupa̱ tub gyel cha' ic nu nac der. De ru dzi ricy cup der pase̱z ni biñ mñaa nu la Jezabel. Mi ze' ricy mi nu rniim por cuen ni Ñgyoozh, tees rlyuum coz rguu ni de mbecy nu ricy de riiñ ne̱. Rlyuum ni dey nu gal dey losa'y nu wanchelaay. Nunu rlyuum ni dey nu gow yu de coz nu gua gun lo nab.
48003008	Grace	De riidz nu bzeeñ Ñgyoozh rniiñ nu par lo, Ñgyoozh gyicy mi nu de mbecy nu walab mbecy Israeel gyanap dey lom par nu nac nu gyicy cup dey consuel lom. Nde' nu Ñgyoozh nam rab mi Abraham lat de riidz ze' nim: “Ya̱ nap gyicy du̱ de lo la mbecy nu nac nu gyicy cup dey consuel lo̱ gal nu ricy cupa' ru consuel lo̱”, nam.
58012005	Recommendation	¿A mnit lagy der consef nu briic Ñgyoozh ni der como i'ñ mi nac der? De riidz ze' rniiñ: Orze' Ñgyoozh nam: I'ña̱, cue' nii too der nu se la la sac cashtig nu rbic Shuaan der nir ornu rshuu num der. Ni cue' shi'ñ der baloor ornu rdza'm ni der.
58013017	Recommendation	Bzuub gyidag der ni de yu nu riib ic der, nunu “O” nii der ni de riidz nu rnii dey, gun dey ze' rña dey de ru. Nunu rad lagy der nu de yu ze' zeed cuen dey lo Ñgyoozh nu nac coz nu ricy yu. Bicy der nu dub gusht la gyicy dey riiñ nim. Cue' nu shni gyicy dey riiñ nim, gun benu ni, orze' wac locyuub dey de ru.
44013019	Description	Orze' mnit lom gagy nac mbecy nu pcyiiñ lo de yu nu la Canaán, nunu briic mi lugaar ze' nu gani de mbecy nim.
54006003	Faith	Benu ca na mbecy lyuuy coz nu walab coz nu rlyuu de̱, o benu riidz nu lyuuy wasaap ñi riidz ni Shuaan den Jesucrisht, de riidz nu rlyuu de̱, o benu riidz nu lyuuy wasaap ñi riidz nu rnii lac mod gyicy den de coz nu rlagy Ñgyoozh,
63001010	Recommendation	Benu tub mbecy cyid yu lat der, ze' walab nu rlyuuy coz nu blyuu Crisht, orze' cue' niir nu chu'y nañ yu'. Ni cue' nii nur yu ñgyoozh.
47001005	Grace	Gun gal nu Crisht bzac zim, ni' zi'l zac zi ga' den nu nac mi. Tees ni' zi'l Ñgyoozh cuic zir mi consuel ni den nu nac Crisht.
65001011	Sin	¡Dzi ga cuaa de mbecy ze'! Gun za ca dey ich coz nu bicy Caiing. Orze' nu nac tiñ gudza dey gal nu gudza Balaam. Nunu gat dey gal nu gut Coré ornu guay contr ni Ñgyoozh.
65001010	Sin	Tees de mbecy ze' rnii zi dey ni de coz nu wagad lagy yu. Ricy dey gal nu ricy bañcyug nu sac shcab ni. La zi'l na coz nu rnii too dey ricy yu. Nde' nu nit lo dey.
58011007	Faith	Na Noé, nu nac nu bicy cup yu consuel lo Ñgyoozh, ornu mniim loy nu gyicy cuidad yu de coz nu yad par lo, de coz nu nigul sac yu. Orze' bzuub gyidag yu nim. Orze' bzaay tub barc. Nañ barc ze' bruu mbañ yu nu dela famil niy. Nunu ni mod blyuuy nu yu' falt ni dela mbecy nu yu' gyishlombecy. Nunu Ñgyoozh bicy mi yu par tub mbecy nu sac cyi nu nac nu bicy cup yu consuel lom.
58009006	Description	Na ornu bi zu lily de coz ze', orze' de uz nu zu riiñ lo Ñgyoozh zaab za la dey nañ cuart loga ze' par nu za' lo dey riiñ nu bi cay.
44007051	Sin	’¡Dzi ga cyigy too der! ¡Lardoo der nañ gal nu na lardoo tub mbecy nu a̱' yu' lo Ñgyoozh! Na der gal nu na tub mbecy go̱' par lo de riidz ni Ñgyoozh. De ru nar gal na' zi'l de gyitoo bel nir. Dub laa tiem ricy der coz nu za contr ni Espiriit Yon ni Ñgyoozh.
54001009	Sin	Rlagy ñi gad lagy den nu Ñgyoozh briic mi leey walab par nu chañ contr ni mbecy nu sac falt ni, sinu par nu chañ contr ni mbecy nu yu' falt ni, par de mbecy nu wagyicy yac coz nu rnii leey, par de mbecy nu wacsuub gyidag ni Ñgyoozh, par de mbecy nu shiñ ricy, par de mbecy cyi, par de mbecy nu waca lagy lo Ñgyoozh, par de mbecy nu waca Ñgyoozh, par de mbecy nu rut uz, par de mbecy nu rut ñaa, par de mbecy nu rut losa',
46005009	Recommendation	Lo tuuba' gyicy nu bzeeda̱ lo der ze', pca̱a̱ nu cue' gac nu der de mbecy nu ral losa' nu wanchelaa.
48001015	Grace	Tees Ñgyoozh nil bloo sum ya̱ nu gaca̱ nim nese anzir nu gala̱ ni ñaa. Orze' bicy mi tub faboor ily briib mi riiñ nim ica̱. Nunu bet lagy mi
45007015	Description	Wagyet lag napa̱ cuen de coz nu ricya̱, gun wagyicya̱ de coz nu rlagya̱ gyicya̱, sinu ricya̱ de coz nu rzi lagya̱ lo̱.
61003018	Faith	sinu nap zir bdu' lo der Shuaan den Jesucrisht, biñ nu co mbañ de ub na, nunu zaab gyicy zir mi faboor nu nap gyicy num der. ¡Rlagy ñi nu gyabic den gyel mbecy nim par dub laa tiem! ¡Laab ni gac ñii!
46004010	Description	De mbecy rzii dey nu de̱ ya̱ nac de̱ mbecy ton par nu nac Crisht. Ze' de ru rzii dey nu dzi lily na shcab ni der par de coz ni Crisht. De̱ ya̱ wacyiiñ de̱, tees de ru dzi cyiiñ der rzii dey. De mbecy rca lagy dey lo de ru, tees lo de̱ ya̱ waca lagy dey.
60005009	Faith	Fert bicy cup der consuel lo Crisht. Orze' gua der contr ni nuras. Nunu bi neñ der nu dutuub la gyishlombecy rzac zi de bicy ru nu nac Crisht laaba' de coz nu rzac de ru.
51003022	Recommendation	De ru mbecy nu nac moz por fers la, bzuub gyidag der ni mbecy nu nac patro̱o̱ nir gyishlombecy ii. Cue' gyicy der nu dzi nap ricy ru ornu zu zi'l yu rgüiiy lo der, par nu gyet lagy yu coz nu ricy ru or ze' zi'l, sinu bicy der ñii nu dutuub la lardoor nu nac nu rca lagy der lo Shuaan den Jesuuz.
66017012	Description	’Na lo tii nguaz ma, nde' yaruuñ tii rey. De yu ze' nigul zub gyi' nu gyub ic yu. Tees gad rishbeey ni dey nu gyub ic yu tub or zi'l tublaazh la nu bañ dañ ze'.
46002012	Grace	Ze' de ub na a̱' ricy cup na espiriit nu rzu bich nu nac gyishlombecy ii, sinu de ub na ricy cup na Espiriit Yon nu bruu lo Ñgyoozh. Gun orze' gad lagy den de coz nu cuic leew lam nin.
59005001	Recommendation	¡Na de ru mbecy guani'ñ bzuub gyidag der ne̱! ¡De ru gun der, nunu cush ti der nu nac de gyel zi nu gzac der!
66002010	Recommendation	Cue' dzib der nu nac de coz nu gzac zir. Orze' nuras gyicy yu nu gyet lag la be der nañ yu' gyiib par nu gac preb der ben a ruu cyigy der. Orze' gzac zi der la be zi'l tiem. Orze' bicy paa der gashtal gat lar, gun orze' gyicya̱ nu gyicy der gan gyel mbañ.
54006011	Recommendation	Ze' ru Timoteo, ru nac ru mbecy nu ricy coz nu rlagy Ñgyoozh. Orze' cue' gyicy ru de coz ze'. Bicy nu coz nu ricy ru, nde' coz nu se'ñ. Nunu bicy nu cyiiñ ru gal mod nu rlagy Ñgyoozh. Nunu bicy nu gyicy cup ru consuel lo Jesuuz. Nunu bicy nu car cyu zi'l mbecy. Nunu bicy nu gagyer ornu deet rac. Nunu bicy nu gac ru mbecy gugy na.
59005005	Sin	Gyishlombecy ii tona' la zu baa der nunu ricy der gusht nir. Nunu bicy re'ñ der ub ru gal nu ricy re'ñ dey tub chigud nu cut yu.
66004004	Description	Orze' laab ze' nu zu yashily ze' dub yub la par loñ, zu ga' gal zu tap yashily ze' nu riib ica' mbecy. Ze' lo gal zu tap yashily ze', zub gal zu tap yu bel. Orze' dela dey zuy negy cacy iily la, nunu ri coron or too dey.
66018007	Description	Gyicy der nu gzac zim, nunu gyicy shnim dub gal mod nu bicy le'm, nunu dub gal mod nu bicy mi gusht. Gun rniim nañ lardoom: “Ii zuba̱ na gal nu na tub rey. Ya̱ walab byud naca̱. Nunu rila wayicya̱ sentiir”, rniim nañ lardoom.
60003007	Recommendation	Na de ru yu gyeey, pcyiiñ nu der mñaar tub mod nu raso̱o̱, nunu pca lagy der lom, como ta zir na de biñ mñaa gaze' de ru. Gun ni' de mi ze' cuic Ñgyoozh nu cui mbañ mi gal nu cuic mi nu cui mbañ de ru. Ni mod bicy der, gun orze' gad mod nu nii nu der Ñgyoozh gal nu rlagy ñi.
54002012	Recommendation	Ya̱ warica̱ rishbeey nu lyuu biñ mñaa lat mbecy zigy. Nunu warica̱ rishbeey nu gyub ic dem lat de yu gyeey. Sinu rlagya̱ nu ri gzub dem. Cue' gniim.
