45006013	Recommendation	Ni' zi'l cue' shet ic der nu gyicy ru cyi nu ni tub la lugaar ni cuerp nir. Nunu cue' shiñ gyicy der nu ca na tub lugaar ni cuerp nir, sinu bgu' der ub ru yaa Ñgyoozh gal nu yad ñi nu gyicy tub mbecy nu bi byabañ ornu gut. Pshet ic der nu gyub ic Ñgyoozh dutuub la cuerp nir par nu gyicy mi coz nap num ñii.
58010039	Faith	Par de ub na a̱' nac den mbecy nu gya' ich. Ni a̱' nac den mbecy nu cha lo cashtig. Sinu nac den mbecy nu ricy cup consuel lom, mbecy nu gruu mbañ.
45011026	Grace	Ornu ded ni de nu nde', orze' dela mbecy Israeel gruu mbañ dey gal nu rnii de riidz ni Ñgyoozh. Ñgyoozh nam: Biñ nu rboo mbañ mbecy, mi ze' gruum Sión nunu co chum dela cyi nu ricy mbecy nu bruu lat de nez Jacob.
52002015	Violence	De mbecy Israeel biit dey de yu nu mnii por cuen ni Ñgyoozh gulas, nunu biita' dey Shuaan den Jesucrisht, nunu pcyuu nu dey de̱ ya̱. De yu ze', wagyedzu' lagy Ñgyoozh lo dey, nunu za dey contr ni dela mbecy.
58010026	Sin	Gun sac reña' gun par nu za' loñ cyi den benu zaab gyicy nap la den cyi despuees ornu bi gu' lo den de coz rishli.
49002006	Grace	Orze' Ñgyoozh gyicy mi nu gyabañ den tublaazh la nu Crisht, gun orze' gzub dun mi gyibaa. Ni gyicy num der nu nac Jesucrisht.
49004025	Recommendation	Orze' nde' nu na cue' ga' guu der losa'r, sinu tub ga la der niir riidz nu rishli lo losa'r, gun dela den nac naa reñ ga la lugaar ni tub zi'l cuerp.
48002005	Faith	Mas lac ru', tees wanguugy lardo̱o̱ de̱ par ni ñuu miiñ la nu ñgyicy de̱ de coz nu rlagy dey, gun orze' de riidz rishli ni Crisht wadza lañ lat der.
46014013	Recommendation	Orze' de yu nu rnii riidz reña' mbecy, rlagy ñi nu cyiñ dey lo Ñgyoozh nu gyicy mi nu cyiiñ dey shaal yu de riidz ze'.
44009001	Violence	Laab tiem ze' Saulo gabee mniiy nu cut yu de mbecy nu ricy cup consuel lo Shuaan den. Orze' guay lo mbecy nu riib ic de uz.
43017013	Description	’Na ya̱ bi yapa̱ lor. Tees ya̱ rne̱e̱ de riidz ii lor lat nu gabee rcyiiña̱ gyishlombecy ii, gun orze' dub gal rii la lagy dey gyet lagy yu gal nu ya̱ yet lagya̱.
60004013	Recommendation	Lugaar nu cha nu ic der, orze' bet lagy der, gun gal nu bzac zi Crisht, ni' zi'l zac zi ga' de ru, gun orze' tona' la gyet lagy der ornu gruu zac Crisht tuuba' tir nu gyel lily nim.
44011006	Description	Orze' mbi la bgüi̱i̱ nañ ñi. Orze' bzaaca̱ de bañcyug nu zub tap gyi'. Bzaaca̱ de bañ gyish. Bzaaca̱ de lo la mni bily. Nunu bzaaca̱ de chigyiñ.
51003008	Recommendation	Tees na bzaan der dela de coz ze'. Orze' cue' cha' ic der nu losa'r. Nunu cue' gazi lagy der. Cue' nii too der nu shiñ gyicy nur losa'r. Nunu cue' gab zi der losa'r. Nunu cue' go der riidz bag.
44018003	Description	Orze' byeeñ nuy de yu ze', nunu tublaazh la bicy dey riiñ, gun Baly nac yu tub yu nu rzaa yu' negy. Laaba' nde' dalje̱z nu ricy Aquila nu mñaay.
45006012	Sin	Orze' na cue' ga' shet ic der nu gyub ic cyi cuerp nu gat ii ni der, gun benu shet ic der, orze' gyicy der de cyi nu druu nañ cuerp nir tuuba' tir.
53003012	Recommendation	Orze' nu nac rishbeey ni Shuaan den Jesucrisht, ya̱ rne̱e̱ lo de mbecy ze' nunu rdu̱' riiñ yaa dey nu cue' nid ru' dey, sinu gyicy dey riiñ par nu gad coz nu gow dey.
44007009	Sin	’Tees de i'ñ yu bicy saap lagy dey ich bicy yu See. Orze' biit dey yu. Orze' mbecy wii dey yu. Byac yu moz por fers la ni tub mbecy Egipto. Tees Ñgyoozh gusa num yu.
44011028	Description	Tub mbecy nu la Agabo wes suy lat de mbecy zigy. Orze' Espiriit Yon ni Ñgyoozh blocyuub mi yu, nunu mniiy nu sñuu ga cyid tub cubiñ ily dutuub la gyishlombecy. Cubiñ ze' biid ñi, ornu Clau byub ic yu de nasyoong.
44020036	Description	Na ornu blazh mnii Baly de nde', orze' gusu tib yu nuy dey. Mnii nuy Ñgyoozh nu dela dey.
48005024	Faith	De mbecy nu bi nac ni Jesucrisht, orze' nde' nañ gal nu na nu bi gut dey lo cruuz nu Crisht. Orze' walaba' de coz a̱' nap ze' riib ic ñi dey. Ni wagyuba' ic de coz nu rlagy ub zi'l dey nañ lardooy.
59001002	Recommendation	De ru bicya̱, gush der shcab nu dzi ga nap ornu gzac der lo de lo la preb,
62001006	Sin	Benu niin nu nac dun mi, ze' laab tiem ze' rded na ricy na cyi, orze' rguun, nunu wagyicy den gal nu rlagy Ñgyoozh.
44010011	Description	Bzaac yu nu byaal baa. Orze' bet tub coz nu na gal nu na tub negy cuadrad nag se' tap la scyiñ niñ yet ñi par lo yu.
44002009	Description	Gun ii yu' mbecy nu bruu zañ lugaar. Yu' mbecy nu bruu Partia, yu nu bruu Media, yu nu bruu Elam, yu nu bruu Mesopotamia, yu nu bruu Judea, yu nu bruu Capadocia, yu nu bruu Ponto, yu nu bruu Asia,
51001010	Faith	Gun benu ni, orze' gac cyiiñ der gal mod nu rlagy Shuaan den Jesuuz, nunu dub laa tiem gyicy der de coz nu gyet lagy mi. Nunu zañ coz nap gyicy der nu nac mod nu rcyiiñ der. Nunu cugyi' nu nap zir cu' lo der Ñgyoozh.
54001018	Recommendation	Timoteo, ru nar gal nu na tub yu feñ ne̱. Orze' ya̱ rdu̱' riiñ ii yaar laaba' gal nu mnii de yu nu mnii por cuen ni Ñgyoozh nu nac ru. Gun orze' fert la char contr ni de mbecy nu rlyuu coz fals.
66019001	Faith	Ornu blazh de nu nde', orze' güeña̱ nu ye zaab ti' tub nac mbecy zigy rniiy gal gyibaa. Orze' na dey: ¡Rlagy ñi gyabic den gyel mbecy ni Ñgyoozh! Mi ze' nac mi biñ nu rboo mbañ. Nac mi biñ lily, nunu nac mi biñ fert,
49002001	Grace	Anzir de ru na der gal nu na mbecy gut nu nac de cyi gal nu de coz a̱' nap nu ricy der.
46010021	Sin	Wac gal der gyel nap nu druu lo Shuaan den ornu row der gyishtily mod nu bzeeñ mi, benu laab tiem ze' gala' der coz nu druu lo nuras. Nunu wac gal der gyel nap ornu ro' der ñup ni urbyay mod nu bzeeñ mi, benu laab tiem ze' gala' der coz nu druu lo nuras.
49005003	Recommendation	Orze' de ru, como nac der mbecy ni Ñgyoozh, orze' rila cue' cuic der mod ni mbecy nu griib dey gyidza too der. Cue' nii dey nu ca na tub der ral ru losa'r nu wanchelaar, gun cue' nu riib dey ni tub la cyi bag nu ni na too der. Nunu cue' nu nii dey nu ca na tub der ye rzac ru lo la coz.
56001015	Sin	Gun benu ca na mbecy nap na shcab niy, orze' dela coz nu ricy yu, nde' coz cacy par lo Ñgyoozh. Tees de mbecy nu wayicy cup consuel lo Crisht nunu benu a̱' nap na shcab ni dey, orze' par de yu ze' saca' coz nap par lo Ñgyoozh. Gashtal shcab nu ricy cup dey gubag ñi. Nunu wagat lo dey nu nac coz a̱' nap nu ricy yu.
44009021	Description	Dela mbecy nu güeñ ze' tona' la za nu ic dey. Orze' na dey: ―¿A walab yu ii mbecy nu gusa pshet zi de mbecy nu rzat Jesuuz Jerusaleeng? Nunu ¿a walab nu yad yu ii par nu cha nuy dey pres, nunu gu'y dey yaa de yu zub lo ni uz? ―na dey.
58008006	Description	Ze' Crisht zum tub riiñ nu gya zir zu par riiñ nu zu de' zir uz. Ni' zi'l trat nu bloom nu rniiñ nu lac gyicy nu Ñgyoozh den, nde' tub trat nu nap zir par trat gush ni leey, gun riidz ni trat cub, riidz nu mnii Ñgyoozh nu segur la gyicy mi, nde' riidz nu nap zir gaze' riidz ni trat gush.
50001021	Faith	Gun par ya̱, benu cui mbaña̱, orze' gyicya̱ coz nu rlagy Crisht zi'l. Ze' benu gata̱, orze' napa' zir.
50001006	Faith	Nunu ya̱ bi neña̱ nu Ñgyoozh, biñ nu bzuub gyi' riiñ nañ lardoo der, mi ze' za' lom ñii ornu shuub dzi nu cyid Jesucrisht tuuba' tir.
62005020	Faith	Nunu ni' zi'l rad lagy den nu Jesuuz, I'ñ Ñgyoozh, bi biid mi gyishlombecy ii, nunu briic mi shcab ni den par nu gad lagy na cyu nac Ñgyoozh nu rishli. Nunu bi nac du den Ñgyoozh, biñ nu rishli, gal nu I'ñ mi Jesucrisht. Mi ze' nac mi Ñgyoozh nu rishli. Nunu mi ze' biñ nu gyicy nu cui mbañ mbecy tub la.
45012018	Recommendation	Bicy der ca na la coz nu gac gyicy ru par nu nap chu' der nu de losa'r.
58010023	Faith	Orze' rlagy ñi nu gzu fert den nu nac de coz ni Crisht nu rzeña lagy den. Rlagy ñi nu cue' nu gyicy cyup ic den, gun Ñgyoozh segur la gyicy yac mi de coz nu mniim nu gyicy mi.
43014027	Grace	’Ornu bi gya̱, orze' gzeeña̱ gyel ri zu nañ lardoo der. Gyel ri zu ni ub la̱ grica̱ ni der, nunu walab nu grica̱ ñii mod nu rbic de mbecy ni gyishlombecy ii. Cue' zaan der nu gac deet nañ lardoor, nunu cue' dzib der.
47005006	Faith	Nde' nu dub laa tiem rzu fert den. Gun rad lagy den nu lat nu rcyiiñ na nañ cuerp ni gyishlombecy ii, orze' walab nu rcyiiñ den lo Shuaan na.
43012047	Grace	Tees cyu zi'l mbecy nu gyeñ de riidz nu rne̱e̱, ze' wazuub gyidag yuñ, walab ya̱ ne̱e̱ nu yu' falt niy. Gun walab nu yapa̱ nu ne̱e̱ nu yu' falt ni de mbecy ni gyishlombecy, sinu yapa̱ par nu gloo mbaña̱ dey.
62003012	Sin	Cue' gac naa gal nu na Caiing. Yu ze' tub mbecy ni nuras. Biit yu bicy yu. ¿La gyi' biit yu bicy yu? Gyi' nu shiñ ricy ub yu. Ze' bicy yu, Abeel, yu ze' nap bicy yu.
66016020	Description	Orze' mnit dela yu nu yu' lo nisyudoo. Nunu mnit dela de bicy.
58011012	Description	Nde' nu mas Abraham bi zuy nu gat yu, tees ni mod guud zañ nez yu. Zañ dey. Gal nu zañ de bel baa ni zañ dey. Gal nu sheñ yu uzh nu nguaa ru' nisyudoo ni' zi'l zigy dey byac yu. Waca' la lab na dey.
54001017	Faith	Orze' rlagy ñi nu ca lagy den lo biñ nu riib ic, nunu rlagy ñi nu gyabic den gyel mbecy nim tub la. Mi ze' biñ nu mbañ tub la. Mi ze' biñ nu wacsac na. Tub zi lam nac mi Ñgyoozh nu rishli. ¡Laab ni gac ñii!
66014007	Faith	Orze' ye la mniiy. Orze' nay: ―Pca lagy der lo Ñgyoozh nunu byabic der gyel mbecy nim. Gun na bi pshuub or nu gri beem ni de mbecy. Orze' briib zily der mi ze', biñ nu psa' lagy gyibaa, gal nu gyishlombecy, gal nu nisyudoo, gal nu dela ze' nu driib nis ―nay.
44006001	Description	Laab tiem ze', ornu bi ryañ zir de mbecy nu ricy cup consuel lo Crisht, orze' de mbecy Israeel nu rnii griego nu de mbecy Israeel nu rnii hebreo, riidz guledz, bdza' dey ni losa'y. De mbecy nu rnii griego mnii dey nu wagyicy paa mbecy ornu rgyeez dey de coz nu gow byud nu yu' lat dey.
60002021	Grace	Gun Ñgyoozh bzum de ru par nu gagye der lat de tiem nu gzac zir, gun Crisht bzac zim nu nac de ru. Nunu blyuum ni der lac mod gyicy ru, gun orze' gyicy der gal nu bicy mi.
53003010	Recommendation	Lat nu pcyiiñ de̱ lat der, i mod mne̱e̱ de̱ lo der: “Mbecy nu washet ic nu gyicy riiñ, orze' yu ze' cue' goy gyit.”
43003016	Grace	’Gun Ñgyoozh tona' la rcam de ru mbecy nu yu' gyishlombecy ii. Nde' nu gal briic lam ya̱ i'ñ mi nu tub zi zu nim ni der. Gun orze' de mbecy nu gyicy cup consuel lo̱, de yu ze' wanit lo dey, sinu gad nu cui mbañ dey tub la.
44019015	Description	Tees ornu ni gugy dey nuras, orze' na nuras rab yu dey: ―Ya̱ yu' lo̱ Jesuuz, nunu ya̱ yu' lo̱ cyu nu Baly. Ze' de ru ¿cyu nac ru? ―nay.
66019019	Violence	Gaze' nu bzaaca̱ bañ dañ, gal nu de rey nu yu' gyishlombecy, gal nu de soldad ni dey bi yu' tublaazh dey nu chucooy nu biñ nu riib cuay ze' gal nu de soldad nim.
44027002	Description	Orze' gu̱' de̱ nañ tub barc ni tub mbecy gyedz Adramitio. Barc ze' bi zu lily ñii par nu ruuñ chañ par de gyedz ni Asia nu yu' ru' nisyudoo. Orze' bruu barc ze'. Orze' za̱ de̱. Aristarco, tub mbecy Tesalónica, tub gyedz nu ri lo yu ni Macedonia, yu ze' za nuy de̱.
58013003	Recommendation	Ca ic der de yu nu yu' nañ yu' gyiib. Bicy der nu ri ga' der nañ yu' gyiib nur dey. Ca ic der de yu nu rzac zi, gun ni' de ru ricy cup der tub cuerp nu rzac zi.
51003017	Recommendation	Dela coz nu gyicy der, gal nu de coz nu nii der, bicy der ñii gal nu ricy mbecy ni Shuaan den Jesuuz. Orze' briic der gras ni Ñgyoozh Uz den par nu nac Shuaan den Jesuuz.
48006006	Recommendation	De yu nu rsya' de riidz ni Crisht rlagy ñi nu locyuub dey yu nu rlyuu lat yu nu de lo la gyel nap nu ricy cup yu.
44007005	Description	Tees Ñgyoozh wancuic mi ni tub lugaar ganiy. Ni ñuu miiñ yu wancuic mi niy. Tees mniim nu segur la cuic mi de lugaar ii ganiy. Mniim nu segur la nu de lugaar ii gac niy, nunu gac ni de nez yu par lo, mas tiem ze' sac i'ñ yu.
44007019	Description	Bguuy de nez den. Shiñ bicy nuy dey. Pcaay de nez den por fers la nu ne' dey de mdoo gyeey nu sa gul ni dey, gun orze' gat yu.
43020003	Description	Orze' Bed gal nu ya̱ za de̱ za güi̱i̱ ru' baa ze'.
44024016	Faith	Nde' nu dub laa tiem ryuba̱ mod nu cue' gyicya̱ coz nu gyicy ñi nu gat lo̱ lo Ñgyoozh. Nunu ryuba̱ mod nu cue' gyicya̱ coz nu gyicy ñi nu gat lo̱ lo mbecy.
65001013	Description	Na dey gal nu na de nguuly ni nis nu fert rded lo nisyudoo. Orze' de coz to' lo nu ricy dey, nde' nañ gal nu na bdziñ nu rzeeñ de nguuly ru' nisyudoo. Na dey gal nu na bel baa nu gudza ma nez nu rded ma. Nde' nu Ñgyoozh mniim nu chesa dey ze' nu blaazha' zir cow tub la.
48001012	Description	Ni walab lo mbecy blo̱o̱ ñii. Ni walab mbecy blyuuy ne̱. Sinu Jesucrisht bicy mi nu gud lagya̱ ñii.
45007005	Sin	Gun lat nu gu' den mod nu rlagy ub zi'l den, orze' leey ze' bicy ñi nu dzi zir rlagy den nu gyicy na de coz cyi nu druu nañ lardoon, gun rniiñ nu cue' ni gyicy den. Nunu de coz cyi ze', de nde' coz nu ricy ñi nu yad ñi ni den nu gat na.
54002007	Faith	Nde' nu ya̱ bdugyi̱ nu naca̱ tub aposht, nunu naca̱ tub yu nu rshaal laab de riidz ze'. Nunu bdu'm riiñ ya̱a̱ nu lyu̱u̱ lat dela mbecy nu walab mbecy Israeel de riidz rishli ni Ñgyoozh. Nunu ya̱ rishli rne̱e̱, walab nu rgu̱u̱.
62003024	Faith	De mbecy nu rzuub gyidag ni de riidz nim, de yu ze' rcyiiñ nu dey mi, nunu mi ze' rcyiiñ num dey. Nunu nu nac de nde', rad lagy den nu mi ze' rcyiiñ num de ub na. Rad lagy den par nu nac Espiriit Yon nim, biñ nu briic mi ni den.
46010024	Recommendation	Rlagy ñi yub den mod nu nap zir par de' zir mbecy. Cue' mod nu nap par ub zi'l den.
45012016	Recommendation	Nap gu' der nu losa'r. Cue' gac der mbecy le'. Nunu pshet ic der nu chesa nur de mbecy shni. Cue' nii too der nu dzi yu' shcab ni der.
49004031	Recommendation	Bloo der dela bis nu guti nañ lardoor. Blaa yaa der nu rgyiiñ lagy ru lo de coz nu ricy ru nañ lardoor. Cue' gazi lagy der. Cue' cush ti der nu gyel rzi lagy. Ni cue' gab zi der losa'r. Ni cue' gyicy der ni tub la coz a̱' nap.
51001025	Faith	Orze' Ñgyoozh bicy mi nu gyicya̱ riiñ ni dela mbecy nim. Bdu'm riiñ ze' ya̱a̱ nu locyuuba̱ de ru. Ze' riiñ ze', nde' nu rshaala̱ dela riidz nim.
66001014	Description	Nunu gyich toom cacy iily lañ. Caacy ñi gal nu caacy gyey. Nunu rabee urlom gal nu rabee lyush gyi.
47004015	Grace	Orze' dela coz nu rzac de̱, nde' par de ru, gun orze' dub gal nu nap ricy nu Ñgyoozh mbecy, orze' ni' yu' mbecy nu cuic yu gras nim, gun orze' rabee nu dzi zily nac mi.
43006056	Faith	Gun de yu nu gow cuerp ne̱ nunu go'y reña̱, de yu ze' cyiiñ du̱ yu, nunu de yu ze' cyiiñ nuy ya̱.
43011027	Faith	Orze' na ga' Mart: ―Laab Shuaana̱, rzeña lagya̱ nu ru nac ru Mesías, i'ñ Ñgyoozh, biñ nu ca lo cuen nu cyid gyishlombecy ii ―nañ.
44002042	Faith	Orze' dela dey fert la zu dey shcab nu nac de coz nu rlyuu de aposht. Nunu yatublaazh dela dey nu ro nuy losa'y riidz. Nunu yatublaazh dela dey ricy yu che nu losa'y gal mod nu bzeeñ Crisht. Nunu yatublaazh dey nii nuy Ñgyoozh. De nde' coz nu zaab bicy la dey.
58001009	Grace	Ru yet lagy ru nu ricy ru de coz nu laab ñi, nunu wayet lagy ru nu gyicy ru de coz a̱' nap. Nde' nu ya̱, Ñgyoozh nir, pcui̱ ru, nunu bicya̱ nu zu cyit zir lagy ru gaze' de' zir mbecy,  nam.
44012002	Violence	Pcaay mbecy nu cut yu Santiag bicy Waa, nu mandzicy.
55002016	Recommendation	Bruu chu lo de riidz wacyiiñ, riidz nu wayet lagy Ñgyoozh, gun de mbecy nu ni mod ro riidz dzi zir gnu dey ub yu par lo coz ni Ñgyoozh.
62003015	Sin	Dela mbecy nu rzi lagy lo losa', de yu ze' gal gaa la nay nu de mbecy nu rut losa'. Nunu de ru rad lagy der nu ni tub la mbecy nu rut losa' a̱' nac yu mbecy nu cyiiñ nu Ñgyoozh tub la.
43021015	Faith	Na ornu blazh bicy de̱ siily, Jesuuz nam rab mi Bed: ―Simo̱o̱, i'ñ Jonás, ¿a rca zir ru ya̱, gaze' gal mod nu rca de' zir de yu ii ya̱? ―nam. Orze' na Bed: ―Laab Shuaana̱, ru rad lagy ru nu rca̱ ru ―nay. Orze' na ga' Jesuuz: ―Orze' mña de mbecy nu nac shily ne̱ ―nam.
46012008	Grace	Espiriit Yon rbic mi shcab ni tub mbecy par nu cuic yu consef ni losa'y. Ze' tuuba' mbecy, laab mi ze' rbic mi shcab niy par nu shaal yu de riidz ni Ñgyoozh nu dzi nap rad lagy yu.
44007013	Description	Byaj cyup See mniiy lo de bicy yu cyu nac yu. Orze' gud lagy Faraón cyu nez nac See.
60003010	Recommendation	Gun lat de riidz ni Ñgyoozh rniiñ: Benu ca na mbecy yet lagy yu nu cyiiñ yu gyishlombecy ii, nunu benu rlagy yu nu gusht cyiiñ yu, orze' rlagy ñi nu cue' shiñ niiy, nunu cue' niiy riidz rguu.
44004032	Description	Dela de mbecy nu bicy cup consuel lo Crisht bicy dey tub zi'l shcab. Ni tub la mbecy wangyicy yu nu de coz niy, nde' coz par ub zi'l yu. Orze' dela coz nac ñii ni delay.
46015003	Grace	Ya̱ brica̱ nu gad lagy der de coz nu gud lagya̱, de coz nu ricy zir ñi presis par de' zir de coz. Nde' nu gut Crisht par nu nac cyi den gal nu rnii de riidz ni Ñgyoozh.
66018024	Violence	Gun gyedz ze', ze' gyad reñ dela de yu nu mnii por cuen ni Ñgyoozh, nunu reñ de mbecy nim. Gyad reñ dela mbecy nu gut gyishlombecy nu nac Ñgyoozh.
44013048	Faith	Na ornu güeñ de mbecy nu walab mbecy Israeel de riidz ze', orze' tona' la bet lagy dey, nunu bicy zily dey riidz ni Ñgyoozh. Nunu de yu nu bi pcui Ñgyoozh par nu cui mbañ yu tub la, brugyi' ricy cup dey consuel lom.
66022020	Description	Orze' biñ nu mnii dela coz ze' nam: ―Laab ni. ¡Ya̱ bi yap gyiilya̱! ―nam. Laab ni gac ñii. ¡Shuaan na Jesuuz, da!
50004009	Recommendation	Bicy der dela coz nu ya̱ blyu̱u̱ ni der gal nu de riiñ nu bdu̱' yaa der. Bicy der dub gal mod nu güeñ der de riidz nu mne̱e̱, nunu dub gal na mod nu bzaac der ni de coz nu bicya̱. Benu gyicy der dela nde', orze' Ñgyoozh, biñ nu ricy nu rzeti ri añ ni der, gac num de ru.
53003015	Recommendation	Tees cue' gyicy ruy par losa' yuur, sinu byoo rishloy gal nu ricy nur bicy ru.
51002008	Recommendation	Bzu der cuidad. Cue' zaan der nu guu de mbecy ru nu nac de riidz fals nu rboo ic mbecy zi'l. De riidz ni de mbecy ze' walab lo Crisht bruuñ, sinu de nu nde' coz nu bzeeñ de gyitoo bel ni dey, nunu laab nu nde' riidz ni nuras, yu nu riib ic gyishlombecy ii.
50003014	Faith	Ricya̱ tub fers nu shupa̱ laza̱, gun orze' gyicya̱ gan i̱ nu cuic Ñgyoozh ni den nu nac Jesucrisht. Gun par nde' blosum de ub na.
56002014	Faith	Mi ze' pshet ic mi gut mi par nu briish mi cyi den, gun orze' bicy mi nu bruu chu den lo de cyi nu ricy na. Nunu bicy mi nu byacaacy nap lan lo Ñgyoozh, gun orze' gac na mbecy nim. Gac na mbecy nu ric la añ ni lo de coz nap.
43005024	Faith	’Ya̱ rishli rne̱e̱ lo der nu de yu nu gzuub gyidag de riidz nu ya̱ rne̱e̱, nunu gyicy cup dey consuel lo biñ nu bzuu nez ya̱, orze' de yu ze' cui mbañ yu tub la. Wane̱e̱ nu yu' falt niy, sinu bi bded loy lo lugaar ze' nu yu' mbecy gut. Bi guud nu cui mbañ dey tub la.
66021015	Description	Orze' anc nu mnii lo̱ nuuy tub ya beey or par nu tush peey gyedz ze', nu ro' niñ, gal nu lo' niñ.
50003019	Sin	De yu ze' nit lo dey gabily. De mbecy ze' de gyel bizh nac ñii ñgyoozh ni dey, nunu ornu ricy dey coz to' lo, lugaar nu gat lo dey ca nu ricy dey gyel le' niy. De yu ze' coz ni gyishlombecy zi'l ii zu dey shcab.
54003006	Sin	Yu nu gac yu bel wac mbecy nu sa brugyi' ricy cup consuel lo Jesuuz, gun nis gyale'y. Gun benu ni gyicy yu, orze' gnii Ñgyoozh nu cyi nu gyicy yu zañ contr nim gal nu bicya' zi'l nuras.
65001003	Recommendation	De ru, bicya̱ nu dzi rca̱, ya̱ dzi rlagya̱ nu zeeda̱ tub gyicy lo der nu rne̱e̱ lac yaruu nu gruu mbañ den: tant de ru, gal nu ya̱. Tees na rad lagya̱ nu ricy zir ñi presis nu zeeda̱ gyicy ii lo der par nu nishba̱a̱ lo der nu gzu fert der nu nac de riidz ni Crisht nu bzeeñ Ñgyoozh yaa mbecy par tub tir zi'l.
44004002	Description	Pcha' ic dey, gun blyuu Bed ni de mbecy nu Jesuuz byabañ mi. Nunu nde' cuic ñi nu gad lagy de mbecy nu gyabañ dela mbecy gut.
66018005	Sin	Gun bi byañ cyi nu ricy mi gashtal gyibaa bi pshuub ñi. Nunu Ñgyoozh ca ic mi de coz a̱' nap nu ricy biñ mñaa ze'.
43004046	Description	Orze' Jesuuz bish cyam zam Caná, tub gyedz nu ri lo yu ni Galilea. Laab lugaar ze' nu bicy mi nu byac nis ñup ni urbyay. Na zu tub mbecy nu zu riiñ ni gubier. Ze' i'ñ yu mbish rat yu Capernaum.
45012011	Recommendation	Cue' gazed der, sinu bloo lo der nu dutuub la lardoor lat nu gyicy der de coz nu rlagy Shuaan den.
60001008	Faith	De ru rca der Jesucrisht mas nigul zac der mi. Nunu ricy cup der consuel lom mas wac zac der mi na. Orze' gucyit lagy der tub mod nu tona' la coz ily. Tub mod nu druu gal gyibaa. Ni wagaca' cuic der raso̱o̱ de riidz ni de coz nu rzac ru.
62004013	Grace	Yu' tub mod par nu gad lagy den nu nac dun Ñgyoozh nunu Ñgyoozh nac num de ub na. Rad lagy der de nde' nu nac nu briic mi Espiriit Yon nim ni den.
43019029	Description	Orze' ze' zu tub teg yu' ñup zii nañ ñi. Orze' psal dey tub coz nu chayo' nis lo ñup ze'. Pcyiig dey ñi lo tub lo yag nu la hisopo. Orze' pcaa dey ñi ru'm.
51001013	Grace	Gun Ñgyoozh bi bloo nap mi de ub na lugaar ze' nu cow, ze' nu riib ic nuras. Orze' ya num de ub na par lugaar ze' nu riib ic I'ñ mi nu dzi rcam.
45016017	Recommendation	Der bicy na, ya̱ rnishba̱a̱ lo der nu gyicy cuidad der nis cyiid mbecy nu gyicy yu nu tub su der losa'r, nis cyiid de yu nu gyicy nu can shcab ni der nu nac de coz ni Crisht. De yu ze' rza dey contr ni de riidz nu bdulyuu ni der. Bruu chu der lo de yu ze'.
45012007	Recommendation	Benu Ñgyoozh gyicy mi nu cyiiñ tub den nu gyicy na coz nu rlagy reña' mbecy, orze' rlagy ñi nu nap gyicy nañ. Orze' benu Ñgyoozh gyicy mi nu cyiiñ tuuba' den nu lyuun ni losa'n, orze' rlagy ñi nu ni gyicy na.
43016023	Faith	Ornu shuub dzi ze', orze' wugyi' ga' der lo̱. ’Ya̱ rishli rne̱e̱ lo der nu Ñgyoozh, uza̱, cuic mi la zi'l coz nu cyiñ der lom nu nac ya̱.
66021019	Description	Orze' de simient ni lo' ze', nde' bdudiiñ nu gyita' nu dzi gya sac. Orze' gyita' loga la ni simient ze', nde' tub gyita' nu la jaspe. Ze' gyita' cyup, nde' tub gyita' nu la zafiro. Ze' gyita' chon, nde' tub gyita' nu la ágata. Ze' gyita' tap, nde' tub gyita' nu la esmeralda.
59004017	Sin	Mbecy nu rad lagy nu gyicy coz nap, ze' wagyicy yu, yu ze' ricy yu cyi.
66019005	Faith	Orze' güeña̱ nu zaab ti' rnii gashtal ze' nu riib ic Ñgyoozh. Orze' rniiñ: Gyabic der gyel mbecy ni Ñgyoozh nin, de ru mbecy nu ricy coz nu rniim, gal nu de ru mbecy nu rca lagy lom. Gyabic der gyel mbecy nim, tant de mbecy gush tant de mbecy feñ,  rniiñ.
47005002	Faith	Nde' nu lat nu rcyiiñ na nañ yu' negy ze', orze' ric la añ nin nu gad yu' nu zub gyibaa, ze' nu cyiiñ den nañ ñi.
48006004	Recommendation	Tub ga la mbecy rlagy ñi nu nii too dey ben a nap ricy ub yu. Orze' benu nap ricy ub yu, orze' gac gyet lagy yu nu nac de coz nu ricy yu. Nunu walagy ñi nu cu' cuen dey ti laab ni ricy losa'y.
46007036	Recommendation	Tees benu tub mbecy rziiy nu rlagy ñi cuic yu i'ñ yu chelaañ gun bi nu ña'n ñi, nunu benu nde' coz nu rlagy ñi rlyu, orze' rlagy ñi nu gyicy yu mod nu rlagy ñi. Gac chelaañ, nunu nde' walab nu cyi na.
43016002	Violence	Gun wabica' dey lugaar nu gyatublaazh der nu dey nañ yu' nu rsya' dey riidz ni Ñgyoozh. Nunu shuub dzi nu benu ca na tub mbecy cut yu de ru, orze' rash yu shcab nu gyicy yu nde' lo Ñgyoozh.
66015001	Description	Orze' gaze' nu bzaaca̱ tub muesht baa. Coz ily tona' la guc, nunu tona' la za du ica̱. Orze' zu gagy anc. Nunu zu gagya' cashtig. Laab nde' la cashtig blazh, gun laab nde' la nu blazh pcha' ic Ñgyoozh.
43018023	Description	Orze' na Jesuuz rab mi yu: ―Benu shiñ mne̱e̱, orze' mnii lo de mbecy nu yu' ii la na coz nu mne̱e̱. Ze' benu laab ñi gal nu mne̱e̱, ¿orze' lagu pshet ru ne̱? ―nam.
50004003	Recommendation	Ze' ru losa̱' nu tona' la ricy paa, losa'n nu bicy na riiñ ni Ñgyoozh tublaazh la, ya̱ rlagya̱ nu locyuub ru de biñ mñaa ze' nu gyicy nap dem riidz nu losa'm. De biñ mñaa ze' fert bicy dem riiñ nu ya̱ par nu shaal de̱ de riidz nu sac ni Jesuuz. Bicy de̱ riiñ ze' tublaazh la nu Clement gal nu de' zir mbecy nu bicy riiñ nu ya̱. Dela de yu ze' bi ta' nu la dey lo libr ni Ñgyoozh, libr ze' nu ta' nu la de mbecy nu ca lo cuen nu cui mbañ.
66016006	Sin	Gun de mbecy gyishlombecy bicy dey nu pshu reñ de mbecy nir, gal nu reñ de yu nu mnii por cuen nir. Nde' nu na, ru, briic ru reñ go' dey. ¡Nde' cashtig nu yad ñi nu gad ni dey! ―nay.
45006002	Sin	¡Rila walab ni! Par nu nac cyi, na den gal nu na mbecy gut. Orze' cyi wayub ica'ñ de ub na. Orze' ¿walab gaal zaab gyicy la den coz cyi?
66017011	Violence	Ze' bañ dañ, bañ nu gulas mbañ ze', ze' na saca' ma, laab ma ze' nac ma rey shuñ mas bruu ma laab lo gagy rey ze'. Tees orze' despuees, orze' gat ma tub tir zi'l.
48004030	Recommendation	Tees ¿lac rniiñ lat de riidz ni Ñgyoozh? Orze' rniiñ: “Cyuu nur biñ mñaa nu nac moz por fers la ze' nu i'ñ lam. Gun i'ñ mi ze' wac gyash yu de gyel nap ni uz yu, sinu i'ñ biñ mñaa nu a̱' nac moz ze', yu ze' gyash yu de gyel nap ni uz yu”, rniiñ lat de riidz ni Ñgyoozh.
54006009	Sin	Tees yu' mbecy rlagy yu gyaguani'ñ yu. Nde' nu rziñ lañ nañ lardooy nu rlagy yu gyicy yu coz a̱' nap par nu gyicy yu gan tiñ. Orze' yet lag yu nañ caa ni de coz a̱' nap ze'. Ye rzac dey lo zañ coz nu gyicy da̱y nu de ub yu. Orze' nde' gyicy ñi nu gnu mbecy ze', nunu dune'y.
66017016	Violence	Orze' de mbecy nu nac tii nguaz ze', gal nu bañ dañ ze' gazi lagy dey lo biñ congal ze'. Orze' co dey dela coz nu ricy cup mi. Orze' gyid yaagy lam chesum. Orze' gow dey beel mi, nunu chuu dey mi nu gyi.
46008003	Faith	Tees benu tub mbecy rcay Ñgyoozh, orze' Ñgyoozh yu' lom yu.
45003009	Sin	Orze' ¿lac beni? ¿A nap zir nu nac de ub na mbecy Israeel gaze' tub naca' mbecy? ¡Walab! De ya̱ bi pshaala̱ lo der nu de mbecy Israeel gal nu de mbecy nu walab mbecy Israeel, tub zi'l nu yu' cyi dey.
44007041	Sin	Gaze' nu bzaa dey tub nab mod nu na tub biser. Orze' biit dey bañcyug. Pshu dey reñ ma looñ. Tona' la bet lagy dey coz nu bzaa dey nu yaay.
