59005013	Recommendation	¿A yu' mbecy lat der nu dzi rzac zi dey? Orze' rlagy ñi nu cyiñ yu lo Ñgyoozh. ¿A yu' mbecy lat der nu zu cyit lagy yu? Orze' rlagy ñi nu gul yu nunu gyabicy yu gyel mbecy nim.
58012012	Recommendation	Orze' de coz ni Crisht, nde' nañ gal nu na tub coz nu psuun ñi der. Orze' yaa gutsiñ der, briic der fers niñ. Nunu tib gut siñ der briic der fers niñ.
60001017	Recommendation	Ñgyoozh gri beem ni tub ga la de mbecy dub gal nu na coz nu ricy dey, nunu walab nu reñ ga la mod gyicy mi num tub ga mbecy. Como de ru “Uza̱”, rnii der lo Ñgyoozh, nde' nu rlagy ñi nu ca lagy der lom dub laa tiem lat nu yu' der gyishlombecy ii.
58010036	Recommendation	Rlagy ñi nu gagye der, gun orze' gyicy der gal nu rlagy Ñgyoozh, nunu gyash yaa der de coz nu mniim nu segur la cuic mi ni der.
58011001	Faith	Nu gyicy cup den consuel, nde' laab ni' zi'l nu gad lagy den nu segur la gzac na de coz nu drish lon. Nunu nu gyicy cup den consuel, nde' laab ni' zi'l nu gzu fert den nu nac de coz nu wacsac na.
49004017	Recommendation	Orze' nii tub coz nu ne̱e̱ lo der. Nii tub riiñ nu du̱' yaa der nu nac Shuaan den Jesuuz: nu cue' ga' chesa der gal nu rded de mbecy nu a̱' yu' lo Ñgyoozh. Gun de yu ze' rded yu ca na la nu rnii shcab ton ni dey.
51002016	Recommendation	Nde' nu cue' shet ic der nu nii zi de mbecy ni der nu nac de coz nu row der, gal nu de coz nu ro'r. Ni cue' shet ic der nu nii zi mbecy nir nu nac cushtom ni de sa' mi' ni dey, gal nu sa' nu rzu' dey ornu sa rca beey mi', gal nu ni de dzi nu rzu lagy mbecy.
66007015	Faith	Nde' nu yu' dey ze' nu zu yashily nu riib ic Ñgyoozh. Dzi rel la ricy dey coz nu rlagy mi nañ yu' nim. Orze' biñ nu zub lo yashily ze' rsoow mi too dey par nu cue' nu shiñ gzac yu, gun yu' dey ze' nu zum.
44020010	Description	Orze' Baly bet yu par lo yu. Orze' gusaab tiily yu. Bdu' yaay yu. Orze' nay: ―Cue' dzib der gun gabee mbañ yu ―nay.
55002010	Faith	Nde' nu ya̱ ragye̱e̱ lo dela coz nu rzaca̱, gun nde' coz nap par de mbecy nu pcui Ñgyoozh nu gac nim, gun orze' ni' de yu ze' gruu mbañ dey nu nac Jesucrisht, nunu cyiiñ nu dey mi tub la lugaar cyit zu, ze' nu rcyiiñ mi.
60005014	Recommendation	Nunu nap mnii nu der losa'r gal mod nu rlagy ñi ornu dzeel ru dey. Orze' Ñgyoozh gyicy mi nu cheti ri añ ni dela de ru mbecy ni Crisht.
49005021	Recommendation	“O” mnii der ni losa'r nu nac nu rca lagy der lo Crisht.
61003017	Recommendation	Nde' nu der bicy na nu dzi rca̱, como de ru bi gud lagy ru de coz ze' anzir nu gac ñii, nde' nu bicy cuidad der ub ru nis gruu chur lo Crisht nu nac de riidz rguu nu nii mbecy a̱' nap lo der. Gun orze' cue' nu checa der nu gzu fert ru nu nac de coz ni Crisht,
51003018	Recommendation	De biñ mñaa, rlagy ñi nu “O” niim ni ñgyeem, gun nde' mod nu rlagy ñi nu gyicy de biñ nu ricy cup consuel lo Shuaan den Jesuuz.
54005020	Recommendation	Ornu gyubee nu tub yu bel yu' falt niy, orze' shuu nur yu lo rgüii la dela de mbecy ni Crisht ornu yu' tublaazh dey, gun orze' de' zir mbecy dzib dey nu gyicy yu cyi.
45014013	Recommendation	Nde' nu na rlagy ñi nu cue' nii den nu yu' falt ni losa'n, sinu rlagy ñi nu gzu fert den nu cue' gyicy den ni tub la coz nu gyicy ñi nu gya' ich de bicy na, ni cue' gyicy den ni tub la coz nu gyicy ñi nu gyicy de bicy na coz cyi.
45002010	Grace	Tees Ñgyoozh cuic mi gyel lily ni de yu nu ricy coz nap, nunu gyicy mi nu gac dey mbecy raso̱o̱, nunu cuic mi gyel ri zu nañ lardoo dey. Nu loga la cuic mi ñii ni de mbecy Israeel, nunu ni' zi'l cuic mi ñii ni de mbecy nu walab mbecy Israeel.
58011034	Violence	Psu dey gyi ily. Bruu chu dey lo mbecy nu ngulagy nu ñgyut dey nu mandzicy. De yu nu gugyidz byafert dey. Nunu lily na dey lo gyel yuu. Bicy dey gan bee nac gaa la soldad nu nac losa' yuuy.
48006017	Faith	Bee na zi'l par lo ni tuba' la mbecy cue' gyicy dey nu gzac deeta̱, gun cuerp ne̱ bi ta' de lac. Nde' tub muesht par nu gad lagy der nu ya̱ tub yu nu ricy yac ni de riidz ni Shuaan den Jesuuz.
66018021	Violence	Gaze' nu tub anc fert pshes nañ yu tub gyita' nu na gal nu na tub gyita' gyech ily nu rdugu. Gaze' nu bzaan yuñ zañ lo nisyudoo. Orze' nay: ―I mod nu byagash zu gyedz Babilonia, tub gyedz nu dzi gya bzu. Orze' rila wansaca' mbecy ñi tuuba' tir.
65001020	Faith	Tees de ru, bicy na nu dzi rca̱, bzu fert der nu consuel nu ricy cup ru, como nde' consuel nu bruu lo Ñgyoozh. Mnii nu der Ñgyoozh dub gal mod nu rnii Espiriit Yon nim nañ lardoo der.
45012002	Recommendation	Nunu cue' gyicy der mod nu ricy cualcyer la mbecy nu yu' gyishlombecy, sinu gush der tub shcab cub, gun orze' gac der tub mbecy nu reña' na par mod nu na der gulas. Gun orze' gad lagy der de coz nu rlagy Ñgyoozh. Gad lagy der la na de coz nap. Gad lagy der la na coz nu rlagy mi. Gad lagy der la na coz nu sac falt ni.
46015009	Sin	Gun ya̱ gash zir zu̱ par lo de' zir de aposht. Ni wangyapa̱ nu nii dey ya̱ aposht, gun ya̱ psheed zi̱ de mbecy ni Crisht.
62002015	Recommendation	Cue' ca der gyishlombecy ii, ni de coz nu yu' gyishlombecy, gun benu ca na mbecy cay gyishlombecy, orze' wacay Ñgyoozh Uz na.
45002001	Sin	Orze' ru mbecy nu rnii too nu yu' falt ni losa', sac rishto' lo nir. Orze' mas cyu zi'l mbecy nu nac ru, sac rishto' lo nir, gun ornu rniir nu yu' falt ni de losa'r, orze' ni' zi'l ricy ru coz nu ricy de losa'r, orze' rabee nu ni' zi'l yu' falt nir.
48002009	Description	Orze' Santiag, nu Bed, nu Waa, de yu nu rnii mbecy nu nac yu zub lo, de yu ze' gud lagy dey nu Ñgyoozh bicy mi faboor nu nap bicy num ya̱. Orze' bicy losa' dey ya̱ nu Bernabee. Mnii dey nu de̱ ya̱ cha shaala̱ de riidz nu sac ni Crisht ze' nu yu' de mbecy nu walab mbecy Israeel. Ze' de ub yu shaal yu de riidz nu sac ni Crisht ze' nu yu' de mbecy Israeel.
43019023	Description	Despuees ornu bi pcaa de soldad Jesuuz lo cruuz, orze' byash dey shab mi, nunu orze' tap nac ñii bicy dey nu dugyi tub gay. Orze' gush dey negy duñ nu ca yeñ mi. Nde' tub negy nu tub zily la zuñ gal yeñ mi nu gal yeñ gyi' lam ornu bdugab ñi. Sac la ze' nu bdugyib niñ.
45002021	Sin	Rlyuur ni mbecy, tees ¿lagu ni ub ru waglyuur? Rshaal ru lo mbecy nu cue' gyicy yu gubaan tees ub ru ricy ru gubaan.
46006019	Faith	¿Walab gaal wagad lagy der nu cuerp ni der, nde' yu' wedz ni Espiriit Yon nu briic Ñgyoozh ni der, nunu Espiriit Yon nim rcyiiñ mi nañ cuerp ni der? Gun cuerp ni der, nde' walab coz par ub zi'l der, sinu cuerp ze', nde' coz ni Ñgyoozh.
47005014	Grace	Orze' la zi'l coz nu ricy de̱, nde' nu nac nu Crisht rcam de̱ ya̱. Gun na bi gud lagy de̱ nu tub zi Crisht gut mi lugaar ni dela mbecy. Orze' nde' nañ gal nu na nu gut dela mbecy.
58003001	Faith	Nde' nu der bicy na, de ru mbecy nu bi bzu chu Ñgyoozh nu gac nim, gush der shcab nu nac Jesucrisht. Mi ze' biñ nu bzuu nez Ñgyoozh, nunu mi ze' uz nu rzu' lom por cuen ni de ub na dub gal mod nu rnii de riidz nu ricy cup den consuel lo.
44020035	Recommendation	Dub laa tiem rlyu̱u̱ ni der nu ni mod rlagy ñi gyicy den riiñ, nunu locyuub den de mbecy nu ricy falt la coz ni. Byeza' lagy der de riidz ni Shuaan den Jesuuz ornu nam: “Gacyit zir lagy mbecy ornu cuic yu coz ni losa'y gaze' ornu gash yu coz nu cuic losa'y niy”, nam ―na Baly.
58013004	Recommendation	Dela mbecy rlagy ñi nu ca lagy yu lo compromis nu ricy yu ornu rchelaay. Nunu rlagy ñi gyicy paa de mbecy nu rchelaa ze' nu losa'y, gun Ñgyoozh cuic mi cashtig ni de mbecy nu ral losa' nu wanchelaa.
43020005	Description	Orze' bzaab tiilya̱ nu bgüi̱i̱ nañ gyerbaa ze'. Ze' bzaaca̱ se sab zi'l nim nguaañ. Tees wanchu̱' nañ gyerbaa ze'.
66016018	Description	Gaze' nu bzu gyi ni guzii. Nunu guc zu redz. Nunu mnii guzii. Nunu briib duru. Nunu nese nu psa' lagy Ñgyoozh mbecy nigul griib duru ily gal nu briib ñi na. Tona' la coz ily bicy ñi.
66019010	Faith	Orze' ya̱ bzu tiba̱ yeñ gyi' anc ze' nu riib zilya̱ yu. Orze' yu ze' nay: ―Cue' ni gyicy ru lo̱. Gun ya̱ naca̱ losa'r nu nac ru moz ni Ñgyoozh nu de' zir de losa'r, de yu nu ricy paa nu de riidz nu mnii Jesuuz, sinu briib zily Ñgyoozh ―na anc ze' rab yu ya̱. Gun de riidz nu mnii Jesuuz, laab nde' riidz nu briic Espiriit Yon ni de mbecy nu mnii por cuen ni Ñgyoozh.
46002010	Grace	De coz ze' Ñgyoozh bicy mi nu rad lagy de ub na nu nac Espiriit Yon nim. Espiriit Yon nim gyet lag mi cuen dela coz, mas de coz biigy ni Ñgyoozh.
50002029	Recommendation	Gyet lagy der nunu nap gyicy nu der yu ornu griy, gal nu yad ñi nu gyicy nu der de bicy ru nu ricy cup consuel lo Shuaan den Jesucrisht. Pca lagy der lo cyu zi'l mbecy nu na gal nu na yu ii,
51003020	Recommendation	De ru mbecy feñ, bzuub gyidag der de coz nu rnii de uz ru, gun de coz ze' gyet lagy Shuaan den Jesuuz.
47001012	Faith	Yu' tub coz nu ricy ñi nu tona' la yet lagy de̱. Coz ze', nde' nu rad lagy de̱ nañ lardo̱o̱ nu nap bicy du̱ de̱ de ru gal nu dela de' zir mbecy. Bicy du̱ de̱ der nu gyel cacy. Nunu naal la rabee coz nu bicy du̱ de ru. Walab nu bicy du̱ de ru tub mod nu bruu nañ shcab ni uba̱, sinu bicy de̱ tub mod nu bruu lo Ñgyoozh. Gun Ñgyoozh bicy mi faboor nu blocyuub mi de̱ nu ni bicya̱.
43014021	Faith	Cyu zi'l mbecy nu “O” nii ni de riidz nu ya̱ rne̱e̱, nunu gyicy yac yu niñ, yu ze' yu nu rca ya̱. Nunu cyu zi'l mbecy nu rca ya̱, Ñgyoozh uza̱ rca ga'm yu. Nunu ni' ya̱ rca̱ yu. Nunu gyicya̱ nu gad lagy yu nu nac du̱ yu.
51002023	Sin	Rishli de mbecy nu bloo ic de leey mi' ze', rlyu nu siñ too dey, tees walab rishli. De leey ze' ricy ñi tub mod nu dzi ta par nu gyicy de mbecy par lo Ñgyoozh. Rniiñ nu gyicy gyidz mbecy ub yu. Rniiñ nu dzi ta gyicy nuy cuerp niy. Mas ni rnii de leey mi' ze', tees rila wacyiiñ ñi nu soow ñi lo de cyi nu yu' nañ lardoo den.
64001006	Recommendation	De yu ze', ornu biid dey lat de mbecy ni Crisht nu yu' par ii, orze' mnii dey lat dela de yu ze' nu dzi nap bicy ru nur dey nu nac nu rcar dey. Orze' por faboor locyuub ñuur dey ni de coz nu cyiiñ par byaj ni dey dub gal mod nu gyedzu' lagy Ñgyoozh.
55002023	Recommendation	Cue' gyicy cuen ru de riidz ton nu se la la cyiiñ nu ro mbecy. Nunu ru rad lagy ru nu de riidz ze' ricy ñi nu ro zi dey riidz nu losa'y.
47003018	Faith	Nde' nu dela den saca' negy nu rsoow lon. Na den gal nu na tub guan nu rlyuu gyel lily ni Shuaan na Jesucrisht. Nunu gac den gal nu na ub mi. Orze' tub dzi ga rabee zir gyel lily nim loon. De nde' coz nu ricy Shuaan den Jesucrisht, biñ nu nac Espiriit ni Ñgyoozh.
58009014	Grace	Benu ni, orze' ¡dzi zir coz ily ricy reñ Crisht! Gun nu nac Espiriit nu zu tub la, orze' Crisht briic mi ub mi par tub gun nu rila sac falt ni. Nunu nu nac reñ mi, orze' gyicy mi nu wat den lo Ñgyoozh nu nac de coz to' lo nu bicy den, de coz nu gyicy nu yad ñi nu gat den, gun orze' gyicy den coz nu rlagy Ñgyoozh mbañ.
44011017	Grace	Orze' benu Ñgyoozh rbic mi ni de mbecy nu walab mbecy Israeel laaba' coz nu briic mi ni de ub na ornu bicy cup na consuel lo Shuaan den, orze' ¿cyu guc ya̱ nu ca̱ ni Ñgyoozh nu cue' ni gyicy mi? ―na Bed.
49004030	Faith	Cue' gyicy der nu gyicy shni Espiriit Yon ni Ñgyoozh. Gun nu nac nu ricy cup der Espiriit Yon ze' gabe nu nac der mbecy ni Ñgyoozh gashtal ornu shuub dzi nu wagyuba' ic cyi der.
66003003	Recommendation	Orze' bicy der nu gyeza' lagy ru de riidz nu bi güeñ ru, de riidz nu bi pshet ic der ni. Bzuub gyidag der ñii, nunu mne' der de cyi nu ricy ru. Ze' benu wayish der yaa, orze' ya̱ yapa̱ lo der gal nu ryiid tub gubaan. Tiem nu a̱' sa' la lagy der, orze' gru'ña̱ lor.
62003007	Recommendation	De ru, yu feñ ne̱, cue' zaan ru nu guu ni tub la mbecy der, gun de mbecy nu zaab ricy la de coz nu se'ñ, de yu ze' nac dey mbecy nap gal nu mi ze' nac mi biñ nu dzi nap.
62004001	Recommendation	De ru bicy na nu dzi rca̱, cue' cheña lagy der ni de mbecy ornu ricy dey nu rniiy por cuen ni Ñgyoozh, sinu bicy der preb dey ben a laab Espiriit Yon ni Ñgyoozh rcyiiñ mi nañ lardoo dey, uti walab. Gun gyishlombecy ii bzu laa mbecy rguu nu ricy nu rnii por cuen ni Ñgyoozh.
44013038	Grace	Orze' na der bicy na, ya̱ rne̱e̱ lo der coz nu rlagy ñi nu gad lagy der nu Ñgyoozh gyicy sulagy mi ni mbecy nu nac Jesuuz.
50003001	Recommendation	Nde' nu de ru bicy na, bet lagy der nu nac nur Jesucrisht. Ya̱ wagazeeda̱ ne̱e̱ lo der tuuba' tir laaba' de coz nu bi mne̱e̱, nunu de coz nu mne̱e̱ locyuub ñi der nu cue' gyicy dza mbecy der.
46011034	Recommendation	Benu yu' mbecy ran yu, rlagy ñi gow laay gyit yu'y anzir nu gyatublaazh der, gun orze' wabic Ñgyoozh cashtig niy par nu nac mod nu yatublaazh der. Ze' de' zir asunt, ya̱ ne̱e̱ lac mod gyicy der ornu yapa̱.
43018031	Description	Orze' na Pilato rab yu dey: ―Laab de ru yaa nu der yu nu gri bee der niy gal nu rniiñ lo leey ni der ―nay. Orze' na ga' dey: ―Tees par lo leey a̱' ricy cup de̱ rishbeey nu gyicy de̱ nu gat ni tub la mbecy ―na dey.
46012031	Faith	Bicy der nu gad tub riiñ nu ricy ñi presis nu gac der. Tees mod nu nap zir par dela de' zir ñi, nde' riidz nu ne̱e̱ lo der na.
58007026	Description	Orze' Jesuuz, mi ze' zum riiñ lo Ñgyoozh dub gal mod nu galagy ñi ni den. Nac mi biñ Yon. Sac la falt nim. Ni sac cyim. Mi ze' tub biñ nu a̱' nac nu de mbecy shiñ ricy. Gya zir zum gaze' de' zir mbecy gyibaa.
50004013	Faith	Ya̱ gac gagye̱ la zi'l coz nu cyid nu nac Crisht nu rbic mi fers ne̱.
52004003	Recommendation	Ñgyoozh rlagy mi nu chesa der mod ni mbecy nu sac falt ni. Nunu rlagy mi nu cue' gal ni tub la der mbecy nu wanchelaar.
51004002	Recommendation	Nunu zaab mnii nu laa der Ñgyoozh. Zaab zu laa der altant nu cuic ru gras nim lat nu rnii nu der mi.
44007029	Description	’Na ornu güeñ Moisees nde' na, orze' bruu chuy Egipto. Orze' gua yat yu. Guay pcyiiñ yu lo de yu nu la Madián. Ze' pchelaay. Orze' gul cyup i'ñ gyeey yu.
46011007	Description	De yu gyeey walagy ñi nu soow dey tooy, gun gal nu na Ñgyoozh, ni na dey, nunu yu gyeey, yu ze' rlyu nu gyel lily ni Ñgyoozh. Ze' biñ mñaa, mi ze' rlyu nu gyel lily ni yu gyeey.
51003015	Faith	Crisht gyicy mi nu cheti ri añ ni der nu nac nu nde'. Orze' gad lagy der ca na de coz nu laab ñi. Ñgyoozh pcuim de ru par nu gac der se tub zi'l cuerp, gun orze' gad nu cheti ri añ ni der. Nunu guc der mbecy nu ricy graseer.
58002010	Grace	Ñgyoozh tona' la zily nac mi. Dela coz yu'ñ nu nac mi. Nunu bicy mi nu ni mod zuñ. Orze' Ñgyoozh rlagy mi nu dela i'ñ mi gzac dey lo gyel lily nim. Nde' nu na bi bza' lom riiñ nu biid Jesuuz, biñ nu rboo mbañ de mbecy nu nac nu bzac zim.
59004001	Sin	¿Ca druu de gyel yuu, gal nu de gyel deet nu yu' lat der? Druuñ lat de coz a̱' nap nu ricy gyel yuu nañ lardoo der.
46005001	Sin	Ya̱ güeña̱ nu lat de ru, zu tub mbecy nu gush yu ñaa naan yu. Yu ze' tona' la cyi ily bicy yu. Mas de mbecy nu a̱' yu' lo Ñgyoozh wagyicy yu cyi ze'.
46010013	Faith	Dela de coz deet nu rzac den, nde' coz nu rzac de' zir de mbecy. Tees Ñgyoozh ricy paam nu de ub na. Orze' mi ze' wazaan mi nu gzac zi den ni de coz gashtal wagagyee ga' la den de coz ily nu yad, sinu tiem nu gzac deet den, orze' Ñgyoozh locyuub mi de ub na nu gad tub mod nu gyicy den gan.
44020029	Violence	Ya̱ rad lagya̱ nu despuees ornu ru̱u̱ lat der, cyid mbecy a̱' nap. Gyicy yu nu laa yaa de mbecy ni Crisht de coz rishli. Na dey gal na lob dañ nu nit lo ma shily.
53001004	Faith	Nde' nu de̱ ya̱ ryabica̱ gyel mbecy ni der ornu rdo̱ riidz nu de mbecy ni Crisht nu yu' gal reña' lugaar. Ryabic de̱ gyel mbecy ni der nu nac nu rzu fert der, nunu nu nac nu ricy cup der consuel lo Crisht lat nu rshet zi mbecy de ru nunu lat nu rzac deet der.
62004012	Faith	Gun ni tub la mbecy nigul zac yu Ñgyoozh. Tees benu ca tub ca tub zi'l den losa'n, orze' Ñgyoozh nac num de ub na, nunu rabee de coz nu ricy mi nañ lardoo den nu nac nu rcam de ub na.
48001001	Description	Ya̱ Baly tub aposht, tub yu nu rded riiñ ni Jesucrisht. Riiñ nu bdugyi̱, nde' walab coz nu bruu lo de mbecy, nunu walab riiñ nu briib mbecy ica̱, sinu Jesucrisht nu Ñgyoozh, uz na, briib mi ñii ica̱. Nunu Ñgyoozh, uz den bicy mi nu byabañ Jesucrisht.
58012003	Recommendation	Orze' gush der shcab nu nac de coz nu bzac mi. Tona' la guzi lagy de mbecy cyi lom, tees gugyeem. Orze' nde' nu gush der shcab nu nac mi, gun orze' cue' nu gatsiñ der, nunu cue' shi'ñ der baloor.
45006005	Faith	Gun benu na den gal na tub mbecy gut nu nac nu gut mi, orze' ni' zi'l na den gal na tub mbecy nu byabañ nu nac nu byabañ mi.
45015010	Recommendation	Tub naca' riidz ni Ñgyoozh rniiñ: De ru mbecy nu walab mbecy Israeel, gucyit lagy der nu de mbecy ni Ñgyoozh,  rniiñ.
54004001	Sin	Tees Espiriit Yon ni Ñgyoozh naal la rniim nu ornu bi yad shuub dzi ni gyishlombecy, yu' mbecy nu wayicy cupa' dey consuel lo riidz nu ricy cup de ub na consuel lo na, sinu gzuub gyidag dey ni de riidz nu gruu lo de nuras nu rguu mbecy, nunu gzuub gyidaga' dey ni de riidz fals nu rlyuu de nuras.
56003001	Recommendation	Bicy nu gyeza' lagy de mbecy ni Crisht nu “O” nii dey ni de gubier gal nu ni de fushtiz. Rlagy ñi nu gac dey mbecy nu rzuub gyidag. Nunu zaab zu la dey altant nu gyicy yu coz nap.
61003005	Sin	Orze' de mbecy ze' ricy go̱' la dey ub yu nu walagy yu gad lagy yu nu tona' la gulas psa' lagy Ñgyoozh baa nu nac riidz nim. Nunu lugaar ze' nu yu' nis, laab ze' psa' lagy mi yu wach. Nunu nu nis psa' lagy mi ñii.
60003018	Grace	Gun Crisht gut mi tub tir zi'l par tub la nu nac dela cyi den. Mi ze' sac cyim. Tees gut mi par de ub na, mbecy nu yu' cyi, gun orze' guud mod nu gya num de ub na lo Ñgyoozh. Mbecy bicy dey nu gut mi, tees Espiriit nim bicy mi nu byabañ mi.
61002021	Sin	Na ornu bi gud lagy dey lac mod gyanap dey lo Ñgyoozh, ze' benu laa yaa dey de riidz nim nu mnii mbecy lo dey, orze' nap zir benu cue' la ñgyad lagy dey.
53003006	Recommendation	Der bicy na, ya̱ rne̱e̱ lo der nu nac rishbeey ni Shuaan den Jesucrisht nu gruu chu der lo ca zi'l na bicy na nu walagy gyicy riiñ, gal nu lo de yu nu wagyicy gal nu rnii de riidz nu blyu̱u̱ de̱ ni der.
45005012	Sin	Ornu tub mbecy nu la Adaang bicy yu cyi, orze' gu' cyi gyishlombecy. Nunu nu nac cyi ze' brugyi' nu rat mbecy. Nde' nu dela mbecy rat dey, gun dela dey bicy yu cyi.
58011033	Faith	Tees nu nac nu bicy cup dey consuel lo Ñgyoozh, gu' dey gyel yuu, nunu bicy dey gan bee nasyoong la. Bicy dey gyel fushtiz gal nu rlagy ñi. Ñgyoozh briic mi de coz nu mniim nu segur la cuic mi ni dey. Psoow dey ru' biidz.
47004009	Faith	Yu' tiem nu rzab mbecy ich de̱, tees Ñgyoozh wacsaan yaam de̱. Yu' nu shiñ ricy nu mbecy de̱, tees wagnit lo̱ de̱.
59004004	Sin	¡A̱ mbecy wagyicy paa! ¿A wagad lagy der nu benu yet lagy ru de coz a̱' nap nu ricy mbecy ni gyishlombecy, orze' yac losa' yuu der Ñgyoozh? Cyu zi'l mbecy nu rlagy gac amig ni de coz ni gyishlombecy, yac losa' yuuy Ñgyoozh.
44016006	Description	Espiriit Yon ni Ñgyoozh wansaan mi nu shaal dey riidz ni Crisht lo de mbecy Asia, nde' nu bded dey dub tuuñ la ze' nu ñgyiid ru' yu ni Frigia nu Galacia.
45010006	Faith	Tees i mod za riidz nu rnii lac mod gyanap den lom nu nac nu gyicy cup den consuel: “Cue' nii toor, ¿cyu chup gyibaa?” rniiñ. Gun walagy ñi gyicy mbecy nu gyet Crisht.
66016002	Violence	Gaze' nu anc loga la gua shuy nis nu yu' nañ taz niy. Orze' briib gyedz shiñ na cuerp ni de mbecy nu ca beey ni bañ dañ ze', de yu nu briib zily nab ma. Orze' tona' la rac cuerp ni dey.
66005008	Description	Na laab bdu' yaa lam gyicy ze', orze' de tap mbecy mbañ nu zu ze', nu de gal zu tap yu bel ze', dela dey gusu tib yu lo biñ nu nac Shily ze'. Orze' lo dela dey tub ga lay nuuy tub ga been nu la arpa. Nunu ni' dela dey nuuy tub ga bas or nu yu' yaal nañ. Orze' yaal ze', nde' yaruuñ ornu rnii nu de mbecy Ñgyoozh, de yu nu bi nac nim.
62005001	Faith	Dela mbecy nu zeña lagy nu Jesuuz nac mi Mesías, biñ nu ca lo cuen nu cyid, de yu ze' nac yu i'ñ Ñgyoozh. Nunu de yu nu rca Ñgyoozh Uz den, orze' ni' zi'l rca ga' dey de yu nu nac i'ñ mi.
48005026	Recommendation	Walagy ñi nu gac den mbecy le'. Ni walagy ñi nu caa yuu den losa'n. Ni walagy ñi nu gazaap lagy den nu nac losa'n.
54005001	Recommendation	Cue' gab zir de mbecy gush, sinu benu gyicy dey coz nu walab se'ñ, orze' pshuu nu dey gal nu rshuu nur uz ru. Ze' de yu feñ, benu gyicy dey coz nu walab se'ñ, orze' pshuu nu dey gal nu rshuu nur tub bicy ru.
60002012	Recommendation	Nap bicy der lat de mbecy nu a̱' yu' lo Ñgyoozh, gun orze' mas griib dey cyi fals too der nu nii dey nu nac der mbecy shiñ ricy, tees ornu gad lagy dey de coz nap nu ricy der. Orze' gyabic dey gyel mbecy nim ornu cyid mi tuuba' tir.
50003006	Sin	Ya̱ tona' la bzu ferta̱ nu de mod nu rzeña lagy de mbecy Israeel, gashtal psheed zi̱ de mbecy nu ricy cup consuel lo Jesucrisht. Ya̱ tona' la se'ñ bicya̱ nu leey ni de mbecy Israeel, nunu warusu ni tub la mbecy nu riib yu cyi ica̱. Nde' nu ricy cup zira̱ raso̱o̱ nu gyicy cupa̱ consuel lo uba̱, bi bicy na nu ni ñgyicya̱.
43004052	Description	Orze' bdugyi'y lo dey ben la or brugyi' nu zesu nap lagy i'ñ yu. Orze' na dey rab yuy: ―Naag, tub gyiib tub or gudze, orze' bruu zig yu ―na dey.
43019031	Violence	Nde' tub dzi anzir ni sa' ni Pas. Ze' de mbecy zub lo ni de mbecy Israeel walagy dey ca añ lo cruuz dzi sab, dzi nu rzu lagy mbecy, gun dzi ze', nde' tub dzi da. Orze' gua nishbaa dey lo Pilato nu gyicy yu mandaar lo soldad nu cha dey cyicy yu gyi' de yu nu ta' lo cruuz ze' par nu gyel gyet de añ ze' lo cruuz.
43019012	Description	Nese or la ze' Pilato byub yu tub mod nu laay Jesuuz. Tees de mbecy zigy ze' brish ti nu zir dey yu. Orze' na dey: ―¡Ze' benu yu ze' glaar yu, orze' ru a̱' nac nur César, yu nu riib ic de nasyoong! ¡Gun cyu zi'l mbecy nu ricy yu nu nac yu rey, yu ze' zay contr ni César! ―na dey.
43014001	Faith	Orze' na ga'm rab mi dey: ―Cue' zaan der nu gac deet nañ lardoor. Bicy cup der consuel lo Ñgyoozh, nunu ni' zi'l bicy cup der consuel lo̱ ya̱.
50001028	Faith	Nunu rlagya̱ gyeña̱ nu wacchib der lo de mbecy nu rzi lagy lo der, gun nde' gyicy ñi nu gabe nu de mbecy nu rzi lagy ze' nit lo dey. Nunu laab nde' ricy ñi nu gabe nu de ru gruu mbañ der. Nunu nde' coz nu gyicy Ñgyoozh.
43015016	Grace	De ru walab nu pcui der ya̱, sinu ya̱ pcui̱ de ru nunu bdu̱' riiñ yaa der nu gyicy der gan zañ de coz nu rlagy Ñgyoozh, coz nu wanit lo. Orze' Ñgyoozh, uza̱, cuic mi dela coz nu cyiñ der lom nu nac ya̱.
58011004	Faith	Na Abeel, nu nac nu bicy cup yu consuel lom, briic yu tub gun nim nu nap zir gaze' gun nu briic Caiing. Nunu nu nac nde', Ñgyoozh bicy mi yu par tub mbecy nu sac falt ni. Nunu gush mi gun ze' niy. Nunu nu nac nu bicy cup yu consuel lom, gabee rlyuuy ni den mas bi gut yu.
46004001	Recommendation	De ru rlagy ñi nu gyicy der de̱ ya̱ par mbecy nu ricy de coz nu rlagy Crisht. Rlagy ñi nu gyicy der de̱ ya̱ par mbecy nu bdugyi riiñ nu shaal de̱ de riidz nu gal na rbic Ñgyoozh nu gad lagy de mbecy.
66006013	Description	Ze' de bel baa bet lag ma lo yu gal nu yet lag de urlas ca' ornu fert druu tub bi ily.
46010014	Recommendation	Orze' der bicya̱ nu dzi rca̱, rila cue' griib zily der nab.
45012021	Recommendation	Cue' zaan der nu gyicy coz a̱' nap gan der, sinu bicy der coz nap. Orze' gyicy der gan, cue' gyicy der coz a̱' nap.
55002014	Recommendation	Bicy nu gyeza' lagy mbecy de riidz ze'. Nunu bdu' riiñ yaa dey nu cue' tub su dey losa'y nu nac reñ ga la riidz nu rnii tub ga dey. Orze' nde' gyicy cuidad dey ñi par lo Ñgyoozh. Gun benu nid ru' dey lo losa'y, nde' se la la cyiiñ ñi. Tub zi la coz nu gyicy nu rnid ru' dey, nde' par nu gnu zi'l dey de mbecy nu rzuub gyidag.
59004008	Recommendation	Becha' der lo Ñgyoozh. Orze' Ñgyoozh gyecha' ga'm lo der. Gal nu ricy der ornu rgyiib ru yaar, ni bdiib der de coz cyi nu ricy ru, de ru mbecy cyi. ¡Bicy der nu gyacaacy lardoor, de ru mbecy nu ricy cyup ic!
59002009	Sin	Tees benu reñ ga la mod gyicy nu der mbecy dub gal nu nay, orze' ricy der cyi, nunu yu' falt ni der par lo leey ni Ñgyoozh.
52004007	Grace	Gun Ñgyoozh wansum de ub na nu gac naa mbecy nu ral losa' nu wanchelaa, sinu bzum de ub na nu gac naa mbecy cacy.
45001018	Sin	Rabee nu gal gyibaa gruu cashtig nu gzeed Ñgyoozh lat de mbecy nu ricy coz cyi, nunu lat de mbecy nu ricy coz a̱' nap nu losa', gun tona' la rzi lagy mi lo dey. De mbecy a̱' nap ze' ricy dey nu wagac gad lagy de mbecy de coz rishli nim nu nac de coz a̱' nap nu ricy dey.
62004007	Faith	De ru bicy na nu dzi rca̱, rlagy ñi nu ca tub ca tub zi'l den losa'n. Gun nu caan losa'n, nde' coz nu bruu lo Ñgyoozh. Dela mbecy nu rca losa' nac yu i'ñ Ñgyoozh, nunu bi yu' loy mi.
62002009	Sin	Benu tub mbecy rniiy nu rded yu ze' nu yu' yaa nu rbic Crisht, ze' gabee rzi lagy yu lo bicy yu, orze' yu ze' gabee rded yu ze' nu cow.
60004014	Grace	Dzi ni der benu tub mbecy gab ziy der par nu nac Crisht. Gun orze' Espiriit Yon ni Ñgyoozh, biñ nu dzi lily na, zaab rded nu laam de ru.
44021019	Grace	Orze' Baly mniiy ñgyoozh nuy dey, nunu pshaal yu lo dey dela coz nu ricy Ñgyoozh num de mbecy nu walab mbecy Israeel par nu nac riiñ nu ricy yu.
43008046	Sin	¿Ca na de ru gac gyicy ru nu gabe ca na cyi nu bicya̱? Ze' benu ya̱ rne̱e̱ coz rishli, orze' ¿lagu wacheña lagy der de coz nu rne̱e̱?
58010017	Grace	Orze' gaze' nu nam: Orze' wayeza' ga' lagya̱ de cyi dey. Wayeza' ga' lagya̱ nu shiñ bicy dey,  nam.
46001005	Grace	Par nu nac nu nac nu der Crisht, Ñgyoozh tona' la nap bicy num der. Nde' nu nap za de riidz nu rnii der, nunu nap yet lag der cuen de coz rishli.
45015030	Recommendation	Der bicy na, ya̱ rnishba̱a̱ lo der nu nac Shuaan den Jesucrisht, nunu rnishba̱a̱ lo der nu nac Espiriit Yon ni Ñgyoozh biñ nu rlocyuub den nu caan losa'n. Rnishba̱a̱ lo der nu co lo der tublaazh nu ya̱ ornu cyiñ der lo Ñgyoozh ne̱.
43007020	Violence	Orze' na la be de mbecy zigy ze' rab yum: ―¡Ru bicy ni nuras ru! ¿Ze' cyu nu rlagy cut ru ze' beni? ―na dey.
